Ⅰ．景気の現状に対する判断理由等,,,,,
,,▲,タクシー（経営者）,お客様の様子,・不景気のためか昼も夜も人の動きが悪く、前年同月と比べて12％の減少である。
,,▲,通信会社（営業担当）,お客様の様子,・近隣でも、特に製造業の業績が落ち込んでいるようである。来月閉鎖を予定している下請会社や、大幅に社員を削った会社などが目立ち始めている。
,,▲,遊園地（職員）,来客数の動き,・上旬から中旬にかけての集客減が響き、お盆中盤より回復基調にはあるものの、前年実績を下回る見込みである。
,,▲,ゴルフ練習場（経営者）,来客数の動き,・暑い日が続いているため、客が街中を歩かない。
,,▲,ゴルフ場（支配人）,来客数の動き,・年配の来場客が多かった平日に猛暑が続き、減少傾向である。体調管理のためソフトドリンクはよく売れるが、オリジナルドリンクの持ち込みも多い。
,,▲,ゴルフ場（業務担当）,来客数の動き,・極端にプレー料金、単価が影響している。
,,▲,美容室（経営者）,来客数の動き,・来客数については、いつもはお盆前が忙しいが、今年はお盆後が忙しくなった状態である。売上は前年よりあまり良くない。全体的には電気の節約に倣って美容も節約する人が増えてきた。つくづく景気が悪く感じられると客も言っている。
,,▲,美容室（経営者）,来客数の動き,・暑い日中に客は来店せず、売上が悪い日が続き、今月は前年比７％減である。
,,▲,その他サービス［立体駐車場］（従業員）,お客様の様子,・周辺に同じ規模の駐車場が３か所ほどあり、400台ほど駐車できる。商業施設に付帯している所もあるが金額を下げており、安い単価の所から順に埋まってくる状況が顕著になってきている。そのため、来客数や単価が下がってきており、全体的にやや悪くなっている。
,,▲,設計事務所（所長）,販売量の動き,・今月は夏休みとあまりの暑さからか、仕事の情報が皆無で困っている。
,,×,一般小売店［衣料］（経営者）,販売量の動き,・学校関係の店であるため、夏休み中は結構少なかったが、学校が８月27日から始まり、多少増えてきたようである。当市内の観光客の様子は、良くなっているという状況は１つも出てきていない。
,,×,スーパー（経営者）,お客様の様子,・業界全体で購買意欲がかなり低下してきている。
,,×,スナック（経営者）,競争相手の様子,・長く当調査に協力しているが、本当に毎回同じ答えになる。全ての選択肢を選びたいが、とにかく競争相手がすごく、消費者が少ないような状況である。
,,×,通信会社（経営者）,販売量の動き,・一般ユーザーからの引き合いは一切ない。行政外郭団体からの見積要請はあるが、どれも今年度後期の事業につき、直接の売上には至っていない。
,,×,その他レジャー施設［アミューズメント］（職員）,来客数の動き,・インターネットカフェ、ゲーム機コーナー、レンタル関係、全てで客数、単価共に落ちている。特に自分の番号、成績等を取得できるインターネットゲームのようなものの得意客はそれほど減っていないが、今日はゲーム、今日はネットカフェ、というようなフリーの客数が極端に減っている。夏休み、８月中の売上としてはかなり良くない数字が出ている。
"企業
動向
関連

(北関東)",,◎,その他製造業［環境機器］（経営者）,受注量や販売量の動き,・原子力発電反対がますます増えるなか、当社の10月決算に間に合うよう、太陽光発電の申請と設備の準備をしている。
,,○,化学工業（経営者）,受注量や販売量の動き,・東日本大震災の復興需要が大きく影響し、メイン商品の生産、販売が好調に推移し始めている。
,,○,金融業（経営企画担当）,受注価格や販売価格の動き,・ホテルや飲食、小売業が好調なことに加え、製造業も自動車関連を中心に受注が増えている。
,,□,食料品製造業（営業統括）,受注量や販売量の動き,・前月に引き続き、35度以上の猛暑が続いた影響で、ワインの消費は伸び悩んでいる。
,,□,窯業・土石製品製造業（総務担当）,受注量や販売量の動き,・生産調整のため、お盆休みと称して連続８日間休みで、今月の稼働日数は18日間となっている。
,,□,金属製品製造業（経営者）,取引先の様子,・産業機械のコンプレッサー、特装車両のコンクリートミキサー車共に順調な生産が続いている。１日当たりの生産が最大であるため、稼働日数が変わらなければ生産量も変わらない。
,,□,一般機械器具製造業（経営者）,受注量や販売量の動き,・自動車関連の一部は夏休み返上でフル生産が続いたが、油圧機器、建設機械分野の仕事は動きが出ず、停滞感がある。業種によってばらつきが大きく、全体的に大きな変化はない。
,,□,電気機械器具製造業（経営者）,受注量や販売量の動き,・大手と結び付いた企業は比較的安定して順調だが、そうではない企業は細かい仕事を集めて何とか確保している。全体的に当社の周りの製造業は比較的安定している。
,,□,電気機械器具製造業（経営者）,受注量や販売量の動き,・東日本大震災関連の受注が一段落している。今年度、新機種関係の進捗が遅れ、受注の上乗せにつながっていない。
,,□,輸送用機械器具製造業（経営者）,取引先の様子,・８月は長期の夏休みが多いため若干落ちるが、５～７月はまずまずで、変わらない状況である。
,,□,輸送業（営業担当）,取引先の様子,・取引先によると、オリンピック等による寝不足から栄養ドリンク、残暑による飲料水等の荷動きが例年より多少多く、良い状態である。また、保冷剤やクーラーボックス等の物量も荷動きが多少多かった。しかし、節約家電の代表である扇風機等は前年のような伸びもなく、全体的には例年並みの物量、輸送量である。
,,□,金融業（調査担当）,取引先の様子,・企業の景況感は二極化しており、海外需要を取り込み好調な企業と内需中心の企業との格差が拡大している。中小企業では厳しい受注環境が続いており、全体では足踏み状態が続いている。
,,□,その他サービス業［情報サービス］（経営者）,受注量や販売量の動き,・特段の変化は見られない。
,,▲,電気機械器具製造業（経営者）,受注量や販売量の動き,・ニッパチは良くないと言われるように、売上がかなり減少している。９月は落ちたところの横ばいで、景気が何となく下がってきている。数字的にはまだ目に見えないが、感覚的には少し厳しい。
,,▲,その他製造業［宝石・貴金属］（経営者）,受注量や販売量の動き,・７、８月と売上は伸び悩み、低価格品の動きにも陰りが見られる。９月から秋冬用ジュエリーの展示会シーズンが始まるが、暑さの影響で仕入意欲が減退している。
,,▲,不動産業（経営者）,競争相手の様子,・当社と同様に、設備投資が難しく古い機材を使い続けている様子が見られる。赤字の所も切れず、黒字の所から補填して維持している現場も多いとの話も耳にしている。
,,▲,不動産業（管理担当）,受注価格や販売価格の動き,・オーナーからの維持管理にかかる費用は変わらないが、追加で一緒にやって欲しいという作業を言われることが多くなっている。それは飲まざるを得ないため、実質的に作業内容は増えても売上が横ばいということが増えている。
,,▲,広告代理店（営業担当）,取引先の様子,・地元企業の折込広告、宣伝が減っている。
,,▲,新聞販売店［広告］（総務担当）,取引先の様子,・今月のチラシ出稿量は前年比96.5％と、６月以降３か月連続で前年の東日本大震災以降の復活し始めた時期を下回っている。枚数の削減やサイズの縮小等が顕著となってきており、前々年比でも前月に続き下回っている。
,,▲,経営コンサルタント,取引先の様子,・観光・宿泊関連、食品関係を主とする消費財関連、建設業、下請製造業、広告関連としての印刷業等、いずれも業績が振るわない。
,,▲,社会保険労務士,取引先の様子,・天候が良い日が多かったが、夏祭りや各種イベントなどでは思ったより客数が戻っていない所が多い。
,,×,食料品製造業（製造担当）,取引先の様子,・前月から来月にかけて、スーパー等５店舗が閉店する。本当に体力勝負で、安売りしている所はやはり財務内容が良くない。単価を上げると客に買ってもらえないという恐怖心から脱却し、自信を持ってサービスで勝負しなければ、ますます倒産企業が増え、連鎖倒産しかねない。
,,×,窯業・土石製品製造業（経営者）,受注量や販売量の動き,・ごくわずかの受注はあるものの、状況は低迷する一方である。
,,×,輸送用機械器具製造業（総務担当）,受注価格や販売価格の動き,・受注量はそこそこいっているが、販売価格が非常に落ち込んでおり、コスト低減が非常にきつくなってきている。電気料金の値上げに伴いコストが目に見えるように高くなってきているため、収益が大幅に悪化している。
,,×,建設業（総務担当）,それ以外,・公共工事主体で土木、舗装工事を行っている。受注高は前年比99％と同額だったが、２年工期の物件が２件あるため、決算時の売上が心配である。また、前年の東日本大震災の影響で工期が延びた物件もあったため、決算の数字も心配である。
"雇用
関連

(北関東)",,◎,－,－,－
,,○,人材派遣会社（経営者）,求人数の動き,・今月は食料品、食材関係が多く見られ、その内容は販売、営業、加工の募集である。製造関係では自動車部品関係の一部で活発さが募集の中に見られた。依然として介護関係のサービス業務での募集は出てきているが、住宅関連は厳しい。
,,○,人材派遣会社（管理担当）,求人数の動き,・コンビニの冷やし麺類が売れて派遣求人数が増えている。
,,○,職業安定所（職員）,求職者数の動き,・窓口を訪れる求職者の状況を見ると、倒産、人員整理等の事業主都合による離職の減少が主な要因で、離職者数が前年比減少を続けている。
,,□,人材派遣会社（経営者）,雇用形態の様子,・10社ぐらいの客のうち、１社だけが非常に忙しく、あとの会社はほとんど変わらない。
,,□,人材派遣会社（社員）,周辺企業の様子,・東日本大震災後のため前年の状況とは比較にならないが、平成22年と比較すると、ある程度宿泊施設関係が持ち直してきている。しかし、景気が良いというほど持ち直している状況ではないようである。
,,□,職業安定所（職員）,求人数の動き,・前年同月比で有効職者数は減少し、有効求人数は増加しているが鈍化傾向にある。円高等の影響もあり、求職者の希望する製造業の正社員求人はほとんどなく、厳しい状況となっている。
,,□,職業安定所（職員）,求職者数の動き,・求職者は若干の減少傾向であるものの、求人についてはほとんど変化がない。
,,▲,人材派遣会社（営業担当）,求人数の動き,・労働者派遣法の改正で、派遣先の派遣離れが起きている。
,,▲,求人情報誌製作会社（経営者）,周辺企業の様子,・夏季でサービス業のパート、アルバイトの求人は多いものの、特に正社員募集は全業種を見ると少なく、求人は低迷している。
,,▲,学校［専門学校］（副校長）,周辺企業の様子,・採用予定がないのか、高学歴の学生の採用を予定しているのかは分からないが、例年採用予定のある企業でも企業実習等の受け入れもしてもらえない。特に高校生の求職者に厳しい状況である。
,,×,＊,＊,＊
,,,,,
　４．南関東（地域別調査機関：（株）日本経済研究所）,,,,,
,,,,,（－：回答が存在しない、＊：主だった回答等が存在しない）
分野,,景気の現状判断,業種・職種,判断の理由,追加説明及び具体的状況の説明
"家計
動向
関連

(南関東)",,◎,コンビニ（経営者）,来客数の動き,・記録的な暑さが続き、冷たい飲物やその他の商品が売れて、非常に良い状況になっている。
,東京都,◎,観光名所（職員）,来客数の動き,・３か月前のゴールデンウィークの影響と８月を比べても、若干良いような気がする。また、前年と比較すると良くなっている。
,,◎,住宅販売会社（従業員）,販売量の動き,・今月の販売量は目標数字の約115％となり、景気は良いと判断したが、ここ数か月間は低迷していたため、契約のずれ込みもあったと考えられる。総合住宅展示場への来場は少ない状況だが、建築中の建築現場見学会への来場客は非常に増えている。豪華でサイズの大きい展示場よりも、等身大の現場を見たいというニーズが高くなっている。
,,○,コンビニ（経営者）,来客数の動き,・８月は厳しい残暑が長く続いたため、ドリンクやアイス、冷たい調理麺等が前年比120％以上と高く推移している。
,,○,衣料品専門店（経営者）,販売量の動き,・８月は暑さが続き、衣料品としては追い風になり、何とか前年をクリアしている。
,,○,乗用車販売店（営業担当）,来客数の動き,・エコカー補助金がまだ残っているため、もう少し見込みがありそうである。
,東京都,○,その他小売［ゲーム］（開発戦略担当）,販売量の動き,・国内では主に人気のゲーム機が好調で、市場全体で夏期商戦は前年比150％を超えている。
,,○,都市型ホテル（経営者）,来客数の動き,・夏休みの８月ということで、大型テーマパーク関係、各種スポーツ関係、近隣施設でのイベント等で、非常に客の入りは良い状況である。
,東京都,○,タクシー運転手,お客様の様子,・昔から２、８月は商売の景気が良くないと言われているが、今年は悪くない。夏の猛暑、残暑とロンドンオリンピックのおかげで、売上は例年に比べて伸びている。特に週末はターミナル駅などでタクシー待ちの列ができ、チケットやカードの中距離客、１万円前後の利用客が多かった。
,,○,設計事務所（経営者）,それ以外,・現在は耐震診断業務を多くやっている。いろいろな報道の関係で、耐震診断に関する質問等が大変多くなっている。そういった環境のなかで、当社も補強、診断及び設計などが非常に増え、月々の仕事の中でも対応ができないくらいの状況になっている。
,,○,設計事務所（所長）,競争相手の様子,・久しぶりに出た仕事が11月までのため、完納するまでは新規物件を受注することは不可能である。民間は計画すら今のところない。
,,○,住宅販売会社（従業員）,お客様の様子,・８月は稼働日数の関係で契約数は伸びないが、業者の話ではお盆明けから客が動き出しているという情報があり、これから良くなっていく。
,東京都,□,商店街（代表者）,来客数の動き,・最近の天候の様子を見ると、とにかく暑すぎる。35度を超える天候が続いているが、これでは高齢者は外に出る気がしない。少し涼しくならないと、今の状態は良くならないと心配している。
,,□,商店街（代表者）,販売量の動き,・今年は、浴衣の商戦としてはあまり良い状況ではなかったが、振袖の契約が増えたため、前年並みの数字が取れており、何とかしのいでいる状況である。
,,□,商店街（代表者）,来客数の動き,・猛暑が続いているため、ワンストップショッピングという１か所で済む大型店に大分流れているのではないかと思う。商店街の通りも客は午前中のみで、午後からほとんど人通りが少ないため、売上も非常に低迷している。
,,□,一般小売店［祭用品］（経営者）,来客数の動き,・今年は９月に祭事が多いようで、希望を込めてである。
,東京都,□,一般小売店［文房具］（経営者）,販売量の動き,・もし天候が悪い日が入るとその分ダウンしたのではないかと思うが、今月は雨が降らなかったため、来客数が平均していて順調といえる。
,,□,一般小売店［印章］（経営者）,来客数の動き,・今の経済、国の不安定さも要因か、非常に景気が低迷しているため、新しい会社を作る人などが非常に少なくなっている。そのため、当店のような印章業は非常に厳しい状況が続いている。
,,□,一般小売店［靴・履物］（店長）,単価の動き,・相変わらず景気が悪い。以前からそうだが、非常に単価面で客の低価格志向が続いている。一度そういった形で固定してしまうと、なかなかそこから抜けられない。金銭的な面でも変わらないため抜けられないのだろうが、非常に低価格志向が続いている。
,,□,一般小売店［茶］（営業担当）,販売量の動き,・ギフトのまとめ買いは減っているが、中旬までは売上、客数共に前年並みに推移していたものの、下旬に入って日中の来客が特に減り、売上、客数共に減少している。
,,□,百貨店（売場主任）,来客数の動き,・お盆休みまでの前半はオリンピックの影響か、前年に比べて来客数が減少し、95％であった。後半は暑さの影響か来客数が上昇し、夏物セールの売上が向上している。
,,□,百貨店（総務担当）,それ以外,・３月から新しい期がスタートしたが、来客数や販売量、近隣店舗の閉鎖等の当店を取り巻く環境など、全てにおいて低迷している。雨の日が少ない８月は天候要因などで単月ではそこそこではあるが、前年には届かない状況で好転しているとは言いがたい。
,東京都,□,百貨店（営業担当）,来客数の動き,・３か月前と環境等は変わらず、かなり厳しい状況が続いている。百貨店では、クリアランスセールを遅らせたこともあり、客の動きも変わり、全体的には厳しい。
,東京都,□,百貨店（営業担当）,販売量の動き,・６月末から７月にかけてクリアランス実施期間を変更した影響もあり、売上は一時的に落ちていた。今月に入って数字が伸びると期待していたが、連日夏日が続き、購買意欲向上にはつながらなかったようである。商品アイテムでは婦人紳士アパレルが前年比プラスに転じたが、食料品の落ち込みが大きく、店全体では消費環境は変わらない。
,東京都,□,百貨店（営業担当）,お客様の様子,・夏物セールにおいても、しっかりと吟味し、必要最低限の消費しかしない。
,東京都,□,百貨店（営業担当）,来客数の動き,・全体的に来客の減少傾向は変わらないが、お盆の時期は東京への観光客増加の影響からか、来客が前年を上回る結果となっている。
,,□,百貨店（販売管理担当）,お客様の様子,・価格には敏感だが、婦人服を中心とした値下げ商品や食品などの帰省関連商品など、一部商品に活発な動きが見られるようになったものの、商品を１点１点吟味する傾向が更に強まり、まとめ買いや衝動買いの傾向が薄れている。
,,□,百貨店（店長）,来客数の動き,・夏のセールが今年から後ろ倒しになったことや、残暑が厳しいため秋物の動きも悪く、判断が難しい。
,東京都,□,百貨店（営業企画担当）,販売量の動き,・猛暑によって各部門とも堅調に推移しており、前年並みの実績である。
,,□,スーパー（経営者）,販売量の動き,・８月は前半は良くなかったが、お盆の前半は非常に良かった。しかし後半に落ちて、現在もあまり良い状態は続いていない。当社は競合店がすぐ近くにできて、４店舗が影響しているため、それもあまり良くない１つの要因である。
,東京都,□,スーパー（店長）,単価の動き,・客数、点数はほぼ横ばいで推移しているが、単価の上昇が見られない。同業他社共に安売り戦略は頭打ちである。安売りの日のまとめ買いが増えてきており、通常日の客単価との開きがかなり見られ、来店頻度の減少も影響している。
,,□,スーパー（店長）,来客数の動き,・３か月前に比べても客数の伸びは変わらず、客が減った状態がずっと続いている。今後も確実に客数が減ると思う。特に住居関連の中でも家電品、自転車などの耐久消費財、高額品が売れず、将来の見通しに対して客が守りに入り、コモディティ商品のみの来客しかないようである。
,,□,スーパー（総務担当）,お客様の様子,・３か月前と比べて同じように前年比３～５％減と来客数が下回っている状況のなか、競合店との価格競争がある。単価も上がっておらず、１人当たりの買上点数も伸び悩んでいるなか、売上は前年から終わっているような状況が続いている。
,東京都,□,スーパー（営業担当）,単価の動き,・この猛暑のなかで、夏物商材は稼働しているものの、単価が上がらず、その分売上的には伸びてはいない。
,,□,スーパー（仕入担当）,来客数の動き,・８月に入って気温が高くなり、残暑も厳しく、景気も上向きにはならず、顧客の来店頻度が減少していることによって客数が減少している。
,,□,コンビニ（経営者）,販売量の動き,・好天続きの影響で、ドリンク類の売上は大幅に増加したが、たばこの売上減などがあり、売上全体では横ばい傾向である。
,,□,コンビニ（経営者）,来客数の動き,・来客数は前年よりも５％ほど伸びているが、総売上、客単価が少し落ちている。たばこのみが若干落ちている感じであり、この暑いなか客に利用してもらっているため、大変心強い。
,,□,コンビニ（経営者）,単価の動き,・特に変わりはない。
,,□,コンビニ（経営者）,来客数の動き,・暑さが続いているため何となく現状維持が続いているが、これから涼しくなったらその反動が来るかもしれない。
,東京都,□,コンビニ（商品開発担当）,競争相手の様子,・天候の関係で伸び悩んだが、８月に入って回復してきている。
,,□,家電量販店（統括）,来客数の動き,・既存店の客数が上がってくる傾向は見られるが、依然として単価が上がらない。
,,□,乗用車販売店（経営者）,販売量の動き,・整備は順調に入ってきているが、販売はエコカー補助金が終了間近で、前月よりも２、３割減となっている。
,東京都,□,その他専門店［雑貨］（従業員）,販売量の動き,・毎年恒例の夏のバーゲンの販売数量が、今年は大変少なくなっている。
