Ⅰ．景気の現状に対する判断理由等,,,,,
,,▲,美容室（店長）,来客数の動き,・スタッフも客も高齢化が進み、新しい客が増えにくくなっている。
,,▲,美容室（店員）,単価の動き,・今月はパーマやカラーの客がやや少なく、カットが多くなっているので単価が低い。
,,▲,住宅販売会社（経営者）,競争相手の様子,・いわゆる老舗といわれる、バブル崩壊や米国の大型金融機関の破たんも乗り越えてきた業者が、倒産ではなく廃業せざるを得ない状況に陥るケースが多発している。
,,▲,その他住宅投資の動向を把握できる者［不動産仲介］（経営者）,それ以外,・金融機関からの情報では、破産案件が増加しているようである。また、融資姿勢も厳しくなる傾向にある。
,,▲,その他住宅［展示場］（従業員）,来客数の動き,・住宅展示場の来場組数が前年同月比で１割ほど減少している。
,,×,一般小売店［衣服］（経営者）,販売量の動き,・今年は気温の低い日が続き､寒波が次々と来ているが、冬物の防寒具が思いのほか伸びていない。今売れなければいけないのに、なぜ売れないのか分からない。
,,×,一般小売店［珈琲］（経営者）,販売量の動き,・９月以降、直営店の来客数の減少や販売先での売行きの悪化が顕著である。電気料金の値上げ予告により、財布のひもが固くなっている。
,,×,一般小売店［野菜］（店長）,お客様の様子,・相変わらず飲食関係はひどい状態で、こちらの業況も悪い。
,,×,衣料品専門店（経営者）,単価の動き,・平均単価の下落が顕著になってきた。売上に占める値引き商品の比率が上がっている。定価販売を死守すると、大幅な売上の減少を覚悟しなければならない。
,,×,衣料品専門店（販売担当）,お客様の様子,・単価の低下はもちろんのこと、買い控えがどんどん進んでいる。
,,×,家電量販店（企画担当）,販売量の動き,・家電製品にヒット商品がなく、所得の低下から買換え需要しか見込めない。
,,×,一般レストラン（経理担当）,来客数の動き,・国内経済の減速、中国との外交問題、電気料金の値上げ、収入の伸び悩みなどにより、消費者の生活防衛志向が高まっている。
,,×,競輪場（職員）,単価の動き,"・今月の客単価は8,123円で、３か月前の客単価は9,855円であったため、悪くなっている。"
,,×,その他サービス［保険代理店］（経営者）,お客様の様子,・今年初めからの業績の不調が好転することなく、年末を迎えている。秋にかなり持ち直した客もあるが、その業績を維持できず、また低迷している。低迷が続くと、回復への意思も弱くなり、消費意欲もなくなる。12月に少しでも来年に期待と意欲を持てる業績をあげなければ、なかなか低迷から脱することができなくなる。
"企業
動向
関連

(近畿)",,◎,＊,＊,＊
,,○,食料品製造業（営業担当）,受注量や販売量の動き,・得意先の従業員やパートが増えたこともあり、当社商品の利用が増えている。特に百貨店関係が右肩上がりである。
,,○,出版・印刷・同関連産業（情報企画担当）,受注量や販売量の動き,・年末商戦に向けて、受注量が増えている。カレンダーなどの季節的受注の要素が大きいが、来年３月までの受注が動き始めている。ただし、弱電関係はこの先も受注が見込めない。
,,○,化学工業（経営者）,受注量や販売量の動き,・好調の関東営業所に比べて大阪は苦戦が続いており、前年の売上を下回る状態が続いていたが、ここへきてようやく前年並みの売上が出せるようになっている。
,,○,プラスチック製品製造業（経営者）,受注量や販売量の動き,・受注などの数字や雰囲気は底を脱した感があるが、あくまでも３か月前との比較であり、確信には至らない。
,,○,輸送用機械器具製造業（経理担当）,受注量や販売量の動き,・国内からの見積依頼が増加傾向にある。
,,○,輸送業（商品管理担当）,受注価格や販売価格の動き,・販売量の動きが、お歳暮やクリスマスの動きに合わせて増加している。
,,○,新聞販売店［広告］（店主）,受注量や販売量の動き,・折込件数がやや増加している。購読の契約更新も、毎月経済的な理由で更新しない読者が出ていたが、12月分は全て更新されている。
,,○,広告代理店（営業担当）,受注量や販売量の動き,・通常の広告は相変わらず良くないが、総選挙関連の広告出稿がここへきて大きく増えている。
,,○,コピーサービス業（店長）,受注量や販売量の動き,・年賀状の印刷に関しては、早くも目標を達成するなど好調な状況を維持している。ただし、客はより安価な商品を選ぶ傾向にあり、単価の下落を懸念している。
,,○,その他サービス業［店舗開発］（従業員）,受注量や販売量の動き,・気温の低下に伴い、冬物商材（食材）が好調に推移している。特に、25日に同日開催された大阪、神戸マラソンの効果は大きく、当日は大阪駅、三ノ宮駅を中心に、多くの駅構内でにぎわいをみせた。
,,○,その他非製造業［民間放送］（従業員）,受注量や販売量の動き,・総選挙の実施が決まり、閉そく感の打破を期待する動きが出てきている。当面は経済にも好影響となる。
,,□,食料品製造業（従業員）,受注量や販売量の動き,・販売量、受注量共に大きな動きはない。販売価格も底値安定といったところで、依然として安売り合戦が続いている。各大手量販店も既にプライベートブランド品は採用しており、残るは販売価格や製品の特徴による売上増である。最近はナショナルブランドの価格も全体の動きにつられて安くなってきている。
,,□,一般機械器具製造業（経営者）,受注量や販売量の動き,・今のところ、受注残をみると順調に推移している。
,,□,一般機械器具製造業（設計担当）,受注量や販売量の動き,・受注量の上向く予想が立たない。下向かないように現状を維持することで精一杯である。
,,□,電気機械器具製造業（経営者）,取引先の様子,・前年と比べると経営条件が悪くなってきている上、ここへきて電力の値上げとなるとより悪くなる。
,,□,電気機械器具製造業（経営者）,取引先の様子,・少し円安が進んだ以外は、良い話はない。国内の取引先のなかでも、大手企業の経営者が本当に弱気になっており、新製品の開発に投資をしない傾向が顕著である。大阪駅前や中之島周辺の開発は華やかであるが、ますます海外頼みが強まりそうである。
,,□,電気機械器具製造業（宣伝担当）,受注量や販売量の動き,・量販店の客足は少なく、販売が低迷している。
,,□,電気機械器具製造業（営業担当）,受注量や販売量の動き,・受注、売上共に横ばいである。
,,□,その他製造業［事務用品］（営業担当）,受注量や販売量の動き,・受注量が悪いまま変化がない。
,,□,建設業（経営者）,受注量や販売量の動き,・11月は問い合わせ、受注などが増加傾向にあったが、月末近くになり、少しその勢いが弱まってきている。来年の案件は複数あるが、目先の12月の案件がまだみえない状況である。
,,□,建設業（経営者）,取引先の様子,・長引く不景気で得意先の設備投資も凍結や縮小、延期となっている。官庁関係も発注量が減少傾向にある。
,,□,建設業（経営者）,受注価格や販売価格の動き,・受注量はそこそこあるが、１物件当たりの単価は依然低調である。
,,□,輸送業（営業所長）,受注価格や販売価格の動き,・新規案件の話も少しは出てきているが、物流コストの見直しで厳しい料金設定が多い。
,,□,通信業（管理担当）,それ以外,・良くなっていると聞くが、少なくとも周辺は冷え込んでいる。市場に行ってもさほど安くはないし、安い物は粗悪な商品である。
,,□,金融業（営業担当）,受注価格や販売価格の動き,・月々の受注の予測がつかない状態である。
,,□,広告代理店（営業担当）,取引先の様子,・関西圏の取引先である各ショッピングセンターをみると、大阪の中心地では百貨店のリニューアルオープンで、来客数は大幅増である。一方、郊外が落ち込んでおり、来客数は増えているが客単価が伸びていないため、９月と変わらない。
,,□,経営コンサルタント,取引先の様子,・クライアントの小売業、製造業共に、大きな変化はない。
,,□,その他サービス［自動車修理］（経営者）,受注量や販売量の動き,・もう12月になるが、忙しさでバタバタする気配がない。
,,□,その他サービス業［ビルメンテナンス］（営業担当）,受注量や販売量の動き,・全体的な景気動向はやや上向き加減かもしれないが、まだ断定できるだけのものはない。
,,▲,繊維工業（団体職員）,受注量や販売量の動き,・タオルの産地にとっては最需要期であるが、受注件数は例年より少なく感じられる。ただし、法人の大口需要もあり、受注量は前年並みとなる。
,,▲,繊維工業（総務担当）,受注量や販売量の動き,・受注数の減少が生産数の減少につながり、生産に従事する外注加工先の収入が減ってきている。
,,▲,パルプ・紙・紙加工品製造業（経営者）,受注量や販売量の動き,・季節的要因を除くと悪くなっている。
,,▲,化学工業（管理担当）,受注量や販売量の動き,・電機関係及び建築関係の製品は、販売数量が前年比で14％減少している。
,,▲,金属製品製造業（営業担当）,受注価格や販売価格の動き,・景気悪化に伴い、客先に足元をみられて執ような値下げ要求を受けている。
,,▲,金属製品製造業（管理担当）,受注量や販売量の動き,・定時での仕事が確保できないため、交代で平日に休み、人件費の削減を行っている。
,,▲,電気機械器具製造業（企画担当）,受注量や販売量の動き,・状況はここ２か月変化がなく、前年の水準を維持している。
,,▲,電気機械器具製造業（企画担当）,取引先の様子,・販売価格交渉が一段と厳しくなっている。
,,▲,建設業（営業担当）,受注価格や販売価格の動き,・人手不足で原価がかさんでいるが、工事価格に転嫁できない。
,,▲,広告代理店（営業担当）,受注量や販売量の動き,・クライアントからの広告の注文が少なくなってきており、新規先も減っている。
,,▲,経営コンサルタント,取引先の様子,・コンサルタントで、主に関西圏の家電メーカー及び関連メーカーでの仕事をしているが、家電の主要メーカーの業況が悪いために、非常に困難な状態にある。
,,▲,その他非製造業［機械器具卸］（経営者）,取引先の様子,・海運会社との取引が高いシェアを占めているが、船の数が減ってきており、これからも減らす予定が出ているので、今後もますます悪くなる。
,,×,金属製品製造業（経営者）,受注量や販売量の動き,・海外製品との競合が続くなか、為替格差によって国産品の製造、販売が激減している。
,,×,電気機械器具製造業（営業担当）,競争相手の様子,・同業者も同じく仕事がない。
,,×,不動産業（営業担当）,取引先の様子,・円高で事業所が神戸から出ていき、住民も減っている。空室が増加しているほか、賃貸マンションや事務所の賃料も下がっている。
"雇用
関連

(近畿)",,◎,－,－,－
,,○,人材派遣会社（経営者）,求人数の動き,・11月に入って、通常のペースに戻ってきた感じがする。年末や年度末に向けての動きも少しずつ出てきている。景気動向としては上向きではないかと思われ、ある職種に限れば活発さが出ているなど、少なくとも徐々に良くなってきている。
,,○,人材派遣会社（支店長）,求人数の動き,・求人自体は増えてきているが、スタッフの確保に苦慮している。
,,○,民間職業紹介機関（職員）,求職者数の動き,・日雇い労働者不足による未充足の求人票（ほとんどが建設部門）が、窓口で徐々に増えている。
,,○,学校［大学］（就職担当）,周辺企業の様子,・南港へのコンテナ船は、11月中旬以降、入港が尖閣問題発生以前の状況に戻りつつある。
,,□,人材派遣会社（役員）,求職者数の動き,・前月に引き続き求人数は回復基調にあるものの、マッチングに難航し、雇用者数の増加にはつながっていない。
,,□,人材派遣会社（営業担当）,それ以外,・貿易赤字の拡大やデフレが解消されず、賃金も上がらない。
,,□,新聞社［求人広告］（営業担当）,求人数の動き,・衆議院の総選挙が決まり、今後政権がどうなるかを見極めた上での動きとなるため、状況は変わっていない。
,,□,新聞社［求人広告］（営業担当）,求人数の動き,・新聞の求人広告は、引き続き低調である。
,,□,職業安定所（職員）,求人数の動き,・新規求人数は９か月連続で増加したが、年末に向けたアルバイトなどの非正規社員の求人が目立ち、正社員求人の伸びは鈍化している。ただし、新規求職者数が引き続き減少しているほか、中国情勢などに大きな影響を受けているという事業所の声もあまり聞かれず、現時点で雇用情勢からは景気が悪化しているという感覚はない。
,,□,職業安定所（職員）,周辺企業の様子,・大手電機メーカーが収益悪化のため、人員整理することが決まっている。その影響で下請企業にどれだけのダメージがあるかは分からないが、それなりの悪影響が出る。
,,□,民間職業紹介機関（大学担当）,採用者数の動き,・実際には、2013年３月卒業予定の学生の３～４割は就職先が決まっていないにもかかわらず、次の年度の採用が始まろうとしている。
,,□,学校［大学］（就職担当）,求人数の動き,・大学に求人を出してくる企業数が、前年よりも２割ほど増加している。
,,▲,新聞社［求人広告］（担当者）,それ以外,・新聞への地元からの出稿をみると、薬品業界、通販業界を中心に、前年比でマイナス10％と非常に厳しい。
,,▲,職業安定所（職員）,求職者数の動き,・新規求職者数が増加している。企業整理などによる離職（予定）者の求職申込が見受けられる。
,,▲,職業安定所（職員）,求人数の動き,・新規求人数の動きについては、２か月連続で増加している。
,,▲,民間職業紹介機関（営業担当）,周辺企業の様子,・再就職支援業務の需要が高まっている。
,,▲,民間職業紹介機関（支社長）,求人数の動き,・新規求人数が伸び悩み始めている。
,,×,－,－,－
,,,,,
　８．中国（地域別調査機関：（社）中国地方総合研究センター）,,,,,
,,,,,（－：回答が存在しない、＊：主だった回答等が存在しない）
分野,,景気の現状判断,業種・職種,判断の理由,追加説明及び具体的状況の説明
"家計
動向
関連

(中国)",,◎,百貨店（営業担当）,単価の動き,・気温の低下時期が遅く、実需がずれ込んでいるため今月に需要が集中している。
,,◎,競艇場（職員）,販売量の動き,・11月に開催したグレード１競走において、携帯等の電話による投票売上及び協力他場の売上が多く確保できている。
,,○,商店街（代表者）,来客数の動き,・商店街のイベント時は来客数が増加する。
,,○,百貨店（営業担当）,販売量の動き,・今月は前年同月比で100％を超えている店舗が半数あり、前月よりは良い状況である。寒くなってアウターが売れていることもあるが、近隣のアウトレットの影響を強く受けていたテナントが若干持ち直し、客足が戻りつつある。
,,○,百貨店（購買担当）,お客様の様子,・前月に比べて冬の気配が高まり、気温が下がって高額品のコートやジャケットが好調で、ウォームビズ関連商品もかなり売れている。総選挙告知直後は客足が少し減ったが、今月は前年をかなり上回った数字で推移している。
,,○,百貨店（売場担当）,お客様の様子,・当店の閉店発表の後、にわかに来客数が増加し、特定アイテムの先買いや、買いだめ的な需要により堅調な売上を維持している。
,,○,スーパー（店長）,販売量の動き,・気温低下に伴い、機能下着や冬支度商品の動きが良くなっている。ウォームビズでの「節電」や「健康」といったテーマの商品の売行きが良い。
,,○,スーパー（総務担当）,単価の動き,・客単価が若干上向きになっている。
,,○,スーパー（販売担当）,販売量の動き,・例年の傾向で、年末が近づくに連れてまとめ買いをする客が増えてきている。
,,○,コンビニ（エリア担当）,販売量の動き,・気温が下がったこともあり、中華まんの販売量が増えた。
,,○,住関連専門店（営業担当）,来客数の動き,・特別販売セールを行ったので来客数が増加した。
,,○,その他専門店［和菓子］（経営者）,来客数の動き,・要因ははっきりしないが売上は順調に推移している。
,,○,一般レストラン（経営者）,お客様の様子,・政権交代に期待するが以前よりは景気が良い。
,,○,都市型ホテル（企画担当）,来客数の動き,・宿泊者数、レストラン客数が少し増えてきている。
,,○,通信会社（工事担当）,販売量の動き,・申込件数が前月より増加している。
,,○,テーマパーク（業務担当）,来客数の動き,・冬季イルミネーションイベントを中旬から開催した効果で順調に来園者数が伸びている。秋のイベント期間は競合する施設やイベントによるマイナス効果で来園者数が伸びなかったが、各種広報展開によるリピーター促進と新たな来園者の掘り起こしを期待している。
,,○,その他レジャー施設（アミューズメント）,来客数の動き,・同居する映画館で話題性のある作品公開が続いており、それをきっかけに来客数が前年比20％近く増えている。特に若者層の来店が多くなっていることで、当店の商品にも好影響が出ている。
,,○,設計事務所（経営者）,販売量の動き,・住宅の引き合いや成約件数が増加している。建築主は消費税が増税される前に建築をしたいということと、駆け込み需要による物価高がおこる前にという思惑がある。
,,□,商店街（代表者）,販売量の動き,・客単価が下がっている傾向が続いており、来街者数も落ち込んでいる。
,,□,商店街（代表者）,お客様の様子,・秋の観光シーズンも大詰めになり観光客数は増えたが、買物をする人が少ない。
,,□,一般小売店［茶］（経営者）,来客数の動き,・前月の売上が非常に悪く、その反動で今月はやや売上が良い状態であるが、累計では前年を割っている状態で先行きは不安である。
,,□,一般小売店［酒店］（経営者）,お客様の様子,・客が料理をしなくなり、野菜や魚類など素材の販売量が減少しているため、総菜関係に力を入れなくてはいけない。得意先の飲食店は忘年会予約が前年と変らない様子である。
,,□,一般小売店［酒店］（経営者）,販売量の動き,・相変わらず料飲店の売上が芳しくなく、客はなかなか外食などをしなくなっている。
,,□,百貨店（営業担当）,お客様の様子,・11月末にカード優待20％引きでの販売セールを行っているが売上は良くない。12月末から１月に行う一部のブランド品のプレクリアランス待ちの客が増えている。
,,□,百貨店（販売促進担当）,お客様の様子,・お歳暮のピークが近づいてきたが、前年を下回っている。総選挙告知や前年の大手企業の業容縮小も要因にあるが、個人客の件数の絞込みと単価低下が顕著である。その反面、早い冬型への気候推移はファッションや寝具等へは追い風となっている。
,,□,百貨店（売場担当）,販売量の動き,・11月前半にアウターがようやく動き、主力の衣料品が全般に好調である。防寒雑貨やショートブーツの売上も安定しており、後半は優待会などの販売促進による売上の維持が大きいが、なんとか前年並みで推移する見込みである。
,,□,百貨店（販売担当）,販売量の動き,・前月は気温が高く冬物の動きが不調だったが、今月は気温の低下とともに非常によく動いた。客単価も前年を２ポイント上回る結果となっている。
,,□,スーパー（店長）,販売量の動き,・客単価に変化はない。
,,□,スーパー（店長）,来客数の動き,・来客数は前年の98％で推移している。
,,□,スーパー（店長）,販売量の動き,・ここ数か月、客１人当たりの販売点数が前年より落ちている。
,,□,コンビニ（副地域ブロック長）,来客数の動き,・製造業の業績悪化で工場近辺に立地する店舗の来客数が減少している。人員整理や工場閉鎖・規模縮小の影響が出ている。
,,□,衣料品専門店（地域ブロック長）,来客数の動き,・前年に比べて就職活動中の学生の動きは良くないが、11月はイベントによる来客数は増加している。
,,□,家電量販店（店長）,お客様の様子,・大手家電メーカーに関する報道が流れており、不安感が煽られ販売につながらない。
,,□,乗用車販売店（店長）,販売量の動き,・サービス入構は好調であるが、販売量は前年の75％で推移している。
,,□,その他専門店［海産物］（経営者）,販売量の動き,・11月はカニのシーズンになり客は増えたが、例年に比べ来客数、販売量、購買単価ともに低くなっている。
,,□,その他専門店［ファッション雑貨］（従業員）,来客数の動き,・土日の集客はあるが、目玉商品だけが動いている。
,,□,その他小売［ショッピングセンター］（支配人）,お客様の様子,・休日は来客数は多いが、金を使わないで時間を過ごす時間消費型の傾向が強く、買上単価の低い状態が続いている。
,,□,高級レストラン（スタッフ）,来客数の動き,・週末の予約は増えているが、平日の来客数は少ない。
,,□,その他飲食［サービスエリア内レストラン］（支配人）,お客様の様子,・客の購買量、単価は以前と変わりなく安定しており、今月は紅葉で例年通り週末は客が多い。
,,□,観光型ホテル（支配人）,販売量の動き,・今月の売上は前年を７～８ポイント下回る見込みであるが、これは婚礼売上が要因であり、その他の部門では前年並みか前年を上回っている。
,,□,都市型ホテル（スタッフ）,お客様の様子,・忘年会の予約は例年並みに入っているが、若干ホテルの宴会場から居酒屋に流れている傾向がある。
