Ⅰ．景気の現状に対する判断理由等,,,,,
,,▲,その他サービス［立体駐車場］（従業員）,販売量の動き,・販売量に関しては、回数券の売上が半減し、月ぎめに関しても今月は契約が０件という結果になっており、３か月前と比べても非常に悪くなっている。また、来客数に関しても、かなり悪くなってきている。客はサービス券で出られる無料の時間帯を考えて入庫と言っている。そのためやや悪くなる。
,,▲,設計事務所（所長）,来客数の動き,・政局の不安定さもあり、補助金絡みの計画は一時中止の状態になっている。
,,▲,住宅販売会社（従業員）,お客様の様子,・来客数が減少している。
,,×,商店街（代表者）,来客数の動き,・街の人通りが極端に少なくなってきている。街角の飲料の自動販売機が撤去されたり、コイン駐車場が閉鎖されたりしている。
,,×,百貨店（店長）,来客数の動き,・客数、単価、数量共に落ちている。
,,×,スーパー（経営者）,競争相手の様子,・ディスカウント合戦が続く。
,,×,衣料品専門店（経営者）,販売量の動き,・商店街に人通りが全く見られない。
,,×,衣料品専門店（販売担当）,来客数の動き,・前月までは客も、波があっても出てきて買物をする様子が多かったが、今月に入ってから極端に少なくなってしまった。何が原因か分からないが、背景には総選挙や、急激に寒くなったことがあるのかもしれない。今月の後半は、幾分客が出てきたが、セール待ちのような雰囲気も見られ、買物までには至らず、本当に悪くなった。極端な悪さである。
,,×,家電量販店（店長）,販売量の動き,・売上の柱である映像関連商品、とりわけテレビが不調続きで、前年比70％弱の実績にとどまっている。映像関連商品は全体の30％強の構成比があり、全体に対して約10％の落ち込みを出している。
,,×,一般レストラン（経営者）,来客数の動き,・年末に向かうなかで総選挙が行われ、希望のある明るい総選挙にはなりそうもなく、国民の不安が一層募り、消費は今まで以上に鈍るのではないか。
,,×,一般レストラン（経営者）,来客数の動き,・夜６時から深夜２時までの客数は減っている。
,,×,スナック（経営者）,来客数の動き,・来客数が減っている。
,,×,旅行代理店（経営者）,販売量の動き,・今、総選挙モードに入っている。政治がなかなか進展しない状況で、なおかつ景気もかなり冷え込んでいるため、しばらく低迷傾向が続く。
,,×,タクシー運転手,お客様の様子,・11月に入ってますます悪くなっている。１日の営業回数が10回ぐらいであり、売上が１～２割落ちている。特に深夜の客がいない。
,,×,タクシー（経営者）,お客様の様子,・不景気のため人の動きが悪く、前年同月比17％の減少である。
,,×,その他レジャー施設［アミューズメント］（職員）,お客様の様子,・深夜から明け方にかけて、特に４～５時以降になると、水商売の従業員が帰りに遊びに来るということがあったが、その人たちがほとんど来なくなり、その間の客が大幅に減少している。
,,×,住宅販売会社（経営者）,お客様の様子,・相変わらず事務所、店舗等の引き合いはほとんどない。中古住宅で本当に安い物件等はちらほらあるが、新築住宅の引き合いはあまりなく、まだまだ不動産価格の下落が進み、デフレが進行している。
"企業
動向
関連

(北関東)",,◎,その他製造業［環境機器］（経営者）,受注量や販売量の動き,・従来の環境機器装置のビジネスモデルは引き続き好調である。また、今現在、500ｋｗ未満の発電を複数準備、計画中の太陽光発電の件で、締め切り認可があり、大変忙しく動いている。
,,○,一般機械器具製造業（経理担当）,受注量や販売量の動き,・長くは続かないと思うが、大口の注文が少し入ってきた。
,,□,出版・印刷・同関連産業（営業担当）,受注量や販売量の動き,・年賀状の時期になるが、件数が伸びない。前月と比べても横ばいである。
,,□,窯業・土石製品製造業（経営者）,受注量や販売量の動き,・受注量、販売量共に相変わらず低迷している。
,,□,金属製品製造業（経営者）,取引先の様子,・特装車両のコンクリートミキサー車に対しては復興需要が続いており、順調な受注量がある。産業機械のコンプレッサーはここ数か月はやや減産傾向にあったが、落ち着いたようである。
,,□,電気機械器具製造業（経営者）,受注量や販売量の動き,・自動車の動きが全く止まってしまった。おそらく中国向けの関係とエコカー補助金が打ち切られた関係で、在庫調整に進んでいるからである。他は季節の調整をすれば変わらない。
,,□,輸送用機械器具製造業（経営者）,取引先の様子,・１～９月中旬ごろまでが、まずまずの状況であったが、９月下旬～11月は取引先、競争相手も若干落ちているように感じる。
,,□,輸送業（営業担当）,取引先の様子,・ようやく冬本来の寒さとなり、季節商材である暖房家電やインテリア類、衣料等の物量が動き出し、こたつ、加湿器、布団等の動きが増している。また、インターネット販売、ホームセンター向けの荷物が目立って増加している状況である。ただし、前年は東日本大震災で需要もあったため、前年比では少し下回っている状況である。
,,□,新聞販売店［広告］（総務担当）,それ以外,・今月のチラシ出稿量は101.4％となり、半年ぶりに前年を上回った。しかし、温泉旅館の営業担当者の話では、例年１泊の忘年会予約が入ってくる時期だが、ほとんどなく危機感を募らせている。
,,□,司法書士,受注量や販売量の動き,・以前は11月ごろから仕事が増え始めたが、そういった時代は去ったようで、低いレベルで変わりなく続いている。
,,□,その他サービス業［情報サービス］（経営者）,受注量や販売量の動き,・特段の変化は見られない。
,,▲,食料品製造業（営業統括）,競争相手の様子,・先日、県内の老舗ワイナリーが過剰投資によってホテルへ売却されるニュースが流れ、世間を驚かせた。原因は売上減少によるものであり、各中小メーカーは海外ワインに押され、四苦八苦しているのが現状である。
,,▲,食料品製造業（製造担当）,受注量や販売量の動き,・販売数が落ちている。
,,▲,化学工業（経営者）,受注量や販売量の動き,・東日本大震災の特需があり、仕事量も今のところある。12月のボーナスの支給も問題なさそうであり、今年は久々の社内旅行も行った。
,,▲,金属製品製造業（経営者）,受注量や販売量の動き,・得意先の受注量が少なくなっているため、これからどうなるか全く不明である。
,,▲,一般機械器具製造業（経営者）,取引先の様子,・油圧ショベル向けの仕事は引き続き低迷しており、好調だった他の分野に関しても、計画より下回る状況が出始めている。
,,▲,電気機械器具製造業（経営者）,受注量や販売量の動き,・試作、作業量共に減ってきている。なり振りを構わず仕事を確保しているが、休業日も出だしている。
,,▲,金融業（経営企画担当）,取引先の様子,・尖閣諸島問題による中国人旅行者の激減が、当地の観光業者に大きな影響を及ぼし、景況感を押し下げている。
,,▲,金融業（調査担当）,取引先の様子,・企業マインドの悪化が続いているほか、政策効果の剥落、日中関係の悪化による製造業の生産減少が見え始めている。
,,▲,金融業（役員）,受注価格や販売価格の動き,・自動車関連では、国内市場のパイがなくなっているため争奪戦になっている。競合しているため、受注量及び受注単価が低下傾向にあり、利ざやが取れない。また、飲食業関係では消費単価が下がっており、来客状況も非常に悪くなっている。
,,▲,不動産業（経営者）,取引先の様子,・少子化の影響で、入学者、入学希望者が減少し、設備や備品類も古い物がそのまま使用され続けている。ビルの維持管理においても、最小限の清掃のみで何年も済ましている。
,,▲,不動産業（管理担当）,受注価格や販売価格の動き,・建物管理に関して、今までは当社で修理して請求していたが、修理に必要な部品を現物支給するので、その分安くやって欲しいと依頼されることが増えた。やることは同じでも、当社の売上が減ることになる。
,,▲,広告代理店（営業担当）,受注量や販売量の動き,・広告宣伝予算が若干減っている。折込チラシの配布部数、エリアの縮小や、パンフレットの発注ロットの減少など、少しでも削減しようとする動きが多い。
,,▲,社会保険労務士,取引先の様子,・運送関連の事業所などで荷動きが悪くなってきており、物の動きが停滞し始めている。
,,▲,経営コンサルタント,取引先の様子,・紅葉シーズンも短く、主な観光スポットには人出はあったようだが、消費に結びつくほどの盛り上がりはなく、他の製造業なども不振である。
,,×,電気機械器具製造業（経営者）,受注量や販売量の動き,・東日本大震災による特需が一段落し、新規受注が下降気味である。
,,×,輸送用機械器具製造業（総務担当）,受注量や販売量の動き,・大手自動車メーカーからの３か月の生産見通しでは、直近の受注量とのかい離が非常に目立ってきており、発注量が下振れとなる。また、12月以降についても減産基調に入ってくるという連絡があるため、非常に先行き不透明になってきている。
,,×,その他製造業［宝石・貴金属］（経営者）,受注量や販売量の動き,・卸売りが不調であり、問屋巡りをしても仕入意欲がない。卸の売上は大幅ダウンし、クリスマス用の商材の需要も少ない。
,,×,建設業（総務担当）,それ以外,・公共工事主体で土木舗装工事を行っているが、決算で売上高は前年比16％増である。しかし、工期延長による大幅な赤字の現場が発生したため、２期連続の赤字決算となってしまった。厳しい状況が続いた２期決算である。
"雇用
関連

(北関東)",,◎,－,－,－
,,○,＊,＊,＊
,,□,人材派遣会社（経営者）,求職者数の動き,・大きい仕事の話はないが、小さい仕事については、あちこちの会社から電話がある。
,,□,人材派遣会社（経営者）,求人数の動き,・住宅関連では、住宅着工が徐々に目立ってきているが、動きが見られる程度で、これから先が分からないところである。ただ、自動車関連等の部品の動きが見られた。また、年末に向けての衣料品、装飾品関係の物品販売での募集傾向が多く見られる。
,,□,人材派遣会社（営業担当）,雇用形態の様子,・雇用形態は、派遣、契約から、パート、アルバイトに特化してきている。本来なら正規雇用の人が、非正規で働いている。
,,□,職業安定所（職員）,求人数の動き,・建設業の新規求人数は太陽光発電や、被災地の復興関連求人が出始めており、前年比20％増となっているが、求職者が希望する製造業は、長引く円高や日中関係の悪化の影響から、前年比11.3％減と厳しい状況となっている。
,,□,学校［専門学校］（副校長）,求人数の動き,・求人数が前月に比べ、増えてきているように感じる。しかし、増え方が例年と比べると、さほど変わらない。
,,▲,人材派遣会社（管理担当）,求人数の動き,・派遣の新規契約は０件で、契約終了は数件である。
,,▲,求人情報誌製作会社（経営者）,周辺企業の様子,・景気低迷のなか、11月の周辺企業の求人は例年に比べると大分減少している。
,,▲,新聞社［求人広告］（担当者）,周辺企業の様子,・忘年会向けの広告も減少する傾向が続いている。
,,▲,職業安定所（職員）,周辺企業の様子,・業績悪化のため事業停止に追い込まれ、自己破産申請となる事業所などが前年同時期に比べて増えてきており、人員整理、削減のあおりで仕事を失い、ハローワーク窓口に駆け込む求職者が目立ってきている。
,,▲,職業安定所（職員）,求人数の動き,・家電量販店や介護福祉系の求人はあるが、全体的に新規求人が少なくなってきている。また、前月末で管内大手企業のリストラで退職になった人の雇用保険手続きは180人程度である。
,,×,－,－,－
,,,,,
　４．南関東（地域別調査機関：（株）日本経済研究所）,,,,,
,,,,,（－：回答が存在しない、＊：主だった回答等が存在しない）
分野,,景気の現状判断,業種・職種,判断の理由,追加説明及び具体的状況の説明
"家計
動向
関連

(南関東)",,◎,コンビニ（経営者）,来客数の動き,・当店は、客数が多くなっている点が従来と非常に違い、良くなっている。
,東京都,◎,観光名所（職員）,来客数の動き,・今月は１年間でトップの成績を誇る月でもある。そのため、とても来客数の動きが良く、好成績に終わっている。
,,◎,その他レジャー施設［アミューズメント］（店長）,来客数の動き,・母体となるショッピングセンターの改装が終わり、集客が大きく伸びている。
,,◎,住宅販売会社（従業員）,販売量の動き,・今月の販売量は目標数字の120％超となり、景気は良いと判断した。また、３か月前と比べても明らかに良かった。９月に入り来場客が増えたのだが、ようやく販売に結びついてきている。消費税増税により動き始めた客との商談が、ようやく成約につながってきている。
,,○,百貨店（店長）,来客数の動き,・政治家の発言から円安、株高になっており、今までよりは先行きに期待が持てる。気温の低下が冬物衣料の売上をけん引している。
,,○,スーパー（総務担当）,販売量の動き,・今月に限ったことだが、11月の上旬に大きなセールがあったことと、気温の低下で冬物が一気に動いたことにより、衣料品や寝具を中心とした住まいの品は良くなっている。ただ懸念されることは、頻度品や食料品などが前年を若干割っており、トータルとしては前年を超えているが、不安が残っている。
,東京都,○,コンビニ（商品開発担当）,販売量の動き,・やっと冬らしい気候になってきたため、冬商材の販売を中心に伸びてきている。
,,○,衣料品専門店（店長）,来客数の動き,・気温の低下に伴い、秋冬物の需要が非常に高まり、来店数が増えた。
,東京都,○,通信会社（経営者）,販売量の動き,・11月はテレビ加入が順調に獲得できており、インターネットや電話も計画をオーバーしている。携帯電話とのセット割、特に９月からの新型スマートフォンに大きく引っ張られた面が大いにあり、今後も続きそうである。
,,○,通信会社（管理担当）,お客様の様子,・解散・総選挙による政治の動向及び年末に向けてのイベント等が街並みに出てきているため、やや良くなっている。
,,○,通信会社（局長）,販売量の動き,・１年を通じた季節要因の特需は、肌で感じることができる。通信系ビジネスのため、携帯電話を中心に活気がある。
,,○,住宅販売会社（従業員）,販売量の動き,・契約数が上向いており、例年に比べて数が多い。そろそろ消費税増税の影響も出てきたようである。
,東京都,□,商店街（代表者）,それ以外,・10月に少し持ち直してきたクレジットカードの取扱が、いま一つ伸びず、現状維持といったところである。イベントを仕掛けると反応は良いのだが、その勢いが長続きしないため、好調とは言い切れない。政治などの明るい材料が必要な気がする。
,,□,一般小売店［印章］（経営者）,来客数の動き,・非常に客は少ない。ショッピングセンターが近隣にいろいろあるため、客が身近なショッピングセンターに分散してしまっているのではないかと思う。非常に低迷している。
,,□,一般小売店［靴・履物］（店長）,単価の動き,・相変わらず良くない。特に単価がなかなか持ち直さず、低い。当店も裾物が一番動いており、それ以外はなかなか動かない状態が続いている。ひどい状態である。
,,□,一般小売店［文具］（販売企画担当）,お客様の様子,・外商系は、季節商材の案件等があったため、ある程度伸びた。しかし、店頭の小売は、１人当たり客単価がとても下がっていることや、また、天候不順のためセールの際に雨が降ったことで、売上が大幅に減ってしまっている。これらを差し引いて、プラスマイナスゼロであり、そのまま変らない。
,,□,一般小売店［茶］（営業担当）,単価の動き,・毎年11月は創業祭を実施しており、前年比170％の売上になったが、前々年比では７％の減少となっている。今年は天候も良く客数は伸びたが、客単価が低く、ギフト需要の伸び悩みがうかがえる。
,,□,百貨店（売場主任）,単価の動き,・気温の低下で、中旬から防寒アイテムのニーズが上昇してきたが、客単価は前年に比べ３～５％下がっている。高額品の動きは９月から不調である。
,,□,百貨店（総務担当）,来客数の動き,・催物などを企画しても来客数が伸びない。総選挙や消費税増税などを背景に、客が消費ムードになっていないようである。お歳暮の状況も芳しくなく、年末の商戦が気掛かりである。今後、売上の基となる来客数がどのように推移するか注視する必要がある。
,東京都,□,百貨店（営業担当）,販売量の動き,・季節商材、ファッションが全て実時期になっており、少し先に購入しておく顧客が激減している。その量は前年を死守するのも厳しい。
,東京都,□,百貨店（営業担当）,来客数の動き,・11月に入り気温の低下とともに、防寒用品の動きが出てきたが、全般的には厳しい状況が続いている。季節的要因により、秋冬商材の動きが遅くなっており、商品単価の違いから売上確保が厳しい面も見られる。食料品については、購買客数も減少、商品単価も上がらないといった二重苦の状態である。ただし、３か月前に比べると、前年比のマイナスは徐々に縮小してきている。
,,□,百貨店（販売管理担当）,お客様の様子,・11月に入り気温が低下してきたことから、コートなどの冬物衣料や、野菜を中心とした鍋素材などの動きが活発化して、売上が回復しつつある。しかし、平均単価や客単価は微減しており、本当に必要な商品だけをよく吟味して購入するという客の様子から、購買意欲の基調に変化はみられない。
,東京都,□,百貨店（営業企画担当）,販売量の動き,・冬物ファッションの動きが本格化し、前半は堅調に推移したが、後半に入り総選挙等の影響もあるのか、若干苦戦している。月のトータルでは前年並みの見込みである。
,,□,スーパー（経営者）,来客数の動き,・客数が減っている。客単価は少し上がっているが、これは雨の影響もあると思う。10月が良くなかったため、それよりは少し良くなっているが、悪いなかで10月よりは良くなっているという状況であり、全体的には良くない。
,,□,スーパー（店長）,販売量の動き,・11月の前半は気温もまだ高く衣料品も厳しかったが、後半から気温がぐっと下がって冬に近づき、衣料品や冬物関連商材が好調になってきている。しかし、まだ食品の動きが改善されておらず、衣料品、住まい関連商品頼みであるため、売上は、３か月前と比べて依然として大きく切っている。
,,□,スーパー（店長）,単価の動き,・安い物しか買わず、プラスアルファの関連商品を買ってもらえないため、客単価も下がる。また、特売は打つのだが、本当に安い物しか売れず、負のスパイラルにはまっているようである。
,東京都,□,スーパー（営業担当）,単価の動き,・季節商材はようやく売れ始めたものの、単価が下がっている傾向にある。
,,□,スーパー（仕入担当）,販売量の動き,・不況感があり、家計支出が増える年末を前に節約志向が強い。必要な物のみの購入となり、買上点数が伸びない。
,,□,スーパー（仕入担当）,販売量の動き,・買上点数は前年並みを維持しているものの、単価の下落により売上が前年に届かない状況が続いている。
,,□,コンビニ（経営者）,単価の動き,・売上、客数共に変化なく推移しているが、通常商品の客単価が下落し、セールの繰り返しで、辛うじて売上の減少を食い止めている。
,,□,衣料品専門店（経営者）,お客様の様子,・買物客のぼやきをよく聞くようになった。増税や電気料金などの値上げ、社会不安により生活防衛を意識するような話をよく聞く。買物も値下げ品の更なる値引きを要求するようになり、生活にゆとりがなくなってきている様子がうかがえる。
,,□,衣料品専門店（営業担当）,販売量の動き,・急に寒くなり、客が冬物を求めることが多くなってきている。
,,□,衣料品専門店（営業担当）,販売量の動き,・気温も下がり、通常、高単価の冬物、セーターやジャケット、コートが売れるはずだが、手ごろな価格の物しか売れない。今月も前年比88％で終わっている。東日本大震災後以来、今月で前年比80％台が５か月連続である。８月決算で赤字となり、今後プラスにするには人を切るしかない深刻な状況である。
,東京都,□,家電量販店（店員）,お客様の様子,・これから光熱費が値上がりし、電化製品が安くなるなか、消費者への負担は一層厳しい状態になる。
,,□,家電量販店（統括）,来客数の動き,・客数を前年維持することが非常に難しい。チラシ購読率も年々低下しており、特に東名阪では激しい。チラシ媒体での集客が困難である。
,東京都,□,その他小売［ゲーム］（開発戦略担当）,販売量の動き,・国内は携帯機が上向き傾向で、良い年末商戦が始まっているが、海外は新ハード、超強力タイトルの続編が投入されたにもかかわらず、静かな印象である。
,東京都,□,一般レストラン（経営者）,販売量の動き,・３か月前の８月、８月１日～24日までの前年比は、売上98.8％、客数99.1％である。今月、11月１日～28日までの売上だけだが、前年比91.5％である。
