Ⅰ．景気の現状に対する判断理由等,,,,,
,,□,住宅販売会社（従業員）,お客様の様子,・いまだ、新築住宅購入への意欲に積極性はない。
,,▲,商店街（代表者）,単価の動き,"・1,000円以上商品と1,000円未満商品の販売比率が初めて逆転した。来客数・箱単位販売数の変化はあまり無いが、購買単価だけは落ちてきている。"
,,▲,一般小売店［自然食品］（経営者）,単価の動き,・販売量も前年同月に比べ減っており、単価の低いものへ移っている。
,,▲,一般小売店［時計］（経営者）,来客数の動き,・客単価が低い。
,,▲,一般小売店［食品］（経営者）,お客様の様子,・季節限定商品が比較的よく売れており、前年同月の実績をなんとかクリアできそうである。しかし、前月に続き、来客数がもう一息のところで達成できていない。客の話を聞いても、ボーナスは額の問題ではなく、出してもらえることで納得しているという厳しい現状がある。
,,▲,一般小売店［書店］（経営者）,単価の動き,・10月の悪さよりは持ち直しているが、客の購買行動は良くない。12月に総選挙が始まるが、政治家が右往左往していることから、客がどんどん白けている様子が見られ、期待が持てない。この総選挙が良いのかどうか、心配になっている。欲を言えば、この総選挙で皆の気持ちががらっと変わってほしい。
,,▲,一般小売店［贈答品］（経営者）,お客様の様子,・11月はお歳暮の早期キャンペーンによる早取りの期間である。例年では、安いため早く来てたくさん買うというように、防衛面で早期に利用されていたが、今年は自粛傾向がある。客の来店が少なくなり、買い控えや、付き合いを減らす傾向が強まっている。個人、法人共に贈答品の贈の部分をセーブしている。残念だが全体的に売上が３か月前から減っている。
,,▲,百貨店（売場主任）,お客様の様子,・今月前半は結構良かったが、後半になると買物をする客が少ない。連休の時、お歳暮を買いに来る客が、自分のものは買わずにお歳暮のみ買っているようで、紙袋を持っている客が少ない。
,,▲,百貨店（経理担当）,販売量の動き,・11月の衣料品販売は、前半は好調であったが、後半には失速し、全体としては10月に続き良くない。食品は、おおむね好調である。
,,▲,百貨店（販売担当）,お客様の様子,・ついで買い、衝動買いのような、目的のない購買は引き続き厳しい。目的のあるものに関しても、吟味し、絞り込んで、さらに値段も考えての購買になっている。生活を楽しむというよりも、生きていくために最低限必要なものを購買している状況になっている。
,,▲,百貨店（販売担当）,販売量の動き,・ボーナス需要が少なく、また、客単価も低い。製造業の中国問題による影響が大きい。
,,▲,百貨店（経営企画担当）,お客様の様子,・スーパーなどの値下げが激しくなるなかで、百貨店の衣料品に関する動きが鈍くなっている。価格に対する消費者の意識が更に強まっており、販売単価が下がっている状況である。
,,▲,スーパー（経営者）,お客様の様子,・今月20日ごろから冬物商戦が始まったばかりなのに、売上不振のため、早くもディスカウントセールが始まっている。地元で人気のうどん屋では、色々な割引があり、少しでもお買得になるよう努力している。また、総選挙が予定され、レストラン等に行く人が少なくなっていると店主が言っている。消費の低迷が進み、今月の景気は良くない。
,,▲,スーパー（経営者）,お客様の様子,・中小顧客であるスーパーや八百屋が、皆11月に入り来客数、客単価共に数％落ち、売上が２けた減少というところが多いと聞く。
,,▲,スーパー（店長）,単価の動き,・単品単価の下落がまだまだ止まっていない。それをカバーする点数が増加していないため、客単価も下がっている。また、高額商品については更に動きの悪い状態である。
,,▲,スーパー（店員）,単価の動き,・この地方の名産である富有柿を贈答品として贈る客が数多く見受けられ、売上増加の一端を担っている。みかんも低価格傾向なので、買い渋る気配はなさそうである。
,,▲,スーパー（店員）,単価の動き,・単価の安いものだけを選んで買物をしている状況が続いている。
,,▲,スーパー（店員）,販売量の動き,・買物に来ている客が、必要なものを必要なだけしか買っていかない。１人当たりの買上点数が、３か月前と比べて少し減っている。
,,▲,スーパー（販売担当）,来客数の動き,・近くに競合店ができてから、土日の客がめっきり減っている。
,,▲,スーパー（商品開発担当）,販売量の動き,・低価格プライベートブランドを投入したカテゴリーは買上点数が上昇しているが、単価が下がって結果的に売上につながっていない。満遍なく売上が減っており、厳しい状況が続いている。
,,▲,コンビニ（エリア担当）,それ以外,・売上は前年同月を下回り、客は価値があると感じる商品しか購入しない傾向がある。
,,▲,コンビニ（エリア担当）,来客数の動き,・新店オープンしても、想定している来客数をなかなか呼び込めない。
,,▲,コンビニ（エリア担当）,来客数の動き,・キャンペーン等により、単価の下げ止まりができている。しかし、特に10月から来客数減少が大きく影響し、売上が下降傾向である。
,,▲,家電量販店（店員）,単価の動き,・全体的に景気が悪くなってきている。単価競争や同業者間の競争が熾烈になっている。
,,▲,乗用車販売店（経営者）,お客様の様子,・購買意欲の低下がうかがえる。
,,▲,乗用車販売店（経営者）,販売量の動き,・軽自動車需要そのものは衰えていない。しかし、３か月前はエコカー補助金がまだ有効だったので駆け込み需要があったが、現在はそれもない。
,,▲,乗用車販売店（従業員）,お客様の様子,・全体的に良くない。客の様子から言っても、景気が良くない。車を進んで買おうという人が少ない。前月に引き続き良くない。
,,▲,乗用車販売店（従業員）,販売量の動き,・今月に入って車の受注台数が前年同月割れとなり、目標未達を起こしている。来客数も前年同月に比べて落ち込んでいる。大型車種も売れず、３月の決算セールを前に買い控えている様子もうかがえるので、しばらくは厳しい状況が続く。
,,▲,乗用車販売店（従業員）,販売量の動き,・エコカー補助金の終了以降、来客数が増えない。客は、今の景気では、事故で車が潰れるような事でもなければ、なかなか車を買換えようとは思えないと言っており、環境の厳しさを実感する。
,,▲,乗用車販売店（総務担当）,販売量の動き,・エコカー補助金の終了による反動が起こっている。
,,▲,高級レストラン（スタッフ）,来客数の動き,・月ごとの変動をならしてみると、夏以降、来客数は減少傾向にある。前年夏の放射能問題による来客数減少の反動増という要因も無くなり、来客数･客単価共に前年同月並みの水準で止まっている。
,,▲,スナック（経営者）,来客数の動き,・繁華街は人通りも少なく、景気が悪いなか、客の財布のひもは依然として固いままである。個人客も最近は利用回数が減ってきている状態で、売上は減る一方で良くない。
,,▲,観光型ホテル（経営者）,来客数の動き,・３か月前は８月で、夏休みの家族客が新東名を使って来たため、１か月間で伸びがあった。しかし最近になり、総選挙に対しての様子見なのか、客足が鈍くなってきている。３か月前と比べてやや悪くなっている。
,,▲,都市型ホテル（経営者）,来客数の動き,・客の予約の直近化傾向が強まっている。
,,▲,旅行代理店（経営者）,単価の動き,・客の動きも悪い上に、単価の安いものが集中している。その反面、高額な商品も売れているので、旅行の客層も上下に分かれ、中間層がいない。
,,▲,旅行代理店（経営者）,お客様の様子,・年末年始の旅行受注は、例年になく好調であったが、ここにきて客の都合による大口のキャンセルが発生している。原因は、客の会社が中国問題で受注が激減し、見通しが全く立たないためだという。キャンセル料を払ってでも、キャンセルした方が良いという判断である。このような事例も発生しているので、単に年末年始の受注が増えたからと言って、景気は上向いてはいない。
,,▲,旅行代理店（従業員）,来客数の動き,・受付方法を少し変えたこともあるが、年末年始にかけての帰省を含めた旅行自体が、減っている。
,,▲,旅行代理店（従業員）,お客様の様子,・しばらくは底辺での横ばいという感じであったところへ、年内総選挙が決まったことにより、官公庁の忘新年会や職員旅行などの団体旅行が減少し、一般の旅行意欲も低下している。海外旅行も、中国を中心に減少したまま戻ってこない。
,,▲,タクシー運転手,来客数の動き,・昼間のタクシー利用も減少してきている。例年11月20日以降に始まる忘年会もほとんど目立たず、夜の繁華街は活気がなく静かである。
,,▲,タクシー運転手,お客様の様子,・相変わらず夜の客の動きが悪い。振り返ると、お盆以降売上が0.5％～10％ほど、ずっと落ち込んでいる状態が続いている。
,,▲,通信会社（営業担当）,それ以外,・街中にも活気が無く、新聞紙上でも明るさを感じる記事がほとんど見当たらない。国道端でもガソリンスタンドでも、閉鎖している場所も多く、大人の遊技場と言われるパチンコ店も、あちこちに閉店した店が見受けられる。
,,▲,通信会社（営業担当）,単価の動き,・現在、固定電話の廃止が増加していることにより、売上が減少している。
,,▲,テーマパーク（職員）,来客数の動き,・今月は来客数、客単価共に下げた状況である。天候等の要素もあったものの、やや悪くなっている。
,,▲,観光名所（案内係）,お客様の様子,・特にいつもと変わりはないが、来客数が減っている。
,,▲,パチンコ店（経営者）,販売量の動き,・来客数の動きがやや悪い。
,,▲,理美容室（経営者）,来客数の動き,・客があまり来てくれない。
,,▲,住宅販売会社（従業員）,販売量の動き,・販売量が落ちている。他社の動きは不明なので、業界的に減少しているのかは不明であるが、例年同月より落ち込んでいる。
,,▲,その他住宅［住宅管理］（従業員）,お客様の様子,・来客数は変わらないが、商談がなかなか良いところまでいかない。物件は探すが、なかなか決めない状況の客が多い。消費税率が上がるまでに決めればよいと、長いスパンで考えているようである。
,,×,商店街（代表者）,販売量の動き,・発注の件数、売上共に激減している。例年、11月は比較的売上の多い月であったが、もう過去のことであり、今後はそのような傾向もなくなるのだろう。仕入先の営業担当の話でも、売上は相当減っているようである。
,,×,一般小売店［結納品］（経営者）,販売量の動き,・とにかく来客数が少なく、販売量が非常に減少している。
,,×,コンビニ（エリア担当）,来客数の動き,・来客数の前年同月比が月を追うごとに悪くなっている。競合店ができた店舗はもちろん、周辺の環境が変わっていない店舗でも、前年割れが出てきている。
,,×,コンビニ（店長）,来客数の動き,・来客数と共に客１人当たりの買上単価が低下している。これは、寒くなってきて飲料水が出なくなったためである。
,,×,衣料品専門店（販売企画担当）,販売量の動き,・販売量が激減している。10年以上商売をしていて、全く何も売れない日があったのは初めてである。
,,×,家電量販店（店員）,来客数の動き,・政治が落ち着かず、世の中が不安定な状態であるため、客の買い控えが起きている。エコポイント終了による谷から徐々に回復基調にあったところに、経済が悪化傾向に向き始めているようで、非常に危機感を覚える。
,,×,乗用車販売店（従業員）,販売量の動き,・エコカー補助金が終了してからは、売行きがガタンと落ち込んでいる。
,,×,その他専門店［貴金属］（店長）,それ以外,・前月に比べると、特に売上は落ちている。消費者の低価格志向は変わっておらず、同乗者も悲鳴を上げている。次の与党に期待している。
,,×,旅行代理店（経営者）,それ以外,・近所の喫茶店の経営者がもう仕事を止めたいとこぼしている。全く来客がなくなってしまっている。企業数も半減しているし、当社も客単価がどんどん下がっており、旅行業自体が成り立っていない。
,,×,テーマパーク（職員）,お客様の様子,・中国人の入場者はほとんどない。日本人の団体客もほとんどない。
,,×,美容室（経営者）,それ以外,・今までにないほど今月は暇である。何が原因かさっぱり分からず困っている。
,,×,美容室（経営者）,競争相手の様子,・景気も良くなく、将来の不安で、客がお金を使わなくなっている。
,,×,理容室（経営者）,お客様の様子,・相変わらず景気の良い話はない。どんどん安い店に流れる。
,,×,住宅販売会社（経営者）,競争相手の様子,・売行きが悪い。単価を下げても今一つの状況である。
"企業
動向
関連

(東海)",,◎,電気機械器具製造業（経営者）,受注量や販売量の動き,・年末にかけて、パーラー業界の設備投資・新店計画が増えたために、受注量が増える。特に当社商品の販売が多くなっている。
,,○,紙加工品［段ボール］製造業（経営者）,受注量や販売量の動き,・中国向け自動車部品梱包用段ボールの販売量が急激に減少していたが、11月に底を打ち、12月中旬からの受注見込みがやや回復している。
,,○,一般機械器具製造業（経理担当）,受注量や販売量の動き,・海外の電子部品メーカー及び電気部品メーカーの動きが、底を打っている。
,,○,輸送用機械器具製造業（品質管理担当）,取引先の様子,・客先の生産計画スケジュールから判断して、やや良い。
,,○,経営コンサルタント,取引先の様子,・中古の売れ残り住宅が、ずいぶん取引されてきている。消費税増税前の駆け込み需要の動きがはっきり見られる。
,,○,その他サービス業［ソフト開発］（社員）,取引先の様子,・大手自動車メーカー系の客において、ＩＴ開発が継続して発生している。
,,□,"出版・印刷・同関連産業（経営者）
",受注量や販売量の動き,・忘新年会企画で広告掲載した飲食店では、年内総選挙が決まって以降、忘年会の予約キャンセルが入っている。行政関係の客は特に顕著であるという。こんな所にも、総選挙による経済へのマイナス効果がある。
,,□,化学工業（総務担当）,それ以外,・震災関係の需要が、売上を増やしている。
,,□,化学工業（企画担当）,受注量や販売量の動き,・国内受注が月割り予算を下回る傾向は、変わっていない。欧州での売上は低調である。米国及び中国のみ予算を上回っているが、中国に関しては政情から、予測できない部分が多い。
,,□,化学工業（人事担当）,受注量や販売量の動き,・日本では後発薬への信頼性の不安から、海外と比べ普及がスローであったが、最近は値段が安いことを重視し、新薬から後発薬への切替えが徐々に増えてきている。
,,□,窯業・土石製品製造業（社員）,取引先の様子,・取引先の中には、稼働率が半分に落ち込んでいるところがあり、全体的には20％ほど落ち込んでいる印象がある。中国への輸出が、先方でストップしているという話も多い。
,,□,鉄鋼業（経営者）,受注量や販売量の動き,・通常の年であれば、他の月に比べて月商が１割から２割程度多く見込める月であるが、本年はほとんど横ばいであり、実質的には売上減少になっている。
,,□,金属製品製造業（従業員）,受注量や販売量の動き,・工場の生産能力を上回る受注が入っているが、その傾向がこの２年間は特に顕著である。製造元が減っているかと思う。その割には価格上昇が見えてこず、安値受注が横行している。
,,□,一般機械器具製造業（営業担当）,受注量や販売量の動き,・北米市場では10月から新会計年度が始まったが、引き合い件数も増えず、受注金額がかつてないほど低調なまま推移している。中国を始めとするアジア市場も、引き合い件数、受注金額共に低調である。
,,□,電気機械器具製造業,取引先の様子,・設備投資意欲は停滞している。
,,□,建設業（経営者）,受注量や販売量の動き,・不動産開発業では、マンション・戸建共に来場者数が一時期より少し停滞気味である。
,,□,建設業（営業担当）,受注価格や販売価格の動き,・入札関係等の雇用費及び処分費の設定値が、１％弱ずつ下がっている。
,,□,輸送業（エリア担当）,受注価格や販売価格の動き,・売上金額で前年は9.8％減少、今年は0.9％減少となり、前年同月比較で8.9ポイント良くなったように見えるが、前年の10月からは売上の伸び率が止まってしまっている。今年の７月からは前年同月割れが続いている。
,,□,輸送業（エリア担当）,受注量や販売量の動き,・３か月前のお盆の時と比べ、今の荷物の取扱量は変わっていない。景気は３か月前と変わらず、悪いままである。
,,□,金融業（企画担当）,取引先の様子,・為替が円安方向に進んでおり、企業業績へのプラスの影響や個人投資家の投資意欲も回復しつつあるが、上向きというほどでもない。
,,□,不動産業（経営者）,受注量や販売量の動き,・総選挙に絡み、問い合わせ等が減っている。
,,□,不動産業（管理担当）,取引先の様子,・ここ３か月全く動きがなく、以前と変わりない。
,,□,不動産業（開発担当）,受注量や販売量の動き,・一部消費税増税に向けた駆け込み需要の動きがあるものの、政府施策が不透明ななかで、現時点において特に大きな変化は感じられない。
,,□,広告代理店（制作担当）,取引先の様子,・出稿量等はそれほど変わっていないが、受注があっても見積の時点で金額を削られてしまう状態が続いている。
,,□,新聞販売店［広告］（店主）,受注量や販売量の動き,・例年11月はチラシが最も多い月であるが、10％ほど減っている。
,,▲,食料品製造業（経営企画担当）,受注価格や販売価格の動き,・依然としてデフレ状況が継続し、店頭価格の下落と原材料価格高騰の間で、収益が圧迫されている傾向がますます強い。先行きも不透明感が続き、コスト削減にも限界がある。
,,▲,パルプ・紙・紙加工品製造業（総務担当）,受注量や販売量の動き,・特に中国問題の悪化により中国向けが悪く、それに伴い、関連する受注量・販売量が減少している。
,,▲,金属製品製造業（経営者）,受注量や販売量の動き,・受注量が減少している。
,,▲,電気機械器具製造業（企画担当）,受注量や販売量の動き,・欧州向けの販売は低迷したままであるし、加えて、中国での売上も減少している。
,,▲,電気機械器具製造業（営業担当）,受注価格や販売価格の動き,・中国問題などで影響が出始めている。
,,▲,輸送業（経営者）,受注量や販売量の動き,・総合スーパーやホームセンター向けの物量が低迷しており、さらに単価の低いものの割合が多いために、売上も減っている。消費者の買い控えが顕著なためと思われる。
,,▲,輸送業（エリア担当）,受注量や販売量の動き,・中国関係の貨物が減っている。
,,▲,通信会社（法人営業担当）,それ以外,"・７～９月のＧＤＰ3.5％減、輸出５％減、設備投資3.2％減（米国の大手金融機関の破たん時は5.5％減）、貿易赤字5,000億円、生活保護215万人等の情報から、やや悪い。"
,,▲,金融業（法人営業担当）,取引先の様子,・エコカー補助金終了に伴い、国内自動車販売の反動減による地元自動車メーカーの生産減少を映じ、部品メーカーの受注も減少している。
,,▲,公認会計士,それ以外,・会計事務所のクライアントの業績が向上傾向にない。また、経営改善計画を金融機関に提出している会社で、実績値が計画に届いていない会社が多い。
,,▲,会計事務所（職員）,取引先の様子,・小売店の販売形態がネット販売に主力を置くようになっている昨今、前年同月と比較すると大きく変わっている。特に食品関係では原価を切っての販売が目立っている。ネット販売は今後更に注目を浴びる形態であり、競争激化は間違いない。
,,▲,会計事務所（社会保険労務士）,取引先の様子,・大手自動車メーカー関連の企業が休業を実施している。自社が自動車関連の製品を作っていると意識していないくらいの下請企業も多いが、どこも受注が減少している。
,,▲,その他非製造業［ソフト開発］（経営者）,取引先の様子,・飲食店は、安い店には客がいるが少ない。日本全体に不況感が蔓延している。各工場においても、生産は７割ほどしか戻ってきていない。年末に向け少しは上昇すると思うが、経営的には非常に厳しい状態である。
,,×,輸送用機械器具製造業（総務経理担当）,受注量や販売量の動き,・もともと欧州向けが出なかったため景気が悪かったところへ、尖閣諸島問題があり、日本から中国向けの物の流れが止まっている。そのため景気が悪くなっている。
,,×,輸送業（従業員）,受注量や販売量の動き,・自動車関連の物流や中国関係の物流が低調である。名古屋港でコンテナを扱う会社から、仕事が減って給料が減ったため転職をしたいと、在職中のドライバーが面接に応募してきたことからも、物流は低調であるといえる。
,,×,金融業（従業員）,取引先の様子,・自動車関連の会社が多いが、中国問題の影響か、生産自体を減らしたり、月で数日の休みをつくったりして、稼動させていない会社が多くなってきている。今後の見通しも立っておらず、景気は明らかに悪い。
,,×,その他サービス業［広告印刷］（従業員）,受注量や販売量の動き,・低迷状態がずっと続いているが、特に今月は全くと言ってよいほど動きがない。
"雇用
関連

(東海)",,◎,－,－,－
