Ⅰ．景気の現状に対する判断理由,,,,,
,,○,一般レストラン（スタッフ）,,・顧客のメインである大手企業各社のボーナスが出たため、来客数が増加している。
,,○,スナック（経営者）,,・４、５月の売上は少し伸び悩んだが、６、７月は売上が増加している。
,,○,都市型ホテル（スタッフ）,,・名古屋駅ビルのホテル開業後市場が大きくなり、やや良くなっている。
,,○,旅行代理店（従業員）,,・見積、国内旅行の依頼が増加している。
,,□,一般小売店［生花］（経営者）,,・相変わらず客単価が低く衝動買いがない。
,,□,スーパー（店長）,,・客数、客単価とも、食料品はやや増加傾向だが、衣料品は減少傾向で、トータルすると変化がない。
,,□,コンビニ（エリア担当）,,・天候、ゲームソフトの大作の影響で好調だが、本格的な景気回復かどうかは判断しかねる。
,,□,コンビニ（店長）,,・猛暑により飲料水やアイスクリームがよく売れているが、本来的に消費が増加しているとは判断できない。
,,□,コンビニ（店長）,,・７月の前半は熱帯夜が１週間くらい続き売上は増加したが、後半は元に戻っている。
,,□,乗用車販売店（従業員）,,・良くなっている状態が変わっていない。
,,□,テーマパーク（職員）,,・相変わらず節約型が多く、客単価が伸びない。
,,□,テーマパーク（職員）,,・夏休み中の宿泊施設の予約が間際化しているのに加えて、低価格の部屋から埋まっている状況で、客が消費に厳しい状況は変わらない。
,,□,旅行代理店（従業員）,,・そごうの倒産やゼネコンの信用不安もあり、旅行業界も個人、団体ともに低価格志向が続き、厳しい状態にある。
,,□,タクシー運転手,,・相変わらず夜の繁華街のタクシーは空車が多く、ホテル客も１時間に１人程度で、なかなか客が拾えない状況が続いている。
,,▲,一般小売店（経営者）,,・そごう問題が世の中に不安な気持ちをあおっており、好転しかけた景気に水をかけ、消費意欲を減退させている。
,,▲,百貨店（販売促進担当）,,・暑い日が多いため、来客数が減少している。
,,▲,百貨店（販売促進担当）,,"・夏物クリアランスが全体的に盛り上がりに欠けている。
・夏休みに入ったが、子供の来客数も大きく減少している。"
,,▲,スーパー（店長）,,・ギフトは店頭では良い数字だが、外商、法人関係が前年比60％とかなり落ちている。
,,▲,家電量販店（店員）,,・ボーナスが出て需要期であるにもかかわらず、売上が伸びない。
,,▲,テーマパーク（職員）,,・天候により、団体利用率が対前年同期比で70％と低下している。
,,▲,ゴルフ場（経営者）,,・愛知県のゴルフ場は全体的に、来場者数が毎月減少している。
,,▲,美容室（経営者）,,・暑さにより、客の出足が悪くなっている。
,,×,商店街（代表者）,,・著しく稼働率が低下し、来客数も著しく減少している。
"企業
動向
関連

(東海)",,◎,＊,＊,
,,○,輸送業（エリア担当）,,・７月中旬以降、荷動きが非常に活発になってきている。
,,○,輸送業（エリア担当）,,・季節の影響もあるが、飲料缶が非常に多く動いている。
,,□,広告代理店（従業員）,,・折込広告は思ったほど増加せず、景気動向についてまちまちの感想を持つ広告主がほとんどである。
,,▲,＊,＊,
,,×,－,－,
"雇用
関連

(東海)",,◎,求人情報誌製作会社（編集者）,,・金融を除く全ての業種で扱い件数が増加し、景気回復が全業界に広がっている。
,,○,人材派遣会社（社員）,,・派遣の依頼数が業種全般に渡り、増加傾向がみられる。
,,○,新聞社［求人広告］（担当者）,,"・求人広告の申込が増加し、特にアルバイトやパートは好調で、雑誌、新聞とも前年比150％である。
・ここ１年ストップしていた輸送機器メーカーの期間従業員の募集や人材派遣会社の求人も活発になっている。
・前年手控えていた新卒採用を再開する企業の数も、前年比165％である。"
,,□,アウトソーシング企業（エリア担当）,,・自動車関連は絶好調だが、他の業種が下降気味になっており、自動車関連が他業種の雇用を吸収している状態である。
,,□,求人情報誌製作会社（編集者）,,・営業職、ＩＴ関連職、オープニングスタッフの求人が多く、中小企業を中心に動きがあるが、総合的には変化がなく、プラス・マイナスゼロとなっている。
,,▲,－,－,
,,×,－,－,
,,,,,
　５．近畿,,,,,
,,,,（－：回答が存在しない、＊：主だった回答等が存在しない）,
分野,,景気の現状判断,業種・職種,景気の現状に対する判断理由,
"家計
動向
関連

(近畿)",,◎,－,－,
,,○,スーパー（経理担当）,,"・猛暑の影響で水物が売れている。
・乳製品の社会不安の影響により、プライベート・ブランドに動きがみられる。"
,,○,コンビニ（エリア担当）,,・既存店の１日当たりの平均販売額は３か月前には前年割れだったが、今月は前年を上回っている。
,,○,コンビニ（店長）,,"・ボーナスの支給によるものと考えられるが、最近１万円札の使用が多くみられる。
・猛暑の影響で、アイスクリーム、ビール等の衝動買いが多い。"
,,○,家電量販店（店員）,,・期待の新製品が一部発売され、売上が増加している。
,,○,その他専門店［薬］（経営者）,,"・猛暑の影響により、水周りの商品がよく動いている。
・買上点数が以前と比べ１点から２点ほど増加している。"
,,○,乗用車販売店（営業担当）,,・当方の仕掛けにより客が相当動き、月の後半から月末まで受注が続いた。
,,○,一般レストラン（スタッフ）,,・来客数、客単価とも前年を上回り、既存店売上の前年比が回復傾向をみせ始めている。７月の猛暑が大きく影響している。
,,○,一般レストラン（スタッフ）,,・７月の後半に入り若干客の動きが活発になってきた。
,,○,観光型旅館（経営者）,,・客単価がやや上向いている。
,,○,都市型ホテル（スタッフ）,,・個人客に動きがみられる。
,,○,観光名所（経理担当）,,・売上の前年比が徐々に良くなってきている。
,,○,旅行代理店（営業担当）,,・近場の海外に加え、国内、家族の旅行申込が増加している。
,,○,旅行代理店（営業担当）,,・客の出が活発になっており、前年と比べても予約数が増加している。
,,○,タクシー運転手,,・客との車内での会話で、多少動きが出てきたということを聞く。
,,○,住宅販売会社（営業担当）,,・最近は、価格よりも質を重視する客が多い。
,,○,その他住宅［展示場］（従業員）,,・減税効果もあると思うが、来場者数が増加している。
,,□,商店街（代表者）,,"・バーゲンセールも中心部のほとんどの商店街で前年割れが続いている。
・依然として単品志向が強く、客単価が上昇しない。"
,,□,百貨店（売場主任）,,・安い物を安い時期に買う以外に客が集まらない状況が続いている。
,,□,百貨店（売場主任）,,"・バーゲン時期が早まり、月前半は好調であったが、後半に息切れした。
・全社的に前年割れの状態が続いている。"
,,□,スーパー（経理担当）,,・売上が前年を下回る傾向が改善されていない。
,,□,スーパー（経理担当）,,・売上があまり変わらない。
,,□,家電量販店（経理担当）,,・既存店ベースの売上がほとんど変わらない。
,,□,乗用車販売店（営業担当）,,・売上があまり変わっていない。
,,□,都市型ホテル（スタッフ）,,・宴会件数、食堂の利用人数、宿泊人数ともあまり変化がない。
,,□,タクシー運転手,,・売上は３か月前の悪い状態に戻った。
,,▲,商店街（代表者）,,・客から、暇である、前月よりひどいという話を聞く。
,,▲,百貨店（売場主任）,,・好調な動きを示していた婦人服が苦戦しており、また紳士服は今まで以上に低迷している。
,,▲,衣料品専門店（店員）,,・そごうの倒産などで先行きに不安感が出てきているためか、当店においては春から順調に伸びてきた紳士服の売上が、今月は伸び悩んでいる。
,,▲,テーマパーク（職員）,,・来場者数が減少傾向にあり、客の消費単価も低下気味である。
,,×,商店街（代表者）,,・暑いため、人通りが全くなく、売上がない。
,,×,商店街（代表者）,,・多少でもボーナスによる需要の拡大に期待していたが、全く期待はずれであった。
,,×,百貨店（売場主任）,,・店頭の小売状況が悪く、低単価になっている。
,,×,コンビニ（経営者）,,・そごうや長崎屋の大口倒産により、買い控えの状況にある。
,,×,インテリア専門店（経営者）,,・雪印、そごう問題による消費者の不安心理から、７月に入り消費が冷え込んでいる。
,,×,その他専門店［宝石］（経営者）,,・客数、客単価とも落ち込んでいる。広告宣伝、チラシ、新聞広告等に対する反応も悪化している。
,,×,自動車備品販売店（営業担当）,,"・日本橋商店街の平日の人通りが一段と少ない。
・中小企業のボーナスは低調だったとのことである。"
,,×,競輪場（職員）,,・近年になく厳しい状況にある。入場者数、購買単価、発売額とも、連日最低記録を更新し、事業存亡の危機にある。
"企業
動向
関連

(近畿)",,◎,－,－,
,,○,一般機械器具製造業（経営者）,,・受注量が増加している。
,,○,電気機械器具製造業（経営者）,,・最近は日曜、祭日にも社員が出勤するほど忙しくなっている。
,,○,電気機械器具製造業（経営者）,,・ＩＴ分野に関連している設備メーカーは徐々に忙しくなってきている。
,,○,新聞販売店［広告］（店主）,,・折込広告の数が増加している。
,,○,経営コンサルタント,,・受注件数が引き続き上向いている。
,,○,その他企業［ネジ］（団体役員）,,・出荷数量が10％台で伸びており、出荷額は１％台で増加している。
,,□,一般機械器具製造業（経営者）,,・ＩＴ関連等は設備投資が始まっているというが、建築物件も含めて現状の出荷量は多くない。ただし、来年以降の物件として、大きなプロジェクトが具体化してきている。
,,□,非製造業［繊維品卸売］,,・小売業における信用不安や輸入品の影響による単価の下落により、悪い状態が続いている。
,,□,広告代理店（営業担当）,,・冬から春にかけてみられた景気の上向き感が、やや伸び悩んでいる。
,,□,広告代理店（従業員）,,・受注量は必要最小限という感じであり、大きく増加しない。
,,▲,輸送業（営業所長）,,・扱い個数が落ち込んでいる。
,,▲,その他企業［自転車製造卸］（団体職員）,,・平均単価が低下しており、高付加価値、高級品の売行きが止まってきているので、収益が悪化する一方である。
,,×,繊維工業（経営者）,,・取引先、商品の納入先の状況として、在庫が徐々に増加しているとの話をよく聞く。
,,×,繊維工業（経営者）,,・そごうの民事再生法の適用による不安が再度、各問屋に影響を及ぼしているようで、買い控えが更に進んでいる。
,,×,その他企業［タオル］（団体職員）,,・受注量、出荷量がますます減少している。
"雇用
関連

(近畿)",,◎,人材派遣会社（社員）,,・新規の受注が非常に増加する一方、若年層のスタッフの登録が減少しており、需要に対し供給が賄えないほど好況になってきている。
,,○,人材派遣会社（経営者）,,・ＩＴ関連、通信、金融などの業界で需要が拡大している。
,,□,人材派遣会社（経営者）,,・受注件数が変わらない。
,,▲,人材派遣会社（社員）,,・そごう問題を含め非常に不安定な状況が続いている。
,,▲,アウトソーシング企業（経理担当）,,・例年、主要得意先である物流関係の会社で需要増が見込まれるが、今年はあまり増加がみられない。
,,×,－,－,
,,,,,
　６．九州,,,,,
,,,,（－：回答が存在しない、＊：主だった回答等が存在しない）,
分野,,景気の現状判断,業種・職種,景気の現状に対する判断理由,
"家計
動向
関連

(九州)",,◎,＊,＊,
,,○,商店街（代表者）,,・ボーナスが出たので、客単価が多少上昇している。
,,○,コンビニ（店長）,,・数字でみると前年比も前月比も増加している。
,,○,インテリア専門店（従業員）,,・前月に引き続き、売上が前年比で伸びている。
,,○,家電量販店（店長）,,・季節商材の動きが良く、７月だけをみても前年を上回っている。
,,○,テーマパーク（職員）,,・宿泊の予約状況が前年を上回っており、良い感触である。
,,○,ゴルフ場（従業員）,,・毎年夏場は客が減少するが、今年は増加しているようである。
,,○,パチンコ店（従業員）,,"・ボーナスが出たため、個人単価が上昇した。
・サミットの影響で遠出を控えた人で店はにぎわった。"
,,○,旅行代理店（従業員）,,・個人旅行が好調だが、出発間際に申し込む、安近短の傾向がある。
,,○,タクシー運転手,,・猛暑の影響で短距離ではあるが、乗車数は増加した。
,,○,タクシー運転手,,・わずかではあるが、夜の繁華街が活気付いてきており、同時にタクシーの乗車率も良くなってきている。
,,○,住宅販売会社（従業員）,,・住宅ローン減税が影響し、公庫の申込が多かった。
,,□,商店街（代表者）,,・通販は良いが店頭売りは変わらず、全体的に大きな変化はない。
,,□,一般小売店［鮮魚］（従業員）,,・店頭で客と接していて、あまり変化がないように感じる。
,,□,百貨店（販売促進担当）,,・ギフトをとっても単価は低く、個数も少なく、個人消費の伸びは今一つ変化がみられない。
,,□,スーパー（店長）,,・客数は増加したが単価が低く、特に生鮮食品が悪い。
,,□,コンビニ（エリア担当）,,・客数も増加しないし、客単価も依然低迷したままである。
,,□,家電量販店（店員）,,・猛暑の影響でエアコンが売れるが、一緒に他の物も購入しようとはしない。
,,□,スナック（店長）,,・７月は地元のあちこちの神社で祭があり、人々が夜遅くまで出かけるので客足が伸びない。
,,□,都市型ホテル（スタッフ）,,・サミット効果を期待したが、客が自粛して少なかった。
,,□,パチンコ店（従業員）,,・７月はボーナス時期にもかかわらず、予想に反して良くなかった。
,,□,タクシー運転手,,・サミットのときに少しにぎわったくらいで、全然変わっていない。
,,□,住宅販売会社（従業員）,,・売上も来場者数も変わらない。
,,▲,商店街（代表者）,,・消費行動が活発になる時期なのに、一向に良くならない。
,,▲,百貨店（営業担当）,,・入店者が減少し、売上単価も低下し、店頭の売上は厳しい。
,,▲,スーパー（店長）,,・景気低迷の影響の少ない子供服の売上まで減少気味であり、価格が徹底的に安くないと品数が動かない状況。
,,▲,スーパー（店長）,,・ボーナスカットの話も聞こえ、消費も低迷している。
,,×,高級レストラン（スタッフ）,,・連休明けから客が少なく、売上が15％ほど悪くなった。
"企業
動向
関連

(九州)",,◎,精密機械器具製造業（経営者）,,・現在追加注文に応じきれず、断っている状態である。
,,○,電気機械器具製造業（経営者）,,・季節商材に支えられた売上がある。
,,○,輸送業（従業員）,,・建材関係の受注が増加してきている。
,,□,電気機械器具製造業（経営者）,,・半導体関連の動きに波があり、このまま良くなったり、悪くなったりで推移する様子である。
,,□,輸送業［倉庫］（従業員）,,・お中元も期待外れでメーカーは物流業者に在庫を買ってもらっているのが実状である。
,,□,輸送業［陸上貨物］（従業員）,,・配達１件当たりの単価は若干上昇しているものの、受注件数の落ち込みが激しく、全体の売上が減少している。
,,▲,農林水産業（経営者）,,・加工品の素材原料などは輸入品との競争で厳しい現状にあり、思ったより伸び悩んでいる。
,,▲,電気機械器具製造業（経営者）,,・新規の受注が減少してきている。
,,▲,輸送用機械器具製造業（経営者）,,・地域で大型倒産が２件続き、かなり影響を受けている。
,,×,－,－,
"雇用
関連

(九州)",,◎,－,－,
,,○,人材派遣会社（社員）,,・３か月前に比べ売上が20％増加した。
,,○,求人情報誌製作会社（総務担当）,,・求人倍率は厳しいが、営業職やＩＴ関連の中途採用は微増ながら良くなってきている。
,,□,人材派遣会社（社員）,,・売上は悪くはないが、企業内自己啓発のセミナー、受講生が減少してきている。
,,□,求人情報誌製作会社（編集者）,,・ＩＴ関係の企業は派遣社員、パート等多く募集しているが、企業の正社員の募集は少なく、まだ安定した雇用状態にはなっていない。
,,▲,－,－,
,,×,－,－,
