Ⅰ．景気の現状に対する判断理由,,,,,
,,,,,
　景気の現状に対する判断の理由について、その主だったもの及び特徴的と考えられるものを取りまとめると以下のとおりであった。,,,,,
,,,,,
,,,,,
　１．北海道,,,,,
,,,,（－：回答が存在しない、＊：主だった回答等が存在しない）,
分野,,景気の現状判断,業種・職種,景気の現状に対する判断理由,
"家計
動向
関連

(北海道)",,◎,－,－,
,,○,商店街（代表者）,,・周辺の状況をみると、飲食や旅行に関する財布のひもがゆるくなってきている。
,,○,百貨店（売場主任）,,・レジ待ちの客数は伸びていないが、客単価は上昇してきている。ただし、法人はお中元の動向をみても、良い状況とは言えない。
,,○,スーパー（企画担当）,,・客単価がここ１、２か月、前年と同じくらいに上昇してきている。
,,○,コンビニ（エリア担当）,,・前半の天候が良くて、売上が非常に好調に推移している。
,,○,家電量販店（店員）,,・AV関係があまり良くないが、今月もエアコンの売上が好調に推移しており、若干客単価が上昇してきている。
,,○,高級レストラン（スタッフ）,,・有珠山噴火の影響で観光客の入込が４月以降はどん底であったが、今月に入り少し増加している。
,,○,高級レストラン（経営者）,,・７、８月は観光シーズンであり、今のところは観光客の来店が増加している。
,,○,一般レストラン（スタッフ）,,・来客数、売上ともに増加し、回復傾向にある。
,,○,スナック（経営者）,,・７月になってから観光客が来店し、少しはにぎやかになっている。
,,○,その他飲食［酒卸］（店長）,,・７月は非常に忙しい日が多かった。ただし、内訳をみると、必需品や低価格の商品が中心である。
,,○,観光型ホテル（役員）,,・洞爺湖が７月中旬にオープンした。ただし、登別が若干落ち込んだ。定山渓は順調に推移している。
,,○,旅行代理店（従業員）,,・道内の諸問題が解決して、客が動き出している。
,,○,タクシー運転手,,・北海道の場合は今が一番良い季節なので、人々の動きも４、５月より活発になっており、我々の職業（運転手）も売上が少し増加してきている。
,,□,商店街（代表者）,,・周辺の話を聞くと、ボーナスが支給されないところがあり、活気がみられない。
,,□,コンビニ（エリア担当）,,・前半は天候も良く売上が増加したが、後半に入り雨が降ったとたんに予想以上に売上が低迷している。
,,□,衣料品専門店（店長）,,・２か月前から置いている低額商品は、客の飛びつきが良く、売上に貢献しているが、高額商品の売上は低迷している。
,,□,家電量販店（店長）,,・依然として、客は必要な物しか購入しない状況が続いており、高額商品の販売が低迷し、単価の低下が続いている。
,,□,一般レストラン（スタッフ）,,・前月までは、売上の前年比の伸び率が上昇したが、今月に入り、北海道では暑さもないせいか、前年の売上を下回っている。
,,□,旅行代理店（従業員）,,・良くなっている様相、悪くなっている様相、それぞれ様々である。
,,□,タクシー運転手,,・北海道観光の最盛期である７月になっても、タクシーの利用客が増えず、実車率、乗客率が減少している。
,,□,タクシー運転手,,・固定客の利用回数の減少とともに、一般客の利用度合いに回復の兆しが依然としてみえない。
,,□,美容室（経営者）,,・来客数が減少したままであり、今月前半は良かったが、後半は減っている。
,,▲,一般小売店［土産］（店員）,,・有珠山噴火の影響が去り、７月は売上が増加すると期待したが、実際にはそれほど増加していない。
,,▲,百貨店（売場主任）,,・お中元を始めとするボーナス商戦の時期であるが、３か月前と比べ、売上の伸び率が大きく低下し、客単価も低下している。
,,▲,百貨店（売場主任）,,"・７月に入って、お中元商戦が大変厳しい状態である。
・化粧品関係、夏物セールともにまとめ買いが少なく、単価も低下している。"
,,▲,スーパー（企画担当）,,・７月の気温の上昇が前年に比べ緩やかであり、ドリンク、アイスクリーム等の売上が伸び悩んでおり、消費動向は総じて厳しい状況が続いている。
,,▲,スーパー（店長）,,・引き続き客数は前年水準を維持しているが、客単価、回転数が低下している。
,,▲,乗用車販売店（経営者）,,・雪印、そごう問題でマーケットに不安感が出てきており、消費活動も消極的になっている。
,,▲,自動車備品販売店（店長）,,・来客数が減少しており、オーディオ、カーナビ等の販売台数も減少している。
,,▲,高級レストラン（スタッフ）,,・観光客が主体となるこの時期、航空運賃改定が足かせとなって企業のツアーの入込が減少している。
,,▲,スナック（経営者）,,・週末に街中にいるのはほとんど若者であり、スナックの客は少ない。
,,▲,タクシー運転手,,・新しく入社する乗務員の中に、企業の倒産、リストラなどで転職してくる人が多くみられる。
,,▲,タクシー運転手,,・期待をしている７、８月の観光シーズンであるが、層雲峡、天人峡、美瑛、富良野方面の観光予約が全くない。
,,×,商店街（代表者）,,・ボーナスが出ない企業が前年より多く、まだまだ売上が回復するような状況にはみえない。
,,×,百貨店（売場主任）,,・夏のセール価格でも客に買ってもらえない。
,,×,住宅販売会社（従業員）,,・住宅業界では、一戸建て住宅の受注が低迷している。
"企業
動向
関連

(北海道)",,◎,－,－,
,,○,非製造業［建設機械レンタル］（総務担当）,,・全体的に売上が上向きであり、特に、今まで悪かった旭川地区が良くなっている。
,,○,その他企業［コンベンション担当］（従業員）,,・客単価は低下しているが、利用者数は増加しており、全体的にみて、そこそこ良くなっている。
,,□,家具製造業（経営者）,,・そごうの民事再生法適用の関係によって株価も低迷しているし、耐久消費財の買い控えも改善傾向にない。
,,□,輸送業（総務担当）,,・公共投資の影響等で、一部の荷動きが良くなっている面もあるが、口蹄疫や雪印の問題の影響もあり、期待したほどに動きが活発ではない。
,,□,司法書士,,・不動産取引は、土地、建物いずれも低調である。
,,□,司法書士,,・家具業界が相変わらず不振のところに、そごう問題の影響もあり、売上が減少しているようで、相変わらず景気は悪い状態が続いている。
,,▲,広告代理店（従業員）,,・雪印乳業の問題の影響を受けて、関連商品の消費も、広告発注も減少している。
,,×,非製造業［建設機械リース］（支店長）,,・取引先並びにその周辺、客の話を聞くと、経営難や設備投資の抑制等、かなり悪い状態である。
"雇用
関連

(北海道)",,◎,－,－,
,,○,求人情報誌製作会社（編集者）,,・アルバイト、パートの求人数が好調で、求人する企業の業種が少しずつ広がっている。
,,○,求人情報誌製作会社（編集者）,,・前年５月以来、求人件数は前年比プラスを続けていたが、今月に入りその比率が一段と上昇している。
,,○,新聞社［求人広告］（担当者）,,・業種によるばらつきはあるが、総体的には良好になってきている。
,,□,人材派遣会社（社員）,,・派遣の受注、売上は増加しているが、内訳をみると、欠員補充の派遣社員が多いで、景気は上向いているとは言えない。
,,□,求人情報誌製作会社（編集者）,,・求人広告取扱件数が横ばい状況である。
,,□,新聞社［求人広告］（担当者）,,・企業のリストラ傾向は一段落したが、残った社員の労働条件が厳しくなって退社したり、穴埋めにパート社員を使ったりしている。
,,▲,－,－,
,,×,－,－,
,,,,,
　２．東北,,,,,
,,,,（－：回答が存在しない、＊：主だった回答等が存在しない）,
分野,,景気の現状判断,業種・職種,景気の現状に対する判断理由,
"家計
動向
関連

(東北)",,◎,－,－,
,,○,百貨店（広報担当）,,・夏物のセールやお中元商戦などにより売上が増加している。
,,○,テーマパーク（職員）,,・入場者数は前年実績を上回って推移しており、まだ予約が入り続けている。
,,○,タクシー運転手,,・タクシーの乗客が、途切れなくなってきている。
,,○,タクシー運転手,,・今月は、平均して売上が良い。
,,○,美容室（経営者）,,・好天が続き、子供連れや盆前の客が多くなっている。
,,□,商店街（代表者）,,・７月上旬のバーゲン終了後、購買意欲が低下している。
,,□,商店街（代表者）,,・お中元シーズンではあるが、前年に比べて今一つの感じがある。
,,□,百貨店（企画担当）,,・来客数は伸びているが、購買に結びついていない。
,,□,百貨店（総務担当）,,・客数は伸びているが、必要な物しか購入しないため、客単価は低迷したままである。
,,□,スーパー（店長）,,・ここ２、３か月は、客数が横ばいで客単価が前年を大きく割り込む傾向が続いている。
,,□,衣料品販売店（店長）,,・20～40代のビジネスマンのスーツの購入が慎重になっている。
,,□,衣料品専門店（店長）,,・暑さの割に夏物の売行きが良くない。
,,□,乗用車販売店（従業員）,,・売上は一進一退の状況が続いている。
,,□,高級レストラン（スタッフ）,,・客数、客単価とも、３か月前と変わらない。
,,□,観光型ホテル（経営者）,,"・選挙のときに、キャンセルや延期をした客が、半数しか戻っていない。
・客のほとんどが家族連れで、利用単価が低い。"
,,□,都市型ホテル（スタッフ）,,"・客数は増加しているが、消費単価が依然として低下している。
・デパートにある惣菜の店舗は、好調に利用客が伸びている。"
,,□,都市型ホテル（経営者）,,・季節要因もあるが、春のころの勢いがみられない。
,,□,遊園地（経営者）,,・イベントのときはともかく、それ以外は一般の客数は伸びない。
,,□,競輪場（職員）,,・競輪の売上が、前年同期比１割減で推移している。
,,□,旅行代理店（従業員）,,・有珠山やサミットの影響で、夏の旅行需要が伸び悩んでいる。
,,□,旅行代理店（従業員）,,・夏休みの家族旅行の申込が多くなっているが、低価格志向が強い。
,,□,美容室（経営者）,,・ボーナス時期なのに購買意欲が高まらず、差し控えているように感じる。
,,▲,百貨店（売場主任）,,・来客数、売上ともに２～３％減少している。
,,▲,百貨店（企画担当）,,"・これまで若者衣料の不振が続いていたが、今月は婦人衣料も不振である。
・お中元ギフトの売上も前年の80％で推移しており、大変苦戦している。"
,,▲,百貨店（売場主任）,,"・ボーナスが出たにもかかわらず、消費者の購買動向は、悪くなっている。
・バーゲン品の売行きに勢いが感じられない。"
,,▲,スーパー（企画担当）,,"・特売でも、客の選別の目が厳しくなっている。
・客単価の低下幅が大きくなってきている。
・雨の日は以前よりも売上の落ち込みが大きく、客が無理をして外出しなくなっている。"
,,▲,その他専門店［酒類］（経営者）,,・消費者の購買動向をみると、再び低価格傾向にあり、客単価が低下している。
,,▲,高級レストラン（スタッフ）,,・週末は前年度の売上を確保しているが、平日の落ち込みが大きく、全体としてやや悪くなっている。
,,▲,一般レストラン（経営者）,,・６月は客数、売上ともに２けた減となっており、７月もこの傾向は変わらない。
,,▲,その他飲食［和食］（経営者）,,・来客数は安定しているが、客単価の低下から売上は減少している。
,,▲,観光型ホテル（経営者）,,・客の宿泊申込の時期が遅くなっており、単価も低下している。
,,▲,都市型ホテル（スタッフ）,,・宴会の受注件数が減少している。
,,▲,競馬場（職員）,,"・１人当たりの購入金額が小さくなっている。
・３か月前に比べて売上が減少している。"
,,▲,設計事務所（職員）,,・春先に比べ住宅着工が伸び悩んでいる。
,,▲,住宅販売会社（従業員）,,"・広告チラシによる来場客数が減少している。
・自己資金、年収が少ない客などが多く、３か月前よりも景気が悪くなっているように感じる。"
,,×,一般レストラン（経営者）,,・客数、売上ともに減少している。
,,×,スナック（経営者）,,・夏休み前のため、客の入りが良くない。
"企業
動向
関連

(東北)",,◎,－,－,
,,○,新聞販売店［広告］,,・ここ２、３か月続けて折込チラシの数が増加している。
,,○,輸送業［航空貨物］（従業員）,,・航空貨物取扱量が順調に増加している。
,,□,食料品製造業（従業員）,,・多少上向いていたのが、雪印の食中毒やそごうの破綻の影響で、出荷・販売が減少している。
,,□,木材木製品製造業（経営者）,,・製材業における値動きが、地場、首都圏ともに停滞気味である。
,,□,電気機械器具製造業（経営者）,,・パソコンや携帯電話などの関連会社は、忙しそうにしているが、従来の製品の製造は減少傾向にある。
,,□,広告代理店（従業員）,,・受注のペースに大きな変化がない。
,,□,輸送業（経営者）,,・貨物輸送量が一進一退の状況である。
,,□,経営コンサルタント,,・診断先企業のリストラがまだ終わっていない。
,,▲,食料品製造業（経営者）,,・そごう倒産の影響からか、飲食店向けやお中元ギフト向け製品の出荷・販売が不振である。
,,▲,食料品製造業（従業員）,,・お中元セールが始まったものの、お中元ギフト用製品の単価が低下し、数量が減少している。
,,×,－,－,
"雇用
関連

(東北)",,◎,－,－,
,,○,人材派遣会社（社員）,,・メーカー系を中心に新規事業の取組があり、それを担う人材募集などの話が多くなってきている。
,,○,新聞社［求人広告］（担当者）,,・求人広告が上向いている。
,,□,人材派遣会社（社員）,,・正社員補充のための派遣需要が高まっている。
,,□,人材派遣会社（社員）,,・大きな注文はなく、限られた一部の業種に、多少前向きの話がある程度である。
,,▲,－,－,
,,×,－,－,
,,,,,
　３．関東,,,,,
,,,,（－：回答が存在しない、＊：主だった回答等が存在しない）,
分野,,景気の現状判断,業種・職種,景気の現状に対する判断理由,
"家計
動向
関連

(関東)",,◎,－,－,
,,○,一般小売店［精肉］（従業員）,,・時期的なものとギフト等が動いているのでやや良くなっているが、前年に比べてそれほど大きな変化はない。
,,○,百貨店（販売促進担当）,,"・７月に入り、お中元ギフトが好調である。
・個人部門、法人部門ともに、客数、売上の減少に歯止めがかかってきており、非常に良くなっているという手ごたえがある。"
,,○,百貨店（買付担当）,,"・前年に比べて、セールの時期が早まったこと、気温が上昇したことにより、来客数が増加している。
・婦人服ではＴシャツ、カットソーを中心とする夏物商材がよく売れている。"
,,○,コンビニ（店長）,,・天候の良い日が続き、商品が比較的よく売れている。
,,○,コンビニ（店長）,,・売上が大きく増加している。
,,○,一般レストラン（支配人）,,"・法人需要が増加し、客単価も上昇している。
・ＩＴ関連等の特定企業、リピーターによる売上が主であるため、景気が全体的に良いとは言えない。"
,,○,都市型ホテル（スタッフ）,,"・７月に入り客の動きが良くなっている。
・景気が多少上向いているという客の話が出てきている。"
,,○,タクシー運転手,,・駅構内での午後10時以降の乗り場開放が廃止されたため、回転率が良くなり、営業収入は増加している。
,,○,その他サービス［学習塾］（経営者）,,・前年に比べて、夏季講習の受講生がやや増えている。
,,□,百貨店（売場主任）,,"・営業日の増加、ギフトセンターの商品券売上の伸び、競合店の不振により、前年に近い売上を何とか維持できている。
・それらの要因を除くと、特に衣料品等の中心商材で依然苦戦しており、売上は決して良くない。"
,,□,スーパー（店長）,,"・衣料品の売上が回復しない。特に紳士、子供服関連が悪く、前年比で20％減少している。
・エアコンやタオルケット等の生活必需品は、前年並みに回復している。
・土用の丑の日には安いうなぎ弁当が売れたが、高い物は売れなかった。"
,,□,衣料品専門店（従業員）,,・商品の低価格化に伴い、客の購入単価が相変わらず低く、購入客数も増加しない。
,,□,乗用車販売店（従業員）,,・高額車種の販売が依然として低迷しており、売上単価が上昇しない。
,,□,一般レストラン（経営者）,,・客数は増加せず、客単価も上昇しない。
,,□,都市型ホテル（スタッフ）,,・客の話から、景気が特に上向いているとは感じられない。
,,□,ゴルフ場（支配人）,,"・ゴルフ場の予約状況が相変わらず悪く、割引をしてほしいとの話が多い。
・客単価が依然低く、状況は全く変わっていない。"
,,□,競馬場（職員）,,・７月の売上の前年比は88％であり、ほぼ同じ水準で変わっていない。
,,□,その他レジャー施設［アミューズメント］（職員）,,・来場客数には増加の兆しがみられるが、客の消費態度は相変わらず厳しく、客単価の上昇につながっていない。
,,□,旅行代理店（従業員）,,・申込件数、問い合わせ件数は非常に多いが、消費者の購買力は低下していて、受注は減少している。ただし、夏休みの時期であるので、受注は一時的にかなり良い。
,,□,タクシー運転手,,・長野ではそごう等の大型店閉鎖で人通りが少なくなり、商店街は大きな打撃を受けているが、その影響でタクシー業界も厳しい。
,,□,その他サービス［フィットネスクラブ］（支配人）,,・来館数は横ばいであり、客の消費動向が上向いているようには見受けられない。
,,▲,百貨店（広報担当）,,・売上は衣料品を中心に前年実績を下回っている。
,,▲,自動車備品販売店（経営者）,,"・車両販売等が若干低迷している。
・身近なところで企業倒産がみられ、財布のひもがきつくなっている。"
,,▲,高級レストラン（支配人）,,"・食堂部門は売上、利用客数が若干減少し、単価も若干低下している。
・宴会部門の受注も低迷している。"
,,▲,スナック（経営者）,,・新規の客が減少し、常連客も少ない。
,,▲,ゴルフ練習場（従業員）,,・客の状況や客との会話では、景気は悪い方向に向かっている。
,,▲,その他サービス［語学学校］（営業担当）,,・入学者数、問い合わせ件数いずれもかなり少ない。
,,×,商店街（代表者）,,"・暑くなっても、雨が降っても人出が良くない。街中の人通りがなく、寂しくなっている。
・客は特価品以外の商品を購入しないという状況が続いている。"
,,×,スナック（経営者）,,・ボーナスシーズンの時期に、団体客が少なくなっている。
"企業
動向
関連

(関東)",,◎,－,－,
,,○,その他企業［情報サービス］（従業員）,,・サミットでいくつかの受注があり、景気はやや良くなっている。
,,○,その他企業［情報サービス］（従業員）,,・安定した受注はあるが、人手不足で対応しきれない状態が続いている。
,,□,食料品製造業（経営者）,,・年初から贈答用の商品を買う客がなく、お中元シーズンでも同様の状況が続いている。
,,□,電気機械器具製造業（経営者）,,・売上は４月と比べても、例年と比べても変化がない。
,,□,輸送用機械器具製造業（経営者）,,"・夏休みが終わらないと業況は良くならない。
・町工場の中では、廃業、倒産という話が多い。"
,,□,その他製造業［プラスチック製品］（経営者）,,・受注量が変化していない。
,,□,非製造業［廃棄物処理］（経営者）,,・注文数等に顕著な変化がみられない。
,,□,広告代理店（従業員）,,・毎月の決まった仕事以外に新規の受注はなく、変わらない。
,,□,税理士,,"・中小企業の納品価格は随分たたかれていたが、少しずつ戻しているようである。
・事務所から駅までの道で、店舗の撤退、吸収合併が相次いでいる。"
,,▲,＊,＊,
,,×,－,－,
"雇用
関連

(関東)",,◎,人材派遣会社（社員）,,・求人数が増加している。
,,○,＊,＊,
,,□,人材派遣会社（社員）,,"・業種によっては季節的に雇用を増やしている企業が見受けられるが、全体的に大きな変化はない。
・好調な企業と今後もリストラをしていく企業の二極化が見受けられる。"
,,▲,新聞社［求人広告］（営業担当）,,"・この２、３か月の間に倒産する企業が相次ぎ、関連企業を含めると今後相当の影響が予想される。
・例年、売上が増加する時期であるのに、今年は横ばい状態であり、どのようにして売上を増やすのか、全く先がみえない企業が多い。"
,,×,人材派遣会社（社員）,,・そごう倒産の影響で、出店していたメーカーが倒産し、販売員が解雇されている。
,,,,,
　４．東海,,,,,
,,,,（－：回答が存在しない、＊：主だった回答等が存在しない）,
分野,,景気の現状判断,業種・職種,景気の現状に対する判断理由,
"家計
動向
関連

(東海)",,◎,＊,＊,
,,○,スーパー（店長）,,"・早い夏の到来で水物、夏果物、バーベキュー材料などの季節商材が順調に動き、全体の売上を押し上げている。
・雪印問題については、客の消費動向に影響はなかった。"
,,○,スーパー（店長）,,・ボーナスもあり高額品の時計などが動いたため、徐々に良くなっている。
,,○,コンビニ（エリア担当）,,・人気ゲームソフトの発売があり、売上が大きく伸びてきている。
,,○,コンビニ（店長）,,・猛暑により、今年に入って初めてビールの売上が前年を少し上回り、売上の減少がやや小さくなっている。
,,○,乗用車販売店（従業員）,,・相変わらず利益率は悪いが、売上は確実に増加している。
,,○,乗用車販売店（従業員）,,・商品次第ではあるが、チラシなどで宣伝すると即決する客が増加している。
,,○,高級レストラン（スタッフ）,,・家族での来客が好調であり、遅い時間の来客数も増加している。
