Ⅰ．景気の現状に対する判断理由,,,,,
,,,,,
　景気の現状に対する判断の理由について、その主だったもの及び特徴的と考えられるものを取りまとめると以下のとおりであった。,,,,,
,,,,,
,,,,,
　１．北海道,,,,,
,,,,（－：回答が存在しない、＊：主だった回答等が存在しない）,
分野,,景気の現状判断,業種・職種,景気の現状に対する判断理由,
"家計
動向
関連

(北海道)",,◎,自動車備品販売店（店長）,,・スタッドレスタイヤを中心に高額商品の売上が増加している｡
,,○,商店街（代表者）,,・デパートのバーゲン効果もあり、来客数が増加している。
,,○,百貨店（売場主任）,,・野球、サッカーなどの明るい話題による商戦での経済効果が非常に大きい。
,,○,スーパー（店長）,,・大型ショッピングセンターが市街地にオープンしたため、郊外に流れていた管内や郡部から客の流れが市街地へと変わり、売上が増加した。
,,○,一般レストラン（スタッフ）,,・野球の優勝セールの効果があり、来客数が増加している。
,,○,観光型ホテル（スタッフ）,,・観楓会のシーズンでもあり、洞爺湖地域の入込は例年の６割程度にまで回復している。
,,○,観光型ホテル（経営者）,,・入込客数の減少幅がやや改善されている。
,,○,旅行代理店（従業員）,,・個人需要は引き続き活発であり、法人需要もやや上向き加減になっている。
,,○,旅行代理店（従業員）,,・国内旅行が堅調に推移し、本州方面への航空機の利用が増加している。
,,○,美容室（経営者）,,・客から、郊外のレストランなどで待たされることが多くなっているという話を聞く。
,,□,商店街（代表者）,,・先行きが不安なため、個人消費に生活防衛の傾向がみられ、買い控え傾向が強くなっている。
,,□,百貨店（売場主任）,,・野球の優勝セールなどでは婦人服、雑貨物は好調であるが、ヤング物を中心とした婦人、紳士服の売上が不振であり単価も低下しており、全体として変わらない。
,,□,百貨店（売場主任）,,・例年と違い、コート等の高額商品がこの時期になっても動きがない。
,,□,百貨店（販売促進担当）,,・化粧品、洋品雑貨は好調であるが、ヤング向けの婦人、紳士物の売上が減少している。
,,□,コンビニ（エリア担当）,,・客１人当たりの買上点数が減少したままである。
,,□,コンビニ（エリア担当）,,・天候が良く来客数は増加したが、客単価が低下している。
,,□,家電量販店（店員）,,・メーカーの出荷状況をみると変化がみられない。
,,□,乗用車販売店（従業員）,,・久しぶりにモデルチェンジ車を発売したが、新車に買換える客が少ないようであり、期待どおりの売上になっていない。
,,□,タクシー運転手,,・寒くなると、例年、利用客数が増加するが、今年はそのような傾向がまだみられない。
,,□,タクシー運転手,,・大型デパートの開店に伴う売上増加を期待したが､期待外れだった。
,,□,設計事務所（所長）,,・これから先の仕事の受注が徐々に出てきている。
,,▲,商店街（代表者）,,・周辺で小売業者の倒産、廃業が増加しており、当店も、売上が増加していない。そごう倒産の影響もある。
,,▲,百貨店（売場主任）,,・野球、サッカーの優勝による効果はあったが、消耗品等、ボリュームゾーンの商品で売上の減少が著しく、全体的にみると売上が変わらない。
,,▲,スーパー（企画担当）,,・プロ野球の優勝セールの効果はあるが、菓子等での一部のヒット商品を除くと、全体の売上動向は厳しさを増している。生鮮野菜、衣料品の単価の低下が続き、買上点数も減少している。
,,▲,スーパー（店長）,,・大きな変化はないが、客単価、商品単価、商品回転数が低下している。
,,▲,スーパー（店長）,,・セールで一時的に売上が増加するが、通常の売上が増加しておらず､単価も低下している。
,,▲,コンビニ（エリア担当）,,・来客数は増加したが、客単価が非常に低下しており、買い控えがみられ、売上が減少している。
,,▲,乗用車販売店（従業員）,,・新型車はそこそこ売れているが､既販車は低迷している。イベントを実施しても来客数が不調である。
,,▲,乗用車販売店（従業員）,,・高級車種の商談が少ない。
,,▲,住関連専門店（営業担当）,,"・来客数は増加しているが、客単価が低下しており、売上が増加していない。
・ブランド志向も根強いが､低価格志向も浸透している。"
,,▲,高級レストラン（スタッフ）,,"・宴会やレストランの利用が週末に集中し、平日の来客数が減少している。
・宿泊に関しても、端境期となり、売上が低調になってきている。"
,,▲,高級レストラン（スタッフ）,,・昼食の来客数が減少し、客単価も低下している。
,,▲,高級レストラン（経営者）,,・今年は、例年に増して夏期の観光シーズン以降の売上の減少が著しい。
,,▲,観光名所（職員）,,・例年なら観光客が集中する場所が空いている。
,,▲,美容室（経営者）,,・来客数、売上が減少し、客単価も低下している。
,,▲,設計事務所（所長）,,・今月の売上が低迷している。
,,×,スナック（経営者）,,・17年間の営業で最低の売上である。
,,×,スナック（経営者）,,・地元企業が非常に低迷しているので、宴会、観楓会で繁華街に出ることが少なくなり､周囲で廃業する店も多い。
,,×,その他飲食［酒卸］（店長）,,・特別なこと以外での外食機会が少ないためか、創業以来でみて、売上が特に悪い。
"企業
動向
関連

(北海道)",,◎,食料品製造業（団体役員）,,・食品中毒事故による販売への影響が沈静化してきたなかで、秋の行楽需要期に入り、受注が活発化している。
,,◎,通信業（営業担当）,,・売上が増加しており、新しい投資のプランも若干立ち上がってきている。
,,○,輸送業（支店長）,,・目に見えるような回復はないが、農産物、製紙、鉄鋼の荷動きが良くなっている。
,,○,その他サービス業［建設機械レンタル］（総務担当）,,・良いという具体的な材料は見当たらないが、各地区の販売責任者の報告や、客の動向をみると、やや良くなっている。
,,○,その他企業［コンベンション担当］（従業員）,,・12月の忘年会の予約の入りが遅いが、10月の売上は増加している。
,,□,食料品製造業（経営者）,,・最も経済効果が期待されたプロ野球の優勝セールも、当地では効果が低い。
,,□,通信業（営業担当）,,・通信業は状況が良いが、社会全般では沈滞ムードがあり、まだＩＴのすそ野が広がっていない。
,,□,その他サービス業［建設機械リース］（従業員）,,・リース案件の引き合い状況が依然として低調である。
,,□,その他サービス業［建設機械リース］（営業担当）,,・仕入メーカーの中間期決算状況が良くない。
,,▲,家具製造業（経営者）,,・大手百貨店の破綻等もあり、厳しい状況になっている。
,,▲,出版・印刷・同関連産業（経営者）,,・道内の地場の会社が、全国規模の会社に吸収･統合されているケースが多く、従来地元企業へ発注していたものが､本社等がある道外の企業に発注されている。
,,▲,輸送業（総務担当）,,・価格が低下し、取扱量もやや減少している。
,,▲,金融業（企画担当）,,・北海道の経済を支えている建設業が､公共事業の減少や住宅着工の伸び悩みで苦しい状況にある。
,,▲,その他サービス業［建設機械リース］（支店長）,,・12月の資金繰りがつかないという声が周りから聞こえてくる。
,,×,＊,＊,
"雇用
関連

(北海道)",,◎,人材派遣会社（社員）,,・２、３か月前に比べて派遣先企業からのオーダーが増加している。
,,○,求人情報誌製作会社（編集者）,,・例年は10月ごろから徐々に求人数が減少する傾向にあるが､今年は９月よりも求人数が増加している。
,,○,職業安定所（職員）,,・新規求人数が増加している。
,,○,職業安定所（職員）,,・求職者数は横ばい状態であり、求人数は３か月前より増加している。ただし、求人数は求職者数の半分程度である。
,,□,求人情報誌製作会社（編集者）,,・求人件数は大幅に増加しているが、採用まで時間がかかるケースも出てきている。
,,□,求人情報誌製作会社（編集者）,,・農業の収穫期でもあり、農産物の２次加工関連の求人数が増加しているが、小売関連の求人数が伸び悩んでいる。
,,□,新聞社［求人広告］（担当者）,,・求人件数は増加しているが、希望の多い事務職は求人数が減少している。
,,▲,人材派遣会社（社員）,,・取引先の状況が、３か月前に比べて、売上の増加、停滞、減少など様々であるが、総じて悪い傾向である。
,,×,－,－,
,,,,,
　２．東北,,,,,
,,,,（－：回答が存在しない、＊：主だった回答等が存在しない）,
分野,,景気の現状判断,業種・職種,景気の現状に対する判断理由,
"家計
動向
関連

(東北)",,◎,観光名所（職員）,,・周囲で残業している企業が多くなっている。
,,○,一般小売店［カメラ］（店員）,,・行楽シーズンで、消費者がお金を使っている。
,,○,一般小売店［カメラ］（店長）,,・旅行の写真現像が増えている。
,,○,百貨店（売場主任）,,・ジャイアンツ優勝セールの影響で、売上が増加している。
,,○,百貨店（売場主任）,,・10月の大型催事の影響で、売上が前年比５％増加し好調である。
,,○,百貨店（営業担当）,,・客数が130％以上増加しており、客の購買意欲も上がっている。
,,○,スーパー（店長）,,・１人当たりの平均買上点数が前年並みに回復している。
,,○,乗用車販売店（営業担当）,,・来店客数が増加している。
,,○,その他専門店［呉服］（経営者）,,・寒くなり、秋物商材が動き出した。
,,○,観光型旅館（経営者）,,"・宿泊客数が前年を上回っている。
・１人当たりの単価も下げ止まりつつある。"
,,○,都市型ホテル（経営者）,,・結婚式や宴会などの予約が増加している。
,,○,テーマパーク（職員）,,・年末の忘年会プランや海外からの客数が増加している。
,,○,住宅販売会社（経営者）,,・住宅の受注が増加し、前年を上回る実績を挙げている。
,,□,商店街（代表者）,,・10月は各種イベントが多く、来街者数は増えたが、売上高は変わらない。
,,□,一般小売店［書籍］（経営者）,,・雑誌の売上が低迷している。
,,□,百貨店（総務担当）,,"・単品買いの客が多く、売上の増加には結び付かない。
・まとめ買いをする客が減少している。"
,,□,百貨店（企画担当）,,・セールの影響で売上が増加したが、秋冬物の売行きが悪く全体的に苦戦している。
,,□,百貨店（総務担当）,,"・高額品がまだ動いていない。
・ファッション性の高い商品の動きが特にミセス層において弱い。
・催事で客数が増加しても、買上単価が低下している。"
,,□,スーパー（経営者）,,・客数は増えているが、１人当たりの買上単価は低下している。
,,□,スーパー（店員）,,・冬物商材の売行きが悪いため変わっていない。
,,□,スーパー（総務担当）,,・日々の客数の推移や客単価は前年割れを続けている。
,,□,スーパー（経営者）,,・客の節約志向の購買行動による買上点数の伸び悩みや、競争激化による相場安で１品単価が下落し、依然として消費支出は厳しい。
,,□,衣料品専門店（経営者）,,・郊外大型店の相次ぐ出店にもかかわらず、売上は５％程度の低下で止まっている。
,,□,衣料品専門店（店長）,,"・客単価の低下が続いている。
・客が必要最低限の物しか買わないため、前年に比べ悪い状況が続いている。"
,,□,衣料品専門店（店長）,,"・必要以上に余計な物を買わない客が多い。
・客単価も上がる傾向にはない。"
,,□,乗用車販売店（従業員）,,・上級車の売上が伸びず、小型車、普通車も伸びないため全体的な売上が減少している。
,,□,乗用車販売店（経営者）,,"・輸入車の契約が伸びず、成約までに時間を要している。
・来場者が減少している。"
,,□,乗用車販売店（経営者）,,"・原価高の影響で、見積案件はあるが、成約までに時間を要している。
・価格を抑えられ、利益幅が小さくなっている。"
,,□,一般レストラン（経営者）,,・回転寿司に来る客も低価格志向で、多くの客が100円の皿を食べている。
,,□,観光型ホテル（経営者）,,・客数は例年並みであるが、利用単価が低く団体客も減少しており、売上が伸びない。
,,□,都市型ホテル（スタッフ）,,・宿泊、結婚式、宴会等、件数は増えていない。
,,□,観光名所（職員）,,・秋の行楽シーズンを迎え、客数は変わらないが、客単価が前年を下回る傾向が続いている。
,,▲,商店街（代表者）,,・一般消費者の価格に対する反発が大きく、安くしなければ売れない。１品単価の下落はまだ続いている。
,,▲,百貨店（売場主任）,,・衣料品は予定どおり売れたが、雑貨や食品などでは、特に若い層の買い控えが目立っている。
,,▲,スーパー（企画担当）,,・競合店の出店が続いており、客の選別購入の傾向が強まっているため、客数、客単価ともに厳しくなっている。
,,▲,スーパー（経理担当）,,・客の買上点数が夏以降減少している。
,,▲,スーパー（店長）,,・ディスカウントを連続しているため、客は激安価格に慣れ、イベントに対する反応が弱くなっている。
,,▲,コンビニ（エリア担当）,,・イベントの効果がない。
,,▲,衣料品専門店（店長）,,"・単純に３か月前よりも厳しさを肌で感じる。
・客が必要最低限の物だけを購入しているのが目立つ。"
,,▲,家電量販店（総務担当）,,・客数が増加しているにもかかわらず売上が増加していない。
,,▲,家電量販店（店長）,,・新築時の家電製品の購入単価が低下したり、先送りする人が増えている。
,,▲,住関連専門店（経営者）,,・客数の減少や客単価の低下がみられる。
,,▲,その他専門店［酒類］（経営者）,,"・買上単価が低下している。
・チラシ広告を出しても効果が出ない。"
,,▲,その他飲食［和食］（経営者）,,"・単価の低下は下げ止まったが、客数が増加しない。
・周囲のビルに空部屋が目立って増えているのが原因だと思う。"
,,▲,遊園地（経営者）,,・体育の日の天候が悪く、客数が前年実績より低下し、客単価も若干低下している。
,,▲,住宅販売会社（従業員）,,・来場者数が減少し、また客は安い物件に目が向く傾向がある。
,,▲,住宅販売会社（従業員）,,・来店者数が減少し、法人との契約も減少している。
,,▲,住宅販売会社（従業員）,,・受注件数の減少と、低価格志向の高まりで、粗利益が減少している。
,,×,スーパー（経営者）,,・１品単価が下落している。
,,×,観光型ホテル（スタッフ）,,・客数は増加しているが、客単価が低下している。
"企業
動向
関連

(東北)",,◎,－,－,
,,○,食料品製造業（経営者）,,"・９月の売上は、前年比110％で１年ぶりに２けた台に乗り、また10月も106％程度に増加している。
・客の低価格志向にもかかわらず売上が増加している。"
,,○,電気機械器具製造業（企画担当）,,・周囲の部品メーカーでは、受注残を抱え、忙しくなっている。
,,○,電気機械器具製造業（経営者）,,"・加工業者や納入業者は、半年前に比べ受注が増加している。
・当社でも外注業者が忙しく、従来と変わってきた。"
,,○,建設業（従業員）,,・民間の設備投資、計画が増えている。
,,○,建設業（従業員）,,・マンション建設が増えている。
,,○,輸送業（従業員）,,・航空貨物の輸出、輸入が数量、金額ともに増加している。
,,□,農林水産業（従業者）,,・夏の好天候で桃の取引額の上昇を期待したが、実際には低下した。
,,□,食料品製造業（従業員）,,・残暑の影響で、おでんの具などの練り製品の出荷の時期が遅れている。
,,□,木材木製品製造業（経営者）,,"・製材品の荷動きは出荷先によって差があり、好調、不調の繰り返しである。
・価格は底値横ばいが続き、厳しさが続いている。"
,,□,電機機械器具製造業（従業員）,,・半導体関連の設備投資がやや頭打ち状態になってきている。
,,□,建設業（企画担当）,,"・民間の設備投資が、分譲マンションや商業施設中心から製造業の工場、医療福祉施設、大規模開発へと拡大しているが、設備投資全体としてはまだ弱い。
・価格競争が激しく、採算悪化に歯止めがかからない。"
,,□,金融業（営業担当）,,・企業の設備投資に変化がなく、運転資金の動向にも大きな変化がみられない。
,,□,広告代理店（従業員）,,・受注ペースに変化がない。
,,▲,輸送業（従業員）,,・輸送貨物の減少が著しい。
,,×,繊維工業（営業担当）,,・残暑の影響でニットの売行きが悪く、輸入品の増加が追い討ちをかけている。
"雇用
関連

(東北)",,◎,－,－,
,,○,人材派遣会社（社員）,,"・事務関係の派遣社員を募集しても集まりが悪く、また新聞の求人広告が増えている。
・若い女性の求職者が減少した。"
,,○,求人情報誌製作会社（編集者）,,"・支店採用が増えている。
・製造業、小売業、飲食業、サービス業の求人広告が増えている。"
,,○,新聞社［求人広告］（担当者）,,・求人広告数が増加している。
,,○,職業安定所（職員）,,"・求人数が増えている。
・求職者数は変わらないが、職業選択の幅が広がっている。"
,,○,職業安定所（職員）,,・求人数が増加傾向にあり、特にパート求人が前年比５割近く上昇している。
,,○,職業安定所（職員）,,・電気機械器具製造業と小売業を中心に求人が増加している。
,,□,人材派遣会社（社員）,,・通常では正規の社員で行うべき職種を人材派遣会社に代替させる傾向に変わりはない。
,,□,人材派遣会社（社員）,,・求人は一部メーカーで伸びているが、サービス業等への波及は今のところみられない。
,,□,職業安定所（職員）,,"・新規求人数は、前年同時期より増加しているが、派遣や臨時社員の求人が多い。
・新規求職者数はほぼ横ばい状態である。"
,,□,職業安定所（職員）,,・企業からの求人が増加しているが、一方で人員整理も相当規模で行われており、景気はまだ回復していない。
,,□,職業安定所（職員）,,・大きな倒産による離職者の発生はないが、景気が良くなっているという話を窓口を通じて聞いていない。
,,□,職業安定所（職員）,,・有効求職者数と雇用保険受給者数が高水準で推移している。
,,▲,－,－,
,,×,－,－,
,,,,,
　３．北関東,,,,,
,,,,（－：回答が存在しない、＊：主だった回答等が存在しない）,
分野,,景気の現状判断,業種・職種,景気の現状に対する判断理由,
"家計
動向
関連

(北関東)",,◎,－,－,
,,○,百貨店（販売促進担当）,,・８月まで、売上の前年比は平均３％低下していたが、９、10月には、同100％を達成しているので、やや良くなっている。
,,○,一般レストラン（店長）,,・新規に開店したショッピングモールや会社があり、購買意欲が上がっている。
,,○,スナック（経営者）,,・今月だけみると売上は大変良くなっている。
,,○,都市型ホテル（スタッフ）,,・会議、宴会、割烹、各レストランの売上は伸び悩んでいるが、宿泊客は徐々に増えつつある。
,,○,都市型ホテル（経営者）,,・当地（宇都宮）では、緑化フェアの開催が良い経済効果を生んでいる。
,,○,住宅販売会社（経営者）,,・住宅金融公庫の金利が上昇した影響もあり、２、３か月契約を延ばしていた客が、契約を決断してくれた。
,,□,商店街（代表者）,,・客の財布のひもが固く、売上はほとんど変わらない。セールをしても効果がない。
,,□,衣料品専門店（店長）,,・客単価が低下しており、悪い状況はあまり変わらない。
,,□,住関連専門店（店長）,,"・客単価が３か月前から上昇していない。
・必需品の購買はあるが、それ以外の商品には波及しない。"
,,□,旅行代理店（従業員）,,・客の業種によっては景気の良い会社もあるが、依然不況で悩む会社も多数あるため、相殺されて変わらない。
,,□,タクシー運転手,,・原油高の影響で、ガソリンの値段が上がっており、ガソリンスタンドの客は大変辛いようである。
,,□,通信会社（社員）,,・携帯電話の契約台数は、毎月純増となっているが、購買層がヤング層のため、必ずしも景気の動向とリンクしていないので変わらない。
,,▲,商店街（代表者）,,・半額以下のバーゲン品は売れるが、普通の商品は売れない。
,,▲,コンビニ（店長）,,・必要な物、あるいは話題になっている物しか買わないという傾向が続いている。
,,▲,乗用車販売店（経営者）,,・以前に比べ、高級車の売行きが悪く、客数も減少している。客は欲しい商品を購入せずに、より安価な車で妥協している。
,,▲,競輪場（職員）,,・売上は前年や３か月前より数％減少している。
,,▲,設計事務所（所長）,,・自分や仲間の事務所における受注状況から判断すると、やや悪くなっている。
,,×,スナック（経営者）,,・客数が減少している。
"企業
動向
関連

(北関東)",,◎,－,－,
,,○,プラスチック製品製造業（経営者）,,・仕事の量は若干増えつつあるのでやや良くなっている。ただし、価格の低下により、売上の伸びにはつながらない。
,,○,一般機械器具製造業（経営者）,,・自動車関連の新規部品受注が決定し、徐々に立ち上がりつつある。
,,○,電気機械器具製造業（経営者）,,・ＩＴ関連設備投資の仕事が、他社と比べてかなり良い状況にある。今月は残業が多いので、やや良くなっている。
,,○,その他サービス業［情報サービス］（経営者）,,・設備投資、特に情報化投資の引き合いと受注が全体的に増加している。
,,□,輸送用機械器具製造業（経営者）,,・３、４か月前から少し景気が良くなってきているので、変わらない。
,,▲,＊,＊,
,,×,－,－,
"雇用
関連

(北関東)",,◎,－,－,
,,○,人材派遣会社（経営者）,,・派遣需要が着実に増えている。
