Ⅰ．景気の現状に対する判断理由,,,,,
,,○,職業安定所（職員）,,"・大企業を就業場所とした請負派遣の求人増加が目立つ。
・初めて職業安定所へ求人を申し込む会社や、ここ数年求人の申込がなかった会社からの求人が増えている。
・雇用保険受給者数は依然高水準で推移しているが、９月の有効求人数は過去最大で、有効求職者数は減少しているので、やや良くなっている。"
,,□,職業安定所（職員）,,・受注の不振、製品価格の下落等により売上収益が落ち込み、余剰人員を抱えている事業所がいまだに多い。
,,□,学校［専修学校］（就職担当）,,"・受領した求人票をみると、企業数、業種とも前年とほぼ同じであり、２、３か月前と変化がない。
・情報処理業、製造業で若干の求人数があるが、サービス業の求人は少ない。
・採用内定企業数は１人当たり平均1.5社で、例年と同じ状況である。"
,,▲,－,－,
,,×,－,－,
,,,,,
　４．南関東,,,,,
,,,,（－：回答が存在しない、＊：主だった回答等が存在しない）,
分野,,景気の現状判断,業種・職種,景気の現状に対する判断理由,
"家計
動向
関連

(南関東)",,◎,商店街（代表者）,,・プロ野球球団の優勝セール等で景気が非常に良くなっている。客層も厚くなっており、非常に良い傾向である。
,,◎,乗用車販売店（営業担当）,,・９月に新型モデルが出たため、３か月前に比べて販売台数は増加している。
,,○,住関連専門店（副店長）,,・客数、客単価ともに上昇傾向にある。
,,○,旅行代理店（従業員）,,・団体旅行の予約数が増加し、職場での残業が非常に多くなっている。
,,□,商店街（代表者）,,・悪い状況がずっと続いているので変わらない。
,,□,百貨店（買付担当）,,・９月の売上不振の反動で、10月は主力商品であるジャケット、スカート、ニットが売れたが、ヤング売場では客単価低下の影響で、３か月前と同様に売上の前年比は低下している。
,,□,百貨店（広報担当）,,・衣料品や服飾雑貨の流行商品には動きがあるが、全体の売上を増加させるまでには至らない。
,,□,百貨店（企画担当）,,・比較的年齢の高い客は一部増加しているが、10代、20代の若い客に伸びがみられず、全体の客数は横ばいである。
,,□,百貨店（売場主任）,,・客は目玉商品に興味を持っても、他のバーゲン商品や定価品の売上につながらないという傾向が続いている。
,,□,百貨店（販売促進担当）,,・客の来場等は明らかに増加しているが、買物動向に依然慎重な姿勢がうかがえる。
,,□,百貨店（販売促進担当）,,・９月30日に店舗をリニューアルオープンしたため、売上面では好調に推移しているが、その効果は徐々に薄れてきて少し苦しい状況である。
,,□,スーパー（経営者）,,"・高額品が売れないわけではないが、常時売れているわけではない。客は低額品で料理を作っているようだ。
・来客数はそれほど変わらないが、売上が減少し、単価が低下している。"
,,□,スーパー（統括）,,・消費者が品物を買う際に、ためらう状況が続いている。買う場合でも、必要最小限の物に絞り込んでいる様子が売場等でみられる。
,,□,スーパー（店長）,,・主婦の買物動向をみると、予定以外の物は極力買わないことから、以前に比べて買上点数が少しずつ減少している。購入する場合も、様々な店を比較して一番良い店で購入しているようである。
,,□,コンビニ（店長）,,"・売上、客数は増加せず、客単価も上昇しない。
・秋祭りで一時的に売上が増加したが、その後の売上は再度減少している。"
,,□,住関連専門店（営業統括）,,・ヒット商品が少なく、インポート商品にも陰りがみられ、あまり変わっていない。
,,□,その他専門店［燃料］（売場主任）,,"・取引先の客が、必要な物以外は購入しなくなった。
・社用車をレンタカーに切替えているところが出始めている。"
,,□,その他小売［雑貨卸］（経営者）,,・取扱商品の中で、ＩＴ関連のデジタル機器は好調だが、フィルムやカメラは売れていない。
,,□,一般レストラン（支配人）,,・客数、客単価の伸びがあまりみられない。特に、接待の需要、平日夜のサラリーマンの需要が伸びない。
,,□,スナック（経営者）,,・相変わらず、リストラの話や仕事減の話が多い。
,,□,都市型ホテル（スタッフ）,,・レストラン部門が急激に伸びることもなく、宴会の受注も以前と変わらない。
,,□,タクシー運転手,,"・ある程度の営業収入を上げることはできるが、あと一歩の伸びがない。
・深夜の駅周辺では、利用客の奪い合いになるほどの車が集まるとともに、深夜バス運行によりタクシー利用客の減少が続いている。"
,,□,通信会社（社員）,,・インタ－ネットに必要なＩＳＤＮ回線の販売は３か月前と変わらない。
,,□,その他サービス［学習塾］（経営者）,,・幼稚園生、小学生の英会話の生徒数は増加しているが、小学生、中学生の塾部門の生徒数が減少している。
,,□,住宅販売会社（経営者）,,・一戸建ての住宅、新築の分譲は、契約数、売却件数ともに３か月前とあまり変わらない。
,,▲,商店街（代表者）,,・商店街会員から景気の動向を聞くと、現状より悪くなっているという話が多い。
,,▲,一般小売店［衣料・雑貨］（経営者）,,・売上、買物金額は非常に減少している。客の買物回数も減っている。
,,▲,百貨店（副店長）,,・客数は増加したが、低価格志向が続き、安物買いが目立つ。
,,▲,スーパー（店長）,,"・衣料品関連の売上は前年比で15％程度減少したままで、食品の客単価も同じく10％程度低下したままで一向に上昇する気配がない。
・住居関連でパソコン、テレビ、自動洗濯機等が売れているのが唯一の明るい材料である。"
,,▲,スーパー（店長）,,・７月以来、売上全体が減少し、現在では非常に悪い。客単価は若干低下し、客数も減少している。
,,▲,コンビニ（店長）,,・催事の有無が売上に大きく影響している。
,,▲,家電量販店（店員）,,・秋の商戦に向かう時期であるが、３か月前と比べて、状況は良くない。ただし、パソコン関係や年賀状シーズンでプリンター等の買換えの客が多く来店するので、それでやや盛り返している。
,,▲,一般レストラン（経営者）,,・需要が停滞し、低価格競争が激化している。また、大手の進出で、状況が厳しくなっている。
,,▲,一般レストラン（店長）,,・夜お酒を飲む客が、３か月前に比べてかなり少なくなっている。
,,▲,一般レストラン（経営者）,,・単価の低いメニューが増える傾向がみられる。夜の客数が目立って減ってきている。
,,▲,通信会社（営業担当）,,・チラシ等をまいても、消費者の商品の購買に対する反応が鈍くなっている。
,,▲,美容室（経営者）,,・収入の減少、残業がない等の理由で、客の消費力が非常に低下している。
,,×,商店街（代表者）,,・客は余分な物は買い求めず、必要な分だけの購入にとどまっている。
,,×,住宅販売会社（従業員）,,・住宅展示場や分譲住宅地への来場者数が減少しており、契約数、契約率も低下している。
"企業
動向
関連

(南関東)",,◎,出版・印刷・同関連産業（営業担当）,,・創業100周年で広告を大々的に行ったこともあり、秋口になって売上が増加している。
,,○,プラスチック製品製造業（経営者）,,・受注、見積の問い合わせがともに増加している。
,,○,一般機械器具製造業（経営者）,,・新しい仕事が立ち上がり、増産になっている。
,,○,電気機械器具製造業（経営者）,,・７月と比較して売上が増加している。
,,○,輸送用機械器具製造業（経営者）,,・依然まだら模様ではあるが、忙しい時期と暇な時期がはっきりしてきたので、以前よりはかなり良くなっている。
,,○,通信業（所長）,,・ケーブルテレビの解約数が少し減少してきている。
,,○,不動産業（総務担当）,,・当社が所有するような大型ビルに対する需要は、空室等の問い合わせが多くなっていることから、かなり旺盛である。既存テナントからの賃料値下げの話も少なく、景気はやや良くなっている。
,,○,その他サービス業［情報サービス］（従業員）,,・ＩＴ時代への乗り遅れを恐れ、企業内ＬＡＮ等の見積や、提案の依頼が増加している。
,,○,その他サービス業［物品リース］（営業担当）,,・一部の企業で、リースを通じて大規模な設備投資をしているところはあるが、それ以外の企業でも資金面で設備投資を断念する企業が少なくなりつつある。
,,□,金融業（渉外担当）,,・取引先の社長の表情に明るさがあまり感じられない。現状が目一杯という感じで、今後に向けた設備投資等の話は全くない。
,,□,不動産業（経営者）,,・地価が下げ止まるまで至っていないため、動きがない。
,,□,広告代理店（従業員）,,・当社を含め、売上の増加や新規契約といった話を聞かない。
,,□,社会保険労務士,,・業種によって異なるが、製造業では資金繰りが厳しいというクライアントがまだ多い。
,,▲,電気機械器具製造業（経営者）,,・空調業界は３か月前よりも価格競争が一層激しくなり、商品単価が下落している。空調関連各社とも、原価率が上がり、利幅の少ないビジネスを展開している。
,,▲,輸送業（営業担当）,,・仕事はあるが取引先からの値引き要求圧力によりコスト圧縮思考が強くなり、我々の仕事である運送コストにもますます影響が出ている。
,,▲,通信業（経営者）,,・受注が少なくなっている。
,,×,＊,＊,
"雇用
関連

(南関東)",,◎,民間職業紹介機関（経営者）,,・求人案件、求人数ともに増加傾向にある。
,,○,人材派遣会社（社員）,,"・派遣契約終了者数より派遣契約開始者数の方が多い。
・派遣の仕事を希望する新規登録者が減少している。
・既登録者の中で新たに正社員に雇用された者や、パート等の就業者も増加している。"
,,○,職業安定所（職員）,,・企業からの求人が、パートから一般の常用求人にシフトしつつある。特に、ＩＴ関連企業からの常用求人数が大幅な伸びを示してきている。
,,○,学校［専門学校］（教務担当）,,・10月になって、コンピュータ関連企業からの追加募集及び既卒者募集が目立つようになった。
,,□,＊,＊,
,,▲,人材派遣会社（社員）,,・販売員を派遣しているメーカーの倒産や、給料の遅延がある。
,,×,－,－,
,,,,,
　５．東海,,,,,
,,,,（－：回答が存在しない、＊：主だった回答等が存在しない）,
分野,,景気の現状判断,業種・職種,景気の現状に対する判断理由,
"家計
動向
関連

(東海)",,◎,＊,＊,
,,○,一般小売店［土産］（経営者）,,・伊勢への観光客数は前年を上回って増加しており、確実に回復の道はたどっている。
,,○,一般小売店［土産］（店員）,,・品物の動きが非常に良い。
,,○,一般小売店［惣菜］（営業担当）,,・衝動買いをする客がやや増加している。
,,○,百貨店（販売促進担当）,,・婦人服を中心に秋物が動き出している。
,,○,百貨店（店員）,,・婦人服のまとめ買いが増加するなど、客単価がかなり上昇している。
,,○,乗用車販売店（従業員）,,・来客数が増加し売上もそれに比例しているので、客の購買意欲は確実に出てきている。
,,○,乗用車販売店（従業員）,,・今、発売している商品が悪くなく、今後も新商品の投入が予定されている。
,,○,乗用車販売店（営業担当）,,・新車の受注がやや伸びてきている。
,,○,その他専門店［雑貨］（店員）,,・様々な商業施設の新規出店が続き、それに伴う消費が増加している。
,,○,旅行代理店（従業員）,,・自動車関連企業を中心に、海外視察が過去の１年おきから年１回又は数回へと増加している。
,,○,タクシー運転手,,・相変わらず夜の繁華街は空車が目立つものの、新規採用を始めている企業の採用担当者の深夜乗車などで、乗車数が増加している。
,,○,通信会社（社員）,,・インターネットや電子メールの利用増により、東海エリアの通信量は徐々に増加している。
,,○,テーマパーク（職員）,,・来客数が前年同期並みに戻り始めている。
,,○,美容室（経営者）,,・客の来店間隔日数がかなり短くなっている。
,,○,設計事務所（経営者）,,・設計に関する依頼や相談件数がやや増加し、施工まで発展する件数も多い。
,,○,住宅販売会社（営業担当）,,・現在の業界全体の着工数はやや減少しているが、住宅を建てたいという人の数はむしろ増えつつある。
,,□,百貨店（販売促進担当）,,・ブランド物や秋物が動き始めている一方で、気温や天候に売行きが大きく影響されるため、消費意欲はまだまだ回復していない。
,,□,百貨店（企画担当）,,・季節の変わり目や流行で若年層による衣料品や雑貨の動きはあるが、ミセス層の購買がまだまだ増加していない。
,,□,スーパー（店長）,,・保存可能な商品は安い店で並んで買い、生鮮品等は鮮度の良い店を選んで買う傾向が続いている。
,,□,スーパー（店長）,,・来客数は例年どおりだが、客単価は低い状態が続いている。
,,□,コンビニ（エリア担当）,,・来客数に変化はないが、買上点数が１点少ないなど客単価が上昇せず苦戦している状況がよくみられる。
,,□,家電量販店（店員）,,・価格に見合った高級品や安価な値打ち品は良く売れるが、中間価格帯の商品にあまり動きがない。
,,□,家電量販店（店長）,,・必要な物を必要な分だけ買っていく傾向が続いている。
,,□,乗用車販売店（経営者）,,・客単価、来客数とも増加傾向だが、販売台数にはあまり変化がない。
,,□,乗用車販売店（従業員）,,・新車の売行きが横ばいで、中古車需要が増加しているが、車検の入庫が増加しているため、収益は変わらない。
,,□,住関連専門店（店員）,,・買い控えが浸透しており、なかなか購入に踏み切れない客が多い。
,,□,高級レストラン（スタッフ）,,・新メニューによる販売促進活動への反応は良いが、その他の一般客の入りには勢いがない。
,,□,高級レストラン（経営者）,,・宴会需要、法人の利用がかなり減少しているが、観光客の利用が増加している。
,,□,一般レストラン（スタッフ）,,・客からの料金の問い合わせや交渉は多いが、１回で決まらず他店と比較して安い方を選んでいる。
,,□,スナック（経営者）,,・11時以降の客が全くない状態が続いている。
,,□,通信会社（社員）,,・通話量は若干増加しているが、毎月の傾向はほとんど変わっていない。
,,□,テーマパーク（職員）,,・天候が良く、災害がないにもかかわらず、来客数があまり増加していない。
,,□,設計事務所（経営者）,,・仕事量に変化がない。
,,□,住宅販売会社（従業員）,,・公庫金利の上昇などの住宅購入を取り巻く環境変化に対する客の反応が鈍い。
,,▲,商店街（代表者）,,・全体的に客単価が低下しており、売上も夏前より減少している。
,,▲,一般小売店［精肉］（店員）,,・来客数はやや減少し、客単価も高級品はあまり売れないなど低下している。
,,▲,スーパー（店長）,,・客の低価格志向が一層進み、商品の価格や価値、必要性にますます敏感になっている。
,,▲,スーパー（店員）,,・買物に占める生活必需品の割合が高くなっている。
,,▲,スーパー（経営者）,,・来客数は増加しているが、客単価が低下している。
,,▲,スーパー（店員）,,・客当たりの買上点数が日々減少している。
,,▲,コンビニ（エリア担当）,,・売上が前年割れする店舗が増加している。
,,▲,コンビニ（店長）,,・来客数、客単価ともに減少している。
,,▲,衣料品専門店（店員）,,・客単価が以前の半分になっている。
,,▲,その他専門店［貴金属］（店員）,,・客に商品を購入しようという意欲がない。
,,▲,一般レストラン（スタッフ）,,・客の滞在時間が短く客単価も低下している。
,,▲,スナック（経営者）,,・街の人通りをみると、若年層が多く年輩者が少なくなっている。
,,▲,タクシー運転手,,・東海豪雨の被災地の範囲がかなり広範囲だったため、全体的に引き締めムードが強い。
,,▲,テーマパーク（職員）,,・来客数が減少傾向にある。
,,▲,ゴルフ場（経営者）,,・来客数の減少が続いている一方で低価格志向が鮮明になっており、客は少しでも低価格なゴルフ場を探している。
,,▲,美容室（経営者）,,・例年に比べて、来客数が減少している。
,,×,衣料品専門店（販売企画担当）,,・輸入が増加しているため、売上が増加せず、国内の生産業者はかなり厳しい状況である。
,,×,乗用車販売店（従業員）,,・リコール問題で新規の来客数が減少している。
,,×,住宅販売会社（従業員）,,・客が契約に対してかなり慎重になってきている。アパートの入居者数も非常に減少してきている。
"企業
動向
関連

(東海)",,◎,－,－,
,,○,プラスチック製品製造業（従業員）,,・新車の発売と輸出の好調により自動車関連の生産量が増加している。
,,○,電気機械器具製造業（営業担当）,,・ＩＴ関連で業界が活気づいている。
,,○,輸送用機械器具製造業（経理担当）,,・中間期の決算が３か月前の見込みよりかなり良くなっている。
,,○,輸送用機械器具製造業（工務担当）,,・高級車がよく売れるなど自動車関連は好調で、業績が良くなっている。
,,○,輸送業（エリア担当）,,・貨物量が徐々に増加している。
,,○,輸送業（エリア担当）,,・より良い条件の業種が増加しているため、年末に運転手を募集しても集まらず、反対に運転手が退職している。
,,○,公認会計士,,・設備投資が増加している。
,,□,金属製品製造業（経理担当）,,・客先で仕事が増加しているため、忙しい状態が続いているが、同業間では受注が減少している。
,,□,輸送用機械器具製造業（企画担当）,,・予算執行の段階で予算削減の要請があるなど、十分な景気とは思えない。
,,□,建設業（企画担当）,,・公共事業は予算据置きのためか状況は変わっていない。民間の設備投資も低迷状態で変わらない。
,,□,輸送業（エリア担当）,,・貨物量に変化はないが、単価は相変わらず低下し続けている。
,,□,金融業（企画担当）,,・客先の仕事量は特に増加しておらず、仕事があるとしても単価的に非常に厳しい状況にある。
,,□,司法書士,,・個人の不動産取引は多少あるが、企業はほとんどない。
,,▲,食料品製造業（企画担当）,,・得意先の卸売業や小売業は依然として前年割れの状況が続いている。
,,▲,金属製品製造業（企画担当）,,・当社の社員数が減少し、拠点もリストラをしている。
,,▲,電気機械器具製造業（経営者）,,・そごうや生命保険会社破綻などの大きな不安材料から、やや上向いていた仕事の動きが停滞している。
,,▲,輸送用機械器具製造業（統括）,,・非常に好調だった３か月前の反動もあり、やや悪くなっている。
,,×,非鉄金属製造業（総務担当）,,・実際の仕事量は少なくないが単価は低下傾向で、採算を保つのが非常に厳しい傾向が続いている。
"雇用
関連

(東海)",,◎,＊,＊,
,,○,人材派遣会社（社員）,,・派遣社員の求人が増加し、不足する状況になっている。
,,○,新聞社［求人広告］（担当者）,,・製造業では業者への請負発注、小売業や運送業ではパート、アルバイト等を含めた求人が活発化している。
,,○,職業安定所（職員）,,・求職者数は３か月前と比べ1.6％減少し、求人数は15.1％増加している。
,,○,職業安定所（職員）,,・求人者数は増加しているが、求職者数は減少している。
,,○,民間職業紹介機関（エリア担当）,,・求人要望が増加し、転職希望者の転職比率も上昇している。
,,□,アウトソーシング企業（エリア担当）,,・製造業の臨時雇用求人数は高水準を維持しているが、労働力は頭打ちで募集しても人が集まらない状態である。
,,□,求人情報誌製作会社（編集者）,,・営業職に対する求人ニーズは相変わらず多いが、全体的な求人件数に大きな変化はない。
,,□,職業安定所（職員）,,・求職者数は減少しているが、小規模事業所で事業悪化による人員整理がまだまだみられる。
,,▲,＊,＊,
,,×,－,－,
,,,,,
　６．北陸,,,,,
,,,,（－：回答が存在しない、＊：主だった回答等が存在しない）,
分野,,景気の現状判断,業種・職種,景気の現状に対する判断理由,
"家計
動向
関連

(北陸)",,◎,－,－,
,,○,乗用車販売店（総務担当）,,・福井県内の新車の販売状況が、やや上向き傾向である。
,,○,観光型旅館（スタッフ）,,・予約内容が前年をやや上回っており、今後も回復が見込まれる。
,,○,旅行代理店（従業員）,,・最近、旅行客が多くなってきている。
,,□,百貨店（営業担当）,,・客の買い方がかなり慎重になってきている。値段が安いだけでなく、明確な目的がないと、物を買わないという状況が続いている。
,,□,百貨店（営業担当）,,・来客数があまり変わっていない。
,,□,百貨店（営業担当）,,・今必要な物だけを買う客が多く、買い置き、まとめ買いが少ない。
,,□,スーパー（総務担当）,,・客単価が低下しており、上昇する気配がない。
,,□,コンビニ（エリア担当）,,・加盟店の売上が減少を続けている。
,,□,乗用車販売店（経理担当）,,・新車の販売が好調といわれているが、前年同期を多少上回っているだけで、長年の入替えを我慢していた人や若い人の一部に売れているだけである。
,,□,乗用車販店（営業担当）,,・商用車の販売台数があまり変わっていない。
,,□,高級レストラン（スタッフ）,,・客が価格に対して非常にシビアになってきており、この傾向はずっと続いている。
,,□,観光型旅館（経営者）,,・福井県や北陸の地場産業の不振と低価格志向の定着により、相変わらず観光客の動きが非常に鈍い。また、宿泊単価や消費単価の落ち込みが相当目立っている。
