Ⅰ．景気の現状に対する判断理由,,,,,
,,○,設計事務所（所長）,,・今年はほとんど新規の仕事がなかったが、10月以降は２件の新規受注があった。
,,□,百貨店（販売促進担当）,,"・消費トレンドが低価格志向にあり、無駄な物は買わないという傾向が続いている。
・成人式用のスーツの動きも悪く、ボーナス待ちの様相を呈している。"
,,□,スーパー（統括）,,"・客数増加でも客単価減少、総点数増加でも商品単価減少、１人当たりの買上点数増加の状況は変わっていない。
・客数の増加は１人当たりの来店頻度上昇が原因だと考えられる。客は、その都度必要な物を購入し、何度も来店しているようである。"
,,□,コンビニ（店長）,,・新製品が出ないと売上が伸びない状況が続いている。客は、金があっても刺激がない商品は購入しない。
,,□,衣料品専門店（経営者）,,・暖冬の影響で、例年なら売れているコート等の売上が伸びない。
,,□,乗用車販売店（営業担当）,,・来場者数は増加しているが、商品購入には至っていない。
,,□,タクシー運転手,,・紅葉の時期にもかかわらず、客がいない。マイカー利用が多く、タクシー利用は少ない。
,,□,通信会社（社員）,,・携帯電話販売数は引き続き好調だが、一方で料金滞納者も多いので変わらない。
,,□,ゴルフ場（支配人）,,・平日客の減少が目立つが、土日は満員状態が続いている。
,,▲,コンビニ（店長）,,"・クリスマス、年末商品の予約数が前年と比べて少ない。
・売上、客単価ともに前年割れで、横ばいであった客数も減少に転じてきている。"
,,▲,旅行代理店（従業員）,,・購買意欲が感じられず、相変わらず低価格志向が強いために、客単価が上がらない。
,,×,商店街（代表者）,,・客数、客単価が減少している。
,,×,コンビニ（店長）,,・周辺にショッピングセンター、ホームセンター等の大型店の開店が相次いでいるため、非常に悪くなっている。
"企業
動向
関連

(北関東)",,◎,－,－,
,,○,電気機械器具製造業（経営者）,,・新規の顧客が増え、仕事量が増加した。
,,○,輸送用機械器具製造業（総務担当）,,・生産量が増加しており、残業時間も増加している。人員の採用も検討中である。
,,○,金融業（融資担当）,,・個人の消費資金等の申込が最近増加しており、徐々に個人消費が活発化している。
,,○,その他サービス業［情報サービス］（経営者）,,・情報化投資の引き合いが依然として多く、相対的に受注残が増加しているという話を聞く。
,,□,電気機械器具製造業（経営者）,,・同業者で状況が良いところも悪いところもあるため、現状横ばいである。
,,□,経営コンサルタント,,"・ＩＴ関連は一般の話題ほどに企業の業績動向に反映されていない。
・小売店や飲食店の一部に設備投資の動きがみられる。"
,,▲,プラスチック製品製造業（経営者）,,・11月に入り仕事量が減少している。
,,▲,建設業（経営者）,,・民需、官公需とも少なく、競争が激化している。
,,▲,建設業（経営者）,,"・発注金額が低下している。
・繁華街に人の出入りが少ない。"
,,×,＊,＊,
"雇用
関連

(北関東)",,◎,－,－,
,,○,人材派遣会社（経営者）,,・ＩＴ関連を中心に派遣需要が引き続き堅調に推移している。
,,○,職業安定所（職員）,,・製造業の一部で求人が増加している。
,,○,学校［専修学校］（就職担当）,,"・今月は特にサービス業の求人が増えている。
・採用人数も、１社で複数の採用ないし内定が出ている。
・求人票を持参する企業があり、採用に対する積極性を感じる。"
,,□,職業安定所（職員）,,"・新規、有効求人数とも増加し、有効求職者数や雇用保険受給者数は減少しているため、有効求人倍率は改善しているが、余剰人員を抱えている事業所も多く、残業規制、配置転換、出向等で雇用調整を実施しているため変わらない。
・新規求人数は職種、業種によってばらつきがあり、特に情報関連、業務請負、派遣業の求人が増加している。"
,,□,学校［短期大学］（就職担当）,,・製造業やサービス業の求人が若干増加しているが、全体としては変化していない。
,,▲,－,－,
,,×,－,－,
,,,,,
　４．南関東,,,,,
,,,,（－：回答が存在しない、＊：主だった回答等が存在しない）,
分野,,景気の現状判断,業種・職種,景気の現状に対する判断理由,
"家計
動向
関連

(南関東)",,◎,－,－,
,,○,百貨店（売場主任）,,・引出物を中心に、慶事需要が軒並み増加している。
,,○,百貨店（買付担当）,,・異常な暖冬であった前年の反動もあり、気温が低下した11月中旬以降は、主力商品であるコート、特にウールコートの売上が予想以上に伸びている。
,,○,百貨店（販売促進担当）,,・冬物単品の動きがようやく活発化し、売上も増加傾向にある。ただし、客数の増加ほど売上は伸びていない。
,,○,スーパー（店長）,,・品質、価格、ファッション性のうち、２つ以上の特徴を持つ商品は良く売れている。
,,○,衣料品専門店（販売担当）,,・少し気温が低下し、重衣料のコートの売上が伸びている。
,,○,一般レストラン（経営者）,,・売上、客数が増加している。
,,○,旅行代理店（従業員）,,・個人の宿泊申込が若干増加している。
,,○,その他サービス［語学学校］（総務担当）,,・問い合わせや実際の入校が増加している。
,,□,商店街（代表者）,,・売上の状況をみても、ほとんど変わらない状況が続いている。
,,□,一般小売店［パン］（従業員）,,・仕事量は増加しても、売上は変わらない。
,,□,百貨店（売場主任）,,・11月初旬まではプロ野球優勝セール、Ｊリーグ関連セールなどで比較的売上が増加したが、消費後押し要因がなくなり、客の財布のひもは固くなっている。
,,□,百貨店（広報担当）,,"・単品買いの傾向が続いている。
・コート等の重衣料の動きが良くない。"
,,□,百貨店（企画担当）,,・お歳暮の新規客は増加しているが、得意客や法人の届先件数、売上が減少している。
,,□,百貨店（営業担当）,,・婦人服、婦人関連雑貨、食品は好調に推移しているが、紳士服、子供服関連は、依然前年割れの厳しい状況が続いている。
,,□,百貨店（販売促進担当）,,・来客数は増加しているが、単価が依然として上昇しない。
,,□,スーパー（店長）,,"・売上全体は前年比で10％以上減少しており、衣料品関連、特に重衣料の紳士、婦人服の売上が悪い。ただし、割引セール等への客の反応は良い。
・家電、大型テレビ、パソコンの売上は好調である。
・食品では、安価な物以外は売れない。また、冷凍食品は４割引セールのスタート当初には売上増につながったが、今では４割引の時にしか購入せず、売上が減少傾向にある。"
,,□,コンビニ（店長）,,・近隣のマンション建設の影響で商品に多少動きはあるが、割引商品の増加により売上全体に変化はない。
,,□,衣料品専門店（経営者）,,・気温の低下とともに来客数は増加しているが、必要な物しか購入しないという客の消費行動は変わらない。
,,□,衣料品専門店（店員）,,・景気にあまり左右されないジーンズの売上が増加する兆しが見受けられない。
,,□,乗用車販売店（営業担当）,,・新車の販売で、新型車を発表したにもかかわらず、来客数や契約数が非常に少ない。
,,□,乗用車販売店（総務担当）,,・11月は前年並みの売上をかろうじて達成している。中古車では、土日のイベント来場者数は前年比10％増加したが、販売額は3.5％の微増にとどまっている。
,,□,高級レストラン（支配人）,,"・新規顧客の受注が少ない。
・既存の顧客では、客単価の動向がばらついており、平均すると変わらない。"
,,□,一般レストラン（支配人）,,・客単価の低下により、売上金額は２、３か月前とほぼ同水準である。
,,□,都市型ホテル（スタッフ）,,・１～３月の予約状況は依然として悪い。景気が良くなる要素がなく、兆候もみられない。
,,□,都市型ホテル（スタッフ）,,・会社の経費削減が相変わらず目立ち、客単価が低下している。
,,□,通信会社（営業担当）,,・ケーブルインターネットの需要は旺盛だが、ＩＳＤＮとの競争激化により、全体の売上は変わらない。
,,□,通信会社（社員）,,・アナログ回線の売上が若干上向いているが、ＣＡＴＶの切替えによるインターネット利用が増加しているためである。ただし、全体の売上は３か月前と変わらない。
,,□,遊園地（職員）,,・来場者は増加しているが、割引券利用の増加により商品単価が低下しているため、売上は変わらない。
,,□,その他サービス［学習塾］（経営者）,,・コマーシャルを出しても、問い合わせ件数に変化がない。
,,□,住宅販売会社（従業員）,,・客の動きに変化がない。
,,▲,商店街（代表者）,,・商品の販売数量にそれほど変化はないが、単価の低下により売上が減少している。
,,▲,一般小売店［茶］（経営者）,,・毎月３日間の定例特売日には、商品が通常の３倍売れるが、その前後の販売は良くない。
,,▲,百貨店（副店長）,,・特売志向が強く、以前より買上単価が相当低下している。
,,▲,スーパー（経営者）,,"・来客数、買上点数は変わらない。
・高額品が動かなくなっている。特に、ビールと発泡酒の売行きの差が大きい。"
,,▲,スーパー（統括）,,・特売のチラシを入れたときと入れないときの売上の落差が、従来より大きくなっている。客が買物を絞り込んでいる。
,,▲,スーパー（店長）,,・ギフト商品の動向、クリスマスケーキ、おせち等の予約状況も、前年比で10％以上低下している。
,,▲,コンビニ（店長）,,"・商品の低価格化が進み、客数、買物点数が減少している。
・個人の食料に費やす金額が減少してきている。"
,,▲,家電量販店（店長）,,・家電商品、パソコンの単価が低下し、売上台数が伸び悩んでいる。安い商品は売れているが、売上は伸びない。
,,▲,乗用車販売店（販売担当）,,・サラリーマンなどは、ボーナスがどの程度出るのか懸念しているため、買い控えている。
,,▲,住関連専門店（営業統括）,,・消耗品等は良く売れているが、高額商品、特に耐久消費財の売行きが悪い。
,,▲,その他小売［雑貨卸］（経営者）,,・デジタルカメラは好調だが、主力のフィルム、カメラが売れない。
,,▲,一般レストラン（経営者）,,・いかに経済的、効果的に金を使って食事をするか、値段をみながら相談している客がいる。
,,▲,タクシー運転手,,・長距離の客が減少している。
,,▲,その他サービス［学習塾］（経営者）,,"・中学１年から塾に通う生徒が減少し、中学３年になってから入塾する生徒が多い。
・英語教室には幼少時から通わせる傾向になっている。"
,,▲,住宅販売会社（従業員）,,・展示場の来客数が減少しており、契約数も若干減少している。
,,×,商店街（代表者）,,・売上は減少し、街を歩く人も少なくなっている。
,,×,一般小売店［雑貨］（経営者）,,・売れている商品のライフサイクルが短くなっている。
,,×,コンビニ（経営者）,,・３か月前と比べて、客数、客単価ともに極端に悪くなっている。
,,×,衣料品専門店（経営者）,,・客数は変わらないが客単価が相当低下しているため、売上が減少している。
,,×,スナック（経営者）,,・客数が少ない。
,,×,住宅販売会社（経営者）,,・３か月前に完成した住宅がなかなか売れない。値段を下げても早急に売れる状況ではない。
"企業
動向
関連

(南関東)",,◎,－,－,
,,○,通信業（所長）,,・キャンペーンでの客の反応は悪いが、ＣＡＴＶの解約数が減少しているので、やや良くなっている。
,,○,不動産業（総務担当）,,・当社が所有しているビルの中で、１フロア当たりの面積が広い大型ビルについては問い合わせが多い。
,,○,その他サービス業［情報サービス］（従業員）,,・次年度の予算検討資料として、大学等からの見積依頼が前年比で1.5倍となっている。
,,□,プラスチック製品製造業（経営者）,,・受注、売上ともに大きな変化がない。
,,□,電気機械器具製造業（経営者）,,・前年同月比で出荷台数が約10％増加し、残業をして増産している。ただし、安い商品のみが売れるため、売上金額は伸び悩んでいる。
,,□,精密機械器具製造業（経営者）,,・景気の良い会社は忙しいが、単価が低いために売上が悪い。景気の悪い会社には大きい仕事がない。
,,□,金融業（渉外担当）,,・企業の中で勝ち組と負け組がはっきりしてきている。
,,□,広告代理店（従業員）,,・広告業界の中小企業については、ＩＴとは全く関係なく、業況はほとんど変わらない。
,,▲,繊維工業（経営者）,,・３か月前と比べて受注量が減少している。
,,▲,化学工業（経営者）,,"・薬業界でも、小売店の店舗過剰、ドラッグストアの台頭により一般小売店は厳しい。
・11月は天候が穏やかで、売上が相当減少している。"
,,▲,一般機械器具製造業（経営者）,,・仕事量の減少に加えて、時間単価の切り下げが続いている。
,,▲,社会保険労務士,,・給与計算を請け負っているが、残業が減少している。
,,▲,その他サービス業［情報サービス］（従業員）,,・インターネット関連の業務は依然好調だが、伸び悩んでいる。
,,×,＊,＊,
"雇用
関連

(南関東)",,◎,人材派遣会社（社員）,,・依然として求人数が非常に多い。
,,◎,民間職業紹介機関（経営者）,,・客の求人ニーズが高まり、幅広く募集するようになっている。
,,○,人材派遣会社（社員）,,"・派遣の受注が増え続けており、企業数の増加及び１社当たりの依頼人数の増加がみられる。
・求職者の減少が続いている。"
,,○,人材派遣会社（社員）,,・求人が質量ともに改善している。年収も100万円以上増加し、休日も増えている求人先がある。
,,○,職業安定所（職員）,,・非自発的離職者数が半年間で半減し、減少傾向が続いている。
,,□,職業安定所（所長）,,"・求人数は多少増加しているが、特定の進出企業及び関連企業によるもので、求職者は横ばいである。
・雇用保険受給者は増加している。"
,,□,職業安定所（職員）,,・求職者は減少、求人数は増加傾向にある。ただし、各社のリストラ等の発表により、印象が暗くなっている。
,,□,職業安定所（職員）,,・秋口以降、企業からの求人数の伸びに一服感が出てきている。また、求人は情報関連の製造業、情報サービス産業に偏っている。
,,□,学校［専門学校］（教務担当）,,・コンピュータ関連企業からの求人はあるが、今年度の採用はないという印刷、デザイン系企業が足元で目立つ。
,,▲,新聞社［求人広告］（担当者）,,・工場の閉鎖、営業所の統合、飲食店等の閉店の影響で、キャリアのある40、50代の課長、部長クラスが時給800円のバイト、パートに応募してくる状況である。
,,×,－,－,
,,,,,
　５．東海,,,,,
,,,,（－：回答が存在しない、＊：主だった回答等が存在しない）,
分野,,景気の現状判断,業種・職種,景気の現状に対する判断理由,
"家計
動向
関連

(東海)",,◎,－,－,
,,○,百貨店（販売促進担当）,,・気温が高いのでコート類には動きがないが、その他の婦人服は良く動いており、食品も堅調な動きをしている。
,,○,コンビニ（エリア担当）,,・売上が前年割れしている店舗が減少している。
,,○,コンビニ（エリア担当）,,"・客単価、来客数、売上ともに微増している。
・インクジェット年賀葉書など前年の２～３倍売れている商品もある。"
,,○,乗用車販売店（従業員）,,・残業がやや減少しているという客も多少いるが、商談の最後にはワンランク上のグレードを購入するなど客に切迫感はなく、100万円前後の車は即答のケースも多くなっている。来客数も増加している。
,,○,その他専門店［雑貨］（店員）,,・人と人とのつながりを大切にしたい場面が年末に向けて増えるため、パーティーグッズ、景品、来客用のスリッパ、皿などの売上が増加している。
,,○,住関連専門店（店員）,,・相次ぐ競合店出店の影響を受けて低迷していたが、競合店との客層の住み分けが始まり売上が回復しつつある。
,,○,都市型ホテル（スタッフ）,,・宴会場の直近の予約が回復している。
,,○,都市型ホテル（スタッフ）,,・11月始めから忘年会が行われているが、前年よりも件数、人数ともに増加している。
,,○,タクシー運転手,,・深夜の乗車がかなり増加してきており、庶民の財布のひもが緩んできている。
,,○,テーマパーク（職員）,,・客単価はまだ低い状況にあるが、来客数は10月に引き続き好調である。
,,○,住宅販売会社（従業員）,,・成約率がやや上昇している。
,,□,商店街（代表者）,,・40～50歳代の購買意欲がなかなか向上してこない。
,,□,百貨店（売場主任）,,"・土日に客は入るが買う人は少なく、売上に結びついていない。
・靴のサイズだけをみて、「また後にします」と言った人のほとんどは、再び買いに来ない。"
,,□,百貨店（企画担当）,,・来客数は依然減少傾向であるが、客単価は前年並みに近づいている。
,,□,百貨店（企画担当）,,・中高年層の購買額が依然として低迷している。ギフトでも個数を減らすなど単価を下げる人が増加している。
,,□,スーパー（店長）,,・客単価、１品単価の低下は依然として続いている。特売に客が集中することが多く、通常は非常に少ない。
,,□,スーパー（店員）,,・客当たりの商品点数が少なく、売出しのときも衝動買いをしない傾向が続いている。
,,□,スーパー（店員）,,・特売品など値引き目当ての客が相変わらず多い。
,,□,コンビニ（エリア担当）,,・客単価、来客数ともに低下したままであり、低単価商品、生活必需品、食品以外の売上が上向きにならない。
,,□,衣料品専門店（企画担当）,,・来客数や買上点数の増加はあるものの、客単価の低下は続いている。
,,□,家電量販店（店長）,,・高額商品ではなく、基本性能のしっかりしている普及価格の商品が売れ続けている。
,,□,家電量販店（店員）,,・店舗改装をしたが、オープンセールで高額な商品を買おうという客が少ない。
,,□,乗用車販売店（従業員）,,・買換えに際し、維持費を下げるため小さい車を購入する客が依然として多い。
,,□,乗用車販売店（営業担当）,,"・新商品を投入すると一時的に盛り上がりはあるが、継続的な上昇感はない。
・ボーナスシーズンに入っているが、中小企業のサラリーマンは支給日まで不安感を持っている。"
,,□,住関連専門店（営業担当）,,・マンションや公共物件を中心に価格競争が激しく、販売価格の低下とともに工賃まで下がってきている。
,,□,その他専門店［貴金属］店員,,・来客数は増加しているがなかなか購入まで結びつかず、高額品では即購入も少なくなり、かなりの接客時間と日数を費やし、やっと買ってもらえるといった状況にある。
,,□,その他専門店［化粧品］（店員）,,"・客単価は上昇しているが来客数は減少している。
・お歳暮やギフトなどの法人受注は伸び悩んでいるが、トータルでみるとあまり変わらない。"
,,□,高級レストラン（経営者）,,・観光客の需要は増加しているが、接待等の法人需要は悪い状態が続いている。
,,□,一般レストラン（スタッフ）,,・生ビール100円など安さをアピールした催物を企画しないと客足が伸びない傾向が続いている。
,,□,旅行代理店（従業員）,,・航空機はビジネスクラスを利用せず、ホテルも２人で１部屋など、費用を抑える傾向が続いている。
,,□,通信会社（社員）,,・県内市外通話料金の大幅値下げが実施されたが、通話量の増加はみられない。
,,□,パチンコ店（店長）,,・水害前の客単価、稼働時間に戻りつつある。
,,□,その他サービス［パチンコ機器製造販売］（エリア担当）,,・主力商品のコンピュータの出荷台数は増加しているが、客単価が減少しているため、売上は横ばいである。
,,□,住宅販売会社（企画担当）,,・分譲のチラシを入れても客数に変化がなく、成約件数にも変化がない。
,,▲,商店街（代表者）,,・家族の人数に合わせた買物しかしないなど個人客の財布のひもは一層固くなっており、法人も手土産などの単価を更に低く抑えてきている。
,,▲,一般小売店［酒］（経営者）,,"・来客数も電話注文も少なく売上は減少している。
・缶ビールなど６本単位で安くしている商品より、必要本数しか購買しない状況にある。"
,,▲,百貨店（売場主任）,,・必要最低限の商品しか購入せず、し好品が売れない。
,,▲,スーパー（経営者）,,・近隣に大型店が３店舗開店するなど競合も激しく、来客数は以前と変わらないが客単価が減少し売上に影響している。
,,▲,スーパー（店長）,,・客はこれまで鮮度、品ぞろえ、価格、接客の善し悪しで店を選別していたが、それら以外のささいな要素での選別が始まっている。
,,▲,衣料品専門店（店員）,,・バーゲン待ちのためか、買い控えを感じる。
,,▲,乗用車販売店（経営者）,,・平日の来客数が少なく週末の売上に依存する傾向にあり、問い合わせ件数も減少気味である。
,,▲,住関連専門店（店員）,,・季節品が暖かくて売れず客単価が低下している。
,,▲,高級レストラン（スタッフ）,,・客数が減少し、直近の予約も減少している。
,,▲,一般レストラン（スタッフ）,,・忘年会や新年会のシーズンを前にして、客の出費控えが目立つ。
,,▲,ゴルフ場（経営者）,,・来客数の減少が続いている。
,,▲,設計事務所（経営者）,,・引き合いはあるが、成約件数は減少している。
,,×,百貨店（売場主任）,,・高額品の売上が相当減少している。株価も上昇しないなど、将来に不安を残す要素が多く、消費へのガードが非常に固くなっている。
,,×,乗用車販売店（従業員）,,・購入時に値段に厳しくなっている。
"企業
動向
関連

(東海)",,◎,－,－,
