Ⅰ．景気の現状に対する判断理由,,,,,
,,,,,
　景気の現状に対する判断の理由について、その主だったもの及び特徴的と考えられるものを取りまとめると以下のとおりであった。,,,,,
,,,,,
,,,,,
　１．北海道,,,,,
,,,,（－：回答が存在しない、＊：主だった回答等が存在しない）,
分野,,景気の現状判断,業種・職種,景気の現状に対する判断理由,
"家計
動向
関連

(北海道)",,◎,自動車備品販売店（店長）,,・タイヤセット等の高額商品の売行きが良く、来客数、売上ともに増加している。
,,◎,その他専門店［造花］（店長）,,・クリスマス用や正月用の商品の販売が好調である。
,,○,商店街（代表者）,,・バーゲン時期ではないが、顧客の購買意欲が上昇してきており、繁忙時間帯の来客数が増加している。
,,○,百貨店（売場主任）,,・そごうの閉店セールによる買い控えがやや気がかりであるが、ミセスの大衆ブランドを中心に防寒衣料の動きは比較的良好である。
,,○,スーパー（企画担当）,,・来客数、売上ともにやや増加しており、客単価も回復傾向にある。
,,○,衣料品専門店（店長）,,・単価の高い商品の売上が増加している。
,,○,家電量販店（店長）,,・３か月前と比べて、分割やカードでなく、現金で購入する客が増加している。
,,○,乗用車販売店（従業員）,,・新型モデルの効果もあり、買換えの商談が増加し、売上台数が増加している。
,,○,住関連専門店（統括）,,・来客数が増加し、客単価も上昇している。
,,○,一般レストラン（スタッフ）,,・来客数は若干減少したが、客単価の低下が止まり、売上が回復している。
,,○,観光型ホテル（経営者）,,・有珠山の影響が一段落し、観光入込客数が回復している。
,,○,旅行代理店（従業員）,,・11月は例年、受注が減少する時期だが、来客数、電話での申込ともにあまり減少していない。
,,○,タクシー運転手,,・売上が若干増加しており、その中身をみると、チケットによる売上もやや増加している。
,,○,観光名所（役員）,,・客のニーズに合った企画商品は売上が好調である。
,,○,美容室（経営者）,,・３か月前と比較して客単価が上昇し、売上も増加している。
,,□,商店街（代表者）,,・来客数に変化がなく、客単価も低下したままである。
,,□,百貨店（販売促進担当）,,・婦人雑貨は継続的に好調で、ヤングのブランド物も回復がみられるが、紳士のカジュアル物は厳しい状況が続いている。
,,□,スーパー（店長）,,・９月にオープンした大型店の影響で街は活気づいているが、そのかわり中小の小売店の状況は芳しくない。
,,□,スーパー（店長）,,・買われる商品が特売品に限られている状態が続いている。
,,□,コンビニ（エリア担当）,,・客の買い控えが続き、客単価も上昇しておらず、売上等の数値は、この３か月でほとんど変化していない。
,,□,コンビニ（エリア担当）,,・郊外地区の店舗の来客数、売上、買上個数は回復しているが、都心部の店舗はあまり回復していない。
,,□,コンビニ（店長）,,・来客数、売上ともに変化がみらない。
,,□,乗用車販売店（従業員）,,・来客数が増加していない。
,,□,高級レストラン（スタッフ）,,・ディナー客の予約はやや回復し、一般客に比べて客単価も上昇しているが、全体的には売上が好転してない。
,,□,旅行代理店（従業員）,,・好調だった国内旅行の伸びが鈍化しており、海外旅行の伸びもあまりみられない。
,,□,タクシー運転手,,・天候の悪い日は利用客が増加するが、夜間の利用客が減少したままである。
,,□,タクシー運転手,,・大型店の出店や新装開店によって人出は増加したが、既存店の客が減少しているようであり、全体でみると変わらない。
,,□,タクシー運転手,,・深夜の利用客は若い人が多く、官庁関係やサラリーマンの客が増加していない。
,,□,設計事務所（所長）,,・３か月前と比べて、仕事の話を持ちかけられる状況に変化がない。
,,▲,商店街（代表者）,,・飲食店関連の店舗の売上が減少している。
,,▲,スーパー（企画担当）,,・大型店の駆け込み出店がピークを迎えて、各店の乱売競争が一段と激しくなっており、生鮮食料品、衣料品等を中心に客単価が低下している。
,,▲,スーパー（店長）,,・来客数は増加しているが、衣料品を中心に売上が不振である。
,,▲,コンビニ（エリア担当）,,・本来この時期にあるべき予約商品は、例年であれば確保できるが、今年は客の反応が弱い。
,,▲,乗用車販売店（従業員）,,・イベント時の来客数が減少している。
,,▲,住関連専門店（営業担当）,,・来客数に変化はないが、雪が少なかったため防寒商品が不振であり、客単価がやや低下している。
,,▲,高級レストラン（スタッフ）,,・観光客等の来客数が減少している。
,,▲,観光型ホテル（スタッフ）,,・有珠山噴火の影響から７割程度まで回復しているが、観楓会シーズンも終わり、このところやや売上が減少している。
,,▲,パチンコ店（店員）,,・来客数が減少し、客単価も低下している。
,,×,商店街（代表者）,,・大型店出店や例年になく雪の降る日が多いため、街を出歩く人が急に減少したようである。
,,×,百貨店（売場主任）,,・冬物コートの動きが悪く、客単価が低下し、まとめ買いをする客もいない。
,,×,高級レストラン（経営者）,,・例年、毎年11月は売上が減少するが、今年は特に悪く、客単価も低下している。
,,×,スナック（経営者）,,・今月はお歳暮を持って何十軒も回ったが、今年は忘年会をやめようという会社幹部が多くみられる。また、何人かの職員同士で個人的に飲みに行くこともできないと言っている。
,,×,その他飲食［酒卸］（店長）,,・11月末は、ワインの解禁や忘年会の前哨戦等、平月より売上が増加する要素はあるが、現状はその気配がなく商品の提案に対しても反応がなく、例年のような傾向がみられない。
,,×,住宅販売会社（従業員）,,・来客数、住宅受注件数ともに減少している。
"企業
動向
関連

(北海道)",,◎,食料品製造業（団体役員）,,・年末需要の時期に、加工原料の豊漁が続き、原料の価格低下と安定供給により、企業の利益率が好転している。
,,◎,その他サービス業［建設機械レンタル］（総務担当）,,・３か月前と比べると、早朝から電話による機械レンタルの問い合わせや、新規の客が増加しており、非常に動きが活発である。
,,○,輸送業（支店長）,,・農産物は道外産地との競合により物流量の増加にブレーキがかけられているが、製紙関係の物流は好調に推移している。
,,○,通信業（営業担当）,,・システム構築の意欲が上向きになってきているようであり、客の問い合わせと新規案件の提案が増加している。
,,○,司法書士,,・不動産の登記件数が増加している。
,,○,その他企業［コンベンション担当］（従業員）,,・売上が増加している。
,,□,食料品製造業（経営者）,,・デパート、スーパー筋での売上は増加していないが、ダイレクト販売やコンビニ関連は堅調である。
,,□,家具製造業（経営者）,,・オフィス家具の売上は増加しており、企業業績が向上しているようであるが、個人需要が伸び悩んでいる。
,,□,その他サービス業［建設機械リース］（従業員）,,・引き合いが依然として低調である。
,,▲,食料品製造業（経営者）,,・注文指示書のＦＡＸ件数等からみて、物流量が減少している。
,,▲,金融業（企画担当）,,・一時期より下げ幅は小さくなったが、依然として設備投資の資金需要が伸びていない。
,,▲,広告代理店（従業員）,,・住宅や流通関連のスポンサーから売れないものをどう売るかという創意工夫を求められる傾向が強くなっている。
,,▲,その他サービス業［建設機械リース］（支店長）,,・物流関連の荷動きが非常に悪く、手形の書換え要請が運送会社からでている。
,,×,－,－,
"雇用
関連

(北海道)",,◎,－,－,
,,○,求人情報誌製作会社（編集者）,,・求人広告では建設業は横ばいだが、食品製造業、卸売業や、サービス業は相変わらず補充採用が多い。
,,○,求人情報誌製作会社（編集者）,,・製造業、卸売業、運輸業、サービス業の求人広告件数が大幅に増加しており、飲食業、建設業についてもやや増加している。
,,○,職業安定所（職員）,,・依然として求職者数は増加傾向であるが、求人数も３か月前より増加している。
,,□,人材派遣会社（社員）,,・依然として正社員退職後の補充として派遣社員の起用が目立っており、派遣社員の求人増加が必ずしも景気回復につながっているといえない。
,,□,求人情報誌製作会社（編集者）,,・アルバイトやパートの求人はあるが、相変わらず正社員の求人が低調である。
,,□,職業安定所（職員）,,・新規求人数は食品、電気機械の製造業や卸小売業、飲食業、情報産業を中心とするサービス業において好調ではあるが、その一方、求人の内容が欠員募集で賃金の抑制傾向があり、パート求人が目立っている。
,,▲,職業安定所（職員）,,・企業倒産や事業縮小による解雇者が増加している一方で、求人ではパートの割合が非常に高く、雇用ミスマッチが目立ち、求人、求職ともに利用者に相当に苛立ちがみられる。
,,×,－,－,
,,,,,
　２．東北,,,,,
,,,,（－：回答が存在しない、＊：主だった回答等が存在しない）,
分野,,景気の現状判断,業種・職種,景気の現状に対する判断理由,
"家計
動向
関連

(東北)",,◎,－,－,
,,○,スーパー（店長）,,・２か月連続して、１人当たりの平均買上点数が前年並みに回復している。
,,○,スーパー（総務担当）,,・来客数が前年同期を超えている。
,,○,家電量販店（店長）,,・映像機器を中心とした高額商品が売れ始めた。
,,○,乗用車販売店（経営者）,,・新車受注状況が前年に比べ良くなっている。
,,○,都市型ホテル（経営者）,,・秋のブライダルシーズンに入り、結婚式その他の宴会で活気がみられた。
,,○,タクシー運転手,,"・以前と比べて、客のとぎれがない。
・タクシーチケットの利用が多い。"
,,○,住宅販売会社（経営者）,,・展示場入場者数、客の動き、契約成立の状況はあまり変わってないが、全体的にはやや良くなっている。
,,□,商店街（代表者）,,"・客の慎重な購買行動がみられる。
・客単価が低下している。"
,,□,百貨店（企画担当）,,・前年比３～５％の範囲でマイナス基調が続いている。
,,□,百貨店（広報担当）,,"・気温の低下に伴い、単価の高いレザーやツイード系の婦人衣料が動き出しているが、出足は鈍い。
・パシュミナストールなどの洋品雑貨やブーツを中心とした婦人靴は比較的動きが良い。
・紳士衣料は依然苦戦状態である。"
,,□,百貨店（企画担当）,,・11月の商況は衣料、食品などの売上が落ちている。特にコートは前年よりも動きが悪い。
,,□,百貨店（売場担当）,,・比較購入が増えており、あまり変わらない。
,,□,百貨店（総務担当）,,・高額品が動かず、安い生活必需品だけが売れるため、売上は伸び悩んでいる。
,,□,スーパー（店員）,,・高額商品は売れず、値段の安いものしか売れない。
,,□,スーパー（店長）,,"・客単価や１品単価の低下が依然続いている。
・バンドル販売も人気が出ず、必要なものしか買わない傾向が強まっている。"
,,□,スーパー（経営者）,,"・生鮮食料品は横ばい状況である。
・競合店より販売価格を低下させれば売上が増加し、販売価格を上昇させれば売上が減少するというシーソー状態である。"
,,□,コンビニ（エリア担当）,,・依然売上が前年を下回る状況が続いている。
,,□,衣料品専門店（店長）,,"・今月に入り、全体に占める低価格スーツの売上構成比が５～10％増えている。
・客は価格に対してより一層シビアになっている。"
,,□,衣料品専門店（経営者）,,・秋物の動きも悪く冬物の出足も悪い。夏以降悪い状況が続いている。
,,□,乗用車販売店（従業員）,,・景気が良くないので車の購入を控えるという声をよく聞く。
,,□,乗用車販売店（従業員）,,・売掛金が増えており、それだけ支払が悪くなっているといえるが、その一方で物の動きが良くなっている｡
,,□,乗用車販売店（営業担当）,,・来場者数は増加しているが、新型車効果と冬場に向けての点検サービスによるもので、売上は増えていない。
,,□,乗用車販売店（企画担当）,,・車の買換え需要は少しずつ上向いているが、単価が低下しているため、売上高は変わらない。
,,□,乗用車販売店（営業担当）,,・新型車の投入で、来客数は増加しているが、買換えサイクルの客が慎重になっている。
,,□,住関連専門店（統括）,,・客単価は低迷し、必要最小限のものしか買わない。
,,□,その他専門店［酒］（総務担当）,,・依然として低価格志向が続いている。
,,□,高級レストラン（スタッフ）,,・客数が伸びているが客単価が依然上昇しない。
,,□,スナック（経営者）,,・売上に上下の変動がない。
,,□,観光型ホテル（経営者）,,・宿泊単価が一向に上昇しない。
,,□,都市型ホテル（スタッフ）,,"・主力の一般宴会が、前年比で件数、売上、消費単価のいずれも下回っている。
・忘年会、新年会の予約状況も悪い。"
,,□,旅行代理店（従業員）,,・年末年始の旅行の予約があまり多くない。
,,□,通信会社（社員）,,・契約回線の販売状況が今までと変わらない。
,,□,通信会社（営業担当）,,・来年５月から始まるマイラインサービスに向けて顧客獲得策を展開しているが、客の反応が悪い。
,,□,通信会社（社員）,,・依然として、客は質よりも安さに走る傾向がある。
,,□,テーマパーク（職員）,,・休日の前日の予約は増えているが、低価格志向である。
,,□,遊園地（経営者）,,・11月の連休やその後の週末の天候が今一つであった。
,,□,住宅販売会社（従業員）,,・個人住宅では展示場来場者が依然少なく、法人受注も低調である。
,,□,住宅販売会社（従業員）,,・不動産の売却価格は底値状態であるが、客は現状よりも価格が低下すると思い取得に消極的である。
,,▲,商店街（代表者）,,・暖冬で気温が下がらず、えびす講などのイベントをやっても盛り上がらない。
,,▲,百貨店（売場主任）,,・客数の減少と客単価の低下が顕著である。
,,▲,百貨店（売場主任）,,・客の低価格志向がより厳しくなっており、定価ベースでは売る側からアプローチをかけても売れなくなっている。
,,▲,百貨店（売場主任）,,"・催事の効果がなく、売上が前年比で６％減少している。
・ギフトの単価が低下し、売上が悪い。"
,,▲,スーパー（企画担当）,,・１品単価、客単価の低下が続き、客の買い回り傾向が強まっている。
,,▲,スーパー（従業員）,,・９～11月にかけ、客数は横ばい状態であるが、売上は大きく前年割れの状態である。
,,▲,スーパー（総務担当）,,・客単価、買上点数ともに低下している。
,,▲,スーパー（経理担当）,,・10月以降、来客数、客単価ともに低い状況である。
,,▲,スーパー（店長）,,・特売回数が増え価格が低下しているにもかかわらず、もう一段の値下げをしないと客が反応しない。
,,▲,衣料品専門店（経営者）,,・郊外型大型集積店の出店で競争が激化し、各店のバーゲンラッシュに埋もれている状況である。
,,▲,衣料品専門店（店長）,,・単価の下落が続き、客数も減少している。
,,▲,家電量販店（総務担当）,,・携帯電話が普及したことで、売上が鈍化している。
,,▲,その他専門店［酒類］（経営者）,,・客単価がますます低下している。
,,▲,その他専門店［ガソリンスタンド］（営業担当）,,"・原油価格の上昇で仕入コストが上昇し、マージンが圧迫されている。
・気温が高く、冬タイヤなどの冬物商材の動きが悪い。"
,,▲,その他専門店［ガソリンスタンド］（経理担当）,,・原油高によるガソリン価格の上昇で、客がガソリン以外の商品の購入を控えている。
,,▲,一般レストラン（経営者）,,・２日間、回転寿司の100円均一セールを行い、１日目は1.8倍、２日目は２倍の売上があった｡・高額の皿も100円にした結果、多くの客が高額の皿ばかり食べていた。
,,▲,一般レストラン（スタッフ）,,"・客数が減少している。
・同業他社では、前年比65％ということである。"
,,▲,観光型ホテル（経営者）,,・11月は例年、低料金の大口団体が動く月であるが、キャンセルにより団体客数が減少しており、家族連れ等の個人客も館内における活気が感じられない。
,,▲,観光型旅館（経営者）,,・募集を中心としたツアーの集客が減少している。
,,▲,通信会社（営業担当）,,・市外電話のトータル通話料が３か月前と比べてかなり減少している。
,,▲,競馬場（職員）,,・客単価の低下傾向が続き、入場者数も前年比マイナスを続けている。
,,▲,住宅販売会社（従業員）,,・９～11月にかけて展示場への来場者数が減少し、それに伴い成約も減少している。
,,×,一般小売店［雑貨］（企画担当）,,・地域を限定せず、至るところの店舗の売上が減少している。
,,×,一般レストラン（経営者）,,・来客数が極端に減少している。
"企業
動向
関連

(東北)",,◎,－,－,
,,○,食料品製造業（経営者）,,・消費者の低価格志向を意識した商品作りの結果、10月の売上高が当社史上最大を記録し、11月も同水準を維持している。
,,○,電気機械器具製造業（経営者）,,"・具体的な引き合いが出てきている。
・組立加工の協力工場も年内は余裕がない状態である。"
,,○,電気機械器具製造業（企画担当）,,"・人材派遣会社に派遣要請をしても、人材を確保できない。
・官公庁からは、ＩＴ関連の引き合いが多くきている。"
,,○,通信業（企画担当）,,・３か月前と比較して仕事のボリュームが出てきている。
,,○,広告代理店（従業員）,,・年末商戦を控え、折込チラシ等が増加傾向であり、やや良くなっている。
,,□,食料品製造業（従業員）,,・地元での売上は上昇しているが、首都圏での売上が悪い。
,,□,電気機械器具製造業（従業員）,,・設備投資の計画はあるが、発注が停滞している。
,,□,建設業（企画担当）,,・情報関連産業や医療、福祉産業、一部の輸出産業に明るさはあるが、全体的な民間投資は弱い。
,,□,建設業（従業員）,,・周辺に計画はあるが、前進しない。
,,□,建設業（従業員）,,・県内の公共投資受注状況が、件数、契約金額ともに前年比マイナスとなった。
,,□,輸送業（経営者）,,・物量が若干増えているが、運賃は下がっている。
,,□,金融業（営業担当）,,・設備投資意欲が依然弱い状況である。
,,□,経営コンサルタント,,・経営者からのリストラの相談やリストラされた方からの相談が多い。
,,▲,食料品製造業（経営者）,,"・飲食店では客単価が低下し、客数は減少している。
・地酒を飲むのをやめて、焼酎へと変わっている。"
,,▲,輸送業（従業員）,,・輸送物量が前年同月よりも大幅に減少している。
,,▲,輸送業（従業員）,,・荷動きが悪く、前年との比較でも悪い。
,,▲,新聞販売店［広告］（店主）,,・大きな水産業者が倒産したので、周辺の関連会社に影響が出ている様子がみられる。
,,▲,コピーサービス業（総務担当）,,・小口、大口に関係せず倒産が多く、全体で悪くなっている。
,,×,繊維工業（総務担当）,,・得意先の販売状況からみて、消費低迷が続き、秋冬物の売上の伸びは望めない状況である。
"雇用
関連

(東北)",,◎,－,－,
,,○,求人情報誌製作会社（編集者）,,"・各業種とも首都圏からの参入が多く、市場は活性化しており、それに伴い雇用状況も堅調に推移している。
・良い会社と良くない会社との差がますます拡大している。"
,,○,新聞社［求人広告］（担当者）,,・募集の急激な伸びはないものの前年を上回っており、業種や内容の偏りはあるが総体的に上向き傾向である。
,,○,新聞社［求人広告］（担当者）,,・広告申込が増えている。
,,○,職業安定所（職員）,,"・新規求人が増加傾向にある。
・有効求人倍率が上昇傾向にある。"
,,○,職業安定所（職員）,,"・新規求人の受理状況が増加傾向にある。
・新規求職者、雇用保険受給者が減少している。"
,,○,職業安定所（職員）,,"・新規求人は全産業、全業種で発生している。
・求職者も、新規求職、有効求職で増加しており、中心は自発的離職者である。"
,,□,人材派遣会社（社員）,,・業況悪化による取引中断がある一方で、新規取引も発生しており、総体的に変わらない。
,,□,職業安定所（職員）,,"・事業主都合による離職者が依然多い。
・雇用保険受給者数が高水準で推移している。"
,,□,職業安定所（職員）,,"・製造業、サービス業、小売業からの求人は増えている。
・一方で人員整理を行う会社も増えている。"
,,□,職業安定所（職員）,,・求人は前年同月比で大幅な増加になっているが、３か月前の水準と比べ同程度かやや減となっている。
,,□,職業安定所（職員）,,"・電気機械、卸小売業などの求人は依然好調である。
・事業主都合による離職者数が高い水準にあり、求職者の増加傾向が続いている。"
,,▲,アウトソーシング企業（社員）,,・前年と比較して、明らかに受注が減少している。
,,▲,新聞社［求人広告］（担当者）,,・新聞広告の申込が前年に比べやや落ちてきている。
,,×,＊,＊,
,,,,,
　３．北関東,,,,,
,,,,（－：回答が存在しない、＊：主だった回答等が存在しない）,
分野,,景気の現状判断,業種・職種,景気の現状に対する判断理由,
"家計
動向
関連

(北関東)",,◎,＊,＊,
,,○,スナック（経営者）,,・忘年会シーズンで予約が入るようになった。
,,○,設計事務所（所長）,,・小さい仕事だが、確認申請の案件が増加している。
