Ⅰ．景気の現状に対する判断理由等,,,,,
,,,,,
　景気の現状に対する判断の理由及びそれに対する追加説明等について、その主だったもの及び特徴的と考えられるものを取りまとめると以下のとおりであった。,,,,,
,,,,,
,,,,,
　１．北海道,,,,,
,,,,,（－：回答が存在しない、＊：主だった回答等が存在しない）
分野,,景気の現状判断,業種・職種,判断の理由,追加説明及び具体的状況の説明
"家計
動向
関連

(北海道)",,◎,－,－,－
,,○,商店街（代表者）,単価の動き,・コートを中心に単価の高い商品が売れている。
,,□,百貨店（売場主任）,お客様の様子,・必要な物にしか金を使わない傾向が続いている。婦人服、食品の売上は増加しているが、紳士服、リビング関連商品については減少している。
,,□,百貨店（売場主任）,単価の動き,・コートの買換えやまとめ買いが少なく、単価が低下したままである。
,,□,スーパー（店長）,単価の動き,・来客数が減少し、消費単価は低下したままである。
,,□,コンビニ（エリア担当）,販売量の動き,・来客数は前年並みだが、買上件数、売上が低迷したままである。
,,□,コンビニ（エリア担当）,競争相手の様子,・競合店の出店により競争が激化し、低価格化が進んでいる。
,,□,コンビニ（店長）,単価の動き,・単価が低下しており、売上は１割減少しているが、来客数は前年並みに回復している。
,,□,家電量販店（店員）,お客様の様子,・客が購買に慎重になっている。来客数が減少し、単価は低下している。
,,□,住関連専門店（統括）,単価の動き,・来客数は増加しているが、単価が上昇しておらず、売上に変化がない。
,,□,高級レストラン（スタッフ）,来客数の動き,・２頭目のBSE（牛海綿状脳症）発見の影響で、鉄板焼の店舗の来客数が減少したが、レストラン、宴会の来客数に変化はない。
,,□,高級レストラン（スタッフ）,お客様の様子,・米国テロの影響による国内旅行へのシフトにより観光客が増加し、牛肉を使用したメニューの売上も回復している。レストラン、個室利用の売上は、前年の実績に届かないものの、最悪の状況からは脱しつつある。
,,□,スナック（経営者）,来客数の動き,・街の人通りが少なく、来客数が減少している状況が続いている。
,,□,旅行代理店（従業員）,来客数の動き,・海外旅行の受注が依然として低調である。
,,□,タクシー運転手,お客様の様子,・冬期の需要期に入っているが、３か月前と比べて乗客数が若干増加している程度である。
,,▲,商店街（代表者）,お客様の様子,・販売促進活動をしても、なかなか財布のひもを緩めない客が目立つ。
,,▲,商店街（代表者）,販売量の動き,・11月の前半の気温が例年より暖かかったため、衣料品の動きが鈍い。
,,▲,商店街（代表者）,お客様の様子,・本来なら予約注文が多い月であるが、ボーナスの減少などにより、なかなか実売に結び付かない。
,,▲,百貨店（売場主任）,来客数の動き,・単価は上昇しつつあるが、来客数が減少している。
,,▲,スーパー（店長）,お客様の様子,・BSE（牛海綿状脳症）の影響で食肉部門が不振である。また、地元炭鉱の閉山、スーパーの倒産などの暗い話題が多く、客の財布のひもが更に固くなっている。
,,▲,スーパー（店長）,来客数の動き,・他店との競争激化とBSE（牛海綿状脳症）の影響で、来客数が減少している。
,,▲,スーパー（企画担当）,お客様の様子,・消費行動の二極分化が激しくなっている。食品に関しては相変わらず客の財布のひもが固い。
,,▲,スーパー（企画担当）,単価の動き,・売上に占める割合が高い食品や衣料品の単価が前年よりも１割低下している。
,,▲,乗用車販売店（従業員）,販売量の動き,・年収が減少している客が多く、ボーナス前であるが買換えが進まない。
,,▲,旅行代理店（従業員）,販売量の動き,・来客数が前年を下回っていることに加え、海外旅行を中心に旅行代金が大幅に値下がりしている。また、海外旅行の取扱の減少を補うほどには国内旅行の取扱が増加しておらず、売上が減少している。
,,▲,タクシー運転手,来客数の動き,・迎車が減少している。
,,▲,タクシー運転手,来客数の動き,・日中の人通りが少なく、市内は人よりもタクシーの方が多いくらいで、利用者数が減少している。
,,▲,パチンコ店（店員）,来客数の動き,・例年11月後半になると、来客数が増加し、客単価も上昇するものだが、今年は、前年、一昨年と比べて落ち込んでいる。
,,▲,その他レジャー施設（職員）,お客様の様子,・大規模イベントの減少に伴い、施設内の売店も来客数が落ち込んでいる。施設へのリピーターが増加しているためか、来店しても購入までに至らないケースが増加している。
,,▲,美容室（経営者）,来客数の動き,・来客数が、前年と比べて１割減少している。
,,▲,設計事務所（所長）,それ以外,・客からの依頼がほとんどない。
,,×,家電量販店（経営者）,お客様の様子,・地元炭鉱閉山の影響で消費が冷え込み、単価が低下している。
,,×,高級レストラン（経営者）,来客数の動き,・BSE（牛海綿状脳症）の影響で、来客数が大幅に減少している。
,,×,一般レストラン（スタッフ）,単価の動き,・来客数が減少し、単価も低下している。
,,×,旅行代理店（従業員）,それ以外,・営業時間中に電話が全く鳴らなくなっている。
,,×,旅行代理店（従業員）,販売量の動き,・米国テロの影響で個人旅行客も手控えムードが続いており、海外旅行の受注が前年比で７割程度である。
,,×,観光名所（役員）,来客数の動き,・米国テロの影響もあり、旅行の安近短の傾向が強まったため、航空機を利用する道外客の入込が減少している。沖縄方面から北海道に変更した客も期待したほど増加していない。
"企業
動向
関連

(北海道)",,◎,－,－,－
,,○,食料品製造業（経営者）,受注量や販売量の動き,・BSE（牛海綿状脳症）の影響で、年末用品の受注において、水産物ギフトの注文が例年より増加している。
,,○,通信業（営業担当）,取引先の様子,・システム設計及びＩＴ系インフラの構築には時間がかかるため、既に来年度をにらんだ案件が出てきており、投資額が大きい案件も増加している。また、新たなビジネスモデル構築に絡む案件があるなど、前向きな商談が増加している。
,,□,司法書士,取引先の様子,・不動産取引が停滞気味である。
,,□,その他企業［コンベンション担当］（従業員）,受注量や販売量の動き,・受注量が少ない状況が続いている。
,,▲,食料品製造業（団体役員）,受注量や販売量の動き,・年末需要に向けて見込生産をしているが、消費が低迷しており、企業の経営環境は更に悪化している。
,,▲,輸送業（営業担当）,受注量や販売量の動き,・需要の減少により、貨物量が減少している。
,,▲,金融業（企画担当）,それ以外,・米国テロやBSE（牛海綿状脳症）の影響を直接受けている企業は少ないが、経営者のマインドが慎重になっている。
,,▲,その他サービス業［建設機械リース］（支店長）,取引先の様子,・11月で既に工事関係が終わりかけており、取引先でも従業員の解雇が目立つ。
,,▲,その他非製造業［機械卸売業］（従業員）,取引先の様子,"・金属機械加工関連の取引先では、秋口以降の仕事量が減少しているため、各社が発注業者への売込を強化しており、加工単価が低下している。
・短納期の受注が増加している。納期に対応するため残業するが、その仕事が終了すると人員が余るので、経費が増加し採算が合わない。"
,,×,輸送業（支店長）,受注量や販売量の動き,・一戸建て住宅の販売不振や、家庭用雑貨の消費低迷などにより、物流量が減少している。
"雇用
関連

(北海道)",,◎,－,－,－
,,○,＊,＊,＊
,,□,求人情報誌製作会社（編集者）,周辺企業の様子,・地元大手スーパーの新規展開がある一方で、中心商店街における閉店や書籍販売店の倒産がみられる。
,,□,職業安定所（職員）,求職者数の動き,・新規求職登録数が、高水準のまま推移している。
,,▲,求人情報誌製作会社（編集者）,求人数の動き,・建設業以外では求人件数が減少している。特に運輸業での落ち込みが目立つ。
,,▲,求人情報誌製作会社（編集者）,求人数の動き,・年末年始商戦に向けての短期アルバイト募集が出始めているが、全体的にみると求人掲載の件数は減少している。
,,▲,新聞社［求人広告］（担当者）,求人数の動き,・人材募集広告の件数が大きく落ち込んでいる。
,,▲,職業安定所（職員）,求人数の動き,・新規求人件数が３か月連続で前年を下回り、新規求職件数は４か月連続して上回っている。
,,▲,職業安定所（職員）,雇用形態の様子,・求人の増加はパートが中心であり、求職者の希望に合致せず、就職に至らないケースが多い。
,,×,新聞社［求人広告］（担当者）,求人数の動き,・求人広告件数が、前年よりも２割程度減少している。
,,,,,
　２．東北,,,,,
,,,,,（－：回答が存在しない、＊：主だった回答等が存在しない）
分野,,景気の現状判断,業種・職種,判断の理由,追加説明及び具体的状況の説明
"家計
動向
関連

(東北)",,◎,－,－,－
,,○,一般小売店［書籍］（経営者）,販売量の動き,・ヒット商品の登場で、売上が増加している。
,,○,百貨店（売場責任者）,販売量の動き,・来客数は堅調に推移し、年間最大の売出しも前年実績をクリアしているが、暖冬の影響で重衣料の動きが今一歩である。
,,○,百貨店（広報担当）,それ以外,・競合店との共同イベントや物産展の単独開催、地元サッカーチームのＪ１昇格記念セールなどが全体に効果的に作用している。
,,○,住関連専門店（経営者）,お客様の様子,・いろいろな催事を企画すれば、客の買上率が多少上昇する。
,,○,観光型旅館（経営者）,お客様の様子,・紅葉の色づき状況が良く、今秋は前年並み又は多少良い。
,,□,一般小売店［スポーツ用品］（経営者）,お客様の様子,・子供は親に金のない状況をよくわかっているので、来店しても買物を我慢している。
,,□,百貨店（企画担当）,お客様の様子,・今月は催事強化やイベント強化で比較的売上は良かったが、単価が低下しているので、企画力で集客して、数で売上をとらざるを得ない。
,,□,スーパー（経営者）,販売量の動き,・主力商品の値下げで販売量が急伸し多少の売上増となっているが、これでは利益にならない。
,,□,スーパー（店長）,来客数の動き,・客単価は依然として前年を下回っているが、下げ止まっており、来客数は横ばいか、やや上向きになっている。
,,□,スーパー（店長）,販売量の動き,・BSE（牛海綿状脳症）問題発生以来、牛肉売上が前年比60％に低迷し、割引セールを実施しても伸びない。野菜類も前年比80％台と低迷しているため、牛肉と合わせて主力生鮮２部門の低迷で非常に大きな影響が出ており、厳しい状況が続いている。
,,□,高級レストラン（支配人）,単価の動き,・今月前半は高級レストランが売上を伸ばしたもののカジュアルレストランは苦戦し、後半はカジュアルレストランが回復し前年並みを確保したが、依然として客単価は低下し、厳しい状況が続いている。
,,□,観光型ホテル（経営者）,来客数の動き,・来客数は例年より10％ほど増加しているが、宿泊料金と館内消費の低迷で売上が全く変わらない。
,,□,都市型ホテル（スタッフ）,競争相手の様子,・景気は良くないが、経営状態が悪いという噂の競合ホテルから客が流れてきており、それで相殺されている。
,,□,都市型ホテル（スタッフ）,来客数の動き,"・来客数は、レストラン、宿泊部門を中心に前年比で減少し続けている。特に宿泊部門の落ち込みが大きい。
・消費単価の下落は歯止めがかからず、館外店舗においても同様である。"
,,□,遊園地（経営者）,来客数の動き,"・イベントに対する客の反応が良くない。
・今月は気温が高く好天が続き、来客数は前年を上回っているが、計画をクリアできない。"
,,▲,一般小売店［茶］（経営者）,お客様の様子,"・仏事関係で売上に動きがあったものの一時的なものであり、来客数は前月と比較して大差のない状況である。
・食品以外の茶器類などは、あるものを使うという客が多い。"
,,▲,百貨店（売場主任）,単価の動き,・催事などで来客数は伸びており盛り上がりはあるものの、客単価が低く売上は今一つ増えない。
,,▲,スーパー（経営者）,競争相手の様子,・地元のスーパーやドラッグストア、全国チェーンのスーパーなどのチラシ攻勢が月を追って激しくなっている。100円均一セールではもはや割安感はなく、88円、77円セールとどんどんエスカレートしている。年末商戦に向け、体力勝負の消耗戦に拍車がかかってきている。
,,▲,スーパー（経営者）,来客数の動き,・来客数はほぼ変わらなかったものの、売上が12％ほど減少している。
,,▲,コンビニ（店長）,単価の動き,・来客数に大きな変化はないが、客単価は曜日による変化はなく、横ばいか下降している。
,,▲,衣料品専門店（店長）,販売量の動き,・冷え込みが体感的に厳しくなく、冬物衣料が不振で点数も伸び悩んでいる。
,,▲,家電量販店（店長）,お客様の様子,・商品の支払方法を、来年の夏のボーナス払いや長期クレジット払いにするなど、時間をかけたものにする客が増えている。
,,▲,乗用車販売店（経営者）,販売量の動き,・販売量において、中古車は動きが良くこのところ前年実績を上回っているが、新車は前年比85％前後である。新車ディーラーのため新車が売れないと社員の士気が上がらない。
,,▲,乗用車販売店（営業担当）,来客数の動き,・時期的にタイヤ交換や点検などのサービス来場は多いが、商談ベースの来場は招待者以外ほとんどない。
,,▲,乗用車販売店（総務担当）,販売量の動き,・来客数、販売量ともに減少し、特に売上単価に関しては、高額商品から低額商品に移行している。
,,▲,住関連専門店（経営者）,お客様の様子,・慎重に購入する客が多く、金を持っている高齢者との商談だけが成立している。
,,▲,その他専門店［事務用品］（経営者）,販売量の動き,・見積依頼は非常に多いものの、実際に購入する客がなかなかおらず、検討段階にとどまる場合が多くて苦戦している。
,,▲,その他専門店［ガソリンスタンド］（経理担当）,販売量の動き,・スタッドレスタイヤの予約状況が例年より鈍く、通常なら３年ではきかえるタイヤを４年から５年使用する客が増加している。
,,▲,一般レストラン（スタッフ）,単価の動き,・来客数は前年比で増加しているものの、売上単価は低下している。
,,▲,観光型旅館（経営者）,来客数の動き,・米国テロにより海外旅行客が国内に回帰しているといわれるが実感はなく厳しい。
,,▲,タクシー運転手,お客様の様子,・客のタクシーへの乗り控えが目立つ。
,,×,一般小売店［医薬品］（経営者）,競争相手の様子,・同じ町内の同業者が閉店したが、それに伴う取り込み需要がなく、売上が増加しない。
,,×,一般小売店［雑貨］（企画担当）,単価の動き,・商品単価の低下だけでなく、売上点数も前年に比べ減少している。
,,×,スーパー（経営者）,それ以外,"・依然として商品単価が下落している。
・今月は、取引先の３件が資金不足で倒産している。"
,,×,スーパー（経営者）,来客数の動き,・米国テロ、BSE（牛海綿状脳症）の影響が現在もなお続いており、客の買物動向は非常に厳しい。同時に買物回数を控えており、来客数が減少している。
,,×,スーパー（店員）,販売量の動き,・販促により来客数は前年より増加したが、売上は減少し、買上単価、点数ともに落ち込み、販促対策の効果がなくなっている。
,,×,スーパー（企画担当）,販売量の動き,・１品単価の下落が依然として続いているが、ここにきて比較的順調であった販売点数までもが前年を下回りつつあり、既存店を中心に売上の減少する店が増加している。
,,×,スーパー（総務担当）,単価の動き,・食品の１品単価が1.1％ずつ低下しているが、それ以上に非食品の１品単価が7.8％低下している。
,,×,衣料品専門店（店長）,単価の動き,・価格を下げて集客しているが、競合他社以上に単価を下げた分だけ売れている。それが来客数の増加につながっておらず、全体の売上は減少している。
,,×,家電量販店（店長）,来客数の動き,・品定めで来店する客が多く、ボーナスが支給されないとなかなか購入を決定できない。
,,×,乗用車販売店（営業担当）,販売量の動き,・新車販売は、来客数の減少と購買意欲の低下で今月は２けたの前年割れで大苦戦している。中古車販売は、前年並みをキープしてはいるが、単価は低下傾向にある。
,,×,住関連専門店（経営者）,販売量の動き,・家具などの耐久消費財の買い控えが顕著に表れている。
,,×,その他専門店［家電］（経営者）,単価の動き,・毎年今ごろは年末商戦で売上が増加していたが、今年は相変わらず単価が低く、情報家電特にパソコンなどの売上が前年より悪い。
,,×,その他専門店［ガソリンスタンド］（営業担当）,単価の動き,・急激な原油価格の低下や販売見込み違いのため、在庫が増加しており、市場では灯油の投げ売りが発生し、価格競争が激化している。
,,×,一般レストラン（経営者）,単価の動き,・来客数は同じでも、料理を抑え酒を多くという客が増え、客単価が低下している。
,,×,スナック（経営者）,来客数の動き,・昼のランチと夜のスナックと１日２回営業しているが、今月は夜の来客数がゼロという日が３日もあり、いまだかつてない状況となっている。
,,×,タクシー運転手,単価の動き,・タクシー乗客は、近くまでの利用が多く、遠くまでの利用は非常に少ない。
,,×,観光名所（職員）,単価の動き,・団体客は最初から値引きの要求をしてくるが、個人客でもフロントに来てから値引き方法はないかという質問を多くするようになってきている。また、割引券などを事前に入手し持参する客も多い。
,,×,テーマパーク（職員）,来客数の動き,・海外からの客が前年比で４割減少している。
,,×,競艇場（職員）,単価の動き,・１人当たり約２万円だった購買額が、現在では１万６千円位に低下している。
,,×,住宅販売会社（従業員）,単価の動き,・宅地販売では住宅金融公庫利用者層の契約率が落ちている。逆に特徴的なのは現金客が増加しているが、こういった客は値引きによる安い価格で契約しているため単価は低下している。
"企業
動向
関連

(東北)",,◎,－,－,－
,,○,－,－,－
,,□,金融業（営業担当）,取引先の様子,・取引先では運転資金、設備資金ともに借入を最小限に抑えるスタンスが続いている。
,,□,その他企業［管理業］（従業員）,受注量や販売量の動き,・受注量が少ないため、従業員の一時帰休を始めており、新製品の製造を開始する来春まではこの状態が続く。
,,□,その他企業［企画業］（従業員）,取引先の様子,・取引先のデザイン企画会社の話では、ユーザーからの新しい案件が極めて少ないということである。
,,▲,食料品製造業（経営者）,受注量や販売量の動き,・低価格傾向が強まっていることに加え、最近では受注量も減少してきている。
,,▲,電気機械器具製造業（総務担当）,受注量や販売量の動き,・米国テロの影響で、北米からの受注量が減少している。
,,▲,通信業（企画担当）,取引先の様子,・従来より医療情報化処理の営業開発に従事してきたが、診療報酬引下げの動きが出たため、直接収入増に結び付かないシステム投資の動きは鈍くなっている。
,,▲,新聞販売店［広告］（店主）,取引先の様子,・市内のデパートが１店閉鎖となり、そのチラシが入らなくなるため、当店も厳しい。また、周辺の商店街への集客力も低下するので、当店へのチラシの減少を含め、いろいろな方面に悪い影響が出る。
,,▲,その他非製造業［飲食料品卸売業］（経営者）,受注価格や販売価格の動き,・標準小売価格や卸価格はあるが、デフレ価格に踊らされ底値がみえず、値段がいくら安くても商品が動かない状況となっている。メーカーも商品サイクルを短くするなど投げ売り的な商品をつくっている。
,,×,繊維工業（総務担当）,受注量や販売量の動き,・秋冬物と春夏物の端境期であるが、発注時期が前年よりも１か月程度遅れている。
,,×,出版・印刷・同関連産業（経理担当）,受注量や販売量の動き,・10月の受注量は最近にない落ち込みを示したが、11月に入っても回復せず、更に悪くなっている。
,,×,一般機械器具製造業（経理担当）,受注量や販売量の動き,・下期予算の見直しを実施したが、そのスタート月である10月実績が売上計画に対して大幅な未達となり、既に計画と実績のかい離が生じている。
,,×,輸送業（従業員）,受注量や販売量の動き,・依然として航空貨物の中心であるＩＴ関連部品の伸びがない。
"雇用
関連

(東北)",,◎,－,－,－
,,○,－,－,－
,,□,人材派遣会社（社員）,雇用形態の様子,・各企業ともに先行き不透明で雇用を抑制する傾向が強く、業務があっても社員採用はもちろん派遣利用でさえも単価が高いという理由で折り合わない。結局、社員の残業でカバーするかパート利用にシフトしている。
,,□,求人情報誌製作会社（編集者）,採用者数の動き,・年末に向けてパートを雇用する企業が増えているが、前年同様の動きである。
,,▲,職業安定所（職員）,周辺企業の様子,"・年末から年明け後にかけて、地元で300名以上の規模の雇用調整の予定である。
・現在、一時帰休の申込が相当数出ている。"
