Ⅰ．景気の現状に対する判断理由等,,,,,
,,×,輸送業（従業員）,受注量や販売量の動き,・米国テロの影響で、航空貨物の輸出入の量が今年度で最も悪化しており、国内航空貨物量も制約が増えたため、大幅に減少している。
"雇用
関連

(東北)",,◎,－,－,－
,,○,－,－,－
,,□,人材派遣会社（社員）,採用者数の動き,・正社員から派遣へのシフトということもあるが、オーダー数は横ばいからむしろ増加しており、必ずしも景気が悪いとはいえない。
,,▲,人材派遣会社（社員）,求人数の動き,・製造業の取引先では、長期の取引先でも、契約打切りの話が出てきている。
,,×,人材派遣会社（経営者）,雇用形態の様子,・派遣社員がしていた業務を正社員が兼務し、派遣社員の契約を中止する企業が出てきている。
,,×,人材派遣会社（社員）,求人数の動き,・前年まではエンジニアの採用に支えられてきたが、その採用もなくなり、これに代わるものがない。
,,×,求人情報誌製作会社（編集者）,雇用形態の様子,・正社員の募集数が減少し、アルバイトや派遣の募集が増えている。
,,×,求人情報誌製作会社（編集者）,雇用形態の様子,・社員としての雇用が減少し、社員からアルバイトやパートへのシフトが増えている。
,,×,新聞社職員［求人広告］（担当者）,求人数の動き,・求人の申込件数が、前年比70％まで低下している。
,,×,職業安定所（職員）,求職者数の動き,・月間で、かつてないほどの企業整理があり、電気機械器具製造業を中心に事業主都合離職による求職者が急増している。
,,×,職業安定所（職員）,求人数の動き,・新規求人数が前年比で大幅に減少し、特に電気機械器具製造業の求人が62％の減少になっている。
,,,,,
　３．北関東,,,,,
,,,,,（－：回答が存在しない、＊：主だった回答等が存在しない）
分野,,景気の現状判断,業種・職種,判断の理由,追加説明及び具体的状況の説明
"家計
動向
関連

(北関東)",,◎,－,－,－
,,○,百貨店（担当者）,来客数の動き,・１週間の大型催事によって、客の動きが非常に活発になっている。ファッション小物を中心に動きが出てきている。
,,○,衣料品専門店（経営者）,単価の動き,・来客数は減少しているが、婦人服、化粧品の１品当たり単価が上昇し、販売数も増加しており、売上金額全体を押し上げている。
,,□,百貨店（店長）,お客様の様子,・高額品、婦人用品、婦人服の売上は伸びているが、服飾雑貨、小物類、セール商品の売行きが芳しくなく、全体では変わらない。
,,□,百貨店（販売促進担当）,販売量の動き,・BSE（牛海綿状脳症）の影響により肉の売上は前年比50％となっているが、その他の商品の売上は全体的に前年並みで変わらない。
,,□,スーパー（統括）,来客数の動き,・来客数は５～10％程度増加しているが、客単価が低下している。特に、食品の売行きが悪くなっている。
,,□,衣料品専門店（経営者）,単価の動き,・夏物が低価格であったので、秋物、冬物も低価格となっている。
,,□,乗用車販売店（従業員）,単価の動き,・新型の軽自動車が発売になり、契約台数は増加しているが、売上単価が上昇しない。
,,□,遊園地（職員）,来客数の動き,・主要客層であるヤング層が、遊びに出かける回数を減らしている状況に変わりはない。
,,□,ゴルフ場（営業企画担当）,単価の動き,・客単価の低下が続いている。
,,□,競輪場（職員）,来客数の動き,・土日を中心に来客数が減少傾向にあり、売上も減少が続いている。
,,□,その他サービス［自動車整備業］（事務長）,お客様の様子,・前年より台数が多少増加している。ただし、高額の部品交換に関しては、客は中古品、再生品を選択している。
,,□,設計事務所（所長）,単価の動き,・単価の高い仕事が出てきているが、受注量は３か月前と変わらない。
,,□,住宅販売会社（経営者）,お客様の様子,・客の成約までの時間が従来より延びており、価格等条件面での提示も厳しい状況が続いている。
,,▲,商店街（代表者）,単価の動き,・農協祭等での売出しの際には食品は動いている一方で、身の回り品では低単価の商品しか動かず、高額商品を購入する客はいない。
,,▲,商店街（代表者）,単価の動き,・単価の低い商品は売れるが、高級品は値引きをしても売上がなかなか伸びない。
,,▲,一般小売店［金物］（経営者）,販売量の動き,・３か月前と比べて、来客数が２割減少している。
,,▲,百貨店（販売促進担当）,販売量の動き,・全体的に食品の売上がやや悪くなっている。特に、BSE（牛海綿状脳症）の影響で、肉の売上は半分以下に落ち込んでいる。
,,▲,スーパー（経営者）,来客数の動き,・競合店の影響により、来客数が前年より0.5％、売上も同0.6％下回っている。
,,▲,スーパー（経営企画担当）,競争相手の様子,・競争相手がチラシを出す回数が増え、中身も厳しくなってきている。
,,▲,乗用車販売店（経営者）,お客様の様子,・客は、好みの車があっても買い控えて現在使用している車で妥協している。
,,▲,自動車備品販売店（経営者）,お客様の様子,・今まで景気の良かった銀行や工場に勤めていた客が、リストラにあって仕事を失っている。
,,▲,住関連専門店（経営企画責任者）,販売量の動き,・客は必要な物以外購入しない。
,,▲,高級レストラン（店長）,来客数の動き,・９月まではランチタイムはほぼ満席であったが、10月には満席にならない日が目立っている。
,,▲,一般レストラン（経営者）,競争相手の様子,・ある程度人数のまとまった宴会予約が少ないので、売上増加につながらない。
,,▲,観光型ホテル（スタッフ）,来客数の動き,・前年の同時期と比べて、忘年会の問い合わせが少ない。
,,▲,旅行代理店（経営者）,単価の動き,・客の需要が減少している中で、競争が一層激しくなり、単価が低下している。
,,▲,旅行代理店（営業・管理担当）,それ以外,・米国テロの影響で、航空券、海外旅行の販売が減少している。
,,▲,通信会社（事業担当）,販売量の動き,・ＡＤＳＬ、ＣＡＴＶ、インターネット等の事業において、格安のＡＤＳＬ業者に押され、申込者数が減少してきている。
,,▲,観光名所（職員）,お客様の様子,・土産品、飲食関連の売上が、かなり落ち込んでいる。
,,▲,ゴルフ場（支配人）,来客数の動き,・秋のトップシーズンであるが、土日祝日の予約を除くと、平日のコンペが少ない。
,,▲,設計事務所（所長）,お客様の様子,・計画が先送りになっている物件が、いくつか出てきている。
,,×,商店街（代表者）,来客数の動き,・今まで客の途切れることがなかった商店街であるが、平日の昼間でも、客が全くいない通りになってしまっている。
,,×,一般小売店［精肉］（従業員）,それ以外,・BSE（牛海綿状脳症）の風評被害により牛肉が全く売れなくなり、それに伴い来客数も減少している。客が牛肉を食べないようになっている。
,,×,衣料品専門店（販売担当）,来客数の動き,・地域の銀行破綻、米国テロを受けた武力行使、BSE（牛海綿状脳症）は、客にかなりの打撃を与え、店の客足が止まっている。
,,×,家電量販店（店長）,お客様の様子,・客の商品購入態度が鈍っている。即決せずに時間をかけて購入しており、財布のひもは固い。
,,×,乗用車販売店（営業担当）,お客様の様子,・必要に迫られて自動車を購入する予定の客が、他店と比べて交渉するため販売条件が乱れ、利益が残らない商談が増えている。
,,×,その他専門店［携帯電話］（店長）,来客数の動き,・キャンペーンを行っても、客が集まらない。
,,×,スナック（経営者）,単価の動き,・来客数、客単価ともに落ち込んでいる。どの店も客寄せのために値下げに走り、悪循環となっている。
,,×,都市型ホテル（経営者）,それ以外,・地域の信用金庫が倒産し、その影響で店を閉めるところが近所にもある。
,,×,旅行代理店（従業員）,お客様の様子,・米国テロを受けた武力行使の影響で、海外の動向を気にする客のキャンセルが相次いでいる。
,,×,タクシー運転手,お客様の様子,・夜遅くなると、通行人や酒を飲む客も少なく、仕事がない。
,,×,タクシー運転手,販売量の動き,・毎年10月には９月と比べ、利用客が２、３割増加するが、今年は１割以上減少している。特に、飲み客等の夜の利用が減少している。
,,×,ゴルフ練習場（経営者）,単価の動き,・来客数は減少し続けており、客単価も低下している。
,,×,住宅販売会社（経営者）,それ以外,・不動産の価格下落が依然として続いており、銀行の融資が厳しく、痛手を負っている。街中でも、空き店舗やマンションの空室が目立っている。
"企業
動向
関連

(北関東)",,◎,－,－,－
,,○,一般機械器具製造業（経営者）,受注量や販売量の動き,・新規受注品が本格的に立ち上がってきている。
,,○,一般機械器具製造業（生産管理担当）,取引先の動き,・受注量等にはつながっていないが、新規取引先や新規の品物がかなり動き始めている。
,,□,食料品製造業（製造担当）,受注量や販売量の動き,・受注、販売数量に大きな変化はない。
,,□,化学工業（総務担当）,受注量や販売量の動き,・夏に販売量が急に減少し、そのままの状況が続いている。
,,▲,プラスチック製品製造業（経営者）,受注量や販売量の動き,・米国テロ以降客が発注を手控えることが多く、受注量が非常に減少している。
,,▲,輸送業（営業担当）,取引先の動き,・取扱商品の価格競争が激しく売り込みの力が大分鈍り、取扱数量は落ち込んでいる。
,,▲,金融業（経営企画担当）,取引先の動き,・米国テロ、BSE（牛海綿状脳症）等の影響が取引先に出ている。旅館、ホテル等で外国人のキャンセルが多くなっており、精肉店では２～３割、焼肉店では５割の売上減少となっている。
,,▲,新聞販売店［広告］（総務担当）,受注量や販売量の動き,"・チラシの出稿量は、７か月連続で前年を下回り、減少幅も１けたから２けたになってきている。
・取引先のディーラーが、チラシを２色から１色に切替えている。"
,,▲,その他サービス業［放送］（営業担当）,受注量や販売量の動き,・スポット物のコマーシャルの受注件数及び価格は、軟調に推移している。
,,×,食料品製造業（営業統括）,受注量や販売量の動き,・例年、秋には工場見学者が多く売上金額も相当あるが、今年はいずれも目立って減少しており、３か月前より悪くなっている。
,,×,電気機械器具製造業（経営者）,受注量や販売量の動き,・月を追うごとに受注量が減少している。製造業は日本で成り立たないのではないかというほど回復の見込みがなく、先がみえない。
,,×,精密機械器具製造業（経営者）,取引先の動き,・値下げ競争が激化している。
,,×,輸送用機械器具製造業（総務担当）,受注量や販売量の動き,・３か月前に比べ受注量は５％減少している。工業団地内の同業者も休業日が増加している。
,,×,その他製造業［宝石・貴金属］（経営者）,受注量や販売量の動き,・店頭での販売が大幅に落ち込んでいる。米国テロを理由に、宝飾品の買い控えが出ている。
,,×,建設業（総務担当）,取引先の動き,・ゴルフ場工事の残金の入金が遅れている。
"雇用
関連

(北関東)",,◎,－,－,－
,,○,＊,＊,＊
,,□,求人情報誌製作会社（経営者）,周辺企業の様子,・周りの企業からの受注量に変化がない。
,,▲,求人情報誌製作会社（経営者）,求人数の動き,"・焼肉チェーンなどの広告アルバイト、パートの募集は、BSE（牛海綿状脳症）の関係で極端に減少している。一般の大手ファミリーレストランについては、求人広告が相応にある。
・他方、製造業での求人は止まっており、広い意味のサービス業での求人が中心となっている。"
,,▲,職業安定所（職員）,周辺企業の様子,・電気機械器具製造業を中心とした大幅な受注減少に伴い、余剰人員を抱えている事業者においては、人員整理、配置転換等のリストラや休業等の雇用調整の実施が本格化しつつある。
,,▲,学校［短期大学］（就職担当）,求人数の動き,・合同就職面接会では、コンピュータや研究開発の技術者、高度な知識を有する営業職の求人が目立っている。学生が希望する事務職については、企業は欠員が生じても配置転換等でやりくりをしている。
,,×,人材派遣会社（経営者）,採用者数の動き,・業種を問わず、人材派遣のオーダーが減少している。特に、販売促進キャンペーン等の営業イベントが影を潜め、関連の要員派遣が皆無に近い状態である。
,,×,人材派遣会社（経営者）,雇用形態の様子,・大手企業の人件費の単価が、20年前の水準に戻っている。
,,×,職業安定所（職員）,求職者数の動き,・倒産やリストラなどによる非自発的離職者が若年層にも広がり、新規求職者数が過去最高になるなど、求職者数が増加する一方である。
,,×,民間職業紹介機関（経営者）,採用者数の動き,・大手企業の県内子会社で、大胆なリストラ、廃業が予定されている。特に半導体関係は厳しく、開発志向型の子会社でも、規模によっては事実上の廃業を選択している企業が目立ち始めている。
,,,,,
　４．南関東,,,,,
,,,,,（－：回答が存在しない、＊：主だった回答等が存在しない）
分野,,景気の現状判断,業種・職種,判断の理由,追加説明及び具体的状況の説明
"家計
動向
関連

(南関東)",,◎,タクシー運転手,お客様の様子,・原宿や代官山を始め東京の街に人があふれている。先日のテロの影響も10日程度で収まっている。
,,○,一般小売店［家具］（経営者）,販売量の動き,・３か月前と比べ、確実に販売量が伸びており、客の反応も良くなっている。
,,○,百貨店（営業企画担当）,お客様の様子,・パターンメードの靴やバッグがベストセラーになるなど、ファッション性等の付加価値がある商品を求め、百貨店に客が戻っている。
,,○,家電量販店（営業部長）,販売量の動き,・家電リサイクル法の施行後落ち込んでいた冷蔵庫、洗濯機、エアコンが持ち直している。また、プラズマディスプレー、液晶テレビなど、薄型の新機能テレビが売れ始めてきている。
,,○,一般レストラン（経営者）,来客数の動き,・宴会と家族層の予約が好調である。
,,○,旅行代理店（従業員）,販売量の動き,"・会社全体の販売量は減少しているものの、今月担当している仕事は多忙であり、やや良くなっている。
・客に旅行の意欲があり、海外旅行から国内旅行へのシフトがみられる。"
,,○,その他レジャー施設［アミューズメント］（職員）,来客数の動き,・ファミリー層が増加し、来客数が増えている。
,,□,百貨店（売場主任）,単価の動き,・セール品はある程度動いているが、高額品の動きが悪い。来客数は減少していないものの、売上全体としては伸び悩んでいる。
,,□,百貨店（売場主任）,販売量の動き,・全体としては厳しいが、ニットやプレタポルテの動きが好調で、ほぼ変わらない状況である。
,,□,百貨店（企画担当）,販売量の動き,"・婦人服ヤングキャリア部門では、単価の稼げるコート、ジャケットの動きが良く、紳士服では、前年不振であったスーツが好調である。しかし、ブーツの不振が続く婦人靴の売上は、大幅に減少している。
・BSE（牛海綿状脳症）の影響が続く牛肉売場では、前月以上に売上が厳しい。"
,,□,百貨店（販売促進担当）,お客様の様子,・単に価格が安いだけでは売れなくなってきている。客は、本当に価値のある商品を選択する目をもって、買物をしている。
,,□,スーパー（店長）,販売量の動き,・食品の売行きは依然として好調であるが、衣料品や住居関連、特に重衣料やパソコン関連の販売量が相変わらず減少している。
,,□,スーパー（店長）,販売量の動き,・客の購買が大きなセールや目玉商品に集中し、通常品の動きはみられない状況が続いている。
,,□,スーパー（店長）,販売量の動き,・販売量は増加しているが、単価が上昇しない。
,,□,衣料品専門店（店員）,来客数の動き,"・客の店での滞在時間が短く、それだけ商品を手にする時間が短くなっている。
・来客数も減少している。"
,,□,乗用車販売店（販売担当）,お客様の様子,・客の様子からは景気に明るさが感じられず、トラックの販売台数も増加していない。
,,□,その他専門店［眼鏡］（店員）,来客数の動き,・単価の落ち込みはそれほどないものの、10月の来客数は前年比８％程度の減少と、伸び悩んでいる。
,,□,スナック（経営者）,来客数の動き,・歌舞伎町での火災事故の影響で、客足が遠のいている状況が続いている。
,,□,タクシー運転手,来客数の動き,・常連の通院客、役所関係は変わらないが、中距離、長距離の客がかなり減少している。
,,□,通信会社（企画担当）,競争相手の様子,・インターネット接続の要望は多いが、競争相手のが価格を大幅に下げているので、利益にならない。
,,□,その他レジャー施設［アミューズメント］（職員）,来客数の動き,・週末はそれなりの来客数があるが、平日と週末の集客の差が広がっている。客は有給休暇を取得するなどして、空いている平日に来場する環境にない。
,,□,設計事務所（所長）,お客様の様子,・一般建築の動きは悪いが、投資目的のマンション等の需要はまだ続いている。
,,□,住宅販売会社（従業員）,来客数の動き,・展示場や分譲地への来場数、契約数が３か月前から横ばいである。
,,▲,商店街（代表者）,販売量の動き,・最近、商店街に複数の人気店舗が開店した影響で、人通りは増加しているが、買物袋を持った客は少ない。当店でも販売点数が若干減少している。
,,▲,一般小売店［茶］（営業担当）,単価の動き,・お茶は自家需要が中心で、進物の動きが鈍く、客単価が低下している。
,,▲,百貨店（企画担当）,販売量の動き,・紳士、婦人のカジュアルを中心とした衣料品が、大変厳しい状況にある。前年好調であったカシミヤストールなどの婦人用品も、不調である。
,,▲,スーパー（総務担当）,販売量の動き,・来客数は変わらないが、BSE（牛海綿状脳症）問題で肉の売上が前年比80％に減少し、食品の売上が全体的に落ちている。
,,▲,コンビニ（経営者）,単価の動き,・弁当だけを購入し、飲料を購入しないなど、客の購入単価が低下している。
,,▲,コンビニ（経営者）,単価の動き,・おにぎりよりも単価の安い中華まんが売れる傾向が、例年以上に強い。
,,▲,衣料品専門店（経営者）,お客様の様子,"・商品購入までの時間が長くなり、客が買物に慎重になっている。
・来客数は依然として減少傾向にある。"
,,▲,家電量販店（店長）,競争相手の様子,・この３か月で近隣に競合店が２店開店したが、１店は先週閉店となり、もう１店でも来客数が減少している。
,,▲,乗用車販売店（販売担当）,来客数の動き,・10月に入り、来客数が減少しており、購入を検討している客も即購入には至らず、慎重に検討している。
,,▲,乗用車販売店（営業担当）,お客様の様子,・客の仕事先が米国テロの影響を受け、車の検討をかなり先まで見送る状況になっている。
,,▲,住関連専門店（販売責任者）,単価の動き,・こたつ布団や暖房家電などの冬物商材では、良いものや価格の高いものより、ノンブランドの商品が売れている。
,,▲,高級レストラン（支配人）,来客数の動き,・食堂部門、宴会部門の来客数がともに落ち込んでおり、３か月前、前年と比べてもかなり悪い。
,,▲,都市型ホテル（スタッフ）,お客様の様子,・米国テロの影響により宿泊客が減少し、BSE（牛海綿状脳症）の影響で、レストランが不振である。
,,▲,旅行代理店（従業員）,販売量の動き,・米国テロの影響で海外旅行のウェイトが非常に低くなっており、海外部門の落ち込みが全体の販売量の減少につながっている。
,,▲,旅行代理店（経営者）,お客様の様子,・宿泊単価が非常に低くなっている。昼食場所、見学場所も、できれば安いところ、無料のところを選択する傾向がみられる。
,,▲,タクシー運転手,来客数の動き,・季節が変わり、動きはあるものの、日中、特に日曜祭日には自家用車での買物客が多く、安定した営業収入を上げることができない。
,,▲,パチンコ店（経営者）,競争相手の様子,・当店を含め、近所のライバル店でも、来客数が減少している。
,,▲,住宅販売会社（経営者）,販売量の動き,・契約単価が低下しているが、販売量は増加しない。依然としてリストラの不安等があり、客はなかなか購入の決定を下せない。家を買うということに前向きになれない人が多く、契約数も全く伸びない。
,,×,一般小売店［雑貨］（経営者）,競争相手の様子,・安いから買ってみる程度で、購買意欲のある人が少ない。
,,×,一般小売店［鞄・袋物］（従業員）,販売量の動き,"・日用鞄については、販売量が増加しているものの、単価が低下している。
・旅行関係用品の需要が半減している。"
,,×,百貨店（営業担当）,競争相手の様子,"・BSE（牛海綿状脳症）の影響で、精肉の売上が落ち込んでいる。代わりに、塩乾、鮮魚等の売上は増加しているが、精肉の落ち込みをカバーできるほどの売上増はない。
・お歳暮に関しても、来客数の大幅増加は望めない。客単価は前年並みか、若干の前年割れと予測している。"
,,×,百貨店（販売促進担当）,お客様の様子,・高額品、食料品、イベント性のある商品については好調であるが、紳士、婦人服が苦戦を強いられている。
,,×,スーパー（経営者）,販売量の動き,・BSE（牛海綿状脳症）の影響で、牛肉の売上が前年比で半分以下になっており、全体の売上にも大きな影響を及ぼしている。
