Ⅰ．景気の現状に対する判断理由等,,,,,
,,,,,
　景気の現状に対する判断の理由及びそれに対する追加説明等について、その主だったもの及び特徴的と考えられるものを取りまとめると以下のとおりであった。,,,,,
,,,,,
,,,,,
　１．北海道,,,,,
,,,,,（－：回答が存在しない、＊：主だった回答等が存在しない）
分野,,景気の現状判断,業種・職種,判断の理由,追加説明及び具体的状況の説明
"家計
動向
関連

(北海道)",,◎,－,－,－
,,○,商店街（代表者）,単価の動き,・防寒着を中心に、３か月前と比べると単価の高い物が売れている。
,,○,一般小売店［土産］（店員）,お客様の様子,・米国テロの影響で国内旅行が増加し、それほど多くはないものの、北海道にも観光客が流れてきている。
,,○,スーパー（店長）,来客数の動き,・10月は来客数が２、３年ぶりに前年を上回っている。
,,○,家電量販店（店員）,販売量の動き,・客単価、来客数に目立った動きはないが、販売量は増加している。また、客はいろいろな店を回ってから買いに来ている。
,,□,百貨店（売場主任）,来客数の動き,・10月は前年同月比で94％であったが、これは前年のプロ野球球団優勝セールで大幅に売上が増加したためである。消費に関しては好転の兆しがみえる。
,,□,百貨店（売場主任）,単価の動き,・ジャンバーやアウターなどが依然として売れず、単価が上昇しない。
,,□,衣料品専門店（店員）,来客数の動き,・来客数の減少が続いている。特に平日に少なく、売上の確保が厳しい。秋物についても買い渋りがみられる。
,,□,高級レストラン（スタッフ）,来客数の動き,・BSE（牛海綿状脳症）問題の影響で、一部の店舗の来客数が減少しているが、全体でみると変わらない。また、宿泊部門では、米国テロの影響もあり、海外を避けたハネムーン客の増加が目立っている。
,,□,美容室（経営者）,来客数の動き,・来客数が変わらない。
,,□,設計事務所（所長）,お客様の様子,・いろいろな相談案件や建築分野以外の仕事の相談などがあり、なかには受注に結び付く案件もある。
,,▲,商店街（代表者）,単価の動き,・売れ筋が低単価の商品であるため、売上の増加に貢献しない。
,,▲,商店街（代表者）,お客様の様子,・秋冬物の季節商材に対する反応が慎重であり、衝動買いをしなくなっている。特に中年齢層において、この傾向が顕著である。
,,▲,百貨店（売場主任）,来客数の動き,・コートなどの防寒着の動きが良くなってきているものの、来客数が減少しており、高額商品も売れない。
,,▲,スーパー（企画担当）,単価の動き,・食品部門の来客数は、前年同月比を10％程度上回って推移しているが、１品単価は前年の94％と低い。
,,▲,スーパー（企画担当）,お客様の様子,・BSE（牛海綿状脳症）問題の影響で、牛肉の売上が前年の半分以下に減少している。セール、イベントも期待したほどの効果がない。
,,▲,コンビニ（店長）,単価の動き,・来客数の減少はようやく止まったが、単価が10円から20円程度低下している。
,,▲,衣料品専門店（店長）,単価の動き,・以前は冬物の販売時期に高額商品が売れていたが、今月は低価格商品しか売れなくなっている。
,,▲,乗用車販売店（従業員）,販売量の動き,・商品的には良い物がそろっているが、なかなか契約に結び付かない。
,,▲,住関連専門店（営業担当）,単価の動き,・来客数は前年を上回っているが、単価が前年の95％と下回っているため、売上は減少している。
,,▲,高級レストラン（スタッフ）,お客様の様子,・今月の前半はBSE（牛海綿状脳症）問題で来客数が激減し、牛肉料理が売れていない。後半は多少回復したが、個室、飲物の利用が特に悪く、前年の６割となっている。
,,▲,スナック（経営者）,来客数の動き,・今月、釧路では市議会選挙があったため客が街に出てきていない。祝勝会に期待していたがその流れも悪い。
,,▲,タクシー運転手,来客数の動き,・電話による注文は前年と比べて減少していないが、すすきのからタクシーで帰る客など、夜間の利用が減少している。また、すすきのの飲食店経営者の話を聞いても来客数が大幅に減少しているところが多い。
,,▲,タクシー運転手,来客数の動き,・観光客は貸切りのツアーバスを、市内一般の客は自家用車やバスを利用しており、電話予約の件数も減少している。
,,▲,通信会社（企画担当）,販売量の動き,・以前は３万円前後の携帯電話も売れていたが、今は１万５千円前後でないと売れない。
,,▲,住宅販売会社（従業員）,販売量の動き,・客の動きがかなり緩慢であり、販売量も減少している。
,,×,コンビニ（エリア担当）,販売量の動き,・周辺スーパーとの競争が激化し、単価が低下している。
,,×,衣料品専門店（店長）,単価の動き,・高額商品が売れず、単価が低下している。
,,×,乗用車販売店（従業員）,販売量の動き,・来客数が極端に減少し、これが販売量に大きく影響している。
,,×,高級レストラン（スタッフ）,販売量の動き,・BSE（牛海綿状脳症）問題の影響で、来店が敬遠される傾向にある。また、来店しても牛肉関連のメニューが売れない。
,,×,スナック（経営者）,来客数の動き,・来客数が前年と比べて非常に少ない。これほど少ない年は今までにない。
,,×,旅行代理店（従業員）,来客数の動き,・来客数が前年比80％まで落ち込んでいる。海外旅行は問い合わせ自体も非常に少ない。国内旅行についても沖縄方面が不調であり、旅行需要が冷え込んでいる。
,,×,旅行代理店（従業員）,販売量の動き,・米国テロ以降、海外旅行客が激減する等、客が旅行を手控える傾向がある。
,,×,旅行代理店（従業員）,販売量の動き,・米国テロに加えて炭そ菌騒動で、海外旅行需要がすっかり冷え込んでいる。
,,×,住宅販売会社（従業員）,販売量の動き,・地価が下げ止まらないこともあり、客の購買意欲がわかず、販売量が減少している。
"企業
動向
関連

(北海道)",,◎,－,－,－
,,○,その他サービス業［システムハウス］（経営者）,取引先の様子,・要員を補充するために外注先で要員を確保しようとしたが、仕事が空いている技術者がいない。
,,□,食料品製造業（経営者）,受注量や販売量の動き,・受注が伸び悩み、販売量が増加していない。
,,□,通信業（営業担当）,受注量や販売量の動き,・この時期の商談は来年度の導入という案件が多く、受注量、価格に変化はない。
,,□,司法書士,取引先の様子,・依然として不動産取引、建築着工が低迷している。
,,▲,輸送業（営業担当）,受注量や販売量の動き,・需要の減退により、貨物量が減少している。
,,▲,金融業（企画担当）,それ以外,・売上を確保するために、建設業では受注競争が激化し、赤字を覚悟している。小売業等では価格競争が激化している。
,,▲,その他サービス業［建設機械リース］（支店長）,取引先の様子,・砂利業者では、前年よりも受注が３割減少している。
,,▲,その他サービス業［建設機械リース］（支店長）,取引先の様子,・BSE（牛海綿状脳症）問題の影響で､家畜運搬の運送業者等、関連業者の仕事が激減している。
,,×,輸送業（支店長）,受注価格や販売価格の動き,・物流量が大幅に減少している。この傾向は、建築素材にかかわらず、日常雑貨に至るまで広がっている。これまで好調だった製紙関連にも陰りがみえ始めている。
,,×,広告代理店（従業員）,受注価格や販売価格の動き,・レギュラーベースの広告費で、既に一度決まった案件に対しても値下げを要求する企業が増加している。
"雇用
関連

(北海道)",,◎,－,－,－
,,○,－,－,－
,,□,職業安定所（職員）,雇用形態の様子,・求職者は３か月ぶりに減少し、求人数も増加したものの、パートが中心であり、常用の求人数の増加は微々たるものである。
,,▲,求人情報誌製作会社（編集者）,求人数の動き,・この数か月、横ばいであった求人数の伸びが、前年度割れとなっている。
,,▲,求人情報誌製作会社（編集者）,求人数の動き,・建築業はやや持ち直しているが、食料品製造業、小売業で求人数が前年よりも減少している。
,,▲,新聞社［求人広告］（担当者）,求職者数の動き,・街の発展を支えてきた基幹産業の衰退などで、雇用の厳しさが更に増している。求人広告もパート、アルバイトなどの求人は増加しているが、正社員の募集は低調である。
,,▲,職業安定所（職員）,求人数の動き,・常用の求人倍率が２か月連続して前年を下回っている。
,,×,人材派遣会社（社員）,周辺企業の様子,・営業先の様子をみると、売上が減少傾向にあり、利益確保が更に難しくなっている。
,,×,求人情報誌製作会社（編集者）,求職者数の動き,・求人掲載件数が減少しており、前年実績を下回っている。また、数か月前までは新規出店計画や事業拡大計画などの案件もあったが、今月は明るい材料がみられない。
,,,,,
　２．東北,,,,,
,,,,,（－：回答が存在しない、＊：主だった回答等が存在しない）
分野,,景気の現状判断,業種・職種,判断の理由,追加説明及び具体的状況の説明
"家計
動向
関連

(東北)",,◎,－,－,－
,,○,百貨店（広報担当）,単価の動き,・買上単価が前年を上回っており、購買率も前年より高くなっている。
,,○,その他専門店［呉服］（経営者）,販売量の動き,・今月実施したセールは、春のセールよりも売上が良い。
,,○,観光型旅館（経営者）,来客数の動き,・今年は例年になく紅葉がきれいで、当旅館がテレビ番組で紹介されたため来客数が増えている。
,,○,旅行代理店（従業員）,お客様の様子,・海外旅行は例年の10％程度でしかないが、国内旅行は、秋の紅葉、宮城国体、身障者スポーツ大会などで忙しい。
,,□,一般小売店［スポーツ用品］（総務担当）,競争相手の様子,"・同業者間の割引競争が激しくなっており、ポイントカードの割増しサービスが増えている。
・売上が減少し、経費の圧迫が厳しくなっている。"
,,□,百貨店（売場主任）,販売量の動き,・全体に秋物衣料の動きが鈍く、前年割れの状態が続いている。
,,□,百貨店（売場担当）,単価の動き,・秋物衣料などの売れ筋商品で販売促進を図っているが、セット販売よりも単品販売が主であり、単価が低いため、売上は期待できない。
,,□,百貨店（企画担当）,お客様の様子,・客は目先の変わったものに興味を示し、催事は順調だが通常の売場、特に秋物関係の動きが鈍い。
,,□,スーパー（経営者）,単価の動き,・安い輸入品の急増や天候の安定による生鮮食品の値下がり、売価競争の激化で商品単価の低下が続いている。
,,□,スーパー（店員）,来客数の動き,・来客数、売上ともに前年並みになっている。
,,□,乗用車販売店（企画担当）,販売量の動き,・毎月定期的に実施している集客促進イベントで来客数は維持しているが、販売に結び付かない。
,,□,スナック（経営者）,来客数の動き,・常連客の来店頻度が減少し、会社都合の配置転換や異動で、常連客が２人転勤している。
,,□,観光型ホテル（経営者）,来客数の動き,"・予約の問い合わせが極端に多くなっている。
・国体と身障者スポーツ大会があり、客に途切れが無い状態であるが、総体的な売上は前年よりも多少減少している。"
,,□,都市型ホテル（スタッフ）,来客数の動き,"・ホテルの来客数は、レストランと宿泊を中心に減少しており、特に宿泊関係の減少が大きい。
・単価下落に歯止めがかからず、館外店舗の来客数が減少しており、売上も低迷している。"
,,□,通信会社（社員）,お客様の様子,・価格の安いサービスへの変更が多く、新規需要や解約などに変化はない。
,,□,通信会社（営業担当）,単価の動き,・単価の下落が止まらず、１人当たりの通話料金も減少し、売上は前年比で減少し続けている。
,,□,住宅販売会社（経営者）,販売量の動き,・受注量は前年を上回っているが、３か月前との比較では横ばいである。
,,▲,商店街（代表者）,来客数の動き,・例年10月は良くなる季節であるが、売上不振の状況である。
,,▲,百貨店（売場主任）,お客様の様子,・単価の安い商品をラッピングするなど付加価値のあるこだわりギフトは増加しているが、従来のギフト商品は大幅に売上が減少しており、買い方がシビアになっている。
,,▲,百貨店（企画担当）,販売量の動き,・BSE（牛海綿状脳症）問題で、牛食肉関連に影響があり、食品全体で売上が減少している。
,,▲,スーパー（経営者）,競争相手の様子,"・県内の同業大手の民事再生法申請など、地元の流通業界全体に与える影響は大きい。
・競合店では、仕入原価を大幅に下回る売価を乱発し、厳しい状況である。"
,,▲,スーパー（店長）,単価の動き,"・特売商品の構成比が上昇し、客単価が低下している。
・BSE（牛海綿状脳症）の影響で牛肉の売上が前年比40％まで減少している。"
,,▲,スーパー（店長）,競争相手の様子,・競合各社でチラシを出しているが、特別に混雑している様子もなく、効果がみられない状況が続いている。
,,▲,スーパー（企画担当）,来客数の動き,・BSE（牛海綿状脳症）の影響が本格的に表れ、生鮮食料品全体の落ち込みが大きくなり、来客数も減少している。
,,▲,コンビニ（店長）,お客様の様子,"・客は商品を選ぶ時、価格を見て悩んで買っている。
・単品目的買いが多い。"
,,▲,衣料品専門店（経営者）,お客様の様子,・青森市では、前月は大手スーパー、当月は地元スーパーと２か月連続して大型店が倒産している。これが地域の消費マインドに大きな影響を与え、じわじわと買物客の動向が鈍くなっている。
,,▲,衣料品専門店（店長）,来客数の動き,"・40歳代の来客数が減少している。
・スーパーの安売スーツの影響が、来客数、売上ともに出ている。"
,,▲,衣料品専門店（店長）,単価の動き,・量販店を中心に、上半期よりも一段と価格競争が激化している。
,,▲,家電量販店（店長）,販売量の動き,・冷蔵庫、カラーテレビ、パソコンなど、高額商品の販売数量が減少している。
,,▲,乗用車販売店（経営者）,お客様の様子,"・自店、他店ともに展示会が多いため集客効果が分散され、来客数が減少している。
・整備や修理の代金を内金や分割で支払う客が増えている。"
,,▲,乗用車販売店（営業担当）,販売量の動き,・サービス利用客は増加しているが、新車購入客が減少し、受注量、販売量ともに減少している。
,,▲,住関連専門店（経営者）,来客数の動き,・平日のＯＬの来店状況が悪く、土日の来客数も減少している。
,,▲,その他専門店［酒］（経営者）,単価の動き,・高価なブランド商品が売れなくなり、これまで高品質、低単価でも売れなかったプライベートブランド商品が売れている。利ざやは縮小し、一方で在庫コストが増大しており全体では厳しい。
,,▲,その他専門店［ガソリンスタンド］（営業担当）,単価の動き,・ガソリン給油で、千円や二千円などの低額の金額指定給油が多く、満タン給油の客が少なくなり、客単価が低下している。
,,▲,その他専門店［ガソリンスタンド］（経理担当）,単価の動き,・原油輸入価格の低下で、元売りからの仕切り価格は低下したが、セルフＳＳなどの影響で販売価格はそれ以上に値崩れし、ガソリン、軽油、灯油のマージンは縮小する一方である。
,,▲,高級レストラン（支配人）,お客様の様子,"・客単価の下落と来客数の減少に歯止めがかからず、BSE（牛海綿状脳症）の影響で洋食系レストランが苦戦しており、今後も回復の見込みが立たず売上への影響は図り知れない。
・百貨店に出店している惣菜店では牛肉系料理の売上が３分の１以下まで減少しており、魚や鶏、豚などで補っているが、以前の水準まで届かない。"
,,▲,一般レストラン（経営者）,来客数の動き,・平日のディナータイムの来客数が激減し、土日の来客数も減少している。
,,▲,一般レストラン（スタッフ）,単価の動き,・来客数は前年並みであるが、客単価が１人当たり50円も低下し、回復の方策が見出せない。
,,▲,観光型旅館（経営者）,来客数の動き,・入込客数の前年割れが続いており、厳しい状況である。
,,▲,都市型ホテル（経営者）,販売量の動き,・国体の影響で、宿泊関係は忙しいものの一般会合の受注が低調で、売上は前年比でマイナスである。
,,▲,タクシー運転手,単価の動き,・今月前半はひどかったが、国体の影響で、後半はやや持ち直している。
,,▲,通信会社（営業担当）,お客様の様子,・受注量は上向きであるが、単価が低下しており、全体としての売上が伸びない。
,,▲,テーマパーク（職員）,来客数の動き,・米国テロの影響か、海外からの予約が前年実績より落ち込んでいる。
,,▲,遊園地（経営者）,来客数の動き,・今月の連休が低調で、国体の波及効果もほとんどなく、来客数は前年より約１割減少している。
,,▲,住宅販売会社（従業員）,来客数の動き,"・住宅設計プランの作成件数が減少している。
・来客数、受注額ともに減少している。"
,,×,商店街（代表者）,お客様の様子,・お客様の様子だけでなく、全ての要素が悪く絡み合って厳しい状況となっている。
,,×,一般小売店［医薬品］（経営者）,来客数の動き,・夜の来客数が特に減少しており、繁華街にもかかわらず地下鉄の終電が過ぎると閑散としている。
,,×,百貨店（売場主任）,競争相手の様子,・大型百貨店や地元の大型スーパーでも民事再生法申請があり、景気は極端に悪い。
,,×,スーパー（経営者）,来客数の動き,・商品の平均単価が２％下落し、悪化している。
,,×,スーパー（経営者）,単価の動き,・豊作の影響で生鮮食品の単価が下落し、BSE（牛海綿状脳症）の関係で牛肉の売上減少や精肉単価の下落、米国テロの影響も加わり、全体で消費ムードが沈滞し、回復の目途が立たない。
,,×,スーパー（店長）,お客様の様子,"・創業月間で毎週激安価格で売出しをしているが、既存店では前年割れの状態である。
・必要な物しか買わないため、激安価格を出しても集客には結び付かず、一段とシビアになっている。"
,,×,スーパー（総務担当）,販売量の動き,・競合他社の折込チラシの投入回数が増えており、今月に入り来客数が７％強の減少、買上点数も約７％の減少となっている。
,,×,コンビニ（エリア担当）,それ以外,・消費が増えない中、販売チャンネルだけが増えており、そのため既存店の売上が減少している。
,,×,家電量販店（店長）,来客数の動き,・来客数が月を追うごとに減少しており、また単価も低下しているため厳しい状況である。
,,×,乗用車販売店（経営者）,販売量の動き,・輸入車販売において、低価格の新型車を投入したものの、来客数や試乗者はあるが契約に結び付かず苦戦している。
,,×,高級レストラン（経営者）,来客数の動き,・高級料理店の場合、多少の自助努力もあるが、景気の影響を大きく受ける。仙台ではデパートの倒産や関連企業の窮状などがあり、景気が悪い以上に心理的に冷え込んでいる。
,,×,一般レストラン（経営者）,販売量の動き,・最近の傾向で、料理の料金が酒代より下回る客が増えている。
,,×,その他飲食［そば］（経営者）,単価の動き,・BSE（牛海綿状脳症）の影響で焼き魚の売上が1.5倍になり、来客数も増えたが客単価が低下してしまい、全体としての状況は苦しい。
,,×,旅行代理店（従業員）,販売量の動き,・海外旅行の手控えにより、日々売上が減少している。
,,×,タクシー運転手,お客様の様子,・売上減少が大きく、退職する運転手が増えている。
,,×,住宅販売会社（従業員）,お客様の様子,"・三千万円以上の建売住宅を売り出したが見向きもされず、客は低額物件へ向かっている。
・値引き圧力が強く、成約まで時間がかかる。
・転職などにより、銀行からの借入が厳しい客が増えている。"
"企業
動向
関連

(東北)",,◎,－,－,－
,,○,＊,＊,＊
,,□,食料品製造業（経営者）,受注量や販売量の動き,・小売、飲食ともに全体としては芳しくないが、当社商品は首都圏、県内ともに順調に受注が増加している。
,,□,金融業（融資担当）,取引先の様子,・自己破産や企業倒産件数が多い状況が変わらない。
,,▲,農林水産業（従業者）,受注価格や販売価格の動き,・桃の販売単価は前年並みであったものの、全体の販売高は前年比80％である。
,,▲,食料品製造業（経営者）,受注価格や販売価格の動き,・販売店側から更に厳しい価格面での条件提示が求められている。
,,▲,木材木製品製造業（総務担当）,受注価格や販売価格の動き,・既に採算割れの状況であるにもかかわらず、商品価格の下落が始まりつつある。
,,▲,建設業（従業員）,取引先の様子,・企業の設備投資計画の見送りが多く、建設受注が減少している。
,,▲,経営コンサルタント,取引先の様子,・特に電子部品製造業の状況が悪くなっている。
,,▲,その他非製造業［飲食料品卸売業］（経営者）,受注価格や販売価格の動き,・以前は納入価格、売価も一定していたが、今は商品によっては結果的に納入価格を割り込む物も出るなど、納入価格や売価が商品ごとに日々変化する状況となっている。
,,×,一般機械器具製造業（経理担当）,受注量や販売量の動き,"・ＯＡ機器などの民生分野で急激に生産量が減少しており、生産余剰が発生している。
・主に欧米用携帯電話向け部品の需要が回復せず、生産調整したままの状態が続いている。"
,,×,電気機械器具製造業（経営者）,受注量や販売量の動き,"・月を追うごとに受注量が減少している。
・この工業団地内でも中規模の企業が受注量激減により倒産し、当社も10月からメインの取引先の受注が無くなり、厳しい状況である。"
