Ⅰ．景気の現状に対する判断理由等,,,,,
,,×,人材派遣会社（社員）,周辺企業の様子,・景気が悪い会社が多いのはもちろんであるが、それほど左右されないところも周りに引きずられて雇用を抑制している。
,,×,新聞社［求人広告］（担当者）,周辺企業の様子,・企業倒産や、特に県内企業のＩＴ不況に伴う電子部品業界の大幅な人員削減で、雇用情勢が更に悪化している。
,,×,新聞社［求人広告］（担当者）,求人数の動き,・求人広告の申込が前月に続き今月も前年比70％の低水準で推移している。
,,×,新聞社［求人広告］（担当者）,求人数の動き,・正社員の求人件数はほとんどなく、あるのはパート、アルバイト的なものである。
,,×,職業安定所（職員）,求職者数の動き,・新規求職者数が前年比で大幅に増加している。電気機械器具製造業や建設業の企業整理が続いているなか、さらに水産食料品加工業で工場廃止があり、事業主都合による離職者が倍増している。
,,×,職業安定所（職員）,求人数の動き,・新規求人数と有効求人倍率が、前年比で５か月連続して減少あるいは低下している。
,,×,職業安定所（職員）,求職者数の動き,・企業整理による新規求職者数が増加したために、有効求職者数や雇用保険受給者実人員が今までにない高水準となっている。
,,×,職業安定所（職員）,それ以外,・企業の人員整理が非常に高い水準で推移しており、今後も多発する。
,,,,,
　３．北関東,,,,,
,,,,,（－：回答が存在しない、＊：主だった回答等が存在しない）
分野,,景気の現状判断,業種・職種,判断の理由,追加説明及び具体的状況の説明
"家計
動向
関連

(北関東)",,◎,－,－,－
,,○,百貨店（担当者）,販売量の動き,・洋品雑貨の婦人トレンド商品に、動きが出てきている。毛皮、帽子を中心に、レッグウォーマーなどが、ファッション全体のリード役になっている。
,,○,コンビニ（店長）,来客数の動き,・３か月前と比べ、来客数の前年比マイナス分が改善され、予約関係も伸びている。
,,○,一般レストラン（経営者）,販売量の動き,・年末に向けて、忘年会等が非常に増え、販売量が増加している。
,,○,ゴルフ場（支配人）,来客数の動き,・客単価の低下により、売上が増加しているわけではないが、土日を中心に来場者が増加している。
,,○,設計事務所（所長）,来客数の動き,・３か月前と比べ、仕事量が増加している。来客数も多く、非常に忙しい。
,,□,商店街（代表者）,単価の動き,・同じような品物の場合、客は単価の低い物を選んでいる。
,,□,一般小売店［精肉］（経営者）,お客様の様子,・客は、スーパーのチラシを見て、目玉商品だけを買い求めている。
,,□,一般小売店［精肉］（従業員）,お客様の様子,・依然としてBSE（牛海綿状脳症）の風評被害を受けており、牛肉の動きが低迷している。
,,□,百貨店（店長）,お客様の様子,・客は、売り出しや催事関係のチラシを出すと来店する。何も催事がない時には、来客数は少ない。
,,□,百貨店（販売促進担当）,販売量の動き,・紳士カジュアル関連の売上の低迷、パーソナルギフトの扱い件数の減少が目立っている。
,,□,百貨店（販売促進担当）,来客数の動き,・各種イベント、セールを行っても、来客数が増加しない。
,,□,スーパー（店長）,来客数の動き,・全体的には下降気味であるが、競合店との差別化によって、客は動いている。価格だけでは競争にならない時代になっている。
,,□,スーパー（統括）,単価の動き,・来客数、買上点数が増加している中で、点単価、客単価がわずかに低下している。衣料は下げ止まったが、食品の売上は依然減少傾向にある。
,,□,衣料品専門店（統括）,来客数の動き,・来客数は３か月前と変わらず、動きは芳しくない。郊外のショッピングセンターには、客がかなり入っているが、身の回りの景気は良くない。
,,□,乗用車販売店（従業員）,お客様の様子,・新発売の軽自動車の受注状況は予想通り良いが、高額車の成約までにはかなりの日数を要しており、客の慎重な姿勢がうかがわれる。
,,□,その他専門店［ガソリンスタンド］（従業員）,販売量の動き,・ガソリン、軽油等の販売量は、前年比で横ばいか、ややプラスである。タイヤ等の高額商品の需要は、いまだに回復していない。
,,□,高級レストラン（店長）,来客数の動き,・毎年11月から年末にかけて、夜の客足が伸びるが、今年は11月下旬になっても今一つである。
,,□,スナック（経営者）,来客数の動き,・中心商店街の店の数が減少している。閉店しても次の店が入らず、シャッターが下りたままである。
,,□,遊園地（職員）,来客数の動き,・依然として客足が伸びず、前年割れの状態が続いている。
,,□,競輪場（職員）,競争相手の様子,・全ての競輪場で、売上、来場者数が減少している。
,,□,設計事務所（所長）,お客様の様子,・仕事の依頼は増加しているが、今まで計画していた仕事がだめになるケースもあり、相殺すると変わらない。
,,▲,商店街（代表者）,販売量の動き,・来客数が激減しており、販売量もかなり減少している。
,,▲,一般小売店［金物］（経営者）,販売量の動き,・年末商戦に突入する時期であるが、売上がなかなか伸びない。
,,▲,百貨店（営業担当）,来客数の動き,・土日の来客数がやや減少している。
,,▲,スーパー（経営者）,単価の動き,"・客単価が80円低下している。
・競合店のチラシを見ると、日替わり商品の単価が低下してきている。"
,,▲,スーパー（経営企画担当）,お客様の様子,・青果物などの生鮮品の最終見切り処分コーナーに立ち寄る客が、以前より増加している。
,,▲,コンビニ（経営者）,単価の動き,・近くに24時間営業のレストランができ、影響を受けている。
,,▲,コンビニ（経営者）,お客様の様子,・朝昼に比べ、夜の来店客の減少率が高くなっている。客の時間外労働が減少し、帰宅時間が早くなっている。
,,▲,衣料品専門店（経営者）,来客数の動き,・３か月前と比べ、通行量、来客数とも減少しており、やや悪くなっている。
,,▲,家電量販店（店長）,販売量の動き,・シーズン商品等の動きが鈍く、売上が増加しない。
,,▲,その他専門店［ガソリンスタンド］（営業担当）,単価の動き,・依然として市況の価格が低下しており、売値も並行して下がるので、やや悪くなっている。
,,▲,一般レストラン（経営者）,競争相手の様子,・BSE（牛海綿状脳症）の影響が大きく、地域の牛肉料理専門店では、一時閉店している店もある。
,,▲,都市型ホテル（スタッフ）,単価の動き,"・宴会の２、３日前に、値引きを希望する客が増加している。
・BSE（牛海綿状脳症）の影響か、洋食を避け、和食、中華に変更する傾向にある。"
,,▲,タクシー運転手,来客数の動き,・リストラ等で、タクシー運転手に職を変える人がおり、辞める人も少ないので、営業台数が目に見えて増加している。全体の仕事量は減少しているので、１人当たりの稼ぎは更に少なくなる。
,,▲,通信会社（社員）,お客様の様子,・新規契約数はそれなりに伸びているが、一方で料金滞納者の数も増加している。
,,▲,観光名所（職員）,お客様の様子,・宿泊客、飲食関係の客が、ともに減少している。
,,▲,住宅販売会社（経営者）,単価の動き,・高級志向の客はあまりおらず、ほとんどが低価格の客で占められている。
,,▲,住宅販売会社（経営者）,お客様の様子,・今まで工業団地に住んでいたが、リストラの対象となったために、やむを得ず来店する客がいる。
,,×,商店街（代表者）,来客数の動き,・イベント開催時には多少人出もあるが、普通の土日の人出は平日より悪く、来街者は減少している。
,,×,一般小売店［青果］（店長）,来客数の動き,・商店街に人通りが少なく、来客数も激減している。
,,×,スーパー（管理担当）,お客様の様子,・客の購入単価が低く、必要な物以外は購入しない状況が続いている。
,,×,コンビニ（経営者）,単価の動き,・客は目的買いをしており、余分な物は買わない。
,,×,家電量販店（店長）,単価の動き,・商品価格の二極化が進んでおり、比率としては安い物が伸びている。販売量は減少傾向にある。
,,×,乗用車販売店（販売担当）,販売量の動き,・来場者数が極端に減少している。新車、中古車共に、販売台数が極端に落ち込んでいる。
,,×,自動車備品販売店（経営者）,お客様の様子,・客は商品を簡単には決めず、予算がないために買わなかったり、安い物に変えたりしている。
,,×,一般レストラン（店長）,来客数の動き,・客は、単価の安いセットメニューのあるランチタイムに集中しており、それ以降の来客は半分以下である。
,,×,観光型ホテル（スタッフ）,来客数の動き,・前年と比べて、宴会が減少している。
,,×,都市型ホテル（スタッフ）,単価の動き,・宿泊、宴会、会議の全てにおいて、料金設定が厳しくなっている。特に宿泊関係は、一番安いものから売れていく状態である。
,,×,旅行代理店（従業員）,販売量の動き,・米国テロの影響で、正月の海外旅行のうち、８割がキャンセルされている。
,,×,旅行代理店（従業員）,お客様の様子,・米国テロの影響が続いており、グループの申込がない。
,,×,タクシー運転手,お客様の様子,・労働者も店員もボーナスが出ない状況なので、３連休でも稼動しない。
,,×,タクシー（経営者）,お客様の様子,・３か月前と比べ、夜から深夜にかけての利用客が減少している。
,,×,通信会社（経営者）,単価の動き,・競争相手が単価を値下げしている。
,,×,美容室（経営者）,来客数の動き,・客の来店サイクルが非常に長くなっているので、売上が少ない。
,,×,その他サービス［自動車整備業］（経営者）,来客数の動き,・客は、よほど悪い状況にならないと修理しないため、修理の依頼数が減少している。売掛金の回収率も悪くなっている。
,,×,設計事務所（経営者）,お客様の様子,・客はリストラや、雇用不安による状況の変化で、住宅の建設を先送りしている。
"企業
動向
関連

(北関東)",,◎,－,－,－
,,○,＊,＊,＊
,,□,食料品製造業（営業統括）,受注量や販売量の動き,・依然として、低価格製品が主流になっている。
,,▲,化学工業（総務担当）,受注価格や販売価格の動き,・ユーザーからの値引き要求が非常に多くなってきている。
,,▲,一般機械器具製造業（生産管理担当）,受注量や販売量の動き,・受注量がますます減少している。
,,▲,建設業（経営者）,受注量や販売量の動き,・仕事量が更に減少しており、競争が激化している。
,,▲,金融業（経営企画担当）,取引先の動き,・売上の減少により、運転資金がひっ迫し、給料の減額で対応している取引先がある。
,,▲,新聞販売店［広告］（総務担当）,受注量や販売量の動き,・チラシの回数や枚数の減少、サイズの小型化等がかなり進んできており、チラシの出稿量が前年割れしている。
,,▲,経営コンサルタント,取引先の動き,・取引先は、新規事業の開拓、新商品開発などにより、経営の新しい切り口を発見するのに躍起となっている。
,,▲,その他サービス業［放送］（営業担当）,受注量や販売量の動き,・スポット物のコマーシャルの受注件数が落ち込んでおり、受注価格も軟調に推移している。
,,×,電気機械器具製造業（経営者）,受注量や販売量の動き,・受注量が激減しており、今年度内は回復する雰囲気ではない。
,,×,電気機械器具製造業（経営者）,それ以外,"・受注量が減少しており、受注価格も低下している。
・大手メーカーが県内３工場を閉鎖する。"
,,×,電気機械器具製造業（経営者）,取引先の動き,・取引先が200人、300人という大規模なリストラを実施している。
,,×,精密機械器具製造業（経営者）,取引先の動き,・取引先の多くが海外に展開しており、受注が減少している。
,,×,輸送用機械器具製造業（総務担当）,受注価格や販売価格の動き,・受注量は変わらないが、他社との競合で、価格を下げざるを得ず、20％のコスト低減をした部品がある。受注は、全体で20％の落ち込みとなっている。
,,×,その他製造業［宝石・貴金属］（経営者）,受注量や販売量の動き,・11月初めの業者向け展示会では、入場者、売上ともに約20％減少し、卸業者の仕入れ控えがうかがわれる。小売店の店頭販売も思わしくない。海外ブランド品のみ好調である。
"雇用
関連

(北関東)",,◎,－,－,－
,,○,－,－,－
,,□,求人情報誌製作会社（経営者）,周辺企業の様子,・周辺で倒産や会社を辞めるところが数社ある。
,,□,求人情報誌製作会社（経営者）,周辺企業の様子,・求人をする会社が減少している。求人の際には、有料の広告ではなく、ハローワーク等が多く利用されている。
,,▲,職業安定所（職員）,周辺企業の様子,・企業から、人員整理、配置転換、他社への出向など、雇用調整に関する相談が相次いでいる。
,,▲,職業安定所（職員）,求人数の動き,・求人数が減少し、特に、製造業、建築業では激減している。常用雇用からパートや臨時雇用に切替えるケースが目立ち始めている。
,,▲,学校［短期大学］（就職担当）,求人数の動き,・求人先、求人数ともに減少しており、特に、事務職、販売職の求人が少ない。就職面接会においても、情報、介護、理工系など、専門技術を要する求人が目立つ。
,,×,人材派遣会社（経営者）,それ以外,・長期派遣の求人が途絶えており、契約満了後に更新されないケースも増えている。販促キャンペーンの激減により、要員派遣もなくなっている。
,,×,求人情報誌製作会社（経営者）,求人数の動き,・外食産業で焼肉、とんかつ店の雇用が伸びてくる時期であるが、BSE（牛海綿状脳症）の影響で肉を中心としている店は伸び悩み、雇用に響いている。
,,×,職業安定所（職員）,周辺企業の様子,・機器メーカーの雇用調整が相次いでいる。安定的にパート求人があった肉加工食品メーカーが、BSE（牛海綿状脳症）の影響で、求人を打ち切っている。
,,×,民間職業紹介機関（経営者）,求人数の動き,・海外、特に中国への転勤を前提とした国内採用の求人が、目立ち始めている。
,,,,,
　４．南関東,,,,,
,,,,,（－：回答が存在しない、＊：主だった回答等が存在しない）
分野,,景気の現状判断,業種・職種,判断の理由,追加説明及び具体的状況の説明
"家計
動向
関連

(南関東)",,◎,＊,＊,＊
,,○,百貨店（企画担当）,来客数の動き,・催事やイベント等の開催による集客効果もあり、衣料品や雑貨を中心に動きが目立つ。
,,○,百貨店（営業担当）,単価の動き,・米国テロの影響で、海外旅行に行く人が少なくなっており、客の消費が百貨店に向いている。特にコート等、単価の高い物の動きが顕著であり、20％以上の伸びとなっている。
,,○,家電量販店（店長）,来客数の動き,"・年末に向かい、暖房商品、プリンター関係の需要が伸びている。
・パソコン関係は、前年の販売状況に近づいている。
・全体的に、来客数は上向き傾向にある。"
,,○,一般レストラン（経営者）,来客数の動き,・昼間の客が若干増加している。
,,○,都市型ホテル（スタッフ）,販売量の動き,・11月の売上は前月比、前年比で20％ほど増加している。
,,○,タクシー運転手,お客様の様子,・夜は最寄の駅から自宅までの近距離客が増加している。中遠距離客は減少しているものの、チケットに代わり、デビットカード、クレジットカードの客が増えている。
,,○,観光名所（職員）,来客数の動き,・来客数が前年比で115％と上向きとなっている。
,,□,一般小売店［衣料・雑貨］（経営者）,お客様の様子,・暖かい日が続き、冬物単品の薄物がよく売れているが、売値が下がっているため、売上状況はほとんど変わらない。
,,□,一般小売店［生花］（経営者）,競争相手の様子,・客の購入意欲は高まっているが、他店との値下げ競争が激しく、共倒れしそうである。
,,□,百貨店（売場主任）,販売量の動き,・全体としては厳しいが、毛皮やプレタ系の高額のコートや、英国トラッドの衣料品が好調であり、悪い中でも、全体を押し上げている。
,,□,百貨店（販売促進担当）,お客様の様子,・来客数は安定しているが、客の購買姿勢はシビアで、客単価は低い。
,,□,百貨店（販売促進担当）,お客様の様子,・食品はお歳暮なども好調であるが、他の商品については、良し悪しのばらつきがあり、全体としては変わらない。
,,□,スーパー（店長）,販売量の動き,・売上が103.5％、来客数が103.9％と、ほぼ横ばいで推移している中で、婦人コート関連は２けたの伸びを示している。
,,□,スーパー（店長）,販売量の動き,・来客数の割に、販売点数が上がらない。
,,□,スーパー（総務担当）,販売量の動き,・精肉の売上を鮮魚が多少カバーし、単価の低下を良品質、少量販売で補うなど、売上の確保ができている。
,,□,コンビニ（経営者）,来客数の動き,・来客数、単価及び日販額の月平均が、２、３％上下するだけで、ほとんど変わっていない。
,,□,乗用車販売店（営業担当）,お客様の様子,・販売単価が低下している。
,,□,住関連専門店（販売責任者）,単価の動き,・単価が低下している割に、買上点数が上がっていない。
,,□,その他専門店［眼鏡］（店員）,販売量の動き,・催事等のイベント開催時には、来客数、売上ともに若干伸びるものの、催事前後の売上が低迷し、月間としては効果が出ない。
,,□,一般レストラン（経営者）,来客数の動き,・BSE（牛海綿状脳症）の影響で、来客数が減少し、予約も少なくなっているが、ケータリングが伸びており、相殺して売上は変わらない。
,,□,旅行代理店（従業員）,単価の動き,・旅行業界での指標である宿泊単価が、上向く傾向にはない。
,,□,タクシー（団体役員）,来客数の動き,・相変わらず駅構内でのタクシー待ちが多い。
,,□,通信会社（企画担当）,販売量の動き,・ケーブルテレビ、インターネットの加入は相応にあるが、解約が多少増加している。
,,□,競馬場（職員）,来客数の動き,・来客数から、景気の回復がみられない。
,,□,その他レジャー施設［アミューズメント］（職員）,単価の動き,・年間を通じて最も繁忙期にあるが、３か月前と比べ、客単価等の動きに変化がない。
,,□,住宅販売会社（従業員）,販売量の動き,・来場数が少ない代わりに、契約率が非常に良く、来客数の減少、単価の低下があっても、販売量は横ばいである。
,,▲,一般小売店［米穀］（経営者）,お客様の様子,・お金を持っているように見える人でも、ノーブランドの価格の安い商品を買う。
,,▲,一般小売店［印章］（経営者）,お客様の様子,・客から客の会社が、銀行から融資を断られて倒産したと聞いている。
,,▲,百貨店（販売促進担当）,販売量の動き,"・特別に売れている商品がなく、全体として販売量が減少している。
・婦人物のコートの売行きは良いが、ニット等の単品の売行きは鈍い。"
,,▲,スーパー（店長）,単価の動き,・客単価が96％前後に低下している。
,,▲,スーパー（店長）,単価の動き,・BSE（牛海綿状脳症）の影響による牛肉販売の減少、家電やスポーツ、レジャー、貴金属等雑貨の単価の低下、買上点数の減少が大きく響いている。
,,▲,コンビニ（経営者）,販売量の動き,・客の買上点数が減少している。
,,▲,衣料品専門店（店長）,お客様の様子,"・客の滞留時間が長く、購入に至るまでに時間がかかる。
・客は一着を選ぶのに慎重で、価格を度々確認している。
・まとめ買いが少なく、単品を目的とする客が多くなっている。"
,,▲,家電量販店（店長）,お客様の様子,・毎週、台数限定品を販売しているが、開店前から並ぶ客が極端に増加している。
,,▲,乗用車販売店（経営者）,販売量の動き,・高額車種の売行きに、陰りがみえる。
,,▲,乗用車販売店（販売担当）,販売量の動き,・低価格車両の話が多いが、その中でも決定率が低下している。
,,▲,その他専門店［燃料］（売場主任）,お客様の様子,・客で転業する人が増加し、仕事量が前年の半分程度という業種の客もいる。
,,▲,一般レストラン（経営者）,来客数の動き,・予約が減少し、当日飛び入りの宴会が多くなっている。
,,▲,一般レストラン（経営者）,来客数の動き,・ランチタイムのサラリーマン等の来客数が減少している。単価が500円程度の店に客が流れており、800円、900円を中心としている当店に影響が出ている。
,,▲,タクシー運転手,来客数の動き,・中距離、長距離の客が激減している。会社からの無線の本数も１～２割減少している。
,,▲,タクシー運転手,お客様の様子,・昼間はなんとか客がいるが、夜間は帰りが早いようで、客が全くいない。
,,▲,通信会社（営業担当）,販売量の動き,・ＣＡＴＶの放送サービス、インターネットサービスともに、販売量が減少している。
,,▲,パチンコ店（経営者）,お客様の様子,"・以前に比べ、高額のラッキーカードが売れなくなっている。
・感謝デーなどを行っているが、競合店も含め、来客数の増加傾向はみられない。"
,,▲,住宅販売会社（経営者）,販売量の動き,・販売価格を低くしても、慎重な姿勢の客が多く、量的な販売に結びついていない。
,,×,一般小売店［鞄・袋物］（従業員）,お客様の様子,"・例年と異なり、ボーナスを前提とした下見の客が見られない。
・米国テロ事件を受け、旅行用品が全く動かない。"
,,×,スーパー（経営者）,販売量の動き,・牛肉の売上は、前年比40％台であるが、鶏、豚は単価が安いので、売上が取り戻せない。
,,×,コンビニ（経営者）,来客数の動き,・夜間の来客数が極端に減少しており、客単価も若干低下している。
