Ⅰ．景気の現状に対する判断理由等,,,,,
,,○,百貨店（売場担当）,お客様の様子,"・コートやジャケットの高額品が良く売れている。
・価格を抑えて品質を追求する商品が多く売れている。"
,,○,観光型ホテル（スタッフ）,来客数の動き,・山口きらら博後、来客数が減少するとの予想に反し、米国テロの影響で増加している。
,,○,テーマパーク（広報担当）,来客数の動き,・団体客が増加しており、週末には県外からの個人客も増加しているため、周辺宿泊施設も年内は予約が一杯の模様である。
,,□,商店街（代表者）,お客様の様子,・先行き不安からの買い控えがいまだに続いている。
,,□,百貨店（売場担当）,単価の動き,・月の半ばまでは好調であったが、気温の影響もあり後半は防寒商品が鈍く、全体では変わらない。
,,□,百貨店（営業担当）,お客様の様子,・客は価値のある物であれば少々高価でも買うが、安くても不要な物は購入しない。
,,□,スーパー（店長）,販売量の動き,・競合店ができて１年が経つ９月以降は、来客数、売上とも例年並みであり、変化がない。
,,□,コンビニ（エリア担当）,競争相手の様子,・売上が低迷しているなか、販売促進費用をかけて競合店とパイを取り合い、これまでの水準を確保している。
,,□,コンビニ（エリア担当）,販売量の動き,・消費者の財布のひもが更に固くなっている。
,,□,衣料品専門店（地域ブロック長）,お客様の様子,・目的買いの客や高価な物が安くなれば買う客が目立っている。
,,□,家電量販店（副店長）,販売量の動き,・前年を上回っている商品と、下回っている商品の差が大きくなっている。
,,□,乗用車販売店（総務担当）,単価の動き,・安売りのときしか来客数の増加が望めない。
,,□,自動車備品販売店（経営者）,来客数の動き,・11月はスタッドレスタイヤが少し売れ始めるので、例年と同様客単価は若干上昇しているものの、来客数はほとんど伸びがなく、大きな変化はみられない。
,,□,その他飲食［ハンバーガー］（エリア担当）,来客数の動き,・BSE（牛海綿状脳症）の影響による来客数の減少は緩和しているものの、週末の家族客の来店が減少する傾向には変化がない。
,,□,通信会社（経営者）,お客様の様子,・月間加入契約数が低迷しており、財布のひもが固い。他社は利用料を値下げしても、加入増に結び付いていない。
,,□,通信会社（通信事業担当）,お客様の様子,・イベントなどで加入に特典を付けると少し反応が良くなるが、逆に通常の条件に戻ると客の反応は鈍くなる。
,,□,テーマパーク（業務担当）,来客数の動き,・平日は年配者が来ており、週末もコンスタントに入込があるので、来客数に変動がない。
,,□,テーマパーク（職員）,単価の動き,・低価格志向が根強く、土産の販売が特に落ち込んでいる。
,,□,レジャー施設（営業企画担当）,単価の動き,"・日帰り温泉部門は、初の試みである入館料値下げ企画と、飲食部門の高価値低価格の新商品に対する反応が良く、売上目標が達成できそうな勢いであるが、客単価の低下を来客数の増加で補っている状況である。
・温泉ホテル部門も１周年記念の宿泊価格の売出しにより客室稼働率が向上しており、収益目標を達成できているが、値下げ効果によるものである。"
,,▲,商店街（代表者）,来客数の動き,・商店街の店が１店閉店し、今後も数店閉店予定である。最盛期の店舗数より半減し、ここ１年の間にガラッと様子が変わったことで、来街者も減少している。
,,▲,百貨店（売場担当）,販売量の動き,・販売促進を行っても月末には状況が悪くなり、売上が増加しないという繰り返しである。
,,▲,スーパー（店長）,販売量の動き,・お歳暮の動きが悪い。競争も激化していることから、安い物でも販売数量が伸びない。
,,▲,スーパー（店長）,来客数の動き,・来客数が例年より２％落ち込んでいる。
,,▲,スーパー（経理担当）,単価の動き,・来客数は変わらないが、単価は低下している。
,,▲,スーパー（店員）,販売量の動き,・客が必要な物以外は買わない。広告の目玉商品を買う客が多く、なるべく食費を抑える傾向がみられる。
,,▲,コンビニ（エリア担当）,販売量の動き,・客が必要な物以外は買わなくなっており、１人当たりの買上個数が減少している。
,,▲,衣料品専門店（地域ブロック長）,単価の動き,・量販店を中心に、低価格商品への競争がますます激しくなっている。
,,▲,衣料品専門店（店長）,お客様の様子,・男性客の洋服に対する消費が低調である。
,,▲,住関連専門店（広告企画担当）,来客数の動き,・来場予約が減少してきている。土日の客の動きも不透明である。
,,▲,その他専門店［贈答品］（店員）,来客数の動き,・来客数が減少し、客単価が低下している。お祝い返しが減少している。
,,▲,その他専門店［カメラ］（地域ブロック長）,単価の動き,・低価格の物が出るものの、高額商品の動きが悪く、売上も減少気味である。
,,▲,都市型ホテル（経営者）,来客数の動き,・婚礼受注の減少幅が例年より大きくなっている。
,,▲,旅行代理店（団体営業担当）,単価の動き,・米国テロの影響で海外旅行が国内旅行へと切り替わったため、客単価が低下している。
,,▲,タクシー運転手,単価の動き,・長距離客が減少しているので、客単価が低下している。
,,▲,通信会社（営業担当）,来客数の動き,・直営店への来客数が更に減少している。
,,▲,美容室（経営者）,来客数の動き,・客がまとめてカラーとパーマに来たりするなど、来店サイクルが長くなっている。
,,▲,住宅販売会社（経理担当）,来客数の動き,"・新規発売物件ではまとまった客があるが、全体としてはモデルルームへの来客数は依然として低調である。既発売物件においては、キャンペーンなどにより週末の来客数を確保している。
・来客数を確保しても、契約に結び付く比率が低下している。"
,,▲,住宅販売会社（営業担当）,販売量の動き,・販売量が減少し、建築単価が低下している。
,,×,スーパー（総務担当）,販売量の動き,・来客数、平均単価とも前年並みとなっているが、買上点数が減少している。特に、今まで特売を行うとある程度まとめ買いされていたラーメンなどの一般食品の販売点数が減少している。
,,×,家電量販店（店長）,販売量の動き,・客の財布のひもが固くなっている。２台あるビデオのうち１台が壊れても、すぐには買わず残りの１台で我慢している。
,,×,家電量販店（店員）,単価の動き,・来客数はほぼ例年並みであるが、客単価が例年の70％台で推移している。
,,×,乗用車販売店（経営者）,お客様の様子,・催しを毎週行っているが、来客数が激減している。商談成立に時間がかかり、車種もコンパクトな車へシフトしている。
,,×,乗用車販売店（所長）,販売量の動き,・車の販売台数が例年に比べて70％と大きく落ち込んでいる。
,,×,乗用車販売店（従業員）,販売量の動き,・販売活動量は通常の倍以上だが、販売台数が減少している。
,,×,その他専門店［時計］（経営者）,単価の動き,・中年客が４～５千円の腕時計は高いとして、１～２千円の更に安い商品を希望する。
,,×,一般レストラン（店長）,来客数の動き,・BSE（牛海綿状脳症）の２頭目が発見されて、客が遠のいており、来客数が18％減少している。
,,×,スナック（経営者）,お客様の様子,・客が高い店から安い店に流れている。
,,×,通信会社（社員）,来客数の動き,・来客数、販売量とも激減している。
"企業
動向
関連

(中国)",,◎,－,－,－
,,○,＊,＊,＊
,,□,化学工業（総務担当）,受注価格や販売価格の動き,・３か月前に比べると原料価格が下落しているが、同時に製品価格も低下傾向にある。
,,□,非鉄金属製造業（経理担当）,受注量や販売量の動き,・ＩＴ不況により、主力の電池材料が落ち込んだままである。販売量、受注量ともに回復の兆しがない。
,,□,一般機械器具製造（企画経理担当）,受注量や販売量の動き,・今までと変わらず販売量も生産量も不振で、売上が伸びない。
,,▲,化学工業（総務担当）,受注量や販売量の動き,・依然として化学原材料の受注量が減少している。
,,▲,輸送用機械器具製造業（総務担当）,受注量や販売量の動き,・受注量が減少し、受注価格も低下している。
,,▲,建設業（経営者）,受注量や販売量の動き,・工事物件が減少している。
,,▲,建設業（経営企画担当）,受注量や販売量の動き,・街をみると、建設用タワークレーンが日増しに増加しているが、自社における受注高は例年と比べて確実に減少し続けている。
,,▲,輸送業（総務担当）,受注量や販売量の動き,・収入が落ち込んでおり、支出の抑制を行っても更に収入が落ち込むため厳しい。
,,▲,通信業（社員）,受注量や販売量の動き,・原価ぎりぎりまで値引きしないと受注できない。
,,▲,通信業（営業担当）,受注量や販売量の動き,"・企業ネットワークの更改、高度化に関する折衝案件は増加しているが、回線容量当たりの単価は低下傾向のままである。
・高品質ではないが大容量、低価格が特徴のネットワークサービスメニューの投入が続いており、既存顧客からのコストダウン要求は更に高まる方向にある。"
,,▲,金融業（業界情報担当）,取引先の様子,・主要受注先の大幅減産の影響を受け、13年度下期の売上、利益を下方修正する取引先が多い。
,,▲,コピーサービス業（管理担当）,競争相手の様子,・同業他社が、受注量の不足が主な原因で倒産している。
,,×,繊維工業（統括担当）,受注量や販売量の動き,・取引先からの価格の引下げ要求が多い。
,,×,木材木製品製造業（経理担当）,受注量や販売量の動き,・ハウスメーカーからの受注量が激減している。
,,×,一般機械器具製造業（総務担当）,受注量や販売量の動き,・例年より20％の減少である。
,,×,電気機械器具製造業（広報担当）,受注量や販売量の動き,・受注量は減少傾向にあり、価格も低下傾向が続いていることから、回復の兆しがみられない。
,,×,輸送用機械器具製造業（経理担当）,受注量や販売量の動き,・臨時休業を４日間実施するほど、実需が落ち込んでいる。
"雇用
関連

(中国)",,◎,－,－,－
,,○,－,－,－
,,□,人材派遣会社（経営者）,求人数の動き,・人材派遣の求人状況は堅調に推移しているが、正社員の雇用は非常に厳しい。
,,□,人材派遣会社（支社長）,求人数の動き,・求人数は減少傾向だが、販売業や官公庁からの依頼があり、全体では変わらない。
,,□,学校［大学］（就職担当）,求人数の動き,・13年度卒業生に対する追加募集の求人がなく、上向きの変化は望めない。
,,▲,新聞社［求人広告］（担当者）,周辺企業の様子,・中小零細企業を中心に厳しい状況が続いている。食品製造業では、中高年より20代前半の男性がリストラの対象になってきている。
,,▲,職業安定所（職員）,求職者数の動き,・10月の新規求職者は例年より20％増加しており、解雇者が増加している。
,,▲,職業安定所（職員）,周辺企業の様子,・小規模ではあるが事業所閉鎖、人員削減が続いている。
,,×,人材派遣会社（支店長）,求人数の動き,・通信業界の求人が、ここにきて止まった状況にある。
,,×,求人情報誌製作会社（編集者）,求人数の動き,・企業の採用意欲がなく、新たな採用に対する人件費を抑えている。
,,×,新聞社［求人広告］（担当者）,求人数の動き,・新規のパート、アルバイトを含め、求人広告は業種を問わずほとんどない。
,,×,職業安定所（職員）,求人数の動き,・有効求人倍率が過去最低となっているなか、電気部品製造業や衣料品製造業、建設業で停滞感が強まっている。
,,,,,
　９．四国,,,,,
,,,,,（－：回答が存在しない、＊：主だった回答等が存在しない）
分野,,景気の現状判断,業種・職種,判断の理由,追加説明及び具体的状況の説明
"家計
動向
関連

(四国)",,◎,百貨店（売場主任）,単価の動き,・急に気温が下がり、冬物のコート、ジャケットなどの衣料の動きが非常に活発になっている。
,,○,ゴルフ場（従業員）,来客数の動き,・季節的な要因を除いても来場者数が多い。
,,□,一般小売店［生花］（経営者）,お客様の様子,・年末商品の予約があまりない。
,,□,百貨店（営業担当）,それ以外,・来客数は６％増加し、売上も１割増加しており、店舗の状況としては順調に推移している。BSE（牛海綿状脳症）問題による肉製品の売上減少は魚製品で補えている。
,,□,スーパー（店長）,販売量の動き,・時間延長をしたものの、売上は前年割れを起こしている。
,,□,衣料品専門店（店長）,単価の動き,・特売商品は売れるが、高額商品の売行きが悪い。
,,□,家電量販店（営業担当）,単価の動き,・単価は９月以降、前年比10％減が続いている。
,,□,乗用車販売店（管理担当）,販売量の動き,・新車を発表したにもかかわらず、販売量は依然として少ない。
,,□,タクシー運転手,来客数の動き,・客が減っており、長距離が出ない。
,,□,通信会社（営業担当）,販売量の動き,・店舗への客の出足の落ち込みが続いている。
,,□,その他住宅［不動産］（経営者）,競争相手の様子,・仲介件数が減った状態が続いている。
,,▲,商店街（代表者）,競争相手の様子,・新たにオープンした大型ショッピングセンターに出店した専門店が苦戦を強いられている。
,,▲,一般小売店［乾物］（店員）,競争相手の様子,・市内に大型商業施設ができたため、来客数が目に見えて減少している。
,,▲,百貨店（営業担当）,来客数の動き,・百貨店の増床リニューアルがあり、多少活気が戻ったようにみえたが、短期間で人の動きが止まっている。
,,▲,スーパー（企画担当）,単価の動き,・商品単価の下落が止まっていない。
,,▲,スーパー（営業担当）,販売量の動き,・お歳暮関係の単価の低下、数量の減少がみられる。
,,▲,コンビニ（経営者）,来客数の動き,・単価の低下とともに来客数も減少している。
,,▲,衣料品専門店（経営者）,お客様の様子,・購入態度は非常に慎重であり、ジャケットとスカートのようなセット売りも難しくなっている。
,,▲,その他専門店［ＣＤ］（店員）,お客様の様子,・高額商品をボーナスで一括払いする客は少なく、分割払いが大半になっている。
,,▲,観光型旅館（経営者）,競争相手の様子,・他社との値下げ競争が厳しい。
,,▲,都市型ホテル（経営者）,単価の動き,・米国テロ以降、来客数は伸びているが、単価が落ち込んでいる。
,,▲,通信会社（総務担当）,お客様の様子,・家族で携帯電話を複数所有している客が台数を減らしている。
,,▲,通信会社（営業担当）,お客様の様子,・安い目玉商品のみを買って、衝動買いがほとんどみられない。
,,▲,設計事務所（所長）,販売量の動き,・小規模な改修物件が多く、新しい物件が非常に少ない。
,,▲,住宅販売会社（従業員）,販売量の動き,・客が慎重になっており、受注棟数は落ちている。
,,×,一般小売店［書籍］（営業担当）,販売量の動き,・立ち読みだけで終わる人が多く、売上につながっていない。
,,×,スーパー（店長）,販売量の動き,・回復基調にあった精肉の売上は、２頭目のBSE（牛海綿状脳症）の牛の発見により、売れなかった時の水準に落ち込んでいる。
,,×,スーパー（店長）,競争相手の様子,・競争相手で倒産するところが出ているが、自店の売上は伸びていない。
,,×,乗用車販売店（営業担当）,来客数の動き,・新型車の売行きは予定通りであったが、その他の車種が落ち込み、前年を下回っている。
,,×,旅行代理店（経営者）,販売量の動き,・ディズニーシーなど国内旅行は堅調であるが、海外旅行は依然厳しく、全体的には売上は低迷している。
,,×,タクシー運転手,お客様の様子,・会社の飲み会が少なくなり、来客数が減少している。
,,×,美容室（経営者）,競争相手の様子,・同業店では料金の20％、30％ディスカウントが当たり前になっている。
,,×,住宅販売会社（従業員）,お客様の様子,・建築計画を取りやめた客が何件かある。
"企業
動向
関連

(四国)",,◎,－,－,－
,,○,－,－,－
,,□,公認会計士,競争相手の様子,・売上高、利益ともに前年比で減少しており、赤字法人が増えている。
,,▲,食料品製造業（従業員）,受注量や販売量の動き,・デフレ状態となり、価格競争が利益を圧迫している。
,,▲,一般機械器具製造業（経理担当）,取引先の様子,・排ガス規制に伴い、モデルチェンジが先行して行われ、製品価格が上昇することから、ユーザーの購入意欲が低下している。
,,×,家具製造業（営業担当）,受注量や販売量の動き,・定常的に売れる在庫対応の商品は、価格の安い中国などに移行しつつあり、特注品や今日、明日必要とされる納期対応品のみの受注となっており、全体の受注が減少している。
,,×,電気機械器具製造業（経営者）,受注量や販売量の動き,・中国との価格競争が厳しい。
,,×,建設業（総務担当）,受注量や販売量の動き,・土木関連の受注が極端に減少している。
,,×,輸送業（支店長）,受注量や販売量の動き,・物流の減少に伴い、車両を減らす業者が増えている。
,,×,輸送業（配車担当）,受注量や販売量の動き,・２頭目のBSE（牛海綿状脳症）問題で、食材の荷動きに影響が出ている。
,,×,広告代理店（経営者）,受注量や販売量の動き,・歳末商戦の広告出稿が、どの媒体も全て大幅に落ち込んでいる。
"雇用
関連

(四国)",,◎,－,－,－
,,○,－,－,－
,,□,求人情報誌製作会社（編集者）,周辺企業の様子,・中小企業の下請が非常に厳しい。
,,▲,人材派遣会社（経営者）,それ以外,・繁忙時の派遣期間が短くなっている。
,,▲,人材派遣会社（支店長）,求人数の動き,・対前年同期比で依頼件数が約30％減少している。
,,▲,職業安定所（職員）,求職者数の動き,・新規求職者数、有効求職者数ともに減少している。
,,×,新聞社［求人広告］（担当者）,周辺企業の様子,・年賀広告を取りやめたり、量を減らしたり、クライアントは弱音で予算を減らしている。
,,,,,
　１０．九州,,,,,
,,,,,（－：回答が存在しない、＊：主だった回答等が存在しない）
分野,,景気の現状判断,業種・職種,判断の理由,追加説明及び具体的状況の説明
"家計
動向
関連

(九州)",,◎,百貨店（営業担当）,販売量の動き,・11月に入り気温が低くなり、ヤングを中心にピーコートが多く出たほか、ストール等も好調であり、全体の売上を押し上げている。
,,○,百貨店（売場担当）,来客数の動き,・中心地区の大型店出店の影響が一巡し、９～11月の売上が前年実績を上回っている。
,,○,家電量販店（経営者）,販売量の動き,・プラズマテレビやパソコンの売行きが良くなっている。
,,○,都市型ホテル（スタッフ）,お客様の様子,・米国テロの影響で国内で遊ぶ人が増えている。
,,○,タクシー運転手,お客様の様子,・急激に寒くなってきたことや、ボーナス時期に入り買物に出る人が多くなったことから、タクシー利用者が多くなってきている。
,,□,商店街（代表者）,単価の動き,・人の動きは良くはないが、意外に高額商品の動きが良いため、前年並みの売上を維持している。
,,□,百貨店（営業担当）,販売量の動き,・来客数の増加により販売量は増えているが、単価がダウンしている。
,,□,衣料品専門店（総務担当）,お客様の様子,・若い女性の来客数が徐々に増えており、カジュアルコートなどが売れ出しているが、全体では変わらない。
,,▲,百貨店（営業担当）,お客様の様子,・物産市など特殊なイベント売場や、リニューアルして新しくなった売場では売上が上がるが、その他では厳しくなっている。
,,▲,スーパー（総務担当）,単価の動き,・高額商品や衣料品、アパレル商品で客単価が低下している。
,,▲,スーパー（企画担当）,お客様の様子,・久しぶりに市内に大型店ができて価格競争が激化しているのに加え、地元の半導体工場でのリストラや、BSE（牛海綿状脳症）問題など不安材料が増えて１品単価が低下している。
,,▲,衣料品専門店（店員）,お客様の様子,・商品をまとめ買いする客が少なくなっている。また、購入を決めるまでの時間が前年に比べて異常に長くなっている。
,,▲,家電量販店（企画担当）,販売量の動き,・来客数は多いが、成約につながるものが少ない。客が非常に慎重になっている。
,,▲,乗用車販売店（経理担当）,販売量の動き,・毎月開催されている新車の展示会等では、来客数の動きはまずまずであるが、購入までに時間がかかる。
,,▲,高級レストラン（スタッフ）,来客数の動き,・例年のように九州場所の賑やかな感じがなく、忘年会の予約も前年に比べて少ない。
,,▲,スナック（店長）,来客数の動き,・11月も末なのに一つも予約がなく、休業のような状態である。
,,▲,タクシー運転手,お客様の様子,・若い利用客が少なく、年配者や体の不自由な人のみ利用している。
,,▲,設計事務所（所長）,お客様の様子,・計画中の物件が、見合わせや計画倒れになることが多くなっている。
,,▲,住宅販売会社（従業員）,販売量の動き,・１年以内に建築を検討している客の数が減ってきている。
,,▲,住宅販売会社（従業員）,販売量の動き,・キャンペーンやイベントを多く開催するが、集客が伸びていない。
,,×,スーパー（店員）,来客数の動き,・食品の動きが悪く、中でもBSE（牛海綿状脳症）問題が影響して肉類の売上が良くない。豚肉や鶏肉で数字を上げても、単価の高い牛肉には追いつかない状況である。
,,×,コンビニ（店長）,来客数の動き,・８時以降の来客数が月を追うごとに減少している。
