Ⅰ．景気の現状に対する判断理由等,,,,,
,,□,レジャー施設（営業企画担当）,来客数の動き,"・例年に比べて来客数の減少が激しいが、土日に限っては増加しており、全体では変わらない。
・温泉ホテル部門は、日曜祭日の客室が全て満室になり、来客数は増加している。"
,,▲,商店街（代表者）,お客様の様子,・来街者数は増加しているが、買う意志がない。
,,▲,一般小売店［茶］（経営者）,お客様の様子,・客から出る話題が暗く、生活防衛に走り買い控えがある。
,,▲,百貨店（営業担当）,販売量の動き,・婦人の防寒商品の動きが悪く、単価の高い商品も販売量が減少している。
,,▲,百貨店（営業担当）,単価の動き,・来客数が例年に比べて増加しているものの、１人当たりの購買金額が減少しているため、売上も減少している。
,,▲,百貨店（売場担当）,販売量の動き,"・衣料品の単価が低下している。
・催物会場やバーゲンはにぎわっているが、それ以外は不振である。"
,,▲,スーパー（店長）,単価の動き,・販売単価が低下しており、牛肉の売上が減少している。
,,▲,スーパー（店長）,販売量の動き,・BSE（牛海綿状脳症）の影響により牛肉の販売量が減少している。
,,▲,コンビニ（エリア担当）,お客様の様子,・客が必要な物以外は買わない状況が続いている。
,,▲,コンビニ（エリア担当）,来客数の動き,・価格に関係なく必要な物以外の買い控えが続き、リピート客が減少している。
,,▲,衣料品専門店（地域ブロック長）,お客様の様子,・低価格商品に購入が集中している。客の財布のひもは固く、これ以上安くならないかと聞かれる。
,,▲,衣料品専門店（店長）,お客様の様子,・米国テロなどの影響で、特に男性の客が消費を抑えている。
,,▲,家電量販店（副店長）,単価の動き,・来客数は増加しているが、売上は減少し、客単価も低下している。パソコンを中心にＯＡ商品の不振が更に大きく影響している。
,,▲,家電量販店（店員）,単価の動き,・販売単価が低下している。客も買いたい商品の予算を下げなければならない状況にある。
,,▲,乗用車販売店（統括）,販売量の動き,・新型車種が２種類出たにもかかわらず、来客数は減少している。
,,▲,自動車備品販売店（経営者）,単価の動き,"・高額商品の動きが鈍化している。
・来客数はあまり減少していないものの、客単価が低下しており、その結果売上が減少している。"
,,▲,その他専門店［贈答品］（店員）,来客数の動き,・全体的に販売が低迷しているが、特にお祝い返しの売上が減少している。
,,▲,その他飲食［ハンバーガー］（エリア担当）,来客数の動き,・ファーストフード業界は、主力商品に牛肉を使用しているので、BSE（牛海綿状脳症）の影響を受けている。そのため厚生労働省の安全宣言が出ても、心理的に来店を控える傾向がある。
,,▲,都市型ホテル（従業員）,来客数の動き,・山口きらら博終了後、地元の客の動きが鈍くなっている。
,,▲,旅行代理店（団体営業担当）,来客数の動き,・米国テロ以降、来客数が減少している。
,,▲,タクシー運転手,それ以外,・日中の乗車状況は変化していないが、23時以降は最寄り駅から電車や深夜バスに乗り換える客が増加している。
,,▲,通信会社（営業担当）,販売量の動き,・携帯電話やＰＨＳの販売において、個人新規契約件数の減少が顕著である。
,,▲,通信会社（通信事業担当）,販売量の動き,・通信部門の新サービスにより、従来のサービスの販売も順調に推移してきたが、現在は減少傾向にある。
,,▲,パチンコ店（企画担当）,来客数の動き,・例年並みの動きをしているが、同業他社の来客数の状況をみると、例年よりやや減少している。
,,▲,競艇場（職員）,来客数の動き,・入場者数がやや減少している。
,,▲,美容室（経営者）,来客数の動き,・例年８月は暇だが、９、10月までもが暇である。キャンペーン等の企画をしても客が入らない。
,,▲,設計事務所（職員）,販売量の動き,・新築工事や公共事業が減少し、建設業者の一部では給料が部分払いになっている。
,,▲,住宅販売会社（経理担当）,来客数の動き,"・新築分譲マンションのモデルルームへの来場者数は、新規発売物件を除き全体的に低調であり、物件によっては週末の来場者がゼロの場合もある。
・既存の物件においては、価格改定等を行うことで集客を図り、目標の契約数を達成しているが、売上、利益とも低迷している。"
,,×,商店街（代表者）,販売量の動き,・１人当たりの購入件数が減少している。
,,×,一般小売店［印章］（営業担当）,来客数の動き,・ＪＲ駅構内店前の人の流れも減り、土日の来客数も減少している。
,,×,スーパー（店長）,それ以外,・販売量の減少、単価の低下、BSE（牛海綿状脳症）による牛肉の売上減少など、悪くなる要素が多い。
,,×,スーパー（総務担当）,販売量の動き,"・BSE（牛海綿状脳症）が発生したため、牛肉が４割減となり、例年好調になってくるはずの野菜も販売量が減少している。
・鶏、豚等、牛以外の食材が値上がりし、単価の割高感があるため、客の１回当たりの購買量が減少している。"
,,×,コンビニ（エリア担当）,販売量の動き,・10月に入って以降、惣菜の販売などにBSE（牛海綿状脳症）の影響が出ており、売上も単価も低迷している。
,,×,家電量販店（店長）,販売量の動き,・来客数も減少し、不況を肌で感じている。
,,×,乗用車販売店（所長）,販売量の動き,・９月は10日までの販売台数が25台ほどあったが、10月は20日が過ぎてもその台数に追いついておらず、販売量が減少している。
,,×,乗用車販売店（店長）,来客数の動き,・新型車の投入がないため、展示会の呼び込みやチラシなどの仕掛けに対して、客の反応が悪くなっている。特に法人においては、米国テロ以来顕著に現れている。
,,×,住関連専門店（広告企画担当）,販売量の動き,・来客数の変化はないが、契約までは結び付かない。
,,×,その他専門店［書籍］（店員）,販売量の動き,・来客数が減少し、下げ止まる傾向がみえない。
,,×,一般レストラン（店長）,来客数の動き,・BSE（牛海綿状脳症）の影響で来客数が22％減少している。
,,×,都市型ホテル（営業企画担当）,来客数の動き,・BSE（牛海綿状脳症）に対する安全性の確認が進まず、客が報道で敏感になっているため、鉄板焼きやレストランの予約が20％、多いときは30％も減少し、来店頻度も減っている。
,,×,旅行代理店（経営者）,来客数の動き,・米国テロ以来キャンセルが相次いでおり、国内旅行を勧めても断られる。
,,×,タクシー運転手,販売量の動き,"・山口きらら博が終了したこともあり、売上が10％低下している。
・山口市内に100円で利用できるコミュニティーバスが走ることになり、売上に影響している。"
"企業
動向
関連

(中国)",,◎,－,－,－
,,○,金属製品製造業（総務担当）,受注量や販売量の動き,・仕事量が10％増加している。
,,□,化学工業（総務担当）,受注量や販売量の動き,・各製品の動きが非常に悪く、販売量が回復していない。
,,□,窯業・土石製品製造業（営業担当）,受注量や販売量の動き,・最大顧客である高炉メーカー、新規顧客である電子部品メーカーの市況が著しく低迷しているため、受注量や販売量が大幅に落ち込んだままである。
,,□,非鉄金属製造業（経理担当）,受注量や販売量の動き,・主力製品である電池材料の製品が低迷したままである。
,,□,電気機械器具製造業（総務担当）,受注量や販売量の動き,・受注量に回復の兆しがみえてこない。３か月前と比べても受注量が低下したままになっている。
,,□,輸送業（営業担当）,受注量や販売量の動き,・全体の荷物取扱量は微増だが、食肉、松茸の取扱が悪い。
,,▲,繊維工業（統括担当）,受注価格や販売価格の動き,・競争の激化による価格の下落が一段と進んでいる。
,,▲,鉄鋼業（広報担当）,取引先の様子,・アメリカのＩＴ不況に伴う国内家電メーカーの大幅な減収減益による影響が出てきている。
,,▲,建設業（経営者）,受注量や販売量の動き,・手持ち工事量の減少、単価の低下が地域全体にある。
,,▲,通信業（営業担当）,受注量や販売量の動き,"・品質よりコスト重視の顧客が増え、エコノミー型専用線への切替えが多い。
・長距離キャリア（地域をまたぐ回線を保有する会社）からの値下げ要求も厳しく、足回り回線（最終的に顧客に接続される部分の回線）の収支悪化が継続している。
・ＡＤＳＬへの関心が高く、インターネット専用線の販売が低迷している。"
,,▲,金融業（広報担当）,取引先の様子,・主要受注先からの受注量が減少している取引先が多い。
,,▲,広告代理店（営業担当）,受注価格や販売価格の動き,・ディーラー関係で適正料金による新聞出稿をしていたところが、値段交渉をしてくるようになっている。
,,×,鉄鋼業（総務担当）,受注量や販売量の動き,・客から値下げ圧力がかかり、受注価格や販売価格が低下している状況である。
,,×,輸送用機械器具製造業（総務担当）,受注量や販売量の動き,・受注量が非常に減少しており、受注価格も低下している。
,,×,建設業（営業担当）,競争相手の様子,・民間工事において、大手、準大手業者の多くが１億円程度の小規模工事に参加するようになっている。
,,×,輸送業（総務担当）,それ以外,・取引量や受注量が落ちている。
"雇用
関連

(中国)",,◎,－,－,－
,,○,－,－,－
,,□,職業安定所（職員）,求職者数の動き,・職業相談窓口での求職相談者数が減少していない。
,,□,学校［大学］（就職担当）,採用者数の動き,・就職内定の進ちょく状況に変化がない。
,,▲,人材派遣会社（社員）,周辺企業の様子,・人手はサービスでは不足感があるものの、建設、ＩＴ関連で余剰気味である。
,,▲,民間職業紹介機関（職員）,採用者数の動き,・最初は複数名の募集であったものが、最終的に１名のみの採用になってしまうケースが出ている。
,,×,人材派遣会社（経営者）,求人数の動き,"・人材派遣の売上は堅調に推移しているが、派遣社員要請件数が減少している。
・派遣社員の登録状況は高水準で、求職者が多くなっている。
・正社員の雇用情勢は依然厳しさが続いている。"
,,×,求人情報誌製作会社（編集者）,求職者数の動き,・企業が正社員の求人を行わず、パート、アルバイトに代えている。
,,×,新聞社［求人広告］（担当者）,求人数の動き,・パート、アルバイトを含め、求人広告はほとんどゼロに近い状態にまで落ち込んでいる。
,,×,職業安定所（職員）,求人数の動き,・有効求人数が最低となっているなか、基幹産業の電気部品製造業や衣服縫製業を中心に、製造業や建設業での停滞感が強まっている。
,,×,学校［大学］（就職担当）,周辺企業の様子,"・広島県内の企業に採用意欲が感じられない。最小限の採用しか考えておらず、しかも必要な人材だから採用するのではなく、人員の年齢構成を保つための採用となっている。
・この時期採用はほとんど終了しているが、追加及び再募集をする企業がほとんどない。"
,,,,,
　９．四国,,,,,
,,,,,（－：回答が存在しない、＊：主だった回答等が存在しない）
分野,,景気の現状判断,業種・職種,判断の理由,追加説明及び具体的状況の説明
"家計
動向
関連

(四国)",,◎,－,－,－
,,○,スーパー（店長）,販売量の動き,・９月より営業時間を２時間延長したため、売上、来客数とも７％ほど増加している。
,,□,百貨店（営業担当）,それ以外,・ロングブーツ、化粧品は好調に推移しているが、紳士用品、食品は減少している。食品に関しては、BSE（牛海綿状脳症）の影響とみられる。
,,□,乗用車販売店（管理担当）,来客数の動き,・新型車を発表したにもかかわらず、ショールームへの来客数が少ない。
,,□,ゴルフ場（従業員）,単価の動き,・来客数は増加しているものの、単価が低下している。
,,□,住宅販売会社（従業員）,販売量の動き,・受注量は横ばいで推移している。
,,▲,一般小売店［生花］（経営者）,単価の動き,・例年と比べて極端に値下がりしている。
,,▲,百貨店（営業担当）,来客数の動き,・前年同月比で来客数が徐々に減少している。
,,▲,スーパー（店長）,単価の動き,・来客数の減少も含め、買い控えを感じる。
,,▲,スーパー（店長）,販売量の動き,・BSE（牛海綿状脳症）の影響で、肉の販売量が非常に減少している。
,,▲,コンビニ（経営者）,来客数の動き,・単価の低下に加えて、最近では来客数も伸び悩んでいる。
,,▲,家電量販店（店長）,単価の動き,・ＩＴ不況で各メーカーの出荷ペースが落ちており、単価も低下している。
,,▲,家電量販店（営業担当）,販売量の動き,・冷蔵庫、洗濯機、パソコンなどの動きが悪い。
,,▲,乗用車販売店（営業担当）,来客数の動き,・フェアの来場者数、成約見込み客とも動きが悪い。
,,▲,乗用車販売店（従業員）,来客数の動き,・新型車の発売が最近立て続けにあったが、来場者数、販売台数とも伸びない。
,,▲,タクシー運転手,お客様の様子,・中距離、長距離の客があまりおらず、売上が悪い。
,,▲,タクシー運転手,お客様の様子,・自転車通勤が増加している。
,,▲,通信会社（総務担当）,お客様の様子,・有料のオプションサービスに対する見方が非常にシビアになっている。
,,▲,設計事務所（所長）,お客様の様子,・事業の中止や中断をする物件が出てきている。
,,▲,住宅販売会社（従業員）,単価の動き,・競争が激しく、受注単価が低下している。
,,▲,その他住宅［不動産］（経営者）,お客様の様子,・商談が長期化する傾向が強くなっている。社会不安、先行き不透明を理由に商談を途中で断られたケースもある。
,,×,スーパー（店長）,単価の動き,・BSE（牛海綿状脳症）の影響で精肉部門の売上が大幅に低下している。焼肉屋、喫茶店、レストラン等の注文も極端に少なくなっている。
,,×,都市型ホテル（経営者）,来客数の動き,・BSE（牛海綿状脳症）の影響で、特にステーキハウスなどについては、前年比50％割れとなっている。
,,×,旅行代理店（経営者）,販売量の動き,・国内旅行はまずまずの業績で推移しているが、米国テロの影響で海外旅行が激減している。
,,×,通信会社（営業担当）,来客数の動き,・必要最小限の購入、目的のみの購入という客が多くなっている。
"企業
動向
関連

(四国)",,◎,－,－,－
,,○,－,－,－
,,□,輸送業（経営者）,受注量や販売量の動き,・受注価格や販売価格は変わらない、もしくは多少低下している。
,,▲,パルプ・紙・紙加工品製造業（経営者）,受注量や販売量の動き,・日々の売上、受注量が落ち込んでいるだけでなく、電話による注文も落ち込んでいる。
,,▲,一般機械器具製造業（経理担当）,取引先の様子,・産業処理関係の機械を製造しているが、ユーザーが産業廃棄物の減量など、コストダウンに努めている。
,,×,食料品製造業（従業員）,受注量や販売量の動き,・BSE（牛海綿状脳症）の影響で発注量が減り、売上が減少している。
,,×,家具製造業（営業担当）,受注量や販売量の動き,・発注単価の下落に加え、受注量の落ち込みも大きい。
,,×,建設業（経営者）,受注量や販売量の動き,・特に民間の建築は、今後の発注の見通しが立たない。
,,×,建設業（総務担当）,競争相手の様子,・他のエリアまで競争相手が進出してきている。
,,×,通信業（支店長）,受注量や販売量の動き,・携帯電話の販売量が、競争相手分を含めて、かなり減少している。
,,×,広告代理店（経営者）,受注量や販売量の動き,・新聞出稿段数やテレビ、ラジオスポットの本数が少なくなっている。
"雇用
関連

(四国)",,◎,－,－,－
,,○,－,－,－
,,□,職業安定所（職員）,求職者数の動き,・事業所閉鎖やリストラで退職した求職者は減少していない。
,,▲,人材派遣会社（支店長）,求人数の動き,・企業からの求人数の動きはかなり鈍くなっている。
,,▲,求人情報誌製作会社（従業員）,求人数の動き,・求職者数は増加し、求人数は減少している。
,,▲,職業安定所（職員）,求人数の動き,・３か月連続で新規求人数が減少している。
,,×,民間職業紹介機関（所長）,周辺企業の様子,・企業の求人意欲の減退が顕著であり、会社都合の解雇が多く見受けられる。
,,,,,
　１０．九州,,,,,
,,,,,（－：回答が存在しない、＊：主だった回答等が存在しない）
分野,,景気の現状判断,業種・職種,判断の理由,追加説明及び具体的状況の説明
"家計
動向
関連

(九州)",,◎,－,－,－
,,○,衣料品専門店（店長）,単価の動き,・現金で購入する客が多くなっている。
,,○,家電量販店（店員）,販売量の動き,・今月の中旬からパソコン業界では新しいＯＳが搭載されたパソコンが発売されたが、それに伴い物流量が増え、販売量が上がり、単価も若干上がっている。
,,○,観光型ホテル（スタッフ）,来客数の動き,・宿泊客や日帰り、立ち寄り客が増えている。
,,□,衣料品専門店（総務担当）,お客様の様子,・バーゲンセールの来客数が前年並みである。
,,□,観光型ホテル（スタッフ）,お客様の様子,・宿泊が若干上向きの傾向にあるが、レストラン、特に肉関係のメニューの売上が減少している。
,,▲,商店街（代表者）,お客様の様子,・米国テロやBSE（牛海綿状脳症）の影響で消費者不安が増大しており、生鮮食品や野菜、豆腐、コンニャク等の売上が低迷している。
,,▲,商店街（組合職員）,お客様の様子,・ウィンドーショッピングの客が多く、元気が良いのはリサイクルショップと100円ショップのみである。
,,▲,一般小売店［青果］（店長）,競争相手の様子,・スーパーの安売り競争が週に２、３回も行われている。
,,▲,百貨店（営業担当）,お客様の様子,・BSE（牛海綿状脳症）の影響で牛肉の売上が落ちているが、反動として豚肉、鶏肉、魚が増えるわけでもなく、消費者は食料品全体への出費を控えている傾向にある。
,,▲,百貨店（営業担当）,お客様の様子,・婦人服、洋品はブティック関係を中心に好調であるが、紳士服、洋品は極端に悪くなっている。この傾向は米国テロ以降、顕著に現れている。
,,▲,百貨店（売場担当）,単価の動き,・米国テロの影響で海外旅行に行く客が減少し、スーツケース等が売れていない。
,,▲,百貨店（総務担当）,競争相手の様子,・そごうの閉店効果はあるものの、同業他社の一番店がリニューアルして以来、食品を中心に厳しい状況にある。
,,▲,スーパー（店長）,競争相手の様子,・業界では、低単価品チラシの配布回数が増えているようだ。
,,▲,スーパー（総務担当）,来客数の動き,・家族１人分のみ購入するなど、シビアな買物の仕方になっている。
,,▲,スーパー（経理担当）,販売量の動き,・BSE（牛海綿状脳症）問題で、牛肉販売額が前年比６割減となっており、他の部分でもカバーできない状態である。
,,▲,衣料品専門店（店員）,お客様の様子,・購入するかどうか迷う時間が長く、迷ったあげく買わずに帰るというパターンが多い。
,,▲,その他専門店［書籍］（店長）,販売量の動き,・米国テロ発生以降、ガイドブック、地図など旅行関係の書籍の売上が低下している。
,,▲,旅行代理店（従業員）,単価の動き,・米国テロの影響で、アメリカやヨーロッパ等の高額商品が売れずに低単価商品ばかりが出ている。
,,▲,パチンコ店（店員）,お客様の様子,・炭鉱閉鎖やテーマパーク閉園などにより、客の財布のひもが更に固くなっている。
,,×,百貨店（販売促進担当）,それ以外,"・前年の地元プロ野球球団の優勝セールの売上が、本年は全く確保できない。
・セールでの買上単価は低下し、点数は減少している。"
,,×,スーパー（店長）,来客数の動き,・米国テロの影響で、客は旅行用品を買わなくなっている。
,,×,スーパー（店員）,販売量の動き,"・衣料品が非常に悪く、食品関係もBSE（牛海綿状脳症）の影響で悪くなっている。売れ筋商品が売れない。
・大手スーパーの破綻で、取引先が連鎖倒産している。"
,,×,コンビニ（店長）,来客数の動き,・長崎は10月に「おくんち」という大きな祭りがあるが、観光客が毎年目減りしている。
,,×,コンビニ（店長）,販売量の動き,・買物メモを持参するなど、客の買い控えが目立つ。
,,×,乗用車販売店（経営者）,単価の動き,・客は品質よりも価格やデザインを重視している。
,,×,乗用車販売店（管理担当）,来客数の動き,・米国テロ以降、土日のイベントの来場者数が減ってきている。
,,×,乗用車販売店（従業員）,お客様の様子,・古い車でも、調子が良ければ買換えを我慢してとことん乗るという傾向にある。
,,×,高級レストラン（経営者）,来客数の動き,・観光客、特に団体客が減少している。
,,×,スナック（経営者）,来客数の動き,・常連客が来なくなり、土曜日の来客数もほとんどない状態である。
,,×,旅行代理店（業務担当）,お客様の様子,・米国テロ以降、海外旅行の申込が極端に減少している。
,,×,タクシー運転手,来客数の動き,・10月は９月に比べて客の乗り込みが極端に少なく、朝から晩まで乗車待ちで長蛇の列ができている。
,,×,通信会社（担当課長）,お客様の様子,・ＩＴ関連の新商品への反応が鈍く、一握りの客が一時的に問い合わせや注文をしてくる程度である。
,,×,設計事務所（所長）,競争相手の様子,・同業者間で設計料のダンピングに近いことが行われ、取引企業の倒産も目立ってきた。
,,×,住宅販売会社（従業員）,競争相手の様子,・家を建てる客自体が少なくなっているため、価格の値引き合戦が続いている。
,,×,住宅販売会社（経営者）,来客数の動き,・８月以降、来客数や契約数が減少しており、契約までの時間が長くなっている。
