Ⅰ．景気の現状に対する判断理由等,,,,,
,,▲,乗用車販売店（経営者）,お客様の様子,キャンペーンによる売り込み攻勢をかけているが、目標の到達には至っていない。販売や修理代に関してもクレジットや分割を希望する客が多く、手持ちの資金が少ない。
,,▲,タクシー運転手,来客数の動き,・送別会等を行う会社があるが、繁華街に出ないで各会社の近くで行うところが増えている。
,,×,一般小売店［野菜］（店長）,販売量の動き,・売上も伸びず、単価もシビアになってきている。周りでは閉店するところも多く、当店も厳しい状況である。
,,×,コンビニ（経営者）,販売量の動き,・競合店、100円ショップの出店、道路開発による交通量の変化等、様々な要素が重なった結果、来客数、販売量、単価全てにおいて悪化傾向にある。
,,×,衣料品専門店（経営者）,来客数の動き,・当店の来客数が減少しているだけでなく、立地している商店街の来街者数も減少している。
,,×,通信会社（経営者）,お客様の様子,・大口の受託顧客から、サービスの停止が提示され、経営的に縮小せざるを得ない状況である。
"企業
動向
関連

(近畿)",,◎,出版・印刷・同関連産業（経営者）,それ以外,・青年会議所の入会面接を担当しているが、前年と比べて明らかにベンチャー企業が増えていることと、自ら望んで応募する企業が増えた。
,,◎,電気機械器具製造業（従業員）,受注量や販売量の動き,・液晶テレビがかなり好調に推移しており、全体をけん引する形で実績が伸びている。
,,○,金属製品製造業（経営者）,受注価格や販売価格の動き,・鉄鋼の原料不足に伴う材料不足のため、ユーザーからの実需以上の材料買いが入っている。
,,○,一般機械器具製造業（経営者）,受注量や販売量の動き,・航空機部門はますます不況であるが、その他の製造業は生産量が増えている。
,,○,電気機械器具製造業（経営者）,受注量や販売量の動き,・従来の試作品が量産化に移行しつつあり、ユーザーからモデル変更の注文も受けた。
,,○,電気機械器具製造業（経営者）,取引先の様子,・家電ではデジタル関係が良いという傾向にあるが、自動車関係でもハイブリットカーの部品の供給が増えてきている。
,,○,電気機械器具製造業（経営者）,取引先の様子,・取引先では電子機器関連や半導体素子関連の企業が急に忙しくなっており、ステンレス加工品などの仕入先から、値上げ要求が来るようになった。
,,○,建設業（経営者）,受注量や販売量の動き,・年度末で土壌汚染調査がかなり忙しくなってきている。決算を控えた土地の売買の動きが活発である。
,,○,輸送業（営業所長）,受注量や販売量の動き,・年度末ということもあるが、学校関係や官庁関係に事務機器や備品の配達が増えている。
,,○,金融業（支店長）,取引先の様子,・鋼材等の資材価格の高騰が懸念材料であるが、建機製造業、美容サロンなどのサービス業の売上は増加している。
,,○,不動産業（経営者）,取引先の様子,・地域ごとに格差はあるものの、品質の高い大阪市内商業地の売却物件については、購入希望者が多数集まり、価格も上昇傾向にある。
,,○,新聞販売店［広告］（店主）,受注量や販売量の動き,・春の転宅シーズンで、読者の移動が激しくなってきた。折込チラシも２月、３月と増えてきている。
,,○,その他非製造業［民間放送］（従業員）,受注量や販売量の動き,・テレビスポット需要が引き続き高いレベルで好調を維持している。
,,□,繊維工業（経営者）,取引先の様子,・問屋の売上が前年比で２割減少したという話を耳にした。
,,□,パルプ・紙・紙加工品製造業（経営者）,競争相手の様子,・今年に入ってからの競争相手の様子では、あまり変化がない。消費税の表示変更でラベル、シールはよく動いている。
,,□,金属製品製造業（経営者）,受注価格や販売価格の動き,・原材料価格は上昇しているが、受注価格は相変わらず低迷しており、ゼネコンを取り巻く環境は厳しい状況が続いている。
,,□,一般機械器具製造業（経営者）,取引先の様子,・３月に大型検査装置を納入したが、それを使っての生産予定がフル生産状態になった。
,,□,輸送業（経営者）,受注量や販売量の動き,・年度末に向けて、住宅関連等の大口顧客の部材の荷量がもっと増えてこなければならないが、業務の平準化のためか駆け込み需要は落ち込んでいる。一方、他の一般貸切では、外販部分で運賃は安いが、引き合いが増えてきている。
,,□,不動産業（経営者）,受注価格や販売価格の動き,・大阪市中央区の飲食テナントの賃料は下げ止まり、空室も目立たなくなってきている。
,,□,広告代理店（営業担当）,取引先の様子,・広告主のなかでも、次年度に向けて積極的に広告出稿を計画している企業もあれば、かなり厳しいところもあり、一概に良いとも悪いともいえない。
,,□,コピーサービス業（従業員）,受注量や販売量の動き,・決算前の調整ということもあり、業績が好調だった企業からは大口の印刷物オーダーが入稿したが、反対に不振だった企業からは注文が大幅に減少した。
,,□,その他非製造業［機械器具卸］（経営者）,取引先の様子,・企業の経常利益が増加していると報道されているが、得意先についてはまだそれが感じられない。
,,▲,繊維工業（団体職員）,受注量や販売量の動き,・原材料の綿糸価格の高騰、受注量の減少などから、採算の悪化が更に深刻になっており、休業する企業も出てきている。
,,▲,通信業（営業担当）,受注量や販売量の動き,・年度末になり、移転などのメンテナンス注文が増加したが、駆け込み需要がそれほどなかった。
,,▲,広告代理店（従業員）,取引先の様子,・各ＳＣともに来客数はやや増加しているようだが、テナント小売業の客単価は減少している。
,,×,繊維工業（経営者）,受注価格や販売価格の動き,・消費税総額表示で、仕入先に値引要求する取引先がでてきた。
"雇用
関連

(近畿)",,◎,＊,＊,＊
,,○,人材派遣会社（社員）,雇用形態の様子,・企業から正社員採用を前提とした人材紹介などの需要が旺盛である。
,,○,人材派遣会社（社員）,求人数の動き,・高度な技能を有する人材が不足し、雇用のミスマッチが解消できていないものの、求人数が増加傾向にあり、新規案件も短期的な内容から長期的な受注となってきた。
,,○,新聞社［求人広告］（担当者）,周辺企業の様子,・求人案内を出す会社の動きが安定してきている。小口の案内広告の広告主、人材紹介業などの動きが多少出てきた。
,,○,新聞社［求人広告］（担当者）,求人数の動き,・年度末を迎えて、特に人材派遣会社からの登録者募集告知の広告が活発に動いている。
,,○,職業安定所（職員）,求人数の動き,・有効求人倍率が９か月連続でプラスとなっている。また、依然として雇用形態でのミスマッチはあるものの、就職数、充足数がともに３か月連続で増加に転じている。
,,○,職業安定所（職員）,求人数の動き,・有効求人数は前年比で２けたの増加であるが、求職者数の推移は減少傾向が続いている。ただ、求職者の現況をみると、在職者であって求職を行っている人が増加している。
,,○,職業安定所（職員）,求人数の動き,・求人数はここ６か月で急速に改善しており、昭和55年２月以来全国平均を上回っている。
,,○,学校［大学］（就職担当）,求人数の動き,・この時期になると、平成16年度の採用中止を決定した企業からのレターが届くが、例年に比べて非常に少ないように感じている。
,,○,学校［大学］（就職担当）,求人数の動き,・平成15年度の求人数は前年度に比べ2.1ポイントの微増であった。規模別では大企業、中堅企業からの求人が増加した。また、業種別では製造業、不動産業が好調であった。
,,□,人材派遣会社（経営者）,求人数の動き,・年度末で駆け込み需要がある時期だが、今年は一切ない。ただし、ＩＴ関連企業には根強い需要がある。
,,□,求人情報誌製作会社（編集者）,求人数の動き,・例年通り新旧のアルバイト、パート異動があり、求人数は前年と変わらない。今年になって求人情報の件数が増加したといわれているが、一部の業者が複数の媒体に重複させて求人企業を掲載しているためであり、実際の求人企業数は増加していない。
,,□,新聞社［求人広告］（担当者）,雇用形態の様子,・ビルメンテナンス会社で、嘱託社員を減らしパート勤務に切替えるところが出てきた。
,,□,新聞社［求人広告］（担当者）,求職者数の動き,・求人数は増加したが一時的なものに過ぎない。例年に比べて求人にかける予算が減ったのか、小さなスペースでの掲載が増えた。
,,▲,－,－,－
,,×,民間職業紹介機関（職員）,求人数の動き,・３月の求人数としては史上最悪のレベルである。しかも、それでも人々は驚かないという雰囲気になっている。ただ一部では、業者の淘汰が進んで、今後は少し経営が安定しそうなところもある。
,,,,,
　８．中国（地域別調査機関：（社）中国地方総合研究センター）,,,,,
,,,,,（－：回答が存在しない、＊：主だった回答等が存在しない）
分野,,景気の現状判断,業種・職種,判断の理由,追加説明及び具体的状況の説明
"家計
動向
関連

(中国)",,◎,一般レストラン（店長）,来客数の動き,・入学、卒業、就職などのお祝いで、大変多くの家族連れが来店しているが、どの顔も明るく、客の中から若年層の就職も次々と決まっているという話も聞かれた。
,,○,商店街（代表者）,お客様の様子,・広島市内周辺郊外部に大型ショッピングセンターが相次いで開店したこともあり、客のフットワークが２月から軽くなったと感じられる。直接販売には結び付いていないが、客の動きがある。
,,○,一般小売店［書店］（経営者）,お客様の様子,・教科書などの動きとともに、店内の人の動きも、高校生を中心に良くなっている。
,,○,一般小売店［100円商品］（店員）,お客様の様子,・客の様子、また、販売量、単価の動きからも、少しずつ上向いている。
,,○,百貨店（販売促進担当）,単価の動き,・一部婦人服や新商品の動きは良くないが、ヤングブランドや化粧品、特選雑貨については非常に動きが良く、また他の高額商品の動きも良くなっている。
,,○,百貨店（購買担当）,お客様の様子,・例年の季節商材主力のリクルートやフレッシャーズのスーツ需要は、就職難も重なり前年をかなり下回ったが、近郊百貨店の開店により、これまでにない、夕方のミセス層を中心とした来店客が見込めるようになり、結果としてカジュアル商品の動きが良く、景気もやや上向いてきたと感じる。
,,○,百貨店（営業担当）,競争相手の様子,・市内百貨店のリニューアルオープン、郊外ショッピングセンターの新規オープンに伴い、市内及び郊外への買物客が増えているとともに、県外からの来店者も増加している。来店者は購買意欲があり、何かしら購入している。
,,○,スーパー（店長）,販売量の動き,・客単価も、以前より若干良くなり、１人当たりの買上点数も、若干ながら上向いている状況である。
,,○,スーパー（店舗運営担当）,販売量の動き,・今春は、例年のような就職進学シーズンの買い控えの傾向がほとんどなく既存店ベースでも順調に推移しており、来店客数が103％と増加傾向にあるとともに、販売量はそれ以上の105％に増加した。
,,○,コンビニ（エリア担当）,お客様の様子,・客の財布のひもが固くなって久しく、それが当たり前の状況であったが、最近ではこちらから商品の良さや販売したいものを勧めると、購買に結び付いてきている。競合店や長時間スーパー等の影響で引き続き厳しさは残るものの、わずかだが景気回復の兆しはみえている。
,,○,衣料品専門店（地域ブロック長）,お客様の様子,・フレッシュマンを中心に来店があるが、以前のように低価格志向の客は少なく、一通りそろうセットで、４万円から５万円のものを購入している。
,,○,その他専門店［贈答品］（店員）,来客数の動き,・３か月連続して、出産お祝いに対してのお返し物が伸びており、結婚式の引き出物関係も好調である。
,,○,都市型ホテル（従業員）,単価の動き,・レストランで追加料金のチョイスメニューの売上が伸びている。
,,○,都市型ホテル（スタッフ）,販売量の動き,・近郊で大型店舗の新築、改装が相次ぎ、それに伴う人の流れが多く、宿泊、レストラン関係が好調である。
,,○,設計事務所（職員）,販売量の動き,・依然として個人住宅向けマンション、１戸建住宅の新築が多く、それも早期に販売できている。また、個人向け建築屋からも忙しいと聞いている。
,,○,住宅販売会社（従業員）,来客数の動き,・展示場、現場見学会等において、以前よりも客の反応がやや良くなっていると感じられる。来場者も１割増である。
,,□,一般小売店［靴］（経営者）,来客数の動き,・来客数はあまり増加しておらず、店頭陳列や店頭特売品は、よく手にとってもらえるが、店内まで足を運ぶ客は減少した。
,,□,一般小売店［茶］（経営者）,販売量の動き,"・全体の売上は、さらに悪くなっているが、各種イベントに多数参加することにより、売上を維持している状況である。
・イベント主催者の話によれば、イベント自体の売上は低下している。"
,,□,百貨店（販売促進担当）,お客様の様子,・新生活、リクルート、卒入園関連の商品の動きが非常に悪い。いずれも、価格が大きな切り口になっている傾向がうかがえる。
,,□,百貨店（売場担当）,お客様の様子,・ミセス衣料は、前年比100％で推移しているが、ヤング衣料が、夏物シフトによる春物不足もあり、前年比の90％で推移している。店舗全体では、前年比95％の見込みである。
,,□,スーパー（総務担当）,お客様の様子,・ＢＳＥ、鳥インフルエンザによる輸入規制、客の肉類に対する不安、不信感、また国産牛の値上がりで年度末の決算特売にも影響が出ている。
,,□,スーパー（店長）,単価の動き,・来店客数に変化がないが、依然として、特売品の販売数の減少など、買上点数、単価の減少が続いている。
,,□,スーパー（店長）,単価の動き,・客数は前年比103％、販売点数は前年比102％と伸びているが、買上単価が、前年比96％とここ２年間連続で低下しており、売上は前年比以下になった。
,,□,スーパー（店員）,単価の動き,・消費税総額表示の対応に追われ、店内では３月後半から消費税総額表示を開始したが、値上げや便乗値上げをしたのかと、客から勘違いされている。
,,□,スーパー（販売担当）,お客様の様子,・客は安い商品を求められており、お店の定番商品は動かない。
,,□,コンビニ（エリア担当）,販売量の動き,・来客数、販売高ともに前年を大きく上回っているが、競合店対抗の要因が大きく、実際に主食類の販売量は数か月前と比べ伸び悩んでおり、上向きの要素はまだ見えにくい。
,,□,衣料品専門店（店長）,単価の動き,・季節柄、フレッシュマンの来客数は増加したが、一般客の来客数、単価は厳しくなっている。
,,□,衣料品専門店（販売促進担当）,単価の動き,"・単価が下がったせいか、売上は若干落ち込むが、客数は伸びている。
・気候が不安定のため、冬物と春物を同時に買う客が多い。"
,,□,家電量販店（店長）,販売量の動き,・生鮮品高騰により食費がかさむため、電気製品は、必要なもの以外は買わないという客が多い。
,,□,乗用車販売店（経営者）,販売量の動き,・２月は、客の動き、販売量とも好調に推移したが、３月に入り、前年よりは若干堅調に推移しているが、苦戦を強いられている。
,,□,乗用車販売店（総務担当）,単価の動き,"・依然として、大型車、中型車の受注が伸びていない。
・サービス部門においても、車検等の価格が低い。"
,,□,乗用車販売店（販売担当）,販売量の動き,・受注件数が前年比90％で推移しており、依然新規受注が少なく、乗換えも少ない状況が続いている。
,,□,一般レストラン（店長）,来客数の動き,・隣接するデパートで大規模なリニューアルがあり、その相乗効果から集客アップが図れたが、全チェーン店では２けたダウンの店が３分の１もあり、依然厳しい状況である。
,,□,観光型ホテル（スタッフ）,来客数の動き,・３か月前と比べると、客の人数、販売量、販売単価など全て上回っている。
,,□,旅行代理店（経営者）,単価の動き,・前年と比べ状況は好転しているが、単価が低くなっているため、売上はやや悪い。
,,□,旅行代理店（営業担当）,来客数の動き,・ＳＡＲＳ、テロ、鳥インフルエンザの影響が、なくなってきた。
,,□,タクシー運転手,販売量の動き,・ＮＰＯによる輸送介護の拡大のせいか、３月初めには、前年比10％以上減少したが、現在は前年比３％減まで回復した。
,,□,タクシー運転手,お客様の様子,・歓送迎会の時期だが、期待したよりも客の動きが悪く、悪い状態で推移している。
,,□,通信会社（経営者）,お客様の様子,・加入契約数がここ数か月の実績から低下したままであり、かつ解約も増加しており、純増加数が低迷したまま推移しており、増加の兆しが見えない。
,,□,その他レジャー施設［温泉センター］（営業企画担当）,単価の動き,・日帰り温泉部門は、動員数で前年を上回る日が増えてきており、温泉ホテル部門も､前年の微増を確保しつつありほぼ順調に推移している。しかし団体から個人の中心の利用になってきていることから、客単価は思ったより伸び悩んでいる。
,,□,美容室（経営者）,販売量の動き,・客の動向として消費が増加傾向にあるが、依然として単価等は上がっていない。
,,□,設計事務所（経営者）,競争相手の様子,・発注件数が大変少ない。
,,□,住宅販売会社（経理担当）,お客様の様子,・住宅ローン返済のための先行収入の不安のため、住宅の購入にちゅうちょする顧客が目立つ。
,,▲,商店街（代表者）,来客数の動き,・商店街来街者も半年前から引き続き少なく、来店者も少ないが、各個店の売上は若干上がってきている。
,,▲,百貨店（売場担当）,来客数の動き,・隣接する百貨店のリニューアル及び大型ショッピングセンターオープンのため、客の流れが急変している。
,,▲,スーパー（店長）,来客数の動き,・現在出店しているショッピングセンター全体で、客数が、特に土日の集客を中心に、前年比90％と落ち込んでいる。より大きなショッピングセンターへ客が流れている。
,,▲,家電量販店（予算担当）,販売量の動き,・消費税総額表示を前倒しで実行したためか、若干売上が落ちている。
,,▲,住関連専門店（広告企画担当）,単価の動き,・来店者数、契約数ともに変化は無いが、単価の低下が止まらない。特に、新築をした客の買替購入金額をみると、以前は気になるアイテムをまとめ買いしていたが、単品毎の買換えにとどまっている。
,,▲,その他専門店［時計］（経営者）,単価の動き,・客単価が10％から15％ほど下がっている。
,,▲,その他飲食［ハンバーガー］（経営者）,来客数の動き,・良いプロモーションを企画すれば客数は伸びていたが、その影響力が薄くなってきている。特に春休みの出足が悪い。鳥インフルエンザ以降、食への不安感が増している。
,,▲,ゴルフ場（営業担当）,単価の動き,・ゴルフ場業界では、単価を下げれば来客数は伸びる状況にあるが、現在下げ止まりの状況であり全体として苦しくなっている。
,,▲,設計事務所（経営者）,来客数の動き,・一時的な冷え込みのせいか、客の動きが悪いことから全体の動きも悪い。
,,×,スーパー（店長）,競争相手の様子,"・大型店出店により、競合状況が激化した。
・消費税総額表示の影響で、１品単価も下がってきている。"
,,×,家電量販店（副店長）,販売量の動き,・３月は大学生の新入学、社会人の異動など、単身者向けの最大の需要期であるが、今期は過去最低の実績である。前年大幅ダウンであり来月にも大きく影響することは間違いない状況である。転出、転入共に激減している。
"企業
動向
関連

(中国)",,◎,電気機械器具製造業（総務担当）,受注量や販売量の動き,・設備能力限界まで受注が入っている。
,,◎,輸送用機械器具製造業（経理担当）,取引先の様子,"・主要顧客の一部生産ラインは活況を呈しており、生産が追い付かない部品が出ているため、主力ラインの臨時休業を実施する。
・決算月で例年活況の３月ではあるが、３か月前との比較では受注量は増加し、前年同月比においても20％の受注量の増加となっている。"
,,○,建設業（営業担当）,受注量や販売量の動き,・民間工事の発注、特にデベロッパー関係の発注が増加し始めている。
,,○,金融業（業界情報担当）,取引先の様子,・新車の販売好調を背景に、生産水準が高水準を維持しており受注量は総じて前年比プラスで推移している。コスト削減要請が厳しく受注単価は低下しているが、増収増益基調は維持している。
,,○,会計事務所（職員）,取引先の様子,・個々の単価という面から見れば厳しさは相変わらずだが、仕事量の面から見れば結構忙しい事業所が多くなってきている。建材メーカーによっては、一部材料の供給が間に合わない所も出てきている。また、不動産業においては、大手デベロッパーが優良地を積極的に購入する動きも出てきている。
,,□,化学工業（総務担当）,受注価格や販売価格の動き,・前月から大きな変化は無い。社内は全般に高稼働であるが、物流費の高騰による原材料、燃料費高が影響し利益が上がらない。
