Ⅰ．景気の現状に対する判断理由等,,,,,
,,□,タクシー運転手,来客数の動き,・梅雨の時期は傘代わりに利用する客も多いが、今年は雨も少ないので客が少ない。
,,□,タクシー運転手,お客様の様子,・ここ数か月間、客の乗車回数の増加傾向が続いており、営業収入は堅調ではあるが、今一つ企業関係の需要に加速感がない。
,,□,タクシー会社（経営者）,お客様の様子,・稼ぎ時である夜間の人出が非常に少ない。
,,□,遊園地（経営者）,来客数の動き,・近郊の私鉄系列の遊園地が閉鎖したので、来客数の増加を期待したが、例年並みになった。
,,▲,百貨店（売場主任）,来客数の動き,・今月に入り急に慎重な購買姿勢が強まった。数量、単価とも前年と比較して悪化している。高額品の動きも商談ベースでは依然として活発であるが、一巡感が強まり全体の売上のけん引役となっていない。ブライダルなど若年層の購買意欲が特に低いようだ。
,,▲,百貨店（売場主任）,販売量の動き,・婦人衣料や雑貨、化粧品に至るまで総倒れである。
,,▲,百貨店（営業担当）,販売量の動き,・ここ２、３年、好調に売上を伸ばしていた高級時計が低迷してきた。高額品の引き合いが減ってきている。
,,▲,百貨店（サービス担当）,お客様の様子,・国政選挙とお中元期が重なって前年の売上を約５％下回っているほか、６月に台風が上陸したこともあり、来客数が前年の約８％減少している。
,,▲,衣料品専門店（経営者）,来客数の動き,・バーゲンの前倒し傾向が強く、プロパーでの来客数の減少が顕著である。
,,▲,乗用車販売店（営業担当）,単価の動き,・大型車種から小型車種にシフトしており、１台当たりの単価が下がってきた。
,,▲,住関連専門店（経営者）,販売量の動き,・連休後の最悪の状態は脱したものの、引き続き来客数、販売数ともに極めて低調な状態にある。
,,▲,都市型ホテル（スタッフ）,来客数の動き,・３月、４月辺りと比較すると現在の状況は確実に悪い。ジューンブライドも一時期ほどではなくなっており、６月にホテルを利用する要素が特にないことが大きな要因である。
,,▲,通信会社（社員）,販売量の動き,・春以降、市場が急に落ちている。春商戦は売上が伸びるものだが、それにしても落ち方が顕著である。
,,▲,美容室（店長）,販売量の動き,・ヘアカットの客に化粧品の販売も行っているが、４月から化粧品販売のキャンペーンを行っている関係で、今月に売れるはずのものを４、５月に売り切ってしまい、販売量が減少した。
,,▲,その他住宅［展示場］（従業員）,お客様の様子,・住宅展示場の来場数は、ゴールデンウィークをピークに減少に転じた。特に今月の来場数は少なくなっている。しかし、１年以内の購入計画者の割合は変わらず、依然堅調な動きではある。
,,×,通信会社（経営者）,お客様の様子,・新規案件が凍結されている。
,,×,競輪場（職員）,単価の動き,・今月の購買単価は３月と比べて下がったほか、売上高及び来客数も減少している。また、場外開催の購買単価も３月よりも低下した。
"企業
動向
関連

(近畿)",,◎,出版・印刷・同関連産業（経営者）,取引先の様子,・当社は様々な提携業務も手がけているが、最近積極的に新しいビジネスモデルに投資しようと考える投資家が増えてきている。
,,◎,一般機械器具製造業（経営者）,受注量や販売量の動き,・全国的にものづくり企業が忙しいようで、見積照会が毎日のようにある。
,,◎,電気機械器具製造業（従業員）,受注量や販売量の動き,・これまで業界全体で上向きの薄型テレビが全体をけん引していたが、今月は電化製品関係や情報機器関係も好調な荷動きを示しており、全体的に活発な荷動きといえる。
,,○,出版・印刷・同関連産業（経営者）,取引先の様子,・取引先からの見積件数が以前より増えている。価格競争は変わらないが、コスト競争に勝てる設備投資を行っているかがキーポイントとなる。キャンペーン商品が少し市場に組み込まれてきた傾向がある。
,,○,電気機械器具製造業（経営者）,受注量や販売量の動き,・液晶、半導体、携帯電話関連は確実に良くなっている。それ以外の業界関連の生産拠点の海外流出は基本的に続いており、当社周辺でも苦境を訴える声がたくさんあるが、当社は液晶や携帯関連にかかわる分野が多いので、受注量増加の恩恵を受けている。
,,○,電気機械器具製造業（経営者）,取引先の様子,・見積の引き合いから、受注に移行することが増えた。
,,○,電気機械器具製造業（営業担当）,受注量や販売量の動き,・国内工場設備改修の引き合い物件が多少増えた。
,,○,金融業（支店長）,取引先の様子,・建機部品等の製造業、プラスチック材料卸売業、不動産業等、幅広い企業で販売量が増加している。
,,○,不動産業（経営者）,取引先の様子,・東京からの資本の流入により、投資物件の需要が堅調である。
,,○,不動産業（経営者）,受注価格や販売価格の動き,・大阪府内の不動産仕入れ価格が徐々に上がってきている。特に建て売り用地に関しては競争が激しく、以前のように買手市場ということはなくなった。
,,○,経営コンサルタント,それ以外,・会社としての新規投資は困難だが、株価が上がっているため、代表者個人の出資により新事業を立ち上げる等、個人ベースの投資余力が一時的にではあるが出てきている。
,,□,パルプ・紙・紙加工品製造業（経営者）,受注量や販売量の動き,・６月に入ってから受注量が確実に減少している。競争相手の様子からもはっきり受注量の減少が分かる。
,,□,金属製品製造業（経営者）,受注価格や販売価格の動き,・得意先であるゼネコンに対して、原材料価格の値上がりに伴う製品価格のアップを要求しても、相変わらず厳しい回答しかもらえない。
,,□,一般機械器具製造業（従業員）,それ以外,・鋼材価格の高騰による影響が大きく出ている。また価格だけでなく、注文しても品薄のため、希望納期までに納入されないケースが出ている。
,,□,広告代理店（従業員）,取引先の様子,・取引先の各商業施設とも夏バーゲンになるが、今一つ盛り上がりに欠ける状況である。
,,□,コピーサービス業（従業員）,受注量や販売量の動き,・企業からの大口印刷受注は増えたが、今年は雨の日が多かったこともあって店頭への来客が減り、総じて変化はなかった。
,,▲,輸送業（営業所長）,受注量や販売量の動き,・関西国際空港での輸入貨物の荷動きが、５月より依然として鈍化傾向にある。それに反して輸出は依然好調と聞いている。
,,▲,通信業（営業担当）,それ以外,・親会社が変わり、業界では注目されるが、法人の契約見込顧客からは敬遠されてしまう要素があり、商談が進まない。
,,▲,広告代理店（営業担当）,受注量や販売量の動き,・春よりも、広告の新規出稿がかなり減ってきている。
,,×,繊維工業（経営者）,受注量や販売量の動き,・取引先からの情報でも、ゴールデンウィーク明けから急激に消費者の購買意欲が低下してきたと聞いた。理由については定かではないが、安価な輸入品の増加とバーゲンセールの頻度が増えたことで、既に買い置きがあるのかもしれない。
"雇用
関連

(近畿)",,◎,人材派遣会社（社員）,求職者数の動き,・正社員志向の人が増えており、スタッフが登録に集まらない状況である。
,,○,人材派遣会社（経営者）,雇用形態の様子,・紹介予定派遣の依頼が増え、最初から正社員でという企業が派遣依頼より多くなってきているので、雇用形態が変わってきている。
,,○,人材派遣会社（社員）,求人数の動き,・求人数は増加傾向にあるが、要求されるスキルが高くなってきているので、マッチングが難しくなっている。
,,○,職業安定所（職員）,求人数の動き,・新規求人を産業別にみると、大半の産業で前年同月を上回り、経営、雇用環境は改善傾向で推移している。
,,○,職業安定所（職員）,求職者数の動き,・景気の上向きを背景に、新規求職申込が２か月連続で減少している。
,,○,職業安定所（職員）,求人数の動き,・新規求人数は、前年比で10か月連続して大幅に増加している。一方で求職者数は11か月連続して減少しており、ハローワークの窓口の状況としては求人窓口が混雑し、職業紹介窓口が落ち着いているという現状である。
,,○,民間職業紹介機関（支社長）,採用者数の動き,・関西メーカーの求人意欲が衰えない。大手以外の中堅中小企業でも求人意欲が上昇中である。
,,□,求人情報誌製作会社（編集者）,求人数の動き,・無料の求人誌が増えてきているが、新規参入の求人誌の広告には競合誌と同じ顧客が多く、市場の求人数としては増えていない。
,,□,新聞社［求人広告］（担当者）,雇用形態の様子,・派遣スタッフの募集が増えているが、前年と比べて非常に応募者が少ない。経理事務、貿易事務、薬剤師などが特に悪い。
,,▲,新聞社［求人広告］（担当者）,周辺企業の様子,・薬剤師等の偏った企業の求人ばかりが目立ち、一般企業では人材が足りている状況にある。来春の新卒採用も、今までよりは広い門と言われているが、内容的には厳しい。
,,×,－,－,－
,,,,,
　８．中国（地域別調査機関：（社）中国地方総合研究センター）,,,,,
,,,,,（－：回答が存在しない、＊：主だった回答等が存在しない）
分野,,景気の現状判断,業種・職種,判断の理由,追加説明及び具体的状況の説明
"家計
動向
関連

(中国)",,◎,－,－,－
,,○,商店街（代表者）,お客様の様子,・客の様子から、買物に少し前向きという雰囲気が漂っている。
,,○,百貨店（売場担当）,販売量の動き,"・特別顧客招待会を催した結果、売上前年比250％、買上点数前年比200％、買上客数185％と大幅に達成した。
・秋物受注会を催したら売上予算の150％を達成した。"
,,○,百貨店（営業担当）,お客様の様子,"・顧客特別優待会では、一点買いからコーディネート買いへの変化が見受けられ、客単価が上昇してきた。
・お中元の出足は前年より悪い。"
,,○,スーパー（店長）,来客数の動き,"・依然として競合状況は厳しいが、１品単価は上昇が見込めないが、客数増により補填している。
・農産品の相場高の影響もあり、客単価も買上点数減少を補填している。"
,,○,スーパー（店長）,販売量の動き,・客の購買意欲が高まって、買上点数などが上向いている。
,,○,スーパー（総務担当）,単価の動き,"・前年の冷夏の反動か、乳飲料の動きが良く、売上が７～８ポイント前年より増加した。
・完成食材の総菜も動きが良く、客単価が２～３ポイント増加している。"
,,○,コンビニ（エリア担当）,単価の動き,・客単価が、前年100.3％と前年比を超えてきており、1人当たりの購買数が増加してきている。客数も今月に入り98.4％と前年割れしているが、前月対比では3.4％の伸びを見せている。
,,○,コンビニ（エリア担当）,それ以外,・旅行の団体客を良く見るようになった。
,,○,衣料品専門店（地域ブロック長）,販売量の動き,"・高額商品と低額商品の２極化が更に進んだ。
・父の日プレゼントも前年よりかなり数量アップした。
・薦めれば、まとめ買いをする。"
,,○,衣料品専門店（地域ブロック長）,来客数の動き,・単価は変わらないが客数は戻ってきており、前年を上回っている。
,,○,衣料品専門店（地域ブロック長）,販売量の動き,・１品単価は低下しているが、客数や買上点数が増加している。
,,○,その他飲食［ハンバーガー］（経営者）,単価の動き,・客数も増加しているが、値段の高い新商品が客単価を上げており、売上増につながっている。
,,○,都市型ホテル（総務担当）,来客数の動き,"・外国人客が増加傾向にある。
・単価がやや増加傾向にある。"
,,○,タクシー運転手,来客数の動き,・ボーナスが出たためか一万円札を出される客が増えた。
,,○,タクシー運転手,販売量の動き,・昼間の客数は減少しているが、ボーナスの影響で、夜間の客数が少し回復してきている。
,,○,通信会社（総務担当）,販売量の動き,・売上も上昇しており、販売量も伸びてきている。
,,○,テーマパーク（業務担当）,お客様の様子,・来園者数が堅調である。
,,○,パチンコ店（総務担当）,来客数の動き,・客もボーナスが支給されて、多少お金が廻っている。
,,□,商店街（代表者）,お客様の様子,・年齢層が中高齢者に限定され、若い人の来客が少ない。
,,□,一般小売店［靴］（経営者）,お客様の様子,・依然として、必要な物のみ購入する傾向が見られ、同時に予算を必ず守ろうとする傾向も見られる。
,,□,一般小売店［茶］（経営者）,販売量の動き,・５月後半から売上が落ち始め、６月も落ちている。郵送小包の注文数も５％減少している。
,,□,百貨店（販売促進担当）,お客様の様子,・お中元の早期割引が好調である。しかし、このことから客の価格に対するシビアな視点がうかがえる。
,,□,百貨店（販売促進担当）,販売量の動き,・お中元を中心として好調に推移している部門もあるが、依然として、主力の紳士衣料婦人衣料とも前年比二けた減少が続いている。全体では前年並みの売上で推移しているが、主力商品の不振は続いている。
,,□,百貨店（購買担当）,お客様の様子,・７月のバーゲンが近いため下見の客は増加しているが、商品をお勧めしても購買に結び付かない。景気回復が伝えられる中、購買については依然慎重な気配である。
,,□,百貨店（売場担当）,お客様の様子,・売出しやＤＭ発送時はそこそこ集客があるも、その他の通常日は来客が非常に少なく、月後半には、バーゲン待ちの様子がみられた。
,,□,百貨店（営業担当）,お客様の様子,・セールが早期スタートしている中でまとめ買いは少なく、本当にほしい物を１点だけ厳選して購入する客が多い。
,,□,スーパー（店長）,単価の動き,"・消費税総額表示後の売価割高感からか、買上点数減少が続いている。
・チラシなどによる買い回りが顕著に見られる。"
,,□,スーパー（店長）,単価の動き,・１人当たりの買上点数も伸び悩み、競合他社も苦戦している様子がうかがえる。
,,□,スーパー（店長）,単価の動き,・客数、販売点数は、前年比の102％から103％に推移しているが、消費税総額表示の影響で、５％分が全ての商品の旧売価に含まれる傾向が徐々に強まってきていることから、売価を圧迫している。
,,□,スーパー（店員）,販売量の動き,"・客の消費税総額表示による割高感は依然変わらず、売価に５％転嫁することができない。
・酒類免許自由化の影響で、競合店が酒類を扱いはじめ、売上が予想以上の20％減少した。"
,,□,コンビニ（エリア担当）,販売量の動き,・上半期を振り返ってみると、全体的に若干ずつ上向きである。しかし、まだまだ楽観視はできない。
,,□,コンビニ（エリア担当）,来客数の動き,・来店客数は前年を５％程度上回っているが、ここ数か月大きな変化はなく横ばいの状況である。
,,□,コンビニ（エリア担当）,販売量の動き,・気温の関係で、アイスクリーム、飲料は好調であるが、依然として、酒類及び酒類と関係した惣菜の売上低下は続いており、全体的な傾向は変わっていない。
,,□,衣料品専門店（経営者）,来客数の動き,・来店はあるも、バーゲンの下見のような状況である。
,,□,衣料品専門店（店長）,単価の動き,・６月に入り、来客数の動きは普通であったが、客単価がかなり低下した。
,,□,衣料品専門店（販売促進担当）,来客数の動き,"・売上は前年とほとんど変わらないが、客足が伸びてきており、ショートパンツ、タンクトップ、シャツなど夏物が非常に好調に推移している。
・割引の案内を顧客に出しても、最近、客の動きはなくなった。"
,,□,家電量販店（店長）,来客数の動き,・エアコンは好調に推移しているが、その分、他の商品の動きが悪く、全体的には、例年と変わらない。
,,□,家電量販店（副店長）,販売量の動き,・ＯＡ商品の販売構成比が低くなっている。その中でも構成比の高いＰＣの販売台数が減少している。
,,□,乗用車販売店（統括）,お客様の様子,・造船は景気が良くてお金が落ちるはずなのに、地元には落ちてこない。鉄が好況な地域でも、地元にはお金が落ちてないようだ。
,,□,乗用車販売店（サービス担当）,お客様の様子,・修理のための入庫台数が減少しており、前年比95％である。
,,□,乗用車販売店（販売担当）,競争相手の様子,・受注の県内市場は前年比100％で推移している。新車が出たディーラーは200％で推移しているところもあるが、そうでないディーラーは50％で推移しているところもあり、受注は景気ではなく商品に依存している。お客の財布のひもは依然として固い。
,,□,乗用車販売店（営業担当）,来客数の動き,・新商品による来場客数増加は図れているが、絶対的な新規客数が増えていない。
,,□,自動車備品販売店（経営者）,来客数の動き,・一部高額商品に動きはあるものの、来店客数は５月連休以降伸び悩んでいる。前年度の年間の客数前期比をも下回っており、「回復」の実感はない。
,,□,住関連専門店（営業担当）,お客様の様子,・新築、婚礼などの客数は変わらないが、必要な物であっても購買をちゅうちょする傾向が見られる。
,,□,高級レストラン（スタッフ）,来客数の動き,・企業関係の需要が、夜の方がかなり低迷し、厳しい状況となっている。
,,□,一般レストラン（経営者）,来客数の動き,・家族連れが増加しており、1名当たりの飲食個数も増加しており、前年並みにはなりそうであるが、あくまで「前年並み」である。
,,□,一般レストラン（店長）,来客数の動き,・週末、日祝日の集客は前年並みだが、平日の集客に各店苦戦している。
,,□,観光型ホテル（スタッフ）,販売量の動き,・３か月前、また前年より、先行予約数は少なくなっている。
,,□,旅行代理店（営業担当）,来客数の動き,・年齢、性別に関係なく、動きが活発になった。
,,□,タクシー運転手,販売量の動き,・６月になって初めて前年対比100％となった。
,,□,通信会社（広報担当）,販売量の動き,"・契約数の増加数が更に鈍化傾向にある。
・他社とのシェア争いは依然厳しい。"
,,□,テーマパーク（財務担当）,来客数の動き,"・週末の悪天候の影響で来客数が減少した。
・団体予約も減少した。"
,,□,美容室（経営者）,お客様の様子,・お客様の様子に、単価の高いものを控えている傾向が見られる。
,,□,設計事務所（経営者）,来客数の動き,"・動きが低調である。
・売上予算的に厳しい顧客が多い。"
,,□,設計事務所（経営者）,販売量の動き,・全体的な工事の量は依然として少なく、改善する兆しはない。
,,□,設計事務所（経営者）,お客様の様子,・商店街内の集会、同業他社の集会においても、景気のいい話は聞かれず、近隣で倒産も発生している。
,,□,設計事務所（職員）,販売量の動き,・近傍の休耕田に一戸建住宅の新築が多く、売れ行きも好調である。
,,□,住宅販売会社（従業員）,お客様の様子,"・展示場への来場客数は、多少横ばい状況で推移しているが、来場者の購買意欲がでていない。
・問題が発生している自動車会社関連の客も多数いるため、今後の状況不安を良く語られている。"
,,▲,商店街（代表者）,来客数の動き,・来客数、販売額ともに減少している。
,,▲,商店街（代表者）,単価の動き,・ベビー子供服業界は、相次ぐ大型店出店で供給過多となっており、価格維持が難しくなってきている。
,,▲,商店街（代表者）,来客数の動き,・依然として、商店街への来街者が大変少ない。
,,▲,一般小売店［100円商品］（店員）,単価の動き,・買上点数が少し減少している。
,,▲,百貨店（販売担当）,販売量の動き,"・売上高、来店客数とも前年を下回っている。
・パラソル、サンダルなど季節商材も、売上が前年比80％と低迷している。"
,,▲,スーパー（店長）,来客数の動き,・客の購買が、必要な物以外は購入しない傾向が目立つ。
,,▲,スーパー（店舗運営担当）,来客数の動き,"・競合店の出店より、客数が１日当たり約200人減少している。
・消費税総額表示により、１人当たりの買上点数が、0.5個減少している。"
,,▲,乗用車販売店（経営者）,販売量の動き,・前月も今月も自動車市場は前年割であり、先行きが不安である。
,,▲,住関連専門店（広告企画担当）,単価の動き,"・以前と変わらず、どんどん単価が下がってきている。結婚を急ぐあまり、きちんと周りと相談して先を見据えたグレードのものを購入されないため、単価が上昇しない。
・新築の方も低年齢化が進んでいるようで、予算的に苦しいのか、これもやはり単価が上昇しない。"
,,▲,観光型ホテル（スタッフ）,お客様の様子,・地元企業の利用、団体客の利用が減少している。
,,▲,都市型ホテル（従業員）,単価の動き,・和食、洋食レストランとも客数は横ばいであるが、特に和食レストランは客単価が落ちており、企業接待、個人消費ともに落ち込んでいる。
,,▲,都市型ホテル（スタッフ）,来客数の動き,・インターネットによる個人客は増加しているが、団体客は減少している。
,,▲,通信会社（社員）,販売量の動き,・販売量に加え、来客数も減少している。
,,▲,住宅販売会社（経理担当）,来客数の動き,・値引きチラシなどによる販売キャンペーンが一巡した後はモデルルームへの来場者が大きく減少し、契約数も予定を下回っている。
,,×,商店街（代表者）,販売量の動き,・客が来ない状況であり、大変に悪くなっている。なぜそうなったか全く分からない。
