Ⅰ．景気の現状に対する判断理由等,,,,,
,,,,,
　景気の現状に対する判断の理由及びそれに対する追加説明等について、その主だったもの及び特徴的と考えられるものを取りまとめると以下のとおりであった。,,,,,
,,,,,
,,,,,
　１．北海道（地域別調査機関：（株）北海道二十一世紀総合研究所）,,,,,
,,,,,（－：回答が存在しない、＊：主だった回答等が存在しない）
分野,,景気の現状判断,業種・職種,判断の理由,追加説明及び具体的状況の説明
"家計
動向
関連

(北海道)",,◎,商店街（代表者）,来客数の動き,・地元では海外チャーター便の誘致に全力を挙げており、その効果が出てきた。台湾・香港からのチャーター便は前年が99便であったが、今年は200便を超える様相である。来道客は、特に涼しいということで、ゴルフや観光に目を付けて、道東地区に来ているようである。
,,◎,設計事務所（所長）,来客数の動き,・民間に限ってだが、予算は相当厳しいものの、かなりの数の物件が動き出す様子を見せている。
,,○,商店街（代表者）,お客様の様子,・今年は気温の高い日が続いているので、客の夏物への購買力が増している。通常は、セール・バーゲン待ちの買い控えが起こる時期も、コンスタントに定価品が売れている。
,,○,百貨店（売場主任）,販売量の動き,・夏の売り尽くしセールの場合には、カットソー・タンクトップ等、低単価商品の動きが良いが、それに合わせて初秋物や晩夏物をついでに買う傾向があり、まとめ買いがある。
,,○,コンビニ（店長）,来客数の動き,・前年に比べて気温が安定して、比較的暖かい状況が続いているためか、５月末に導入したＡＴＭの利用者が、１日平均で30～40人程度あり、若干ではあるが来客数のアップにつながっている。
,,○,家電量販店（店員）,来客数の動き,・前年から比べると、６月は客数・売上とも増加した。薄型テレビ・ＤＶＤレコーダー・大型冷蔵庫・洗乾機などが良く売れた。
,,○,家電量販店（地区統括部長）,販売量の動き,・アテネオリンピックに向けてＡＶ商品、特に薄型テレビ・ＤＶＤレコーダーの販売が絶好調である。
,,○,一般レストラン（スタッフ）,単価の動き,・消費税総額表示に合わせて１円単位を全て切り捨て、実質全体で1.6％の値下げとしたにもかかわらず、客単価は前年並みで推移している。
,,○,旅行代理店（従業員）,販売量の動き,・申込件数・来店件数は前年よりも低調だが、予定販売額は２けたの増加となっている。５月は前年よりも販売額が低下していたものの、７～８月に向けての旅行の動きが回復傾向にある。
,,○,その他レジャー施設（職員）,お客様の様子,・地元プロ野球チームの応援に熱が入ってきた。品切れが多かった関連グッズの供給も安定してきため、グッズの売上も安定している。
,,□,商店街（代表者）,来客数の動き,・比較的天候が安定しており、衣料品に動きがみられる。
,,□,商店街（代表者）,お客様の様子,・季節商材の売れ行きはまずまずだが、依然として購買傾向は慎重であり、高単価商品の売れ行きは今一つの状態である。
,,□,商店街（代表者）,販売量の動き,・最近は、量販店やドラッグストアなどで安売競争に走っていることもあり、商店街地域の客の動きや買物の仕方も、どちらかというと安い商品に寄っている。正常な商売が段々やりづらくなっている。
,,□,一般小売店［酒］（経営者）,販売量の動き,・既存店の販売量が減少しており、新規店の売上の増加分は、既存店の減少でプラスマイナスゼロとなる。
,,□,スーパー（店長）,販売量の動き,・食品の売上は回復傾向にあり、来客数も戻りつつあるが、衣料品・雑貨の売上不振が依然として続いている。
,,□,スーパー（店長）,来客数の動き,・６月の前年比は客数・売上とも５月を上回っている。大型店舗の改装効果や、青果を中心とした販促強化により売上高は徐々に回復傾向へ向かっている。
,,□,スーパー（企画担当）,来客数の動き,・都市部のみの傾向であるが、好天続きの影響で行楽商材を買い求める客を中心に、来客数の回復傾向がみられる。
,,□,コンビニ（エリア担当）,販売量の動き,・前年と比べて、酒の免許自由化に伴う酒類販売店の増加による影響があるが、他の商品に関してはそれほど差が出ていない。
,,□,コンビニ（エリア担当）,来客数の動き,・商品単価が低下しており、チラシの頻度を増やしても、来客数が増加しない傾向にある。
,,□,コンビニ（エリア担当）,来客数の動き,・来客数の回復はみられるが、売上に結びつかない。客が購買行動に対して興味を持っているものの、使える金額は増えていない。
,,□,衣料品専門店（店長）,単価の動き,・客は単価の高いものよりも、単価が低くて良いものを多く買う傾向にある。
,,□,衣料品専門店（店員）,お客様の様子,・来客数は３か月前と比べて変わりないが、夏のボーナス時期ということもあり、買上率がアップしている。ただし、夏物衣料は単価はあまり高くないため、売上高としては決して良い状況ではない。
,,□,乗用車販売店（従業員）,来客数の動き,・新型車が出たが、金額が安いにもかかわらず、思うように販売数が伸びない。
,,□,乗用車販売店（従業員）,販売量の動き,・小型車は売れているが、総売上台数がそれほど変わらないため、売上高は前年より少なくなっている。
,,□,乗用車販売店（役員）,販売量の動き,・受注量・販売価格ともに前年割れの状況である。回復の兆しもみられない。
,,□,住関連専門店（経営者）,販売量の動き,・来客数も売上も前年暮れから一向に変わらない。このままでは店の存続も危ぶまれる。
,,□,住関連専門店（営業担当）,お客様の様子,・特売バーゲン品等では目玉商品のみの購入が多く、消費税総額表示で割高感を感じるためか、まとめ買いや高単価商品の購入の動きが悪い。後半の天候不順で季節商材の出足が悪く不振である。
,,□,高級レストラン（スタッフ）,来客数の動き,・週末はほぼ前年並みであるが、平日の落ち込みがひどい。客単価は変わらないものの、来客数は前年比で15％の減少となっている。
,,□,高級レストラン（スタッフ）,お客様の様子,・ランチは２～３か月続いて盛況である。ビジネスマンの来客数が増加し、客単価も少し上昇した。夜の外食を控えて、昼は豪勢にという会社員が増えてきたようだ。全体の売上は、レストランと個室の合計が、今年初めて前年並みとなった。
,,□,スナック（経営者）,来客数の動き,・３か月前と比べて観光客が少し入ってくるようになったが、それでも前年、前々年と比べると非常に悪い。
,,□,スナック（経営者）,来客数の動き,・今月は団体の大会や高校ＰＴＡの大会といった催しがあり、二次会への流れもあり、人の動きが良かった。
,,□,観光型ホテル（経営者）,来客数の動き,・来客数は前年に比べると、若干少なくなっているが、前年度が非常に良かったためであり、平年度ベースではやや良いということで、ほぼ変わらない。
,,□,旅行代理店（従業員）,販売量の動き,・４月の売れ行きが好調であったが、ゴールデンウィーク明けからがっくりと減り、６月は開店休業状態となっている。全体としては、大きく変わっておらず、地方の旅行業の景気回復には、程遠いものがある。
,,□,タクシー運転手,お客様の様子,・依然として繁華街への人出が思わしくない。
,,□,パチンコ店（店員）,お客様の様子,・短時間の遊戯が多くなってきている。話を聞くと、残業等がなくなってきていることから、収入が減少しているためという答えが多かった。
,,□,住宅販売会社（従業員）,来客数の動き,・マイホームセンターもしくはモデルハウスの来場者数が全体的に前年に比べて減っている。
,,▲,商店街（代表者）,販売量の動き,・郊外店の影響が大きく、上昇気運に乗れず、販売量に変化がない。
,,▲,スーパー（店長）,販売量の動き,・販売量が減少しており、前年比で86％となっている。
,,▲,衣料品専門店（店長）,販売量の動き,・客の動きが非常に悪く、高額品の動きが悪くなってきている。
,,▲,その他専門店［医薬品］（経営者）,来客数の動き,・前月同様に来客数が激減している。薬局、病院に行かない客が増加しているようだ。
,,▲,その他専門店［ガソリンスタンド］（経営者）,単価の動き,・原油高騰により、買い控えがみられる。
,,▲,観光型ホテル（経営者）,来客数の動き,・道外客の落ち込みが深刻である。一般団体の数量の減少、一団体当たりの人数の減少が顕著になってきている。一方、消費単価面でも、大都市圏からの利用客は利用金額が大きいが、そうでない地域からの利用客はまだまだという傾向が依然としてある。
,,▲,タクシー運転手,来客数の動き,・ＹＯＳＡＫＯＩソーラン祭りや札幌神宮祭りなどのイベントがあったことに加えて、例年よりも暑い日が多かったにもかかわらず、タクシーの利用が少なく、売上も前年より大幅にダウンしている。
,,▲,タクシー運転手,来客数の動き,・選挙の前哨戦で夜の人出がますます少なくなっている。
,,×,家電量販店（経営者）,販売量の動き,・４月ごろから連続して、販売量・販売額とも前年比よりダウンしている。
,,×,高級レストラン（スタッフ）,来客数の動き,・昼食利用は主婦層を中心に上向き傾向にあるが、夕食利用が激減している。宿泊に伴う観光客の減少が大きな要因であるほか、接待客も減少している。
"企業
動向
関連

(北海道)",,◎,通信業（営業担当）,取引先の様子,・取引先が明らかに忙しい。アポが取り難く、最近はほとんどがメールでの商談である。
,,○,家具製造業（経営者）,受注量や販売量の動き,・いわゆる一流百貨店における販売額が増加しており、個人消費が底堅くなってきた。
,,○,輸送業（支店長）,取引先の様子,・輸入品の動きは相変わらず堅調に推移している。また、建築関係、特にコンクリート製品等は、道内需要は相変わらず冷えているものの、本州の物件が道内に入り込んできて、道内企業が受注している。ただし、本州物件に絡まない業界・会社は相変わらず厳しい状況にある。
,,○,輸送業（営業担当）,取引先の様子,・国内輸送ではスポットの引き合いが頻度を増している。また、輸出貨物の紙パルプ製品が増量傾向となってきた。
,,○,その他サービス業［建設機械リース］（支店長）,取引先の様子,・企業間格差があるが、業績が上向いている取引先が増えている印象がある。
,,○,その他企業［コンベンション担当］（従業員）,受注量や販売量の動き,・高単価の商品等の販売量が増えている。
,,□,食料品製造業（経営者）,受注価格や販売価格の動き,・消費税総額表示へ変更になった４～５月の売上が低迷していたことから、取引先から、価格据置きのまま内容量を減らしたり、値下げを要求する動きが多くなってきている。一方、原材料や資材などは軒並み値上げになっており、製造メーカーの収支は悪化している。
,,□,金融業（企画担当）,それ以外,・設備資金は低調である。素材価格は高騰しているが、価格転嫁できず収益を圧迫している企業が多い。ＹＯＳＡＫＯＩソーラン祭り期間中の観光客の入込も前年を下回った。
,,□,広告代理店（従業員）,取引先の様子,・毎年恒例のものとして、出稿していた協賛広告関連が、経費削減の名目でカットされることが相次いでいる。また、地元老舗の広告代理店が、５月末に自己破産の末倒産した。
,,□,司法書士,取引先の様子,・不動産取引は依然として停滞傾向にあり、また建築着工についても停滞傾向にある。
,,□,その他非製造業［機械卸売］（従業員）,取引先の様子,・官庁物件の発注はまだ少ないが、民間の製缶・機械加工・溶接の仕事が増えてきた。ただし、鋼材値上分を加工単価で削られ、状況は厳しい。
,,▲,食料品製造業（団体役員）,取引先の様子,・加工用原材料が高騰しており、製品価格への転嫁が思うようにできない状況にある。
,,▲,金属製品製造業（統括）,受注量や販売量の動き,・住宅の需要が落ちているのか、着工が遅れているため、販売量が伸びない。
,,×,－,－,－
"雇用
関連

(北海道)",,◎,－,－,－
,,○,人材派遣会社（社員）,求人数の動き,・営業職やテレマーケティングの求人が増加している。
,,○,求人情報誌製作会社（編集者）,求人数の動き,・建設業、食品製造、業務請負、病院介護系の求人層が顕著である。全体の求人件数としては前年比７％程度の伸びであるが、大手での大量採用の求人企業も増えており、実際の求人数は前年比10％前後まで伸びていると思われる。
,,○,学校［大学］（就職担当）,求人数の動き,・大学への求人件数に加えて、会社説明会・採用試験等を行う会社が増えてきている。
,,□,求人情報誌製作会社（編集者）,それ以外,・卸売・小売・飲食・サービス業のパート・アルバイトの求人受理件数が全体の80％で雇用形態に片寄りがみられるものの、求人件数自体に大きな変化はみられない。
,,□,職業安定所（職員）,求人数の動き,・求人数は食品製造業と飲食業で増加したものの、サービス業と建設業で減少している。
,,□,職業安定所（職員）,求人数の動き,・今年は１～２月に大型ショッピングセンターの新規開店にむけた大量求人があったが、４月のオープン後、テナント等の関連求人もほぼ充足したことで、４、５月と月を追うごとに減少し、４か月連続で横ばいないし減少している。新規求人数は２か月連続で前年を下回った。
,,□,職業安定所（職員）,求人数の動き,・新規求人数は前年比で15％増加し、月間有効求人倍率も前年を0.06ポイント上回る0.40倍となったが、依然として低水準であり、新規求人の増加もパートや就業地が管外の請負求人の増加によることから、管内の雇用環境は引き続き厳しい。
,,□,職業安定所（職員）,求人数の動き,・就業場所が地元である求人で、大口採用などの雇用増の動きがあまりみられない。
,,▲,－,－,－
,,×,－,－,－
,,,,,
　２．東北（地域別調査機関：（財）東北開発研究センター）,,,,,
,,,,,（－：回答が存在しない、＊：主だった回答等が存在しない）
分野,,景気の現状判断,業種・職種,判断の理由,追加説明及び具体的状況の説明
"家計
動向
関連

(東北)",,◎,住宅販売会社（経営者）,販売量の動き,・予想通り、今年限りの住宅ローン減税効果が出始めており、上向きである。前年比100％、３か月前との比較で103％である。
,,○,一般小売店［カメラ］（店長）,お客様の様子,・旅行などの写真が多い。そのために商品を購入する客もいる。
,,○,スーパー（経営者）,販売量の動き,・消費税総額表示により４～５月と販売量、特に買上点数に悪い影響が出ていたが、今月に入り、その状況が和らぎ、ほぼ平常の買物レベルに戻りつつある。それに加え、ボーナス支給もあり明るい。
,,○,スーパー（総務担当）,販売量の動き,・買上点数も少しずつ上向きになっていて、客のマインドが良くなっている。
,,○,コンビニ（エリア担当）,来客数の動き,・前年の６月は月末にかけてたばこ増税に向けた特需があり、売上的には１日分増えた勘定であるが、今月は客数が伸び、前年並みの売上となっている。
,,○,衣料品専門店（店長）,販売量の動き,・蒸し暑さが続き、長期予報でも夏らしい天候が予想されているなか、シーズン商品の動きが活発で、売上をけん引している。
,,○,乗用車販売店（経営者）,販売量の動き,・売上及び単価は上がらないまでも、販売台数、入庫台数は伸びている。
,,○,住関連専門店（経営者）,お客様の様子,・ボーナス支給月ということもあり、家計状況が改善されているようで、また仕事も前よりはいくらか入っているという話であり、当社の売上もやや上昇に向かっている。
,,○,その他専門店［白衣・ユニフォーム］（営業担当）,販売量の動き,・夏物の売行きがけっこう良い。天候も早目に暑くなっていて事務服、作業服が例年より若干早目に動いている。しかしこれも商品の在庫が切れてしまえば、注文をもらっても納品できなくなるため、限りはあるが、去年より動きは良い。
,,○,その他飲食［そば］（経営者）,来客数の動き,・４月ごろから周辺のオフィスビルの空き室に入居者が出始め、それに伴い来客数も増えているが、単価は相変わらず低いままである。
,,○,観光型ホテル（経営者）,来客数の動き,・今月は前月同様、遠方関西からの客が多く、特に建築関係で芸者も入り、館内も多少にぎやかである。売上高においては、これまで十数年右肩下がりであったが、辛うじて横ばい状態である。今月は総会シーズンであるが、件数は前年より多い。
,,○,観光型旅館（経営者）,来客数の動き,・６、７月と堅調である。今月はサクランボツアーの影響が大きい。間際の目減りが気になったもののサクランボ様々である。また交通網の整備が好影響を与えている。
,,○,通信会社（営業担当）,お客様の様子,・前年度と比較して通信機器の購入に関する引き合いが多くなっている。
,,○,住宅販売会社（従業員）,販売量の動き,・受注量が、前年比180％となっている。
,,□,商店街（代表者）,お客様の様子,・入梅当初は雨が続いたが、その後は天候に恵まれ気温も上昇したため、夏物衣料、特に婦人服が動き出し、全体の底上げに寄与した。しかし、日用品や雑貨、家電の落ち込みが激しく、総体的には変わらない。
,,□,百貨店（売場主任）,単価の動き,・当県では、夏のボーナスが前年割れとなっている。婦人服の購買動向では単品買いが増え、セット販売が減少している。加えて客単価も低下している。
,,□,百貨店（売場主任）,単価の動き,・６月から営業時間を延長しているが、認知度がイマイチである。目的買いの客は着実に来店し、特に返礼ギフトが好調であるが、単価が低い状態である。
,,□,百貨店（企画担当）,販売量の動き,・世間一般では景気がやや上向いているというイメージがあるようだが、百貨店業とりわけうちのグループでは、景気は良くなく、売上が悪い。
,,□,百貨店（売場担当）,お客様の様子,・ボーナス支給月になっているが、ボーナスを当てにした買物が少なく、広告品も売れない。若い女性層でも、あまり無理をしないで購入している。
,,□,スーパー（店長）,単価の動き,・６月は前年と比較し日曜日が１日少ないが、客数が前期比102％と好調で、客単価前年割れをカバーし、既存店の売上は前期比101％である。これまで不振であった農産物が相場の回復で久々に前年をクリアしたのが大きい。また気温の高い日が続き、夏物商材が好調に売れたのも貢献している。
,,□,スーパー（店長）,お客様の様子,・競合激化の中、客は沢山ある店の中から自分の都合に合わせて買物をしている。客はテレビ等での節約ブームの時流にのり、節約をしている。
,,□,スーパー（店長）,販売量の動き,・ＢＳＥ問題はまだまだ影響が残り、低単価のオーストラリア産輸入牛肉も値上がりしており、消費に大きな影響を与えている。消費も相変わらず低迷した状態である。
,,□,スーパー（総務担当）,販売量の動き,・食品の平均単価は前年比マイナス1.2％で、生鮮の食肉と水産の落ち込みがマイナス５％強と大きく、生鮮全体を引き下げたが、加工食品はほぼ前年並みで推移している。スーパー全体ではマイナス1.9％だが、買上点数が既存比6.4％と増えている。このうち客数既存比も５％強増えているので、ここ数か月は同じ傾向値を示している。ただ周辺にリストラがまだ続いているという話であり、就職状況も正社員採用を減らしているとも聞こえてくる。景気状況が完全な回復基調にあるようには思えない。
,,□,スーパー（企画担当）,販売量の動き,・消費税総額表示の影響で始まった客単価の下落が今でも続いている。時間延長や客数増加のための価格強化により客数は戻りつつあるが、販売点数は10％ほど減少している。
,,□,コンビニ（店長）,単価の動き,・客は使える金が限られており、近隣に出店した100円ショップの影響もあり、商品を選ぶ時は100円を規準としている様子である。
,,□,衣料品専門店（経営者）,来客数の動き,・客の動きにさほどの変化はない。相変わらず先行き不安で需要が停滞している。夏は天候に左右されるので、今後は前年の冷夏よりは暑い夏を期待しているところ大である。
,,□,衣料品専門店（経営者）,来客数の動き,・夏物商戦のＤＭに全く反応が無い。
,,□,衣料品専門店（店長）,お客様の様子,・婦人服は、客がもう夏物のバーゲン待ちに入り、少々苦戦しているが、秋冬物の受注会等は、思いの外高額の物が売れているので、トータル的に見れば現状は変わらない。
,,□,乗用車販売店（経営者）,お客様の様子,・自動車の保有期間延長により、自社客の買換え比率が落ち込んでいる。また、数年前までであれば、新型車の発売に合わせ、夏のボーナス支給前後が買換えの大きな動きがあったが、今年は動きがない。
,,□,乗用車販売店（経営者）,来客数の動き,・輸入車の販売では、新型車を投入したディーラーは集客力がある。しかし高額車の動きが鈍く、低価格車のみが売れている状況である。
,,□,乗用車販売店（経営者）,来客数の動き,・新型車投入により、若干ではあるが集客力が強まり、相乗効果で軽自動車の動きが良くなっている。
