Ⅰ．景気の現状に対する判断理由等,,,,,
,,□,新聞販売店［広告］（総務担当）,取引先の様子,・今月のチラシ出稿量は前年比111％であるが、前年のアテネオリンピック後の落ち込みと、衆議院選挙効果を考慮すると、一前年ベースに追いついたといったところである。衣料問屋の話では、春ごろから企業のユニフォーム需要が好調で、冬物も約30％増しで、一度ユニフォームを廃止した企業で再び導入を検討しているところもあるとのことである。
,,□,その他サービス業［放送］（営業担当）,受注量や販売量の動き,・官公庁及び製造業からのタイムコマーシャルが減少傾向にある。サービス業、不動産業、流通業からのスポットコマーシャルは、件数は増えているが、売上高は横ばいである。
,,▲,食料品製造業（製造担当）,それ以外,・原料の価格が今年は３年前の約2.5倍にまで上がっており、利益分をほとんど食われている状態である。
,,▲,輸送業（営業担当）,それ以外,・配送依頼は増えているが、燃料高のために特に長距離便の本数が減っている。協力会社でも運賃の良い仕事を選んでいることから、長距離便の本数を減らしており、帰り便がつかまえにくく、厳しい状況になっている。
,,▲,不動産業（経営者）,取引先の様子,・アパート管理の修繕費を出し渋るオーナーが多い。
,,▲,広告代理店（営業担当）,取引先の様子,・利益率が悪いため、宣伝広告予算が期中で削られる傾向が目立ってきている。９月中間決算が思っていたより良くない現状がみえる。また、売掛金の未回収が前年同時期の５％増となっている。
,,×,建設業（総務担当）,受注量や販売量の動き,・公共事業100％依存企業のため、公共事業削減の影響を受け続けている。発注件数が極端に少ないために赤字でも受注してしまう企業があり、次年度設計単価への影響も心配である。
"雇用
関連

(北関東)",,◎,求人情報誌製作会社（経営者）,求人数の動き,・ここにきて、製造業、サービス業全般にわたり、求人広告の依頼が大変増えている。非常に活発に動いており、景気が良い。
,,○,人材派遣会社（営業担当）,求人数の動き,・相変わらず、製造業からの求人が非常に多い。しかも早急に派遣してほしいという話がある。
,,○,新聞社［求人広告］（担当者）,求人数の動き,・求人広告の依頼が増加傾向にある。
,,○,学校［短期大学］（就職担当）,求人数の動き,・３か月前ごろは採用活動の早期化により夏以降の求人数が極端に減少するのではないかとの見込みもあった。しかし現在、学校への直接求人は少ないものの、企業との情報交換により、まだ企業側が充足していないことや、内定辞退により採用活動の通年化が増加していることがうかがえるので、期待している。
,,□,人材派遣会社（経営者）,求職者数の動き,・求人募集は３か月前と同じくらい多く出ているが、求職者数は少ない。業種によって異なるが、周辺企業なども同じように求人を出しても求職者が少ないということである。
,,□,求人情報誌製作会社（経営者）,求人数の動き,・多少、業種により正社員の募集が増えてきているが、全体的に求人は横ばいである。派遣社員、パートの求人は多くなっている。
,,□,職業安定所（職員）,求人数の動き,"・全国展開する大手家電販売会社のエリア拡大に伴う新規出店及び既存店の欠員補充で約1,200名の求人があったが、それを除くと、新規求人は約4,800と３か月ぶりに5,000を下回っている。製造業を中心に求人の減少傾向が強い。"
,,□,職業安定所（職員）,求人数の動き,・相変わらず求人は更新によるものが多く続いている。そのなかで、建設の求人は増加傾向がみられるが、製造業では減少するなど、業種によって一進一退が続いている。
,,□,職業安定所（職員）,求職者数の動き,・求人数はわずかながら増加傾向にある。求職者数も増加しており、中でも求職者における在職者の割合は増加傾向にある。賃金や待遇など、より良い条件を求め来所する人が多いが、希望に合う求人はまだ少数である。
,,□,学校［大学］（総務担当）,求職者数の動き,・各企業で人が集まらないためか、学校に送られてくる求人票は前年より大幅に増えている。学生の内定率は前年同様、この時期で約71％となっている。
,,▲,新聞社［求人広告］（担当者）,求人数の動き,・通常９月は募集意欲が高まり、注文もくるが、今年に限っては他社をみても募集そのものがあまり出ておらず、相当冷え込んでいる。もしかしたらサイクル的に遅いスタートで、10月に盛り上がりがくるのかもしれない。
,,×,＊,＊,＊
,,,,,
　４．南関東（地域別調査機関：（財）日本経済研究所）,,,,,
,,,,,（－：回答が存在しない、＊：主だった回答等が存在しない）
分野,,景気の現状判断,業種・職種,判断の理由,追加説明及び具体的状況の説明
"家計
動向
関連

(南関東)",,◎,－,－,－
,,○,商店街（代表者）,それ以外,・クレジットカードの売上が引き続き堅調で、新規店舗の出店も活発になってきている。
,,○,一般小売店［ＣＤ］（営業担当）,単価の動き,・来客数の動きはあまりないが、客の買上金額は少しずつ増加している。
,,○,百貨店（営業担当）,来客数の動き,・９月に入って来客数が増加している。特に、物産展等の催事の波及効果が出て、全館で売上が上向いている。
,,○,百貨店（営業担当）,来客数の動き,・９月の中旬以降、来客数が増加している。特に、婦人服ではジャケットの動きが良く、トレンドがはっきりしている。
,,○,百貨店（販売促進担当）,販売量の動き,・お得意様招待会では高額品でも品質重視でよく売れている。また、店頭での平月のバーゲンを中止したため、別会場での会期限定バーゲンの集客も好調である。消費の二極化は続いているが、その両方で勢いが増している。
,,○,百貨店（販売管理担当）,販売量の動き,・９月中旬以降気温が下がり、婦人服、紳士服等の衣料品が好調で、特にフォーマル関連の催事は、需要期を前に盛況である。化粧品やアクセサリー等の婦人雑貨もよく売れている。前年より２～３％のプラスになる模様である。
,,○,百貨店（広報担当）,販売量の動き,・前半は残暑や台風に見舞われ、売上が低迷していたが、後半は気温の低下に伴い、秋冬物の動きが活発化し、前年同月を上回っている。紳士物はビジネス、カジュアル共に好調である。
,,○,スーパー（店長）,販売量の動き,・初秋物の衣料品が好調である。特に、主力の婦人服が104％、服飾雑貨が110％と動きが良く、夏物セールからの好調が続いている。
,,○,スーパー（統括）,お客様の様子,"・店舗でのパート採用等を行っていても、従来に比べて応募者が極端に少なくなっている。
・客が本当に食べたい物をよく吟味して購入する行動については変わっていないが、今までよりは消費に余裕が感じられるようになっている。"
,,○,コンビニ（経営者）,販売量の動き,・連続して大きなフェアを開催しており、前年比104％の売上を確保している。
,,○,衣料品専門店（経営者）,単価の動き,・この時期は季節柄、前半は夏物整理で単価が低いが、今年はここのところ単価の高い羽織物の動きが目立っている。
,,○,家電量販店（営業統括）,単価の動き,・デジタル家電や高機能生活家電の販売状況が好転し、高単価商品の動きが出てきたことで、販売単価が上昇している。徹底的に価格で販売する商品と、高品質、高価格の商品とに二極分化している。
,,○,乗用車販売店（店長）,販売量の動き,・特に新型車が投入されているわけではないが、販売量が前年比110％となっている。
,,○,その他専門店［眼鏡］（店員）,来客数の動き,・今月は各種催事を行ったことで全体に効果が上がっている。特に、２度の３連休とも来客数が増え、売上も５ポイント増加している。
,,○,都市型ホテル（スタッフ）,お客様の様子,"・レストランでは、料金を若干引上げた定食が売れるなど、客単価が上昇している。多少高くても、値段に見合う商品であれば売れている。また、会社の経費で利用する接待も、小口ではあるが利用件数が増加している。
・宿泊は、ネット経由の低料金のものから埋まる傾向は変らないが、周辺に新規ホテルがオープンしても客室の利用率が下がらないのは、ビジネスマンの動きが活発になってきているからである。"
,,○,都市型ホテル（スタッフ）,お客様の様子,・忘年会、新年会の引き合いが、前年比110％で伸びている。
,,○,旅行代理店（従業員）,販売量の動き,・秋の行楽シーズンの問い合わせが増加しており、前年以上に間際での予約も多くなってきている。
,,○,通信会社（営業担当）,販売量の動き,・放送サービス、インターネット共に加入状況が改善しつつある。
,,○,その他レジャー施設［アミューズメント］（職員）,それ以外,・９月に家庭用、業務用のゲームショウが相次いで開催され、前年を上回る入場者数で好評を博した。家庭用は新ハードのお披露目、業務用は今までの景品取得機器からカードゲーム機への移行がメインである。
,,○,設計事務所（所長）,お客様の様子,・仕事量は出てきてはいるが、決定までには相変わらず時間がかかっている。
,,○,住宅販売会社（従業員）,販売量の動き,・９月は半期決算のため、値引き販売やキャンペーン展開を行い、３か月前よりは販売量が増加している。
,,□,商店街（代表者）,来客数の動き,・来客数はさほど変わらないが、客が入店してから購買するまでの時間が長く、買上比率も若干低下している。
,,□,一般小売店［家電］（経営者）,販売量の動き,・物販はあまり伸びないが、リフォームや工事関係の仕事がきているため、全体としては変わらない。
,,□,一般小売店［衣料・雑貨］（経営者）,お客様の様子,・夏の暑さと後半の天候不順で、秋の商品の動きが良くないが、カットソーやブラウスは売れているなど、商品ごとのばらつきがみられる。
,,□,一般小売店［茶］（営業担当）,単価の動き,・景気回復の兆しはあるが、注文数が回復しても、単価競争により値引き率が大きくなっているため、全体の売上は変わらない。
,,□,一般小売店［鞄・袋物］（従業員）,お客様の様子,・秋物商戦に入ったが、具体的なイベント需要がないために、客の買い控えが目立っている。スポーツ商品は非常によく動くが、エレガンス商品の動きが悪く、特に女性客の消費は厳しい状況である。
,,□,百貨店（総務担当）,販売量の動き,・売上は、全体では前年並みである。１階から３階の低層階では比較的好調だが、上層階になるにつれ悪くなっており、特に飲食関係が伸び悩んでいる。
,,□,スーパー（店長）,単価の動き,・単価がなかなか上昇しない。鮮魚が不振である。
,,□,スーパー（店長）,お客様の様子,・客が商品や価格によって買い分けをしている。競合店の買物袋を持って当店で買物する姿も見られる。
,,□,スーパー（店長）,来客数の動き,・５月に大型店が開店して以来、売上も来客数も減少する一方である。９月中旬までには来客数は少し戻ってきたが、まだ92％程度で、前年比100%には届いていない。
,,□,スーパー（統括）,来客数の動き,・広告等を入れたときは集客があるが、それ以外は来客数の動きに変化がなく、買上金額が上がる状況にはない。
,,□,コンビニ（経営者）,販売量の動き,・売上、来客数共に下げ止まっているが、売上は前年比90％台後半で、安心できる状態ではない。
,,□,コンビニ（店長）,販売量の動き,・連休の多い月であり、またハイウェイカードが月半ばより販売中止になったにもかかわらず、駆け込み需要を含め販売量は減少している。ただし食品については、４％増加している。
,,□,衣料品専門店（経営者）,お客様の様子,・９月は、20日ごろまで非常に厳しい状態だったが、気温が25度を割った頃から、婦人物が急に動き始め、結果としては前年を上回っている。婦人物の動きが特に活発である。
,,□,衣料品専門店（経営者）,お客様の様子,・天候に大きく左右され、初秋物が売れ残っている。この３か月、苦戦している状況が変わっていない。
,,□,家電量販店（経営者）,販売量の動き,・売上が好調な分野と不振な分野が明確に分かれてきている。ＡＶ、生活家電は安定して好調を維持しているが、カメラ、ＰＣ関連は厳しい。ただし、ＡＶの価格競争は激化しており、全体の粗利を大きく圧迫している。
,,□,乗用車販売店（経営者）,販売量の動き,・自動車の整備は順調に入ってきているが、販売は悪かった前年と同様で、売上が20％程度減少している。
,,□,乗用車販売店（渉外担当）,販売量の動き,・９月の新車販売は、予算達成率92.6％、対前年伸張率マイナス5.8％で、２か月連続前年同月を下回っている。ただし、新たに立ち上げた高級ブランド車の売行きは順調であり、既存車とのギャップがある。中古車は予算達成率88.5％だが、対前年伸張率は12.1％と２か月連続前年同月を上回っている。
,,□,その他専門店［燃料］（売場主任）,販売量の動き,・８、９月と売値を変えずに販売しているが、ガソリンの仕入れ価格は２円20銭ほど上がっており、さらに１円の値上げがきているので、10月から販売価格を３円程度値上げをする予定である。20銭は当社負担になるが、競争が激しく、なかなか販売価格に転嫁できないので、次第に経営が苦しくなっている。売値の上昇で、客もガソリン数量や単価を指定するようになっており、ガソリン以外の商品も買い控えている様子である。
,,□,一般レストラン（経営者）,来客数の動き,・団体の宴会が減少している。客の来店頻度も減少しており、来客数も増加しない。
,,□,一般レストラン（経営者）,来客数の動き,・来客数は少しずつ減少している。ケータリングは増えているが、来客数が減っているので、売上はあまり変わらない。
,,□,一般レストラン（店長）,単価の動き,・客は最初の一杯はビールを飲むが、２杯目からは安い焼酎を注文するため、単価が上がらない。
,,□,スナック（経営者）,来客数の動き,・今までは部下や友人を連れてくる客が結構いたが、最近は一人で来るケースが目立っている。
,,□,旅行代理店（従業員）,お客様の様子,・９月は国内団体旅行の動きが鈍く、前年比でも90％程度である。国内の個人旅行は愛知万博で大変盛り上がっているが、団体及び海外の状況は良くない。
,,□,タクシー運転手,来客数の動き,・街を歩く人、駅から帰宅する人はほとんど最終バスを利用し、タクシーを利用する人は少ない。
,,□,タクシー（団体役員）,来客数の動き,・相変わらず駅待ちの時間が長く、流し営業が難しい状況である。
,,□,通信会社（営業担当）,お客様の様子,・当社事業の営業に関しては、デジタル化のサービス一巡後は厳しい環境が継続しており、良くなっていない。
,,□,ゴルフ練習場（従業員）,競争相手の様子,・来客数、売上は横ばいかやや減少気味である。競合施設の値引きがかなりあり、思うような集客ができない。ただし、客からは景気の良い話が聞かれる。
,,□,設計事務所（所長）,それ以外,・新規物件の話や計画はあるが、なかなか進まず、これまでの継続案件によって変わらない状況を保っている。
,,□,住宅販売会社（経営者）,販売量の動き,・工事の請負あるいは住宅分譲については、価格が下がっているにもかかわらず、販売量が極端に少なくなっており、同業他社の中小企業も同様の状態である。大企業については良くなってきている。
,,□,住宅販売会社（経営者）,販売量の動き,・分譲住宅は建てないと売れず、完成してもすぐには売れない。最近では、青田での売買はほとんどない。地価がまだ下がると思っている客が多く、様子見をしている。
,,▲,百貨店（業務担当）,販売量の動き,・８月までの店頭売上は前年比同水準だったが、９月に入り選挙、天候、残暑、原油の高騰等、様々な事情からか、婦人服を中心に衣料品の売上が悪く、秋物も売れていない。
,,▲,スーパー（店長）,来客数の動き,・９月も競合店オープンに伴う影響で、来客数が前年比で１日300人ほど減少している。買上点数は伸びているが、来客数の減少と単価の低下による売上の減少の影響が大きい。
,,▲,スーパー（総務担当）,販売量の動き,・３か月前と比較して、青果が相場安となっており、精肉、鮮魚も販売量は増えていない。敬老の日の行事も行政の補助が少なくなり、大口の弁当等の注文が減少している。
,,▲,衣料品専門店（営業担当）,販売量の動き,・５か月連続で前年を上回っているが、９月後半からは売上が悪くなってきている。ミセスの場合は、家族も休みの連休は買物等を控えてしまうので、売上に響いている。前年の９月の売上が悪すぎたこともあり、手放しでは喜べない状態である。
,,▲,乗用車販売店（販売担当）,単価の動き,・販売価格の値上げ交渉をしても、客先の運賃が全く上がっていないため、一切、認められない。軽油価格上昇で、客の運賃粗利は減少しており、新型車種でも値上げは認められていない。
,,▲,乗用車販売店（営業担当）,来客数の動き,・新型車が発売になっても、土日の来店が少ない。
,,▲,住関連専門店（統括）,販売量の動き,・来客数の割に販売量が少なく、売上の伸び悩みが解消されない。
,,▲,その他専門店［ドラッグストア］（経営者）,競争相手の様子,・１か月前に競合店がオープンしたため、同じエリア内で客の取り合いになっている。他店との差別化を進めようとしているが、同じような店舗が増え、商品の８割がほぼ同じであるため、なかなか差別化できない。
,,▲,高級レストラン（支配人）,単価の動き,・９月の客単価は３か月前より低く、客の注文が１ランク安い料理に移ってきている。
,,▲,一般レストラン（経営者）,来客数の動き,・９月は中旬以降も客足が伸びなかった。
,,▲,旅行代理店（従業員）,販売量の動き,・９月の受注は、前年比90％程度に落ち着いてしまっている。
,,▲,タクシー運転手,お客様の様子,・乗車する客は少ないが競争相手は多く、３か月前と比較すると悪くなっている。
,,▲,その他レジャー施設（経営者）,来客数の動き,・９月は給料日前後に連休が続き、客が来ない。
,,▲,その他レジャー施設（経営企画担当）,来客数の動き,・これまでは人気が高く、チケットの入手が困難だったスポーツイベントに空席が目立つ状況が続いている。
,,▲,設計事務所（営業担当）,競争相手の様子,・当社が取れるはずの仕事が、競争会社にいってしまっている。
,,×,一般小売店［茶］（営業担当）,来客数の動き,・９月は客単価が９％低下、来客数も８％減である。８月下旬から９月にかけて、客の動向が急に悪くなっている。
,,×,その他専門店［キャラクターグッズ］（従業員）,来客数の動き,・３連休が連続してあったにもかかわらず、その恩恵をほとんど受けていない。年々、連休の集客増を期待できなくなってきている。
,,×,タクシー運転手,来客数の動き,・最近では、雨の日や電車事故等があった時以外は、乗り場に客が並ぶことはほとんどない。毎日、一日のノルマを達成するのに大変苦労している。
,,×,設計事務所（経営者）,競争相手の様子,・同業者から、全く仕事がないという声をよく聞く。当社にも仕事がない。
,,×,住宅販売会社（従業員）,販売量の動き,・３か月前と比較し、販売量は３分の１程度にまで落ちている。
"企業
動向
関連

(南関東)",,◎,電気機械器具製造業（経営者）,受注量や販売量の動き,・まとまった相談があり、売上は６月比150％と良くなっている。
,,○,出版・印刷・同関連産業（経営者）,受注量や販売量の動き,・通常の仕事はあまり振るわなかったが、入札関係、スポット物の仕事が重なり、今年一番の忙しさである。
,,○,出版・印刷・同関連産業（営業担当）,受注量や販売量の動き,・問屋、メーカーへの支払額の合計が６月は26万５千円だったのが、９月は30万８千円となっている。新会社設立の印鑑受注も10本ある。
,,○,一般機械器具製造業（経営者）,受注量や販売量の動き,・悪くなっているものもあるが、価格が比較的良い仕事が立ち上がったので、会社全体では良くなっている。
,,○,電気機械器具製造業（経営者）,受注量や販売量の動き,・見積成約が平均して10％程度上昇している。荷動きも若干活発になってきている。
,,○,電気機械器具製造業（経営者）,受注量や販売量の動き,・以前は努力しても売上が上がらなかったが、この１～２か月は受注が比較的順調に推移している。
,,○,金融業（渉外担当）,それ以外,・都心を中心に地価が上昇に転じている。不動産売買価格も路線価を大幅に上回る価格が一般的になっている。
,,○,金融業（審査担当）,取引先の様子,・輸送用機器関連の業種は受注が好調で、売上は２割程度増加している。
,,○,不動産業（総務担当）,取引先の様子,・ここにきて業績好調のテナントからオフィススペースの拡張要望が出ている。
,,○,経営コンサルタント,取引先の様子,・この数か月間、前年同月比で売上高が増加している取引先が多い。
,,○,その他サービス業［情報サービス］（従業員）,受注量や販売量の動き,・上半期は、予定を上回る受注を獲得できたが、１件当たりの利益が低く、仕事量の割には収益は上がっていない。
,,□,食料品製造業（関連会社担当）,受注量や販売量の動き,・この２、３か月の販売量は、前年同月比で同水準で推移している。大きな変化はない。
,,□,プラスチック製品製造業（経営者）,受注量や販売量の動き,・受注量は多いが、売上の増加には結び付かない。
