Ⅰ．景気の現状に対する判断理由等,,,,,
,,,,,
　景気の現状に対する判断の理由及びそれに対する追加説明等について、その主だったもの及び特徴的と考えられるものを取りまとめると以下のとおりであった。,,,,,
,,,,,
,,,,,
　１．北海道（地域別調査機関：（株）北海道二十一世紀総合研究所）,,,,,
,,,,,（－：回答が存在しない、＊：主だった回答等が存在しない）
分野,,景気の現状判断,業種・職種,判断の理由,追加説明及び具体的状況の説明
"家計
動向
関連

(北海道)",,◎,その他専門店［造花］（店長）,販売量の動き,・クリスマス商品や正月商品を扱っているが、例年にないほど動きが良い。秋物商材についても同様である。また、最近始めた新商品についても動きが良く、好調である。
,,◎,観光型ホテル（経営者）,来客数の動き,・愛知万博や知床ブームの影響からか、ここ数か月間、来客数は前年比での減少が続いていたが、ここ最近は客室の予約状況が上向いている。
,,○,商店街（代表者）,単価の動き,・９月に入り、寒暖の差が激しくなっているが、冬物コートなどの高額な商品のトレンドが見えてきたことから、そうした商品の動き出しが早く、単価的には上昇してきている。
,,○,一般小売店［酒］（経営者）,販売量の動き,・今月は天候の良い状態が続いているため客の出が良く、また新規の取引先が何軒か増えたこともあり、販売量は良い状態で推移した。
,,○,一般小売店［土産］（店員）,来客数の動き,・北海道への観光客に関しては、前年かなり落とした面もあるが、今年は増えてきていると感じる。団体客は依然として落ち込んでいるが、個人での小旅行に加えて、愛知万博の影響への反動もあり、北海道観光には明るい兆しが出ている。
,,○,スーパー（店長）,来客数の動き,・北海道における既存店全体の売上は前年比97％と、全国平均値の100％からは３％の遅れとなっているが、衣料品、住居用品、食品の３部門で前年比が８月から改善している。９月前半は例年にないほど気温が上昇したことで、衣料品、住居用品が苦戦を強いられたものの、後半の大型プロモーションが成功したことで上昇した。客数についても前年比97％と、前月からは２％の増加となった。
,,○,衣料品専門店（店員）,単価の動き,・主婦層の買上金額、単価が高くなってきている。
,,○,家電量販店（地区統括部長）,販売量の動き,・プラズマテレビや薄型テレビなどのデジタルＡＶ機器商品の販売量が、前年比200％以上で推移している。
,,○,乗用車販売店（営業担当）,来客数の動き,・前年と比較して来店者が増えてきている。
,,○,観光型ホテル（経営者）,販売量の動き,・北海道観光に知床や旭山動物園の効果が現れているためか、宿泊人数は前年より落ち込みが少ない。消費単価についても前年並みは確保できていないものの、回復しつつある。道内客、道外客ともに減少率が鈍化してきているというのが、正直な見方である。
,,○,観光型ホテル（スタッフ）,販売量の動き,・９月は連休の日並びが良かったこともあり、宿泊人数は前年比を７％程度上回っている。
,,○,旅行代理店（従業員）,販売量の動き,・来店による旅行申込が増加しており、宿泊の申込も前年比で130％以上と好調に動いている。海外旅行についても新婚旅行客の増加と好調なヨーロッパ旅行客の申込増加によって先行受注の状況が良くなってきた。
,,○,旅行代理店（従業員）,来客数の動き,・来客数が前年から２割アップしている。ただし客の買上単価は前年より１割減少している。
,,○,観光名所（役員）,販売量の動き,・ロープウェイの輸送人員は、８月までの前年比マイナスからプラスに転じつつある。
,,○,美容室（経営者）,お客様の様子,・客の来店周期が若干ではあるが短くなってきており、商品の動きも良くなってきた。
,,○,設計事務所（所長）,お客様の様子,・来年の物件が動き出し始め、問い合わせが多くなってきた。近年まれに見る出足の良さだ。
,,□,商店街（代表者）,販売量の動き,・衣料品関係の店では、８月以降ずっと気温が高かったことから、秋物が全く動かず前年を下回っている状態であるものの、総体的な見方では大きな変化はみられない。
,,□,商店街（代表者）,来客数の動き,・平日に訪れる固定客に変化はないが、休日は客が大型店に流出していることから落ち込みが大きく、新規客の増加が期待できない状況が続いている。
,,□,商店街（代表者）,お客様の様子,・長い残暑も終わり、秋物シーズンに入り、少しずつ季節商材が売れ出してきている。
,,□,百貨店（売場主任）,お客様の様子,・前月はやや持ち直しを感じたが、今月は選挙の影響や気温の高止まりなどで、中旬までは静かな動きであった。下旬に入り、本来のざわつき感も出てきて持ち直してきたが、はっきりと言い切れるほどではない。衣料品以外は集客が落ち込み、買上単価も下がっている。
,,□,百貨店（売場主任）,単価の動き,・セーターやカットソー等の単価の低い商品が中心の販売状況となっていて、スーツ等の重衣料に関しては、必要なもの以外は買わない傾向にある。
,,□,百貨店（役員）,来客数の動き,・比較的気温が高めに推移したため、季節商材の動きが鈍く、来客数も前年比96％と奮わず、客単価も前年を割り込んでいる。
,,□,コンビニ（エリア担当）,単価の動き,・前年は台風災害の復興工事等があり、現場労働者による需要があったため、前年比でみると前年を下回る結果となっているが、それ以上に客の買上点数が減少しており、買い控え傾向がみられる。
,,□,コンビニ（店長）,単価の動き,・来客数が若干増加しているので、本来であればやや良いと答えたいが、客単価の下落が激しく、最終的な売上は変わらない状況である。客は安売りしている商品に目が行くようであり、そういった商品は動きが良い。
,,□,衣料品専門店（店長）,単価の動き,・３か月前と比べて単価の推移が横ばいで変わらない。販売量についても変わらず、売上も横ばいである。
,,□,家電量販店（経営者）,お客様の様子,・商品の販売量の下落とともに、商品単価も下がっている。客の買い控え傾向も強い。
,,□,家電量販店（店員）,お客様の様子,・客数が少し減っている。また気温が高く、ストーブ等の暖房器具の売行きが伸びてこない。
,,□,乗用車販売店（従業員）,販売量の動き,・全体としては大きな変化はみられない。ただし単価の安い商品については、今まで前年並みに売れていたが、今月は大変厳しく、あまり売れていない。
,,□,高級レストラン（スタッフ）,販売量の動き,・前月に引き続き、客数、単価とも前年比でマイナスとなった。中旬以降の２回の３連休はまずまずであったが、平日は相変わらず厳しい。売上の前年比は10％以上のマイナスとなった。
,,□,高級レストラン（スタッフ）,販売量の動き,・ランチの売上は前年比で２割減少した。道内企業の景気落ち込みや２回の連休などが影響したのか、ビジネスマンの利用が激減した。夕食は前年を超えたが、予約のディナー客によるところが大きく、飲物中心のフリー客は減少した。全体としては大きく変わらないが、じわじわと下がってきている。
,,□,タクシー運転手,来客数の動き,・９月は良い天候の日が多く、また週末の連休も２回あったものの、前年と比べると、タクシーの利用は大きなマイナスとなった。
,,□,住宅販売会社（従業員）,来客数の動き,・モデルハウス等の来場者が少ない状態が続いている。
,,□,住宅販売会社（従業員）,販売量の動き,・販売量の低迷もさることながら、単価が低下している状況が相変わらず続いている。かなり価格破壊が進んでいる状態にある。
,,▲,百貨店（売場主任）,販売量の動き,・９月は残暑が続き、20日ごろまではほとんど秋物の動きがなく、厳しかった。特にジャケット、セーター、カットソー等の商品が動かなかった。下旬に入り、秋物の動きが非常に良くなったが、去年には及ばない状況である。
,,▲,スーパー（店長）,お客様の様子,・月初めに大きなキャンペーンを実施したが、客の購買意欲がなかなかみられなかった。客数は前月から若干回復傾向にあるが、依然として単価ダウンと無駄な物は買わないという買い控えが続いており、これらの傾向は変わらない状況にある。
,,▲,コンビニ（エリア担当）,単価の動き,・買物の傾向として、本当に必要なものしか買わなくなっており、その周辺の商品に客の手が届かなくなっている。
,,▲,衣料品専門店（店長）,来客数の動き,・展示会をよく行うが、今年は人出が非常に悪く、来客数が悪い状況である。
,,▲,乗用車販売店（従業員）,販売量の動き,・例年９月は販売台数が多くなるが、今年は良くない。他の販売店についても同様であり、消費の拡大には至っていない。
,,▲,住関連専門店（経営者）,お客様の様子,・商店街の通行量も依然として悪いようで、撤退する店舗が後を絶たない。入れ替わりにオープンする店の多くが、商店街としてはふさわしくないカラオケ店やパチンコ店である。
,,▲,その他専門店［ガソリンスタンド］（経営者）,競争相手の様子,・石油製品の高騰による客の買い控えがあり、販売量が減少しているため、競合による採算を度外視した価格競争が起きている。
,,▲,タクシー運転手,来客数の動き,・各観光施設の来客数がかなり減っている。
,,×,スナック（経営者）,来客数の動き,・観光客と地元リピーターを対象にして商売しているが、これほど８月に比べて９月が落ち込むとは想像していなかった。前月の時点では少しずつ良くなっていくかと思ったが、今月はまだ前年比が落ち込んでいる状態であり、不景気を実感している。
"企業
動向
関連

(北海道)",,◎,－,－,－
,,○,家具製造業（経営者）,受注量や販売量の動き,・質の高い請負物件の需要に底堅いものがある。
,,○,通信業（営業担当）,取引先の様子,・以前より残業、休日出勤等が増えたとのことを聞いており、稼働率の上昇がうかがえる。
,,□,食料品製造業（団体役員）,それ以外,・原油価格の高騰は製造コストの上昇を招いており、中小企業の経営においては厳しい状況となっている。
,,□,金融業（企画担当）,それ以外,・設備資金はやや増加しているが、一般企業向けは低迷している。個人消費は夏物商戦が堅調だったが、低価格志向もあり、総じて弱い。大型スーパーの進出で既存の小売店が押されているという事情もある。住宅着工の伸び悩みや公共投資の削減など、建設業界も厳しい。
,,▲,輸送業（支店長）,受注価格や販売価格の動き,・ガソリンや重油等の燃料費のアップによるコスト増はトラック、フェリー、内向海運のコスト増加となって現れているが、道内の場合運賃価格あるいは単価に反映されにくく、経営悪化に直結している。
,,▲,輸送業（営業担当）,取引先の様子,・原油高による船会社の運賃値上げや、米国のハリケーン被害に伴う穀物輸送船のスケジユールの遅れなど悪条件が重なっている。
,,▲,その他非製造業［機械卸売］（従業員）,受注量や販売量の動き,・７月をピークに下降傾向が強く出ており、受注見通しと実績のかい離が８月、９月と大きく出てきている。予想以上に消耗資材の出荷が減少している。
,,▲,その他企業［コンベンション担当］（従業員）,受注量や販売量の動き,・衆議院選挙による影響もあるのか、宴会部門の受注が前年比で10％のマイナスとなった。宿泊部門は海外からの観光客が前年比で15％増と好調であるものの、国内からの観光客は愛知万博の影響か前年比で10％のマイナスとなった。
,,×,＊,＊,＊
"雇用
関連

(北海道)",,◎,－,－,－
,,○,人材派遣会社（社員）,求人数の動き,・正社員の求人数が緩やかに増加しているほか、派遣オーダーも増加傾向にあり、企業が一時の悲壮感から脱し、攻めに転じてきているように思う。派遣のオーダーの内容に関しても、事務系派遣に加えて、イベント要員、販売業務の派遣など、売上に直結する人材を求めており、企業に活力が戻りつつある。
,,○,求人情報誌製作会社（編集者）,求人数の動き,・小売業、スナックを除いた飲食業など、主要な業種の求人数は概ね前年比でプラスに転じた。一方で、今年前半まで好調だった建設業、建設関連業の求人数は前年比で２割ほどマイナスとなっている。
,,○,求人情報誌製作会社（編集者）,求人数の動き,・接客サービス業界に伸びがみられるとともに、スナック等もやや回復傾向にある。
,,○,職業安定所（職員）,求人数の動き,・新規求人数が前年比で13か月連続で増加している。同時に、派遣や請負以外の直接雇用型の求人も多少増加してきている。
,,○,学校［大学］（就職担当）,採用者数の動き,・学生の採用内定率が前年度より良く、多くの学生が希望する企業から内定を獲得している。
,,□,求人情報誌製作会社（編集者）,求人数の動き,・求人広告受理件数にあまり大きな変化はみられない。広告費全体でみれば、その約３割がリピーターによるものである。
,,□,新聞社［求人広告］（担当者）,それ以外,・地方の土建業等で倒産が相次ぎ、過疎化が顕著になっている。帯広市内のスーパーの売上も前年比でマイナスになっており、当地域の景況感は一段と落ち込んでいる。
,,□,職業安定所（職員）,求人数の動き,・新規求人数は前年比で18.7％と前月に引き続き増加となった。産業別にみると、建設業、製造業、卸小売業、飲食店、宿泊業が増加しており、運輸業、サービス業が減少している。４～８月までの累計では前年比で16.2％の増加となった。
,,▲,職業安定所（職員）,求職者数の動き,・新規求人数は前年比で８か月連続で増加したものの、新規求職者が前年比で３か月ぶりに増加した。特に常用雇用希望者で事業主都合離職者が増加している。
,,×,－,－,－
,,,,,
　２．東北（地域別調査機関：（財）東北開発研究センター）,,,,,
,,,,,（－：回答が存在しない、＊：主だった回答等が存在しない）
分野,,景気の現状判断,業種・職種,判断の理由,追加説明及び具体的状況の説明
"家計
動向
関連

(東北)",,◎,＊,＊,＊
,,○,商店街（代表者）,競争相手の様子,・目的買いが増加している。以前のような見るだけの客が少なくなり、「この商品はありますか」「この商品をください」というような即決買いが増加している。これまで低下傾向が続いた購入単価がここ３か月で少しずつ上昇している。手ごたえありの声がライバル業者からも出始めている。
,,○,一般小売店［カメラ］（店長）,お客様の様子,・愛知万博、海外旅行、行楽など出かける機会が多い。来客数を含め、写真のショット数は増えている。
,,○,百貨店（売場担当）,お客様の様子,・先週あたりから、ジャケットやウールのコート等をまとめて買う客が増えている。感度の良い客ほど即決で買う傾向がみられ、売上も前年を上回っている。
,,○,スーパー（経営者）,販売量の動き,・９月～10月は、当地域は芋煮会の需要があって、値上がりしている肉類が非常に好調に動いている。
,,○,スーパー（店長）,来客数の動き,・８月の盆商戦以降９月に入り徐々に来客数が増加し、105％の伸びとなっている。売上についても前期上乗せで推移している。
,,○,乗用車販売店（経営者）,来客数の動き,・月半ばから、新規の来客数が徐々に増えている。また、成約率もやや向上している。
,,○,住関連専門店（経営者）,販売量の動き,・来客数が若干増えている。客単価はさほど変化はないが、買上率が上がっている。
,,○,観光型ホテル（経営者）,来客数の動き,・端境期であり、万博、選挙があったにもかかわらず、来客数、売上が前年比５％増であった。団体客が戻りつつあり、館内の消費も多少明るくなってきている。
,,○,都市型ホテル（経営者）,販売量の動き,・９月は定期異動のシーズンであるが、今月は前年よりも定期異動に伴う歓送迎会が増えている。ゴルフコンペ等の打ち上げ会も増えている。
,,□,商店街（代表者）,お客様の様子,・夏から秋の端境期を迎え、台風が過ぎた後、秋めいた日が続き、婦人服を中心に衣料品や化粧品が前年を上回る売上となっているが、全体的には前年比２％程度の売上減となっている。
,,□,百貨店（売場主任）,お客様の様子,・前半は衆議院選挙の影響で来客数が非常に少なかった。中旬は集客力のある食品催事等があったので来客数は増えたが、売場へのシャワー効果はほとんどなかった。20日以降、ヤング、キャリア層を中心に秋のトレンドのジャケット等秋物のまとめ買いが多かった。ただ、ミセス層はその時節に合ったもので、すぐ着れるものを求める傾向が非常に強く、大苦戦した。
,,□,百貨店（販促担当）,お客様の様子,・来客数に比例して売上動向が変わるアイテムである食品、デイリー商品、婦人の服飾雑貨等は苦戦した。逆に、客との関係作りができている婦人のプレタポルテや特選ラグジュアリー関係は好調であった。
,,□,百貨店（経営者）,来客数の動き,・前半は、残暑、選挙等の影響で特に来客数、買上客数が悪かった。
,,□,スーパー（経営者）,販売量の動き,・一般的には、踊り場を脱したとか各企業の業績も向上していると言われているが、最終消費、特に食料品の状況については決して好転していない。堅実な消費傾向については依然変わらず、１品単価の下落も続いている。全体的な景気の上向き加減と実際の食料品を含めた消費の実態は若干状況が違っている。
,,□,スーパー（店長）,お客様の様子,・食品関係は毎日食するものであり、大きく変化はないが、石油の高騰が少しずつ各分野に影響を及ぼしており、商品価格が上がる要因となっている。
,,□,スーパー（企画担当）,販売量の動き,・来客数は依然として横ばいであるが、販売点数は減少傾向である。新製品に大きなヒット商品もなく、秋の季節商材の動向も現状は不調である。
,,□,コンビニ（エリア担当）,来客数の動き,・来客数の前年比は回復傾向にあるが、依然として前年を割っており、回復の要因も好天に恵まれたことによる。
,,□,衣料品専門店（経営者）,来客数の動き,・新卒求人数は、前年よりは増加はしているが、職種によりかなりばらつきがあり、全体的には厳しい。
,,□,衣料品専門店（店長）,販売量の動き,・秋物の本番を迎え、少しずつ動きも良くなってきているが、来客数も売上もなかなか伸び悩んでいる。
,,□,乗用車販売店（経営者）,販売量の動き,・春の新型車によって何とか販売台数を維持しているが、昨今のガソリン価格の値上がりで、燃費の良いコンパクト車、ハイブリット車に受注販売が集中している。
,,□,乗用車販売店（経営者）,来客数の動き,・販売台数､販売単価とも前年比増加しているものの最近、客数が伸びない。数多く出た新型車効果が長続きせず、上昇するような勢いはない。
,,□,乗用車販売店（経営者）,お客様の様子,・土木関連の客の話では、市内の作業発注が少なく､新潟県中越地震関連の作業を毎日早出でこなしているが利益率が低く､収益的にもかなり厳しい受注内容のようである。
,,□,乗用車販売店（従業員）,お客様の様子,・新型車両が発売されたので、来場者数が増えた。
,,□,住関連専門店（経営者）,来客数の動き,・仏壇の販売は、９月に入っても不調で、期待していた彼岸商戦でも来客数は少なかった。
,,□,その他専門店［靴］（経営者）,販売量の動き,・残暑が続き、夏物の消費が順調である反面、秋物商材の動き出しが例年より遅い。
,,□,その他専門店［パソコン］（経営者）,単価の動き,・市場が単価を下げているという現状もあるが、客自体も単価の低いものを選択している。
,,□,その他専門店［酒］（営業担当）,販売量の動き,・あまり期待していなかったが、選挙後に多少の持ち直しがあった。全体では横ばい傾向である。
,,□,その他専門店［ガソリンスタンド］（営業担当）,お客様の様子,・ガソリンを始めとする燃料の販売が前年割れを起こしており、客の購買状況もガソリンに関して、数量の10リットル、20リットルの指定買いや1000円分等の金額指定等の販売が増えている。燃料以外の洗車やタイヤ等の販売も振るわない。掛け売り客の支払についても、支払遅延や、内金支払が増加している。以上の様子から、燃料価格の高止まりから買い控えが進んでいることがうかがえる。
,,□,高級レストラン（支配人）,来客数の動き,・宿泊はインターネット予約が好調で、来客数、客単価とも前年を大幅に上回った。レストランについては、和食が好調で中華が苦戦し、洋食が横ばいであった。宴会は婚礼の受注減少で、ホテル全体では減収であった。
,,□,都市型ホテル（経営者）,販売量の動き,・貴金属の販売展示、携帯電話会社の会合等一般会社のセミナー及び自社向けのセミナーは少し増えているが、婚礼が依然として減少傾向にあり、全体的な売上増にはなっていない。
,,□,観光名所（職員）,来客数の動き,・９月は３連休が２回あり期待したが、後半の３連休は天候に恵まれず、苦戦した。来客数は前年を若干上回ったが、売上は伸び悩んでいる。
,,□,遊園地（経営者）,来客数の動き,・９月は例年天候が不安定であるが、今年の土日祝日の半分は天候に恵まれず、プロ野球新球団の最後の盛り上がりの影響もあり、前年を数％下回る見込みである。
