Ⅰ．景気の現状に対する判断理由等,,,,,
,,□,タクシー運転手,お客様の様子,・４月の前半は少し動きがあったが、中旬に入っては例年のように動きが悪くなった。
,,□,通信会社（経営者）,お客様の様子,・加入契約数がここ数か月の実績から低下したままであり、かつ解約も増加しており、純増加数が低迷したままで、さらに減少も見られる。
,,□,通信会社（販売企画担当）,販売量の動き,・販売数は横ばいである。来店者数は減少の傾向にある。
,,□,テーマパーク（財務担当）,来客数の動き,・入園者数に関しては、前年比でも少し落ち込んでいるが、消費単価に関しては、ほぼ前年並みに推移している。
,,□,ゴルフ場（営業担当）,来客数の動き,・割引券等によって単価も少し下げてみたが、あまり効果は上がらなかった。かなりまだ厳しい状態である。
,,□,美容室（経営者）,競争相手の様子,・同業者の競争相手の情報を聞いても、年々店舗も増えてきて、客数もだんだん減ってきて最近あまり良くない。
,,□,設計事務所（経営者）,販売量の動き,・建築業界はあいも変わらず低迷しつつある。絶対販売量、物件数も少なく低額なものが多いなかでしのぎを削っている状態で、これが上向く方向性はなかなか見受けられない。
,,□,住宅販売会社（従業員）,来客数の動き,・来場数が、今年に入り毎月0.5％ずつ減少傾向がつづいており、悪くなっているのは変わっていない。
,,▲,商店街（代表者）,お客様の様子,・松江市の場合中心市街地おしなべて悪いが、なかでも今年に入ってからは特にいいという声を全然聞かない。
,,▲,商店街（代表者）,来客数の動き,・近くに大規模店ができたせいか、とにかく商店街に人がこない。
,,▲,一般小売店［茶］（経営者）,販売量の動き,・商工会所の会議に出てきたが、全体的に非常に景気が良くない。どこも物が動かなくて大変だといわれている。わが社も去年と比べると前年比を割り始めているので不安である。
,,▲,百貨店（売場担当）,販売量の動き,・店全体の売上が前年比の82％との話もある。ものの売上が悪く去年、一前年が75％になったにもかかわらず今年については82％という形でだんだんと落ちている状況である。
,,▲,スーパー（総務担当）,販売量の動き,・単価は下落しているのに１人当たりの買上点数が伸びない。
,,▲,コンビニ（エリア担当）,販売量の動き,・量販店の内容がが少しずつ悪くなっている。チェーン別の格差はあるが、単価の崩れではなく他メーカーの参入があるためである。コンビニについては若干の開店もあるので、順調に前年は確保しているが、今月は少しずつ悪くなる中で前年を若干割り込むという悪い状況である。
,,▲,衣料品専門店（経営者）,競争相手の様子,・商店街の同業者やメーカーの話などでは、天候は春らしくなっているのに、例年になく厳しい。
,,▲,衣料品専門店（地域ブロック長）,来客数の動き,・前月が好調で前倒しになっているのか集客が少ない。気温の低下の日がありスプリング・サマースーツ、フォーマルが動かない。チラシ効果も薄く、チラシ商品も残る。
,,▲,家電量販店（店長）,来客数の動き,・今月はパソコンの入替え時期にあたる。季節的にはエアコンは少し早い時期であたり、大型テレビもやや落ちつき気味で全体的に低調であった。
,,▲,乗用車販売店（販売担当）,販売量の動き,・１、２月は新型車の好影響も続き前年比150％と好調であったが、今月は新車効果も薄くなり前年比110％と前年を多少上回る程度の厳しい状態になっている。
,,▲,乗用車販売店（総務担当）,販売量の動き,・新車の動きも新型車の動きも悪く、改善の傾向がでていないために、今しばらく逆に悪くなると感じている。
,,▲,住関連専門店（広告企画担当）,来客数の動き,・納期的にギリギリのお客様が多く、また、準備期間が過ぎてしまってもさほど気にしない。客がちょっとずつ、価格の低いものを探しているから、決めるのが遅くなる傾向がある。
,,▲,住関連専門店（営業担当）,競争相手の様子,・道の対面に競合店が出店してきて、客数が約10％位落ち込んでいる。それに伴い客の動向も売上と同時に買い渋りの傾向があり、全体的にはあまりいい状況ではない。
,,▲,スナック（経営者）,来客数の動き,・ちょうど年度末で、人事の入替えの時期だが、昔のように歓送迎会がほとんど一次会で済んでしまい、二次会、三次会に行かない時代になってきている。
,,▲,その他飲食［ハンバーガー］（経営者）,単価の動き,・価格を下げたこともあり客数は伸びているが、客単価が落ち込み、売上増にまだ繋がっていない。
,,▲,通信会社（社員）,販売量の動き,・３か月前と比べて販売量、来客数ともに悪くなっている。
,,▲,美容室（経営者）,単価の動き,・景気が少し上向きになっていると市場ではいわれているが、まだ高単価のものの商品が全く動かない。
,,▲,設計事務所（経営者）,販売量の動き,・販売量の低下と受注単価の下落が大きくなっているようだ
,,×,商店街（代表者）,単価の動き,・ピーク時の３割から４割は客の感じる価格が下がっている。デフレ傾向がまだまだ続いていて、以前2000円で購入した商品が、客にとっては今は1400円位が妥当とするような感覚でである。大変な事態である。
,,×,その他専門店［時計］（経営者）,お客様の様子,・隣で日曜日ごとに朝市が開催される100円の試食コーナーがある時は来場者数が多い、コーナーがない時は少ないが、以前と比較してその差が大きくなった。とにかくなかなか買物をしなくなった。
,,×,タクシー運転手,来客数の動き,・例年と比べるとほとんど安い居酒屋で済ませ、タクシー利用が少なくなってきている。特に歓送迎会等は一次会で終わるところが多く、飲食店あたりは期待はずれであった。
"企業
動向
関連

(中国)",,◎,輸送用機械器具製造業（経理担当）,受注量や販売量の動き,・４月単月でみると、異例に多い受注販売量である。
,,○,化学工業（総務担当）,受注価格や販売価格の動き,・生産量、出荷量共に前月と大きな変化はなく安定しており、全般に高稼働率である。物流費・原燃料費高等の影響を受けながらも好景気の影響で、利益が上がってきている。
,,○,建設業（営業担当）,取引先の様子,・一部製造業及びサービス業において、本社建物建て替え、支店の建物建設投資等の動きが出てきた。
,,○,金融業（業界情報担当）,取引先の様子,・輸出を中心とした主力車の販売好調を背景に、生産はフル操業を持続中。樹脂原料価格の上昇などコストアップから利益率は伸び悩んでいるが、受注拡大により増益は確保している。
,,○,不動産業（経営者）,取引先の様子,・賃貸に関しては割合に増えつつある傾向である。なぜならば各企業、顧客からの申込量が多少増えつつあるように見受けられる。
,,□,化学工業（総務担当）,受注価格や販売価格の動き,・原油高による、海上運賃・トラック運賃等の物流費アップが現実となってきた。
,,□,窯業・土石製品製造業（総務経理担当）,受注量や販売量の動き,・大型案件製造完了後、新規引合が少なく生産量も低水準である。例年連休対策の飛込み注文があるが、本年はその出足も遅い。ただ積極的営業展開で新規客先の商談はある。
,,□,金属製品製造業（総務担当）,受注量や販売量の動き,・受注量は依然として高水準にあり、工場もフル操業である。この状況は過去３か月同様である。
,,□,一般機械器具製造業（経営企画担当）,それ以外,・自社製品の売上は引き続き好調に推移しているものの、原材料の高騰に伴い生産コストが懸念される。
,,□,電気機械器具製造業（総務担当）,受注量や販売量の動き,・自動車関連が好調で国内、欧米等海外とも受注拡大し向こう3か月フル操業の状況となっているが、材料の支給が遅延ぎみでとても造りきれない。材料メーカーも同様の状況と聞いている。
,,□,その他製造業［スポーツ用品］（総務担当）,受注量や販売量の動き,・相変わらず売上不振が続いている。多少好調な企業は一時金等で対応しており、今まで下げられていた賃金ベースは以前として低調なままである。したがって消費動向がアップするところまではいっていない。
,,□,建設業（経営者）,受注量や販売量の動き,・不動産は全く、建設も相変わらず悪い。事業の一つである産廃事業のみは順調であるが、地域全体にとってみれば悪いまま推移しているという状況である。
,,□,建設業（経営企画担当）,受注量や販売量の動き,・今月の受注は前年同月と比べると約80％減という非常に悪い結果となっている。しかし、現在までの累計でみると、前年同月で約10％増である。今年は前年に比べて発注を前倒ししている傾向があると共に、民間の受注が伸びてきている。
,,□,輸送業（統括）,それ以外,・今月の景気はゴールデンウィーク前で値動きは非常に多くなっている。しかし前年と比べると同じ様な内容であるためあまり変わらない。
,,□,通信業（営業企画担当）,受注価格や販売価格の動き,・企業向け通信サービスの受注単価や総額は相変わらず低下傾向にあり、新規のシステム構築より既存更改の割合が高いため、業界全体で収益維持に苦しむ状況は変わらない。
,,□,会計事務所（職員）,取引先の様子,・販売業は相変わらず不振が続いており、好転の兆しはまだ見えてこない。また、建設業も公共工事の予算削減が厳しく、完成工事高は前年割れを起こしているところが多い。反面、製造業は思いのほか好業績で、年度末の受注をこなしきれず、まだ納品が残っているところもある。
,,▲,食料品製造業（総務担当）,受注価格や販売価格の動き,・前年の目標以上に売上を上げるということで、売上を伸ばしているが、それに対しての利益面で見越してないような受注発注が多くなっている。
,,▲,輸送用機械器具製造業（総務担当）,受注価格や販売価格の動き,・受注量はほぼ横ばいで推移しているが、購入資材の値上がりに加え取引先からの受注価格の引き下げ要求を受け現在値段の折衝中である。
,,▲,金融業（営業担当）,それ以外,・仕事が無い状況が続いている。特に建設関係で鋼材等の値上りが響いていて、受注に手が出せない状況にある。ただマンション等の建築があるが、それは県外の業者が受注しており、地場の業者の苦しさは相変わらず続いている。
,,×,農林水産業（従業者）,それ以外,・１～３月と３か月前の10～12月を比較すると、水揚げ数量では1247tの減少、水揚げ金額でも31580千円の減少した。水揚げ数量の減少原因は中型まき網の減少である。また、水揚げ金額の減少原因は沖合い底引き網が減少したためである。
"雇用
関連

(中国)",,◎,求人情報誌製作会社（支店長）,採用者数の動き,・着実に期が変わるごとに採用者数が増えているように感じる。
,,○,求人情報誌製作会社（担当者）,周辺企業の様子,・久しぶりに新卒の採用を復活する企業からの情報が目立った。
,,○,民間職業紹介機関（職員）,求人数の動き,・某メーカーでは派遣社員の採用が出来ないことから自ら派遣会社を興し自社工場内でのワーカーを探している。
,,○,学校［大学］（就職担当）,求人数の動き,・前年度のこの時期に比べて１割程度求人件数が増加している。
,,□,人材派遣会社（支店長）,周辺企業の様子,・通信業界が非常に厳しい状況で薄利多売になっている。競争も非常に悪化してるということで、ますます厳しい状況に客が陥ると言われた。
,,□,求人情報誌製作会社（支社長）,求人数の動き,・求人数からいうと引き続き可も無く不可も無くという状態で、広島はメーカー系が少し良くなっているが全体的に小売含めて消費が上向きになっていない。
,,□,職業安定所（職員）,求人数の動き,・求人は微増で大きな変化はない。増加した業種は電機製造業、情報サービス業、運輸業だったが、その増加要因は特定企業からの大量求人によるものであったり、運輸業などでは繁忙期（引越）対応の臨時求人であったりで、景気動向によるものではない。
,,□,職業安定所（職員）,求人数の動き,・新規求人数が前年同月及び３か月前に比べて増加しているが依然として派遣、請負企業からの求人が目立っている。
,,□,職業安定所（職員）,求人数の動き,・前月と比べて求人が25％以上増加しているが、その内容は、パート求人、派遣・請負求人、有期求人が主体であり、安定した雇用に結びついていない。
,,□,職業安定所（雇用開発担当）,求人数の動き,・３か月前と比較して新規求人数は増加しているものの、前年度のこの時期と同じ傾向を示していること、及び有効求人倍率が変化していないことから変わらないと判断した。
,,□,民間職業紹介機関（職員）,雇用形態の様子,・上場企業からの総務部門の求人が正社員から派遣社員に変更になった。安定的な雇用者が増えない。
,,□,学校［短期大学］（就職担当）,雇用形態の様子,・就職未内定卒業者のその後の動向を調査するも、就職できた者の雇用形態をみると臨時や契約、嘱託といった不安定な身分の者が多く、企業が身を固くしている様子がうかがえる。
,,▲,－,－,－
,,×,＊,＊,＊
,,,,,
　９．四国（地域別調査機関：四国経済連合会）,,,,,
,,,,,（－：回答が存在しない、＊：主だった回答等が存在しない）
分野,,景気の現状判断,業種・職種,判断の理由,追加説明及び具体的状況の説明
"家計
動向
関連

(四国)",,◎,－,－,－
,,○,商店街（代表者）,来客数の動き,・来客数が非常に多く、夏物の商品の出足も非常に良く、街全体に活気がある。
,,○,百貨店（営業担当）,お客様の様子,・４月に入ってからは天候にも恵まれ、人の動きが良い。
,,○,スーパー（財務担当）,販売量の動き,・既存店の売上高は、前年の３か月前と比べると、102.7％が104.6％と1.9ポイント改善した。
,,○,家電量販店（店長）,販売量の動き,・今月はシングル需要があり、液晶テレビが大幅に伸びている。また、売上に占める割合は低いものの、電子辞書、デジタルオーディオも好調である。
,,○,観光名所（経営者）,来客数の動き,・来客数は約５％程度減っているが、売上は５～10％増加している。
,,○,ゴルフ場（従業員）,来客数の動き,・予約の状況は、土日も埋まりが早く前年と比べて非常に良い。
,,○,美容室（経営者）,来客数の動き,・来店客数が新規客を含めて増加した。
,,○,住宅販売会社（従業員）,来客数の動き,・イベントへの来場者数が前年と比べ増加した。
,,□,一般小売店［生花］（経営者）,単価の動き,・商品点数は伸びているが単価が減少したため、売上は増加しない。
,,□,百貨店（総務担当）,お客様の様子,・以前は入学式などがあると早くから洋服を買う客が多かったが、現状は、必要に迫られる直前まで買わないというシビアな消費傾向がある。また、持ち合わせの服にコサージュをつけて式らしい雰囲気を出している人が多く、節約している様子がうかがえる。
,,□,百貨店（営業担当）,それ以外,・催事については来客数及び売上高は前年並みに推移し、ブランド商品群は前年より若干増加したが、ファッション関連・ギフト関連が前年割れとなり、全体では、前年同月と比較し、来客数、売上高共に下回った。
,,□,スーパー（店長）,単価の動き,・飲料などの新製品については良く売れているが、必要な物しか買われない傾向は続いている。
,,□,スーパー（店長）,単価の動き,・来客数は増えているが、客単価は急激に減少している。
,,□,スーパー（企画担当）,来客数の動き,・食品は惣菜が前年並みを確保しているものの、衣料品、鮮魚、加工食品の動きが悪く、総売上高は前年比で２％、客数は約３％減少している。
,,□,コンビニ（エリア担当）,販売量の動き,・販売量や客単価が上昇してこないことに加えて、母の日の贈物といったギフト関係の売上が例年と比較して少なく、景気の悪い状態が続いている。
,,□,衣料品専門店（経営者）,単価の動き,・パンツについては、単価の高い商品が売れたが、レディースのトップスは、単価、数量ともに、20％程度落込み、全体的には前年と変わらない。
,,□,乗用車販売店（従業員）,お客様の様子,・例年なら新卒需要がある程度期待されたが、客の様子は通常の月と変わらない。
,,□,一般レストラン（経営者）,来客数の動き,・会社としての会合、会食でなく、個人や家族単位での食事が主流になっている。
,,□,都市型ホテル（経営者）,単価の動き,・利用客や販売数が増えても、単価が下げ止まらず、全体では横ばい状態が続いている。
,,□,旅行代理店（従業員）,来客数の動き,・中国が反日デモの影響でキャンセルが発生するなど振るわなかったが、国内では愛知万博、近場の温泉、沖縄、東京方面、海外ではハワイ、ヨーロッパ、台湾、韓国などの需要が多く、好調が継続している。
,,▲,一般小売店［書籍］（営業担当）,単価の動き,・来客数にあまり変化はないが、客単価が低下している。
,,▲,乗用車販売店（従業員）,お客様の様子,・ガソリンの価格が上昇し、乗用車の購入も慎重になっている。
,,▲,観光型旅館（経営者）,競争相手の様子,・地域全体、同業の様子を見ると、値下げ競争が続いており、厳しい状況である。
,,▲,その他住宅［不動産］（経営者）,お客様の様子,・賃貸住宅の退去者は非常に多かったが、新築の賃貸アパートが沢山できたことに加え、住宅やマンションを買った人が多かったため、入居者が少なく、空き家が増えた。
,,×,衣料品専門店（経営者）,販売量の動き,・寒暖の差が大きく、春物の動きが悪い。
,,×,乗用車販売店（営業担当）,販売量の動き,・客の買換え需要や新規購入が増えてこない。
,,×,タクシー運転手,お客様の様子,・３か月前と比べて、接待などの人数が少なくなっている。また、客単価も下落し、長距離を乗る人が少なくなっている。
"企業
動向
関連

(四国)",,◎,食料品製造業（従業員）,受注量や販売量の動き,・新商品が好調に推移しており、3か月前と比較し、売上が増加している。
,,◎,通信業（支店長）,受注量や販売量の動き,・販売価格が若干値上がりしているにもかかわらず、販売は好調である。
,,○,電気機械器具製造業（経営者）,受注量や販売量の動き,・電子機械の仕事は少なくなっているが、メディア、ＤＶＤ関係の生産ラインはフル操業で忙しい。
,,○,輸送業（支店長）,受注量や販売量の動き,・荷動きが活発になり、運行車が足りない状態になっている。
,,○,輸送業（役員）,受注量や販売量の動き,・これまでは、平均的に出荷されていたのが月末集中型になったものの、全体では少し動きは良くなっている。
,,□,繊維工業（経営者）,取引先の様子,・タオル業界の主力販売先である百貨店、ギフト専門店などのギフト商品の売行きが非常に悪い状態が続いている。
,,□,一般機械器具製造業（経理担当）,受注量や販売量の動き,・建設用油圧クレーンの稼働率は全国的に高稼働を維持している。
,,□,電気機械器具製造業（経営者）,受注価格や販売価格の動き,・原油高が販売価格に転嫁できず、厳しい状況が続いている。
,,□,広告代理店（経営者）,受注量や販売量の動き,・４月は契約更新の時期であるが、費用対効果をよりシビアに判断し、新聞、電波、雑誌の各マス媒体を減らし、チラシ折込広告やダイレクトメールにシフトするクライアントが増えている。
,,□,公認会計士,取引先の様子,・クライアントの決算内容を見ると、前年比でまだマイナスの企業が過半数を占めている。また、実際に経営者と話をしても、景気が良くなっていると判断している人はほとんどいない。
,,▲,化学工業（営業所長）,受注量や販売量の動き,・今年に入り、受注量、販売量は減少傾向が続いていたが、４月に入っても回復の兆しはなく、１～３月より大きな落ち込みとなっている。
,,▲,建設業（総務担当）,受注量や販売量の動き,・手持ち工事が前年同期比で２割程度少なくなっている。
,,×,－,－,－
"雇用
関連

(四国)",,◎,－,－,－
,,○,－,－,－
,,□,人材派遣会社（支店長）,求人数の動き,・求人数はあるものの、経験者を必要とするケースが多く、非常に対応が困難である。
,,□,職業安定所（職員）,求人数の動き,・新規求人数は、警備員、販売員で大口求人があったものの、製造業、飲食店、宿泊業、医療・福祉業で欠員補充が少ないため、全体では減少した。
,,□,職業安定所（職員）,求人数の動き,・求人の中でパートや臨時の求人が占める割合に変化がみられない。
,,□,学校［大学］（就職担当）,採用者数の動き,・採用者数の動きが、ほぼ停滞のまま推移している。
,,▲,人材派遣会社（従業員）,雇用形態の様子,・派遣社員の代わりに、契約期限の限られた契約社員での採用が増加しており、より人件費抑制傾向がうかがえる。
,,×,－,－,－
,,,,,
　１０．九州（地域別調査機関：（財）九州経済調査協会）,,,,,
,,,,,（－：回答が存在しない、＊：主だった回答等が存在しない）
分野,,景気の現状判断,業種・職種,判断の理由,追加説明及び具体的状況の説明
"家計
動向
関連

(九州)",,◎,コンビニ（店長）,来客数の動き,・天候が良いので、３か月前に比べ来客数が前年比20％増とかなり増えた。
,,○,百貨店（売場担当）,お客様の様子,・売出しの内容を変えたことで、売上が前年を上回った。特に気温に見合った衣料品の動きが良かった。客はやはり値ごろ感があって良い商品を求める。来客数の動きは変わっていないが、明るい雰囲気を感じる。
