Ⅰ．景気の現状に対する判断理由等,,,,,
,,,,,
　景気の現状に対する判断の理由及びそれに対する追加説明等について、その主だったもの及び特徴的と考えられるものを取りまとめると以下のとおりであった。,,,,,
,,,,,
,,,,,
　１．北海道（地域別調査機関：（株）北海道二十一世紀総合研究所）,,,,,
,,,,,（－：回答が存在しない、＊：主だった回答等が存在しない）
分野,,景気の現状判断,業種・職種,判断の理由,追加説明及び具体的状況の説明
"家計
動向
関連

(北海道)",,◎,その他レジャー施設（職員）,販売量の動き,・取扱チケットのカテゴリーが増えたため、大幅に販売量や来客数が増えた。ただし、客単価は低くなっている。
,,○,商店街（代表者）,お客様の様子,・今月は天候、来街者など比較的安定した状態で、若者中心の衣料店に動きが目立つ。
,,○,商店街（代表者）,お客様の様子,・ようやく気温が上がってきて、月前半は春物の羽織関係が売れていた。中旬からは夏のトレンドがある程度はっきりしてきたため、客の購買意欲が増している。カットソー、Ｔシャツなどの単品を中心に、客が商品を探している様子が確実にうかがえる。
,,○,一般小売店［酒］（経営者）,販売量の動き,・天候の回復もあり、４月に入ってから人出が活発になってきて、それに伴い販売量も幾分伸びてきている。
,,○,一般小売店［土産］（店員）,来客数の動き,・先々月まで、観光客が前年比で５～10％減っていたが、底入れしたのか前月から今月にかけてほぼ前年並みになり、改善傾向にある。
,,○,スーパー（店長）,来客数の動き,・来客数、販売量とも前年比は、全国平均値と比較すると遅れをとっているものの、前月との比較ではいずれも増加している。力強さには欠けるものの、１月、２月を底としてやや回復している状況となっている。内訳では、食品及び住居用品で全国平均を上回っている。
,,○,スーパー（店長）,来客数の動き,・雪の影響もあったのか、３か月前と比べると店全体の来客数が３％増加している。
,,○,スーパー（店長）,販売量の動き,・３か月前と比較して販売数量が25％伸びている。前年の12月と比べても約６％多くなっている。
,,○,衣料品専門店（店長）,単価の動き,・客１人当たりの買上点数が増えており、客単価も上昇している。
,,○,乗用車販売店（従業員）,販売量の動き,・雪解けが遅かった反動とも思うが、４月は前年より契約台数が多く、良い状況であった。
,,○,一般レストラン（スタッフ）,来客数の動き,・依然として客単価の前年割れが続いているが、来客数が前年比107％と伸びている。
,,○,観光型ホテル（スタッフ）,販売量の動き,・外国人客を中心に宿泊客数は３か月連続の２けた増加となった。ただし、宿泊単価は依然として前年割れと厳しい。
,,○,旅行代理店（従業員）,販売量の動き,・ヨーロッパ方面の海外旅行が順調に伸びており、国内旅行も道外に向かう旅行は好調に申込数を増やしている。
,,○,美容室（経営者）,お客様の様子,・客との会話の中で旅行や買物、食事など活動的な話題が多くなってきている。
,,□,商店街（代表者）,お客様の様子,・天候のせいもあるが、客の消費意欲が非常に低迷しているように感じる。バーゲンであっても反応が悪く、本当に必要なものしか求めない。
,,□,商店街（代表者）,お客様の様子,・天候がそれほど良くなっていないため、客の動きがまだ緩慢な状態である。
,,□,百貨店（売場主任）,単価の動き,・３月の実売期に苦戦していた春物のコートを４月上旬に値下げしたところ、ある程度販売に結びついた。また初夏物・夏物を早めに投入しているが、カットソーやセーターなど、低単価の商品が販売の主力となっている。
,,□,百貨店（役員）,お客様の様子,・中旬過ぎから気温が平年並みまで上がる日が多く、売上を上乗せしようと強い販促を仕掛けると客数はアップするが、客の買い方は慎重なままである。特にまとめ買い等があまりみられず、依然として前年を割り込んでいる。
,,□,スーパー（店長）,販売量の動き,・例年に比べて気温が低いことも影響しているが、春物、初夏物の売上がなかなか回復してこない。割引を実施しても客が飛びつかない状況が続いている。
,,□,家電量販店（店員）,来客数の動き,・入学、進学の客が少なく感じた。相変わらず複数の店を回る客が多く、特価商品の人気がある。
,,□,家電量販店（地区統括部長）,販売量の動き,・デジタル商品が好調に推移しているものの、前年末からの単価ダウンに歯止めがかからず、トータル的には変わらない。
,,□,住関連専門店（経営者）,来客数の動き,・とうとう商店街の店舗で閉店するところが２～３店出てきた。我慢ができずに限界を迎えている店舗が多いようだ。
,,□,高級レストラン（スタッフ）,来客数の動き,・大型店撤退のニュースなど、地域の衰退が消費者の利用意識を低下させている。
,,□,高級レストラン（スタッフ）,来客数の動き,・観光客の落ち込みが顕著である。この時期は、例年であれば観光バスや観光客が良く目に付くが、最近はあまりみられない。
,,□,高級レストラン（スタッフ）,お客様の様子,・ゴールデンウィークを控えているせいか、ランチ客が前年の７割となった。特にビジネスマンと時間に余裕のある女性客が減少したようだ。ディナーは企画商品が当たり、客数、売上、単価のいずれもが増加した。全体では前年を少し下回っている。
,,□,スナック（経営者）,来客数の動き,・４月は企業の異動の時期だが、歓送迎会は一次会で終わることが多く、二次会があっても、団体料金の安いスナックなどに流れていたようだ。
,,□,観光型ホテル（経営者）,販売量の動き,・道外客、地元客とも動きが良くない。１人当たりの消費額も伸びる気配がない。台湾からの旅行客は依然として好調である。名古屋圏からの客は増加傾向にある上、付帯収入部門での売上増加が顕著である。地元客を含めた道内客の動きの悪さが痛手である。
,,□,旅行代理店（従業員）,販売量の動き,・ゴールデンウィークの宿泊客が伸びず、長期間の休みの割には動きが鈍いように感じる。
,,□,旅行代理店（従業員）,来客数の動き,・例年のゴールデンウィークの動きに比べて来店が少なく、旅行申込も少ない上に、１泊程度の短い日程が増えている。
,,□,設計事務所（職員）,それ以外,・新年度を迎え、公共工事が発注される時期が近づいてきたが、例年より数や量が少ない。民間工事も医療施設や分譲マンションに限定されて、全般的には少ない。
,,□,住宅販売会社（従業員）,販売量の動き,・季節的にモデルハウスの来場者は増えてきているが、成約等は相変わらず低調な感じである。
,,□,住宅販売会社（従業員）,販売量の動き,・購買量の低下は所得の減少が最大の理由と受け止めている。
,,▲,商店街（代表者）,お客様の様子,・低単価志向が強く、また消耗品の動きも鈍く、落ち込みが大きい。
,,▲,百貨店（売場主任）,お客様の様子,・２月、３月と季節物の動きが鈍かったことから、今月は気温の上昇に伴い動きが活発になることを期待したが、思いのほか伸びきれずに推移した。母数の大きい衣料品・服飾雑貨の購買客数の減少に歯止めがかからない状況にある上、比較的、変動の少ない食料品でも、過去に例がないほどの大幅な落ち込みを記録した。少子化の進行に伴い、入学・進学の返礼ギフト需要が減少していることも影響している。
,,▲,百貨店（売場主任）,お客様の様子,・食品における物産催事は客数、売上とも非常に良いが、春物の婦人服、紳士服の動きが厳しい状況である。
,,▲,コンビニ（エリア担当）,来客数の動き,・幹線道路沿いの店舗で男性の来客数が前年に比べて減少している。雪解けの遅れが工事や農作業の遅れにつながっている可能性がある。
,,▲,コンビニ（エリア担当）,単価の動き,・客の買上点数は前年と比較するとほぼ変わっていない。ただし単価が低下しており、客はより安いものを求めているとみられる。
,,▲,コンビニ（エリア担当）,競争相手の様子,・順調に売上が伸びていると言われているスーパーも販促の機会が多くなり、前年は週2.0回であったものが今年は週3.6回まで増加している。通常の値段では売れず、単価自体も下がっており、景気は減退している。
,,▲,衣料品専門店（店長）,単価の動き,・色々と売り出しや展示会を行うが、今月の展示会では高額品が全く売れず、安い物でも数が減っている状態である。
,,▲,乗用車販売店（営業担当）,販売量の動き,・販売活動を強化しているが、景気が悪く商談にならない。
,,▲,その他専門店［ガソリンスタンド］（経営者）,お客様の様子,・原油価格の急騰により石油製品価格が暴騰している。
,,▲,観光型ホテル（経営者）,来客数の動き,・来客数の動きはここ数か月、前年に比べて停滞気味に推移している。愛知万博の影響、あるいは航空機の輸送能力の減少等が理由として考えられるが、何が本当の理由かはもう少し分析する必要がある。
,,▲,観光名所（役員）,来客数の動き,・函館への観光客入込者数は減少傾向にあり、施設内のレストラン利用者も減少している。
,,×,スナック（経営者）,来客数の動き,・４月は歓送迎会がある時期だが、いまだに国家公務員の倫理規程が厳しいため参加してくれる人が少ない。
,,×,タクシー運転手,来客数の動き,・４月になり、雪解けとともにタクシーの利用客が激減している。また規制緩和により、札幌のタクシー台数は３年間で14％増えているため、利用客の減少と合わせてますます売上が減少している。
"企業
動向
関連

(北海道)",,◎,－,－,－
,,○,食料品製造業（団体役員）,受注量や販売量の動き,・総体的な受注量に変わりはないが、愛知万博の影響で中部地域への販売量が好調である。
,,○,輸送業（支店長）,取引先の様子,・道内の産業構造がリサイクルを中心に動き出している。特に、石炭価格の高騰の影響によると思われる代替燃料への転換及びリサイクル法関連で新たなビジネスチャンスが生まれてきている。
,,□,家具製造業（経営者）,受注量や販売量の動き,・前年と比較して、最近数か月は請負物件の受注が良い。
,,□,輸送業（営業担当）,取引先の様子,・紙パルプのメーカー、農産物の取引ともに大きな変化はみられない。内航船の運賃高騰に伴い輸送の引き合いがうまくいっていない。
,,□,通信業（営業担当）,受注量や販売量の動き,・今月は年度始めであったが、取引量、内容とも大きな変化はなかった。
,,□,金融業（企画担当）,それ以外,・設備資金は低調である。道内全体としては大手製造業の大型投資が下支えしているが、道内地場企業の投資意欲は弱い。この冬は大雪と寒さが長引き、大型小売店や観光地の客足も鈍っている。建設業は公共投資の削減で厳しく、比較的堅調なのは、札幌中心部の分譲マンション程度である。分譲マンションは退職者などの購入意欲が強い。
,,□,司法書士,取引先の様子,・前年の秋以降、住宅関連の建物着工は前年から30％強落ち込んでおり、現在においても引き続き停滞傾向にある。
,,□,その他サービス業［建設機械リース］（営業担当）,受注価格や販売価格の動き,・建設受注活動において少ない案件の中、まだまだ安値受注が目立つ。
,,▲,通信業（営業担当）,受注量や販売量の動き,・この時期は本来であれば、比較的販売量が多い時期であるが、今年は例年及び３か月前との比較でいえば低調な数字となっている。
,,▲,その他サービス業［システムハウス］（経営者）,競争相手の様子,・今まで取引関係のない同業他社から仕事がないかという問い合わせが増えている。
,,▲,その他サービス業［建設機械リース］（支店長）,取引先の様子,・特に運送業者はガソリンの高騰による打撃を受けている様子である。運送単価は決して高くなく、非常に厳しい状態である。
,,▲,その他企業［コンベンション担当］（従業員）,受注量や販売量の動き,・中国、韓国等の対日感情の悪化により外国人旅行客が減少している上、本州の旅客が愛知万博を選択する傾向が生じている。
,,×,－,－,－
"雇用
関連

(北海道)",,◎,－,－,－
,,○,人材派遣会社（社員）,求人数の動き,・特に苫小牧や千歳の大型店出店に伴い、求人数が増えている。
,,○,求人情報誌製作会社（編集者）,求人数の動き,・ここ３か月間、求人広告及び求人数が安定しており、ごく若干だが伸びがみられる。
,,○,求人情報誌製作会社（編集者）,求人数の動き,・スナックの求人を除くと求人件数は全般的に好調である。前年と比較すると15％程度の件数の伸びを示している。減少傾向が続いていた衣料品販売や理美容の求人件数も上向きに転じた。都市部のマンション建設ラッシュによる技術者、技能者の人材不足感も出てきている。
,,○,職業安定所（職員）,求人数の動き,・求人数を前年と比較してみると数か月連続してある程度の増加を示している。また久々に求人活動を再開している企業が増加してきている。
,,○,学校［大学］（就職担当）,求人数の動き,・通年採用や秋採用、追加採用で求人票が増加している。また新年度に入り、求人票を持参して大学へ来る企業の人事担当者が増えている。
,,□,求人情報誌製作会社（編集者）,周辺企業の様子,・ゴールデンウィーク前の状況もあるかと思うが、大型コールセンターなどの雇用もほぼ無くなり、余剰人員を持っている現状で、企業も業務の受注状況が芳しくない模様である。建築関連も動きはあるものの、継続的な受注ではなく単発的なものが多い。
,,□,職業安定所（職員）,求人数の動き,・新規求人件数は前年比でマイナス0.1％と大きな変化はない。業種別にみると、建設業及びサービス業が増加、製造業及び運輸業が減少となっている。
,,□,職業安定所（職員）,雇用形態の様子,・前年比でみると、新規求人が３か月連続で増加しているが、派遣・請負求人が増加しており、また新規求人のうち36％がパート求人であり、雇用環境が良くなっているとは思われない。
,,▲,人材派遣会社（社員）,雇用形態の様子,・弊社からの販売、営業業務への派遣は増加しているが、これは企業業績が悪化しているため、即戦力の人材を投入し、回復を図っていることにほかならない。さらに投入期間も短期間であり、利益が出ていないため、経費を節約せざるを得ないほど、各社の景気は悪い状態である。
,,×,－,－,－
,,,,,
　２．東北（地域別調査機関：（財）東北開発研究センター）,,,,,
,,,,,（－：回答が存在しない、＊：主だった回答等が存在しない）
分野,,景気の現状判断,業種・職種,判断の理由,追加説明及び具体的状況の説明
"家計
動向
関連

(東北)",,◎,－,－,－
,,○,スーパー（店長）,単価の動き,・前年は、消費税総額表示導入により、販売側も客の側も不慣れで、消費への影響が出たこと、税まる飲みによる販売単価下落により、前年４月は買上点数・単価の低下により売上を落とした。今年は、買上点数が既存店前期比108％と好調に推移している。
,,○,衣料品専門店（店長）,来客数の動き,・女性客による代理購買が増えてきていることとオーダーを始めとした高単価商品が稼動してきている。
,,○,乗用車販売店（経営者）,販売量の動き,・４月に入ってから、例年に比べ遅い雪解けではあったが、震災復興と合わせて遅れていたタイヤの履き替え需要も増えた。新年度からの新モデルの販売も堅調に推移している。
,,○,その他専門店［靴］（経営者）,販売量の動き,・暖かくなってきて、寒かった３月に売れなかった春物商材が４月に入って好調である。
,,○,都市型ホテル（経営者）,来客数の動き,・例年どおり歓迎会の件数があり、ある程度ベースをつくれた。また、行政の力が大きいが、花見の名所の来客数が非常に増え、宿泊、飲料部門にかなりのプラスとなった。
,,○,都市型ホテル（スタッフ）,来客数の動き,・レストラン関係では、前年よりも利用人員が増加する等少人数グループ等の利用が活発化しているところがあるが、全般的には前年横ばいである。異業種間格差、同じ企業の中でもセクション間格差があり安定しないところがあるが、一時の最悪状態からは脱出した感がある。
,,○,住宅販売会社（経営者）,販売量の動き,・前年比68％にとどまっているが、前年同月受注が特殊要因で大きく伸びたことが要因なので、実質は落ち込んでいない。３か月前比では109.5％の受注になっている。
,,○,住宅販売会社（従業員）,販売量の動き,・４月の完成内覧会での新規客契約と営業期間の長い顧客が動き始め、契約数が伸びている。
,,□,商店街（代表者）,競争相手の様子,・新しい商品に対する反応は、前年よりも良い。消費指向全体は低調で、商店街における競争力の低下がある。
,,□,一般小売店［書籍］（経営者）,お客様の様子,・全般に衝動買いが少ない。引き続き雑誌、書籍とも目的外のものは買い控えの傾向である。立ち読みでの情報収集に終わり、買上にまでつながらない状況である。
,,□,一般小売店［医薬品］（経営者）,お客様の様子,・４月１日から新球団の試合が始まったにもかかわらず、地元飲食街に対する貢献度は少ないという話が飲食店オーナーから聞かれる。
,,□,百貨店（企画担当）,それ以外,・４月の中旬から最高気温が10度前後の日が２週間程度続き、春物の衣料品は深刻な状況にある。気候の要素で来客数が落ち込むほど消費の体力は十分に回復していない。景気もそれを跳ね返すだけのパワーがない。
,,□,百貨店（広報担当）,お客様の様子,・月の上旬から中旬にかけて前年に比べて、平均気温が1.5度程度低かったため春物初夏物が低調に推移した。中旬の新規催事の盛況、リニューアル等、また、隣接に新規オープンした店舗ビル等で界隈の活性化にはつながっており、来客数は伸びているが、直接売上に結びついてこない。
,,□,百貨店（売場担当）,単価の動き,・３月は旅行鞄等、高額品が動いた。今月からは２～３万円の小物の革製品が出ている。欲しいものは、新年度の３月位に買い揃え、その後に自分の身の回りの安めのものを買うようになっている。目標もぎりぎり達成されている。ブティック全体をとっても売上の良いところと悪いところに差がある。全体的に値段の大きい商品の売上は上がっていない。
,,□,スーパー（経営者）,販売量の動き,・消費税総額表示に変り１年が経過し一巡したことで、若干客数、販売量が持ち直し傾向にあるが、今後も継続するかは不確かである。
,,□,スーパー（経営者）,来客数の動き,・前年４月に実施された消費税総額表示は、かなり消費にブレーキをかけたが、一巡した今年４月はその反動がほとんど見られず厳しいまま推移している。１品単価や客の買上点数に大きな変化はなく、プラス反動が出ているという状態ではない。
,,□,スーパー（店長）,来客数の動き,・来客数は、前年比103％と伸びているが、１品単価は下がっており、売上は前年並みと変わらない。相変わらず安い商品を買うため、買い回りしている傾向にある。
,,□,スーパー（店長）,来客数の動き,・一次商圏内の競合店のディスカウントチラシの影響で、来客数前期比93％、売上前期比95％で推移しており、集客面でかなり厳しい状態が続いている。
,,□,スーパー（総務担当）,販売量の動き,・前年より継続して買上点数の既存店前年比伸び率は、同じ推移で来ていたが、４月に入り、急に低下した。ガソリン等の値上がりもあり買い控えが出たのではないかと推測される。平均１品単価の推移は食肉を除き、生鮮がほぼ前年並み、加工食品は前年を１％超える推移だった。買上点数の落ち込みが大きすぎる。
,,□,スーパー（企画担当）,販売量の動き,・気温が上昇し、飲料を中心として、また、行楽関連の動向が回復している。新製品も販売量が伸びており、わずかながら客数も戻っている。
,,□,スーパー（企画担当）,お客様の様子,・暖かくなったが、原油、灯油、ガソリンの値上がりに関する報道が、購買力にブレーキをかけている。
,,□,コンビニ（エリア担当）,単価の動き,・客数と客単価の乖離が約３％ある。客数は前年同月比で改善しているが、客単価が低くなっている。財布のひもが固いようだ。
,,□,コンビニ（エリア担当）,販売量の動き,・４月は気温が例年より低いため、ソフトドリンク、冷やし麺など売行きが悪い。
,,□,衣料品専門店（経営者）,お客様の様子,・客は、慎重な買物が多い。目的買いのみで衝動買いはせず、いくら値下げしても必要でないものは買わない。
,,□,衣料品専門店（経営者）,単価の動き,・価格競争の激化が進み、電子入札制度の導入等により、拍車がかかる恐れがある。
,,□,乗用車販売店（経営者）,販売量の動き,・各メーカー系列とも新型車が発売されているものの、買い控え、保有延長のため、前年を超えることが難しい。
,,□,乗用車販売店（経営者）,来客数の動き,・例年にないほど雪解けが遅れ、３月の需要期に来客数が落ち込み、４月に新聞広告、ラジオのスポット等販促を実施したが、遅れを取り戻せない状況である。
,,□,住関連専門店（経営者）,来客数の動き,・久しぶりに売上が前年比でプラスになった。大雪の影響の反動であるかもしれない。
,,□,住関連専門店（経営者）,お客様の様子,・４月は気温が低く推移しており、春物衣料の動きは例年よりも悪く、後半気温が高くなっても動きにあまり変化はなく、タンス在庫で今年の春はすまそうという意識が客の会話から感じられる。
