Ⅰ．景気の現状に対する判断理由等,,,,,
,,□,電気機械器具製造業（経営者）,受注量や販売量の動き,・国内販売は、映写機関連は３か月前とほぼ同レベルであるが前年同期比では新規需要に減少傾向がみられる。一方、監視カメラ関連は市場の堅調さからやや増加となっている。
,,□,輸送用機械器具製造業（統括）,取引先の様子,・主力取引先は再建中で受注量が減少しており、単価引き下げ要求も厳しい。数量の増加も当面見込めない。
,,□,輸送業（エリア担当）,受注量や販売量の動き,・荷動き、トラックへの積み込み台数などにはほとんど変化はない。愛知万博関連は、祭りの山車の運搬等が出ている。
,,□,金融業（企画担当）,取引先の様子,・住宅ローンが好調である。
,,□,広告代理店（制作担当）,取引先の様子,・様々な企画を提案しても企業側はなかなか乗ってこない。足踏み状態である。
,,▲,鉄鋼業（経営者）,受注量や販売量の動き,・鉄鋼メーカーが決算対策で３月末に一時的に出荷量を増やしたため一部で鋼材在庫が増加し、買い控えが続いている。
,,▲,金属製品製造業（従業員）,取引先の様子,・取引先同士で金銭的なトラブルが続発しているなど、いやな話をよく聞く。
,,▲,輸送業（従業員）,受注量や販売量の動き,・ゴールデンウィーク前は例年かなりの荷動きがあるが、今年は大型連休にもかかわらず出荷時期が遅く、物量も少ない。天候不順のためか例年に比べて荷動きが低調である。
,,▲,行政書士,受注量や販売量の動き,・燃料の価格高騰が関与先の運送会社などに影響している。
,,▲,経営コンサルタント,取引先の様子,・宅地開発の関連の集客は良くない。
,,×,窯業・土石製品製造業（経営者）,受注量や販売量の動き,・前年同期と比べて売上は34％の減収で、経常利益も大幅減益である。
,,×,非鉄金属製品製造業［鋳物］（経営企画担当）,受注量や販売量の動き,・受注量、販売量の減少傾向が続いている。加えて原材料価格の高騰とその販売価格への転嫁が容易に出来ないことも続いているため、売上、利益は引き続き減少している。
"雇用
関連

(東海)",,◎,＊,＊,＊
,,○,人材派遣会社（社員）,求人数の動き,・愛知万博関連の需要が一息ついて、新規需要が減少してきている。しかし万博以外の需要は増加傾向にあり好調である。
,,○,人材派遣会社（社員）,求職者数の動き,・例年なら求人求職者の動きが一段落する時期であるが、引き続き好調な製造業を始めとして、求人募集広告は減少していない。
,,○,民間職業紹介機関（経営者）,求人数の動き,・例年なら年度末から年度始めにかけては求人数はいったん落ち込むが、今年は高位で安定している。中堅、中小企業からの求人も増加している。
,,○,民間職業紹介機関（職員）,求人数の動き,・求人数は相変わらず高水準にある。各社とも派遣での求人を求めている。
,,□,人材派遣会社（社員）,求職者数の動き,・３か月前と比べて派遣求職者の応募が増加している。
,,□,新聞社［求人広告］（営業担当）,求人数の動き,・県内の求人は変わらず好調に推移している。しかし求職が追いつかず、人手不足の状態が続いている。特に販売系と専門技術者の不足が顕著である。
,,□,新聞社［求人広告］（担当者）,求人数の動き,・３か月前と同様に、パート、アルバイトや請負業等を中心に求人は依然好調である。
,,□,職業安定所（職員）,求職者数の動き,・雇用保険の受給資格者が減少し、求職者も減少している。しかし在職中で転職を希望する者は増加傾向にある。
,,□,職業安定所（職員）,雇用形態の様子,・有効求人倍率は１倍を超えて推移しているが、パート、派遣、請負などの非正規社員の求人が多い。
,,□,職業安定所（管理部門担当）,雇用形態の様子,・常用雇用の求人は横ばいである。パート求人が依然として多い。
,,▲,職業安定所（職員）,求人数の動き,・当地区の有効求人倍率は２か月連続で低下し、５か月ぶりに1.3倍を下回っている。有効求人数も２年４か月ぶりに前年同月を下回っている。
,,×,－,－,－
,,,,,
　６．北陸（地域別調査機関：（財）北陸経済研究所）,,,,,
,,,,,（－：回答が存在しない、＊：主だった回答等が存在しない）
分野,,景気の現状判断,業種・職種,判断の理由,追加説明及び具体的状況の説明
"家計
動向
関連

(北陸)",,◎,通信会社（社員）,販売量の動き,・携帯電話の新規加入台数が増加した。
,,○,百貨店（営業担当）,お客様の様子,・靴やバッグを含めてファッション全般ではジーパンのカジュアルスタイルにフィットした商品の動きが目に付く。食品では旬をとらえた商材の動きが良い。家庭用品、身の回り品では例えば高額の箸にこだわり、生活のスタイルをちょっと変えてみたいという購買行動がみられ、全体的にはやや上向いてきている。
,,○,百貨店（営業担当）,販売量の動き,・旅行用に婦人服をまとめ買いする客が増えている。
,,○,スーパー（営業担当）,単価の動き,・来客数は変わらないが、100円、198円、298円などの値ごろ感のある商品をアピールすることによりの買上点数が増加し、客単価が上がっている。消費税総額表示も１年が経過し、客も慣れてきた。
,,○,乗用車販売店（経理担当）,販売量の動き,・車の需要期のピークは過ぎたが、新型車が存在しないにもかかわらず、３か月前及び１年前との比較で販売台数はかなり増加している。
,,○,その他専門店［医薬品］（営業担当）,来客数の動き,・来客数は既存店ベースで前年同月比２％増、売上は同4.7％増となっており、来客数の伸びが売上を引っ張っている。
,,○,一般レストラン（スタッフ）,来客数の動き,・従来と違って、広告等の販売促進を実施すると、来客数は２けたの伸びとなる。
,,○,都市型ホテル（スタッフ）,来客数の動き,・レストランの通常営業は前年を下回っているが、宿泊、一般宴会や、レストランを含む婚礼の売上は前年を上回っている。３か月前と比べても全体で上回っている。
,,○,都市型ホテル（スタッフ）,販売量の動き,・レストラン、宴会など一部バラツキはあるが、全体として販売量が増加している。
,,○,住宅販売会社（従業員）,お客様の様子,・客の年齢層が年々若くなっているため、以前に比べ販売金額は減少したが、販売件数は増加した。
,,□,一般小売店［鮮魚］（従業員）,販売量の動き,・温泉地や大型娯楽施設の取引先では、愛知万博の影響で予約や売上が軒並み落ちている。
,,□,一般小売店［事務用品］（営業担当）,販売量の動き,・３月の年度末需要が終わり、文房具などの消耗品の動きが止まっているが、新入社員向けの机や椅子などの備品は若干売れている。
,,□,スーパー（店長）,単価の動き,・ここに来て客単価が若干下げ止まりしている。これは牛肉の値上げ、果物相場の上昇によるもので、決して客の購買意欲が上がったわけではない。逆に１人当たり買上点数が減少していることから、全体としては変わらない。
,,□,スーパー（副店長）,単価の動き,・年２回の会員特別招待会の実施により、来客数は前年を上回ったが、客単価は依然前年割れとなっている。
,,□,コンビニ（経営者）,販売量の動き,・４月の前半は前年よりも天候が悪く、気温も低かったが、来客数、客単価共に前年を上回った。
,,□,コンビニ（経営者）,単価の動き,・来客数は増加しているが、単価が伸び悩んでいる。
,,□,衣料品専門店（経営者）,販売量の動き,・月の初めは良くなかったが、中盤から後半にかけて良くなった。しかし、気候が寒くなると、とたんに販売量が落ちる。
,,□,衣料品専門店（経営者）,販売量の動き,・４月にやっと暖かくなり、３月に止まっていた春物もようやく動き出した。
,,□,家電量販店（経営者）,販売量の動き,・引き続きテレビ、ＤＶＤが好調、パソコン及び関連品は低調である。エアコンの出足が今一つ良くないが、洗濯機が売上、単価共に前年をかなり上回り、乾燥機能付き洗濯機が定着してきた。４月29日と30日の連休スタートは販促効果もあり、まずまずの売上となった。
,,□,乗用車販売店（経営者）,販売量の動き,・全体としては前年並みの実績であるが、売れ筋は極端に偏る傾向にある。例えばお買い得な限定車が出るとそれだけに引き合いが集中し、他は全く売れず、需要の底上げができない。
,,□,乗用車販売店（経理担当）,販売量の動き,・小型車や新型ＲＶ車があるにもかかわらず、最大需要月の３月の販売台数は前年比で減少したが、４月の受注・登録数は若干ながら前年より増加した。
,,□,自動車備品販売店（従業員）,来客数の動き,・必要な商品であれば、価格よりもアフターサービスやメンテナンスを重視する客が多い。
,,□,高級レストラン（スタッフ）,販売量の動き,・４月は桜の開花が例年より遅かったことから客の出足は悪かったが、開花後は天候もよく、花見客や歓迎会など例年並みの受注ができた。
,,□,タクシー運転手,来客数の動き,・歓送迎会や夜の花見会は集中的に行われたが、タクシーの利用は少なかった。
,,□,パチンコ店（店員）,来客数の動き,・客は長期連休の前に出費を抑えているためか、来客数が前月に比べて１割程度落ち込んでいる。
,,□,住宅販売会社（従業員）,お客様の様子,・以前の客はどちらかと言えば付和雷同型が多かったが、今は一定期間を定めて計画的に住宅取得を考えている人が増えている。契約までの期間は延びるが、その分手ごたえを感じながら交渉ができるため、確実性がある。
,,□,住宅販売会社（従業員）,販売量の動き,・受注量が前年に比べて減少した。各社が低価格商品を宣伝しているため、客はすぐに決めることができず、様子見の状態が続いている。
,,▲,百貨店（営業担当）,来客数の動き,・今月の買上客数は前年比95％で推移しており、プレシーズン商品の水着の買上数についても前年の７割となっている。
,,▲,百貨店（営業担当）,販売量の動き,・春物コートの需要が昨年より少なく、また期間も短く、すぐにジャケットの需要に切り替わったため、客単価が低下している。また、取引先が徐々に製造量を減らしているため、ジャケットの需要に対して欠品が重なり、売り逃しがかなり起きている状態である。全体的に売上が減少している。
,,▲,スナック（経営者）,来客数の動き,・好天の花見シーズンで人出が多かったが、来客数は少なく、下旬には市議会議員選挙が行われたため、好調であった前年同月の７割程度に落ち込んだ。来客のない日が３、４日あったが、これは20数年前に営業を開始して以来、初めてのことである。
,,▲,観光型旅館（スタッフ）,来客数の動き,・４月は宿泊人数が大幅に前年を下回っている。また、前月から宿泊単価が低下傾向にある。
,,▲,旅行代理店（従業員）,販売量の動き,・中国のデモの影響により、中国旅行の見合わせがかなり発生している。
,,▲,タクシー運転手,来客数の動き,・花見や夜桜見物の客は天候に恵まれて、例年になく人出が多く、また歓迎会の開催も多かった。しかし、ほとんどの人はマイカー、代行運転や最終のバスで帰り、人出の多かった割にはタクシーの利用が少なかった。
,,▲,テーマパーク（職員）,来客数の動き,・愛知万博の影響で周辺の旅館・ホテルの宿泊客が少なくなっている。この影響を受けて当会場への来場者数もあまり良くない。
,,×,テーマパーク（職員）,来客数の動き,・４月に入り愛知万博による逆風が本格化し、来場者数は前年同月比で２割の減少となった。
"企業
動向
関連

(北陸)",,◎,－,－,－
,,○,食料品製造業（企画担当）,受注価格や販売価格の動き,・新商品の価格帯が上向いているなかで、販売量も堅調に推移している。安さだけでは購買に結び付かず、逆に高くても価値のあるものに対して購買意欲が顕在化している。
,,○,化学工業（総務担当）,受注量や販売量の動き,・新規受注商品の販路が拡大した。
,,○,金融業（融資担当）,取引先の様子,・製造業では受注残がかなり多く、休日の稼働日数も前年より多くなっている。
,,○,司法書士,取引先の様子,・４月は特に不動産取引の依頼が多かった。
,,□,繊維工業（経営者）,受注量や販売量の動き,・引き続き婦人服関係は全般に悪く、スポーツ関係も代わり映えしない。
,,□,プラスチック製品製造業（企画担当）,受注量や販売量の動き,・前年末からの製品価格の値上げ問題が順調に進まず、販売量も思うように伸びていない。
,,□,電気機械器具製造業（経理担当）,受注量や販売量の動き,・４月になっても受注が回復する兆しがない。
,,▲,繊維工業（経営者）,受注量や販売量の動き,・発注先が在庫水準に敏感で発注を抑えているため、ますます期近の商売となっている。先行き不透明感が更に強まっている。
,,▲,建設業（経営者）,競争相手の様子,・ピーク時に比べて、売上高が４分の１近くまで減った業者が見受けられる。また、前年は希望退職を募っていた業者が、今年は指名解雇を行っているなど、全般的に一段のリストラが行われている。
,,×,建設業（総務担当）,それ以外,・建築資材、特に鋼材価格の上昇が続いており、コストアップ分を受注価格にフルスライドすることが困難な局面が出ている。
"雇用
関連

(北陸)",,◎,－,－,－
,,○,求人情報誌製作会社（編集者）,求人数の動き,・３か月前に比べ、広告件数は約15％増加している。季節的要因と考えられるアルバイト・パート募集の増加に加え、若干ではあるが正社員募集も増加している。
,,□,人材派遣会社（社員）,求人数の動き,・全体的に求人依頼は堅調に推移している。登録者数に大きな変化はないが、ＣＡＤ、経理関係の有資格者など、スキルの高いスタッフの募集が困難な状況である。
,,□,新聞社［求人広告］（担当者）,求人数の動き,・４月の求人広告は前年比約５％減少している。
,,□,職業安定所（職員）,採用者数の動き,・就職件数が前年同期比で7.4％減と伸び悩んでいる。
,,□,学校［大学］（就職担当）,求人数の動き,・学生の就職活動が前年度と同様に早くなっている。
,,▲,－,－,－
,,×,－,－,－
,,,,,
　７．近畿（地域別調査機関：りそな総合研究所（株））,,,,,
,,,,,（－：回答が存在しない、＊：主だった回答等が存在しない）
分野,,景気の現状判断,業種・職種,判断の理由,追加説明及び具体的状況の説明
"家計
動向
関連

(近畿)",,◎,コンビニ（経営者）,来客数の動き,・来客数の増加に対して在庫を増やしたことで相乗効果が生まれ、売上がより一層伸びてきている。
,,○,商店街（代表者）,それ以外,・ゴールデンウィークを控えて恒例のセールを開催した。来客数が増加し、店内の高額品の売行きが好調で、前年比118％にアップした。
,,○,一般小売店［時計］（経営者）,単価の動き,・今月は近隣で大型ショッピングモールがグランドオープンしたことで、その影響を心配していたが、結果的には悪くなかった。オープニングセールで来店した人々が、欲しい物がない等の理由で当店へ回ってきた。さらに、平均単価も平月にしては高かった。
,,○,百貨店（売場主任）,販売量の動き,・各ゾーンとも全般的に順調に推移し、春物商材の後ずれと夏物商材の前倒し傾向により、４月は衣料全体の動きが良かった。
,,○,百貨店（営業担当）,お客様の様子,・祖母から子や孫たち１人１人に高級時計を贈ったり、同居のために家具を買ったりと、ペイオフの影響ではないかと思われる動きが出てきている。
,,○,スーパー（広報担当）,販売量の動き,・行楽関連商品、特に花見弁当が好調である。前年の高気温の反動で夏物商材の動きは低調だが、前年４月よりスタートした消費税総額表示による買い控えの反動もあり、全体として好調である。
,,○,コンビニ（経営者）,来客数の動き,・突然の陽気と桜の遅咲き、雨が少なく花見の期間が２週間に及んだこと等で、行楽に出向く人が多かったほか、週末の天候が良かったことで売上が伸びた。商品単価も少しずつ回復基調となり、特におにぎりに関しては、具や米にこだわった高品質の商品がよく売れた。その一方で、100円おにぎりは売行きが下降傾向にある。
,,○,コンビニ（店長）,お客様の様子,・客の表情が少し明るくなり、財布を出す時も不景気を口に出さなくなった。使うお金は少ないものの余裕が感じられ、つり銭の小銭を寄付する余裕も出てきている。
,,○,衣料品専門店（営業・販売担当）,販売量の動き,・既存客からのオーダースーツの注文数量が増加し、また新規客も増加している。
,,○,その他専門店［医薬品］（経営者）,来客数の動き,・季節的なこともあるが、花粉症による鼻炎などで目薬、マスクなどの鼻炎商品の売上が好調である。また、健康食品、ダイエット、美容の関連で、エネルギー補給商品であるコエンザイムＱ10、アルファリポ酸の健康食品がよく売れている。特に化粧品関連では美白商品の動きが良い。
,,○,都市型ホテル（営業担当）,来客数の動き,・宿泊は前月に続いて好調で売上目標をクリアした。単価の低いアジアの団体やインターネット予約等で稼働率を上げているため、平均販売室料は下がり気味であるものの、売上ではプラスとなった。個人旅行客に少し勢いがなくなってきているのは、愛知万博の影響があるものとみられる。宴会に関しては一般宴会の調子が良く、前月に続いて婚礼の件数が伸びたことで売上目標をクリアした。
,,○,旅行代理店（広報担当）,販売量の動き,・愛知万博の開幕やゴールデンウィークの日並びの良さが影響してか、ゴールデンウィークを中心に４月から６月の旅行取扱人数が、国内旅行、海外旅行とも前年より概ね１割増加している。
,,○,通信会社（社員）,お客様の様子,・地上デジタル放送関連の認識が広まるにつれ、この機会にケーブルテレビに加入したいと考える人が増えている。
,,○,美容室（店長）,販売量の動き,・新しい客がなかなか増えない状況であるが、セット販売を行っているホワイトニング化粧品の売上が堅調であった。
,,○,その他サービス［ビデオ・ＣＤレンタル］（エリア担当）,販売量の動き,・ＣＤの物販売上が新商品投入不足のため前年割れとなったが、レンタルは好調である。
,,○,住宅販売会社（経営者）,単価の動き,・実需かどうかは判断に苦しむが、確実に土地の仕入単価は上昇傾向にある。
,,○,その他住宅［情報誌］（編集者）,お客様の様子,・新築マンションの販売在庫は引き続き低いレベルで推移しており、2002年秋頃の半分以下の水準になっている。デベロッパー各社の決算も好調の様子である一方、不動産相場の先行き上昇感から新規発売のペースは鈍っており、品薄感が出てきている。
,,□,商店街（代表者）,お客様の様子,・暖かくなって人出はあるが、夜の引きが早いため売上が伸びない。
,,□,一般小売店［精肉］（管理担当）,お客様の様子,・気温が一定しないので食べる物の傾向が定まらず、商売の仕掛けが上手くいかない。特に、精肉においては気温が下がれば鍋商材で、上がれば焼肉という傾向がある。また、牛肉の相場が年明けから下がらず、ゴールデンウィークを前に更に上昇していることから、思い切ったセールも実施しにくい。
,,□,一般小売店［衣服］（経営者）,お客様の様子,・春物の売行きはかなり低調で、むしろ客の目は夏物に動いている感がある。
,,□,百貨店（売場主任）,販売量の動き,・天候の不順により、相変わらずファッションの季節品の動きが鈍い。しかし、月後半になってサンダルや帽子などの季節品が動きだした。
,,□,百貨店（売場主任）,お客様の様子,・部門やアイテムによりばらつきがあるが、紳士の衣料関係は気温の上昇とともに上向いてきた。ただ、子供の衣料関係は従来になく不調である。
,,□,百貨店（サービス担当）,お客様の様子,・今月も衣料品関連を中心に苦戦している。また、少子化で子供服のほか玩具等の教養商材が不振であり、客単価は上がっているものの販売量の減少で苦戦している。しかし、全体としては食料品の好調により前月並みの水準を確保している。
,,□,スーパー（店長）,お客様の様子,・前年は４月から導入された消費税総額表示に対して、価格が高くなったという客の感覚があり、売上への影響がみられた。今年はその反動で売上は前月より若干良い。しかし、本質は変わっていない。
,,□,スーパー（経理担当）,販売量の動き,・これまで不調であった日用雑貨や婦人、紳士衣料が比較的好調である。その一方で、生鮮部門は今一つで、特に鮮魚部門は不振であった。全体としては前年実績を上回る傾向を維持している。
,,□,家電量販店（企画担当）,単価の動き,・デジタル家電関連、薄型テレビなど相変わらず好調であるが、単価は毎月下落している。その他、空気清浄機、電子レンジの売上も前年を上回っているが、全体をけん引するほどではない。
,,□,乗用車販売店（営業担当）,お客様の様子,・新型車が売れているので、販売台数は前年より少し多めに推移しているが、商売をしている客が古くなった車を仕方なく乗り換えている感がある。
,,□,その他飲食［コーヒーショップ］（店長）,来客数の動き,・来客数が前年比で２％～５％の減少傾向であるのに対し、客単価が２％～５％で上昇した結果、売上は横ばいとなった。決して景気が上向いているとは感じられない。
,,□,観光型旅館（経営者）,単価の動き,・数年前からみると来客数は減少しているが、近隣にレジャー観光スポット等があるため、極端に落ち込むこともなく、客単価も安定してきている。
