Ⅰ．景気の現状に対する判断理由等,,,,,
,,▲,繊維工業（総務担当）,取引先の様子,・販売先からの発注額が30％減少している。消費者ローンの契約に対する規制が厳しくなり、小売販売の減少している影響が大きい。
,,▲,繊維工業（団体職員）,受注量や販売量の動き,・地域特産のタオルの最需要期であるにもかかわらず、受注量が減少している。さらに、綿糸や原油の高騰で製造コストが上昇している一方、価格転嫁が進んでおらず、採算は更に厳しくなっている。
,,▲,窯業・土石製品製造業（経営者）,受注量や販売量の動き,・ドリンクや健康食品に使われている茶色の瓶については、受注や販売が大きく落ちてきている。
,,▲,金属製品製造業（営業担当）,競争相手の様子,・建築確認申請の認可が遅れているのに伴い、建築着工戸数の減少が続いている。
,,▲,建設業（経営者）,競争相手の様子,・建築確認申請に対する審査の厳格化で工事が停滞しており、いつ着工できるか分からない状況である。
,,▲,輸送業（営業所長）,受注量や販売量の動き,・年末が近づいているものの、例年どおりの荷動きがみられない。
,,▲,金融業（営業担当）,取引先の様子,・月下旬に寒くなったことから、紳士服製造業では冬物衣料の出荷が増えている。一方、食品スーパーは商品の値上げによって売上が増加しているものの、あくまで自然増であり、利益は増加していない。また、建築基準法の改正で建築確認の認可が遅れている影響で、不動産業、建設業では売上が大きく減少している。
,,▲,不動産業（経営者）,取引先の様子,・依然として、分譲マンション用地や分譲住宅用地の取得意欲は旺盛であるが、金融機関による融資の姿勢が厳しくなっており、動きが慎重になってきている。
,,▲,新聞販売店［広告］（店主）,受注量や販売量の動き,・折り込み件数が減少しているほか、新築マンションも入居率が悪く、部数増につながらない。
,,▲,広告代理店（営業担当）,受注量や販売量の動き,・例年、年末に向けて受注が増える時期であるが、今年は動きが悪い。特に、秋に比べると良くない状況である。
,,▲,広告代理店（営業担当）,受注量や販売量の動き,・年末に向けた広告出稿が予想したほど伸びていない。
,,▲,経営コンサルタント,取引先の様子,・住宅着工戸数が大幅に減少するなか、住宅業界全体で需要が冷え込んでいる。
,,▲,経営コンサルタント,取引先の様子,・堺市内のクライアントをみると、中小の小売業では仕入価格の上昇に対し、販売価格を値上げせざるを得ない状況にある。ただし、客は値上げに抵抗感があり、安売り店へ行く傾向が出ている。一方で中小の製造業は、大手電機メーカーの進出によるビジネスチャンスを探る機運が高まっている。実際に、関連企業の進出や従業員住宅の手配をにらんだ商業施設の開発計画も進んでおり、市内の不動産業界は活気付いている。
,,▲,その他非製造業［機械器具卸］（経営者）,競争相手の様子,・建築基準法改正の影響で工事が進んでおらず、中小の工務店の動きが悪い。
,,×,金属製品製造業（管理担当）,取引先の様子,・建築基準法の改正で着工案件が減少し、受注が大幅減となっている。
,,×,その他製造業［履物］（団体役員）,受注量や販売量の動き,・問屋からの定期的な注文が入って来ず、輸入品との競合も更に激化している。
"雇用
関連

(近畿)",,◎,－,－,－
,,○,職業安定所（職員）,それ以外,・大阪の有効求人倍率は1.25倍と前月から0.05ポイント低下したものの、１倍を超える高水準が続いているなど、雇用失業情勢の改善傾向は続いている。
,,○,学校［大学］（就職担当）,求人数の動き,・求人全体は増加傾向が続いているが、中堅企業からの追加求人や、中小零細企業における未充足分が中心となってきた。
,,□,人材派遣会社（経営者）,求人数の動き,・年末の忙しさは例年と変わらず、人手不足の状況も続いている。一方、派遣契約の延長確認はこれまで１か月前に行ってきたが、企業が早めに延長する動きが出てきている。
,,□,人材派遣会社（経営者）,求人数の動き,・派遣先企業からの求人数は１けた台の伸びで堅調に推移しており、都市部では需要に見合った登録者の確保に努めている。
,,□,人材派遣会社（支店長）,求職者数の動き,・今月に入って、アクセサリーブランドなどからクリスマスシーズンの短期の応援要請が増えているなど、受注は増加傾向にある。ただし、販売職に対する求職者の人気が下がってきており、前年よりも求職者の確保に苦労している。
,,□,職業安定所（職員）,求人数の動き,・窓口では、ガソリンなどの値上げによる直接的な反応はみられないものの、求人申込数からは景気が調整期に入った感がある。
,,▲,求人情報誌製作会社（営業担当）,求人数の動き,・年末商戦に向けて、お歳暮の配送や飲食、サービス業などでの求人の増加が予想されたが、あまり増加がみられない。
,,▲,新聞社［求人広告］（担当者）,周辺企業の様子,・企画広告やイベントに伴う売上は好調であるものの、通常紙面の売上が伸び悩む傾向にある。
,,▲,新聞社［求人広告］（担当者）,周辺企業の様子,・売上は増えたものの、クライアント全体が経費削減傾向にあり、低価格の契約が増えているため、利益率や利益額がかなり落ち込んでいる。
,,▲,新聞社［求人広告］（担当者）,それ以外,・関西の企業からの新聞広告出稿が、前年比で減少している。
,,▲,新聞社［求人広告］（営業担当）,周辺企業の様子,・既存の業務では成果が上がりにくくなってきており、試行錯誤を繰り返している企業が増えている。それに伴い、新聞の求人広告もかなり減少している。
,,▲,職業安定所（職員）,周辺企業の様子,・原油高騰による影響について、500台を保有するバス会社からは、燃料費が１億数千万円上昇した前年度よりも、更に厳しくなるとの声が聞かれる。
,,▲,職業安定所（職員）,求人数の動き,・求人数はこれまで緩やかに減少していたが、10、11月と減少幅が大きくなっている。
,,▲,民間職業紹介機関（職員）,求人数の動き,・８～９割が建設業に依存している日雇求人数では、前年比20％程度の減少が続いている。建築基準法の改正に伴う工事の遅れにより、日雇労働者や路上生活者にまで影響が及んでいる。
,,×,－,－,－
,,,,,
　８．中国（地域別調査機関：（社）中国地方総合研究センター）,,,,,
,,,,,（－：回答が存在しない、＊：主だった回答等が存在しない）
分野,,景気の現状判断,業種・職種,判断の理由,追加説明及び具体的状況の説明
"家計
動向
関連

(中国)",,◎,－,－,－
,,○,百貨店（営業担当）,単価の動き,・今月下旬から気温も低下し、コート・アウターがたくさん売れた。
,,○,百貨店（販売促進担当）,販売量の動き,・11月の初旬は、10月からの低迷を引きずっているような低水準の売上であったが、11月下旬になり、寒さが本格的になってきたこともあって、売上が増加している。前年を上回る売上の日が多くなってきた。
,,○,百貨店（売場担当）,来客数の動き,・ガソリン代が値上げになったため、遠出の行楽を控え、近くで買物をする客が増えた。また、屋根付きの駐車場があるので、雨が降ると来客数が増加する。
,,○,百貨店（販売担当）,来客数の動き,・近隣商業施設のオープンに伴い、この１～２か月減少していた来客数が、３か月目に入りほぼ前年並みに戻ってきた。
,,○,スーパー（総務担当）,来客数の動き,・前年に比べ原油高騰による商品の値上げや、野菜の単価高止まりにもかかわらず、来客数が前年比で1.2％上昇している。
,,○,コンビニ（エリア担当）,販売量の動き,・下半期から新規の店舗が売上に寄与し始めており、良好に推移してきている。既存店の前年比もそれなりに伸びているので、今年いっぱいくらいは良い状態が続く。
,,○,自動車備品販売店（経営者）,来客数の動き,・季節的な商品の動きは当然としても、他の高額商品の動きも良く、また来客数もここ数か月の動きより良く、前年の水準を上回っている。
,,○,その他専門店［カメラ］（店長）,来客数の動き,・まだまだ良くないが以前よりは来客数、プリント枚数、売上に、回復傾向が現れてきた。
,,○,都市型ホテル（経営者）,来客数の動き,・宿泊については、石見銀山効果で10月、11月と客が多かった。
,,○,旅行代理店（営業担当）,お客様の様子,・経済団体等の視察が多く、また個人による年末年始の旅行の予約も多い。
,,□,商店街（代表者）,来客数の動き,・商店街を通行する人の数が減少し、それに伴い来客数も減少している。
,,□,商店街（代表者）,販売量の動き,・３か月前はちょうど季節の変わり目にあたり判断が難しいが、客の様子や商品の動きを見ていると変わらない。
,,□,商店街（代表者）,お客様の様子,・寒さが来ているので、防寒系への注目度は高い。ただし気温次第である。
,,□,一般小売店［茶］（経営,お客様の様子,・客の消費動向には厳しいものがあり、何か突破口がないか必死で知恵を絞っているが、難しい。
,,□,百貨店（電算担当）,販売量の動き,・11月の売上は前年並みだった。客は、食品物産展に非常に高い関心があり、売上に貢献した。衣料品は気温が高く冬物衣料の出足が悪い。大体において財布のひもが固い一方、高級品が売れており、二極化が進行している。
,,□,百貨店（売場担当）,販売量の動き,・今月は気温が比較的高めに推移し、防寒商品を中心に苦戦が続いているが、アパレル関連や防寒もの以外の身の回り品・化粧品などは好調に推移している。ただ売場外販売において、高額バッグやアクセサリーなどは厳しい。
,,□,百貨店（購買担当）,お客様の様子,・食品部門については、原油の高騰でそれぞれの食材が値上げになるという情報があっても、好調に推移している。特に、北海道物産展やご当地グルメといった催事では、来客数も多く前年を上回っている。しかし、衣料・雑貨関連では客の財布のひもが厳しいのか、まとめ買いも少なく前年と比較しても客単価が数千円落ちている。
,,□,スーパー（店長）,販売量の動き,・ここ半年以上、販売点数が前年比101～102％と推移している。この傾向はしばらく続きそうである。ただし、各部門で若干値上げの傾向があり、この影響が出ることが予想される。
,,□,スーパー（店長）,単価の動き,・客単価は、前年比98.8％と１％近く低下した。特に石油製品・ガソリンが上がった時点から、客が安い商品を求めるようになり、食品の１品単価が低下した。
,,□,コンビニ（エリア担当）,お客様の様子,・今月は地域フェアを実施し、菓子・食品・飲料などを販売したが、低価格商品でも、客は必要な物しか手を出さなかった。
,,□,衣料品専門店（地域ブロック長）,販売量の動き,・初旬に秋物が売れ出したと思ったが、中旬以降売上が止まり、冬物の動きも止まったままである。
,,□,家電量販店（店長）,単価の動き,・全体的な数字は前年並みに推移したが、１品単価は低下している。あまり好調とは言えない。
,,□,乗用車販売店（統括）,販売量の動き,・11月は販売台数で前年を若干上回ったが、他社の新車効果及び自社の販売施策によるもので、購買意欲が喚起されたものではない
,,□,乗用車販売店（営業担当）,来客数の動き,・既納客の乗換え状況の鈍さもさることながら、新規来客数が一向に伸びない。
,,□,乗用車販売店（サービス担当）,来客数の動き,・土日の店頭への来客数が、例年の70％から80％程度である。平日はほとんどない。
,,□,その他専門店［スポーツ］（経営企画）,販売量の動き,・取引点数が既存店で前年比100.9％であるが、前年11月に開店した自社店と競合している事を考慮すると、ほぼ前年並みと考えられる。
,,□,その他小売（営業担当）,単価の動き,・値上げをしたが、売れるものは販売単価が変わらない小さな商品に移っている。
,,□,その他飲食［ハンバーガー］（経営者）,来客数の動き,・来客数は前年と比べ２けたの伸びが続いており、基調は変わっていない。
,,□,観光型ホテル（スタッフ）,来客数の動き,・シーズンに入って前年より宿泊者、館内利用者が増えているが、客単価が若干落ちている。宿泊代は標準値であるが、お土産や館内での飲食などの費用が落ちている。
,,□,都市型ホテル（総務担当）,お客様の様子,・一般宴会及び婚礼部門においては、ある程度の増加傾向は感じられるものの、重油高騰が食材等に転嫁されており、売上が増加しても、それが収益に反映されていない。どちらかと言えば、マイナスイメージが大きい。
,,□,タクシー運転手,販売量の動き,・10～11月にかけて、観光客は前年に比べて多かったし、学会等でタクシーの利用客も増加したのに、売上は前年と変わらない。ここ３～４年、売上が前年と同じという状態が続いている。
,,□,タクシー運転手,お客様の様子,・行楽シーズンにふさわしい暖かい天候が続き、土・日・祝日は客が集中しているが、公共交通機関を利用する人が多く、タクシーの利用はあまりない。
,,□,通信会社（総務担当）,お客様の様子,・デジタル契約が、客に様子見の傾向があること、料金面の割高感等から伸び悩んでいる。
,,□,テーマパーク（財務担当）,来客数の動き,・来客数はほぼ前年度並みで推移しており、売上等をみても上向いているとは言えない。ただ、目立ったイベントも実施していない状況を考慮すれば、まずまずの結果といえる。
,,□,テーマパーク（業務担当）,来客数の動き,・「秋の行楽シーズン」が無かったこと、ガソリン価格の高値更新など、マイナス要因が重なり、ここ数か月は苦しい状況が続いている。
,,□,ゴルフ場（営業担当）,単価の動き,・単価の変動はあるものの来客数は変わらない。
,,□,設計事務所（経営者）,お客様の様子,・品物が動かない。購入意欲が全くない。価格の安い特価品しか売れない。
,,▲,商店街（代表者）,お客様の様子,・客は値段以上の付加価値を強く求めている。購買のハードルが日々高くなっている。
,,▲,一般小売店［靴］（経営者）,単価の動き,・高額商品を購入する客は、購買する頻度が確実に少なくなっている。それ以外の客は、ますます低価格商品の買物のみになっている。
,,▲,一般小売店［紙類］（経営者）,お客様の様子,・客の購買意欲が落ちている。手にとっても、なかなか購入には至らない。
,,▲,一般小売店［酒店］（経営者）,お客様の様子,・情報交換するなかでも、人の動きが悪く、販売量が低迷している様子が見て取れる。
,,▲,一般小売店［印章］（営業担当）,来客数の動き,・会社関係の注文は動きが多少あったが、この時期一番の売上であるはずの年賀状印刷が前年に比べても激減している。年賀はがきを準備して待っているが、持込はがきが多い。また、郵政民営化による予約販売の影響も大きい。
,,▲,百貨店（営業担当）,お客様の様子,・11月は後半になっても日中は18度前後と暖かく、日中だけの外出だとジャケット程度でよいため、主力商品のコートの動きが悪い。客単価も低下し、特にミセスのボリュームゾーンに影響が出ている。
,,▲,百貨店（営業担当）,単価の動き,・販売数量は前年並みだが、客単価が連続して低下している。
,,▲,百貨店（販売促進担当）,お客様の様子,・ガソリン等の値上げ、また食品業界の各種不祥事等マイナス要素が多い。物産展においても、産地・賞味期限の確認等、以前にも増して客の購買姿勢はシビアになってきている。ポイント日への集中購買、お歳暮早期割引が人気を集めるなど、価格に対してもよりシビアな目が向けられてきている。
,,▲,百貨店（売場担当）,販売量の動き,・11月中旬の寒さで幾分かはミセス防寒衣料、手袋、マフラーが上向いたが力強さはなく、店全体で前年比99％となった。
,,▲,スーパー（店長）,販売量の動き,・マヨネーズ・カレーなど、値上げした商品の動きが非常に悪い。
,,▲,スーパー（店長）,販売量の動き,・買上点数の減少に伴い、客単価も低下している。客の様子も、いろいろな商品の値上げで厳しくなっている。
,,▲,スーパー（店長）,来客数の動き,・客単価は前年を上回るが、来客数に関しては、特に週末の落ち込みが大きく、トータルの売上では前年を下回っている。
,,▲,スーパー（経理担当）,販売量の動き,・客の買う商品について、高い物と安い物との二極化が進んでいる。
,,▲,スーパー（財務担当）,来客数の動き,・既存店における来客数が前年の98～99％の状況が続き、既存店での売上の前年割れが続いている。
,,▲,スーパー（販売担当）,単価の動き,・食料品に限らず、雑貨等でも価格の変更や内容量の減少など規格の変更が続いている。
,,▲,コンビニ（エリア担当）,来客数の動き,・来客数の前年比が、３か月前と比較し、4.5ポイントの下落となり、全体の売上もほぼ同じ落ち込みとなっている。
,,▲,衣料品専門店（販売促進担当）,販売量の動き,・今月は売上、来客数共に、暖冬で例年より落ち込んだ前年の85％と、更に落ち込んでいる。まだ例年より暖かかったため、特にメンズのアウターの動きが悪く、客は見には来るが買うまでには至らない厳しい状況である。２万円以上のアイテムが苦戦している。
,,▲,家電量販店（店長）,販売量の動き,・来客数が前年比で約１割減少している。
,,▲,家電量販店（店員）,来客数の動き,・平日の売上がかなり厳しい。ただしこれから年末に向け売上が少しは増えると思われる。
,,▲,家電量販店（予算担当）,販売量の動き,・薄型テレビの伸びが落ちてきている。前年同月が好調であったことの反動もあるが、今後の動きに注目したい。一方でＤＶＤレコーダーが再び活発になっている。
,,▲,乗用車販売店（経営者）,お客様の様子,・固定客以外はほとんどが買い回り客で、価格の安い店に流れている。また、これだけ燃料費が高騰すると、コンパクトカー・軽四輪車指向が一段と強くなっている。
,,▲,乗用車販売店（統括）,販売量の動き,・原油高の高騰で、生活用品の値上げが報道されるなか、扱う商品が必ず必要なものでないため、買い控えか価格の安い商品へと流れる傾向が強くなった。
,,▲,その他専門店［布地］（経営者）,来客数の動き,・11月は前半暖かく、商品の動きが悪かった。後半は寒くなったが、ボーナス前とあって思うほど商品は動かなかった。
,,▲,一般レストラン（店長）,お客様の様子,・平日の夜や週末の来客数が減少傾向にある。「ガソリンも高いから、あまり外に出られない」と客から言われた。
,,▲,スナック（経営者）,お客様の様子,・円高・株安の影響もあるが、やはり原油の高騰の影響が一番で、客の話題も株で損したとかガソリン代の値上がりといったようなことばかりである。
,,▲,都市型ホテル（従業員）,来客数の動き,・11月の繁忙月にもかかわらず、法人主催の宿泊団体予約が減少している。また前年開催された国民文化祭のようなイベントがなかった。
,,▲,都市型ホテル（スタッフ）,お客様の様子,・例年に比べ、企業での大きな忘年会は少なくなっており、個別の少人数の宴会が増えてきている。安い居酒屋が多く進出してきており、そちらに流れているようである。
,,▲,タクシー運転手,お客様の様子,・これから忘年会シーズンに入るが、飲食店でも売上の予定が立たないとか、先が読めない話をよく聞く。
,,▲,タクシー運転手,お客様の様子,・昼の動きはあまり変わらない。病院・買物の利用は変わらないが、法人関係の利用は激減している。夜は、深夜まで飲む客はビジネスホテル等を利用するなど、タクシーの利用は減少している。
,,▲,通信会社（総務担当）,販売量の動き,・ガソリン高騰、物価値上げ等に伴う消費者意識の変化などが影響し、販売量が一向に増加しない。
,,▲,美容室（経営者）,来客数の動き,・一般生活用品とガソリン代の値上げが響いているのか、来店周期が１か月延びている。３か月周期だった客が４か月周期になっている。
,,▲,美容室（経営者）,お客様の様子,・客との会話のなかで、景気の良い話はあまり出てこない。
,,▲,設計事務所（経営者）,来客数の動き,・収入の伸びが鈍化しているために、購買意欲が低い客が多い。
,,▲,設計事務所（経営者）,競争相手の様子,・建築基準法の厳格化の影響と、建築物価の高騰で業務の停滞が続いている。
,,▲,住宅販売会社（従業員）,お客様の様子,・展示場への来客数が減少し、客の購買意欲も減退し、様子見の傾向が強く現れている。
,,▲,住宅販売会社（経理担当）,それ以外,・来客数及び契約率共に悪くなっている。
,,×,商店街（代表者）,販売量の動き,・販売量が落ちている。来客数も少ない。
,,×,商店街（代表者）,お客様の様子,・所得が上がらないので、消費意欲も上がらない。
,,×,百貨店（売場担当）,販売量の動き,・催事の集客も悪く、高額品も売れない。
,,×,スーパー（店長）,来客数の動き,・前年比で、来客数が約10％減少した。また高校生・大学生といった低年齢層の客に、購買意欲の低下が見てとれる。
,,×,コンビニ（エリア担当）,単価の動き,・今月は来客数も減少し、さらに客単価も落ち込んだ。客の必要な物以外は買わないという傾向が、一層強くなっている。
,,×,衣料品専門店（経営者）,来客数の動き,・前月オープンした大型郊外店の影響がまだまだ続いている。
,,×,住関連専門店（広告企画担当）,お客様の様子,・買い控え・低単価・来客数の減少など悪い要素しか見えない。
