Ⅰ．景気の現状に対する判断理由等,,,,,
,,,,,
　景気の現状に対する判断の理由及びそれに対する追加説明等について、その主だったもの及び特徴的と考えられるものを取りまとめると以下のとおりであった。,,,,,
,,,,,
,,,,,
　１．北海道（地域別調査機関：（株）北海道二十一世紀総合研究所）,,,,,
,,,,,（－：回答が存在しない、＊：主だった回答等が存在しない）
分野,,景気の現状判断,業種・職種,判断の理由,追加説明及び具体的状況の説明
"家計
動向
関連

(北海道)",,◎,－,－,－
,,○,家電量販店（店員）,販売量の動き,・12月商戦が近いということで商品全体に動きがみられる。中でも薄型テレビは販売台数が前年より伸びている。
,,○,乗用車販売店（営業担当）,販売量の動き,・前年に比べて販売量が多い。来客数も前年より増えている。
,,○,その他専門店［医薬品］（経営者）,販売量の動き,・医薬品業界も値上げラッシュがあり、買いだめのような消費行動がみられる。また、例年よりもインフルエンザや風邪が流行していることから、関連商品が売れている。
,,○,旅行代理店（従業員）,販売量の動き,・年末年始の旅行の申込が前年に比べて増えている。
,,○,住宅販売会社（従業員）,お客様の様子,・今後予測される消費税率引上げに対しての反応が意外に強く、税率上昇前に住宅を買おうという客が増えてきたように感じる。
,,□,商店街（代表者）,お客様の様子,・11月は防寒衣料の最盛期であるが、前半は気温の高さから客の購買が少なかった。中旬以降の冷え込みで一時的に売上は増えたが、下旬に入るとバーゲン待ちの客がみられるようになり、数字が今一つ伸びきらない。
,,□,百貨店（売場主任）,お客様の様子,・気温が高いことの影響で、相変わらずコート、ジャケット等の動きが鈍い。客は、まだ商品を買おうという状況にはなっておらず、様子を見ているという状態である。
,,□,スーパー（企画担当）,お客様の様子,・原油価格高騰の影響に伴うガソリン、暖房用灯油の大幅値上げが家計を直撃しており、消費に大きな影響を与えている。
,,□,スーパー（役員）,単価の動き,・過去３か月、売上に大きな変化はないまま推移している。客単価や１人当たりの平均買上点数も大きな変化は無く、前年比103％前後で推移している。
,,□,高級レストラン（スタッフ）,来客数の動き,・週末の客の入込は、前年を15％ほど上回っており、待ち時間も長くなっている。一方、ディナーについては前年を５％下回っており、月全体でみると来客数はほぼ横ばいとなっている。ただ、メニュー改訂の影響もあるのか、客単価は前年を７％上回り、健闘している。
,,□,高級レストラン（スタッフ）,お客様の様子,・３連休がある月は厳しいこともあり、夕食が前年並み、昼食が前年から30％のダウンとなった。食品や灯油の値上げも響いているようで、すすきのの高級店では、売上が悪いことから従業員を早めに帰すと聞いている。地方は閑散としており、特に大量降雪のあった旭川周辺では客足が遠のいたという話を聞いた。
,,□,スナック（経営者）,来客数の動き,・９～10月は繁華街への客足が遠のいており、前年と比べて売上がかなり落ち込んでいたが、11月は前年並みの売上となった。
,,□,旅行代理店（従業員）,お客様の様子,・ボーナス前のせいか、客の動きが鈍く、景気が上向いている様子はみられない。
,,□,タクシー運転手,来客数の動き,・例年11月は、初雪とともにタクシーの利用が増えてくるが、今年は初雪が例年よりも遅かったこと、また全般的に暖かい日が多く、雪の日が少ないことなどから、例年よりもタクシーの利用が少ない。
,,□,タクシー運転手,お客様の様子,・降雪期に入ることから需要の増加を見込んでいたが、12月の灯油代の大幅な値上げを控え、客は極力無駄な出費を控えているようであり、実車率が上がってこない。
,,▲,商店街（代表者）,販売量の動き,・客の低単価志向は強く、商品の動きは横ばい傾向にある。現況においては、販売量の増加は期待できない。
,,▲,商店街（代表者）,お客様の様子,・冬物衣料のシーズンに入り、本来なら動きが良くなるはずだが、灯油やガソリンの値上がりに加えて、各種製品の値上がり傾向がみられることから、客が購買に慎重になっている。
,,▲,商店街（代表者）,お客様の様子,・客の選択が更にシビアになっており、より安い物を選ぶようになっている。
,,▲,一般小売店［酒］（経営者）,販売量の動き,・原油高の影響で灯油やガソリン、食品など様々な分野で値上げが行われており、冬を迎える消費者に心理的、経済的圧迫感を与えている。我々の業界は消費者が可処分所得を向けることで成り立っているので、どうしても消費が減退していく情勢にある。
,,▲,百貨店（売場主任）,お客様の様子,・客単価が低下しているほか、週末の家族客が非常に減っている。特に30～40代の客の減少が目立っている。
,,▲,百貨店（販売促進担当）,販売量の動き,・冬を前にして、灯油価格の上昇や食料品などの相次ぐ値上げが消費マインドを低下させている。ファッション売場では単品での購買が増えており、コーディネートアイテムを勧めてももう１品がなかなか売れない。価格弾力性の小さい高額品も例外ではない。
,,▲,スーパー（店長）,販売量の動き,・前月よりは若干良かったものの、３か月前と比較すると依然として低迷している。
,,▲,コンビニ（エリア担当）,単価の動き,・単価が低下しており、安売り商品ばかりが売れている。また各カテゴリーにおいて高価格の商品が軒並み売れないという傾向もみられる。
,,▲,コンビニ（エリア担当）,単価の動き,・来客数は前年並みで推移しているが、消費者の買い控えが目立っており、単価が継続して低下している。
,,▲,コンビニ（エリア担当）,お客様の様子,・来客数は前年並みだが、客単価が低下している。客は特売商品の価格に非常に敏感であり、安い商品を狙って購入しているようである。
,,▲,衣料品専門店（店長）,販売量の動き,・灯油の値上がりが大分響いているのか、催事等でも客の動きは決して良くはない。来客数も大きく落ち込んでいる。
,,▲,家電量販店（地区統括部長）,販売量の動き,・10月からの地方都市での地上デジタル放送の開始に伴い、薄型テレビ等のデジタル家電の需要増加を期待していたが、結果は前年から５％のアップにとどまっている。一方、白物家電はここ半年ほど、前年を大きく下回っており、全体としては前年を下回っている。
,,▲,乗用車販売店（従業員）,販売量の動き,・ガソリン等の値上がりの影響から、車の維持費が増加しており、乗換えに結び付かなくなっている。
,,▲,その他専門店［ガソリンスタンド］（経営者）,単価の動き,・原油価格の急騰により、石油製品の価格が高騰している。
,,▲,観光型ホテル（経営者）,来客数の動き,・来道客数の減少を受けて、道外からの団体客の集客が落ち込んでいる。道内客は依然として回復しておらず、特に企業の観楓会などは大きく減少している。
,,▲,観光型ホテル（経営者）,来客数の動き,・前年に比べて来客数がやや減少している。その中身をみると、個人客は安定的に推移しているが、団体客、とりわけ国内客が目立って減っている。
,,▲,観光型ホテル（スタッフ）,単価の動き,・北海道観光の動向をみると、札幌、旭川方面では観光客が前年を上回っているが、地方の動きが悪く、全体としては観光客が減少している。また、観光客数の減少を補うための価格ありきの営業政策により、消費単価の伸び悩みがみられており、売上を維持するのが精一杯の状況である。
,,▲,旅行代理店（従業員）,販売量の動き,・10月から販売量の増えない状況が続いている。景気が安定しないことから、先行きに不安を持っている客が積極的に動かない様子がうかがえる。
,,▲,タクシー運転手,販売量の動き,・運賃収入が下げ止まらない。
,,▲,美容室（経営者）,販売量の動き,・関連商品の売上が前年よりも１割程度下がっており、必要な物以外は購入しないという雰囲気が感じられる。
,,▲,設計事務所（所長）,お客様の様子,・厳寒期を控えての灯油やガソリンの値上がりで、客が生活の先行きに不安感を感じていることをひしひしと感じる。
,,×,高級レストラン（スタッフ）,来客数の動き,・前月同様、来客数は前年から10％ほど減少している。市内全体で利用客の減少が目立っており、12月に向けての利用控えなのか、判断が付かない。客単価を上昇させることで、どうにか売上は保っているものの、食材の高騰や消耗品の値上げも控えており、収支バランスの悪化が懸念される状態にある。
,,×,スナック（経営者）,来客数の動き,・11月は過去最低の来客数であった。周りの飲食店からも同様の話を聞いている。
,,×,美容室（経営者）,来客数の動き,・９～11月と来客数が前年から10％近く減少している。
,,×,設計事務所（職員）,それ以外,・あまりの仕事量の少なさにより、他社との競争が厳しくなっており、価格や取引秩序のようなものが失われ始めている。
,,×,住宅販売会社（経営者）,来客数の動き,・モデルハウスへの来場者が極端に減っている。
,,×,住宅販売会社（従業員）,販売量の動き,・戸建志向の低下や金融機関からの借入条件の悪化、建築基準法の改正に伴う建築確認申請の遅れなどが経営に大きく響いている。
"企業
動向
関連

(北海道)",,◎,－,－,－
,,○,食料品製造業（団体役員）,受注量や販売量の動き,・消費者の海外商品に対する敬遠感の高まりから、国内の原材料使用による商品にシフトしており、当地の食品製造業は年末受注を含め、状況がやや良くなってきている。
,,○,出版・印刷・同関連産業（役員）,受注量や販売量の動き,・首都圏からの商談がこれまで以上に多くなりつつある。
,,□,輸送業（営業担当）,取引先の様子,・大半の取引先の生産に大きな変化は出ていない。飼料工場は、越冬用玉ねぎと生乳増量対策で出荷状況が良く、原料価格の高騰という要因を除くと順調である。
,,□,司法書士,取引先の様子,・不動産取引関連については、依然として低調であり、回復するような要因は見当たらない。
,,□,その他非製造業［鋼材卸売］（従業員）,受注量や販売量の動き,・回復の兆しも見えない状況である。来年２～３月以降の工事量の復活に期待をしているものの、特定企業のみの回復となる可能性も高く、楽観できる状態にない。
,,▲,家具製造業（経営者）,受注量や販売量の動き,・原油価格高騰の影響により、様々な物が高くなりつつあることや、建築基準法の改正による住宅着工数の減少が家具市場にも悪影響を与えている。
,,▲,輸送業（経営者）,取引先の様子,・燃油価格の高騰が続いているが、３か月前と比べると非常にシビアな状況となっている。
,,▲,輸送業（支店長）,取引先の様子,・建築基準法の改正による建築確認申請の遅れが問題となっているほか、個人住宅においては銀行からの融資不調により、住宅を建てられないケースが続発している。道内大手ハウジングメーカーの中には、銀行の審査を通るのは10人のうち２～３人というところも出てきている。銀行の審査基準が厳格化しているということもあるが、それだけ道内企業、従業員の状況が厳しくなっているということであり、今後も景況感が更に悪化すると見込まれる。
,,▲,通信業（営業担当）,取引先の様子,・取引先から受注がやや低調との話を聞く機会が増えた。取引先の状況をみると、社内的には経費削減を進めている一方で、客先からは価格低下要求が強まっているようである。
,,▲,金融業（企画担当）,それ以外,・設備投資は、自動車関連工場の新増設やホテル、オフィスビルの建設で増加している。しかし住宅着工の大幅な減少や、原材料価格の上昇が企業収益にマイナスとなっている。個人消費も、所得環境の厳しさに加え、ガソリン価格や灯油価格の高騰で家計の防衛意識が強まっており、停滞している。総じて景気は幾分後退している。
,,▲,広告代理店（従業員）,取引先の様子,・地場のカード会社の経営破綻、地元経済界の重鎮である会社社長の急逝等、景気が落ち込むマイナス要因が相次いだ。
,,▲,その他サービス業［システムハウス］（経営者）,受注量や販売量の動き,・新たな案件が出てこない。トラブルの応援のような話ばかりで先につながるような話が少ない。
,,▲,その他サービス業［建設機械リース］（営業担当）,受注量や販売量の動き,・建設工事量が減少しており、さらにこれに連動して価格競争が厳しくなっている。
,,▲,その他サービス業［建設機械リース］（支店長）,取引先の様子,・取引先の様子をみると、燃料高騰を始めとしたコストの増加を吸収しきれていない様子であり、設備投資にまで手が回らない状況にある。
,,×,＊,＊,＊
"雇用
関連

(北海道)",,◎,－,－,－
,,○,学校［大学］（就職担当）,求職者数の動き,・北海道の地場企業の採用は厳しい状況にある。ただ、関東や中部の企業においては、北海道支店や札幌支店といった支店での採用も行われており、そのような企業の求人動向は好調である。
,,□,求人情報誌製作会社（編集者）,それ以外,・求人広告に反応するのは年配者が多くなる傾向があり、18～25歳の求職者の応募率が減少している。地域の若年労働力が減少しつつあるのが気になる状況である。
,,□,職業安定所（職員）,求人数の動き,・有効求人倍率は８か月連続で前年を上回っているが、10月の倍率は0.49倍と依然として低水準である。
,,□,職業安定所（職員）,求人数の動き,・新規求人数は、前月比0.5％減、前年比1.6％減となっており、ほぼ横ばいで推移しているが、新規求職者数は３か月連続して減少しており、前年比2.9％減となった。求職者数は前年並みとなっているものの、求人数は前年を3.7％下回っている。
,,□,職業安定所（職員）,求人数の動き,・新規求人数、月間有効求人数とも12か月連続して減少している。
,,▲,人材派遣会社（社員）,求人数の動き,・年末に向け、例年であれば販売促進関係の派遣依頼がピークを迎えるが、今年は発注側の経費が削られているようで、例年より派遣の依頼が少ない。
,,▲,人材派遣会社（社員）,採用者数の動き,・仕事の依頼はあるものの、なかなか採用までに結びつかない。また、直接雇用の傾向があるものの、賃金が抑えられている。
,,▲,新聞社［求人広告］（担当者）,求人数の動き,・20日現在の状況であるが、前年比で２割近く求人件数が減っている。
,,▲,職業安定所（職員）,求人数の動き,・新規求人が減少傾向にあり、有効求人倍率は４か月連続で前年を下回っている。
,,×,－,－,－
,,,,,
　２．東北（地域別調査機関：（財）東北開発研究センター）,,,,,
,,,,,（－：回答が存在しない、＊：主だった回答等が存在しない）
分野,,景気の現状判断,業種・職種,判断の理由,追加説明及び具体的状況の説明
"家計
動向
関連

(東北)",,◎,家電量販店（店長）,来客数の動き,・来客数の増加とともに、大型商品の動きも良くなっている。全体的ににぎわいが出てきており、景気は上向きになってきている。
,,○,コンビニ（経営者）,販売量の動き,・前年比で客単価は100％と伸び悩んでいるが、買上点数は107％、売上は104％、来客数が103％と改善している。例年、８、９月と比べると売上が落ち込む時期であるにもかかわらず、本年は大分盛り返している。
,,○,衣料品専門店（店長）,来客数の動き,・ビジネス衣料は商品本位で購入する客層が主体であり安定していることに加え、カジュアル衣料についても品ぞろえの豊富さが認知されるようになり、来客数、買上客数などが増えている。
,,○,家電量販店（店長）,販売量の動き,・地上デジタル放送の試験放送が始まったこと、寒さが到来したことにより、映像関係、暖房関係の商品の動きが良くなっている。
,,○,乗用車販売店（経営者）,販売量の動き,・自動車販売では東京モーターショーの効果がみられ、来場促進から販売につながるケースが出てきた。整備関連も早めの降雪により需要が増えている。
,,○,その他専門店［靴］（経営者）,販売量の動き,・例年より早い積雪で、冬物の実用品がよく売れている。
,,○,観光型ホテル（経営者）,来客数の動き,・観光シーズンと忘年会シーズンの端境期に当たるが、本年はリニューアル効果もあって来客数は順調に伸びている。ただし、１人当たりの消費単価は低く、売上はそれほど伸びていない。なお、客層は建設関係の団体が目に付く。
,,○,住宅販売会社（従業員）,販売量の動き,・長期管理客からの受注が始まっている。
,,□,商店街（代表者）,お客様の様子,・10、11月と冬の訪れを感じる寒い日が多く、衣料品を中心に冬物関連商品が好調で、１年１か月ぶりに売上高が前年同月を上回った。しかしながら、景気が良くなっているというレベルには達していない。
,,□,一般小売店［書籍］（経営者）,単価の動き,・ドラマ化、映画化されたコミックや文庫などの低単価商品の動きはまずまずであるが、専門書など学術的な分野の苦戦が目立っている。
,,□,一般小売店［カメラ］（店長）,販売量の動き,・カメラの販売関係は新製品の発売もあり順調であるが、写真プリントは例年より受注が少なくなっており、トータルでは前年並みである。
,,□,百貨店（経営者）,販売量の動き,・秋物からコート、ブーツ、マフラーといった冬物に移行する時期であるが、中旬までは暖かい日が多く動きが鈍かった。降雪もあり、やや動きがみえたが、それ以降はまた暖かくなり、売上はそれほど伸びていない。
,,□,百貨店（売場担当）,単価の動き,・客は必要に迫られなければ買わないといった様子で、例えば冬物商材（防寒アイテム）で言えば気温が10度を下回ってからやっと購買意欲が湧く、という具合である。また、値段に対して非常にシビアであり、どのブランドの店舗でも色々と比較し、悩み抜いており、即決する客は少ない。
,,□,百貨店（経営者）,お客様の様子,・来客数の減少は無いが、まとめ買いは少なく、買い控えをしている様子がみられる。ただし、気温の低下、降雪により、冬物に動きが出てきており、総体的に大きな変化はみられない。
,,□,スーパー（経営者）,来客数の動き,・既存店の来客数は安定的に推移している。
,,□,コンビニ（経営者）,販売量の動き,・売上は前月比で116％となっているが、毎年恒例のボージョレーヌーボーの貢献が大きく、それを除けば引き続き厳しい状況が続いている。
,,□,コンビニ（エリア担当）,来客数の動き,・客単価は２～３％の改善がみられるようになっているものの、来客数が依然として前年実績に満たない状況が続いている。
,,□,コンビニ（エリア担当）,お客様の様子,・例えば、ボージョレーヌーボーの売行きが前年を大きく下回り、在庫が余っているなど、客は無駄なことに出費しないという傾向がみられる。
,,□,衣料品専門店（店長）,来客数の動き,・近隣の競合店が完全閉店したことにより来客数が10％程度伸びているものの、それ以外には何も改善していない。
,,□,乗用車販売店（経営者）,お客様の様子,・新規客、固定客共に来客数は前年と比べ悪くないが、来店してもお金を落としていく機会が少なく、売れるのはサービス価格のタイヤ交換のみということが多い。スタッドレスタイヤも今年は全く売れていない。
,,□,乗用車販売店（従業員）,単価の動き,・ガソリンや灯油が高くなり、車に掛けるお金が少なくなっている。
,,□,その他専門店［食品］（経営者）,販売量の動き,・前年並みの荷動きで推移しているが、実際には活発さが足りず、やや不満感が募っている状況である。
,,□,その他専門店［酒］（営業担当）,販売量の動き,・11月はもう少し飲食店の動向が盛り上がると予測していたが稼働率が低く、当てが外れた。全体の景気は変わらないが、天候不順の影響はあった。
,,□,都市型ホテル（スタッフ）,販売量の動き,・宿泊は単価アップを図るためネット価格を上げた影響で稼働率は下がっているが、大型婚礼、一般宴会でカバーしている。ビジネス客はネット価格に敏感に反応する。
,,□,都市型ホテル（スタッフ）,お客様の様子,・当社は設備投資の効果で売上が順調に推移しているが、設備投資ができない競合他社は売上が減少しており、業界全体ではパイが伸びているわけではない。
,,□,タクシー運転手,来客数の動き,・相変わらず客が少なく、特に深夜０時を過ぎると客足がぱったりと止まってしまう。
,,▲,商店街（代表者）,お客様の様子,・何回も下見して値段を確認してからでないと購入しないなど衝動買いは全くみられず、前月あたりからの傾向であるが、客の購買姿勢が非常に慎重になっている。一時期は弱まっていた価格に対する抵抗感が、数年ぶりに強まってきた。
,,▲,一般小売店［スポーツ用品］（経営者）,お客様の様子,・店頭販売は前年を15％下回っているなど、とにかく購買につながらない。
,,▲,一般小売店［医薬品］（経営者）,お客様の様子,・繁華街であるにもかかわらず、深夜が非常に静かになっている。ほとんどの客は早い時間に帰り、深夜の住人は店のオーナーか従業員だけで構成されているなど、非常に不思議な状況になっている。
