Ⅰ．景気の現状に対する判断理由等,,,,,
,,×,化学工業（経営者）,取引先の様子,・得意先の会合などに出席しても、悪い話しか聞かれず、悲壮感すら漂っている。
,,×,金属製品製造業（営業担当）,受注量や販売量の動き,・自動車関連の売上が、４～５か月前と比べて平均で３～５割減少している。
,,×,一般機械器具製造業（経営者）,受注量や販売量の動き,・当社には鉄鋼関連の顧客が多いが、大手製鉄所から受注済み案件のキャンセルがあった。当社にとっては年商の20％に相当する額で、大きな痛手となっている。
,,×,一般機械器具製造業（経営者）,受注量や販売量の動き,・見積案件が少なくなっている。
,,×,一般機械器具製造業（設計担当）,取引先の様子,・取引先からの請負業務を行っているが、取引先自体の受注量が極端に減っている。世界的な不景気の影響で、海外案件についても非常に不透明な状況である。
,,×,電気機械器具製造業（経営者）,受注量や販売量の動き,・企業にとって生命線の一つである販売量の変動が激しい。
,,×,電気機械器具製造業（企画担当）,受注量や販売量の動き,・11月に入って急に消費の勢いが落ちている。特にマンション関係の販売不振で、関連設備の売上が25％減少している。
,,×,電気機械器具製造業（企画担当）,取引先の様子,・ここ数か月は売上が減少している。今の商品構成では販売が伸びない。
,,×,その他製造業［履物］（団体役員）,受注量や販売量の動き,・食料品の値上げにより、靴下などの身の回り品の買い控えが進んでいる。
,,×,金融業（営業担当）,取引先の様子,・不動産業や建設業だけではなく、製造業やソフト関連のサービス業と、あらゆる業種で業績が悪化している。
,,×,不動産業（営業担当）,取引先の様子,・景気の悪化で、マンション業者や建売業者が値引きして販売せざるを得なくなっている。また、倒産した不動産業者から開発用地を買い取り、安く販売する業者も出てきている。それに伴ってマンションや戸建住宅、土地価格の低下が進んでいる。
,,×,新聞販売店［広告］（店主）,受注量や販売量の動き,・折込収入が前年比で２割近く減少している。
,,×,広告代理店（営業担当）,競争相手の様子,・前月に続き、同業他社の廃業や合併が相次いでいる。
"雇用
関連

(近畿)",,◎,－,－,－
,,○,－,－,－
,,□,－,－,－
,,▲,人材派遣会社（経営者）,求人数の動き,・求人件数が減少しているほか、製造業を中心に派遣契約の終了も増加している。
,,▲,人材派遣会社（経営者）,求人数の動き,・企業からの派遣依頼が減っている一方、派遣社員の応募は増えてきている。完全に需給バランスが崩れており、買手市場となりつつある。
,,▲,求人情報誌製作会社（編集者）,求人数の動き,・求人数の減少率が前年比で20％台後半と、東京、名古屋と変わらない水準まで悪化している。
,,▲,新聞社［求人広告］（担当者）,周辺企業の様子,・比較的堅調であった運輸関連の求人広告も減少傾向にある。新商品や新企画を投入してもセールスは難航しており、手詰まりの状態である。
,,▲,新聞社［求人広告］（担当者）,求人数の動き,・今までにない市場の落ち込みで、11月は創業以来で最低の売上となっている。
,,▲,職業安定所（職員）,求職者数の動き,・新規求職者が前年比で５か月連続の増加となり、うち事業主都合の離職者は９、10月に続いて20％以上の増加となっている。
,,▲,職業安定所（職員）,求人数の動き,・新規求人数は前年比で22.0％の減少であり、特に製造業、運輸業、サービス業の減少幅が大きい。これで14か月連続の減少であるほか、有効求人倍率も同様に14か月連続で低下している。
,,▲,職業安定所（職員）,求人数の動き,・有効求人倍率が低下を続けている一方、新規求職者も７月以降は増加傾向にある。
,,▲,民間職業紹介機関（支社長）,採用者数の動き,・採用面接の実施件数は前年並みであるが、合格数が減少している。合否が判明するまでの期間も長くなっており、採用者数は前年比で80％程度まで落ち込んでいる。
,,▲,学校［大学］（就職担当）,求人数の動き,・求人企業による来訪が極端に減少している。
,,×,人材派遣会社（支店長）,求人数の動き,・前月以降、企業からの求人依頼が例年にないほど減少している。
,,×,求人情報誌製作会社（営業担当）,求人数の動き,・企業収益の悪化に伴って、夏ごろから有期雇用求人の採用中止が始まり、直近では業種を問わず増えてきている。
,,×,新聞社［求人広告］（担当者）,それ以外,・新聞広告の出稿状況が非常に悪く、前年比80％という水準である。
,,×,新聞社［求人広告］（営業担当）,求人数の動き,・求人募集広告の動きが悪い。現状維持ならまだ良い方で、企業や商店からの求人はかなり抑えられている。
,,×,職業安定所（職員）,求人数の動き,・求人が期限切れとなった際、これまでは求人が未充足であれば更新されたが、更新されないケースが増えている。特に製造業で顕著となっており、派遣会社からの求人も大幅に減少している。また、更新の際も、最小人数の１名での更新が増えている。
,,×,職業安定所（職員）,求人数の動き,・製造業からの求人が大幅に減少している。それに伴い、メーカー向けを想定した派遣会社からの求人も減少傾向にある。
,,×,民間職業紹介機関（職員）,求人数の動き,・例年、この時期は建設業を中心とした日雇求人が伸びるが、今年は伸びがみられない。
,,×,民間職業紹介機関（営業担当）,周辺企業の様子,・賃金カットや内定の取消しが出てきている。
,,×,学校［大学］（就職担当）,それ以外,・業績悪化を理由に、内定の取消しが８件発生している。
,,,,,
　８．中国（地域別調査機関：（社）中国地方総合研究センター）,,,,,
,,,,,（－：回答が存在しない、＊：主だった回答等が存在しない）
分野,,景気の現状判断,業種・職種,判断の理由,追加説明及び具体的状況の説明
"家計
動向
関連

(中国)",,◎,競艇場（職員）,販売量の動き,・他の競艇場や電話投票の売上が、11月初旬の記念レースの際に例年より増加した。
,,○,百貨店（販売促進担当）,販売量の動き,・テナントの売上状況はまちまちだが、夏から秋にかけてほぼ全面的に減少だったのに比べると少し持ち直し、前年比ではほぼ同水準となっていることから、現在のところ下げ止まったか、少し上向きの傾向にある。
,,○,衣料品専門店（地域ブロック長）,単価の動き,・前年よりも、高額商品の売れる比重が高くなっている。
,,○,その他小売（営業担当）,お客様の様子,・海外旅行から国内旅行へシフトしたため、土産物である当社製品の売上が増えた。
,,○,観光型ホテル（スタッフ）,販売量の動き,・前年を上回る、宮島観光への来客数による販売量の増加と、まだまだ続くガソリンの高値などで、国内の観光需要が増えている。
,,○,テーマパーク（財務担当）,来客数の動き,・土・日・祝日を中心に、来客数等好調である。
,,□,商店街（代表者）,それ以外,・新しいデパートのオープンに伴い、通行量は２けたの伸びをみせているが、今月に入って、物販関係３店の閉店が決まった。物販店への好影響はないようだ。
,,□,一般小売店［紙類］（経営者）,来客数の動き,・連休があったにもかかわらず、観光客が増加しなかった。
,,□,百貨店（営業担当）,販売量の動き,・単価の高い重衣料で新しいトレンドがなく、買い控えが見られる。
,,□,スーパー（店長）,来客数の動き,・前月同様、来客数が前年比104～105％で推移している。販売点数についても、103～104％で推移しており、変わらない状況が続いている。
,,□,スーパー（販売担当）,来客数の動き,・新聞にチラシが入った日でも、開店直後から来る客が減った。普通なら朝は11時前後にピークを迎えるが、ピークのこない日もある。
,,□,コンビニ（エリア担当）,来客数の動き,・３か月前と比較すると、来客数の前年比は、ほとんど変化がない。
,,□,衣料品専門店（店長）,お客様の様子,・土日の来客数は平日の３倍くらいになるが、平日の来客数が増加しない。また、毎週火曜日に食品の特売を実施しているが、午前中は少し客が増えるものの、食品のみを買って帰る客が多い。
,,□,家電量販店（店員）,単価の動き,・自分の担当しているＤＶＤ関係の商品は、ハイビジョン放送をブルーレイディスクレコーダーで録画できるという追い風もあり、前年以上の売上があった。テレビも前年比をクリアしているので、売場に立っていて、あまり景気が悪いという実感はなかった。
,,□,その他専門店［カメラ］（店長）,来客数の動き,・来客数が前年並みに下げ止まってきた。ただ上昇までの感じはない。
,,□,一般レストラン（経営者）,単価の動き,・原料代等が下がってきた実感はないが、来客数は安定している。また冬のライトアップが始まり、人出も例年通りあるようで、夜の来客数も変化はない。
,,□,一般レストラン（店長）,来客数の動き,・ボーナスの支給に伴い来客数は伸びつつあるが、客単価等にあまり変動はなく、客の慎重さがうかがえる。
,,□,都市型ホテル（総務担当）,販売量の動き,・紅葉のシーズンであることに加えて、台湾からのチャーター便が来客数の確保に寄与した。
,,□,タクシー運転手,単価の動き,・例年より少し悪いが、月末からは12月にかけて営業のあいさつ回りなどで徐々に増えてきてはいる。
,,□,タクシー運転手,お客様の様子,・今月は前半から非常に動きが良かった。他県からの観光客の流入により、各所で観光客が増加している。人気劇団のイベントが２日間行われ、その効果が現れた。
,,□,通信会社（企画担当）,お客様の様子,・世間で言われているほど、客の様子からは購買を控えようとする意志の強さが見て取れない。不景気に慣れてしまっているのかも知れない。
,,□,通信会社（総務担当）,販売量の動き,・国内景気の低迷と、精神的なものから、消費への意欲が大きく落ち込んでいる。
,,□,テーマパーク（広報担当）,来客数の動き,・来客数はほぼ横ばいだが、中身は変わってきて、近場の客が増えてきており、旅行が「安・近・短」になってきている実感がある。ただし、本当の近場客である地元の客は、大型ショッピングセンターに奪われていて、結果としては横ばいである。
,,▲,商店街（代表者）,来客数の動き,・来客数減少、客単価低下、商店街の通行量減少という状態にある。
,,▲,商店街（代表者）,お客様の様子,・ついに当地域の主要な商店街とその近辺にも、空き店舗・空きビルが目立ち始めた。他の商店街とは状況が少々異なるとは思うが、商況や商店街を取り巻く状況は悪化している。
,,▲,一般小売店［酒店］（経営者）,お客様の様子,・地場の自動車関連企業の労働時間短縮や、契約社員の減少など、厳しさが身の回りのこととして伝わってきている。このため消費意欲はかなり低調になってきて、得意先の飲食店も客入りが悪くなっている。
,,▲,一般小売店［印章］（営業担当）,来客数の動き,・年賀状印刷受付の時期に入ったが、受付件数で前年比10％減と落ち込んでいる。また、印刷価格の問い合わせも多くあり、より安い店を探していることがうかがえる。
,,▲,一般小売店（営業）,販売量の動き,・地方にはあまり影響のないように思えたが、金融危機などのニュースによって、消費者の財布のひもがきつくなっている。料飲店は焼肉屋の落ち込みがひどい。
,,▲,百貨店（営業担当）,お客様の様子,・来客数も少なく、販売量も減少している。カードを使用して買物をする客が減って、１品単価も低下している。必要最低限の買物しかしない様子が見てとれる。
,,▲,百貨店（販売促進担当）,お客様の様子,・消費の低迷に加えて、地元大手企業のリストラ等もあり、地域経済は非常に冷え込んでいる。店頭においても、宝飾品や婦人服の高級ゾーンが、大きなマイナスとなっている。
,,▲,百貨店（電算担当）,販売量の動き,・今月は、売上が前年比で8.5％減となった。過去10年間でこんなに悪いのは初めてで、雑貨、衣料品、服飾、ほとんどの課がマイナスになっている。消費に意欲が感じられない。
,,▲,百貨店（売場担当）,お客様の様子,・一部のブランドコーナーを除いて、低単価な身の回り品から高額な化粧品・衣料など、全体的に売上ダウンが大きい。高めの気温のせいだけでなく、地域全体の消費が冷え込んでいる。
,,▲,百貨店（購買担当）,お客様の様子,・今月上旬よりお歳暮ギフトセンターがオープンしており、早く申し込まれたものへの割引・安売りというセールスポイントにより、来客数は前年並みで推移しているが、送り先の削減などにより、件数が前年よりも減少している。また、今月は七五三があったが、写真館に行って貸し衣装で簡単に撮るというような傾向にあるようで、子供服のフォーマル関係の動きがほとんどなかった。
,,▲,百貨店（販売担当）,来客数の動き,・来客数は前年並みながら、売上は前年比５ポイントのマイナスである。購買目的の客が少なく、買い方が非常にシビアである。
,,▲,スーパー（店長）,販売量の動き,・全体的に売上は落ちているが、チラシ投入商品の動きだけが非常に良い。特に調味料など、使用頻度の高い食材の特価品の販売数は多くなっている。
,,▲,スーパー（経営企画）,販売量の動き,・10月21日現在の既存店の販売量が、前年比96.05％である。来客数は97.59％である。
,,▲,コンビニ（エリア担当）,販売量の動き,・売上は値上げの寄与で、前年比をやや上回っているが、販売量は若干落ち気味である。
,,▲,コンビニ（エリア担当）,単価の動き,・最近は低単価の物しか売れていない。ペット飲料は月間の特売品を中心に売れ、弁当は480円以上の商品の売上が大幅に減少している。雑貨も大幅に減少している。
,,▲,コンビニ（エリア担当）,販売量の動き,・タスポ効果でタバコの売上は伸びているが、それ以外の商品は前年割れが続いている。タバコの効果も導入当時に比べると徐々に落ちてきていて、全体的な売上については減少傾向にある。
,,▲,衣料品専門店（地域ブロック長）,単価の動き,・低価格商品の動きしか見受けられず、高い商品が売れていない。したがって、客単価も低下している。
,,▲,衣料品専門店（販売促進担当）,来客数の動き,・今月は寒くなったこともあり、常連客の来店は多い。しかし、一見の客の来店が少なく、来客数は下がっているため、売上自体はやや減少している。全体的にメンズの動きが鈍く、レディースの伸びの方が目立つ。
,,▲,家電量販店（店長）,単価の動き,・薄型テレビ・ＤＶＤ等は数量的にはまずまず売れているが、販売単価の低下により、売上の確保が難しい状況である。
,,▲,乗用車販売店（統括）,単価の動き,・全般的に引合い自体が少なくなっている。引き合いがあっても、単価の低いものに移行してきている。
,,▲,乗用車販売店（サービス担当）,来客数の動き,・店頭への来客数が少なくなり、新車を買うか買わないか、その反応が鈍くなっている。またこのご時世に、新車を買うと周囲からどんな目で見られるかという配慮から、中古車にする客も多い。
,,▲,自動車備品販売店（経営者）,来客数の動き,・来客数の減少は続いており、今月は特に良くない。平日は前年実績を確保できるが、土日祝日の落ち込みが大きい。また商品では、高額商品であるナビゲーションが、数量、売上共に、今までにない落ち込み方である。
,,▲,自動車備品販売店（店長）,単価の動き,・消耗品でも安い物しか買わない。ぜいたく品である大型商品は全く売れない。
,,▲,スナック（経営者）,お客様の様子,・客がとにかくお金を使わない。忘年会の話も一切出ず、普通だったら「忘年会をいついつにするから、その後頼むぞ」というような話があるのに、一切聞こえてこないなど、客の様子は大変悪くなっている。会社で忘年会をせず、グループや家庭でしているようである。
,,▲,その他飲食［ハンバーガー］（経営者）,来客数の動き,・客単価のアップで、売上は維持できているが、来客数が大幅に減少している店舗が増えている。
,,▲,都市型ホテル（従業員）,来客数の動き,・宿泊部門は前年低調であった一般団体が増加したことにより、前年並みであるが、レストランは高単価の店舗を中心に、前年に及ばない。
,,▲,都市型ホテル（スタッフ）,来客数の動き,・レストランでは夜の一般の客が減少しており、宿泊客が夕食で利用する程度である。宿泊の人数は、前年より微増であるが、客単価を下げざるを得ないため、売上は減少している。
,,▲,旅行代理店（営業担当）,お客様の様子,・現在の国の施策では、景気回復はおぼつかない現状であり、アメリカの金融業界も破綻に近い状況のなか、客は旅行どころではない。
,,▲,タクシー運転手,販売量の動き,・例年だと、この時期から早めの忘年会が始まっているはずだが、その動きが出ていない。
,,▲,タクシー運転手,販売量の動き,・11月は３連休が２回あり、例年だとその前日は確実に客が増えたのだが、今月はそれもなく、先が思いやられる。また、１0月の売上も５％減となった。
,,▲,通信会社（営業担当）,販売量の動き,・訪問先企業において経費削減・コスト見直し等の話が多くなっている。
,,▲,通信会社（総務担当）,お客様の様子,・高品質の新メニューを導入したが、料金が若干高いこともあり、新規契約獲得の増加に結び付いていない。
,,▲,ゴルフ場（営業担当）,お客様の様子,・外国、特に韓国からの客の動きが悪くなった。ウォン安円高で、日本への旅行がしにくくなっている。
,,▲,美容室（経営者）,来客数の動き,・景気後退、景気後退と言われる社会的な風潮のせいかもわからないが、客の来店周期が徐々に延びてきて、景気の冷え込みを感じさせる。
,,▲,設計事務所（経営者）,競争相手の様子,・受注の減少が加速している。同業者に廃業、もしくは破産整理が増え、現状維持が精一杯である。
,,×,商店街（代表者）,来客数の動き,・来客数が少ないのだが、少ないなかの客の話を聞いても、不景気感が強い。
,,×,商店街（代表者）,単価の動き,・客の消費動向が、生活防衛に向かっているというのがありありとわかる。より付加価値の高い物を、より安くという傾向が、ますます鮮明に出てきている。オーバーストア・デフレ・少子化の三重苦で、子供服・衣料については、ますますデフレ傾向が強まっている。
,,×,商店街（代表者）,お客様の様子,・今までも景気はひどく悪く感じていたが、この世界的な株の乱高下等による先行き不安のために、客の買い控えがなおさら強くなってきている。
,,×,商店街（代表者）,お客様の様子,・客同志で話すことが、不景気な話ばかりである。実際に客単価が低下しているし、食事以外にはお金を使わない。
,,×,一般小売店［靴］（経営者）,来客数の動き,・来客数が減少していることに加えて、販売量の動き・単価の低さ・客の不景気な様子、全てが悪くなっている。
,,×,一般小売店［茶］（経営者）,それ以外,・中小企業団体への加盟企業で、数か月まで羽振りがよかったコンピュータ関連企業や、中国に鋼材を輸出している企業などの倒産が相次いでいる。地域として一気に悪くなっている。
,,×,一般小売店（経営者）,来客数の動き,・世間の不況のニュース等で、消費マインドが相当低下している。
,,×,百貨店（営業担当）,販売量の動き,・客の購買力が弱くなってきているため、売上高が計画値を下回っている。
,,×,百貨店（売場担当）,販売量の動き,・好調であったミセス衣料やヤング婦人靴は、11月第２週の末から落ち込んで、結局前年比80％台で推移し、好調な商品群がなくなった。家族優待会などで紳士衣料とミセス服が若干盛り返したが、後半仕掛けのない平日は前比80％後半で推移した。今月は３連休が２度あったにもかかわらず、店全体でも前比90％前半の売上となった。
,,×,百貨店（売場担当）,販売量の動き,・株価下落の影響からか、富裕層に良く出る美術品が売れなかった。
,,×,スーパー（店長）,販売量の動き,・単価が安い商品に消費者の興味が移行しつつある。
,,×,スーパー（店長）,来客数の動き,・ここ数か月、来客数の減少傾向は続いており、当店来客数の前年比86％、館全体でも前年比92％と苦戦を強いられている。この部分での回復の兆しがみられない現状では、景気は後退していると言わざるを得ない。
,,×,スーパー（店長）,単価の動き,・来客数は変わらないし、買上点数も全く変わらないが、客単価が低下している。
,,×,スーパー（総務担当）,単価の動き,・来客数は前年並みか、多めで推移しているものの、客単価が上がらない。メモを片手に買物している姿が多く見られ、必要最小限の買物しかしていない。
,,×,スーパー（財務担当）,販売量の動き,・値上げにより単価が上昇したため、買上点数と来客数が減少するという状況が続いている。
,,×,コンビニ（エリア担当）,お客様の様子,・生活防衛型の客が増えている。弁当などの主食系商品は前年割れが続いており、弁当をコンビニで買うより、家から持って来るなど、客の行動が変わりつつある。
,,×,衣料品専門店（経営者）,競争相手の様子,・残り少ない商店街の同業者が、お店を奥さんにまかせてパート勤めを始めた。
,,×,家電量販店（店長）,競争相手の様子,・同業他社・競合店の状況をみると、前年比で大幅に数字を落としている。パイ自体は多くなっているわけではなく、市場としては非常に冷え込んでいる。
