Ⅰ．景気の現状に対する判断理由等,,,,,
,,,,,
　景気の現状に対する判断の理由及びそれに対する追加説明等について、その主だったもの及び特徴的と考えられるものを取りまとめると以下のとおりであった。,,,,,
,,,,,
,,,,,
　１．北海道（地域別調査機関：（株）北海道二十一世紀総合研究所）,,,,,
,,,,,（－：回答が存在しない、＊：主だった回答等が存在しない）
分野,,景気の現状判断,業種・職種,判断の理由,追加説明及び具体的状況の説明
"家計
動向
関連

(北海道)",,◎,－,－,－
,,○,スーパー（店長）,販売量の動き,・客単価が落ち込んでいるものの、販売量は前年比106％と伸びている。
,,○,スーパー（店長）,来客数の動き,・３か月前と比べると来客数がやや伸びてきている。
,,○,スーパー（店員）,販売量の動き,・毎年、１万円の買物券を買った客に５％の買物券をプレゼントする企画を期間限定、会員限定で実施しているが、前年以上の伸びをみせている。やはり特典が付いているためか、初日から前年を上回る販売量となっており、このまま推移すれば期間中の販売量は前年を上回ることになる。
,,○,観光型ホテル（経営者）,来客数の動き,・地元客が全くの不振であるものの、道外からのツアー客が順調であることから、地元客の不調分をカバーしている。ただ、これまで好調だった中部地区からのツアー客に陰りが出てきている。
,,○,通信会社（企画担当）,販売量の動き,・携帯電話においては、各社が秋冬向けの新商品を発売しており、機種変更、新規契約共に活気付いている。
,,□,スーパー（役員）,単価の動き,・ここ数か月、既存店の売上は前年比108％前後、来客数が前年比107％前後で推移している。買上点数がやや減少する一方で、商品単価がやや上昇する状況が変わらず続いている。
,,□,コンビニ（エリア担当）,単価の動き,・来客数も売上も前年を上回っている。タスポ効果により、たばこ以外の商品の販売が順調であるが、これは来客数の増加によるものであり、１人当たりの購入額は前年を下回っている。業界としては順調であるが、客が出費に慎重な様子がうかがえる。こうした状況は、ここ数か月継続している。
,,□,コンビニ（エリア担当）,来客数の動き,・タスポ効果が継続しており、たばこ以外のカテゴリーも連動して伸びている。ただ、たばこの伸びは鈍化傾向にある。
,,□,コンビニ（エリア担当）,単価の動き,・タスポ効果による来客数の増加により、販売量も増加している。しかし、客単価は２％ほど低下しており、同種商品でもより単価の安い商品にシフトしている。また、催事商品の売上が好調であり、近くのコンビニで用を足す傾向が強まっている。
,,□,その他専門店［ガソリンスタンド］（経営者）,販売量の動き,・石油製品価格の下落により、石油製品の販売量は前年並みに回復したが、自動車関連部品の売上が低迷している。
,,□,旅行代理店（従業員）,お客様の様子,・円高の傾向にあるものの、１月以降の海外旅行への問い合わせ件数や申込件数が前年よりも少なくなっている。
,,□,美容室（経営者）,来客数の動き,・ここ数か月、来客数がほぼ同じような状況で固定化しており、良い動きも悪い動きもみられない。
,,▲,商店街（代表者）,販売量の動き,・前月末から今月にかけて商店街周辺に食品スーパーが相次いでオープンしており、食品関係を扱う商店の売上は軒並み前年を大きく下回っている。
,,▲,商店街（代表者）,単価の動き,・防寒物の最盛期を迎える11月に入っても、単価の高い防寒物が売れず、客単価が低下している。
,,▲,商店街（代表者）,来客数の動き,・11月中旬からの気温の冷え込みにより、来街者数、来客数共に減少している。
,,▲,一般小売店［酒］（経営者）,販売量の動き,・例年であれば、冬のボーナスを当て込んだ需要がそろそろ出てくるが、今年はそうした需要がまだみられない。ボーナスも厳しい状況のようなので、お金を使わない風潮が色濃く出ていると感じる。
,,▲,百貨店（売場主任）,お客様の様子,・集客状況は各日とも悪化している。特に土曜、日曜の落ち込みが大きい。客単価に大きな落ち込みはみられないが、値札をよく見ながら商品を選んでいる様子から、価格への敏感さがうかがえる。食品の集客で買い回るこの店の傾向からみると、近郊でスーパーの出店が続いたことで、食品部門の来客数が前年を10％下回っていることの影響が大きい。
,,▲,百貨店（売場主任）,販売量の動き,・販売量が減少しており、売上を確保するのが大変厳しい状況となっている。
,,▲,百貨店（販売促進担当）,お客様の様子,・ここにきて、消費者の購買態度が日増しに厳しくなっている。百貨店業界では、各社が継続的なセールの投入やポイントカードのポイント付与率引上げなど、消費喚起策に躍起となっているが、肝心の消費者に動きがみられない。最近では、衝動買いをあまり見かけなくなっており、本当に必要な物を長時間吟味して買うのが当たり前の光景になってきている。
,,▲,スーパー（役員）,販売量の動き,・既存店の動向をみると、客単価は上昇しているが、それは値上がりによるものであり、買上点数は若干減っている。
,,▲,家電量販店（店員）,販売量の動き,・イベントや招待会、週末の来客数はまずまずであるが、平日の来客数が前年よりもかなり少なくなっている。
,,▲,乗用車販売店（従業員）,販売量の動き,・具体的な商談に入ることができず、客の購買意欲が感じられない。
,,▲,乗用車販売店（従業員）,販売量の動き,・最近は点検等の入庫が徐々に減りつつあり、サービス部門の売上が前年を下回ってきている。
,,▲,その他専門店［医薬品］（経営者）,来客数の動き,・来客数の減少に歯止めがかからない。冬場の好景気はもはや有り得ない状況となっている。
,,▲,高級レストラン（スタッフ）,来客数の動き,・地元客に合わせたメニュー作り、ＰＲ広告の実施、観光スポットでのパンフレット配布などの販促の結果、売上はかろうじて前年を２％上回った。客単価はほぼ前年並みであったが、定期的に販促を行わないと厳しい状態にある。
,,▲,高級レストラン（スタッフ）,お客様の様子,・11月は連休が２度あったことから、消費動向がやや悪く、アルバイト従業員を早上がりさせるなどした。他店も厳しいようであり、知人のレストランでは夕食の来客数がゼロの日もあった。地方にあるシティホテルでは、朝食の料金は以前と変わらないのに、料理の品数が少なくなっていた。
,,▲,スナック（経営者）,来客数の動き,・繁華街を出歩いている人が少ない。
,,▲,観光型ホテル（スタッフ）,単価の動き,・インターネットでの予約状況をみると、宿泊料金が安くなる間際の予約が増えてきている。
,,▲,旅行代理店（従業員）,販売量の動き,・海外旅行の販売量が前年の60％、国内旅行の販売量が前年の95％となっており、販売額が前年を下回っている。海外旅行における円高の影響もみられない。
,,▲,タクシー運転手,お客様の様子,・経済の不況感から、病院への通院などでタクシーを利用していた人も利用しなくなった。また、夜や深夜の利用客が極端に少なくなっている。
,,▲,タクシー運転手,来客数の動き,・電話での注文数が減少している。
,,▲,観光名所（役員）,来客数の動き,・週末や連休はともかく、平日の来客数の落ち込みが目立つようになっており、前年並みの来客数を維持するのが難しい状況となっている。
,,▲,その他レジャー施設（職員）,それ以外,・施設を無料で一般開放した際に実施した企画において、前年や一昨年よりも多数の利用者がみられた。不景気のため、利用客もなるべくお金を使わないようにしている様子がうかがえる。
,,▲,設計事務所（職員）,それ以外,・米国発の金融不安により、ファンド系のマンション事業が中止又は保留されている。また、金融機関の貸しはがしを警戒して事業が中止される例もあり、建設会社の営業担当者は対象物件がほとんどなくなっていると憂いている。
,,×,商店街（代表者）,お客様の様子,・10月下旬以降、来客数が激減しており、客の消費気運も最低の水準となっている。季節商材への反応もみても、低価格で本当に必要な物しか購入しない傾向が更に強まってきている。
,,×,一般小売店［土産］（経営者）,来客数の動き,・悪いムードが更に悪いムードを引き起こしており、より一層悪くなっている。また、年末を控えて銀行の貸し渋りが現実に起きており、そのせいで更に悪くなっている。
,,×,百貨店（売場主任）,販売量の動き,・暖冬の影響もあり、客の買い控えが相変わらず続いている。特に、コートを始めとする重衣料の動きが悪く、婦人服の販売量は前年の80％、紳士服の販売量に至っては前年の60％となっている。
,,×,百貨店（役員）,来客数の動き,・客単価はそれほど変わっていないが、来客数の減少により、売上が低下している部門が目立つ。
,,×,スーパー（店長）,お客様の様子,・売れる物が両極化している。良い物か安い物では動きがみられるものの、中間帯の商品の売行きが非常に悪くなっている。
,,×,家電量販店（店長）,来客数の動き,・省エネ性の優れた商品の売行きが良いことから、商品単価自体は上昇しているものの、買い回り客がそれほど多くないため、全体の売上としては前年から微減で推移している。
,,×,家電量販店（地区統括部長）,販売量の動き,・北京オリンピックの終了以降、毎月、売上が前年を下回っている。特に薄型テレビにおいては、販売台数もさることながら、単価の低下が目立っている。
,,×,乗用車販売店（営業担当）,販売量の動き,・販売実績が前年の半分程度にとどまっている。
,,×,高級レストラン（スタッフ）,お客様の様子,・連日のように企業の減益減収が報道されるなか、生活への不安感がますます高まっており、ぜいたくと思われる外食の機会が顕著に減少している。特にぜいたく感を訴求する店舗の利用客は前年から20％、３か月前からは40％もの減少となっており、他店舗の売上でカバーしきれない状態となっている。
,,×,一般レストラン（スタッフ）,販売量の動き,・来客数、客単価共に前年割れが続いており、売上が減少している。特に夜の売上の落ち込みが大きく、前年からは12％ほど減少している。
,,×,スナック（経営者）,来客数の動き,・景気が悪いということで、12月を待たずに廃業するスナックやクラブが多くなっている。
,,×,観光型ホテル（経営者）,来客数の動き,・最近の宿泊客数の伸びが悪く、売店等の付帯収入も減ってきている。同業者も同じような状況にある。
,,×,旅行代理店（従業員）,販売量の動き,・海外旅行の落ち込みが大きく、販売量が前年の50％程度となっている。
,,×,旅行代理店（従業員）,来客数の動き,・今までに例がないくらい、受注件数が低い水準にあり、米国の同時多発テロ直後のような状況となっている。
,,×,タクシー運転手,来客数の動き,・今月は比較的暖かく、雨や雪の日も少なかったので、前年よりもタクシーの利用が減っている。また、すすきのでは夜間の人出が週末の金曜であっても少なく、タクシーを利用する客も減っている。
,,×,設計事務所（所長）,競争相手の様子,・ガソリンや灯油の価格が落ち着いてきたものの、企業の業績悪化に伴う給与の不安から住宅需要は冷え切っている。
"企業
動向
関連

(北海道)",,◎,－,－,－
,,○,輸送業（経営者）,取引先の様子,・競争相手が事業を縮小しているほか、燃料が安くなっていることから、やや良くなっている。
,,□,食料品製造業（団体役員）,それ以外,・年末の需要期を控えて、受注量の増加がみられるものの、低価格や小ロットでの受注が中心である。国内景気の落ち込みにより消費動向は更に悪くなっているが、円高の影響による原油価格や輸入原材料価格の低下により、生産コストの軽減も見え始めてきている。
,,□,金属製品製造業（経営者）,競争相手の様子,・３か月前と比べると受注量が３分の１に減っている。
,,□,司法書士,取引先の様子,・不動産取引や建物新築の件数が低水準にあり、悪い状態のままで変わらずに推移している。
,,▲,食料品製造業（役員）,受注価格や販売価格の動き,・原料価格上昇分の販売価格への転嫁が思うように進んでいない。
,,▲,輸送業（営業担当）,取引先の様子,・製紙業界全体が厳しいなか、洋紙類の減産が行われていること、古紙の中国への輸出が大幅に減少していることから、在庫が増加している。
,,▲,通信業（営業担当）,取引先の様子,・取引先から、販売量や売上が減少傾向にあることを聞く機会が増えている。
,,▲,金融業（企画担当）,それ以外,・地元企業の設備資金は少ない。原材料価格の上昇が続いており、価格転嫁できない企業が多い。建設関連を中心に倒産件数も増加しつつある。ガソリンや灯油の価格が下落しているものの、株安など、先行きが不透明な面があることから、個人消費は落ち込んでいる。
,,×,輸送業（支店長）,取引先の様子,・本州資本による大型物件や新千歳空港等の公共物件については、多少の遅れがあるものの、計画通りに進行している。その一方で、道内地場企業の中小物件は大半が延期ないしは中止となっている。道内の鉄骨加工業者は仕事を求めて道外物件の受注に向かっている。
,,×,司法書士,取引先の様子,・土地の売買登記が少なくなり、会社設立の登記も減少している。その一方で、廃業する会社が増加している。
,,×,その他非製造業［鋼材卸売］（役員）,受注量や販売量の動き,・機械設備の引き合いが少なく、受注残もほとんどない状態となっている。受注が決まっていた物件でも中止や延期が発生している。工具関連も販売量の落ち込みが目立っている。消耗品はまとめ買いが減っており、必要な分だけを都度購入する買い方が増えている。
"雇用
関連

(北海道)",,◎,－,－,－
,,○,－,－,－
,,□,職業安定所（職員）,求人数の動き,・10月の有効求人倍率は0.49倍であり、前月に引き続き前年と同率となった。新規求人数は前年から1.9％増加したが、数件の大量求人によるものであり、全体としては変わらない。
,,▲,求人情報誌製作会社（編集者）,求人数の動き,・本州方面への派遣・請負関係の求人が急激に減少している。地元の求人数も減少傾向にある。
,,▲,新聞社［求人広告］（担当者）,求人数の動き,・前年と比較して、求人広告の売上が15％以上落ち込んでおり、企業が雇用を抑えている姿勢が顕著に表れている。特に、これまで好調に推移していた派遣、医療系の求人広告が大きく売上を落としている。一方、飲食系、運輸・運送系の求人広告は30～40％売上を伸ばしたが、全体の落ち込みからすると、焼け石に水だった。
,,▲,職業安定所（職員）,求人数の動き,・10月の有効求人倍率が0.45倍と前年比で0.10ポイントもの大幅な減少となった。
,,▲,学校［大学］（就職担当）,求職者数の動き,・求人情報が極端に少なくなってきている。企業からは、新卒採用を行うかどうかを検討しているが、会社としての結論が出ないと聞いている。
,,×,人材派遣会社（社員）,求人数の動き,・求人ニーズが慎重になっており、量的にもやや減少している。事務系の派遣のニーズも控え気味である。現段階では大幅な減少とは言い切れないが少なくとも増加しているとは言えない状況にある。
,,,,,
　２．東北（地域別調査機関：（財）東北開発研究センター）,,,,,
,,,,,（－：回答が存在しない、＊：主だった回答等が存在しない）
分野,,景気の現状判断,業種・職種,判断の理由,追加説明及び具体的状況の説明
"家計
動向
関連

(東北)",,◎,コンビニ（経営者）,競争相手の様子,・周辺の食堂などの廃業に伴い、米飯類が122％、飲料水が104％、加工食品が106％と主に食料品関係が伸びている。
,,◎,観光型旅館（経営者）,来客数の動き,・６月の岩手・宮城地震の影響で６～９月の売上は、前年比で30～20％の減少となっていたが、紅葉、行楽シーズンや仙台・宮城デスティネーションキャンペーンの効果もあり、前年並みに回復している。
,,○,＊,＊,＊
,,□,一般小売店［医薬品］（経営者）,来客数の動き,・９月のリーマンショック以降、景気後退ムードが高まっているが、消費の面で底固さが見られ店頭での売上への影響は軽微である。
,,□,百貨店（広報担当）,それ以外,・前年よりもポイントサービスデーを増やしたため、売上が前年を上回る状況で推移しているが、それ以外の日は、相変わらず生活防衛意識が強く、客単価、来客数共に減少傾向がみられる。
,,□,スーパー（店長）,競争相手の様子,・競合各社では、消費喚起のため商品の値下げやチラシ価格の強化を実施しており、客の奪い合いになっている。消費低迷により、単価が高い商品が不振となっており、食料品の１品単価が前年比で２％低下、衣料品の売上は15％減少している。
,,□,スーパー（店長）,来客数の動き,・来客数は前年並みに推移しているが、商品価格の値上げにより客の節約傾向は続いており、買上点数、客単価共に低下している。
,,□,コンビニ（経営者）,販売量の動き,・例年大きな商戦となる年賀状やボジョレーヌーヴォーの売行きが悪く、たばこ、米飯類、菓子パンが相変わらず好調を維持している。
,,□,コンビニ（エリア担当）,販売量の動き,・既存店ベースの売上は、前年と比較して若干増加しているものの、３か月前との比較では横ばいである。
,,□,コンビニ（エリア担当）,単価の動き,・タスポ効果が追い風となって売上は増加しているが、客単価が伸びていない。
,,□,コンビニ（エリア担当）,単価の動き,・依然としてタスポ効果は続いているが、たばこのみを買う客が増加し、ついで買いが見られない状況にある。
,,□,衣料品専門店（経営者）,競争相手の様子,・問屋や同業の廃業など、明るい話題が全くない。
,,□,衣料品専門店（店長）,お客様の様子,・例年に比べて厳しい状況に変わりはないが、リクルート関係の来客数が増加している。来年は就職活動が更に厳しくなると予想されることから学生は早めに準備をしている。
,,□,その他専門店［呉服］（経営者）,来客数の動き,・来客数が減少しており、売上が伸びていない。
,,□,一般レストラン（経営者）,販売量の動き,・販売量、単価、客の様子全てにおいて悪い状態が続いている。現状を打破するため様々な努力をしているが、どれも一時的なものであり景気回復には至っていない。
,,□,一般レストラン（スタッフ）,来客数の動き,・不景気が続くなか、ガソリン価格の下落に伴い、来客数が戻ってきている。
,,□,通信会社（営業担当）,お客様の様子,・燃料価格の低下により景気回復を期待しているが、各業界の客からは依然として厳しい話ばかりが聞こえてくる。
,,□,遊園地（経営者）,来客数の動き,・連休が好天に恵まれたことから、前年と比べて来客数は順調に推移しているが、客単価については前年並みとなっている。
,,□,美容室（経営者）,来客数の動き,・最近は節約志向が高まり、美容室の利用回数を減らして自分でカットする客が増加している。
,,▲,商店街（代表者）,来客数の動き,・駅前や郊外の大型商業施設の開店や、商店街にある大型商業施設の閉店により、目に見えて商店街を訪れる客が減少している。
,,▲,商店街（代表者）,お客様の様子,・下旬にまとまった雪を記録し、衣料、靴、除雪用具を中心に冬物用品の動きが活発になるはずであるが、消費者はかなり我慢をしており、今年は反応が鈍い。
,,▲,一般小売店［酒］（経営者）,販売量の動き,・客は必要最低限の物しか買わない状況が続いている。
,,▲,一般小売店［スポーツ用品］（経営者）,お客様の様子,・店頭での売上が悪く、バーゲンを実施しても売上増加につながるか確信できない状況にある。
,,▲,一般小売店［医薬品］（経営者）,来客数の動き,・前年に比べて売上に大きな変化は無いが、来客数が徐々に減少している。
,,▲,百貨店（企画担当）,単価の動き,・当社のお歳暮ギフトセンターがオープンして数週間経過し、売上は前年並みで推移しているものの、スーパーブランドなどの高額商品の動きが相変わらず悪く、客単価は低下している。
,,▲,百貨店（売場担当）,お客様の様子,・客の買い控え傾向は続いているが、価格に対する反応がシビアになっている。価格設定が高い婦人服特選売場では、新規客はまずは値札を見る行動をとり、ある程度価格が分かる客も価値と価格のバランスを今まで以上に厳しい目でみている。また、ミセス向けの防寒アイテムの売れ筋価格が前年より低下している。
,,▲,百貨店（経営者）,お客様の様子,・気温の低下により冬物衣料に動きが出てきているものの、他商品と組み合わせるなどのまとめ買いが少なく、売上全体を押し上げる状況にない。
,,▲,百貨店（経営者）,単価の動き,・食料品の売上は堅調に推移しているが、宝飾時計、婦人服プレタゾーンの苦戦が続いている。
,,▲,スーパー（経営者）,お客様の様子,・低価格商品のみ売れることから、売上確保のため無理な売価引下げを実施しており、粗利益が減少している。
,,▲,スーパー（店長）,販売量の動き,・来客数は前年並みに戻っているが、買上点数、売上共に減少している。
,,▲,スーパー（店長）,販売量の動き,・来客数はほぼ横ばいで推移しているが、ここ１か月は安い物しか売れず、客単価、売上共に減少している。
