Ⅰ．景気の現状に対する判断理由等,,,,,
,,▲,理美容室（経営者）,来客数の動き,・例年なら暑くなり忙しくなる時期であるが、来客数は少ない。
,,▲,設計事務所（職員）,お客様の様子,・客の話によると、耐震改修の仕事はあるが、その替わりに新築がなくなっている。
,,▲,住宅販売会社（経営者）,競争相手の様子,・安価で良い物件しか売れていない。
,,▲,住宅販売会社（企画担当）,競争相手の様子,・最近の商談では、競合相手がかなり値引きをして契約を取っている様子である。そのため、利益率が悪くなっている。
,,▲,住宅販売会社（従業員）,お客様の様子,・新築住宅を購入しなくても、中古で良いという人が出てきている。
,,×,商店街（代表者）,来客数の動き,・とにかく来客数が極端に減少している。したがって、販売量、売上が増えないのは当然である。客の様子を見ていると、生活に追われている様子である。当店の商品は生活必需品ではないが、客は生活必需品を購入しているため、当店の商品にまでお金は回ってこない。
,,×,商店街（代表者）,お客様の様子,・客の会社関係の人は皆、景気が悪いと言っている。
,,×,百貨店（外商担当）,販売量の動き,・百貨店にとって、お中元商戦の最盛期である。前年末のお歳暮商戦では全く受注がなくなった客が何件かあって、売上が大きく減少した記憶があるが、前年末には何とか贈っていた客でも、このお中元から全く廃止するという客が増えており、外商客からの受注は20％以上も落ち込んでいる。これが、全体の売上を大きく減少させている。その他でもプラス材料はほとんどない。天候不順もあり、いよいよ深刻で、危機が増してきている。
,,×,百貨店（外商担当）,販売量の動き,・お中元商戦の売上は前年同月比72％と思っていた以上の落ち込みであり、現在の景気が如実に表れている。お歳暮ならしなくてはいけないが、お中元はカットするという企業が散見され、大幅減となっている。特に製造業の大幅減が響いている。
,,×,スーパー（経営者）,来客数の動き,・また中型店のオープンがあり、大型店、中型店との競争が激しく、中小企業の店はますます大変になっている。景気の悪さとのダブルパンチで、大変困っている。
,,×,スーパー（経営者）,お客様の様子,・客の小売店では、来客数が少ないなどによって売上が立たず、困っている。
,,×,スーパー（店長）,来客数の動き,・来客数は急激に落ち込んでいる。安売店、ディスカウント店に客が流れている。
,,×,コンビニ（エリア担当）,来客数の動き,・来客数の減少が続き、落ち着く様子もない。
,,×,コンビニ（店長）,販売量の動き,・天候不順のせいか、売上は前年同月を１割ほど下回っている。特に飲料水は２割近く減少している。
,,×,コンビニ（店長）,来客数の動き,・前年同月比で来客数、客単価共に15％ほど悪化している。来客数、客単価の落ち込みは、この２、３か月間で一番悪い。
,,×,コンビニ（企画担当）,来客数の動き,・７月になって、客単価の落ち込みよりも、来客数の減少のほうが大きくなってきている。
,,×,衣料品専門店（経営者）,来客数の動き,・うだるような蒸し暑さが続き、商店街には人気もない。バーゲンのポップを見ての来店は、ほとんどない。客単価の落ち込みはないが、来客数の減少が大きい。
,,×,その他専門店［貴金属］（店長）,お客様の様子,・夏は時計、宝飾品が目立つトップシーズンであるが、ボーナスが出ているにもかかわらず、客の購買意欲は今一つ盛り上がっていない。定価販売が厳しさを増しているため、単価は非常に低下している。
,,×,高級レストラン（スタッフ）,来客数の動き,・来客数の減少幅が、再び拡大し始めている。
,,×,一般レストラン（経営者）,お客様の様子,・世の中の経済、雇用の不安定のせいか、客の財布のひもは緩んでいない。
,,×,都市型ホテル（支配人）,単価の動き,・宿泊は、出張客が大幅に減少している。また、単価も平日、休日共に、大幅値引きをして何とか売っている状況である。レストランは、接待と思われる客がほとんどない。
,,×,旅行代理店（経営者）,お客様の様子,・来客数は顕著に減少している。
,,×,旅行代理店（経営者）,競争相手の様子,・夏の予約状況は前年よりも悪く、同業他社で契約社員の70名近くを再契約しなかったところが出ている。驚くほど低単価の旅行商品が出現して、利益率はますます悪化している。
,,×,理容室（経営者）,お客様の様子,・相変わらず景気の良い話題はない。また、客は安い理容室に流れてしまう。
"企業
動向
関連

(東海)",,◎,－,－,－
,,○,紙加工品［段ボール］製造業（経営者）,受注量や販売量の動き,・販売量は、幅広い業種で伸びてきている。
,,○,化学工業（総務担当）,受注量や販売量の動き,・受注に急ブレーキが掛かった後、ある程度は持ち直している。ただし、元通りには至っていない。
,,○,一般機械器具製造業（営業担当）,受注量や販売量の動き,・本格的な回復とはいえないが、引き合いや設備改造の注文は増えてきている。
,,○,電気機械器具製造業（営業担当）,受注量や販売量の動き,・計画と対比して、売上は若干ながら増えつつある。
,,○,輸送用機械器具製造業（統括）,受注量や販売量の動き,・主力取引先の新製品がヒットし、受注は増えている。
,,○,輸送用機械器具製造業（財務担当）,受注量や販売量の動き,・４月には休業日が４日あったが、今月はゼロである。それに加えて、ハイブリッド車関連の部品のラインでは、残業も発生している。また、関連会社の一部でも、派遣社員の再雇用が行われている。
,,○,輸送業（経営者）,受注量や販売量の動き,・業種によって差はあるが、製造業の荷主の物量は概ね、徐々に回復してきている。
,,○,輸送業（エリア担当）,受注量や販売量の動き,・３か月前の売上の前年同月比はマイナス29.8％であったが、今月は同マイナス27.0％と若干改善されて、落ち込みに歯止めが掛かっている。前々月、前月と比べると良くなってきている。
,,○,輸送業（エリア担当）,受注量や販売量の動き,・荷物の動きは落ち込んだが、更に減り続ける感じではなく、逆に若干増え始めてきている。
,,□,パルプ・紙・紙加工品製造業（総務担当）,受注量や販売量の動き,・この数か月間、受注量、販売量共に横ばいである。
,,□,窯業・土石製品製造業（経営者）,受注量や販売量の動き,・売上は３か月前と比較して18％ほどの増加傾向にあるが、経常利益はいまだ損益分岐点に達せず、引き続き厳しい状況である。
,,□,窯業・土石製品製造業（社員）,受注価格や販売価格の動き,・販売数量は回復傾向にあるが、同業他社による新規の低価格製品の売り込みが激しく、やむなく価格を下げざるを得ない。同業他社の採算を度外視したような低価格の売り込みに苦慮している。
,,□,鉄鋼業（経営者）,受注価格や販売価格の動き,・受注量、販売量は前月から底ばいの状況にあるが、競争や客からのコストダウン要請により、受注価格は少しずつ下落している。年初と比べると、価格は30％ほどの下落率を示し、今なお下げ基調にある。
,,□,一般機械器具製造業（経理担当）,受注量や販売量の動き,・受注高、操業度は、前月と同様に、特に建設関係が前月比マイナス25％と落ち込みが大きい。スポット受注があり、全体では前月比で若干プラスであったが、先行きは厳しい。
,,□,電気機械器具製造業（経営者）,受注量や販売量の動き,・車載製品等の一部は、期初の見通しを超える受注動向を見せている。ただし、全体を大きく底上げするまでには至っていない。
,,□,電気機械器具製造業（経営者）,受注量や販売量の動き,・今年に入ってから、受注量は前年同月比４割減での横ばい状態が続いている。
,,□,電気機械器具製造業（企画担当）,それ以外,・省エネ家電のエコポイント制度やエコカー減税によって、家電や自動車は一時持ち直している。しかし、需要は低価格商品に集中してデフレ傾向が強まっており、景気としては一進一退の状況が続いている。総選挙を控え不確定要素も多々あり、先行きが予測しにくい状況にある。
,,□,電気機械器具製造業（営業担当）,受注量や販売量の動き,・下期予算のための見積などから増加も見込めるが、まだ未確定である。
,,□,輸送用機械器具製造業（総務経理担当）,受注量や販売量の動き,・完成車メーカーからの受注量は、損益分岐点をまだまだ超えていない。ピーク時の５割を切っている状況である。
,,□,建設業（経営者）,受注量や販売量の動き,・不動産業では、住宅販売が依然として低調である。ただし、景気の底打ち宣言により、今後は多少持ち直しの動きがある。
,,□,輸送業（従業員）,受注価格や販売価格の動き,・取引先からの見積依頼が多いが、同業他社と運賃比較をするのみで最終的には運賃を下げる材料となっており、じりじりと運賃水準が下がっていく傾向にある。
,,□,輸送業（エリア担当）,受注量や販売量の動き,・梅雨がなかなか明けず、天候不順が続いている。そうした天候要因を除いても、夏場に向けてのレジャー用品、屋外用品、日用雑貨の動きは例年に比べて悪く、良くない状況が続いている。
,,□,輸送業（エリア担当）,受注量や販売量の動き,・特に大きな変化はなく、低調が続いている。
,,□,通信業（営業担当）,取引先の様子,・緩やかな回復基調にはあるが、まだまだ大きな変化はなく、変わらない。今年いっぱいは変わらないと話す取引先も多く、なかなか厳しい。
,,□,金融業（従業員）,取引先の様子,・大手自動車メーカーの社員やその下請の中小企業の社長に聞いたところ、景気は回復しておらず、現在の状況はどちらとも言えないとのことである。
,,□,金融業（企画担当）,取引先の様子,・自動車業界を中心に、受注は厳しい。決算分析をすると、前期比では悪化している。最悪期は脱した感があるものの、ピークの数割程度の回復にとどまっている。全般的には、３か月前より良くなっているとは言い難い。
,,□,広告代理店（制作担当）,取引先の様子,・企画物や新しい提案に対して、具体的な返事を得られないことが多く、平行線をたどることが多い。
,,□,新聞販売店［広告］（店主）,受注量や販売量の動き,・折込広告の出稿量は回復していない。
,,□,行政書士,受注量や販売量の動き,・顧問先の物流業者では、貨物の荷動きが相変わらず悪い。
,,□,会計事務所（職員）,取引先の様子,・小規模事業者では、このところ廃業や廃業予定が相次いでいる。まだ続けられるのに廃業を決意する事業者がある要因は、今後の見通しの不透明さにあると思われる。良くなることを期待する反面、これ以上の悪化は避けたいといったところである。
,,□,会計事務所（社会保険労務士）,取引先の様子,・一時帰休を実施する事業所が増えている。製造業は既に実施しているが、建築資材の卸売や工事を行う事業所でも、相談が出始めている。新規工事の着工がなくなったためと思われる。
,,▲,出版・印刷・同関連産業（経営者）,受注価格や販売価格の動き,・経費節減によって広告費の削減が進むなか、広告出稿は掲載料の値引きを進める媒体に流れている。
,,▲,化学工業（企画担当）,受注量や販売量の動き,・半年先には受注増が期待される案件も一部にはあるが、現在のところ回復基調にはない。
,,▲,金属製品製造業（従業員）,受注価格や販売価格の動き,・見積件数は少なくないが、受注決定段階での客先からの要望価格は非常に低い。同業他社はその価格で仕事を請け負っているとのことであるが、本当かどうかわからず混乱している。
,,▲,建設業（営業担当）,取引先の様子,・作業内容に応じて業者と仕事に出掛けるが、年間を通しての仕事量が減少しているという話や、車の乗車料金を尋ねられるといったことが、多々聞かれるようになっている。
,,▲,不動産業（経営者）,受注価格や販売価格の動き,・販売価格の引き下げが、水面下で横行している。
,,▲,不動産業（管理担当）,受注量や販売量の動き,・経費の圧縮から、オフィス事業の単価切り下げが止まらない。名古屋駅前のオフィスでは、坪単価３万５千円を２万５千円にダンピングしても、止まらない状況にある。オフィスは、単価の安い場所にどんどん移転している。
,,▲,その他サービス業［ソフト開発］（社員）,受注量や販売量の動き,・中部地域における受注金額は予算を下回っている。受注金額は全国的に当初予算を下回っている。
,,×,金属製品製造業（経営者）,受注量や販売量の動き,・受注量の減少に加えて、受注単価の低下も続いている。競争も引き続き激化している。
,,×,公認会計士,それ以外,・顧問先企業からの報酬引下げ要請が散見される。顧問先では、倒産した企業や従業員のボーナスが支払われない又は減額された企業がみられる。
,,×,経営コンサルタント,取引先の様子,・競売物件が、徐々に増えてきている。競売になった人の話によると、普通に働いていても所得水準が低下し、消費者金融などに手を出してしまったというケースが増えている。雇用不安等が地域経済にも悪影響を与えている。
,,×,その他サービス業［広告印刷］（従業員）,受注量や販売量の動き,・売上は半減に近い状態が続いている。受注に結び付くような見積も出てきていない。
"雇用
関連

(東海)",,◎,－,－,－
,,○,人材派遣会社（経営企画）,周辺企業の様子,・客の動きを見ると、派遣契約の非継続が少なくなり、一部では研究開発需要も出始めている。
,,○,アウトソーシング企業（エリア担当）,周辺企業の様子,・ハイブリッド車関連の仕事が好況であり、一部企業では派遣採用の動きがみられる。
,,○,職業安定所（職員）,求人数の動き,・自動車製造業では、エコカー関連車種の増産体制が始まり、関連企業、下請企業にも波及しており、回復の兆しが見えてきている。ただし、他の車種は回復の兆しが見えていない。また、製造業以外では、回復傾向は見られない。
,,□,人材派遣会社（経営者）,求人数の動き,・求人には、ほとんど動きがない。求人は全くない状態であると言ってよい。
,,□,人材派遣会社（支店長）,求人数の動き,・一部で景気底入れなどの報道がなされているが、雇用回復などの兆候は現在も見られていない。求人数は年同月比30％台に落ち込んでいるが、これも３か月前と変わっていない。
,,□,人材派遣会社（営業担当）,周辺企業の様子,・自動車業界を中心に在庫調整が一巡し、生産はやや持ち直してきているものの、本格的な増産にはなっていない。また中国からの各需要は一部で盛況になっているものの、景気の本格的回復として認識するには時期尚早である。
,,□,人材派遣会社（営業担当）,周辺企業の様子,・グループ企業の輸送部門は依然として低迷しており、前年同月比で80％を下回っている。商業物流を中心に、依然として景況感は悪い。
,,□,人材派遣会社（社員）,求職者数の動き,・企業の早期退職制度で退職した求職者の登録が増えている。
,,□,職業安定所（職員）,求職者数の動き,・求職者数はピークにあり、これ以上は増加しない。求職者の中には、短期での就職が多くなっている。
,,□,職業安定所（職員）,求人数の動き,・新規求人数は前月と比べて増加の兆しが見えず、低水準で推移している。雇用調整は進んだようであるが、新規雇用までにはいかず、現有の従業員で業務を回している状況である。
,,□,職業安定所（職員）,求人数の動き,・新規求人数は上向いていないものの、前年同月比の減少幅には歯止めが掛かりつつある。
,,□,職業安定所（職員）,求職者数の動き,・求職者数の増加率は、若干横ばいにはなっているものの、依然として前年同月と比べると激増している。
,,□,民間職業紹介機関（職員）,求人数の動き,・求人数は増えていないものの、就業者数は落ち着き始めている。
,,□,民間職業紹介機関（社員）,求人数の動き,・求人数は底を打ったものの、反転回復とは言い難く、Ｌ字型の状態である。
,,□,学校［大学］（就職担当）,求人数の動き,・求人数は、前年同月と比べるとかなり減少している。大手企業でも、様子を見ながら少しずつしか採用活動をしていない。
,,▲,人材派遣会社（社員）,求人数の動き,・例年夏期には求人数は減少するが、例年と比較しても約２割、他の事業所では５割近く減少している。
,,▲,新聞社［求人広告］（営業担当）,求人数の動き,・７月に入り自動車産業などで期間工の募集を行う企業も出てきているが、全体的にはまだ悪くなっている。
,,▲,職業安定所（所長）,求人数の動き,・新規高卒者の求人数が、大幅に減少している。４～６月の新規求人数は、前年同期比の減少幅が拡大している。また、中小企業緊急雇用安定助成金を申請している事業所で、倒産した事業所がみられる。
,,▲,職業安定所（職員）,周辺企業の様子,・主に外需頼みの製造業系企業の雇用調整が、消費を縮小させている。また、アパレルや食品など内需関連の製造業系企業の雇用調整にも波及しつつある。
,,×,新聞社［求人広告］（営業担当）,求人数の動き,・求人広告件数は、前々年同月比で８割減少、前年同月比で６割減少、３か月前比で３割減少、前月比で７％減少となっている。一本調子で下がり続けており、回復の見込みもない。特に製造業が多い地区では、前々年同月比で９割減少、前年同月比で85％減少と大きく落ち込んでいる。過去に例のないような落ち込みを記録している。
,,,,,
　６．北陸（地域別調査機関：（財）北陸経済研究所）,,,,,
,,,,,（－：回答が存在しない、＊：主だった回答等が存在しない）
分野,,景気の現状判断,業種・職種,判断の理由,追加説明及び具体的状況の説明
"家計
動向
関連

(北陸)",,◎,－,－,－
,,○,一般小売店［書籍］（従業員）,販売量の動き,・今期に入り売上、販売数とも前年を下回る日がなく、来客数も最近ではかなり良い数字で推移している。
,,○,乗用車販売店（総務担当）,販売量の動き,・新型ハイブリッド車の受注状況は極めて好調だが、生産が追いつかず受注残の上乗せが続いている。既販車の売上も新型ハイブリッド車効果で改善の傾向が見えている。
,,○,乗用車販売店（経理担当）,販売量の動き,・環境対応車への減税や補助金制度もあり、新型ハイブリッド車は好調に推移している。また、その他既販車への商談も少しずつだが増加しており、好影響が出てきている。
,,○,乗用車販売店（経理担当）,販売量の動き,・売れ筋車種は小型化しており、本格的な需要回復とは言いがたいものがあるものの、環境対応促進税制の恩典がかなり普及している。
,,○,観光型旅館（経営者）,来客数の動き,・夏休みに入り家族連れの客を中心に例年並みの集客ができている。
,,○,都市型ホテル（スタッフ）,販売量の動き,・前月まで苦戦していた宿泊部門も前年比プラスに転じ、全部門が前年を上回った。
,,○,通信会社（役員）,販売量の動き,・情報通信の分野では、客がより良いサービスを求める動きが活発で、テレビ多チャンネル契約、インターネット契約とも、前年比約1.5倍の増加となっている。また、デジタル化の動きも加速しており、従来のアナログ契約からデジタル契約への移行数は前年比約４倍で推移している。
,,○,通信会社（営業担当）,販売量の動き,・携帯電話の旧モデルの価格も安くなり、客の需要に応じた販売が出来るようになったため、来客に対しての購買率が高くなっている。
,,○,住宅販売会社（従業員）,販売量の動き,・例年になく販売量が悪かった４月と比較すると、７月は例年より販売量は悪いものの、４月より上向いている。
,,□,商店街（代表者）,お客様の様子,・インターネットでのセール品の売上は大きく伸びている。特に、若い層は休日利用、主婦等は平日に注文を出している。おしゃれで安価な衣料への反応は速く、しかも多い。
,,□,商店街（代表者）,お客様の様子,・例年、デパートのお中元商戦では土日は駐車場待ちの車で大渋滞が起こるが、今年は駐車場待ちの車列ができることもなくなった。お中元も老舗の「包装紙」のブランド力よりも、実需中心で価格重視の傾向が強いようで、割安感のあるスーパーに客を取られ、商店街への来街客数減の要因になっている。
,,□,百貨店（営業担当）,お客様の様子,・トレンド商品を中心に活発に動く時期であるが、これらの商品の売上は前年比約80％台に落ち込んでいる。食品・家庭用品に支出の重点を置き、ファッション支出を抑える傾向が顕著になっている。
,,□,百貨店（営業担当）,単価の動き,・依然として、低単価の商品を１点だけ買う客が多く、売上は前年比１割以上下回る状況が続いている。
,,□,スーパー（店長）,単価の動き,・相変わらず、低単価商品の動きは非常に良い。
,,□,スーパー（店長）,単価の動き,・客は必要な物のみをより安く購入している状況に変化はない。チラシの特売や他社との比較などをした上で、買い回る傾向が一層強くなっている。
,,□,スーパー（総務担当）,お客様の様子,・客単価の低下をカバーするため、単価上昇、来客数増加の目的でポイント５倍セールの回数を増やしている。しかしその当日の売上は伸びるが、他の日で前年を下回り、平均すると前年売上をなんとか維持している状態が続いている。客はかなり家計を考えて購買するようになってきている。
,,□,スーパー（営業担当）,お客様の様子,・天候の関係で客が購入するものは通常と違ってきているが、売上高は変わらない。
