Ⅰ．景気の現状に対する判断理由等,,,,,
,,○,商店街（代表者）,それ以外,・クレジットカード取扱高における前年同月比のマイナス傾向が、前月ごろから少しずつ止まりそうな状況である。また、来街者数が減少していない。
,,○,一般小売店［家電］（経理担当）,販売量の動き,・エコポイント制度の効果もあり、商品は比較的良く動いている。定額給付金に合わせ発行した連合商店会のプレミアム付商品券もあり、客に勧めやすい。
,,○,一般小売店［家具］（経営者）,それ以外,・店の来客数と販売量は依然として停滞しているが、ここに来て内装関係、リフォーム工事関係の仕事が大分増えてきている。
,,○,一般小売店［文具］（販売企画担当）,競争相手の様子,・６月に廃業した同業他社が結構多かったため、そういった所の客が若干流入してきている。個人の消費も若干上向きになってきている。
,,○,百貨店（広報担当）,お客様の様子,・数か月前のように前年比80％台に落ち込むということもなくなり、やや落ち着きを取り戻してきている。しかし、衣料品のセールでは厳選して買う客が実に多く、依然80％台と苦戦している。また、美術工芸品や宝飾品などで成約が増えるなど、一部高額商品にも動きが見えてきている。
,,○,百貨店（販売促進担当）,お客様の様子,・店舗全体としては、お中元商戦の個人顧客の贈答件数ダウン、法人顧客の件数、単価ダウンにより大きく苦戦している。その結果、７月の売上は前年比マイナスとなるが、婦人衣料、雑貨関連のファッションはプラスである。夏物値引き後に、比較的低価格で秋色の夏物定価品をきめ細かく提案した結果、顧客に受け入れられたといえる。お中元でも当用買いでも、客は価値と価格をよく見極め、納得すれば買上につながっている。
,,○,衣料品専門店（経営者）,来客数の動き,・雑貨を含め、季節商材や特価品などの種類を増やしたため客数が上がり、売上増につながっている。
,,○,衣料品専門店（経営者）,販売量の動き,・７月はほとんどの人に定額給付金が給付された。それに合わせてＤＭ、チラシを毎週打ったことで、売上、客数共に前年を大分上回りそうである。
,,○,衣料品専門店（営業担当）,販売量の動き,・夏本番で薄手のジャケットが良く売れている。関東は天候にも恵まれ、商売はしやすくなっている。事前に売れ筋を確保していたことが、数字を上げている結果となっている。
,,○,家電量販店（店長）,単価の動き,・エコポイント制度の効果が上がってきている。
,,○,家電量販店（営業統括）,販売量の動き,・ボーナス商戦とエコポイント制度の相乗効果で、テレビ、冷蔵庫の販売状況が上向いている。また、エコを売り物にした高機能商品の動きが良いため、客単価も上昇傾向にある。しかしながら、消費の実態は予断を許さない状況であり、消費者はあくまでも必要最低限での消費行動から抜け出せないのが実態である。
,,○,家電量販店（副店長）,お客様の様子,・夏のボーナス、エコポイント制度の効果により、客の購買意欲が高まっている。特に高単価商品を購入する客が多い。
,,○,乗用車販売店（経営者）,販売量の動き,・当業界は助成金の恩恵で、販売台数は伸びている。
,,○,乗用車販売店（経営者）,販売量の動き,・新車の販売量の統計にあるとおり、前年のリーマンショック以来、国産車で20数％、輸入車で50％に迫る受注量減があったが、それだけの買い控えがたまってきたことと、４月の新しい減税施策、その後の第２次施策が多少、車両の購入に前向きにさせる効果が出ている。国産車はエコカーと言われるハイブリッド車を中心に受注だけが先行し、既に来年３月くらいまでの受注が埋まってしまう状況になっている。ただし、エコカー以外の車両についてはいまだに受注が大変少ない状況が続いており、エコカーの受注が冷え込んだ場合にこのままの状況が続くかは分からない。
,,○,乗用車販売店（販売担当）,販売量の動き,・大型トラックの受注量は若干だが増えつつある。ただしこれは、環境に優しいトラックについては助成金が出るということが各ユーザーに浸透して、受注が増えてきたということである。この登録もせいぜい10月くらいまででないと環境助成金の予算が枯渇するので、多分そのあたりで止まってしまう。
,,○,乗用車販売店（店長）,販売量の動き,・売上台数は目標未達で事業計画上91.6％に終わったが、前年比では93.6％であり、前月に続き前年実績まであとわずかのレベルまでは回復してきている。純受注の目標も前年レベルまで回復し、来客数も前年強となっている。
,,○,都市型ホテル（スタッフ）,来客数の動き,・婚礼見込客の来客数が若干伸びている。
,,○,旅行代理店（従業員）,来客数の動き,・新型インフルエンザが落ち着き、５～６月の中止した旅行を秋にやろうという客が増えている。
,,○,通信会社（営業担当）,販売量の動き,・３か月前と比べ、テレビ有料サービスの契約が増加している。販促チラシに対する反響も増えつつある。
,,○,通信会社（営業担当）,販売量の動き,・テレビの解約が減少しつつあり、純増数も落ち着きを取り戻しつつある。２～３か月前よりは改善傾向にあるが、一本調子に上昇するとも思えない。インターネットは堅調だが電話が予算割れを起こしている。
,,○,通信会社（営業担当）,お客様の様子,・地上デジタル放送のテレビを購入している客が増えている。
,,○,通信会社（総務担当）,販売量の動き,・景気自体はまだ良いとは言えないが、３月に比べると客に動きが見受けられる。契約件数も微増となっている。
,,○,観光名所（職員）,来客数の動き,・観光地のため、週末に天候に恵まれたことが良い点である。
,,○,ゴルフ練習場（従業員）,販売量の動き,・練習場、付帯するレストラン共に前年を上回っているため、景気の状態はやや良くなっている。
,,○,その他レジャー施設［アミューズメント］（店長）,来客数の動き,・当店の来客数が３月くらいから前年を越えて来ている。2008年10月以降の大苦戦からは少し上向き、持ち直しの兆しが見えて来ている。母体となるショッピングセンターも、売上は前年を下回ったままだが、来客数は前年比100％超えを維持できている。ただし、客単価はまだ持ち直し切れていない状態である。
,,○,住宅販売会社（従業員）,お客様の様子,・契約が増えている。
,,○,住宅販売会社（従業員）,販売量の動き,・マンションの完成在庫の販売スピードが、やや速まってきている。
,,○,住宅販売会社（従業員）,販売量の動き,・販売は約４倍くらい良くなっている。また、３か月前は在庫を処分するような状況だったが、今は新しい新規のものが売れているので、良くなってきている。
,,□,商店街（代表者）,それ以外,・プレミアム付商品券や、市自体も様々な対策を行っているので多少上向きな感はあるが、天候にとても左右されている。非常に雨が多いことと、客が買物に来る時間に雨が降っていることが結構多いため、例年と変わらない。
,,□,商店街（代表者）,販売量の動き,・とにかくボーナスが相当減っているということで、買上客が非常に少なくなっていると皆が話している。こういう状態が続くようだとかなり心配である。
,,□,商店街（代表者）,来客数の動き,・商店会の会議で、最近多くの問屋が廃業しているとの話題が頻繁に出ている。小売業も大変厳しいが問屋もこの不況を乗り切るのに必死であるようで、今後の見通しが立たない。
,,□,一般小売店［家電］（経営者）,販売量の動き,・エコポイント制度で商品が伸びるかと思ったが、全然伸びない。たまたま取引先の設備工事等があったので売上はあったが、その他は、周りがエコポイントと騒いでいる割には苦しい。
,,□,一般小売店［生花］（経営者）,来客数の動き,・当店の立地上、やはりこの時期は海に行く人が多いため、客が店に寄ることが少ない。
,,□,一般小売店［酒類］（経営者）,お客様の様子,・近隣の酒販店が閉店し１年になるが、家庭における販売は一向に増えることはない。しかし、自治会又は各種団体等による注文を受けることはある。お中元用品の動きもほとんど無い。
,,□,一般小売店［衣料・雑貨］（経営者）,お客様の様子,・７月は気温が上昇したが、天候不順で売上を伸ばすことが難しく、少々値引きをしなければ売れない。後半はセールの前倒しで売上を伸ばしているが、中身、内容は落ちている。
,,□,一般小売店［茶］（営業担当）,販売量の動き,・来客数と客単価共に１か月間を通して落ちることなく、前年並みに推移している。
,,□,百貨店（売場主任）,来客数の動き,・中旬以降、来客数が徐々に減少している。特に土日、ファミリー層が減少している。レストラン街への来客が８掛けの状態であり、ボーナス減少の影響が考えられる。
,,□,百貨店（売場主任）,販売量の動き,・夏のクリアランスセールについては６月後半から各社が値引きを行ったが、思いのほか振るわない。再値引き、均一セールと訴求を掛けるが、目立った効果は出ていない。お中元ギフトは受注件数、売上共に前年比90％である。
,,□,百貨店（総務担当）,販売量の動き,・来客数及び買上客数共に前年割れが継続する。同業他社の情報も同様で、７月バーゲン期においても改善傾向にない。
,,□,百貨店（総務担当）,競争相手の様子,・近隣各店の売上は依然低迷を続けており、特に衣料品の売上は前年比２けた減から脱していない。
,,□,百貨店（広報担当）,販売量の動き,・７月１日からスタートしたクリアランスセールは１週目は売上前年比２けた減でスタートしたが、２週目以降の再値引き以後は２けた増と盛り返して推移している。値ごろ感のある独自商品やミドル女性に関心が高いスポーツテイストの商品は好調である。お中元は価格に左右されない商品が堅調に推移する反面、当店は早期割引を行っていないため、割引志向の客が大幅客数減につながっている。浴衣や水着等季節商材も２けた減となっている。
,,□,百貨店（営業担当）,来客数の動き,・全く変わっていない状況である。浮上の兆しは出ているものの一部分のみであり、今後も不安を感じる。実数も伸びていない。
,,□,百貨店（営業担当）,販売量の動き,・夏物クリアランスに入ってもまとめ買いがなく、客は吟味し購入している。
,,□,百貨店（販売促進担当）,単価の動き,・来客数、購買客数はほぼ前年のトレンドだが、全体の単価が下落している。ただ、お中元ギフトなどのシーズンマストニーズや、子供、家族関連の消費は惜しまない傾向がうかがえるため、下支えとなっている。
,,□,百貨店（販売促進担当）,来客数の動き,・お中元ギフトの客単価は前年とほぼ変わらないものの、来客数が前年を割っている。以前から続いている来客数の減少が、今もなお続いている。
,,□,百貨店（営業企画担当）,販売量の動き,・前月と変わらず、高額品を中心に売上が苦戦している。苦戦している中で健闘していた食品も、お中元の売上が苦戦し、前年に対してのマイナス幅が拡大している。
,,□,百貨店（業務担当）,単価の動き,・世間的には底を打ったとか少し上昇に転じたというような話があるが、一般的に客の動きを見ているなかでは、決してそのようなに感じる状況にはない。お中元ギフトにおいても単価が低下している。総体として食品はまあまあだが、その他衣料品等については、クリアランスのセール品もなかなか売上につながらない。非常に厳しい状況が続いていると実感している。
,,□,百貨店（副店長）,単価の動き,・夏のセールが不調で、客単価ダウンが続いている。レストランのディナー利用の減少傾向が続いている。
,,□,スーパー（店長）,単価の動き,・来客数並びに販売点数は横ばいだが、単価の低下が目立つ。
,,□,スーパー（統括）,来客数の動き,・前年比100％の来客数となることがほとんど無くなり、96～97％の状況が毎日続いている。
,,□,スーパー（統括）,販売量の動き,・３か月前と比べて来店客数は前年同期比でほとんど変わっていないが、売上高は95％前後と、引き続き買い控える人が多い状況である。
,,□,スーパー（仕入担当）,販売量の動き,・前年と比べて気温が下がっており、冷し中華、豆腐等の涼味商品の売上が前年割れを起こしている。
,,□,コンビニ（経営者）,来客数の動き,・来客数には毎回注目しているが、ほとんど変わっていない。
,,□,コンビニ（経営者）,単価の動き,・来客数、客単価共にばらつきがあって見通しが立たない。
,,□,コンビニ（経営者）,販売量の動き,・予想していたことだが、タスポ効果の需要も一回りし、今月からはたばこも落ち着き、全体の売上が前年比95％程度で推移している。それに加えて、気温が高く、夏らしくなればなるほど来客数が増えるものだが、天候の不順によって客数が増えず、販売量も伸びず、単価も上がらない。
,,□,コンビニ（経営者）,単価の動き,・当店は何とか前年の売上近くまで来ているが、これは特殊事情だと思うので、景気が上向いているかどうかは何とも言えない。
,,□,コンビニ（経営者）,お客様の様子,・弁当類を始め、プライベートブランド商品、ナショナルブランド商品共、買い得品に買上が集中し、売上、利益共、再び減少し始めている。
,,□,衣料品専門店（営業担当）,お客様の様子,・今月は梅雨明けが早く、それ以降は戻り梅雨があり、また、景気があまり良くないので売上は伸びていない。
,,□,家電量販店（経営者）,販売量の動き,・エコポイント制度対象商品の売上は好調だが、非対象商品は苦戦している。
,,□,家電量販店（店員）,来客数の動き,・現状、夏商戦自体が既に過ぎ、ボーナスが出ない企業が増えてきているため、販売店にとって厳しい状況になっている。
,,□,家電量販店（統括）,来客数の動き,・エコポイント３商品の販売実績は増加しているが、全体的な客数減は続いている。来客数が前年比100％をコンスタントにクリアできれば、景気回復の実感が持てる。
,,□,乗用車販売店（経営者）,販売量の動き,・整備は順調に入っているが販売は芳しくない。前年７月の３割減となっている。当社の取扱メーカーにハイブリッド車は無く、前年とあまり変わらない。ハイブリッド車は大分好調なようである。
,,□,乗用車販売店（営業担当）,販売量の動き,・個人的に見たら上がっているかのようにも見えるが、周りを見てみると思っているほど上がってはいない。
,,□,乗用車販売店（渉外担当）,販売量の動き,・エコ減税効果によるハイブリッド車は好調を維持しており、販売は前年比マイナス29％と若干持ち直している。しかし、ハイブリッド車購買に偏って総量は増えず、販売の底上げには依然時間を要する。中古車市場も売り玉不足で、高額商品の売行きが鈍く、販売は同マイナス30％で推移している。
,,□,乗用車販売店（総務担当）,販売量の動き,・相変わらず前年を下回る販売実績である｡減税、補助金制度導入により若干動きがあるものの、消費者には買い控え、慎重さがうかがえる。
,,□,住関連専門店（統括）,販売量の動き,・来客数も少なく、それに伴う販売量も少ない状態が続いている。
,,□,その他専門店［服飾雑貨］（統括）,競争相手の様子,・バーゲン期の盛り上がりに欠け、価格訴求でしか売上促進が図りづらい状況である。
,,□,その他小売［ゲーム］（統括）,販売量の動き,・夏休みに入り繁忙期ではあるが、家庭用ゲームは期待したほど販売数量は伸びていない。一方、携帯電話でのゲームは予想どおり堅調であり、ダウンロードの便利さ、廉価さが受け入れられている。
,,□,高級レストラン（支配人）,来客数の動き,・場所柄、企業、法人の利用が圧倒的に多くなるが、接待等での利用が回復して来ない。また、宴会においては大人数の会合が前年と比較しても減少している。
,,□,一般レストラン（経営者）,お客様の様子,・値上げができない現在、既存のメニューに１品プラスしたセットメニューで客単価を上げてみたところ、リピーターが増えてきている。
,,□,一般レストラン（店長）,来客数の動き,・ボーナスを当て込んで当ビルでもイベントを行って集客しようとしているが、そのイベントにも客は乗ってこず、来客数が全然増えない。特に夜は来客数が少ないのが実状である。
,,□,一般レストラン（スタッフ）,来客数の動き,・一応はしっかりと宣伝費を掛けているので、客は来ている。インターネット等に多く出しているのが良いのだと思う。安い所と比較するともう少し安いほうが良いと言われ、また、今は安いほうが良いということになっているが、当店は専門店なので、値段を落としてしまうと品質や職人を落とす等、質が落ちて良い物ができなくなってしまう。基本的には、良い物をしっかりと出していればそう落ちないのではないか。
,,□,都市型ホテル（スタッフ）,来客数の動き,・宿泊部門は稼働率、利用客数が伸びない。目立つ観光地が無い当社の立地では、ビジネス客が戻らないと客室の稼働は上がらない。レストランも個人利用を促進することで当社にできる販促活動をしているが、大ヒットにはならない。宴会の利用も、夏の暑気払いのセールスをしているが、居酒屋との競合でなかなか受注につながらない。
,,□,旅行代理店（従業員）,お客様の様子,・３連休明けから極端に客からの問い合わせの電話が減り、国内団体旅行の受注件数が減っている。今までに体験したことがない、静かな社内になっている。
,,□,旅行代理店（営業担当）,お客様の様子,・申込の電話が低調である。
,,□,タクシー運転手,来客数の動き,・５～６月に比べ、朝から終電までは客数が戻りつつある。終電以降の深夜の利用客はまだまだだが、中距離の客は多少出ている。
,,□,タクシー（団体役員）,お客様の様子,・今年に入ってから、契約顧客からの無線オーダーやチケット利用額が前年同月比で約20％ずつ減少していたが、今月は約10％減と下げ止まった感がある、しかし、利用客は減少したままで推移しており、厳しい営業が続いている。
,,□,タクシー（団体役員）,お客様の様子,・７月になってボーナスも出ているのだが、いまだに客の動きが悪い。
,,□,通信会社（営業推進担当）,競争相手の様子,・量販店での来客数は今までより増加傾向にあるように感じる。また、当社のサービス獲得も増加しているが、それ以外の販売チャネルでは苦戦しており、全体感としてはあまり変わらない状況である。
,,□,通信会社（企画担当）,販売量の動き,・テレビのデジタル化効果である。
,,□,通信会社（管理担当）,販売量の動き,・７月の販売量は微増している。持ち直し傾向であったが、再度停滞傾向である。
,,□,通信会社（営業担当）,お客様の様子,・サービスを他社へ切替える動きに歯止めが掛からず、前年同月比ではマイナスとなっている。
,,□,ゴルフ場（支配人）,単価の動き,・中間決算を行い、若干ではあるが収支面での減が目立つ。秋口のシーズンに向けての集客を期待する。
,,□,パチンコ店（経営者）,競争相手の様子,・競争相手の様子や来客数、当店の動きを見ると、さほど変化がない。人数的にも横ばいである。
,,□,その他レジャー施設［ホール］（支配人）,販売量の動き,・特別な公演を除き、前年比で売上が落ちており、廉価なものであっても同様の動きとなっている。また、駅に隣接している大型ショッピングセンターにはスーパーもあり、駐車場も完備しているので、週末は自動車が渋滞を起こしているが、全体的には前年より売上は減少しているように聞いている。
,,□,その他レジャー施設（経営企画担当）,お客様の様子,・プロ野球関連商品、サービスについては、対戦カードや曜日などによりばらつきはあるものの、客からの引き合いは強い。ただ、高額商品、サービスへのニーズは今一つであり、ホテル宿泊等の波及効果も弱い。
,,□,設計事務所（所長）,お客様の様子,・客も当社もどのように進んでいいか見当もつかず、また長い間計画した物件も融資の問題等で進めることができず、八方ふさがりの状態である。
,,□,設計事務所（所長）,お客様の様子,・客との折衝のなかでも、業種が違っていても厳しさは以前と変わらないと言っている。当社の業界も３か月前とほとんど変化していない。
,,□,設計事務所（職員）,それ以外,・依然として大型物件の発注量は低迷しており、自社の前期末決算において、売上は目標値にとどまっている。
,,□,住宅販売会社（従業員）,販売量の動き,・５月のゴールデンウィーク等の時期には集客は前年並みか前年よりやや良かったが、その割に契約は伸びず、相変わらず苦戦をしている。住宅減税の効果はあまり感じられない。
,,□,住宅販売会社（従業員）,販売量の動き,・今月の販売量は目標数字の約60％で、景気はどちらとも言えない。３か月前と比べても販売量は多少の増減はあるものの、景気は変わらない。金利はやや上昇傾向にあるが、物件価格が低価格に設定されており、今が買い時と判断して購入に踏み切る客も多い。
,,□,その他住宅［住宅資材］（営業）,販売量の動き,・販売量は低迷したまま継続している。
,,▲,商店街（代表者）,来客数の動き,・消費者は大型店のショッピングセンターへと足が向いているようである。地元の商店街には今一つ人の流れが来ないため、流通のアンバランスができている。
