Ⅰ．景気の現状に対する判断理由等,,,,,
,,○,百貨店（売場主任）,来客数の動き,・ゴールデンウィークの天候の安定が来客数増につながり、特に低迷していた衣料品関係の動きが上昇している。
,,○,百貨店（総務担当）,販売量の動き,・衣料品の売上は依然前年を下回っているものの、回復がみられる。また、飲食や生活雑貨も良くなってきている。
,東京都,○,百貨店（広報担当）,販売量の動き,・都心の店舗を中心に、約２年ぶりに売上が前年を上回る見込みである。食品、婦人、紳士衣料、雑貨全般で前月を上回る改善となっている。前半は天候にも恵まれたゴールデンウィークと、母の日ギフト顧客に向けた企画提案が効を奏し、後半は初夏のライフスタイルに合わせて、レインウェアや自然との共生を意識した企画等が底上げとなり、来客増につながっている。ただし、前年は新型インフルエンザの影響などで大きく数字を落としているため、前々年比ではまだ２けた減である。
,東京都,○,百貨店（広報担当）,販売量の動き,・４月は天候が安定せず、春物の動きが今一つであったが、それでもおおむね前年の売上に近かった。５月に入って天候も安定し、売上は好調に推移している。超高額品とまではいかないが、100万円以内の宝飾時計類も動いてきている。
,東京都,○,百貨店（営業担当）,お客様の様子,・以前は目的のものを買ったら帰る客がほとんどであったが、最近では買物後にも買い回りをする客が増えてきている。
,東京都,○,百貨店（営業担当）,来客数の動き,・ゴールデンウィークの動員を含め、今月に入って来客数に伸びが見られる。話題性、イベント性の高い新規物産展の動員効果もあったが、３か月前と比較しても明らかに来客数の伸びがみられる。ただし、来客数の伸びに対して売上の伸びが比例することはなく、売上は既存店ベースでは若干前年割れの状況である。
,,○,百貨店（販売促進担当）,お客様の様子,・婦人服飾領域は単価、数量共にやや低下傾向だが、これまで各家庭で抑えてきたと思われる紳士領域で伸長がみられる。後回しにされがちな紳士服の伸長は、今後の個人支出伸長を期待できる証左として、これから必須の機能性商材や子ども手当による子ども用品の消費を促進するポイントを訴求、伝達していきたい。
,東京都,○,百貨店（業務担当）,それ以外,・前年はちょうど新型インフルエンザの影響が非常に大きく出た月であり、前々年に対して落ち幅が相当大きかった。その前年に対して何とかプラスであるということを考えると、これをもって景気が良くなったと判断できるかはやや疑問である。しかし、現在の景気は若干上向きな部分があるので、やや良い。
,,○,百貨店（営業企画担当）,販売量の動き,・月前半は特殊要因により各カテゴリー全般に動きが良かったが、その状況が後半以降も継続している。
,,○,百貨店（店長）,お客様の様子,・以前はいくら話題性があっても本当に必要な物しか動かなかったが、前月同様、話題性のある商品の動向が良い。
,,○,百貨店（販売管理担当）,来客数の動き,・来客数、買上客数、客単価は共に前年並みで推移している。衣料品が一部前年を超えてきており、回復の兆候が出始めている。
,東京都,○,百貨店（営業企画担当）,来客数の動き,・５月は来客数、売上共に、前年も予算も達成している。天候不順ではあったものの、初夏物、レイングッズが好調であり、全体的には食品、リビング関連、雑貨の好調さが衣料品をけん引している。ただし、客単価はまだ低く、来客数の伸びで辛うじてプラスを保った感もある。
,東京都,○,スーパー（店長）,販売量の動き,・価格に対してかなり敏感な部分はあるが、取扱物量は以前に比べてかなり増えてきている。単価の下落もなく、ほぼ前年を維持しているので、以前よりは期待が持てるようになってきている。
,,○,コンビニ（経営者）,来客数の動き,・天候が良いと来客が非常に多い。ゴールデンウィークにおいても客の出入りが非常に多かったことから、やや良くなっている。
,,○,コンビニ（経営者）,来客数の動き,・販売の中心が低価格のプライベートブランド商品のため、客単価は低迷しているが、矢継ぎ早に実施したセールの影響で客数が増加し、売上も上昇している。
,,○,コンビニ（経営者）,来客数の動き,・当店の前の再開発事業が終わり、４月後半から５月中旬に掛けて新しいテナントが次々と開店している。また、道路のある部分が広くなって交互通行ができるようになったり、目の前の駐車場が一般開放されたりと、人の流れが大分変わってきている。そのようななかで、今まで土日は暇だったのが、逆に忙しくなってきている。来客数が２割ほど増え、その分客単価は低いものの、売上が上がっている。
,,○,コンビニ（店長）,お客様の様子,・父の日ギフトは、店員の努力もあって前年度を達成している。こういったイベント関係は客が省くこともあるが、省かず継続してくれれば、売上につなげていくことができる。
,,○,衣料品専門店（経営者）,来客数の動き,・５月も天候の変化が激しい月となったが、晴れて暖かい日は来客数が上がり、買上点数も増えている。
,,○,衣料品専門店（店長）,お客様の様子,・以前と比べ、価値を認めれば、金額に関係なく購入するケースが増えてきている。
,,○,衣料品専門店（営業担当）,来客数の動き,・５月の前半は好天候に恵まれ、また行楽期と相まって衣替えの季節である。そのため、やっと売れてきている。
,東京都,○,家電量販店（営業統括）,販売量の動き,・テレビの販売台数が３月をピークに落ち込んでいるが、商品単価は上昇傾向にある。テレビ、冷蔵庫、洗濯機、エアコンなど大型家電製品に関しては、前年比で若干落ち込んではいるものの、全体では販売品目数が増加している。また、外国人観光客の商品購入数量が多くなってきており、前年比で２倍になっている。
,,○,乗用車販売店（総務担当）,販売量の動き,・登録ベースでは決して楽観できないが、新型車の投入等、予約販売が進んでいる関係上、受注は好調に推移している。エコカー購入補助金制度の活用も追い風になっている｡
,東京都,○,その他小売［雑貨卸］（経営者）,来客数の動き,・来客数はやや増加してきたが、最近の欧州発の金融危機が不安である。
,,○,その他小売［ショッピングセンター］（統括）,来客数の動き,・来客数も順調に伸びてきており、客単価も３か月前と比べて上昇しており、下げ止まり感が出てきている。
,東京都,○,その他小売［ゲーム］（統括）,それ以外,・３Ｄテレビ、新型多機能情報端末の発売で、コンテンツ業界への期待感が大きく膨らんでいる。実際、業績に反映するのは１年後になるが、気分は高揚している。
,,○,高級レストラン（副店長）,来客数の動き,・前年比での来客数に、わずかながら伸びがある。
,,○,旅行代理店（経営者）,お客様の様子,・不況のあおりで同業者がある程度閉店したため、来客が多くなったせいかもしれないが、従来どおりの旅行への関心がまた盛り上がってきたように見受けられる。実行に移すかはあまり把握できていないが、もしかしたら良くなってきているのではないかという感じを受けている。
,東京都,○,旅行代理店（従業員）,お客様の様子,・国内団体旅行の問い合わせの電話件数が増えている。それに伴って受注件数が増えている。
,東京都,○,旅行代理店（営業担当）,お客様の様子,・申込の電話が増えている。
,,○,通信会社（営業担当）,販売量の動き,・サッカーワールドカップを控えていることもあり、多チャンネルサービスへの加入は堅調に推移している。ただし、戸建は地上デジタル放送対策が進んでおり、加入数は頭打ちな状態である。
,東京都,○,通信会社（営業担当）,販売量の動き,・新年度に入り、５月もテレビ、ネット電話、携帯は共に目標達成見込みである。賃貸集合住宅の業者向けの販売が好調である。
,東京都,○,観光名所（職員）,来客数の動き,・ゴールデンウィークに大変天候に恵まれ、旅客が大変伸びたことから、良くなっている。今後もこの天候が続く限りは、徐々に良くなっていく。
,,○,ゴルフ練習場（従業員）,販売量の動き,・５月は前年同月比マイナス５％くらいなのだが、ゴールデンウィークの集客が前年よりやや落ちている。ただし、来客数等は増えており、今後景気は良くなる。付帯するレストランも前年比を上回り、状況は良いようである。
,,○,ゴルフ場（支配人）,来客数の動き,・３か月前に比べて、来客数の動きが１～２割程度増えている。
,東京都,○,その他住宅［住宅資材］（営業）,販売量の動き,・電気関係を中心にリーマンショック前のアルミの発注量に戻ってきている感じはするが、建築関係は物件数も少なく、厳しくなっている。ただし、以前に比べれば良い業種が出てきたということで、上向きになっている。
,東京都,□,商店街（代表者）,それ以外,・クレジットカードの取扱高は、前年同月比を割らなくなっている。しかし、イベントの反応が今一つで、消費者の真意がつかめない。
,東京都,□,商店街（代表者）,来客数の動き,・今年は天候不順が特にひどく、野菜等もかなり値上がりしている。客はいろいろな面で、お金の使い方をかなり考えながらやっている。こういう状態では、景気は良くならない。
,,□,商店街（代表者）,来客数の動き,・催事をやっている時に客がそこそこ来ることはあるが、催事が終わって平静の店の中での販売になると、ほとんど客がいない。なかなか店内に入ってくる客も少ないし、入ってきた客が購入する率も減っている。
,,□,一般小売店［生花］（経営者）,単価の動き,・客は価格が高い物には手を出さないが、手ごろな価格の物は割とすぐに買ってくれる。
,東京都,□,一般小売店［衣料・雑貨］（経営者）,お客様の様子,・５月は中旬ごろまで天候に恵まれ、月初めからよく売れている。全体で前年の実績を確保しており、まずまずである。中高年の購買力は強い。
,,□,一般小売店［酒類］（経営者）,来客数の動き,・相変わらず来客数は少ない。例年どおり各種団体の総会があり、その需要があるのみである。
,,□,百貨店（総務担当）,来客数の動き,・来客数に全然改善がみられず、売上についても同様の動きになっている。
,東京都,□,百貨店（営業担当）,単価の動き,・単価の下げ止まりはあったものの、維持している状況であり、決して上がってはいない。
,東京都,□,百貨店（副店長）,お客様の様子,・来客数、買上客数は伸びているが、単価の動きが安定しない。
,東京都,□,百貨店（営業企画担当）,販売量の動き,・客単価の低下と、天候不順や気温が低めに推移した影響もあり、衣料品を中心に苦戦している。
,,□,スーパー（経営者）,来客数の動き,・客数が以前よりも落ちており、多少悪くなっている傾向にある。やや悪くなっているというほどではないが、変わらないというよりちょっと悪いという状況である。
,,□,スーパー（店長）,販売量の動き,・高齢化社会と言われているが、確かに当店もそうである。その中で食費は大まかに計算されており、当店の販売量の動きは前年と比べて平行しているため、変わらない。
,,□,スーパー（店長）,競争相手の様子,・他社も価格訴求で広告品、定番品の販売を行っている。それで売上利益を確保できるか疑問だが、集客が大きな目的であろう。
,東京都,□,スーパー（総務担当）,お客様の様子,・食品については、価格に非常に敏感である。また、衣料品、住居品については、訳有り商品など価格が非常に下がったものに反応している。
,東京都,□,スーパー（営業担当）,単価の動き,・天候の不順等が影響し、季節商材の稼動が良くない。
,,□,スーパー（仕入担当）,販売量の動き,・ゴールデンウィーク以降、天候要因もあって夏物商材の動きが緩慢である。集客のための価格訴求によって単価が下がり、売上の底上げにつながらない。
,,□,スーパー（仕入担当）,単価の動き,・ゴールデンウィークは天候に恵まれ、客単価も上がり良かったが、中旬以降、その反動で消費防衛意識が高まり、客単価が下がっている。
,東京都,□,コンビニ（経営者）,来客数の動き,・来客数と共に客単価も下がっている。
,,□,コンビニ（経営者）,単価の動き,・政治経済は不透明感が強く、将来に対する何とない不安感から、どうも財布のひもは固そうである。
,,□,乗用車販売店（経営者）,販売量の動き,・当社は整備と販売をしているが、整備は順調に入っているが、販売は前年度より２割減となっている。
,,□,乗用車販売店（営業担当）,販売量の動き,・販売量の動きもそうだが、販売車種が小型車や軽自動車が中心となっており、高額車種の需要が無くなってきている。
,東京都,□,乗用車販売店（販売担当）,販売量の動き,・エコカー購入補助金が大型トラックについては６月初旬に切れるという状況になってきている。補助金で受注を拡大してきていたが、ここにきて補助金が無くなるということが出てきたため、７、８月以降の受注が全く取れていない。また、景気は若干上向きだったが、ギリシャ財政危機等があり、経営者が先行き不透明感に陥り、将来の設備投資を控えている。この数か月間、悪い状況の中で変わらない。
,,□,乗用車販売店（店長）,販売量の動き,・３か月前比ということでは、変わらない。前月に比べて売上台数は、店舗計は未達だが、社内計は達成となっている。台数を大きく落とした前年に比べれば、５月は大幅な回復となっているが、エコカー購入補助金が続く限りの話であり、補助金が無くなった時は非常に不安である。
,,□,住関連専門店（統括）,販売量の動き,・販売量があまりなく、増えていない状態で変わらず動いている。
,,□,その他専門店［服飾雑貨］（統括）,お客様の様子,・ゴールデンウィーク期間中、相当数の来客があったが、買上率等が低迷している。
,東京都,□,高級レストラン（支配人）,来客数の動き,・接待などは以前に比べて確実に減っており、今後急速な景気の上昇は難しいが、全体的にはやや上向きである。
,,□,一般レストラン（経営者）,来客数の動き,・少しは良くなっているものの、それは商売柄、２月は一番暇な時期だったためである。景気はやや悪いまま、あまり変わらない。
,東京都,□,一般レストラン（経営者）,来客数の動き,・近くに大手スーパーが進出し、人の流れが変わった。限られた客の取り合いの状態は、ランチに顕著に表れている。
,東京都,□,一般レストラン（店長）,単価の動き,・お金を使わないという客が非常に多く、単価が少しも上がってこない。
,東京都,□,スナック（経営者）,来客数の動き,・今月はゴールデンウィークだったせいか、客足が少し止まっている。団体客も少なく、個人客だけだったので、売上も落ちている。
,,□,都市型ホテル（スタッフ）,単価の動き,・月間の来客数は少しずつ伸びている。前年比で宿泊は１割、レストランと宴会は５％増加したが、１人当たりの単価が下落しており、下げ止まらない。安い料金の期間限定商品を次々に打ち出し、単価下落を補うだけの集客を図っているので、何とか前年以上の売上を達成できている。
,東京都,□,都市型ホテル（スタッフ）,来客数の動き,・来客が前年比で２割減っている。
,東京都,□,旅行代理店（支店長）,販売量の動き,・本来であればゴールデンウィーク明けから団体の動きが活発になってくるのだが、例年や前年と比べて動きが悪く、特に６月の販売量が非常に落ち込んでいる。原因としては、景気がなかなか上向かないので、旅行を控えるという傾向がみられる。
,東京都,□,タクシー運転手,お客様の様子,・ゴールデンウィークがあった関係で当業界にとっては厳しい状況であるが、思っていたほど落ち込みはない。一応、底を打った感じである。
,,□,タクシー運転手,お客様の様子,・ゴールデンウィークは例年より長く、工場や業種によっては11連休の会社もある。ゴールデンウィーク中の仕事関係の利用客が少なく、また夜の飲食店街の客も少なく、前年比で10％減である。
,東京都,□,通信会社（総務担当）,お客様の様子,・契約解除は一時期より減少しているものの、新規契約はいまだに少なく、家計における娯楽費は締め付け状態にある。
,,□,通信会社（営業担当）,お客様の様子,・例年新入居の時期は学生を中心にインターネットサービスの加入が増えるが、前年同時期と比べても明らかに加入数が減っている。理由として、両親が出費を抑えたいというケースが多く見受けられる。
,東京都,□,通信会社（営業担当）,お客様の様子,・契約数が減少している。
,東京都,□,通信会社（営業推進担当）,競争相手の様子,・月間目標に対する達成率は依然厳しい状況が続いている。競合他社との競争が激化しているようである。
,,□,通信会社（局長）,販売量の動き,・契約数は前年より伸びてはいるものの、加入者１人あたりの月額平均収入は下がる傾向にあるので、景気が良くなっているとはあまり感じられない。
,,□,ゴルフ場（従業員）,来客数の動き,・ここ数年、ゴールデンウィークは通常料金より値引きを行い、ダイレクトメール発送等で広告宣伝も行っている。予約はほぼ一杯、天候にも恵まれたが、それでも前年を上回ることができない。
,東京都,□,パチンコ店（経営者）,競争相手の様子,・当社の店舗も含めて、競争相手の客数が少し上がったり下がったりしているが、平均を取るとさほど変化はない。
,,□,その他レジャー施設［ホール］（支配人）,販売量の動き,・残念ながらこの数か月は良くない状態が続いている。広報活動を強化しているが、当施設でのチケット販売は、企画内容の影響もあるかと思うが、高額なものだけでなく、全体として前年比で15％程度落ちている。今のところ好転しそうな材料が見当たらない。
,東京都,□,その他レジャー施設（経営企画担当）,お客様の様子,・プロスポーツ関連商品、サービスに対する顧客のニーズが一巡してきている。ホテルは稼働率が改善しているものの、単価の下落が大きい。
,,□,その他サービス［保険代理店］（経営者）,販売量の動き,・上品質の商品に気持ちが向かない。余計なものは買わない。
,東京都,□,設計事務所（所長）,お客様の様子,・客を含め、どのように動いたら良いか皆目見当が付かず、ただ単に様子見の段階が続いている。また、銀行融資の件も、途中で見当が付かなくなるような状態が続いている。
,東京都,□,設計事務所（職員）,それ以外,・良し悪しの方向性に関する具体的な現象が見られない。
,,▲,一般小売店［和菓子］（経営者）,来客数の動き,・５月は天候不順な日が多く寒暖の差が激しい日が続いたため、客の来店、夏物商材などの売行きにかなり影響している。
,,▲,一般小売店［家電］（経理担当）,お客様の様子,・当店の場合はテレビ需要があるので適度に商品は動いているが、それ以外は良くない。３月にテレビが良く売れたので、それに比べると良くない。
,,▲,一般小売店［家電］（経理担当）,来客数の動き,・３月でエコポイント制度が一区切りとなり、極端に来客数が減っている。また、必要のない物は買わず、極端に安い物しか売れなくなっている。
,東京都,▲,一般小売店［文房具］（経営者）,販売量の動き,・需要期が大体終わったところなので、その点では仕方ないが、天候に非常に左右されて売上が悪いようである。
,東京都,▲,一般小売店［米穀］（経営者）,競争相手の様子,・小麦粉が値下がりし、米も安くはなっているが、売れない。海老を食堂に卸している問屋も、５月は悪いと言っている。競争相手のスーパーも売れず、売れる物は激安値下げ品のみとのことである。街の景気は良くなる感じがしない。
,,▲,一般小売店［印章］（経営者）,来客数の動き,・当社の製品は目的買いのため、需要が非常に低迷している。また、無くてはならない印章業だが、新しい会社を作るという人がまずほどんどおらず、非常に厳しい。
,,▲,一般小売店［祭用品］（経営者）,単価の動き,・必需品以外を仕分けしているようで、受注が明らかに減っている。客単価もかなり落ち込んでいる。
,東京都,▲,一般小売店［茶］（営業担当）,お客様の様子,・今月は新茶の出始めの月間で売上増を期待したが、ふたを開けてみると、あまり成果が感じられなかった。予約新茶という前評判の新茶の時期が終わり、例年は新茶を飲んだらおいしかったのでまた追加で買おうと言う客が多いが、今年は少ない。
,,▲,一般小売店［茶］（営業担当）,販売量の動き,・今年は低温により新茶の発売時期が遅れ、上旬にあるべき売上がずれ込んでいる。発売が遅れたのを機に財布のひもを締めたのか、購入意欲がみられず、客数、売上は共に大きく減少している。
,,▲,百貨店（企画担当）,それ以外,・売上、来客数は共に４月期の状況と比較すると、鈍化してきている。
,,▲,衣料品専門店（経営者）,お客様の様子,・婦人アウターについて、来店しても購入せず帰ってしまうケースが今月は多い。寒暖の差が大きく、客は明日着ていく物に困っている感じで、迷ったまま帰るという状況が続いている。
,東京都,▲,その他専門店［雑貨］（従業員）,来客数の動き,・ゴールデンウィークのイベントがあったにもかかわらず、あまり来客数が伸びていない。
