Ⅰ．景気の現状に対する判断理由等,,,,,
,,▲,コンビニ（店長）,販売量の動き,・盆過ぎから雨が多く気温も低下したことから、来客数、売上共に鈍くなっている。たばこの供給が正常に戻っても、まとめ買いの客がなかなか戻ってこない。たばこに関して言えば節約ムードが続いている。
,,▲,衣料品専門店（経営者）,来客数の動き,・来客数の減少と客単価の低下が目立っている。
,,▲,衣料品専門店（販売企画担当）,競争相手の様子,・競争相手で忙しくしているのは、原価割れしているような安価な商品を取り扱っているところばかりである。高価な商品を取り扱っているところは暇にしている。
,,▲,家電量販店（店員）,販売量の動き,・アナログ放送終了に伴うテレビの駆け込み需要が終わって反動減が来ることは予想していたが、予想以上に落ち込んでいる。パソコンの売上は伸びているものの、その他の商品は売行きが悪い。
,,▲,乗用車販売店（経営者）,来客数の動き,・これといった新型車もなく、需要低迷が続いている。
,,▲,乗用車販売店（従業員）,来客数の動き,・前月までに比べると、販売量や来客数、販売量の動きが少し悪くなっている。
,,▲,乗用車販売店（従業員）,販売量の動き,・新車販売台数が前年比60％前後で推移しており、車が売れていない。エコカー補助金があった前年と比べると落ち込みが大きい。
,,▲,その他専門店［雑貨］（店員）,お客様の様子,・客は必要最低限の機能でより安価なものを求めており、客単価はどんどん下がっている。
,,▲,高級レストラン（スタッフ）,来客数の動き,・来客数が減少している。放射性物質による食品汚染の風評被害もあって、特に土日の家族客が大きく落ち込んでいる。
,,▲,一般レストラン（スタッフ）,来客数の動き,・大手企業の輪番休業ならびに原発事故による放射性物質の風評が影響して、来客数が減少している。
,,▲,スナック（経営者）,来客数の動き,・盆休みを取る客が多く団体客もあまりいないため、繁華街は全体的に人通りが少なく来客数が伸び悩んでいる。売上も前年に比べると一割ほど減少している。
,,▲,都市型ホテル（経営者）,単価の動き,・競争激化の部分も含まれてはいるが、買い控えや旅行控えにより、ますます客単価が減少している。
,,▲,都市型ホテル（支配人）,来客数の動き,・宿泊客数はビジネス利用を中心に減少している。レジャーも今一つである。宴会の予約件数も前年比マイナスである。
,,▲,旅行代理店（経営者）,お客様の様子,・東日本大震災の影響はまだ残っており、やや悪い状況である。
,,▲,通信会社（サービス担当）,販売量の動き,・３か月前に比べ光インターネットの販売数が20％ほど少なくなっている。
,,▲,パチンコ店（経営者）,販売量の動き,・来客数の動きからみると、やや悪くなっている。
,,▲,美容室（経営者）,競争相手の様子,・年々美容室が近所に増加しており、競争が激化している。
,,▲,設計事務所（職員）,お客様の様子,・客や取引先から景気の良い話は聞こえてこない。
,,×,一般レストラン（経営者）,お客様の様子,・店がある繁華街は、夜遅くまで出歩く人が全くいない。
,,×,理美容室（経営者）,来客数の動き,・例年であれば盆があって忙しい月のはずであるが、来客数は減っている。
,,×,美容室（経営者）,お客様の様子,・今年の夏も暑さが厳しく、客の来店回数が１回ずつ減少している印象を受ける。自動車を利用する客はコンスタントに来店してくれるが、徒歩や自転車で来店していた客の出足が悪くなっている。
,,×,理容室（経営者）,お客様の様子,・客の来店頻度は減少している。また、安い店に客が流れてしまっている。
,,×,住宅販売会社（経営者）,それ以外,・不動産購入に際し、購入代金の一部に充てる融資がなかなか金融機関から受けられず、購入に至らないケースが非常に多くなっている。
"企業
動向
関連

(東海)",,◎,＊,＊,＊
,,○,食料品製造業（経営企画担当）,受注量や販売量の動き,・市場価格は相変わらずデフレ傾向から脱していないが、販売量は前年を上回る数字にまで回復しつつある。
,,○,紙加工品［段ボール］製造業（経営者）,受注量や販売量の動き,・主要取引先である自動車関連企業からの受注量がやや良くなっている。
,,○,電気機械器具製造業（経営者）,受注量や販売量の動き,・東日本大震災による影響は５月が底となり、第２四半期は急速に回復している。
,,○,輸送用機械器具製造業（総務経理担当）,それ以外,・完成車メーカー、その他大手部品メーカーは年末にかけて大量に期間工を採用する予定であるが、なかなか人手が集まっていない。
,,○,輸送用機械器具製造業（財務担当）,受注量や販売量の動き,・受注は急に回復しており、休日返上で生産しているラインも出てきている。
,,○,建設業（経営者）,受注量や販売量の動き,・マンション、戸建共に順調な売行きである。来客数も多くなっている。
,,○,輸送業（経営者）,受注量や販売量の動き,・製造メーカーを中心に物量が増えるとともに、平準化してきている。
,,○,輸送業（エリア担当）,それ以外,・最近はリースの更新契約を打ち切って、買い取る方法で自社の資産に繰り入れ、金利支払を抑えていくようなケースが増加している。企業の体力はだんだん回復してきている。
,,○,輸送業（エリア担当）,受注量や販売量の動き,・発送、到着共に増えている。自動車メーカーの増産による影響か順調に推移している。ただし、人的コストが上昇していることが気になる。
,,○,金融業（従業員）,取引先の様子,・周囲に自動車関連の企業が多いため、現在は木金休みの体制になっているが、数か月先には仕事量が増加し、休日は週１日ほどになるとの話を聞いている。景気はやや良くなっている。
,,○,金融業（法人営業担当）,取引先の様子,・自動車部品メーカーの生産が増加しているほか、物流が活発化していることから、プラスチック製品メーカーでは輸送用パレット、コンテナーがフル生産の状態となっている。
,,○,会計事務所（社会保険労務士）,取引先の様子,・雇用調整助成金を受給している顧問先は無くなっている。売上、利益率共に良くなってきている。
,,○,その他サービス業［ソフト開発］（社員）,取引先の様子,・全体的な売上は厳しいままであるが、特定の顧客については今までの停止案件が動き出している。
,,□,化学工業（企画担当）,受注量や販売量の動き,・東日本大震災後の海外からの在庫引取りで売上は一時的に増加しているが、予算目標程度の水準である。
,,□,金属製品製造業（従業員）,競争相手の様子,・少しずつ忙しいという話を聞くが、同業者の廃業によるもので、市場が回復しているわけではない。単価が厳しいので忙しくても利益につながっていない。
,,□,一般機械器具製造業（営業担当）,受注量や販売量の動き,・中国、タイなどのアジア及び北米自動車業界からの引き合い量は変わらないが、円高のため価格競争力が失われ、受注に至らないケースが増えてきている。
,,□,電気機械器具製造業（営業担当）,受注価格や販売価格の動き,・販売量は回復傾向だが、円高の影響もあり売上としてはあまり変わらない。
,,□,電気機械器具製造業（企画担当）,受注量や販売量の動き,・東日本大震災の影響による業績悪化は予想ほど悪くはなく、生産減による品不足を見込んだ注文が一段落しつつある。
,,□,輸送業（従業員）,受注量や販売量の動き,・猛暑効果で荷動きが活発である。
,,□,輸送業（エリア担当）,受注価格や販売価格の動き,・売上は前年同期比で9.7％のプラスとなっている。前年と比較すると確かに良くはなっているものの、良くなってきたという実感は乏しい。
,,□,輸送業（エリア担当）,受注量や販売量の動き,・輸入貨物は増加しているが、輸出貨物は減少している。
,,□,通信業（営業担当）,取引先の様子,・取引先との受注状況においては変化はみられない。投資対効果が明確でないものへの投資が手控えられている。
,,□,金融業（企画担当）,取引先の様子,・足元は回復基調も見られつつあるが、円高、政治情勢など景気がよくなる要素はなく３か月前と変わらない。
,,□,広告代理店（制作担当）,取引先の様子,・大型案件の受注はほとんどなく、現状維持といった感じが続いている。
,,□,行政書士,受注量や販売量の動き,・荷動きは通常と変わりがない。
,,□,会計事務所（職員）,取引先の様子,・不動産賃貸業者や温室みかん栽培業者などの中小企業の経営状況は悪化しているところが多い。一方、自動車関連下請業者など中堅の事業者については少しずつ受注が回復している。
,,□,その他サービス業［広告印刷］（従業員）,受注量や販売量の動き,・悪い状態がそのまま続いている。
,,□,その他非製造業［ソフト開発］（経営者）,取引先の様子,・当社も競合先もまずまず忙しい状態が続いているが、パートや従業員の勤務日数は減少傾向にあり、円高の影響が早くも出始めている。
,,▲,パルプ・紙・紙加工品製造業（総務担当）,受注量や販売量の動き,・自動車関連の受注は良くなってきているが、節電や円高などの影響で他の落ち込みが大きく、厳しい状況となっている。
,,▲,窯業・土石製品製造業（社員）,受注量や販売量の動き,・取引先の生産量が減っており、消耗品の注文が少ない。全体的に受注量が少なくなっている。
,,▲,鉄鋼業（経営者）,受注量や販売量の動き,・自動車業界の製造ラインは生産量を増やしているものの、生産に関連するもの以外は新規の仕事がほとんどない。
,,▲,電気機械器具製造業（経営者）,取引先の様子,・東日本大震災により取引先の業績が大幅に悪くなり、全面的な設備投資の減少によって受注が減少している。
,,▲,建設業（営業担当）,受注量や販売量の動き,・３か月前と比べると、毎月発生していた定例的な仕事が２か月に１回に減っているので、やや悪化している。
,,▲,不動産業（経営者）,取引先の様子,・最終的な決済が延期又は解除されるケースが生じている。
,,▲,公認会計士,それ以外,・東日本大震災の影響で消費者の消費が冷え込んだため、取引先のサービス業を中心に業績は悪化している。また、低下していた操業度が急に向上したことや土日営業の影響を受けて、残業代や人材派遣費等のコストの増加につながっている。
,,▲,経営コンサルタント,取引先の様子,・住宅地の市況がまだ戻っていない。
,,×,金属製品製造業（経営者）,受注価格や販売価格の動き,・受注価格が低下している。
,,×,企業広告制作業（経営者）,それ以外,・所得の格差拡大は、消費に積極的な人とそうでない人に二極化している。
"雇用
関連

(東海)",,◎,－,－,－
,,○,人材派遣会社（経営企画）,周辺企業の様子,・客の技術者需要が堅調である。
,,○,人材派遣会社（社員）,求人数の動き,・週末を中心に求人数が増加している。平日にも法人関係の宴会が多少戻ってきている。
,,○,人材派遣会社（営業担当）,周辺企業の様子,・自動車産業を中心とした生産が東日本大震災後の影響分を取り戻している。
,,○,アウトソーシング企業（エリア担当）,雇用形態の様子,・自動車関連の雇用に関して、自動車生産の増産に伴い雇用形態が良くなっている。
,,○,新聞社［求人広告］（営業担当）,求人数の動き,・新聞の求人広告量でみると、少しずつではあるが増加している。
,,○,職業安定所（職員）,求人数の動き,・自動車関連の製造が回復してきたことも含め、新規求人数が前年同月比で増加傾向にある。また求人者からの問い合わせも増えてきている。ただし、製造業については派遣、請負、期間雇用といったものが多く、正社員求人が増加しているわけではない。
,,○,職業安定所（職員）,求人数の動き,・ここ数か月は新規の求人数が持ち直しており、今月の求人数はかなり多くなっている。
,,○,職業安定所（職員）,求職者数の動き,・新規の求人数が増加している。また求職者数は引き続き減少傾向にあり、企業は募集活動を強化している。
,,○,職業安定所（次長）,求人数の動き,・新規求人数が16か月連続で前年比増となっており、実数でも４、５月と比べ２割以上増加している。求職者の減少も続いており、新規求人倍率も２か月連続で１倍を超えている。特に新規求人増のうち常用求人の伸びが大きい。
,,○,民間職業紹介機関（支社長）,求人数の動き,・製造業を中心に求人は堅調である。幅広い業界から即戦力だけでなく、若手の素養を重視した求人も入り始めている。
,,□,人材派遣会社（経営者）,求人数の動き,・名古屋、大阪、東京においては求人はある程度あるが、地方都市にはほとんどない状態である。当地域においては、全体の求人数の動きもそれほど良くない。
,,□,人材派遣会社（支店長）,求人数の動き,・求人数としては、前年比100％前後での推移となっており、景気動向としては変わらない状況が続いている。
,,□,人材派遣会社（支店長）,求人数の動き,・東日本大震災後の影響もあり、派遣求人数は前年比65％～70％で前月と変わらず推移している。
,,□,職業安定所（所長）,求人数の動き,・新規求人は自動車部品、木材、プラスチック等を製造している産業では増加傾向にあるものの、求人内容を見ると、正社員求人については小規模事業所に多い。従業員数概ね20人以上の事業所や派遣会社等においてはパート、期間工等の募集が多くなっている。現在のところ円高の影響はまだ出ていない。
,,□,職業安定所（職員）,求人数の動き,・求人数が増加傾向にある。派遣や請負の求人や大手チェーンの販売職、人手不足感のある介護職等が目立つが、地場の中小企業の求人は少ない。全体としては大きな変化はみられない。
,,□,職業安定所（職員）,それ以外,・新規求人は増加傾向が続いている。一方で事業主都合による離職者も増加している。
,,▲,人材派遣会社（営業担当）,それ以外,・東日本大震災や株価の下落、円高などで影響を受けている企業が多く見受けられる。
,,▲,新聞社［求人広告］（営業担当）,求人数の動き,・県内の有効求人倍率に改善の傾向が見られない。
,,×,－,－,－
,,,,,
　６．北陸（地域別調査機関：（財）北陸経済研究所）,,,,,
,,,,,（－：回答が存在しない、＊：主だった回答等が存在しない）
分野,,景気の現状判断,業種・職種,判断の理由,追加説明及び具体的状況の説明
"家計
動向
関連

(北陸)",,◎,観光型旅館（スタッフ）,来客数の動き,・売上は前年同月比107％、宿泊人数は同118％、宿泊単価は同99％となり、宿泊関連については状況が改善している。前年はイベントを開催したが、今年度は風評被害の影響も考慮し実施を見合わせたにもかかわらず、売上は前年を上回った。
,,○,一般小売店［精肉］（店長）,来客数の動き,・食品の放射能汚染問題も落ち着きを見せ、来客数も多くなっている。
,,○,一般小売店［鮮魚］（従業員）,販売量の動き,・今期になって初めてのことであるが、販売量が前年実績を上回った。
,,○,一般小売店［書籍］（従業員）,来客数の動き,・客単価は上がっておらず、売上は横ばいであるものの、来客数は増加している。
,,○,百貨店（営業担当）,単価の動き,・安い商品、得な商品に目を向けがちだった客に変化がみられ、良い商品、今後必要な商品など価格より商品の内容に目が向いており、関心度が高まっているように思われる。
,,○,スーパー（総務担当）,お客様の様子,・果物、菓子などのし好品及びお中元の売上が前年並みに回復した。取引業者からも東日本大震災の影響はほぼなくなっていると聞いている。来年度の採用について、知るかぎり同業他社においても例年並みとのことである。
,,○,乗用車販売店（経理担当）,販売量の動き,・東日本大震災の影響から低迷していた乗用車の生産体制も整い、販売台数は前年同月比６割まで回復している。
,,○,その他専門店［医薬品］（営業担当）,来客数の動き,・既存店約100店舗の来客数は、３か月前と比較すれば５％程度伸びており上向き傾向にある。
,,○,高級レストラン（スタッフ）,販売量の動き,・高速道路料金の休日上限1000円制度廃止により、週末に集中していた個人旅行客が分散したのか、盆以外も平日が順調に推移した。法人客も例年並みに推移した。６月から安定した集客があり、震災の大きな影響は完全に抜けた様子を感じる。
,,○,観光型旅館（経営者）,来客数の動き,・夏休み期間中は、家族客を中心に例年並みの入込があった。
,,○,都市型ホテル（スタッフ）,販売量の動き,・宿泊は５月以降好調を維持している。また、宴会、レストランは好調に推移した。
,,○,都市型ホテル（スタッフ）,販売量の動き,・東日本大震災後の自粛ムードが残る３か月前と比べて、宿泊者数・レストランの来客数などで増加傾向が見られる。
,,○,旅行代理店（従業員）,販売量の動き,・相変わらず国内旅行は客単価が上がっているが、円高で海外旅行が増加し、その分で販売量が確保されている。
,,○,タクシー運転手,来客数の動き,・真夏日が連続18日となりタクシー利用客があった。また、旧盆時期の帰省客や観光客は前年とほとんど変わらず、人出があったためタクシー利用も増えた。
,,○,タクシー運転手,販売量の動き,・気候が暑かったこともあり、タクシー利用客は多かった。
,,○,通信会社（社員）,販売量の動き,・スマートフォン需要が好調である。
,,○,通信会社（営業担当）,来客数の動き,・スマートフォンに興味のある消費者が非常に多く、一度見てみようと来店する客も多くなった。例年の新商品発表時以上の来店がある。
,,○,テーマパーク（職員）,来客数の動き,・来客数は前年同月比では７％伸びている。要因は個人客の増加が大きい。ただ、団体客は前年同月比１割以上の減少、海外客は円高、福島第一原子力発電所問題の風評被害もあり、同４割程度の減少となっている。全体としては、夏休み期間ということもあり、前年以上の個人客の来客があった。
,,○,競輪場（職員）,販売量の動き,・年に１度の地元開催記念レースがあったため、売上、来客数共に増加した。
,,○,住宅販売会社（従業員）,お客様の様子,・フラット35Ｓの金利引下げの締め切りが当初12月30日までの申込であったが、急きょ９月30日までの申込に限り適用されることになったため、駆け込み受注がみられる。
,,□,商店街（代表者）,来客数の動き,・クリアランスセールが終わり、秋物商戦へと移るころに気温も下がり販売環境には恵まれた。また、盆商戦も天候に恵まれデパート中心に盛り上がった。しかし、例年のごとく盆明けは厳しい。
,,□,商店街（代表者）,競争相手の様子,・８月15日以降、閉店や退店が多い。東日本大震災以後の売上減少による採算面での赤字を理由とする先が多いと聞いている。
,,□,商店街（代表者）,来客数の動き,・盆明けから天候不順などの影響もあるだろうが、極端に人出が少ない。ゲリラ豪雨、暑さのぶり返しなど、外出を控える要素が多い。
,,□,一般小売店［事務用品］（営業担当）,販売量の動き,・東日本大震災の影響かもしれないが、９月からコピー用紙の原価が上がるかもしれないとメーカーから打診があるなど、今後商品価格の改定、値上げがあるように思える。買い控えなどの動きも更に考えられる。
,,□,百貨店（売場主任）,来客数の動き,・円高の影響が徐々に一般家庭に出始めている。高額商品も一時期の伸びは見られず、しばらく様子見の状態である。
,,□,百貨店（営業担当）,お客様の様子,・一番の要因は天候である。盆過ぎから一時的に秋めいた気候になったこともあり、消費の喚起につながった。夏物の単価の低い商品から秋物で正札の単価の高い物に買物が変わっている。一時的にはやや上向きになったと感じるところはあるものの、基調に大きな変化はない。
,,□,百貨店（売場担当）,来客数の動き,・前月と比較すると、来客数はマイナス2.1％、売上も減少、客単価もマイナス5.4％となり、全体の動きに変化はない。
,,□,コンビニ（経営者）,来客数の動き,・客単価はたばこ値上げの影響が続いて高止まりしているが、客数についてはこのところ微減が続いている。
,,□,コンビニ（経営者）,販売量の動き,・県内のコンビニ業界の再編成が終了し、勢いがやや弱くなったように感じているものの、売上は前年同月比110％をここ数か月維持している。予想より健闘している。
,,□,コンビニ（店舗管理）,販売量の動き,・昼食用の米飯を安価で販売するサービスを開始し、好調に推移しているものの、それ以外の商品は売上増加にはつながっていない。相変わらず財布のひもの固さを感じる。
,,□,衣料品専門店（経営者）,来客数の動き,・前年と比較し、５月の連休、８月の盆など帰省した客が減少している。
,,□,衣料品専門店（経営者）,お客様の様子,・大手ディベロッパーが実施している街の活性化やアパレルなどが実施している個店の販売促進が、中小企業の経営をますます圧迫している。
,,□,衣料品専門店（経営者）,お客様の様子,・８月は毎年15日間の夏休みを取っているが、売上や来客数などは従来の傾向と変化がない。
,,□,衣料品専門店（総括）,お客様の様子,・本当に必要なものだけしか購入しない傾向に変わりはない。
,,□,乗用車販売店（経営者）,お客様の様子,・購入する車種を人気や今売れている車に決めて来店する客が多くなってきた。一方で購入条件や対応次第で簡単に他車種へ変える客もおり、こだわりの選択は薄い。
