Ⅰ．景気の現状に対する判断理由等,,,,,
,,×,高級レストラン（店長）,販売量の動き,・福島第一原子力発電所の事故の影響により、例年多く見受けられた関西からの観光客が激減している。売上も前年比で30％低下している。
,,×,スナック（経営者）,お客様の様子,・40年やっているがこの８月は最悪である。もう限界かもしれない。
,,×,スナック（経営者）,来客数の動き,・例年８月は暇な月ではあるが、今年は見事に売上が半減している。
,,×,通信会社（経営者）,販売量の動き,・いつまでも東日本大震災の影響とは言いたくないが、当県の中小企業や商店は、世の中が動かない状態で広報をしても経費ばかりがかさむと判断しており、一切受注につながらない。
"企業
動向
関連

(北関東)",,◎,一般機械器具製造業（経営者）,受注量や販売量の動き,・自動車を中心として東日本大震災後止まっていた仕事が、上期の遅れを取り戻そうと本格的に動き出し、忙しさが増している。
,,◎,輸送用機械器具製造業（総務担当）,受注量や販売量の動き,・東日本大震災の影響が少しずつ薄れ、３か月前と比べ、主力自動車メーカーからの受注が増加し、９、10月に向けた在庫積み増しのためフル稼働状態である。ただ、節電の問題で非常に困っている。
,,○,窯業・土石製品製造業（経営者）,受注量や販売量の動き,・リゾートホテルでの夏休みものづくり体験工房の来客者数が予想をはるかに上回っている。
,,○,電気機械器具製造業（経営者）,受注量や販売量の動き,・東日本大震災被害により部品受注が増加している。
,,○,電気機械器具製造業（経営者）,受注量や販売量の動き,・小口や試作品等、多岐にわたるが、安定した受注が入っている。周りの精密加工関係も多忙な様子である。
,,○,金融業（役員）,取引先の様子,・長く低迷していた不動産取引において、７、８月と連続して利回り物件への投資がみられ、やや景気の回復感がうかがえる。
,,○,金融業（経営企画担当）,取引先の様子,・当地域内の観光地はトップシーズンで客足が伸びている。また、東日本大震災後、客足が戻りつつある。
,,○,金融業（調査担当）,受注量や販売量の動き,・製造業の水準はまだ低いが、サプライチェーンの回復により受注は増加し始めている。
,,○,新聞販売店［広告］（総務担当）,それ以外,・地元一般広告やミニコミ誌の広告は前年比90％前後、チラシ出稿量は99.2％と横ばい状態である。新聞本紙の求人広告は増えている。
,,○,社会保険労務士,取引先の様子,・東日本大震災直後より人の動きは良くなってきており、売上や受注も多少戻ってきている。
,,○,経営コンサルタント,取引先の様子,・東日本大震災後の状況として少しは良くなっているが、業績は７～８割程度の回復で止まっている。自動車関連の下請企業の一部で受注が増えているところもあるが、食品関連や飲食業、宿泊業等の観光関連業種はまだまだであり、建設産業、下請製造業などは業績が２極化している。
,,□,食料品製造業（経営者）,受注量や販売量の動き,・前年比、前月比共に大きな変化が見られない。
,,□,食料品製造業（製造担当）,競争相手の様子,・同業者と比べても、当社はそれほど落ち込んでいない。
,,□,窯業・土石製品製造業（総務担当）,受注量や販売量の動き,・被災地に関係する製品が多少動いているが、明るい見通しに結び付かない。
,,□,輸送用機械器具製造業（経営者）,受注量や販売量の動き,・親会社10数社を見ても、受注量、販売量等があり、それなりの売上を確保できる仕事量がある。
,,□,その他製造業［環境機器］（経営者）,受注量や販売量の動き,・フロンガス回収機の納期や工事は期末の影響を特に受けないため、特段変わりはない。
,,□,輸送業（営業担当）,取引先の様子,・今年の夏は節電ということで扇風機等の荷動きが５割増となっている。冬物家電へと移行するなか、同様に石油ストーブやこたつの動きも良い状態である。しかし、運賃単価の値上げは現状避けられており、物量に対しての利益が薄くなっている。
,,□,不動産業（管理担当）,受注価格や販売価格の動き,・節電意識が浸透し、照明や空調に掛かる電気量や水道量が減少したために経費が削減できている。ただし、メンテナンスに掛ける経費を、頻度を減らすことなどで削減したいというオーナーからの要請もあり、受注額も減少している。
,,□,司法書士,受注量や販売量の動き,・あまり良くない状況が続いている。
,,□,その他サービス業［情報サービス］（経営者）,受注量や販売量の動き,・特段の変化は見られない。
,,▲,食料品製造業（営業統括）,受注量や販売量の動き,・夏休みに入り工場の見学者数は増加しているが、急激な円高の影響で輸入ワインに押され、売上高は伸び悩んでいる。
,,▲,出版・印刷・同関連産業（営業担当）,受注量や販売量の動き,・受注量が前年比で約２割減少している。
,,▲,化学工業（経営者）,受注量や販売量の動き,・利用者の廃業の話が同業者間で度々出てくる。当業界の回復が非常に遅れている。
,,▲,電気機械器具製造業（経営者）,受注量や販売量の動き,・３か月前と比較すると、自動車関連は忙しくなりつつあるが、ほかの受注が伸び悩み、頭打ちという状態で売上が落ちている。この先どう動くか見えないので、非常に困っている。
,,▲,その他製造業［宝石・貴金属］（経営者）,受注量や販売量の動き,・３月以来仕入調整でやりくりしてきた問屋筋も少しずつ仕入をするようになってきている。しかし３月比で25～30％近い金地金の高騰、ダイヤの値上がりで新作物の価格が合わず、本格的な仕入は行われていない。
,,×,＊,＊,＊
"雇用
関連

(北関東)",,◎,－,－,－
,,○,人材派遣会社（管理担当）,周辺企業の様子,・前月末から自動車関連の派遣の仕事が急増している。
,,□,人材派遣会社（経営者）,求人数の動き,・７、８月は思ったより伸びなかった。８月前半は盆休みなどもあり製造工場等の稼働が非常に悪かったが、後半は電子関連、自動車部品関係での募集が出て持ち直してきている。介護関係の職員、サービス業、食品関係等は依然活発な動きが見られる。
,,□,求人情報誌製作会社（経営者）,求人数の動き,・今月は掲載企業の募集が多少多く掲載されたが、福祉、サービス、夏季商戦の商業店舗のパートやアルバイト募集が多く、工業、建設などの募集はほとんどない。
,,□,職業安定所（職員）,周辺企業の様子,・事業所からの情報等によると、忙しくなっている業界と依然停滞したままの業界がある。総合的に見ると変わらない。
,,□,職業安定所（職員）,採用者数の動き,・前年同期と比べて新規求人の申込は増えているものの、求職者が望む正社員求人の伸びは鈍く、就職者数の増加につながらない傾向にある。求人申込の期限切れを更新しているような、新鮮さに欠ける募集内容が目立っていることも応募に結び付かない要因となっている。
,,□,職業安定所（職員）,採用者数の動き,・前年度に比べて紹介件数は減少しているが、当所管内の大部分が災害救助法の指定地域であり、被災者雇用開発助成金を利用する求職者が多いため、就職率は高い水準となっている。
,,□,民間職業紹介機関（経営者）,求人数の動き,・求人数は徐々に増え始めているが、製造業では円高への警戒心が強く、求人が減り始めている。また、観光事業は大幅な求人数の減少が続いている。
,,▲,人材派遣会社（経営者）,求人数の動き,・取引先のほとんどで仕事があまりなく、頼まれても単発的で売上が上がらない。
,,×,＊,＊,＊
,,,,,
　４．南関東（地域別調査機関：（株）日本経済研究所）,,,,,
,,,,,（－：回答が存在しない、＊：主だった回答等が存在しない）
分野,,景気の現状判断,業種・職種,判断の理由,追加説明及び具体的状況の説明
"家計
動向
関連

(南関東)",東京都,◎,旅行代理店（支店長）,お客様の様子,・８月に入って特に見積依頼が増えていると感じている。
,東京都,○,商店街（代表者）,販売量の動き,・季節変動を加味しても、地域の商店街活動は新規の中型スーパーの乱立により低迷の状態が続いているが、当地域は特有の事情によるテレビ等での宣伝効果で、来客数、販売数量が増加している。
,,○,一般小売店［祭用品］（経営者）,販売量の動き,・東日本大震災後初めての夏は、縮小傾向ながらも復旧を望んで祭事が行われたため、若干の景気回復となっている。
,,○,百貨店（販売促進担当）,販売量の動き,・天候不順が原因でファッション関係が若干低迷しているが、売上は全体としては堅調であり、特に食料品、リビング関係が好調である。
,,○,コンビニ（経営者）,来客数の動き,・８月に入ってから非常に暑い日が続いたため、飲料関係が多く売れている。
,,○,コンビニ（経営者）,来客数の動き,・暑さが続いていることにより、来客が多くなっている。
,,○,コンビニ（店長）,販売量の動き,・今年は気温が高かったということや、依然としてたばこの販売が好調であったので、良くなっている。
,東京都,○,コンビニ（商品開発担当）,お客様の様子,・キャンペーン企画に対する客の反応が良くなっている。
,,○,乗用車販売店（経営者）,来客数の動き,・以前に比べて来客数、新車の売上が伸びてきている。
,,○,乗用車販売店（経営者）,販売量の動き,・整備は順調に入っている。販売はあまり良くなかったが、前月から前年並みの状況になってきている。
,,○,乗用車販売店（総務担当）,販売量の動き,・登録台数は前年比75％の見込みだが、前年はエコカー購入補助金制度による最終駆け込み月であったため、悪くない。３か月前から比べれは景気も落ち着いてきている。
,,○,高級レストラン（店長）,来客数の動き,・東日本大震災以降低調だった夜の来客数が回復しつつある。
,東京都,○,高級レストラン（支配人）,お客様の様子,・東日本大震災の影響もはっきり分かる形では出てこなくなり、自粛という言葉もほとんど聞かれなくなっている。
,東京都,○,一般レストラン（経営者）,来客数の動き,・官公庁の自主規制もあり、依然、宴会予約は前年比３割止まりというところではあるが、盆休みをはさんで新規の客がやや増えている。
,,○,一般レストラン（経営者）,来客数の動き,・３か月前と比べていろいろな部分で東日本大震災の影響が大分薄れてきており、少しずつ客も戻ってきている。円高の影響や自動車産業が良くないので気になるが、まだ今のところは多少は伸びている。
,,○,都市型ホテル（スタッフ）,来客数の動き,・会社全体への来客数は３か月前と比較して良くなっている。特に関東地区や東日本地区を対象にした大会等は、東日本大震災の影響で中止を心配したが、８月の中止は無かった。また、レストラン関係の来客数も前年の95％強まで戻っており、宿泊も同様である。
,東京都,○,タクシー運転手,お客様の様子,・今月は予想以上に客の出足が好調である。本来ならば８月はあまり良くない月であるが、思ったほど悪くなく、逆に客は増えているような感じがする。
,,○,ゴルフ練習場（従業員）,販売量の動き,・８月は来場数、来客数共に前年を上回っており、また前月よりも売上は伸びている。イベントの効果等もあったが、全体的に景気はやや良い。また、付帯するレストランも売上を前年比、前月比共に伸ばしている。
,東京都,○,その他サービス［福祉輸送］（経営者）,販売量の動き,・東日本大震災の影響がまだ残るなかで、前年比を大分割り込んでいた３か月前と比べると、８月は観光のスポット受注等も例年並みに大分戻ってきたため、良くなってきている。
,,○,住宅販売会社（従業員）,お客様の様子,・東日本大震災以降、客に少しずつ落ち着きが出てきており、購買意欲が徐々に出てきている。
,,○,住宅販売会社（従業員）,販売量の動き,・６月は契約が多かったため、それに比べれば落ちているが、８月は稼働日数も少ない割に契約が順調に推移したため、景気は良くなっている。
,東京都,○,その他住宅［住宅資材］（営業）,販売量の動き,・東日本大震災後、荷動きがかなり停滞していたが、今月に入って徐々に動き出してきた感がある。
,東京都,□,商店街（代表者）,それ以外,・東日本大震災後、順調に回復していたが、円高の進行や節電などで客のマインドは冷えているように見える。クレジットカード取扱高は前年同月比で少しずつ良くなっていたが、現状維持となっている。
,東京都,□,商店街（代表者）,来客数の動き,・今年の夏はかなり暑いために客の出足が悪く、思ったように売行きが伸びない。ここへきて少し落ち着いてきたので、何とか売上を上げたいと頑張っている。
,,□,一般小売店［和菓子］（経営者）,販売量の動き,・東日本大震災以降、ギフト物の売上が落ち込んでおり、盆の帰省のギフト需要もかなり悪い状況である。
,,□,一般小売店［酒類］（経営者）,販売量の動き,・毎日のように折込広告が氾濫しており、特に食品、酒類の広告が多い。来客はほとんどなく、時期により自治会からの受注があるのみで、それも天候によって左右される。
,東京都,□,一般小売店［米穀］（経営者）,来客数の動き,・前年よりは過ごしやすい夏だが、来客数は少し減っている。急な雨や雷も一因だろうが、客は価格の安い所へ行っているようである。賞味期限が迫っている値下げ品は売れるが、これではやっていけない。
,,□,一般小売店［靴・履物］（店長）,来客数の動き,"・３か月前は非常に大変な状況であり、その悪いままの状況が続いている。単価の動きも同じで、1,100円の一番安い履物を客は皆、選んで買っている。それも今まで10,000円くらいの靴を履いていた客が1,000円の靴を履いているような状況である。"
,,□,百貨店（売場主任）,お客様の様子,・８月は夏休みイベント等で来客数は前年より６％増加したが、天候不順により夏物セールへの関心度が下がり、買上客数が減少している。
,,□,百貨店（総務担当）,それ以外,・７月は来客数も回復し、猛暑やクールビズ対応商材がけん引して衣料品も前年並みの動きが見られたものの、今月は夏物商材も一段落したなかで、秋物商材もやや動きが鈍い状況である。
,,□,百貨店（総務担当）,それ以外,・東日本大震災の影響が一段落した状況ではあるが、売上が良化しているとは言い難い。特に株価などの影響からか、買い回りや滞留時間の減少が見られる。
,東京都,□,百貨店（総務担当）,販売量の動き,・東日本大震災直後と比べるとやや景気も販売額も上がってきてはいるが、前年比では100％を切って若干マイナスという傾向が続いている。
,東京都,□,百貨店（広報担当）,それ以外,・売場が改装途中で実質的な販売面積も一時的に減少しており、ここ数か月は売上、客数共に前年比90％台半ばが続いている。
,東京都,□,百貨店（営業担当）,お客様の様子,・夏休みの親子向け催物や盆の帰省対応などにより日々の来客は回復傾向が続いているが、売上にはつながっていない。特に高額品は厳しい状況が続いている。
,東京都,□,百貨店（営業担当）,単価の動き,・東日本大震災後よりは上がっているだけである。震災の反動で多少盛り返したものの、震災直前の状況までは至っていない。
,東京都,□,百貨店（営業担当）,販売量の動き,・クリアランス実施により６、７月は復調が見られたが、８月前半は猛暑日が続いたことで客数減となる等、売上は厳しい状況である。クールビズ対応で伸長した紳士服が伸び悩む一方で、節電対応により家庭用品需要が伸びるなど、商品群により好不調の波が大きい。サマータイムの影響を受けているのか、夕方から夜に掛けての売上の伸びに鈍化傾向が見られる。
,東京都,□,百貨店（営業担当）,来客数の動き,・特定できないが、極力外出は避ける等、過剰なまでの熱中症予防の声掛けのため、来客数が減少している。
,,□,百貨店（販売促進担当）,お客様の様子,・当月はほぼ前年並みの推移だが、盆明けから給料日までが厳しい状況になるなど、購買機会以外では、購入を見合わせているような様子が見られる。給料日の週末は秋への最初の購買機会として前年を上回るが、初速としては単価が低く、初秋への影響が懸念される。
,,□,百貨店（販売管理担当）,来客数の動き,・８月は天候の影響が大きいが、来客数が５％前後減少している。ただし売上は目標を達成したため、結果的には予定どおりである。
,東京都,□,スーパー（店長）,お客様の様子,・夏休み前半は暑さによる涼味商材の特需で順調に推移していたが、後半の悪天候により厳しさが増してきている。夏休みも終わりに差し掛かり、緩んでいた財布のひもが固くなっているように見受けられる状況で、客数は前年並みを維持できているものの、点数、単価の上昇が見られない。
,,□,スーパー（店長）,お客様の様子,・消費動向は以前と変わらない動きをしている。しかし、安心・安全や風評などの事柄で購入する商品、あるいは安心が確認されておらず購入できない商品等があるために、より一層、消費は低迷傾向にある。
,,□,スーパー（総務担当）,お客様の様子,・８月は暑くなったので盛夏物の処分が進むと思ったが、節電に伴う企業の休みが土日から平日にシフトしたことで、平日の売上は上がったが土日の売上が若干下がっている。トータルとしては５月と変わらず良くない状況である。
,東京都,□,スーパー（営業担当）,単価の動き,・８月中旬以降の天候不順により、季節商材が伸び悩んでいる。
,,□,スーパー（仕入担当）,来客数の動き,・消費者は節電、節約の意識を持ち、必要な物や外出頻度を抑えているため、来客数が前年度を割っている。特に盆の期間が前年を３％ほど割っている。
,,□,スーパー（仕入担当）,販売量の動き,・前年並みの猛暑ではないため、アイスや氷等の夏物商材の動きが前年と比較して大きく落ち込んでいる。
,,□,コンビニ（経営者）,来客数の動き,・来客数が前年同月比108％となっており、それに伴って売上も伸びている。ただし、客単価は上がっているもののたばこの値上げ分が上乗せになっているので、利益率は若干下がっている。
,東京都,□,コンビニ（エリア担当）,販売量の動き,・客数の傾向が３か月前と比較しあまり変わっていない。
,東京都,□,コンビニ（商品開発担当）,販売量の動き,・不安定な気象状況の影響もあって例年以上に売上が乱高下しているが、トータルすると横ばいである。
,,□,家電量販店（店員）,単価の動き,・パソコン部門では低価格化に歯止めが掛からない。競合店も含め、台数を出すために利益を削ってまでも価格を安くする姿勢であり、経済が潤わない。
,,□,乗用車販売店（営業担当）,販売量の動き,・毎月のことだが、ほぼ変わらない数字で推移している。
,東京都,□,乗用車販売店（販売担当）,販売量の動き,・東日本大震災以来ずっと、いろいろな対策や取組みを行い新型車も出しているが、売上は６か月連続して前年を超えることができていない。相変わらず景気は悪い段階であり、ここ半年変わっていない。
,,□,乗用車販売店（店長）,販売量の動き,・３月11日以来、生産納期の遅れによって大きく膨らんだ７月末までのバックオーダーが８月目標比151.8％と、目標台数の関係で非常に大きなものとなり、売上台数は今期初の目標達成となっている。しかし、純受注台数は前年８月のエコカー購入補助金効果等を踏まえると、前々年比にも増してひどいものになっている。
,,□,その他小売［ショッピングセンター］（統括）,来客数の動き,・日中は家庭で過ごすのではなく公共施設や商業施設等に避暑地として出掛けてもらうよう官民一体となって呼び掛けた結果、節電避暑地として来客数は３か月前に比べて約10％増加している。ただし、地上デジタル放送や節電の対応によるテレビ、エアコン、扇風機等の家電製品は７月好調の反動により落ち込んできている。紳士衣料もクールビズ、カジュアルビズの浸透で、８月の売上は鈍化傾向となってきている。
,東京都,□,その他小売［ゲーム］（開発戦略担当）,販売量の動き,・７月は北米で過去５年で最低の単月売上だったという報告もあり、目立った新作の投入もなく、国内、海外共に低調である。
,東京都,□,一般レストラン（経営者）,来客数の動き,・５月以降消費の低迷があったが、少し復興のために消費をしようという動きがある。それがずっと来ていたが、頭打ちのような感じであり、推移は横ばいである。
,東京都,□,一般レストラン（経営者）,販売量の動き,・５月24日までの結果では、５月の前年比は売上92.2％、客数94％である。今月は８月24日までで売上92.1％、客数92.8％と、相変わらず前年比は厳しい状況である。
,東京都,□,一般レストラン（店長）,来客数の動き,・東日本大震災後１か月くらいで少し良くなったが、その後５月ごろから低迷が続いており、客数が全く伸びない。当店は40～50代の客が中心であるが、外食の回数、仕事帰りに一杯やるということが非常に減っている。
,東京都,□,スナック（経営者）,来客数の動き,・やはり暑い時は客の動きが少し遅く、絶対数が取れない。
,,□,都市型ホテル（支配人）,販売量の動き,・販売量の動きでは、３か月前と大きく変わらない。
,東京都,□,都市型ホテル（スタッフ）,お客様の様子,・披露宴での１人当たりの利用金額は増えているが、依然として参加人数が増えていない。
