Ⅰ．景気の現状に対する判断理由等,,,,,
,,,,,
　景気の現状に対する判断の理由及びそれに対する追加説明等について、その主だったもの及び特徴的と考えられるものを取りまとめると以下のとおりであった。,,,,,
,,,,,
,,,,,
　１．北海道（地域別調査機関：（株）北海道二十一世紀総合研究所）,,,,,
,,,,,（－：回答が存在しない、＊：主だった回答等が存在しない）
分野,,景気の現状判断,業種・職種,判断の理由,追加説明及び具体的状況の説明
"家計
動向
関連

(北海道)",,◎,＊,＊,＊
,,○,一般小売店［酒］（経営者）,販売量の動き,・今月半ばまではあまり良いと言えない状況であったが、後半に入ってからは売上がかなり盛り返している。
,,○,百貨店（販売促進担当）,来客数の動き,・天候が安定し、気温が上昇するにつれて、衣料品を中心に客の購買量が増えてきている。
,,○,スーパー（店長）,販売量の動き,・１月以降、販売量は上向きになってきている。
,,○,スーパー（役員）,販売量の動き,・前年は東日本大震災で工場が被災したことで、食料品等が十分に供給されず、欠品する商品が多数あったが、今年は潤沢に商品が供給されているため、品ぞろえも良く、売上が増加している。
,,○,コンビニ（エリア担当）,来客数の動き,・東日本大震災後の売上変動の反動があり、売上の変化を読みづらい状況ではあるが、来客数は少しずつ回復傾向にある。
,,○,衣料品専門店（店長）,それ以外,・前年と違い、天候状況が良くなかったことから販売動向が弱い印象であったが、気温が上昇するにつれて、消費が上向いてきている。また、東日本大震災から１年が経過し、消極的だった買物動向も回復している。
,,○,家電量販店（地区統括部長）,販売量の動き,・前年の家電エコポイント制度の終了と地上デジタル放送化の影響は依然として続いているが、年末から比べるとテレビの販売量が若干増えつつある。
,,○,乗用車販売店（従業員）,販売量の動き,・エコカー減税とエコカー補助金の効果により、前年よりも売上がかなり良い。
,,○,乗用車販売店（営業担当）,販売量の動き,・新型車効果の持続とエコカー減税、エコカー補助金の効果が大きい。
,,○,観光型ホテル（スタッフ）,来客数の動き,・依然として低価格競争は続いているが、国内のメディア募集型商品とＷｅｂ商品で人員を稼ぐ結果となった。
,,○,旅行代理店（従業員）,販売量の動き,・３月のビジネス需要及び観光需要は伸びてきている。前年は東日本大震災の影響でアウトバウンド、インバウンドともに大きく減少していたため、前々年との対比でどこまで回復できるかが上期のポイントとなる。
,,○,美容室（経営者）,お客様の様子,・来店時に関連商品の説明をすると以前より客の反応が良く、買上につながることが多くなってきた。
,,○,住宅販売会社（経営者）,お客様の様子,・為替が円安基調に振れているなか、復興需要への期待もあって、客の消費や投資のムードが大変良くなっている。
,,○,住宅販売会社（従業員）,販売量の動き,・広告量を減らしているにもかかわらず、販売量については月初めの段階で３月の目標を達成した。分譲マンションの販売については、価格が手ごろであればとにかくよく売れる。
,,□,商店街（代表者）,お客様の様子,・新入学、就職関連の商品に少しずつ動きは出ているが、前年に比べて動きが鈍い。雪解けが遅いことから、特に春物の衣料品や靴などの動きが悪い。悪天候が続いているため、商店街への来街も少ない。
,,□,商店街（代表者）,お客様の様子,・春めいてきて、少しは消費者の声にも弾みが出てきている。しかし、先行きへの心配感があるためか、客の慎重な購入態度は依然として変わらない。
,,□,商店街（代表者）,お客様の様子,・例年であれば、３月は春物に動きがみられるが、今年は気温が低いままであるため、なかなか客の購買意欲がわかないようであり、卒業、進学、就職関連以外の春物の動き出しが遅い。気温にも左右されており、良かったり悪かったりを繰り返し、販売量がなかなか伸び切れない状況にある。
,,□,商店街（代表者）,お客様の様子,・景気に変化はない。天候状態により客の動きが違うため、基本的な状況は以前と変わらない。
,,□,商店街（代表者）,販売量の動き,・今月初旬は、世界ジュニアスピードスケート選手権大会の効果により、若年層を中心とした客層による飲食及びスポーツ関連衣料品等で売上の増加があったが、大会終了にともない、売上は激減した。しかしながら、下旬に入り、地元客による入学卒業及び就職等のための買物が百貨店を中心に目立つようになっており、販売量が増加傾向となっている。
,,□,一般小売店［土産］（経営者）,来客数の動き,・客との会話からは、自己防衛の気持ちが強く、なかなか消費をしようという気になれないという話をよく聞く。福島県からの被災者の旅行客も少しずつみられるようになっているなど、少しは期待感も出てきているが、大きくは変わっていない。
,,□,百貨店（売場主任）,お客様の様子,・前年は東日本大震災後の来客数減少の影響で売上も非常に厳しく、前年比90％を下回っていた。今年は、前年以上に寒さが厳しく、雪の降る日も多かったが、春物の動き、物産催事での客の動員が多く、売上が非常に増加している。特に婦人物のニット、カットソーの売上は前年比120％を超えている。
,,□,百貨店（販売促進担当）,来客数の動き,・来客数を前年と比較すると、東日本大震災直後の営業日こそ増加になったものの、その後は前年並みか減少で推移している。前年は駅前通に地下歩行空間が開通したことの恩恵で３月後半から来客数が増加で推移していたが、一巡した今年は震災の影響を差し引いても苦戦している状況にある。
,,□,百貨店（役員）,来客数の動き,・今年は大雪による影響がかなり出ている。今月も春物ファッションが動かず、購買につながっていない。自転車も前年の半分以下の販売量となっている。自転車は雪解け後に動きがずれ込むとみられるが、減少分をばん回できるかは微妙である。
,,□,スーパー（企画担当）,販売量の動き,・前年の東日本大震災の反動から足元の売上動向は読みにくいが、前々年と比較しても売上が伸びておらず、やや停滞気味の状況にある。
,,□,スーパー（役員）,来客数の動き,・前年に東日本大震災後の仮需要やメーカーの資材不足から商品の品切れ等が発生したこともあり、今月は消費者動向を比較しづらい月である。来客数は前年比で0.7％上昇しているものの、商品単価の低下などもあり、客単価は前年比100.4％と、ここ数か月変わらない状況で推移しており、全体的な状況に変化はみられない。
,,□,コンビニ（エリア担当）,来客数の動き,・前年の東日本大震災にともなう一時的な商品買いだめの反動で、今月の売上は前年比では厳しい。しかし、夜間の来客数は、震災以降、依然として減少し続けている。
,,□,衣料品専門店（店長）,販売量の動き,・なかなか景気が良くならないことに焦っているが、良くなることを願っている。
,,□,衣料品専門店（店員）,単価の動き,・入学、卒業や転勤、異動のシーズンで出費が大きいなか、ガソリンの価格高騰の影響もあり、春物衣料の消費動向については、質が良くて少しでも安くなっている商品が求められている。
,,□,家電量販店（店員）,お客様の様子,・春商戦の１人立ちセットは例年並みによく売れているが、余計な買物をしない客が多い。
,,□,その他専門店［医薬品］（経営者）,販売量の動き,・マスコミ品ナショナルブランドは大手スーパー、ドラッグの専売となった。小規模店は独自の専門品に特化しないと生き残れない。
,,□,高級レストラン（経営者）,来客数の動き,・来客数がさほど増えていない。
,,□,高級レストラン（スタッフ）,単価の動き,・前年は東日本大震災の影響もあったため、前年との比較はできないが、前々年との比較では売上は93％となっている。３月中旬までは天候が悪く、客足が鈍かったが、下旬からは週末のランチはほぼ満席であった。
,,□,高級レストラン（スタッフ）,来客数の動き,・寒い日が多かったため、客の入りがやや悪かった。通常メニューはあまり人気がないが、低価格のフェアメニューは好調である。地方都市の飲食店は、以前の繁盛店も来客数の減少に歯止めがかからず、苦しい状況が続いている。
,,□,旅行代理店（従業員）,お客様の様子,・個人、法人ともに１か月前受注が多く、先行案件が少ない。消費者も先行きを手探りしているようで、結果的に間際の受注となっている。ただ、前年の東日本大震災の影響は薄れてきている。
,,□,タクシー運転手,来客数の動き,・前年は東日本大震災の影響で観光客が全く来なくなり、地元も自粛ムードでタクシーの売上も激減したが、今年は前年よりも売上が増加している。３か月前と比べても客の利用状況は変わらない。
,,□,タクシー運転手,販売量の動き,・例年より雪の日が多かったため、タクシーの利用客は若干伸びているが、景気そのものが良くなったというわけではない。
,,□,通信会社（社員）,お客様の様子,・報道をみると、株価の上昇や景気回復の兆しに関する好調が報じられているが、一般の個人事業主の話を聞くと、決してそのような感じはなく、来客数の減少、売上の維持又は減少がほとんどで何も変わっていない。都市部と地方部との温度差がとても大きく、違和感がある。
,,□,通信会社（企画担当）,競争相手の様子,・春商戦の効果もあり、想定以上の客から通信機器導入、更新の引き合いを受けているものの、競合他社への流出が前年以上に増加している。
,,□,観光名所（職員）,来客数の動き,・来場者については冬のイベントなどの効果もあり、３か月前に比べると153％と増加しているが、東南アジアからの来場者が減少傾向にあるなど、依然として東日本大震災の影響が残っている。
,,□,美容室（経営者）,販売量の動き,・この３か月間、売上が前年を約５％下回っている。特に何が悪いというわけではないが、売上の伸びない状況にある。
,,□,美容室（経営者）,来客数の動き,・景気があまり良くないため、先が全然見えない。意見の述べようがないほど世の中が大変な状況である。灯油高騰、ガソリン高騰、その他社会の動きがあまりにもひどすぎる。もう少し国がしっかりしてくれないと困る。
,,□,美容室（経営者）,来客数の動き,・年度替わりの３月だが、来客数の動きに変化がみられない。
,,▲,商店街（代表者）,来客数の動き,・売上としては、前年の東日本大震災の反動もあり、前年を上回っているが、来客数が増えていない。ガソリンの高騰が影響しており、車で来店する客が減っている。
,,▲,百貨店（売場主任）,単価の動き,・３月は25日までの全店での売上が前年比96.3％、買上客数が前年比96.6％、客単価が前年比99.0％となっており、客単価はやや前年を下回って推移しているが、買上客数が96.0％前後に落ち込んでいる。10月から１月まで売上が前年並みに回復してきたが２月から苦戦傾向にある。
,,▲,自動車備品販売店（店長）,販売量の動き,・寒さが長引いていることと、店内改装のため、数日臨時休業したことがマイナス要因となっている。しかし、季節の影響を受けない商品も動きが鈍いため、全体としてはやや悪い状況となっている。競争相手の様子を確かめたうえで、取組を見直したい。
,,▲,その他専門店［ガソリンスタンド］（経営者）,販売量の動き,・石油製品価格の急騰により、節約志向が強くなっている。
,,▲,高級レストラン（スタッフ）,来客数の動き,・東日本大震災のあった前年よりは来客数が増えているが、原油高騰とまだ冬のような天候が続いていることがマイナス要因となっており、とても上向きとは言えない状況にある。
,,▲,観光型ホテル（経営者）,来客数の動き,・１月は海外客の回復もあり、若干持ち直したが、依然として首都圏、関西圏からの国内客が大幅に落ち込んだままである。さらに、旅行需要が弱いため、旅行会社を中心に宿泊単価の値下げ要請が相次いでおり、非常に厳しい状況となっている。
,,▲,タクシー運転手,販売量の動き,・前年の３月と比較すると、120％の売上であるため、東日本大震災の影響による落ち込みは回復したと思われるが、３か月前の売上と比較すると約８％の落ち込みとなっている。３か月前は、非常に寒く雪が多かったため、タクシーの需要も伸びた。しかし、３月に入って、動きが落ち着いている。
,,▲,タクシー運転手,来客数の動き,・前年と比べて注文数が減少している。特に観光目的の客からの注文数が大きく減っている。
,,×,その他サービスの動向を把握できる者［フェリー］（従業員）,来客数の動き,・20数年ぶりに本格的に流氷が到来し、数日間にわたり全便又は一部欠航となったことから、当初予想していた輸送量を大幅に下回った。
"企業
動向
関連

(北海道)",,◎,－,－,－
,,○,家具製造業（経営者）,受注量や販売量の動き,・請負物件のほか、百貨店や住宅関連向けの商品も活況である。
,,○,建設業（従業員）,競争相手の様子,・予算や補助金の関係から年度内着工が条件とされた公共建築工事が一斉に着工したため、見積照会や労務者確保の動きが増えている。
,,○,通信業（営業担当）,受注量や販売量の動き,・ここしばらくの身の回りの景況感は低迷を続けていたが、２月下旬から販売量が明らかに回復傾向となっている。
,,○,コピーサービス業（従業員）,受注量や販売量の動き,・受注量は非常に増えている。期末という影響を考慮しても上向きである。
,,○,その他サービス業［ソフトウェア開発］（経営者）,受注量や販売量の動き,・受注量が増えている。ただし、年度末ということでの一時的な動きとみられる。
,,○,その他非製造業［鋼材卸売］（役員）,受注量や販売量の動き,・官庁関連からの年度末の駆け込み需要が多かったせいか今月はやや好調だった。
,,□,食料品製造業（団体役員）,それ以外,・年度替わりにともなう消費需要と新規雇用者の増加に明るさがみられるものの、原油価格高騰により、燃料油や光熱費などの生産コストが上昇しており、経営環境に厳しさがみられる。
,,□,食料品製造業（役員）,受注量や販売量の動き,・受注が伸びず、以前のままの状態で推移している。
,,□,輸送業（営業担当）,取引先の様子,・円安傾向となったことで、スクラップの輸出が開始されている。また、震災復興向けとみられるが、東北への道産カラ松の内航船輸送が決定している。
,,□,輸送業（支店長）,受注量や販売量の動き,・通常であれば、年度末を迎えて、メーカーの決算対策から物流量が増加する月であるが、大きな変化がみられない。政府の補正予算がようやく決まったが、全体的に遅れが目立っており、スピード感に欠ける。北海道は雪解けが遅れているが、具体的な案件の動きも鈍い。
,,□,金融業（企画担当）,それ以外,・個人消費は、大雪や寒波の影響で春物衣料の出足が鈍るなど弱めの動きとなっている。観光関連は外国人観光客の入込がほぼ東日本大震災前の水準に戻っている。建設関連は一部ではあるが復興需要がみられる。
,,□,司法書士,取引先の様子,・不動産取引、建築関連は低調のまま推移している。ただし、冬期間が終わり、若干の明るさが見えてきている。
,,□,司法書士,取引先の様子,・雪解けとともに不動産取引も若干増えてきたが、依然として景気回復の兆候は見えないため、取引が活発化している状況にはない。消費税の増税問題だけがクローズアップされ、経済政策の方向性が見えないため、景気動向に変化が出てこない。
,,□,その他サービス業［建設機械リース］（支店長）,取引先の様子,・燃料費の値上がりが深刻との話を多業種のユーザーから聞く。
,,▲,司法書士,取引先の様子,・冬期間で建物工事が皆無のなか、土地の売買も少ない。
,,×,－,－,－
"雇用
関連

(北海道)",,◎,－,－,－
,,○,求人情報誌製作会社（編集者）,求人数の動き,・土木建設業の回復と農産品加工業の安定性もあり、求人広告受理件数は前月比で２％、前年比で９％増加している。
,,○,求人情報誌製作会社（編集者）,求人数の動き,・２月に引き続き、東北の復興需要の影響もあり、建設関連の求人が増加している。宿泊業もアジア人観光客が戻ってきており、上向き傾向になっている。また、ホテルだけでなく、年度末の契約更新に向けた案件対応による清掃系の求人も増えている。
,,○,職業安定所（職員）,求人数の動き,・新規求人数は13.9％増加し、25か月連続で前年を上回った。また、月間有効求人数は19.7％増加し、25か月連続で前年を上回った。
,,□,求人情報誌製作会社（編集者）,周辺企業の様子,・リーマンショック以降、少しずつ回復基調にあるが、景気回復に向けての決定的な明るい材料がない。
,,□,新聞社［求人広告］（担当者）,求人数の動き,・３月の募集広告売上は前年比110％と大きく伸びた。特に小売、土建不動産、自動車関連での伸び率が顕著だった。また、大口の医療、派遣も微増となり、全体の底上げに貢献した。
,,□,職業安定所（職員）,雇用形態の様子,・管内の１月の新規求人数は前年比11.7％の増加となった。新規求職者数は前年比12.6％の減少となった。この結果、月間有効求人倍率は0.63倍となり、前年の0.51倍を0.12ポイント上回った。しかし、求人数のうち正社員求人の占める割合は42.9％にとどまっており、求人者と求職者との間における職種や労働条件のミスマッチも少なくないことから、依然として厳しい状況にある。
,,□,職業安定所（職員）,それ以外,・管内の求人倍率は0.54倍と前年を0.09ポイント上回ったが、依然として高い水準とは言えない。
,,▲,人材派遣会社（社員）,求人数の動き,・例年であれば、春商戦に向けて家電量販店やスーパーからの派遣需要が多くなる時期であるが、今年は東日本大震災のあった前年並みの需要で推移している。また、労働者派遣法改正の議論を受けて、大手企業で派遣の活用について神経質な対応が目立っており、派遣需要の盛り上がりに欠けている。
,,▲,人材派遣会社（社員）,求職者数の動き,・求人数に比べて求職者の数が圧倒的に多い。
,,×,－,－,－
,,,,,
　２．東北（地域別調査機関：（財）東北活性化研究センター）,,,,,
,,,,,（－：回答が存在しない、＊：主だった回答等が存在しない）
分野,,景気の現状判断,業種・職種,判断の理由,追加説明及び具体的状況の説明
"家計
動向
関連

(東北)",,◎,一般小売店［書籍］（経営者）,来客数の動き,・来客数、客単価共に上昇傾向にある。
,,◎,百貨店（経営者）,販売量の動き,・前年の震災による各種イベント等の休止、中止による購買動機消失の反動か、祝い事の需要や、旅行関連、外出着など、前年半分まで落ちたカテゴリーの回復が全体を大きく押し上げている。
,,◎,衣料品専門店（店長）,来客数の動き,・フレッシュマンの客が例年以上に多く、単価も増加している。また、４月から部署替えや転勤など異動が決まった人も多く訪れており、来客数及び売上が大幅に伸びている。
,,◎,旅行代理店（店長）,販売量の動き,・前年に中止となった企業、団体から旅行申込があり、販売量は２年前を上回る水準まで回復している。
,,◎,設計事務所（経営者）,お客様の様子,・住宅の建て替えや工場の増築及び建て替えなど、震災に関連した仕事が続いている。また、今まで取引したことのない所や何年も取引していない所から仕事の依頼が入ってきている。
,,○,商店街（代表者）,お客様の様子,・天候は不順であったものの、思いのほか好調である。
,,○,商店街（代表者）,販売量の動き,・販売単価、販売量共に上向きとなっている。特に衣料品や小物関係、文具が好調である。
,,○,商店街（代表者）,来客数の動き,・前年は東日本大震災の影響で３～５月に来客数の落ち込みが大きく、客単価も落ちたため、前年比では増加している。
,,○,商店街（代表者）,お客様の様子,・２月のやや悪くなっている状態は脱した感がある。例年より天候の回復は遅いものの、最近消費者が時節の催し物に反応するようになっており、売上、来客数共に前年比プラスとなっている。
,,○,一般小売店［医薬品］（経営者）,単価の動き,・健康上の相談を受け、客とまとまった時間会話する機会が増えてきている。震災以前の普通の生活に戻りつつある。
,,○,百貨店（営業担当）,販売量の動き,・東日本大震災があったため前年との比較は困難である。２年前との比較では催事、セールを除いても２けた近い売上増があり、景気の好調さは続いている。前半は気温が低く春物の動きが鈍かったが、後半は気温も上がり動きが出てきている。物産展は相変わらず好調である。
,,○,百貨店（経営者）,販売量の動き,・震災後の復興資金の浸透により、販売量もやや良くなっている。
,,○,スーパー（経営者）,来客数の動き,・前年は震災のあった月なので比較にならないが、２年前との比較では来客数が多少プラスになっている。
,,○,スーパー（経営者）,来客数の動き,・前年は震災の影響で、営業できない店舗と震災特需のあった店舗があり、前年との比較はできない。２年前や実数値の推移と比較する限り、１品平均単価はほとんど変わらないものの、来客数の伸びは良くなっている。
,,○,スーパー（営業担当）,単価の動き,・客単価が上向きの傾向にある。
