Ⅰ．景気の現状に対する判断理由等,,,,,
"企業
動向
関連

(近畿)",,◎,出版・印刷・同関連産業（情報企画担当）,受注量や販売量の動き,・４月の入学や入社の資料作成関係が動き、活況を呈している。一方、弱電業界では円安になっているにもかかわらず、輸出に対する販促物の動きはほとんどなく、新年度以降に期待している。また、住宅業界では消費税の引上げを見据えた活発な宣伝やＰＲにより、仕事の量が増えている。
,,◎,化学工業（経営者）,受注量や販売量の動き,・年明けから雰囲気だけが良くなり、荷動きは悪かったが、ここへきて３、４月は対応できないほどの注文が入ってきている。
,,◎,金属製品製造業（管理担当）,受注量や販売量の動き,・建築、土木関連の受注や販売量は低調であるが、太陽光発電関連が絶好調のため、人員の移動などで生産体制を拡充している。５月には新工場が完成し、更に生産量を増やせるように準備中である。決算賞与も、正社員以外の派遣スタッフにも還元できるほど利益が上がっている。
,,○,金属製品製造業（営業担当）,受注量や販売量の動き,・年度末に向けて、自動車向けの出荷が少し増えている。また、住宅向けの出荷も増えている。
,,○,電気機械器具製造業（経営者）,それ以外,・新政権のここまでの成功だけで取引が増えることはないが、海外の工場との取引が多く、円安の進行で利益が増えるため、とりあえず明るい雰囲気になっている。
,,○,電気機械器具製造業（企画担当）,受注量や販売量の動き,・戸建住宅、マンション、店舗関連の受注量が増加してきている。
,,○,その他製造業［事務用品］（営業担当）,受注量や販売量の動き,・受注の動きが出てきている。
,,○,建設業（経営者）,受注量や販売量の動き,・土地の動きが活発になっているのか、土壌汚染調査の問い合わせが増えている。また、再生可能エネルギーの固定価格買取制度の今年度締切りに向けて、太陽光発電関連の駆け込み需要も多くなっている。
,,○,通信業（管理担当）,それ以外,・スーパーなどの市場の価格については、さほど高くなったとは思えず、季節が暖かくなるにつれて野菜の価格も安定し、安くなっている。
,,○,新聞販売店［広告］（店主）,受注量や販売量の動き,・前年12月から購読数が伸びている。新規購読が増えていて、購読の中止が抑えられている。折り込み件数は全体に横ばい状態ではあるが、住宅や自動車関係のチラシが多くなっている。
,,○,広告代理店（営業担当）,受注量や販売量の動き,・広告注文の件数が、今年に入って増えてきている。
,,○,その他非製造業［民間放送］（従業員）,受注価格や販売価格の動き,・株価上昇による景気浮揚感を、少しずつであるが確実に感じ始めている。
,,□,食料品製造業（従業員）,受注量や販売量の動き,・販売量に波があり、良い月と悪い月が交互にきている感がある。全体的には販売価格も低下傾向にある。今年の冬は気候がはっきりしているので、メリハリがあって悪くはないが、野菜価格の高騰など当社の取扱品には良くない影響がある。
,,□,食料品製造業（経理担当）,受注量や販売量の動き,・取引先からの受注量が非常に少ない。
,,□,食料品製造業（営業担当）,受注価格や販売価格の動き,・得意先の販売価格が下がっているにもかかわらず、販売量は３か月前と比べても変化がない。
,,□,繊維工業（団体職員）,受注量や販売量の動き,・年間を通じての閑散期であるが、例年以上にやや需要が低迷しているようである。
,,□,パルプ・紙・紙加工品製造業（経営者）,受注量や販売量の動き,・顧客によって大きな差がある。上向きと下向きの会社があり、全体的には変化がない。
,,□,プラスチック製品製造業（経営者）,受注量や販売量の動き,・新政権の今後の政策への期待感か、雰囲気は悪くないが、まだ実体に結びつかない。試作の依頼や問い合わせは増加気味であるが、従来のリピート品の受注は自然減であり、一増一減で現状維持となる。
,,□,金属製品製造業（経営者）,受注量や販売量の動き,・市況や業界の環境は非常に明るくなってきているが、荷動きが活発化するまでには、まだまだ時間がかかる。
,,□,一般機械器具製造業（設計担当）,取引先の様子,・取引先の受注増加が見込めない。
,,□,電気機械器具製造業（経営者）,取引先の様子,・円安、株高ということで、ムードは良い。ただし、実態はまだ変わっておらず、設備投資が出てくるのはまだ先である。
,,□,電気機械器具製造業（宣伝担当）,受注価格や販売価格の動き,・中国からのＰＭ2.5の飛来による影響で、空気清浄機の荷動きが活発であるが、全体的には前年割れの状況である。
,,□,輸送用機械器具製造業（経理担当）,受注量や販売量の動き,・相変わらず国内の設備投資への動きが鈍く、受注に向けての価格競争が激化している。
,,□,建設業（経営者）,取引先の様子,・景気回復の兆しはあるが、建設業の場合は景気が回復し、設備投資計画が企画、設計された後に仕事が始まる。
,,□,建設業（経営者）,受注価格や販売価格の動き,・住宅、商業施設、公共施設共に、単価、利益率は低調なままである。
,,□,輸送業（営業所長）,受注量や販売量の動き,・複写機などの搬入が、例年の２月に比べて微増となっている。
,,□,金融業（営業担当）,受注価格や販売価格の動き,・円安の進行が予想より早く、取引先には警戒心がある。価格についても為替動向を注視している。
,,□,不動産業（営業担当）,取引先の様子,・円安や株高により、消費者マインドが少しは好転している。土地の価格も下げ止まりつつあるが、事務所や住宅の賃料が下落しているなど、実体としては悪い。
,,□,広告代理店（営業担当）,受注量や販売量の動き,・年度末に向かって、広告出稿の大きな動きはみられない。
,,□,経営コンサルタント,受注量や販売量の動き,・家電メーカーや関連会社のコンサルタントをしているが、業界では大手の大赤字などもあり、長らく低迷が続いている。
,,□,コピーサービス業（店長）,受注量や販売量の動き,・数字的に目立った変化はないが、客との会話や雰囲気を総合すると、やや上向きな印象が感じられる。
,,□,その他サービス［自動車修理］（経営者）,受注量や販売量の動き,・景気が良くなる要素が何もない。
,,□,その他サービス業［店舗開発］（従業員）,受注量や販売量の動き,・駅構内の店舗については、飲食店舗は前年並みとおおむね好調であるが、物販店舗は前年比で90～98％と総じて不調である。バレンタインデー商戦も低調に終わるなど、１月の初売りとクリアランスセールの反動減が続いている感がある。
,,□,その他非製造業［機械器具卸］（経営者）,取引先の様子,・株高、円安の効果が出ていると思われるが、現状は実感がない。
,,▲,繊維工業（総務担当）,受注価格や販売価格の動き,・値引きを求められ、単価が維持できないケースが増えている。円安のために原材料や加工代が上がってきているが、コスト増加分が販売価格に転嫁できていない。
,,▲,一般機械器具製造業（経営者）,受注量や販売量の動き,・当社の主な取引先が大手同士で合併したため、多くの投資計画や取引が見直されている。多くの案件が保留となっており、受注が先延ばしされている。
,,▲,電気機械器具製造業（営業担当）,受注量や販売量の動き,・受注が落ち込んでいる。
,,▲,輸送業（商品管理担当）,受注価格や販売価格の動き,・毎年であるが、２月は荷物の量が少ない。
,,▲,広告代理店（営業担当）,取引先の様子,・12、１月はセール時期であるため、それに比べると２月は特に数字が下がる。
,,×,輸送業（営業担当）,取引先の様子,・他社に客が流れているようであり、売行きが悪い。
"雇用
関連

(近畿)",,◎,－,－,－
,,○,人材派遣会社（経営者）,求人数の動き,・２月に入って、年度末までの案件で忙しくなっているが、４月以降の案件も出そろってきている。特に、公共事業、福祉関係、不動産関係など、2014年度の消費税アップを見越しての動きが出てきている。
,,○,人材派遣会社（役員）,採用者数の動き,・求人に対するマッチングが増え、成約案件もわずかずつではあるが、確実に増えてきている。
,,○,人材派遣会社（支店長）,求人数の動き,・建設、土木関連を中心とした受注が増えている。
,,○,人材派遣会社（営業担当）,それ以外,・円安、株高で好況感が感じられる。
,,○,新聞社［求人広告］（管理担当）,求人数の動き,・当社が取り扱う中小企業が主体の求人広告は、３か月前の水準を安定的に上回っているなど、景気は上昇している。
,,○,職業安定所（職員）,求人数の動き,・新規求人数は前年比で増加している。
,,○,職業安定所（職員）,求人数の動き,・１月の新規求人数は12か月連続で対前年同月を上回り、前年10月ごろから鈍化していた伸びも３か月ぶりに２けた増となり、正社員求人の増加も目立つ。減少傾向にあった製造業からの求人も３か月ぶりに増加に転じたほか、建設業や卸売・小売業からの求人が大幅に増加するなど求人の動きは活発となっている。新規求職者数についても引き続き減少していることから、景気についてはやや上向きという感触を受ける。
,,○,民間職業紹介機関（職員）,求人数の動き,・建設関連の日雇い労働者不足が指摘されながらも、いくらかは求人数が増えている。
,,○,民間職業紹介機関（大学担当）,採用者数の動き,・13年３月卒業の学生の動きは落ち着きつつあるが、14年３月卒業の学生に対する採用活動が活発になってきている。
,,○,民間職業紹介機関（営業担当）,求人数の動き,・求人件数が増加している。
,,○,学校［大学］（就職担当）,周辺企業の様子,・２～３か月前よりも、近隣の港に入港する中国や韓国からのコンテナ船が増え、大型船での荷動きが活発になっているように感じる。
,,□,新聞社［求人広告］（営業担当）,周辺企業の様子,・３月に向けて決算時期に入るため、求人の動きは低迷している。ただし、大阪では梅田や阿倍野地区で、大型プロジェクトの動きに対応した求人の動きが出ている。
,,□,新聞社［求人広告］（営業担当）,求人数の動き,・新聞への求人広告の出稿量でみると、政権が代わって増加したと言いたいところであるが、まだ大きな変化は感じられない。
,,□,職業安定所（職員）,求人数の動き,・新規求人数の動きについては、医療・福祉、建設業、卸売・小売業の求人は増加しているが、製造業の動きが悪化している。
,,□,民間職業紹介機関（支社長）,求人数の動き,・新規雇用の需要の変化は今のところみられない。派遣などの非正規社員には動きがみられるが、正社員の採用には依然として慎重姿勢である。
,,▲,人材派遣会社（支店長）,周辺企業の様子,・年度末ということもあるが、周辺企業では事業所の閉鎖や業務縮小といった組織変更の動きが出てきており、派遣のニーズが多少減ってきている感がある。
,,▲,新聞社［求人広告］（担当者）,それ以外,・新聞広告の動きをみると、大阪の地元企業の動きは前年比で８割程度である。特に、関西の地場産業の動きが鈍い。
,,×,－,－,－
,,,,,
　８．中国（地域別調査機関：（社）中国地方総合研究センター）,,,,,
,,,,,（－：回答が存在しない、＊：主だった回答等が存在しない）
分野,,景気の現状判断,業種・職種,判断の理由,追加説明及び具体的状況の説明
"家計
動向
関連

(中国)",,◎,－,－,－
,,○,商店街（代表者）,来客数の動き,・昼時の来客数が以前に比べて確実に増えている。
,,○,商店街（代表者）,それ以外,・土日集中ではあるが来街者の多さが感じられる。また株高、円安傾向のためか高額品の売上も堅調である。
,,○,一般小売店［印章］（経営者）,来客数の動き,・会社、個人ともに印鑑の注文が増えて景気が良くなっている。
,,○,一般小売店［紙類］（経営者）,来客数の動き,・道路の新規開通があったため県北部からの客が増えている。
,,○,百貨店（営業担当）,販売量の動き,・前年同月比で110％を超えてきており、100％を上回る店舗が３分の２を超えている。前年のこの時期は落ち込んでいたので一概に良くなってきているとは言えないが、売上は回復基調にある。
,,○,百貨店（営業担当）,単価の動き,・販売客数は減少しているが、客単価は特にデザイナーズブランドで上昇している。財布に余裕がある客はまとめ買いの頻度も高い。
,,○,百貨店（購買担当）,お客様の様子,・天候の関係で寝具関係は厳しい状況であるが、衣料品は春物が順調である。今年のアパレル業界の仕掛けとしてきれいな色目の商品を打ち出しており、景気の良さを表すように客の購買意欲が高い。コートやジャケットといった高額商品も売れている。
,,○,スーパー（店長）,販売量の動き,・食料品は若干販売量が増加しているが、衣料品や住居余暇商品は前年と比較しても販売量が伸び悩んでいる。
,,○,コンビニ（エリア担当）,来客数の動き,・全体的に来客数は増加している。朝と昼に工事現場からの客が多く、弁当やカップ麺、珈琲飲料の売上が好調である。
,,○,衣料品専門店（経営者）,お客様の様子,・２月の売出しでは来客数も上がり単価の高い品物が出ている。
,,○,衣料品専門店（地域ブロック長）,来客数の動き,・来客数が増加しており、政治の影響もあって景気が良い。
,,○,家電量販店（企画担当）,来客数の動き,・季節的な要因を差し引いても来客数がやや増加してきている。
,,○,乗用車販売店（店長）,お客様の様子,・政権交代の影響か、来場者数が増え、成約に至るまでの時間が以前よりも短くなっている。
,,○,自動車備品販売店（経営者）,お客様の様子,・来店客の様子が変わりつつある。話す内容が悲観的、否定的だった前年までとはうって変わって、期待感があり、明るい話が増えた。
,,○,その他専門店［海産物］（経営者）,お客様の様子,・まだ売上が増えるところまではいかないが、今月の中旬くらいから客の様子がやや観光に向けて動きだしている。
,,○,その他小売［ショッピングセンター］（支配人）,販売量の動き,・政府の経済対策のアピールが心理的に多少影響しているのか、特に生活必需品の売上増加が見られる。ただし、高額品や単価の高い飲食、食品の購買意欲の向上には至っていない。
,,○,その他小売［ショッピングセンター］（運営担当）,来客数の動き,・前年同月よりも来客数は確実に伸びており、売上増にもつながっている。
,,○,高級レストラン（スタッフ）,来客数の動き,・週末の家族客、平日は予約なしの来客数が増えている。
,,○,一般レストラン（経営者）,お客様の様子,・気候が春めいてきた関係からか、客に明るさが感じられる。店舗利用時も１人当たりの利用金額が上昇している。
,,○,一般レストラン（外食事業担当）,単価の動き,・今月に入り宴会の数が増えており、前年より２けたの伸びで景気が上向いている。客単価も上がっている。
,,○,その他飲食［サービスエリア内レストラン］（支配人）,販売量の動き,・以前に比べ買上点数が増加しており、気候が良くなり気温が上がると客も増え、売上は上がる。
,,○,観光型ホテル（支配人）,販売量の動き,・宿泊、宴会部門とも堅調である。特に宿泊は震災被災地からのツアーが２月だけで延べ400人が来館し、宴会も大型の特需物件が受注できた。
,,○,都市型ホテル（企画担当）,来客数の動き,・宿泊客数、レストラン客数、企業宴席も若干伸びている。
,,○,タクシー運転手,お客様の様子,・売上は前年の104％である。
,,○,テーマパーク（広報担当）,来客数の動き,・ここ数年に比べて暖かい天候に恵まれ、また人気イベントを期間延長して実施している影響もあり、前年に比べて大幅に来場者が増加している。
,,○,その他レジャー施設（アミューズメント）,来客数の動き,・11月から継続して来店客数が増加している。前年比30％増となっており、客単価の伸びはあまり大きくないが、娯楽目的で来店する客が増えている。
,,○,設計事務所（経営者）,競争相手の様子,・消費税の駆け込み需要が発生している。
,,○,設計事務所（経営者）,お客様の様子,・耐震改修への意識が官・民ともに高まっており、補助金を使っての工事が増えている。
,,○,設計事務所（経営者）,来客数の動き,・戸建て住宅やオーナービルを消費税増税前に建築したいというクライアントからの引き合いが増えている。
,,○,住宅販売会社（販売担当）,お客様の様子,・商談で前向きな発言が増えている。
,,□,商店街（代表者）,来客数の動き,・地方都市の中心市街地での来客数と売上が増加している様子は感じられない。
,,□,商店街（理事）,来客数の動き,・寒さで客足は良くない。必要な商品だけを購入するという客がほとんどである。
,,□,商店街（代表者）,単価の動き,・アベノミクスの影響で景気が上向いているという報道があるものの、客は将来に不安を感じており気持ちはまだ購買に向いていない。
,,□,商店街（代表者）,来客数の動き,・寒い冬であるが、人通りは例年と変わらない。
,,□,百貨店（営業担当）,販売量の動き,・春物需要は気温の上昇に併せて徐々に高まっているが、バレンタインギフトや雑貨・インテリア等の動きは依然として鈍い。
,,□,百貨店（販売促進担当）,お客様の様子,・前年の大雪と打って変わり、本年はほとんど積雪のない天候で推移している。その中で期待していた春物の立ち上がりは、婦人服を中心に低迷している。購買も単品中心の動きで、本当に必要なものしか買わないといった購買姿勢が強まってきている。客単価が低下傾向にある。
,,□,百貨店（売場担当）,販売量の動き,・２月はハンカチなどのギフト商材は前年並みで推移したが、手袋や冬物ストールなどのセールが急失速している。11月から好調であった防寒系の勢いが収束し、やや前年を下回る見込みである。
,,□,百貨店（売場担当）,来客数の動き,・今月末での閉店発表以降、多数の客が来店した。特殊な状況なので景気判断はできないが、当店の状況とすれば良い。
,,□,百貨店（売場担当）,販売量の動き,・ブランド品やサンゴのアクセサリーは売れているが、先行きは不明である。
,,□,百貨店（販売担当）,来客数の動き,・客単価は前年を維持しているものの、客数が前年からマイナス２％と、来客数の減少により売上も苦戦している。
,,□,百貨店（営業推進担当）,お客様の様子,・客の品物を選ぶ姿が慎重である。
,,□,スーパー（店長）,単価の動き,・１人当たりの買上点数に変化はない。
,,□,スーパー（店長）,来客数の動き,・この半年は来客数が前年の98～99％で推移している。
,,□,スーパー（店長）,来客数の動き,・前年と比較して客数が減少傾向にある。
,,□,スーパー（店長）,来客数の動き,・来店客数が前年を下回っている。
,,□,スーパー（総務担当）,販売量の動き,・生鮮の価格上昇で単価は上昇しているが、点数は伸びていない。
,,□,スーパー（業務開発担当）,来客数の動き,・消費者の財布のひもは固く、必要なものを必要な量だけできるだけ安く買うスタンスは変わっていない。現状は非常に厳しい。
,,□,スーパー（販売担当）,お客様の様子,・客数は依然として減少傾向にあり厳しいが、客１人当たりの購買点数並びに購入単価は若干ながらも上がってきている。総体的に景気の回復を実感するまでには至らないものの、景気の後退は感じられない。
,,□,スーパー（販売担当）,来客数の動き,・来客数に変化はない。
,,□,スーパー（管理担当）,来客数の動き,・客数減少、客単価維持の傾向に変わりはない。
,,□,コンビニ（エリア担当）,来客数の動き,・来客数の減少傾向は止まったが、上向きに転じていない。
,,□,コンビニ（副地域ブロック長）,来客数の動き,・売上の前年割れが継続している。競合店の出店が大きく影響している。
,,□,コンビニ（地域ブロック長）,来客数の動き,・客数の減少を客単価増で支えている。
,,□,衣料品専門店（経営者）,お客様の様子,・今のところ大きな変化はない。
,,□,家電量販店（店長）,販売量の動き,・省エネ商品の売上は好調であるが、テレビの落ち込みをカバーできるほどではない。
,,□,乗用車販売店（統括）,販売量の動き,・２月の販売量は前年比90％と、エコカー補助金終了以降、前年割れが続いている。
,,□,乗用車販売店（副店長）,来客数の動き,・来客数は前年と変わらない。クリーンディーゼル補助金が終わることも影響している。
,,□,その他専門店［和菓子］（経営者）,来客数の動き,・大きな変化はないが、客数は微増で推移している。
,,□,その他専門店［布地］（経営者）,お客様の様子,・一般市民は景気が良くなったという感じを受けていない。何かのきっかけで景気回復を感じれば消費は増える。
,,□,一般レストラン（エリア担当）,来客数の動き,・週末の集客が悪くなっている。家族連れが減っている。
,,□,スナック（経営者）,来客数の動き,・株価の上昇や円安・景気対策などにより景気が良くなると思っていたが、冷静に見ると来客数も変わらないし、客の話を聞いても景気に変化はない。
,,□,都市型ホテル（スタッフ）,お客様の様子,・新政権になり景気回復が期待されるが、ホテルへの影響はまだ先の話である。
,,□,都市型ホテル（総支配人）,来客数の動き,・宿泊客数は12月以降ずっと前年比２％程度落ちている状況である。
