Ⅰ．景気の現状に対する判断理由等,,,,,
,,□,窯業・土石製品製造業（経営者）,受注価格や販売価格の動き,・受注量、販売量共に相変わらずの低迷動向である。
,,□,金属製品製造業（経営者）,受注量や販売量の動き,・復興需要が続き、特装車両（コンクリートミキサー車）のフル生産が続いている。
,,□,金属製品製造業（経営者）,取引先の様子,・主な取引先にいろいろと先行きの様子を聞いているが、６か月ぐらい先ならば発注があるかもしれないが、今は全然予定はないという話ばかりで困っている。
,,□,一般機械器具製造業（経営者）,受注量や販売量の動き,・世の中の雰囲気は良くなってきていると感じるが、現状、数字としてなかなか上がってこない。足元の数字は思わしくない。
,,□,一般機械器具製造業（経理担当）,受注量や販売量の動き,・当社はものづくりをしている中小企業である。大手企業はどんどん海外生産をしてしまうので、我々中小企業に注文は回って来ず、生産は減少している。
,,□,電気機械器具製造業（経営者）,受注量や販売量の動き,・６月の売上は前年同月比４割減で、約半分くらいになってしまった。今年に入ってから２～３割の減少だったが、ここにきて最大の落ち込みである。仲間に聞いても仕事はないという回答が多い。製造業にはまだアベノミクスの影響はほとんどないように思う。
,,□,輸送用機械器具製造業（経営者）,受注価格や販売価格の動き,・取引先、受注量、販売量等は、良い会社もそうでないところもあり、平均的にはあまり変わらない。
,,□,輸送用機械器具製造業（総務担当）,受注量や販売量の動き,・３か月前と比べ、大手自動車メーカーからの受注は10％ほど増加している。ただし、コスト削減の要請を受け、販売単価は厳しくなっており、収益面はやや落ち込んでいる。総じて変わらない。
,,□,輸送業（営業担当）,取引先の様子,・このところ天候の良い日が続き、気温も高いため、特に夏場の商材で扇風機等の物量が増加し、中でもインターネット通販、ホームセンター向けが増えている状態である。ただし、円安による原油高により燃料高となっており、利益の確保が難しい状態が続いている。
,,□,金融業（経営企画担当）,取引先の様子,・製造業関連では、燃料費及び原材料の高騰が利益率を悪化させているが、経費削減等により利益確保に努めている。建設業においては、地方の景気回復が遅く、建築物件は少ない状況で改善していない。小売業では目立った売上増の動きはない。
,,□,新聞販売店［広告］（総務担当）,取引先の様子,・好天が続いたものの、中旬から天候や寒暖の変化が激しく、衣料品店や量販店での夏物の動きは今一つ鈍い状況だと聞いている。今月のチラシ出稿状況は前年比99.5％であり、今年に入ってから前年実績を上回った月はない。
,,□,経営コンサルタント,取引先の様子,・景気をけん引する商品やサービスがないという状態である。設備投資も個人消費も目覚ましい変化が見えない。
,,□,司法書士,受注量や販売量の動き,・やや良くなっている様子はあるものの、やや良くなると回答するほどではない段階なので、変わらないという回答である。
,,□,社会保険労務士,取引先の様子,・忙しくなってきているわけでも、賃金が上がったわけでもなく、今のところ業績の大きな変化も見受けられない。
,,□,その他サービス業［情報サービス］（経営者）,受注量や販売量の動き,・新年度に入ったが、まだまだ受注量に変化が見られず、投資額は抑え気味である。
,,▲,窯業・土石製品製造業（総務担当）,受注量や販売量の動き,・何ら変化なしの状態である。
,,▲,電気機械器具製造業（経営者）,受注量や販売量の動き,・取引先からの受注が伸び悩んでいる。
,,▲,不動産業（経営者）,それ以外,・競争が厳しいので、新規分野を開拓したくても、経済見通しの不安定要素が多く、新規分野への投資がはばかられる。
,,▲,不動産業（管理担当）,受注量や販売量の動き,・今まで年度の途中で契約が終了することはなかったが、管理を委託されていた物件で、別の管理会社と契約したために当社への委託がなくなった物件があった。
,,▲,広告代理店（営業担当）,受注量や販売量の動き,・広告媒体（情報誌）の出稿数や金額が10％くらい下がっている。
,,×,電気機械器具製造業（経営者）,受注量や販売量の動き,・更に注文が取れなくなり、休業、早退で何とか維持している状況で、悪くなっている。採算は悪化してきている。
,,×,建設業（開発担当）,受注量や販売量の動き,・決算後２か月経過したが、公共工事発注は少なく、民間工事受注が中心になっている。受注は何とか前年並みであるが、前年はその前の年より10％程度落ち込んでいた。営業をかけているが、発注物件が少ない状況である。
"雇用
関連

(北関東)",,◎,＊,＊,＊
,,○,人材派遣会社（経営者）,求人数の動き,・電機関係だとＬＥＤ関連の蛍光灯、豆電球の生産は良いように見受けられる。夏物の商品では、扇風機、エアコン等の部品組み立てなどの作業や部品製造、また、農機具などが今回目立ったように思われる。住宅関連は依然として横ばいという意見が出ている。
,,○,人材派遣会社（管理担当）,求人数の動き,・自動車及び携帯電話関連の企業から、突然求人が150名増加したためである。
,,○,職業安定所（職員）,求人数の動き,・５月の新規求人数が３、４月を上回っている。
,,○,職業安定所（職員）,求人数の動き,・求人数が増加傾向、求職者数は減少傾向にある。
,,○,職業安定所（職員）,求人数の動き,・一部の生産品目を除き、今まで厳しかった製造業において、非正規雇用ではあるものの求人数が徐々に増加の傾向にあることが要因である。また、全体的な求人数の推移を見ても、減少分が少なくなってきており、以前よりは景気が安定してきている。
,,□,人材派遣会社（経営者）,周辺企業の様子,・今年に入ってから、企業の人材要請がほとんどない。前年の今ごろとは全然違う状況である。
,,□,新聞社［求人広告］（担当者）,採用者数の動き,・求人広告の依頼が増加傾向にある。
,,□,職業安定所（職員）,求人数の動き,・求人数の動きに変化が見られない。
,,□,学校［専門学校］（副校長）,周辺企業の様子,・高校生及び専門学校生の求人や求人情報は例年とあまり変わらない。若干ではあるが大手企業からの求人数が増えてきている。
,,▲,求人情報誌製作会社（経営者）,周辺企業の様子,・５、６月共に、一部企業を除いて全般的に景気低迷が続いている。周辺企業ではパートの募集はあるものの、正社員募集は少ない。
,,▲,職業安定所（職員）,求人数の動き,・管内主要企業及びその関連企業で早期退職を募っており、12～３月にかけ県北地区で530名程度、その後４～６月にかけて追加で110名程度の実施を予定している。そのため４、５月の求職者が増加している。一方、新規求人数は前年同月比で４月がマイナス8.6％、５月が同12.7％となっている。
,,×,－,－,－
,,,,,
　４．南関東（地域別調査機関：（株）日本経済研究所）,,,,,
,,,,,（－：回答が存在しない、＊：主だった回答等が存在しない）
分野,,景気の現状判断,業種・職種,判断の理由,追加説明及び具体的状況の説明
"家計
動向
関連

(南関東)",東京都,◎,家電量販店（営業統括）,単価の動き,・時計を中心に高価格帯の販売実績が上がってきた。引き続き訪日外国人の来店が多く、免税売上が好調に伸びている。
,東京都,◎,その他小売［雑貨卸］（経営者）,販売量の動き,・新聞、ニュースで報道されているとおりで良くなっている。
,,◎,住宅販売会社（従業員）,販売量の動き,・契約数が例年より２、３割増えている。
,東京都,○,商店街（代表者）,それ以外,・全体的にアベノミクスの勢いは弱くなっているように思う。しかし、当地域だけをみると私鉄の相互直通運転開始による特需はまだ緩やかに続いている。クレジットカードの取扱高がわずかながら前年比を超えている。
,,○,一般小売店［家電］（経理担当）,来客数の動き,・以前は故障での買換えがほとんどだったが、今月になってエアコンなど買換えの客が少し増えている。
,,○,一般小売店［家電］（経理担当）,お客様の様子,・商品の動きや、リフォームの相談、太陽光への提案、相談などがある。ＬＥＤ照明の動きも良い。
,東京都,○,一般小売店［家具］（経営者）,販売量の動き,・３か月前と比べてやや良くなっている。販売量はもちろんのこと、来客数も増えている。金額が高い物も動くようになってきている。
,,○,一般小売店［靴・履物］（店長）,単価の動き,・来客数は減っているが、２、３か月前と比べてまとめ買いの客が多くなっている。また、良い物を買う人が多くなり、単価がやや良くなっている。総体的には前年と同じような動きだが、多少は良くなっている。
,,○,一般小売店［茶］（営業担当）,販売量の動き,・お中元の時期に入り、前年に比べギフトの件数が増え、売上の増加につながっている。
,,○,百貨店（売場主任）,販売量の動き,・梅雨入りはしたが天候は良く、ＵＶ関連商材の動きが非常に多い。特にパラソルの動きが良く、販売数量が増加している。
,東京都,○,百貨店（総務担当）,販売量の動き,・３か月前と比べて売上高は約３～５％上向きになっている。前年と比べてもそのぐらい良くなっている。来客数もこの１、２か月については、前年比100％を超えてきている。
,東京都,○,百貨店（営業担当）,販売量の動き,・今月は特に高額品の動きが良く、前年比２けた以上の伸びをみせている。食料品関連はほぼ横ばいだが、お中元ギフトの早期受注が大きく伸長している。現在の状況では来客数及び顧客単価も前年に対し２～３％前後伸びている。
,,○,百貨店（販売管理担当）,お客様の様子,・ここ数か月間は宝飾や時計といった高額品販売が順調に推移しているほか、百貨店の中心売上の一つである進物、ギフト需要も平均単価、客単価共に増加しており、客の購買意欲は引き続き堅調であることがうかがえる。
,,○,百貨店（副店長）,来客数の動き,・売場リニューアルを実施したことが奏効し、来店客が増えている。来店客の増加がそのまま売上増加には直結しないが、販売努力や様々なイベント等により徐々に購買客数が増えてきている。
,東京都,○,百貨店（計画管理担当）,お客様の様子,・ここ数年、お中元の売上ピークが後半にずれ込む傾向であったが、今年は６月前半から好調に推移している。自分の買物と違い、他人への進物なので手持ち資金とマインドに余裕がないと、買おうというモチベーションにつながらないが、気持ち的に余裕が出てきているのではないか。
,東京都,○,コンビニ（経営者）,来客数の動き,・来客数がやや多くなっている。
,,○,コンビニ（経営者）,お客様の様子,・高付加価値商品であるプライベートブランド商品の売上が順調に伸びている。それと同時にお届けサービスの利用が増え、客の買上額も上昇している。
,,○,コンビニ（経営者）,販売量の動き,・３店舗の平均でみると、来客数は少々伸びた程度であり、大きな期待をしていたが外れた。
,,○,コンビニ（経営者）,単価の動き,・最近の傾向として、多少高くても価値があると思った商品には関心を持ち、単価が上がっている。
,東京都,○,コンビニ（エリア担当）,来客数の動き,・気温が前年との比較で上昇高いことを受け、来客数が伸び始めている。
,東京都,○,コンビニ（商品開発担当）,来客数の動き,・依然として厳しい状況は続いているが、前年と比較すると来客数は徐々に回復している傾向にある。
,,○,衣料品専門店（経営者）,販売量の動き,・父の日のプレゼントも期待したほどではなく、６月上旬は低調な売上だったが、気温の上昇とともに夏物が本格的に売れ出してきた。また、旅行のための衣類を求める年配の人が増えてきている。
,,○,乗用車販売店（経営者）,来客数の動き,・新型車の投入とコマーシャルの効果で来店客が増えてきている。
,,○,乗用車販売店（営業担当）,お客様の様子,・日ごろのニュースのせいなのか、影響を受けているユーザーが多い。
,東京都,○,乗用車販売店（販売担当）,単価の動き,・トラックの新車は前年と比べると、自動車排出ガス規制や先進環境対応型ディーゼルトラック等の導入に対する補助金終了の影響で、全体的には前年より若干下回っているが、中古車についてはオークションでの成約率が高く、粗利も前年と比べると台当たり単価で５～10％ぐらい高くなっている。中古車市場については景気は良い。
,,○,乗用車販売店（店長）,お客様の様子,・新型軽自動車の効果もあるが、前年比でみると軒並み上回っている。また、客は政権の偉業によりボーナス等が増えたと言っている。
,,○,一般レストラン（経営者）,お客様の様子,・３か月前と比べると、アベノミクス効果なのか今の方が雰囲気的には良くなっている。決して消費者の所得が上がったわけではないが、この雰囲気で多少は良くなっている。客も気分的なものだと言っている。
,東京都,○,一般レストラン（経営者）,お客様の様子,・通常は選挙のある月は接待を控えるので売上が伸びないが、今回の東京都議会議員選挙に関しては選挙に関心がなかったということも大きな点ではあると思うが、比較的客の来店が多かった。お金も少し使うような感じで推移している。
,東京都,○,旅行代理店（従業員）,お客様の様子,・前年に比べ国内団体旅行の販売単価が上がっているものの、予約が入ってきている。また、50～100名規模の大型社員旅行の話もつきない。
,,○,タクシー運転手,お客様の様子,・空梅雨で売上が下がるのではと不安だったが、まずまずの流れで、特に今月２回深夜にあり得ないぐらいの長距離利用があった。朝、夕方の通勤、駅、会社の往復、病院の往復と利用が少し増えているようである。
,,○,タクシー（団体役員）,お客様の様子,・今月に入り契約企業からの無線配車オーダーも若干であるが増えてきている、さらに週末の繁華街の人出も２～３か月前よりは多少多く感じる。
,東京都,○,通信会社（社員）,お客様の様子,・加入契約数が少し上向きになってきており、どん底からははい上がった感じがある。新規導入のサービスが伸びてきている。
,,○,通信会社（営業担当）,単価の動き,・既存のサービスよりも月額料金が上がるサービスの契約比率が上昇傾向にあり、価値を見出せるサービスへは以前ほど支払をいとわない傾向にある。
,東京都,○,観光名所（職員）,来客数の動き,・３か月前の３月は観光地としては一番の閑散時期でもあり、６月は梅雨とはいえ、やや良くなっている。
,,○,美容室（経営者）,お客様の様子,・来客数と売上が少し伸びてきた。
,,○,設計事務所（経営者）,それ以外,・我々建築設計は全般的には良くない。しかし、学校等の公的な場所において耐震診断を全て行い、地震に強い建物環境を作るということで行政は耐震診断、耐震補強を優先しているため、建築設計の業務も非常に忙しく、活発に動いている。
,,○,設計事務所（経営者）,お客様の様子,・客にこれからの話を聞くと、当社の仕事量が増えるかもしれないが、実際、契約に結び付くかどうかは流動的である。
,,○,住宅販売会社（経営者）,それ以外,・当社は住宅を主に扱う不動産開発業と総合建設業である。当社においては直接景気が良くなっているとは感じられないが、世間のムードは明るさを持ってきているように思える。ムードだけではなく、本当に個人消費が増えて景気が良くなることを期待している。
,東京都,○,住宅販売会社（従業員）,販売量の動き,・消費税増税関係等により、契約は前年比15％ほど増加しているが、売上についてはまだ反映されていない。これから更に駆け込み需要が予想されるが、売上に反映されて利益につながるのはまだ先になる。
,,○,住宅販売会社（従業員）,販売量の動き,・今月の販売量は目標の約130％となり、３か月前と比べても少し増えているため、景気はやや良くなっている。客から消費税増税前に契約をしたいという話をよく聞く。
,,○,住宅販売会社（従業員）,販売量の動き,・マンション販売センターへの来客数が増えている。また、客の意欲が高まっている。
,,○,住宅販売会社（従業員）,販売量の動き,・戸建住宅の受注量が増加してきている。
,東京都,○,その他住宅［住宅資材］（営業）,販売量の動き,・引き続き建材関係の荷動きが活発である。ただし、それ以外の客先は低調なところもある。
,,□,商店街（代表者）,お客様の様子,・客の様子をみると、給料が上がっているような様子は全くなく、先行きの心配も若干あり、景気が良くなったとはあまり感じられないようで、非常に慎重になっている。
,東京都,□,商店街（代表者）,来客数の動き,・かなり暑い日が続いており、こういう時は高齢者が出なくなるので売上が落ちるという状態が続く。気候が普通の状態にならないと我々の生活は大変である。
,,□,商店街（代表者）,お客様の様子,・ここのところ店舗を閉める人が多く、その後釜がサービス業的な人集めのできる業種ではないため、商店街のシャッター通り化がますます加速していくような感じがするので、非常に困っている。
,東京都,□,商店街（代表者）,販売量の動き,・大企業の景気回復状態に比べ、末端の商店街ではまだその恩恵にはあずかっていないように感じる。前回のバブル期の教訓から消費者は次の景気後退に備え、消費を一挙に増大させようとはしていない。先行きの安定感が求められている。
,,□,一般小売店［印章］（経営者）,来客数の動き,・毎月のことだが、来客数は低迷し、低いところでほとんど変わらない。残念なことに当店の客の増加はまだ望めていない。
,,□,一般小売店［祭用品］（経営者）,来客数の動き,・６月後半になり受注も出てきたが、前半は新規の受注が少なかった。
,,□,一般小売店［文具］（販売企画担当）,販売量の動き,・６月に関しては売上、粗利共に横ばいである。それほど目立って良くなった、悪くなったということはない。若干雨が降ったので、その分店頭の売上、来客数等が下がったが、外商等は普通である。消費税が今の５％から８％に上がると特需が若干あるので、その辺のプラスがあり、店頭のマイナスを差し引くと、全く変わらない。
,,□,百貨店（総務担当）,来客数の動き,・景気だけの要因ではないが、来客数が芳しくない。今後もこの状況は一転するとは思えない状況にある。
,東京都,□,百貨店（広報担当）,お客様の様子,"・５月23日に日経平均株価が1,143円安という急落を記録、為替レートも乱高下が続き、今一つ伸びはみられないが、高額品消費の動きはある。６月中旬までの高額品の商況は、絵画、宝飾品の販売は前年並み、時計販売は前年比で海外有名ブランドが300％、平均販売単価が120％、国産腕時計を代表するメーカーが約340％と好調である。特にその日本メーカーの所有する高級腕時計ブランドは前年比800％である。"
,東京都,□,百貨店（営業担当）,来客数の動き,・婦人服に大きな変化は感じられない。来客数も増えているわけでもなく、むしろ減っている。
,東京都,□,百貨店（営業担当）,お客様の様子,・高級時計などぜいたく品の販売は増加傾向にあるものの、生活消費財は必要最低限の購買しかしていない。
,,□,百貨店（販売促進担当）,お客様の様子,・客の動向として、必要なものを目的の売場で購入し、買い回りをしない傾向が続いている。
,東京都,□,百貨店（営業企画担当）,販売量の動き,・前月同様高額品を中心に好調を維持している。
,,□,百貨店（店長）,販売量の動き,・３月のような勢いがなくなっている。悪くはないが、良い感じもない。
,,□,スーパー（経営者）,販売量の動き,・来客数はそれほど減っていないが、１人当たりの買上点数が減っている。雨の影響か、それとも景気が悪いので買い控えをしているのか、競合店がたくさんできているので買い回りしているのか、そのどれかである。
,,□,スーパー（店長）,来客数の動き,・今月に入り、１日の来客数が前年と比べると20名ほど落ちている。24日現在で約480名の来客数減となっている。近隣に競合店ができたことが一番の要因である。競合店ができて３か月がたつが、まだ来客数が回復に至っていないのが現状なので、３か月前と比べると変わらない。
,東京都,□,スーパー（店長）,お客様の様子,・来客数、単価、点数共に前年並みに推移しており、ここ数か月の流れは変化していない。
,,□,スーパー（総務担当）,お客様の様子,・６月全体の状況としては、前年を若干下回っている。前半はまあまあ良かったが、後半は天候が不安定だったため、衣料品等が若干落ち込んできて前年並みである。ただし、頻度性の高い食料品や日用雑貨類は来客数の落ち込みがそのまま売上につながっており、前年を５％ほど下回っている。また、単価も影響を受けて下がっている。
,東京都,□,スーパー（営業担当）,販売量の動き,・買上単価、販売数量、来客数については前年よりも上回っており、この３、４か月同じベースで好調に推移している。
,,□,スーパー（仕入担当）,販売量の動き,・株価、円相場が不安定で消費者の心理は節約志向でまだまだ販売点数は伸びていない。
