Ⅰ．景気の現状に対する判断理由等,,,,,
,,,,,
　景気の現状に対する判断の理由及びそれに対する追加説明等について、その主だったもの及び特徴的と考えられるものを取りまとめると以下のとおりであった。,,,,,
,,,,,
,,,,,
　１．北海道（地域別調査機関：（株）北海道二十一世紀総合研究所）,,,,,
,,,,,（－：回答が存在しない、＊：主だった回答等が存在しない）
分野,,景気の現状判断,業種・職種,判断の理由,追加説明及び具体的状況の説明
"家計
動向
関連

(北海道)",,◎,観光名所（従業員）,来客数の動き,・今月の利用乗降客数が前年比135％となっており、年度全体でみても前年比120％と好調を継続している。
,,◎,その他サービスの動向を把握できる者［フェリー］（従業員）,来客数の動き,・これから観光最盛期を迎えるが、旅客数、車両台数ともに大幅に増加している。
,,○,一般小売店［土産］（経営者）,販売量の動き,・今月も天候不順が客の出足を鈍らせているが、少し改善されてきており、売上は前年よりも８％程度伸びている。
,,○,百貨店（売場主任）,販売量の動き,・３月は好調な商品が特選や宝飾品中心だったが、今月は婦人服が前年比105％、紳士服が前年比109％など、全ての分野で前年比がプラスとなっている。
,,○,百貨店（売場主任）,単価の動き,・ハウスカードの加入自体は大幅に増えていないが、既存顧客の利用額が若干アップしている。
,,○,百貨店（販売促進担当）,販売量の動き,・気温の上昇にともない、来客数、買上客数ともに増加基調になっている。
,,○,百貨店（販売促進担当）,お客様の様子,・天候や気温の安定が好影響となり、今まで苦戦が続いていた衣料品の購買客数がようやく上向いてきた。
,,○,スーパー（店長）,販売量の動き,・６月に入り急激に暑くなってきたことで、衣料品を中心に盛り返している。
,,○,スーパー（役員）,販売量の動き,・お中元ギフトの販売が好調である。消費に少し余裕が出ている。
,,○,コンビニ（エリア担当）,来客数の動き,・天候の回復が来客数をけん引している。以前と比較しても、気温が上昇した時の来客数が増加している。また、飲料水やアイスクリームなど、低単価商品の消費が回復している。
,,○,衣料品専門店（店員）,単価の動き,・新政権の経済対策の効果なのか、客の購買意欲が向上している。きもの展示会でも高額商品が売れており、宝石の売上もかなり良かった。
,,○,家電量販店（地区統括部長）,販売量の動き,・今年は春が短く、暑さが早めに到来したため、エアコンの需要が微増ではあるが伸びてきている。
,,○,乗用車販売店（従業員）,販売量の動き,・販売台数も伸びているが、来店した際にお金を使ってもらう機会も増えている。
,,○,自動車備品販売店（店長）,来客数の動き,・車の小物商品の買上点数が増えており、月を通しての利用回数も増えてきている。
,,○,その他専門店［医薬品］（経営者）,お客様の様子,・長かった寒冷期から一気に夏になったことで、購買意欲もやや盛り上がってきた。
,,○,高級レストラン（スタッフ）,来客数の動き,・ランチ、ディナーともに、地元客、観光客の入込が良い。特に若年層のカップルや年配の夫婦、グループと観光客が戻ってきている。来客数は前年比117％と好調である。
,,○,高級レストラン（スタッフ）,販売量の動き,・来客数が少しずつ良くなっており、やや期待できる状況になっている。
,,○,観光型ホテル（経営者）,来客数の動き,・３か月前と比較すると、外国人客数は引き続き堅調に推移している。また、今月に入り、本州方面からの団体客数が若干回復し始めている。客単価が低いため、売上にはなかなかつながらないが、来客数の増加でカバーできる状況になりつつある。
,,○,観光型ホテル（スタッフ）,来客数の動き,・学会、イベント、コンベンションなどがあり、好調に推移した。
,,○,旅行代理店（従業員）,それ以外,・６月のボーナスが良かったため、やや良くなっている。
,,○,タクシー運転手,来客数の動き,・今月はタクシー１台当たりの売上は前年をやや上回ったが、乗務員不足でタクシーの稼働率が悪くなったため、会社の売上は前年を下回った。一方、観光客が増えていることで、夜の人出は多くなってきている。
,,○,タクシー運転手,来客数の動き,・北海道観光に関する問い合わせやオーダー数が前年よりもやや増えている。
,,○,通信会社（社員）,販売量の動き,・客の購買意欲が高まっている。ただし、その要因は景気によるものではなく、消費税増税前の駆け込み需要が増えているためである。一般消費者にまで新政権の経済対策の効果が出ているかと言われると決してそうではない。収入が増えているわけでもないため、消費が活発になるわけではない。
,,○,住宅販売会社（経営者）,お客様の様子,・株価もある程度上がり、外国為替も安定してきているため、３か月前よりはやや上向き傾向にある。
,,○,住宅販売会社（従業員）,販売量の動き,・消費税増税を控えての影響がみられる。
,,○,住宅販売会社（従業員）,お客様の様子,・モデルルームを来訪する客のなかには、早く買わないと、欲しい部屋が他の客に契約されてしまうと、購入の判断を急ぐ方が増えてきている。そのような客の行動が、分譲マンションの早期完売に貢献している。
,,□,商店街（代表者）,お客様の様子,・このところ天候が二転三転しており、季節商材などの売上に変動がみられる。ただし、全般的にみると大きな変化はみられない。
,,□,商店街（代表者）,お客様の様子,・天候に左右されることが非常に多い。６月上旬のかなりの低温からいきなり暑くなり、中旬にまた気温が落ちるといった変化に、客の戸惑いが感じられ、夏物の購買がもう一歩安定しないところがみられる。
,,□,商店街（代表者）,お客様の様子,・気分的には景気が良くなってきたとみられるが、現実的にはなかなかまだ良いという気持ちにはならない。
,,□,商店街（代表者）,来客数の動き,・道内外及び外国からの観光客が増加する時期であるが、増加の実感はない。とりわけ外国人観光客については、団体客が前年と比較して激減している。また、当地の歩行者天国のオープニングが23日に行われ、１万人弱の人出があったが、買物へと流れる来街者は少なかった。
,,□,商店街（代表者）,来客数の動き,・当地区では、観光客が前年の７割程度と相当減少している。業者に聞いても、道内でも悪い方だと言われている。
,,□,一般小売店［酒］（経営者）,販売量の動き,・客単価については、やや底を打った感があり、高額商品もそこそこに売れている。ただ、全体のボリュームが非常に少なく、なかなか売上の増加には結び付いてこない状況である。
,,□,百貨店（売場主任）,来客数の動き,・今月は上旬から中旬にかけて、前年と比べて気温が高く、晴れた日も多かったため、特に夏物商材やカットソー、ブラウス関連の販売量が前年比110％と伸びた。それに加えて、パンツの動きも非常に良く、前年比120％となっている。
,,□,百貨店（役員）,販売量の動き,・今月はホームセンターが順調に売上を伸ばしている。要因としては、５月までの天候不順から、６月に入り、気温が上がり、天候が良くなったことが大きい。
,,□,スーパー（役員）,来客数の動き,・３月以降、若干の来客数の増加がみられるが、前年との比較では、いまだに約１％下回っている。６月は真夏日が３日間あった一方で、最高気温が16.1度と低い日もあり、気温が乱高下している。特に第４週は気温が低く、来客数も急に減少した状況となっている。また、円安により、輸入に頼っている食品で、相場が高くなっている品目が多く、平均買上点数も伸び悩んでいる。
,,□,コンビニ（エリア担当）,単価の動き,・天候不順の影響で漁師の来店回数が減少している。
,,□,衣料品専門店（店長）,それ以外,・暖かくなるとともに良くなることを期待していたが、なかなかそうはいかず、今のところは苦しい状況にある。
,,□,家電量販店（店員）,販売量の動き,・６月は気温が上がらなかったため、夏物商材が動かず、前年を下回っている。
,,□,乗用車販売店（従業員）,単価の動き,・販売単価の低い商品が中心で高額車が売れない｡
,,□,乗用車販売店（営業担当）,販売量の動き,・受注量、販売量ともに大きな動きがみられず、期待しているほど上向いてこない。
,,□,高級レストラン（経営者）,来客数の動き,・例年であれば、観光客、特に外国人観光客がもっと入ってくるはずだが、今年はそこまで増えていない。
,,□,高級レストラン（スタッフ）,お客様の様子,・全体で例年並みとなった。来客数は、個人客は変わらないが、企業の少人数グループ客が増えている。ボーナス月で期待したが、今一つ盛り上がらなかった。好天が続いたことで、郊外や地方のレストランへ出かけた人も多いようだ。
,,□,タクシー運転手,来客数の動き,・景気の動向として、言われているような持ち直し感については、地域においてはなかなか実感がなく、消費動向が一向に回復してきていない。
,,□,タクシー運転手,販売量の動き,・観光客の入込はまずまずだが、タクシーの利用は少ない。３か月前と比較すると、売上が約３％伸びているものの、前年比では約２％落ち込んでいる。このようなことから、３か月前と比べて変わらない。
,,□,通信会社（企画担当）,お客様の様子,・客のなかから、他社の魅力的な通信端末に移行するという声が減らない。
,,□,美容室（経営者）,来客数の動き,・一時の高揚感ではなく、落ち着いた気分が雰囲気として感じられる。良くもない代わりに悪くもないといった一定の落ち着きがある。
,,▲,商店街（代表者）,販売量の動き,・急に暑くなったりと異常気象が続いているため、来客数が減少した。
,,▲,スーパー（店長）,販売量の動き,・４～５月と売上が足踏み状態だが、３か月前と比較して販売量が５％近く落ち込んでいる。また、前年との比較でも７％の落ち込みとなっている。
,,▲,乗用車販売店（従業員）,販売量の動き,・販売量についてみると、前年比での減少幅が小さくなってきている。車種ではやはり省エネ車に需要が偏っている。
,,▲,旅行代理店（従業員）,お客様の様子,・７～８月出発の受注が前年比で悪化している。しかし、９～11月出発の受注はとても良い。７月は参議院選挙の影響も考えられる。
,,×,＊,＊,＊
"企業
動向
関連

(北海道)",,◎,建設業（従業員）,受注価格や販売価格の動き,・建築型枠、鉄筋工事、内装工事等の労務者が不足していて、特に地方で下請の見積が高騰している。公共工事のみならず民間工事でも入札の不調が続いている。
,,○,食料品製造業（経営者）,それ以外,・新政権の経済対策の効果から景気の上向き感が出ている。ただし、庶民の暮らしまでは届いていない。
,,○,家具製造業（経営者）,受注量や販売量の動き,・大都市圏のマンション、住宅の活況に呼応して家具需要も拡大している。
,,○,金融業（企画担当）,それ以外,・設備投資は医療福祉施設の新増設などで底堅い。観光関連は東南アジアからの来道客が増加しているほか、ＬＣＣの就航も追い風となっている。しかし、円安による原材料や燃料価格の上昇が収益を圧迫している。建設関連では技能者不足が深刻で工期の遅れもみられる。
,,○,コピーサービス業（従業員）,受注量や販売量の動き,・販売単価は横ばいだが、受注量が少しずつ増えてきている。
,,○,その他サービス業［ソフトウェア開発］（経営者）,受注量や販売量の動き,・自治体の大型のシステム開発案件が出てきたことによる特需が生じている。
,,□,食料品製造業（役員）,受注量や販売量の動き,・３か月前と比べて受注状況に変化はみられない。
,,□,輸送業（営業担当）,取引先の様子,・現実的には取扱貨物及び設備投資が増えていないが、新政権の経済対策により、精神的な面で得意先に明るい雰囲気がみられるようになってきている。
,,□,輸送業（支店長）,受注量や販売量の動き,・本質的な需要に対応した荷動きはまだ少なく、価格調整や在庫調整上の一時的な荷動きにとどまっている。
,,□,司法書士,取引先の様子,・不動産取引や建物の新築着工から判断すると、依然として低水準のまま推移している。
,,□,司法書士,取引先の様子,・当地において、景気回復の兆しはあまり見えていない。
,,□,その他サービス業［建設機械リース］（支店長）,取引先の様子,・取引先に尋ねても景気の上向きを実感しているのはまれである。建設業関連の取引先では、参議院選挙の影響もあり、工事発注が夏以降に集中することに危機感を抱いている。
,,▲,通信業（営業担当）,取引先の様子,・景況感そのものはやや良い状態を堅持しているが、３か月前と比較すると、取引先の様子からは、昨今の国内株価の乱高下や米国、中国との情勢を背景として慎重姿勢が目立ち始めており、方向感としてはやや悪くなってきている。
,,▲,司法書士,取引先の様子,・土地売買、建物の新築案件が相変わらず低調なままである。
,,▲,その他非製造業［鋼材卸売］（役員）,受注量や販売量の動き,・マスコミで報道されているような新政権の経済対策の効果は一部の輸出関連の本州企業に限られており、一般市況は厳しさを増している。客先の仕事量はまだ少なく、当社の販売量、売上は足踏み状態である。
,,×,－,－,－
"雇用
関連

(北海道)",,◎,求人情報誌製作会社（編集者）,雇用形態の様子,・一般企業の事業拡大や支店、営業所の開設による求人募集が増加傾向にある。飲食店でも新店オープンが相次いでおり、札幌圏外や道外に進出する企業も出始めている。これらの影響から不動産業も堅調である。また、正社員求人も安定して増えてきている。
,,○,人材派遣会社（社員）,求人数の動き,・経営者のマインドが改善し、新たな営業活動を検討しているのか、営業職や管理部門の求人が前年比で40％程度増えている。また、人材派遣のニーズも緩やかながら増加傾向にある。
,,○,求人情報誌製作会社（編集者）,求人数の動き,・求人広告件数に関しては､前年と比較して１～２割程度の増加で推移している。特に建設業界を筆頭に企業側の募集意欲は堅調である。
,,○,職業安定所（職員）,求人数の動き,・新規求人数は前年から7.7％増加し、40か月連続で前年を上回った。月間有効求人数も前年から11.9％増加し、40か月連続で前年を上回った。
,,○,職業安定所（職員）,求人数の動き,・建設業では、建築分野で消費税増税を見越した前倒し発注の増加がみられ、技術者のほか、職人や作業員の求人が増加している。卸小売業もほぼ各業種で求人が増加している。
,,□,人材派遣会社（社員）,求職者数の動き,・４月の年度変わりで一旦採用が落ち着いた様子がある。
,,□,求人情報誌製作会社（編集者）,雇用形態の様子,・ほぼ全業種で人手不足感があり、求人件数も増加傾向にあるが、派遣などの非正規雇用の求人の増加が目立っている。
,,□,新聞社［求人広告］（担当者）,求人数の動き,・前年６月は、募集広告の売上が前年比131％と大幅に増加した月だったが、今年６月は前年比104％と更に実績を上回った。特に地元企業からの求人が好調で、農作業の派遣や看護師等の医療系が大きく伸長した。
,,□,職業安定所（職員）,雇用形態の様子,・５月の新規求人数は前年を3.7％上回った。新規求職者数は前年を13.1％下回った。月間有効求人倍率は0.68倍となり、前年の0.62倍を0.06ポイント上回った。一方、新規求人数のうち正社員求人の占める割合は46.7％と、求人者と求職者の間における職種や労働条件のミスマッチも少なくないことから、依然として厳しい状況にある。
,,□,職業安定所（職員）,求人数の動き,・求人数の増加傾向は継続しているが、３か月前と比較しても特に良くなっているという印象はない。
,,▲,求人情報誌製作会社（編集者）,求人数の動き,・新政権の経済対策が総体的な求人増をもたらしたが、ここにきて業種毎のばらつきが出てきており、多くは例年どおりの数字に落ち着こうとしている。求人疲れか先行きの不透明さが影響している。
,,×,－,－,－
,,,,,
　２．東北（地域別調査機関：公益財団法人東北活性化研究センター）,,,,,
,,,,,（－：回答が存在しない、＊：主だった回答等が存在しない）
分野,,景気の現状判断,業種・職種,判断の理由,追加説明及び具体的状況の説明
"家計
動向
関連

(東北)",,◎,－,－,－
,,○,商店街（代表者）,来客数の動き,・梅雨とはいえ恵まれている天候やイベント実施効果とみられるが、来街客が増えている。それに呼応してテイクアウト、ファストフード、飲食店関係は好影響のようである。
,,○,商店街（代表者）,来客数の動き,・好天が続いているので、観光客や観光客による街めぐりの増加等があり、飲食は確実に良い方向に向いている。しかし、物販がいまいち停滞している。
,,○,百貨店（売場主任）,お客様の様子,・天候も回復し、前月まで低迷していた消費マインドが一気に盛り上がりを見せている。季節商材、ブライダルの動きが良く、化粧品では高級クリームなどがコンスタントに動いており、客単価アップとなっている。
,,○,スーパー（店長）,来客数の動き,・３か月前と比べ、来客数に加え、買上点数と客単価も良くなっている。
,,○,コンビニ（経営者）,販売量の動き,・工事関係者の来店減少に伴い、来客数が99％と前年割れしている。しかし、客単価は堅調に推移し、買上点数も伸びているため、総体的には売上の前年割れは回避できている。
,,○,コンビニ（エリア担当）,来客数の動き,・来客数が前年を越える店舗が増えている。
,,○,コンビニ（エリア担当）,それ以外,・前年度に出店した競争店の影響も一巡し、前年比が良くなっている。
,,○,コンビニ（エリア担当）,お客様の様子,・６月実績については前年クリアこそできてはいないが、日別でみると肉薄している数字が出ている。
,,○,コンビニ（店長）,来客数の動き,・３か月前に比べて来客数が増え、売上も増加している。またボーナス月でもあるので単価も上がっている。
,,○,衣料品専門店（経営者）,単価の動き,・今年はサマーセールを他店より早く開催したため、セール期間中の客単価が上昇し、売上も前年を上回っている。
,,○,衣料品専門店（経営者）,来客数の動き,・好天が続き、寒かった時期に比べて来客数もある。滞在時間も平均して少し増えている。欲しい物をじっくりと検討して買いたい気持ちがあるようである。
,,○,家電量販店（店長）,単価の動き,・来客数は８割だが、季節商材を中心に売れている。
,,○,家電量販店（店長）,来客数の動き,・来客数が前年比で105％ほどになっている。単価はあまり変わらないので、その分が売上のアップにつながっている。
,,○,家電量販店（店長）,単価の動き,・苦戦していたテレビが大分持ち直してきており、テレビの売上が前年と同数くらいまで伸びてきている。４Ｋテレビなどの新製品により、需要が少しまた伸びてきているようである。その他のエアコンや冷蔵庫などの白物家電も好調に推移している。
,,○,乗用車販売店（経営者）,販売量の動き,・新型軽自動車効果で新車受注が増加し、来場数も増えてきている。
,,○,乗用車販売店（従業員）,販売量の動き,・新型車の効果があり、販売量が少し伸びている。
,,○,自動車備品販売店（経営者）,お客様の様子,・建設業系重機の高額修理見積がすんなり通るようになっている。
,,○,住関連専門店（経営者）,販売量の動き,・広告に多少反応しているようで、前年実績を若干上回っている。新築住宅の増加など、消費税増税前の駆け込み需要が影響しているようである。
,,○,住関連専門店（経営者）,単価の動き,・高額商品が多少多めに販売でき、小物だけの前月とは売上の差が結構大きく開いている。
,,○,その他専門店［酒］（経営者）,お客様の様子,・暑い日が続いているため、例年よりも飲食店を訪れる人の動きが早くなっている。株価や経済の不安定な動きには敏感で、決して楽観的ではないが、今まで我慢を強いられていた分、雰囲気におされているようである。
,,○,高級レストラン（経営者）,お客様の様子,・客の様子を見ても明るさが出てきている。また、販売量も上がってきている。
,,○,一般レストラン（経営者）,来客数の動き,・最近、特に女性を中心にランチタイムの客が戻ってきているような雰囲気がある。何となくこれまで我慢していたものが、少し解放されてきたような気配がある。
,,○,観光型ホテル（経営者）,来客数の動き,・今月は昔から旅行シーズンの季節でもあり、団体の観光客も増え、震災前の７割程度に復活している。内容は公的な助成のある消防団などが目立つ。なお、デスティネーションキャンペーンの恩恵は地域としてあまりない。
,,○,都市型ホテル（スタッフ）,お客様の様子,・３～５月は異常に寒く、春物も売れず非常に大変であった。しかし、ここにきて暖かくなり、人が買物に出るようになっているし、ホテルにも客が来るようになっている。
,,○,都市型ホテル（スタッフ）,単価の動き,・レストラン関係及びデパート地下のデリカ各店については、利用人員が若干減少して消費単価が上がるという流れができつつある。価格の下落に下げ止まり感が出てきているので、良い傾向とみるべきだろう。
,,○,旅行代理店（店長）,お客様の様子,・長年の赤字企業が黒字転換を成し遂げたり、過去最高益を出している企業が目に付く。
