Ⅰ．景気の現状に対する判断理由等,,,,,,,
,,▲,旅行代理店（経営者）,販売量の動き,・10～11月のハイシーズンの動きは例年並みだが、12月以降、年末年始の動きが非常に悪い。,,
,,▲,旅行代理店（経営者）,それ以外,・ターミナル駅前の飲食店、百貨店やタクシー等を毎日利用しているが、従業員や経営者の話では、客単価が徐々に落ちており、あきらめに近い声しかない。以前のようなバブル期が異常であり、これが普通という声も聞く。,,
,,▲,旅行代理店（従業員）,来客数の動き,・台風や天候不順の影響で来客数が減少している。不調の原因は天候ばかりではなく、台風等の災害や農作物の不作が家計に影響し、レジャーを控えるという悪循環を招いている。,,
,,▲,テーマパーク（職員）,お客様の様子,・円高でインバウンドが減っている。日本人客も、台風や雨天等の影響で外出を控える状況である。,,
,,▲,観光名所（案内係）,お客様の様子,・観光客の使う金が、段々と減ってきている。,,
,,▲,パチンコ店（経営者）,販売量の動き,・来客数の動きがやや悪くなっている。,,
,,▲,理美容室（経営者）,来客数の動き,・まだまだ暑く、忙しくなっても良いはずだが、客が来ない。,,
,,▲,美容室（経営者）,お客様の様子,・客の様子からも当地の景気は良くない。,,
,,▲,設計事務所（職員）,お客様の様子,・客からは景気の良い話は聞かない。,,
,,▲,住宅販売会社（経営者）,お客様の様子,・広告を出しても客が来ない時もある。,,
,,▲,住宅販売会社（従業員）,販売量の動き,・新規の来場者は、なぜか家を建てたばかりの人で、レジャー先として住宅展示場に来る人が多い。今の来場者は今後３か月の契約にも影響するが、特に12月は冬枯れをするので、10～11月にばん回が必要となり心配である。,,
,,▲,その他住宅［住宅管理］（経営者）,お客様の様子,・高級マンションのリフォームを行った際、前にリフォームした部屋にまだ入居がない。オーナーの話では、家賃の高い物件は、すぐには入居が決まらないようである。,,
,,×,商店街（代表者）,販売量の動き,・誰もが売上が悪いと言っている。,,
,,×,商店街（代表者）,単価の動き,・廉価な商品しか売れず、高級品は見向きもされない。付加価値が高い商品でも、とにかく安さを求める客が多い。,,
,,×,一般小売店［酒類］（経営者）,販売量の動き,・飲食店に来る客は増えない。有料のドリンク類を控える傾向が一層進んでおり、客単価が上がらない飲食店泣かせの状態である。,,
,,×,乗用車販売店（経営者）,販売量の動き,・今月は新型車種が出たが、客の動きは悪い。全体的に来客数が少ない。,,
,,×,乗用車販売店（従業員）,販売量の動き,・今月は、全く売上がなく、問い合わせも来客数も少なく非常に悪い。例年９月はそれほど売上が悪い月ではないが、客足が鈍ったため落ち込んでいる。,,
,,×,一般レストラン（経営者）,来客数の動き,・長期デフレが続き、給与も上昇せず、今の金銭感覚が日常化している。将来への不安要素も、消費マインドが改善する足を引っ張っている。,,
,,×,美容室（経営者）,お客様の様子,・９月は長雨で客足が鈍ってしまい、暇である。,,
,,×,理容室（経営者）,お客様の様子,・周りからは、景気の良い話は出ない。相変わらず、客足は安い店に流れる。,,
"企業
動向
関連

(東海)",,◎,－,－,－,,
,,○,化学工業（営業）,受注量や販売量の動き,・スマートフォン関連の半導体メーカーに出荷している容器製品の販売が好調である。,,
,,○,輸送用機械器具製造業（品質管理担当）,取引先の様子,・製品の生産量が、わずかではあるが増加している。,,
,,○,輸送業（エリア担当）,受注量や販売量の動き,・貨物の動きが前年同期比で3.8％増加しているが、前月の稼働日数のずれが入った分、良くなっている。,,
,,○,金融業（従業員）,取引先の様子,・東京オリンピック開催等の影響もあり、住宅や重機等を扱う企業は、以前よりも若干上向きであるという話をよく聞く。,,
,,□,食料品製造業（経営企画担当）,受注量や販売量の動き,・９月までの売上は順調に伸びているものの、売れ筋商品の変化で、利益率が高い商品の販売量が低下しており、利益は計画どおりに確保できていない。,,
,,□,化学工業（総務秘書）,それ以外,・アベノミクスは一定の効果はあったものの、全国的に実感できる効果は表れていない。円高傾向に戻り、不安感が漂う。大企業や投資家には明らかな恩恵があったようだが、多くの国民は、恩恵をほとんど受けていない。,,
,,□,化学工業（人事担当）,それ以外,・英国のＥＵ離脱問題で株価が一時的に大きく下落したが、しばらく後に回復してからは、特に大きな変動はない。経済状況は、特に良くも悪くもなっていない。,,
,,□,鉄鋼業（経営者）,受注量や販売量の動き,・例年ならば、秋口は前月比10％以上受注量が伸びるが、今年は全く変化がなく、中小製造業の仕事量は増えていない。先行きにも明るい材料がみえず、期待感より閉塞感の方が強い。,,
,,□,金属製品製造業（従業員）,受注量や販売量の動き,・物件の動きがあまり良くないなかで、短い納期や低価格での要請等、条件の厳しい仕事が多い。,,
,,□,電気機械器具製造業（企画担当）,受注量や販売量の動き,・全体としては売上減少につながる要因は見当たらないが、欧州情勢や米国の大統領選挙等、不確定要素が多い。また、円高が進むと業績に影響を及ぼす可能性が高いので気が抜けない。,,
,,□,電気機械器具製造業（経営者）,受注価格や販売価格の動き,・国内需要の製品については、価格交渉では引き続き厳しい状況が続いている。,,
,,□,電気機械器具製造業（総務担当）,受注価格や販売価格の動き,・放送・通信機器、ケーブルテレビやシステム構築等、案件の受注は好調だが、相変わらず販売価格は抑えられ、適正な利益が得られない。,,
,,□,輸送用機械器具製造業（研修担当）,取引先の様子,・製品加工量は、前年同月比で変わらない。,,
,,□,輸送用機械器具製造業（総務経理担当）,受注量や販売量の動き,・売上は、前年同月比で変わっていない。ここしばらくは同じようなペースで進んでいる。,,
,,□,輸送用機械器具製造業（経理担当）,受注量や販売量の動き,・円高の影響を社内の改善活動でカバーすることで、当初計画の利益水準を何とか保っている。,,
,,□,輸送用機械器具製造業（デザイン担当）,取引先の様子,・受注量等は変わっていない。,,
,,□,建設業（経営者）,受注量や販売量の動き,・マンション・戸建住宅共に、まずまずの売行きに戻っている。,,
,,□,輸送業（経営者）,受注量や販売量の動き,・消費財の荷動きが前年同期比で５％ほど悪く、輸送単価も下落しているが、前月の荷量が多かったことを考えると、大きな変化はない。,,
,,□,輸送業（従業員）,受注量や販売量の動き,・９月初めは天候が不順で荷動きは低調であったが、後半は活発である。業界では依然として運転手の採用難が続いており、採用できる会社とできない会社では、大きく経営状態が変わり、体力のない会社では存続が難しくなるところも出てくる。,,
,,□,輸送業（エリア担当）,受注量や販売量の動き,・円高で輸出量は伸び悩んでいる。,,
,,□,輸送業（エリア担当）,受注量や販売量の動き,・１日当たりの荷物の取扱量は、景気が上向けば増加し下降すれば減少するバロメーターとなるが、３か月前と比べて変化がないため、景気は横ばいである。,,
,,□,通信会社（法人営業担当）,取引先の様子,・次年度予算の立案と、今年度下期予算の消化計画もまとまり、行政の業務は落ち着いてきているが、景気の影響を受けているような動きは感じられない。,,
,,□,通信会社（法人営業担当）,それ以外,・円高も気になるが、日銀の一層の金融施策にもかかわらず、物価上昇は見込み薄である。有効求人倍率や完全失業率等、景気回復を示す指標があるにもかかわらず、景気回復というムードはない。,,
,,□,金融業（企画担当）,取引先の様子,・金利低下で住宅ローンの新規借入も相応にあり、不動産には動きがある。借換えも多く、ローン負担が減って家計にはプラスとなり、消費も堅調である。一方、個人投資家は、株価が横ばいで為替が円高傾向のため含み損を抱えており、様子見で動けない状況から変わっていない。,,
,,□,金融業（法人営業担当）,取引先の様子,・取引先の自動車部品メーカーの稼働率は前年同期並みである。,,
,,□,不動産業（経営者）,受注価格や販売価格の動き,・ここ数か月、価格面ではあまり変化がない。,,
,,□,不動産業（用地仕入）,受注価格や販売価格の動き,・マンションの販売価格には変化がみられない。,,
,,□,広告代理店（制作担当）,取引先の様子,・ウェブ広告や印刷物等の新規案件が、若干増えてきてはいるが、全体的にはあまり変わっていない。,,
,,□,行政書士,受注量や販売量の動き,・受注件数が変わらない。,,
,,□,公認会計士,それ以外,・客先の業績は、３か月前と大きく変わらない。,,
,,□,会計事務所（職員）,取引先の様子,・９月は各地で天候による災害が懸念され、特に室外作業を主とする業者にとっては大変であった。サービス業でも、来客数が減っている。,,
,,□,会計事務所（社会保険労務士）,取引先の様子,・卸・小売業や飲食店は厳しい状況にある。一部の建設業と製造業は好調で、全体としては変わらない。,,
,,□,その他サービス業［ソフト開発］（社員）,取引先の様子,・客先の事情もあり、案件の状況が見通しづらくなっている。,,
,,□,その他非製造業［ソフト開発］（経営者）,競争相手の様子,・競合企業の仕事は、まずまずの状況である。現在の為替や原油価格の水準であれば、我が国の経済は十分に耐えられるが、一層の円高は、経済界も警戒している。,,
,,▲,食料品製造業（営業担当）,取引先の様子,・客先の娯楽業や飲食業では、集客力が落ちて閉店となるケースが増えている。客単価の低迷が続いており、経営が困難との話も多く耳にする。,,
,,▲,窯業・土石製品製造業（社員）,受注量や販売量の動き,・１品種で売上の１/４を占める主力製品が、より小型で安価な製品でも代用可能となり、売上が10％以上落ち込んでいる。,,
,,▲,一般機械器具製造業（営業担当）,受注量や販売量の動き,・引き合い件数はあまり多くなく、北米の自動車向け設備投資の計画も延期や中止となっている。,,
,,▲,電気機械器具製造業（営業担当）,受注価格や販売価格の動き,・円高傾向で、受注は若干縮小している。,,
,,×,出版・印刷・同関連産業（代表）,受注量や販売量の動き,・受注量や販売量が減少している。更に料金の値引き要求が増えている。,,
,,×,金属製品製造業（経営者）,受注量や販売量の動き,・販売数量が前月より減少している。製品価格も低下傾向にある。,,
,,×,電気機械器具製造業（経営者）,受注量や販売量の動き,・客先業界への当局の規制により、客先では設備投資ができない状況となっており、当社の業界も苦しい状態である。,,
"雇用
関連

(東海)",,◎,－,－,－,,
,,○,人材派遣会社（社員）,求人数の動き,・ターミナル駅前の新築ビル群の開業に伴って、求人数の増加が見込める。,,
,,○,人材派遣会社（支店長）,求人数の動き,・求人数は前年同期比で15％以上増加している。求人数も増加傾向が続いており、引き続き右肩上がりの状況が見込まれる。,,
,,○,人材派遣会社（営業担当）,求職者数の動き,・下期に向けて企業の採用意欲が高まってきている。転職希望者も少しずつ増えている。,,
,,○,アウトソーシング企業（エリア担当）,採用者数の動き,・自動車業界においては、下期に向けて体制を整えるため採用者数の増加がみられる。,,
,,○,職業安定所（職員）,雇用形態の様子,・製造業やサービス業で、正社員での求人募集が増加している。,,
,,□,人材派遣会社（営業担当）,それ以外,・株価が横ばいで推移している。,,
,,□,新聞社［求人広告］（営業担当）,求人数の動き,・大型イベントを実施したが、全体の求人市場には変化はみられない。,,
,,□,職業安定所（所長）,求人数の動き,・全体としての求人数はほぼ横ばいであるが、募集先をみると人手不足業界からの求人は増え、逆に製造業の求人は減っており、二極化する状況が続いている。,,
,,□,職業安定所（職員）,求職者数の動き,・求人や求職の状況は、大きな変化はみられない。事業主都合による離職者は減少が続いており、リストラや倒産の減少が主な要因と考えられる。,,
,,□,民間職業紹介機関（営業担当）,求職者数の動き,・転職希望者の動向は、ここ数か月大きな増減はないが、今春卒業した新入社員の転職希望者が増えている。,,
,,□,民間職業紹介機関（窓口担当）,求職者数の動き,・求人数は多いが、条件限定での求職者が多くマッチングが難しい状態が続いている。,,
,,▲,人材派遣会社（社員）,求人数の動き,・中旬まではイベントがあり好調だったが、終了後のスタッフ派遣数は、３か月前、前年同月と比べても減少している。台風接近による予約のキャンセルも影響している。,,
,,▲,人材派遣会社（社員）,求職者数の動き,・正社員採用での求人は増加しているが、条件にマッチする人材が不足している。,,
,,▲,人材派遣会社（営業担当）,周辺企業の様子,・各社とも予算執行があまり進んでいない。具体的な理由はわからないが、大手製造業では10月以降の予算縮小の動きが出ている。各社とも着手したいテーマは多々あるが、優先事案にしか予算がつかない。営業職としてみた景況感は、やや悪くなっている。,,
,,▲,新聞社［求人広告］（営業担当）,周辺企業の様子,・９月は、天候と同様にはっきりしない状況が続いている。大型連休でも、人の動きがあったとは実感できない。,,
,,×,－,－,－,,
,,,,,,,
　６．北陸（地域別調査機関：一般財団法人北陸経済研究所）,,,,,,,
,,,,,（－：回答が存在しない、＊：主だった回答等が存在しない）,,
分野,,景気の現状判断,業種・職種,判断の理由,追加説明及び具体的状況の説明,,
"家計
動向
関連

(北陸)",,◎,通信会社（営業担当）,販売量の動き,・新商品発売に伴って販売数が大幅に増加した。また、同時購入やプラス提案のチャンスが増えたことにより全体的な販売増につながった。,,
,,○,コンビニ（経営者）,販売量の動き,・競合店が８月末に閉店した影響はあるが、来客数は増えている。また、品数を豊富にしたことで客単価が若干上がっており、両方の理由で売上は上がっている。,,
,,○,家電量販店（店長）,販売量の動き,・４Ｋテレビの認知度がオリンピック以降に高くなり、テレビの販売単価は上がってきている。また、寒冷地向けエアコンによって冬にエアコン暖房を使う傾向が強くなり、エアコンの販売台数、単価が上がっている。,,
,,○,その他小売［ショッピングセンター］（統括）,来客数の動き,・前年の近隣競合店のオープンから１年が経過し、その反動によって来客数が前年と比較して増えている。気温低下の遅れから客単価は伸び悩むが、来客数の増加により売上は前年と比較して増加した。また、来客数の増加要因としてはシネマの好調があげられる。,,
,,○,通信会社（店舗統括）,販売量の動き,・新製品の販売量が前年以下と予想していたが、思ったより好調である。,,
,,□,商店街（代表者）,それ以外,・来客数が増えてきているが、客単価は低くなっており売上増加に結び付かない。商店街にはブティックが比較的多いが、差別化できる商品には需要がみられず、東南アジア製の安い商品への需要が伸びている。,,
,,□,商店街（代表者）,お客様の様子,・寒暖差が少し出てきたため秋物への関心がみられるが、例年の動きとあまり変化はない。,,
,,□,一般小売店［事務用品］（店員）,販売量の動き,・今月は売上、利益ともに計画未達であり、継続的なキャンペーンには大きな効果がみられなかった。,,
,,□,一般小売店［鮮魚］（役員）,販売量の動き,・北陸新幹線開業から１年が経過した今年の春先は、さすがに１年たつとこんなものかと、やや観光客数は落ち着いていたが、８～９月は少し戻ってきた。しかし、やはり消費金額は減っている。また、相次ぐ台風や時化のため魚の単価が高騰して粗利には悪影響となった。,,
,,□,スーパー（店長）,販売量の動き,・台風の影響により野菜の高騰が続いている。客の購買行動がよりシビアになっている。,,
,,□,スーパー（総務担当）,販売量の動き,・競争店の改装開店や新店舗を含めて、価格競争が止まらない。しかし、一部相場や気温によって左右された品目があるものの、全体としての販売量は今までの水準を保っている。,,
,,□,スーパー（店舗管理）,来客数の動き,・旧盆セール以降は、来客数が回復しない。,,
,,□,コンビニ（経営者）,販売量の動き,・天候不順の影響が若干みられるが、例年と比べて大きく変わったということはない。良くなってもいないし悪くもなっていないと判断している。,,
,,□,コンビニ（店舗管理）,来客数の動き,・売上で前年割れする店舗が増えている。特にショッピングセンター内の店舗の落ち込みが激しい。,,
,,□,乗用車販売店（経営者）,販売量の動き,・９月に新型車を発売したが、新型車以外の受注が良くない。全体的な販売が増えない状況が続いており、市場状況はまだ良くない。,,
,,□,乗用車販売店（従業員）,販売量の動き,・新型車が発売されたことでかなり期待していたが、なかなか新車販売に結びついていない。,,
,,□,乗用車販売店（役員）,販売量の動き,・９月の中間期に向けて新車販売台数は前年を超えてきている。年末に向けて新型車の取扱が増えるので業績は前年を上回る見込みである。,,
,,□,乗用車販売店（経理担当）,販売量の動き,・９月の販売量は前年同月比105％の見込みである。28年６月の販売量は前年同月比102％であったので、３ケ月前との比較でほぼ横ばいである。,,
,,□,自動車備品販売店（役員）,お客様の様子,・半期決算セールを行っているが、例年以上に価格に敏感である。安くても必要がない商品購入を控えている。車検需要期で数量的には前年を越えているが、付帯メンテナンスを極力避ける傾向であり、出費をできるだけ抑えたいとの声が多い。,,
,,□,その他専門店［酒］（経営者）,販売量の動き,・悪い状態がずっと続いている。良くなる兆しが全く見えない。,,
,,□,その他小売［ショッピングセンター］,販売量の動き,・食料品は何とか前年並みを維持できているが、衣料や住まいの品が悪い。客は必要以上には買わない様子で、価格をよく見て買っている。,,
,,□,観光型旅館（経営者）,来客数の動き,・９月は、前年比で前年の４連休に相当する分だけ落ちている。,,
,,□,観光型旅館（スタッフ）,来客数の動き,・前年比で総売上88％、宿泊人数88％、宿泊単価98％となっている。宿泊人数は新幹線開業２年目の影響による減少に加え、宿泊単価の高い部屋の予約が減少したことでマイナスとなっている。,,
,,□,都市型ホテル（役員）,販売量の動き,・宿泊部門においては、北陸新幹線開業以降は順調に推移してきたが、やや鈍ってきている。宴会部門では、リオデジャネイロオリンピック関係の祝勝会の利用により全体では前年と変わらない。,,
,,□,通信会社（役員）,販売量の動き,・リオデジャネイロオリンピックが終了してテレビ視聴への関心が低下したこともあり、ケーブルテレビ契約の獲得数が鈍化傾向にある。,,
,,□,競輪場（職員）,販売量の動き,・売上が伸びてこない。,,
,,□,その他レジャー施設（総支配人）,来客数の動き,・オリンピック、パラリンピックの影響を少しは期待していたが、刺激をされてスポーツに取り組みたいと思う人達がいないように感じた。,,
,,□,住宅販売会社（従業員）,販売量の動き,・金利の低下や地価の動向など、住宅取得のための環境は今が一番いい時なので客は動いているが、ローコスト住宅の志向が強く高額商品へのニーズは低い。,,
,,□,住宅販売会社（従業員）,お客様の様子,・客の様子から注文住宅や不動産の動きはあまり感じられない。,,
,,▲,商店街（代表者）,お客様の様子,・景気回復と言われるが、全く実感はない。接客していると、むしろ後退感の方が強い。時節柄、秋物が主流となってきているが、割引がないなら買わないと敬遠する客が多くみられる。,,
,,▲,一般小売店［精肉］（店長）,来客数の動き,・新幹線開業効果は前年に比べて薄くなり、徐々に来客数が減ってきている。,,
,,▲,一般小売店［書籍］（従業員）,来客数の動き,・来客数が前年同月比で10％以上のダウンで、客の購買意欲は感じられない。,,
,,▲,百貨店（売場主任）,販売量の動き,・前年９月は、プレミアム付商品券やシルバーウィーク、気温の低下といった特殊要因があり好調に推移した。本年９月は特に好調となる要因もなく、シルバーウィークは飛び石連休に終わり、前年の反動から厳しい状況が続いている。特にファッション関連は、シーズンの先取り層が激減し、秋物の売行きは鈍く苦戦している。,,
,,▲,百貨店（営業担当）,来客数の動き,・前年はプレミアム付商品券で買物する客が多かったため、前年比で売上は大きく落ちている。プレミアム付商品券の影響を差し引いても、今月は天候不順、台風の影響で来客数が少なく、客単価が低い。特にファッション商材の動きが良くない。,,
