Ⅰ．景気の現状に対する判断理由等,,,,,
,,▲,理美容室（経営者）,来客数の動き,・７月は気温が上がり客が増える時期だが、あまり客が来ない。
,,▲,設計事務所（職員）,お客様の様子,・景気の良い話は聞かない。
,,▲,住宅販売会社（従業員）,競争相手の様子,・取引先からは、他社の仕事が減っているとか、支払を先延ばしにする元受事業者が増えているといった話が増えている。
,,▲,その他住宅［住宅管理］（経営者）,お客様の様子,・リフォーム物件では、外装には金をかけるが、内装については、良い材料と低価格のものに二極化が進んでおり、大半は低価格な材料に決まる。
,,×,一般小売店［酒類］（経営者）,来客数の動き,・飲食店への来客数は増えていない。３月にターミナル地区でオープンした店も、既にオープン当初の勢いがなくなってきている。
,,×,スーパー（経営者）,お客様の様子,・飲食店では、今までにないほど悪いと言っている。２けた減のところも複数あると言っていた。
,,×,一般レストラン（経営者）,来客数の動き,・世界の経済情勢や動きがリアルタイムで個人レベルまで伝わり、将来への不安感につながっている。
,,×,美容室（経営者）,それ以外,・これだけ暑い日が続くと、客足が悪くなる。
,,×,理容室（経営者）,お客様の様子,・客は余分な支出はしない。相変わらず安い店に流れている。
,,×,住宅販売会社（経営者）,競争相手の様子,・競争相手の売行きが悪い。消費税増税の再延期の影響が出ている。
"企業
動向
関連

(東海)",,◎,－,－,－
,,○,電気機械器具製造業（経営者）,取引先の様子,・お盆を前に取引先でリニューアルする店舗が多いため、当社製品の生産・出荷が増えている。
,,○,行政書士,受注量や販売量の動き,・お中元向けの出荷量が増えている。
,,○,その他サービス業［ソフト開発］（社員）,受注量や販売量の動き,・前年に成功した実績の効果で、他社から追随する形で案件の問い合わせが増えてきている。
,,□,食料品製造業（営業担当）,取引先の様子,・取引先の様子では、受注量、販売量共に例年に比べれば減少しているが、過去３か月との比較では変動はない。
,,□,食料品製造業（経営企画担当）,受注量や販売量の動き,・夏物商材全体で動きは活発になりつつあるが、ギフト商品の動きが良くない。選挙の年は贈答品の需要が下がるといわれるが、実際に多少影響がある。
,,□,化学工業（総務秘書）,それ以外,・世界ではテロや紛争、経済格差、環境破壊で、暗い様相であるが、そのなかで円高が進むのは、日本が比較的安定した政治経済を維持しているからである。景気の大きな動きも実感はない。英国のＥＵ離脱問題や米国大統領選挙の候補者のＴＰＰ反対等は、将来への影響が不安である。
,,□,窯業・土石製品製造業（社員）,受注量や販売量の動き,・今年から納入し始めた新分野の製品の伸びが著しく、生産能力が目一杯となっている。
,,□,鉄鋼業（経営者）,受注量や販売量の動き,・全体的に数字は下降が続いており、受注量は前年比10％ほどのマイナスになっている。
,,□,一般機械器具製造業（営業担当）,受注量や販売量の動き,・引き合いや受注件数は減っていないが、試作品の製作等プラスアルファを求められることが増えている。
,,□,電気機械器具製造業（企画担当）,受注量や販売量の動き,・海外販売の売上は、地域差があるものの現地通貨ベースでは総じて堅調である。しかし、円高が続いているため、円ベースでは伸び悩んでいる。
,,□,電気機械器具製造業（経営者）,受注価格や販売価格の動き,・ここ数か月、生産量、売上共に変わっていないが、取引の度に価格交渉等が行われ価格的には非常に厳しい。仕事がないわけではないため、良いとも悪いともいえない状況である。
,,□,輸送用機械器具製造業（品質管理担当）,取引先の様子,・客先の生産計画が横ばいとなっている。
,,□,輸送用機械器具製造業（研修担当）,それ以外,・ボーナス額は前年より減少している。今期の業績見通しも厳しいものとなっている。
,,□,輸送用機械器具製造業（総務経理担当）,受注量や販売量の動き,・１日当たりの生産量は、３か月前と比べて変わらない。スクラップの値段は、４月の高値から数円下がってきている。
,,□,建設業（経営者）,受注量や販売量の動き,・マンション、戸建住宅共にまずまずの売行きである。しかし、モデルルームへの来場数は横ばいで、今後の景気動向によっては悪化する懸念が、払しょくできない。
,,□,輸送業（エリア担当）,受注量や販売量の動き,・為替の変動で、輸出入の動向がつかみにくい。
,,□,輸送業（エリア担当）,それ以外,・参議院選挙で与党が勝利したが、これからどういう政策を行っていくのか、経済をどうてこ入れするかが見えてこないので、世の中も今のところ様子見で、景気への影響は何も生じていない。
,,□,通信会社（法人営業担当）,受注量や販売量の動き,・受注、販売量の前提となる新規案件の提案依頼がほとんどない。通信サービスに関しては、通信費用削減の提案ばかりが求められ、新たな価値を生み出すためのサービス提案には、なかなか興味を示してもらえない。
,,□,金融業（従業員）,取引先の様子,・自動車産業や中小企業においては、例年に比べて生産量、発注量等の動きが良くない。一時的には良い動きの部署もあるので、良いとも悪いともいえない。
,,□,金融業（法人営業担当）,取引先の様子,・取引先の自動車部品メーカーの生産量は、前年をやや上回っており、比較的堅調である。
,,□,金融業（企画担当）,取引先の様子,・円高の進展や軟調な株式相場の動きから、投資意欲が減退し様子見の個人投資家が多い。購買意欲も大きくない。
,,□,不動産業（用地仕入）,受注価格や販売価格の動き,・マンションの販売価格に特段の変化なく、競合他社でも、販売価格には大きな変化はみられない。
,,□,企業広告制作業（経営者）,それ以外,・参議院選挙の結果は、投票先ではなく政策としては、国民が望んだものとかい離している。アベノミクスの効果が期待できないと市場が判断した時には、消費税増税の再延期に伴う財政赤字は、景気を必ず後退させる。
,,□,広告代理店（制作担当）,取引先の様子,・前年同期は多少増えていたウェブ媒体の広告受注量が、今年になって逆に減少してきている。
,,□,公認会計士,それ以外,・客先の中小企業の業績は、好調とはいえない状況から変わらない。材料費や人件費の高騰によるコストの増加が、業績に影響を与えている。
,,□,会計事務所（職員）,取引先の様子,・賃金アップを望む声が大きいが、民間では横ばいか微増に留まっている。家計では、負担増加が大きい一方で収入の増加が伴わない状況である。
,,□,会計事務所（社会保険労務士）,取引先の様子,・客には目立った動きがない。設備投資も車両の買換えくらいで、先行投資というほどのものではない。
,,▲,パルプ・紙・紙加工品製造業（総務担当）,受注量や販売量の動き,・特にどの産業とは特定できないが、全体的にみて、受注量、販売量共に、前年同月比で５～８％ほど減少している。
,,▲,化学工業（営業）,受注価格や販売価格の動き,・数か月前までは原料価格が下がり、収益は上がっていたが、客との値下げ交渉がほぼ決着し、製品単価及び収益は２～３か月前と比べて若干ダウンしている。
,,▲,化学工業（人事担当）,それ以外,・７月に参加した海外ツアーは、多い時は参加者が25名にもなる人気ツアーだが、今回は９名であった。テロの影響なのか、観光地ではあまり日本人は多くなかった。他方面のツアーでは参加者が増えているのかもしれないが、海外旅行業界にとっては、あまり景気は良くないと思われる。
,,▲,金属製品製造業（従業員）,受注量や販売量の動き,・足元の仕事の引き合いが少ない。あっても低価格、短納期という傾向が強まっている。
,,▲,電気機械器具製造業（営業担当）,受注価格や販売価格の動き,・円高の影響が出ている。
,,▲,輸送業（経営者）,受注量や販売量の動き,・輸出入の貨物量がいずれも７％程度減少している。国内消費財の動きも、緩慢になってきている。
,,▲,輸送業（従業員）,受注量や販売量の動き,・国内の小口雑貨の輸送物量が前年同月比で落ち込んでいる。小口貨物では、一部の業者でダンピングが発生している。輸出関連も円高で落ち込んでいる。
,,▲,輸送業（エリア担当）,受注量や販売量の動き,・貨物の動きが前年同期比で4.9％も低下している。
,,▲,輸送業（エリア担当）,受注価格や販売価格の動き,・荷物の量は増えているが、単価が下がり収支は悪化している。人員体制を増強したくても、人の集まりが悪い。
,,×,出版・印刷・同関連産業（代表）,受注価格や販売価格の動き,・広告出稿量、一段当たりの単価共に、非常にシビアになってきている。
,,×,金属製品製造業（経営者）,受注量や販売量の動き,・受注量が減少している。
"雇用
関連

(東海)",,◎,人材派遣会社（支店長）,求人数の動き,・求人数は、３か月前比で120％、前年比でも108％と堅調に推移している。常用稼働者の年間ベースの動きでも、右肩上がりの推移が10か月間続いている。
,,○,人材派遣会社（社員）,求人数の動き,・法人関係の利用が多く、前月からオープンしたビヤガーデンも、天候に恵まれ好調である。
,,□,人材派遣会社（営業担当）,それ以外,・株価が１万６千円台で安定して推移している。
,,□,アウトソーシング企業（エリア担当）,採用者数の動き,・自動車メーカーでは、随時人材を募集して生産体制を維持している。
,,□,職業安定所（所長）,周辺企業の様子,・企業から業績が上向きという声は聞かないが、人手は不足している。しかし、賃金を引上げてでも人員を確保しようとする動きはみられない。
,,□,職業安定所（職員）,求人数の動き,・新規求人数も有効求人数も、ほぼ横ばいで推移しており、あまり大きな変化はみられない。
,,□,職業安定所（職員）,求人数の動き,・新規求人は前年同月比では増加しているが勢いがなくなっている。正社員での求人は15％以上増加しており、改善がみられる。
,,□,民間職業紹介機関（営業担当）,求人数の動き,・ここ３か月の動きと比較すると、求人数の減少が目につくが、景気動向や為替の影響かはわからない。
,,□,民間職業紹介機関（窓口担当）,求職者数の動き,・正規雇用での就業希望者が相変わらず多い。年齢が高めの人材も採用される傾向にある。
,,□,民間職業紹介機関（支社長）,求人数の動き,・求人数にあまり変化はなく、採用意欲も高い。
,,□,その他雇用［広告代理店］（求人広告担当）,周辺企業の様子,・ここ半年ほどの間、状況には変化がない。
,,▲,人材派遣会社（経営企画）,周辺企業の様子,・円高の影響により予算を縮小する客がある。
,,▲,人材派遣会社（社員）,求職者数の動き,・求人案件に対して要件に該当する求職者が見当たらず、マッチングから紹介の成約に至らないケースが増加している。
,,▲,人材派遣会社（営業担当）,周辺企業の様子,・最近の円高の影響なのか、大手製造業で仕掛かり中の長期案件が、10月以降は１年間の延期となった。他の大手製造業でも着手予定の案件の予算化が進まないという情報もあり、周辺企業の動きから景況感には陰りを感じている。
,,▲,新聞社［求人広告］（営業担当）,周辺企業の様子,・各企業とも、非正規を含む人材の不足感は依然として強く、募集件数は多いが、欲しい人材を採用できない状況に陥っている。粘り強く募集をかけるが、そろそろ限界というところも出てきている。現状維持に精力を注ぐ傾向になり、発展・拡大は考えにくくなる。
,,▲,新聞社［求人広告］（営業担当）,周辺企業の様子,・製造業では、英国のＥＵ離脱問題や円高により、不透明感が表れている。
,,▲,職業安定所（職員）,求人数の動き,・新規求人数は、前年比1.3％の減少、前年同月比で5.6％減少となっている。このところ増加傾向にあったが、全ての産業において微減に変わってきている。
,,▲,職業安定所（職員）,求人数の動き,・求人の動きが少ない。
,,×,－,－,－
,,,,,
　６．北陸（地域別調査機関：一般財団法人北陸経済研究所）,,,,,
,,,,,（－：回答が存在しない、＊：主だった回答等が存在しない）
分野,,景気の現状判断,業種・職種,判断の理由,追加説明及び具体的状況の説明
"家計
動向
関連

(北陸)",,◎,通信会社（役員）,販売量の動き,・７月に入り新規申込の問い合わせが増え、また既存加入者からもインターネットサービス、テレビサービス増設の申込が増えている。
,,○,乗用車販売店（役員）,販売量の動き,・熊本地震の影響による配車遅れのため、販売できなかった受注分がようやく処理できている。県内の登録車市場も前年分を確保しているので悪い状況ではない。
,,○,乗用車販売店（経理担当）,販売量の動き,・７月の販売量は前年同月比で135％の見込みである。４月の販売量は前年同月比で118％であったので、３か月前と比較して上向きである。
,,○,美容室（経営者）,来客数の動き,・今年の３月ごろまでは来客数が前年割れをすることが当たり前のようだったが、ここ数か月は前年を上回ることが多くなった。
,,○,住宅販売会社（従業員）,お客様の様子,・今年の路線価が発表されて前年より上がっている場所が少なくないため、活気が戻ったようである。
,,□,商店街（代表者）,競争相手の様子,・商店街はセール期間中も例年と変わらないようだが、買物をする客ではなく街を楽しみに来ている様子である。比較購買できて、駐車場のあるショッピングモールで買物しているようである。
,,□,商店街（代表者）,来客数の動き,・セール中であるが、来客数はあまり変化がない。晩夏ものが順調に動き始めている。
,,□,商店街（代表者）,販売量の動き,・７月に入って夏物の衣料品の買い控えに回復傾向がみられたが、月末頃には真夏日が続かず夏物商材の売上が伸び悩んだ。夏休みや地元のイベントが予定されることから、相乗効果を期待したい。
,,□,一般小売店［事務用品］（店員）,販売量の動き,・定番商品の売上は微増だが、そのほかの商品についてはあまり動きがなかった。
,,□,一般小売店［鮮魚］（役員）,販売量の動き,・今年の４月以降は全く変化がない。悪くはないが良くもない。
,,□,百貨店（営業担当）,お客様の様子,・夏のバーゲンは例年より早めのスタートで、猛暑でもあったため客の動きは非常に良かった。ただし、前年より土日が１日ずつ多い月にもかかわらず前年を少し上回る程度で、高額品については動きがなく、全体的には今一つの状態である。
,,□,スーパー（店長）,単価の動き,・今年は梅雨の影響が長引いており、暑さが厳しい状況が続いている。買物量をみてもあまり増えていないのが実情である。
,,□,スーパー（総務担当）,販売量の動き,・７月は前年より暑い日が多く夏物の飲料や酒などの売行きが好調であった。しかし、全体としては前年並みで推移している。参議院選は盛り上がりに欠けプラス要因はなかった。
,,□,コンビニ（経営者）,販売量の動き,・来客数は３ポイントほど減少している。その分、客単価が微増しており、かろうじて前年並みの売上高を維持している。
,,□,コンビニ（経営者）,販売量の動き,・７月に限っていえば、毎週あった消防操法の大会が施設の移転によって無くなったことで売上ダウンは必至だ。そのほかの部分では大きな変化はみられない。
,,□,乗用車販売店（経営者）,お客様の様子,・ボーナス月ではあるが、客との商談期間が長くなっており、まだ自動車の購入に対して慎重な様子がみられる。
,,□,乗用車販売店（従業員）,来客数の動き,・来客数が少ないためか、販売、修理などが売上に結びついていない。
,,□,自動車備品販売店（役員）,来客数の動き,・ボーナス商戦は例年の盛り上がりに欠けていた。しかし、高額商品、スタッドレスタイヤなどのポイント増額イベントには反応は良く、メリットを感じれば購入につながると感じる。裏を返せば価格に敏感である。
,,□,住関連専門店（役員）,販売量の動き,・年度が変わって３か月が経過し、浮き沈みはあるものの著しい上向きの傾向はみられない。
,,□,高級レストラン（スタッフ）,販売量の動き,・今年の７月は週末が５回あって飲食業としては稼ぎ時が多いが、前年並みの実績なので厳しい状況は変わらない。
,,□,観光型旅館（経営者）,来客数の動き,・ゴールデンウィーク以降の入込客数が、若干ではあるが前年比で減少してきている。
,,□,都市型ホテル（役員）,販売量の動き,・宿泊、レストラン、宴会部門のいずれも前年と同じ申込状況であるため、景気動向は変わらないと考える。
,,□,タクシー運転手,来客数の動き,・観光客は、夏に入って少しずつ増えている。週末は人出があるが、平日があまり良くないことから、全体的に変わらない。
,,□,タクシー運転手,販売量の動き,・今月は大きなイベントが一つあったことから、それが売上に寄与した。
,,□,通信会社（役員）,販売量の動き,・海外などの定額制動画配信サービスの多様化と普及に伴い、高速インターネットサービスに対するニーズは高く、光通信サービスの新規獲得数は高水準で推移している。
,,□,通信会社（営業担当）,販売量の動き,・本来であれば、ボーナス商戦や新商品などの発売によって販売数が伸びる時期だが、家族連れの客が少ない上に複数台の購入もあまりなく、販売数は伸び悩んだ。
,,□,通信会社（店舗統括）,来客数の動き,・新規契約客が減少しても機種変更の客は増加しているため、来客数は持ち直してきている。
,,□,住宅販売会社（従業員）,販売量の動き,・住宅ローンの金利など、住宅取得に関する諸条件は最良の状況にあるが、受注数が安定しない。
,,▲,商店街（代表者）,来客数の動き,・食料品や飲食関係の売場、店舗はまだ客がいるが、バーゲンだというのに衣料品売場は閑散とした状態である。単価が大きいため売上減に直結している。
,,▲,一般小売店［精肉］（店長）,販売量の動き,・６月と違い７月は、選挙の影響もあってかギフトがあまり出なかった。選挙が終わってからもギフトが少なく、そのままである。
,,▲,一般小売店［書籍］（従業員）,来客数の動き,・売上は微増だが、来客数は大幅に減少している。
,,▲,百貨店（売場主任）,販売量の動き,・月を通して土日が多い曜日配列にもかかわらず、前年の売上実績を下回る見込みである。中旬以降は前年の売上実績を超える日が続き、日々ばん回をしているが、月の前半のマイナスをカバーできていない状況である。依然として、購買行動が慎重な客が多く、衝動買いやまとめ買い需要は減っている。顧客の囲い込みを図るため、カード会員向けの優待会の日数を拡大して来店を促しているが、客の反応は鈍い。
,,▲,百貨店（営業担当）,来客数の動き,・今月も例年と比べて来客数が少ない。セールだからといってすぐには決めずに、吟味して購入する客が多い。
,,▲,スーパー（総務担当）,来客数の動き,・食品スーパーの来客数が徐々に前年を下回るようになってきている。市内と郊外の店舗がほぼ同じ現象であるため消費を抑制しているようにみえる。
,,▲,コンビニ（店舗管理）,販売量の動き,・前年同月はプレミアム付商品券の効果が絶大であったため、前年比で売上は大幅ダウンした。特に土日祝においては、人手不足によるチャンスロスの傾向がある。
,,▲,衣料品専門店（経営者）,販売量の動き,・７月10日ごろまでとそれ以後では、原因不明の断点があるようだ。選挙、冷夏、円、株の影響ではない。短期間のものなのか、ずっと続くものなのか注意してみたい。７月10日ごろまでは割と良かったが、10日ごろからものすごく悪くなった。
,,▲,衣料品専門店（経営者）,それ以外,・次々と起こる社会変化に対応するため、節約するという図式が今の状況をあらわしている。
,,▲,衣料品専門店（経営者）,お客様の様子,・全国ほとんどの百貨店、スーパーが衣料品の売上不振を言っているが、地方の専門店の実態はもっと悪い。
,,▲,家電量販店（店長）,単価の動き,・７月前半は真夏日も多く、夏物商材が爆発的に売れた。しかし、中盤は真夏日が少なく夏物商材の不振により、全体では厳しくなっている。
,,▲,その他小売［ショッピングセンター］,来客数の動き,・衣料品は盛夏物中心に良くなってきたが、今年に入って来客数の前年割れが続いている状況は変わらない。特に食料品の売上減が大きい。十分に吟味した上で必要以上には買わない傾向が続いている。
,,▲,その他小売［ショッピングセンター］（統括）,来客数の動き,・客単価をみると、客の購買意欲自体は大きく変わっていないが、周辺競合環境の影響による来客数の減少がみられる。競合店オープンから１年経過したが、完全に来客数が戻りきっていない。特に衣料品、食料品、飲食業種については苦戦が続いている。
,,▲,一般レストラン（統括）,来客数の動き,・客単価が高くなるほど客数が前年割れをする傾向がみられる。前年同時期は北陸新幹線開業効果により、その傾向は感じにくかった。
