Ⅰ．景気の現状に対する判断理由等,,,,,,,
,,□,都市型ホテル（スタッフ）,単価の動き,・宿泊は高稼働、高単価のまま推移しているが、前年比では微増にとどまる。ホテルのグレード的には今の水準が限界と思われる。インバウンドは昨年ほどではないが、一定数は確保できており、傾向として多国籍化や小グループ化が進んでいる。宴会では昨年の大型周年記念の行事がない分、マイナスであるが、新規案件の増加や単価アップが顕著にみられる。,,
,,□,都市型ホテル（管理担当）,単価の動き,・インバウンドの宿泊人数は、以前ほどの勢いはないが、やや好調に推移している。ただし、客室単価が前月、今月共に前年を割り込み、ピークを過ぎた感がある。,,
,,□,旅行代理店（営業担当）,販売量の動き,・株高や円安が個人消費に良い影響を与えることを期待しているが、１月以降の予約状況にも回復の兆しがみられない。,,
,,□,タクシー運転手,お客様の様子,・年末の繁忙期なので、売上が増えている。,,
,,□,テーマパーク（職員）,販売量の動き,・秋シーズンの悪天候によるキャンセル客が、この12月に振り替えて来場しているので、数字だけをみると回復していると感じるが、実際にはそうではない。,,
,,□,美容室（店長）,来客数の動き,・大きなプラスはないものの、今月の販売は少し良くなっている。,,
,,□,その他サービス［ビデオ・ＣＤレンタル］（エリア担当）,販売量の動き,・稼ぎ時の年末にしては、前年に比べて勢いがないように感じる。,,
,,□,住宅販売会社（経営者）,お客様の様子,・住宅の売却相談は、相続関連と経済的理由とに大きく分かれている。所得の増加による新規取得や買換えの需要はみられないため、それほど景気は好転していないと感じる。,,
,,□,住宅販売会社（経営者）,販売量の動き,・集客数が減ってきているほか、低額の売買物件が多くなっている。不動産の仲介業務は調査に時間や費用がかかるため、３％程度の手数料では、単体取引で赤字となる。,,
,,□,住宅販売会社（総務担当）,販売量の動き,・来客数は微減であるが、契約量は前年に比べて微増となっている。,,
,,□,その他住宅［展示場］（従業員）,お客様の様子,・住宅展示場への来場数は増加したが、これは９月以降に前年割れが続き、販促費用を増やしたためである。ただし、アンケート内容をみると、建築の計画予定が１年以内という客は減少している。,,
,,□,その他住宅［情報誌］（編集者）,お客様の様子,・米国の大統領選からの株高により、高所得層の不動産購入意欲が高まっている。都心のタワーマンションを中心に、億ションが以前よりも動いている。逆に、一次取得者向けの物件は、集客、販売共に苦戦し、状況は以前よりも厳しくなっている。,,
,,▲,一般小売店［衣服］（経営者）,お客様の様子,・今年の気温は、例年に比べて低いにもかかわらず、コートの販売が全店とも伸びてこない。,,
,,▲,一般小売店［菓子］（経営企画担当）,販売量の動き,・今年12月現在と９月の売上前年比を、各地区別に上位５店舗の平均でみると、関西は12月が94.1％で、９月が87.2％、関東は12月が90.5％で、９月が93.6％、中部は12月が76.6％で、９月が95.6％、中国は12月が88.2％で、９月が205.0％となり、各地区合計の平均は12月が88.0％、９月が103.8％となった。全国的に非常に悪く、特に中国地区では、プロ野球チームの優勝による影響の反動が出ている。,,
,,▲,一般小売店［自転車］（店長）,来客数の動き,・来客数も少ないが、来店した客もお金をなかなか落としてくれない。,,
,,▲,スーパー（店長）,販売量の動き,・前年と来客数に大きな変化はないが、１人当たりの買上点数が減少傾向であり、必要な物を吟味して購入する傾向が強まっている。,,
,,▲,衣料品専門店（経営者）,来客数の動き,・販促を仕掛けても、客の反応が悪い。,,
,,▲,乗用車販売店（販売担当）,来客数の動き,・受注台数に陰りがみられる。,,
,,▲,乗用車販売店（販売担当）,販売量の動き,・例年の年末商戦の活気が今年はなかったように思われる。来年以降に期待したい。,,
,,▲,住関連専門店（店長）,単価の動き,・必要最小限の少量買いが多く、まとまった売上金額の物件が減っている。,,
,,▲,観光型旅館（経営者）,来客数の動き,・特に大きな原因は見当たらないが、予約の入りが悪い。,,
,,▲,旅行代理店（支店長）,お客様の様子,・年末年始の申込の間際需要が例年になく悪く、駆け込み需要も客のムードからは期待できない。,,
,,▲,タクシー運転手,お客様の様子,・日本人観光客がホテルや旅館を予約できず、客足が落ち込んでいる。,,
,,▲,ゴルフ場（支配人）,競争相手の様子,・地域全体の動きが悪いのか、原因がよく分からない。,,
,,▲,住宅販売会社（従業員）,お客様の様子,・これまで好調であった、都心部のタワーマンションの集客状況が少し落ちてきている。郊外に至っては集客が激減しているなど、新築マンションの販売は非常に厳しい。,,
,,▲,その他住宅投資の動向を把握できる者［不動産仲介］（経営者）,お客様の様子,・不動産の取引件数は減少している。,,
,,×,一般小売店［野菜］（店長）,競争相手の様子,・年末になって動きが出るかと思っていたが、問屋で話をしていても全く良い話を聞かない。,,
,,×,一般レストラン（経営者）,来客数の動き,・飲食店は天候に左右されやすいので、暖かい日は比較的来客数が安定しているが、寒い日は客足が遠のく。店の前に出してあるチラシも、お持ち帰り分ばかりが減るなど、家で食事をする傾向が強まっている。,,
,,×,美容室（経営者）,それ以外,・大型商業施設がなくなって３年経過したが、新しい商業施設が建たない限り、人は集まってこない。,,
"企業
動向
関連

(近畿)",,◎,化学工業（管理担当）,受注量や販売量の動き,・電子部品関連製品の販売量が、前月と同様に、前年比で約10％増加している。,,
,,◎,電気機械器具製造業（経営者）,受注量や販売量の動き,・市場の景気は悪いが、当社は３か月前から好調が続いている。為替の円安傾向による影響が顕著であるが、自助努力の成果も大きい。このところは各企業の状況と、市場の動き、政府の財政問題による不透明感が混在しており、景気の見方が難しくなっている。,,
,,○,金属製品製造業（経営者）,取引先の様子,・特殊な製品を中心として、国内、海外向け共に、活発に動いている。,,
,,○,建設業（経営者）,受注量や販売量の動き,・年始早々に受注が確定している案件がある。例年は１月の動きがそれほど良くないが、来年は受注が多いため、少し良くなってきていると感じる。,,
,,○,輸送業（営業担当）,取引先の様子,・県内に新店舗が２件オープンしたので、売上が伸びている。,,
,,○,新聞販売店［広告］（店主）,受注量や販売量の動き,・わずかながら折込件数が増え、収入が良くなっている。,,
,,○,広告代理店（営業担当）,取引先の様子,・郊外型ショッピングセンターでは、12月の来客数は前年と変わらないが、客単価が微増となり、売上は前年以上になっている。,,
,,○,経営コンサルタント,それ以外,・一般的にいわれている米国の次期大統領効果という言葉が象徴しているように、全体としては明るさが感じられる。,,
,,○,その他サービス業［店舗開発］（従業員）,受注量や販売量の動き,・冬らしい気温に落ち着いたこともあり、駅構内では冬物商材が順調に売れている。また、観光名所の公園で開催される各種イベントの効果もあり、環状線の各駅がにぎわいをみせている。その大半は東南アジアからの観光客である。,,
,,○,その他非製造業［衣服卸］（経営者）,受注量や販売量の動き,・歳末商戦に関しては、家庭用品は堅調な売行きとなった様子である。寒くなってからは、ファストファッションの店舗でみられるように、実用衣料が売れ出している。,,
,,□,食料品製造業（経理担当）,受注量や販売量の動き,・会社の売上は前年比で７％強の増加と上向いているが、まだデフレの傾向は続いている。,,
,,□,繊維工業（団体職員）,受注量や販売量の動き,・主力商品である白タオルの販売量が減少しているようであるが、ほかの商品の需要などにより、全体的にはややプラスである。,,
,,□,パルプ・紙・紙加工品製造業（経営者）,受注量や販売量の動き,・季節的要因を考慮すると変化はない。,,
,,□,プラスチック製品製造業（経営者）,受注量や販売量の動き,・数か月間はややプラスで推移していたが、ここへきて足踏み感がある。数字的には現状維持であるが、周囲の状況をみながらの発注になっていると感じる。,,
,,□,金属製品製造業（営業担当）,受注量や販売量の動き,・秋ごろから継続して売上好調である。前年は、12月から年度末までは少し減少したが、今年は落ち込みがない。,,
,,□,金属製品製造業（管理担当）,受注量や販売量の動き,・関西地方では目立った物件が少なく、受注量も多くない。,,
,,□,一般機械器具製造業（経営者）,受注量や販売量の動き,・目立った新規受注はないが、通常ベースの少額受注はこれまでどおり続いている。,,
,,□,電気機械器具製造業（経営者）,取引先の様子,・円安、株高により、一見すると景気が良いようにみえるが、どこまで続くかは分からない。また、米国の次期大統領の政治手腕により、どのような推移になるかも不透明である。,,
,,□,電気機械器具製造業（営業担当）,受注量や販売量の動き,・受注が増えてこない。,,
,,□,輸送用機械器具製造業（経理担当）,受注量や販売量の動き,・国内の自動車産業からの受注は堅調である。ただし、航空機関連の発注は遅れ気味であるほか、相変わらず中小企業の設備投資の動きは鈍い。,,
,,□,その他製造業［事務用品］（営業担当）,受注量や販売量の動き,・受注量が変わらないため、良くも悪くもない。,,
,,□,建設業（経営者）,受注価格や販売価格の動き,・年末にかけての工事単価も相変わらず低調である。,,
,,□,建設業（経営者）,受注価格や販売価格の動き,・地域全体の仕事量はあるものの、官庁関係の入札は厳しい価格競争が続いている。民間関係についても同様の動きがあり、やはり東京一極集中の影響が感じられる。,,
,,□,輸送業（営業所長）,受注量や販売量の動き,・12月中旬までは、予想したほどの配送はなかったが、年末に入って食品の配送依頼が増えている。,,
,,□,金融業（営業担当）,取引先の様子,・取引先の動向が今一つ鈍い。年末の慌ただしさも、例年に比べれば少ないように感じる。,,
,,□,金融業［投資運用業］（代表）,それ以外,・今ごろになって株価が年初来高値を更新しているが、来年は米国の次期大統領就任などで乱高下、又は下降しそうな気配である。,,
,,□,広告代理店（営業担当）,受注量や販売量の動き,・紙広告、Ｗｅｂ広告共に、売上が前年をやや下回っている。,,
,,□,広告代理店（営業担当）,受注量や販売量の動き,・円安の影響で、関連業種の広告は少し控えめだが、全体的に大きな変化はない。,,
,,□,その他非製造業［機械器具卸］（経営者）,競争相手の様子,・現状は受注や引き合い、設備関係などの見積が少ないため、今後が心配である。,,
,,▲,食料品製造業（従業員）,受注量や販売量の動き,・今月の前半は家庭用の荷動きが今一つであったが、年末でもあるため、業務用は例年並みに動いていた。後半は家庭用も少し良くなったように感じるが、トータルとしては良くない。,,
,,▲,経営コンサルタント,取引先の様子,・年末であったが、難波や梅田などでの買物客の混み具合に比べ、周辺の衛星都市での、中心地のにぎわいのなさが印象的である。,,
,,▲,その他サービス［自動車修理］（経営者）,受注量や販売量の動き,・取引先からは、仕事の値下げなどの相談が多い。,,
,,▲,その他非製造業［商社］（営業担当）,受注量や販売量の動き,・１～３月にかけては案件数が少ない。,,
,,×,化学工業（経営者）,受注量や販売量の動き,・問い合わせ案件数でみると、前年よりも少し多いが、受注額は前年を下回っている。また、問い合わせ件数も、３か月前に比べれば明らかに悪くなっている。,,
,,×,その他非製造業［電気業］（営業担当）,受注量や販売量の動き,・実体経済が良くなっていない。,,
"雇用
関連

(近畿)",,◎,－,－,－,,
,,○,人材派遣会社（支店長）,求人数の動き,・10月以降、徐々に求人数と就職の決定数が増えてきている。,,
,,○,人材派遣会社（支店長）,求職者数の動き,・雇用形態の動きが、労働者派遣法の改正後は変わってきている。,,
,,○,人材派遣会社（営業担当）,求人数の動き,・求人数の増加がみられる。,,
,,○,職業安定所（職員）,求人数の動き,・近畿の新規求人数が、前月はいったん減少したが、今月は前年比9.6％増と、増加傾向に戻った。主な産業別にみると、卸売、小売業以外で増加している。特に、滋賀、京都を中心に、電子部品や電子機器、食料品、プラスチックなどの製造業が力強く増加してきた。人が集まりにくいため、製造現場での派遣求人も増えている。製造業の求人が伸びた要因には、円安の影響もあると思われる。企業の業績が回復すれば、滞っていた設備投資も進むことが期待できる。,,
,,○,民間職業紹介機関（マネージャー）,求人数の動き,・為替の影響などが採用に直結するような動きはまだみられないが、引き続き採用状況は活発である。当社の成約数は前年比で120％近くに達する見通しである。,,
,,○,民間職業紹介機関（営業担当）,求人数の動き,・求人数が増加している一方、３月末に派遣契約が終了する人も多く、求職者が少し増えている。,,
,,○,学校［大学］（就職担当）,求人数の動き,・年末に入っても求人数が伸びており、企業からの訪問も増えている。,,
,,○,学校［大学］（就職担当）,それ以外,・前年に比べて繁華街の人出が多く、商店への客の入りも多く感じられた。デパートの買物袋を抱えた人も増えているようである。,,
,,□,人材派遣会社（経営者）,求人数の動き,・例年の年末特有の忙しさが今一つなかった。例年は年末ぎりぎりまでバタバタしているが、今年はそういうこともない。その中で、福祉や介護関連、一般事務、ＩＴ関連など、業種を問わず、年明けや新年度からはかなり忙しくなる。これは様々な事業が絡み合ってのことであるが、特に来年は福祉、介護事業がけん引していく。,,
,,□,人材派遣会社（役員）,求職者数の動き,・人手不足が深刻化するなか、特に一般派遣で働く人が減少している。労働者派遣法改正の影響で、３年ごとに職場を変えることに抵抗があるのかもしれない。あるいは正社員志向が強く、派遣市場に人が集まらない構造になっている可能性もある。このままの状況が続けば、景気浮揚の足かせになる。,,
,,□,アウトソーシング企業（管理担当）,それ以外,・今月も例年どおりの動きである。,,
,,□,新聞社［求人広告］（管理担当）,求人数の動き,・新聞求人においては、例年どおり、年末の季節的要因による若干の求人数の増加もピークを過ぎ、景気の上向きや下向きの動きを示すような、特に変わった要素はみられない。,,
,,□,新聞社［求人広告］（担当者）,それ以外,・新聞広告の出稿の推移をみても、ここ数か月は前年比で10％前後の減少が続いている。,,
,,□,新聞社［求人広告］（営業担当）,求人数の動き,・新聞の求人広告はどんどん減少し、中途採用を中心に業種も限られてきているが、大阪市内のサービス業や飲食店は人手不足の傾向が顕著である。今後はバランスの良い求人情報の発信が必要となる。,,
,,□,職業安定所（職員）,求人数の動き,・直近の新規求人数は、前年比で8.1％増加し、３か月ぶりに増加に転じた。ただし、前月、前々月に求人数が減少した主な要因は、前年に飲食チェーン店から大量求人があった反動であり、全体的には求人数は増加傾向で推移している。求人数が増加している業種は、教育・学習支援業や不動産・物品賃貸業、情報通信業、医療・福祉、製造業、建設業などとなっている。事業所への景況感に関するヒアリングでは、普通とする回答が多い。,,
,,□,職業安定所（職員）,それ以外,・今後の展望はやや明るいとみており、企業も現状は変化なしと考えている。,,
,,□,民間職業紹介機関（職員）,求人数の動き,・当地の建設日雇い求人数は、前年を少し下回る水準が続いている。,,
,,□,民間職業紹介機関（営業担当）,求職者数の動き,・求人数は以前と変わらず好調な一方、大卒の新卒者を中心とした求職者数は減っている。就職先が決定している学生が多く、求職者が例年よりも少ない。特に理工系はその傾向が強い。,,
,,▲,－,－,－,,
,,×,－,－,－,,
,,,,,,,
　８．中国（地域別調査機関：公益社団法人中国地方総合研究センター）,,,,,,,
,,,,,（－：回答が存在しない、＊：主だった回答等が存在しない）,,
分野,,景気の現状判断,業種・職種,判断の理由,追加説明及び具体的状況の説明,,
"家計
動向
関連

(中国)",,◎,一般レストラン（経営者）,販売量の動き,・来客数が増えており、人の動きがある。,,
,,○,一般小売店［紙類］（経営者）,来客数の動き,・客の購入点数が増えて景気が良い。,,
,,○,一般小売店［靴］（経営者）,来客数の動き,・既存客の紹介で新規客が増えている。,,
,,○,百貨店（営業担当）,販売量の動き,・コートなどの高額商品が通常価格でよく動き、売上も伸びている。,,
,,○,スーパー（店長）,販売量の動き,・高値が続いていた野菜価格が低下しており、客が価格に非常に敏感である。,,
,,○,スーパー（総務担当）,単価の動き,・来客数が減少しているものの、客単価が上昇しているため景気はやや上向きである。,,
,,○,スーパー（販売担当）,来客数の動き,・ここ数か月、来客数の前年割れが続いていたが、今月は前年を上回る数字で推移している。特に特売等のイベント時には来客数の伸びが顕著である。またクリスマスプレゼント需要では、前年より来客数、単価共に増えている。,,
,,○,コンビニ（エリア担当）,来客数の動き,・若干ではあるが来客数は増加傾向である。,,
,,○,コンビニ（支店長）,単価の動き,・来客数は前年並みで、客単価は上昇傾向にある。,,
,,○,衣料品専門店（店長）,単価の動き,・高額商品を現金で購入する客が多い。,,
,,○,家電量販店（店長）,来客数の動き,・来客数が増加するとともに客単価も上昇している。,,
,,○,乗用車販売店（統括）,販売量の動き,・新型車効果により、12月の販売量は前年比145％と大幅に伸びている。,,
,,○,乗用車販売店（総務担当）,販売量の動き,・新型車の販売が好調で売上に大きく寄与している。,,
,,○,自動車備品販売店（経営者）,販売量の動き,・年末にかけて一番動きが活発になる業界であるとともに、今年は早くから降雪情報も出ているため販売が好調である。,,
,,○,その他小売［ショッピングセンター］（所長）,来客数の動き,・隣接する大型ショッピングモールが特別セールを25日まで実施していたため、当ショッピングセンターにも客が流れてきており、テナントの閉店セールも集客アップにつながっている。,,
,,○,一般レストラン（店長）,単価の動き,・忘年会シーズンで予約の入り具合は前年に比べ多い傾向にある。また客に余裕があるため客単価も上昇している。,,
,,○,一般レストラン（外食事業担当）,単価の動き,・９月に食材価格の上昇に伴い売価の値上げとメニュー改定に踏み切ったことと、10月後半は大手ナショナルチェーン店が出店した影響で来客数が前年の90％台に減少したが、11月後半は値上げの効果で売上が前年をクリアしている。食べ放題の割合が減少し、通常メニューの注文が増加している。,,
,,○,都市型ホテル（スタッフ）,来客数の動き,・忘年会シーズンということもあるが、例年より来客数が増えている。,,
,,○,タクシー運転手,お客様の様子,・忘年会シーズンになり、夜の動きが活発である。,,
,,○,通信会社（工事担当）,お客様の様子,・客の様子が良くなっている。,,
,,○,通信会社（総務担当）,それ以外,・当県へのロシア大統領訪問に伴い、県外からの関係者等の来訪もあって、県内消費は微弱ではあるものの活性化が図られている。,,
,,○,テーマパーク（業務担当）,来客数の動き,・イルミネーションイベントを行っていることと合わせて、週末の天候も良く来客数が増加している。,,
,,○,競艇場（職員）,販売量の動き,・12月下旬に開催したＳＧ競争とＧ１競争では、外向発売所で一定の売上が確保できている。,,
,,□,商店街（代表者）,来客数の動き,・天候に恵まれたものの、商店街を通る人は予想したほどには増えていない。,,
,,□,商店街（理事）,お客様の様子,・客は必要な商品しか購入しない。,,
,,□,商店街（代表者）,来客数の動き,・年末にもかかわらず来客数が伸びておらず、正月用品の動きが鈍い。,,
,,□,商店街（代表者）,お客様の様子,・買い控えする客や安い商品を選んで購入する客が増えている。,,
,,□,商店街（代表者）,お客様の様子,・年間最大の商戦期であるが三連休に売上が集中したため、例年より売上を確保する期間が短く、前年並みの売上を確保するのが精一杯である。全般的な景気動向は３か月前同様にあまり良くない。,,
,,□,一般小売店［印章］（経営者）,来客数の動き,・年賀状を出す数が減少し自分で印刷する人が増えているため、年賀状印刷の売上が低下している。,,
