Ⅰ．景気の現状に対する判断理由等,,,,,,,
,,▲,一般小売店［菓子］（経営企画担当）,販売量の動き,・９月現在と６月の売上前年比を、各地区別に上位５店舗の平均でみると、関西は９月が86.2％で、６月が97.1％、関東は９月が90.2％で、６月が96.6％、中部は９月が95.6％で、６月が93.6％、中国は９月が241.2％で、６月が107.2％となり、各地区合計の平均は９月が104.7％で、６月が98.1％となった。一見好調のようであるが、関西、関東共に大きく前年を下回っており、非常に厳しい状態である。中国地区は特にプロ野球チームの優勝による影響が大きく、大幅に伸びているが、一過性の動きであり、継続するものではない。,,
,,▲,一般小売店［花］（店長）,販売量の動き,・台風や豪雨の影響で商品価格が高騰しているため、客の購入は控えめな感じである。,,
,,▲,百貨店（売場主任）,お客様の様子,・今月の売上は目標を下回る見込みである。輸入商品や高額品など、一部には動きが堅調な商品もあるが、アパレルが厳しいほか、中間層に対するボリューム商品の売行きも鈍くなってきている。客の購入姿勢の慎重さは、より一層強まっており、価格に対してもシビアになっている。,,
,,▲,百貨店（企画担当）,お客様の様子,・売上の２割を占めるインバウンド売上は、今月に入っても減少傾向に歯止めがかからず、前年比で約19％の減少となっている。免税売上は2015年２月以降、19か月ぶりに10億円を割り込んだ。その一方、来客数は前年を約７％上回っているが、客単価が大幅に低下している。富裕層の外商顧客については、店頭での購買額は前月までと変わらないが、訪問販売での商談には慎重さがみられる。ボリューム層の動きも、台風などの影響もあって来客数が減少しており、厳しい状況が続いている。,,
,,▲,百貨店（営業担当）,販売量の動き,・天候不順や気温の高さなどで、ファッション商品が動かない。,,
,,▲,百貨店（営業担当）,お客様の様子,・猛暑も一段落し、富裕層の優良顧客は高級ブランド品や美術品を買うよりも、旅行やゴルフなどにお金と時間を使う傾向が強まってきている。,,
,,▲,百貨店（営業担当）,販売量の動き,・中間層向けの婦人、紳士ファッションや、洋品雑貨の動きが更に不振となり、食料品の動きも鈍化している。,,
,,▲,スーパー（店長）,単価の動き,・前年はプレミアム付商品券の効果があった分、今年は悪い。これは分かっていたことであり、販促によって対応したものの、結果につながらず苦戦している。,,
,,▲,スーパー（店長）,単価の動き,・残暑が厳しく、秋物の動きが悪いことも景気下振れの要因となっているほか、食品を含めた客単価の下落がみられる。,,
,,▲,スーパー（店長）,来客数の動き,・以前からの固定客の来店頻度も変わらず、買上点数は維持しているものの、買い回り客の来店頻度が大きく減少している。印象としては、価格訴求店での購入が増えていると感じる。,,
,,▲,スーパー（店員）,来客数の動き,・台風や雨の影響で、葉物野菜の値段がかなり上がっている。根物野菜も、大きく育っていないにもかかわらず値段が高いので、あまり売れていない。,,
,,▲,スーパー（企画担当）,競争相手の様子,・競合の激化で、売上は前年比で97％の推移となっている。,,
,,▲,スーパー（企画担当）,競争相手の様子,・９月は台風の影響で天候が悪く、売上は前年比で97％と今期で一番悪い月となった。新店舗を出したが、競合店が密集している地域であり、なかなか売上も上がってこない。,,
,,▲,スーパー（経理担当）,販売量の動き,・今月は雨の影響が大きいと思われるが、売上が下降傾向にある。同業他社の危機感も強く、価格競争の激化が、消費者の低価格指向を強めてしまう恐れがある。,,
,,▲,スーパー（企画）,単価の動き,・８月までは食品の１品単価が下落していたが、９月に入って、台風の影響などで相場が上昇し、買上点数が前年割れしている。また、月下旬には季節が戻って少し暑くなったため、衣料品の季節商材の動きが鈍い。,,
,,▲,コンビニ（経営者）,来客数の動き,・近隣でビルの売却が増え、テナントの空室も埋まっていないなど、周辺の人口が減少している。,,
,,▲,家電量販店（経営者）,販売量の動き,・客の財布のひもが固く、買換えサイクルも伸びているため、家電の販売量が増えない。,,
,,▲,乗用車販売店（経営者）,販売量の動き,・仕事はあるものの、内容が悪く、利益が出ていない。,,
,,▲,乗用車販売店（営業担当）,販売量の動き,・新型車が発売されたが、販売台数の上乗せはなく、新型車を含めて前年並みとなっている。,,
,,▲,一般レストラン（経営者）,来客数の動き,・前月の中旬から来客数が伸びず、シルバーウィーク以降は特に減少した。旅行や買物などの急な出費が多く、外食を控えざるを得ないという客の声が多く聞かれる。,,
,,▲,一般レストラン（経営者）,来客数の動き,・今月ほど天候に恵まれない月もなく、雨ばかりで客足が伸びなかった。近隣の店舗にも客が入っている様子はなく、商店街の人通りは少ない。新しい飲食店も開店したが、暇そうである。,,
,,▲,一般レストラン（企画）,来客数の動き,・８～９月は天候不順やリオデジャネイロオリンピックの影響で来客数の前年比が大きく悪化したが、９月に入っても底打ちの様子がみえてこない。外食全体でも低価格業態以外は苦戦しており、この傾向はこれからも続くと予想している。,,
,,▲,一般レストラン（経理担当）,それ以外,・消費環境の悪化に加え、台風や猛暑といった異例ずくめの天候による不安要素もあり、やや悪くなっている。,,
,,▲,観光型ホテル（経営者）,来客数の動き,・特に、宴会の予約数が例年に比べて伸び悩んでいる。,,
,,▲,観光型ホテル（経営者）,来客数の動き,・今月は前年比で来客数が減っており、販売量も落ちている。前年ほどのシルバーウィークがなかったことも一つの要因であるが、全体的に前年のような勢いはみられなくなった。,,
,,▲,観光型旅館（経営者）,来客数の動き,・７～８月は天候にも恵まれ、海のレジャー関連での来客が多かった。一方、９～10月は台風が多く、伸び悩んでいる。　,,
,,▲,都市型ホテル（客室担当）,来客数の動き,・円高の影響もあり、インバウンドは団体客による催行率が低下している。その代わりに個人客の予約が増えており、宿泊は前年を上回る売上となっている。,,
,,▲,都市型ホテル（管理担当）,来客数の動き,・中国からの宿泊者が、団体から個人に変わってきている。やはり、個人客では団体ほど宿泊人数が集まらず、稼働率が低下してきている。また、予約方法としては、エージェント予約からインターネット予約に推移し、ルームチャージだけの宿泊が増えたことで、レストラン、特に朝食の売上に影響が出ている。,,
,,▲,旅行代理店（支店長）,お客様の様子,・過激派組織の影響によるマレーシア方面のキャンセルに続き、ジカ熱の影響で、シンガポールやタイなどのキャンセルも相次いだ。国内旅行への振替があっても、販売額は上がらず、現地のホテルやバス会社からはキャンセル料も要求されるため、大変厳しい状況である。客からは、落ち着いてからまた考えるとの声が多く、徐々に旅行離れが進むのではないかと予想される。,,
,,▲,旅行代理店（役員）,販売量の動き,・国内旅行は、台風が８月は４回、９月は２回上陸したために、キャンセルが相次いだ。海外旅行も、いまだに各地で発生するテロの影響から脱却できていない。,,
,,▲,タクシー運転手,お客様の様子,・夏場が過ぎて暑さが和らいだほか、以前からの傾向も影響している。,,
,,▲,ゴルフ場（支配人）,単価の動き,・東京オリンピックに向けた、景気や経済情勢が不透明である。,,
,,▲,競輪場（職員）,単価の動き,"・今月の客単価は9,328円で、３か月前の客単価は9,601円となっている。",,
,,▲,美容室（店長）,来客数の動き,・なかなか予約が入らず、売上が前年を約１割下回っている。,,
,,▲,住宅販売会社（従業員）,販売量の動き,・新築分譲マンションは、価格の高騰によって一部では投資需要があるものの、実需の購入意欲が減退し、売行きがストップしてきている。実需が中心の新築戸建住宅も同様であり、売行きは鈍い。,,
,,▲,その他住宅［展示場］（従業員）,来客数の動き,・９月の住宅展示場への来場数は、前年比で１割以上の減少となっている。,,
,,▲,その他住宅［情報誌］（編集者）,お客様の様子,・分譲マンションの販売状況は、以前から物件ごとに好不調の差はあったが、ここ数か月でその差が更に大きくなっている。特に、不調物件が増加する傾向にある。,,
,,×,商店街（代表者）,来客数の動き,・８～９月の２か月が非常に悪い。天候が不安定で、特に９月は長雨に苦しんだ。来客数が減り、売上も厳しくなっている。,,
,,×,百貨店（販促担当）,単価の動き,・今月は大苦戦であった。暑さが続くなか、その影響が強く出て、衣料品を中心に秋物が動かない。また、台風を含めた雨模様の天候により、来客数にも影響が出ている。高額品も目立った材料はなく、全般的に非常に厳しい推移となっている。,,
,,×,百貨店（外商担当）,お客様の様子,・婦人服を中心とした、衣料品の買い控えが目立つ。,,
,,×,百貨店（営業企画）,単価の動き,・婦人服を中心に、食料品以外の商品が全体的に不振で、その度合いが増している。特に、レジ客単価の低下が顕著である。,,
,,×,百貨店（服飾品担当）,販売量の動き,・９月に入って、初旬の気温が前年を大きく上回るなか、秋物衣料は婦人や紳士、子供服で前年を大きく割り込む結果となった。靴や帽子などの雑貨類も厳しく、都心店舗だけでなく、郊外店舗でも15～20％下回る形となっている。一方、食品や化粧品、ブライダル商材などのアクセサリーはほぼ前年並みの数字であるため、気温の影響だけではなく、消費が必需品を中心とした堅実な購買スタイルに変わっているものと思われる。,,
,,×,百貨店（マネージャー）,来客数の動き,・セール以降、入店客数や客単価の悪化傾向が続いている。９月に入って気温が高いこともあるが、ファッション、消耗品雑貨の苦戦がより一層顕著である。営業施策を強化しても客に伝わらない状況が続き、買い控えとは異なる反応がみられる。,,
,,×,百貨店（マネージャー）,来客数の動き,・９月は残暑で最高気温が平年よりも５度近く高い日が続き、買上客数が前年よりも10％以上減少した。特に、紳士服が18％減、ビジネス需要のスーツやネクタイ、長袖ワイシャツなどの秋物衣料が大幅に減少している。一方、インバウンド消費の減少で上半期は苦戦が続いた高額品の時計については、富裕層を中心に回復基調となり、単価も20％程度上昇している。,,
,,×,スーパー（店長）,販売量の動き,・今月は特に気温の高い日が多く、秋物が不調である。さらに、競合相手との価格競争で、利益が圧迫された状況から脱していない。,,
,,×,衣料品専門店（経営者）,来客数の動き,・９月は雨の日が多く、台風などもあり、来客数が大幅に減少している。８月以降は秋らしい日がなく、秋物の動きが非常に悪い。,,
"企業
動向
関連

(近畿)",,◎,＊,＊,＊,,
,,○,出版・印刷・同関連産業（営業担当）,受注量や販売量の動き,・２～３か月前に比べて、少しではあるが受注量が増えてきているように思う。特に、一般消費者を対象としている企業からの発注が少しずつ増えてきている。,,
,,○,プラスチック製品製造業（経営者）,受注量や販売量の動き,・消費税増税時の駆け込み需要のような、発注の仕方や製品の動きが目につく。動きは大きいが、理由が分からない。,,
,,○,金属製品製造業（経営者）,取引先の様子,・９月に入って各品種共に受注量が増加しており、10～12月の受注内示も増加傾向にある。,,
,,○,金属製品製造業（営業担当）,受注量や販売量の動き,・相続税対策で賃貸住宅の建設が増えており、資材の需要が旺盛である。,,
,,○,電気機械器具製造業（経営者）,受注量や販売量の動き,・夏枯れで８月は特に悪かったが、全体の傾向は良くなっている。ただし、力強さはなく、増え続ける休日で稼働日も足りず、厳しくなるばかりである。余談であるが、当市内の一等地とはいえない商業地域では、空き店舗がなかなか埋まらない。中小商店の起業は難しくなっているようである。,,
,,○,輸送業（営業担当）,取引先の様子,・新規店舗ができたので、やや良くなる。,,
,,○,広告代理店（営業担当）,受注量や販売量の動き,・例年以上にハロウィーン需要が多く、受注が増えている。,,
,,□,食料品製造業（営業担当）,受注量や販売量の動き,・残暑が続いており、月前半は飲料水の売上が伸びたが、雨が多かったせいか、後半には伸びが止まったように感じる。,,
,,□,食料品製造業（経理担当）,受注価格や販売価格の動き,・アベノミクスへの期待感も薄れてきている。,,
,,□,繊維工業（団体職員）,受注量や販売量の動き,・年末に向けて、通常の需要や荷動きは出てきているようである。,,
,,□,パルプ・紙・紙加工品製造業（経営者）,受注量や販売量の動き,・受注量や販売量に大きな変化はない。また、増産の情報はあるものの、現時点では変化がみられない。,,
,,□,化学工業（管理担当）,受注量や販売量の動き,・国内及び海外向けの販売数量には、ほとんど変化がない。,,
,,□,窯業・土石製品製造業（経営者）,受注量や販売量の動き,・最近は取引先の余裕がなくなっている。,,
,,□,電気機械器具製造業（経営者）,取引先の様子,・相変わらず不安定で、やや円高傾向にあるのが現状である。今は期末であるため、忙しく仕事をしているという感じである。,,
,,□,電気機械器具製造業（営業担当）,受注量や販売量の動き,・受注が伸び悩んでいる。,,
,,□,輸送用機械器具製造業（経理担当）,受注量や販売量の動き,・航空機関連の受注は増加傾向であるが、相変わらず中小企業の動きは鈍い。,,
,,□,建設業（経営者）,受注量や販売量の動き,・商品によって動きが異なる。太陽光発電は全体的に少なくなりつつあるが、まだ受注残はある。その一方、土地の動きはそれほど活発ではなく、あまり変化がない。,,
,,□,建設業（経営者）,受注価格や販売価格の動き,・見学会のイベントへの来場者は多いが、低予算の顧客がほとんどである。,,
,,□,建設業（経営者）,取引先の様子,・技能労務者や管理技術員が不足するなか、相変わらず厳しい受注競争が繰り広げられている。,,
,,□,輸送業（営業所長）,受注量や販売量の動き,・新規案件が増えてきたが、慢性的な運転手不足で商談が進まない。,,
,,□,通信業（管理担当）,それ以外,・市場の様子をみても、以前に比べて大きな変化がない。,,
,,□,金融業（営業担当）,取引先の様子,・中小企業の動向が不安定である。企業努力による売上の維持と、経費の削減がかぎとなっている。,,
,,□,金融業［投資運用業］（代表）,それ以外,・株価は年初来安値の近辺を推移し、それに為替も連動するなど、大きな動きはない。マイナス金利によって市中に出てくるはずの銀行の融資も慎重であり、何も良いことがない。,,
,,□,広告代理店（営業担当）,受注量や販売量の動き,・期初から比較的好調であった広告出稿も、８月下旬以降は少し様子見になっている。,,
,,□,広告代理店（営業担当）,受注量や販売量の動き,・Ｗｅｂ広告、紙広告共に、前年の売上を下回っている。,,
,,□,経営コンサルタント,それ以外,・主に中小企業や商店街の動向をみているが、来客数や買物単価が良くないという声も多く、バーゲンを除けば客もまばらである。中小企業の経営者の話を聞いても、芳しい反応が返ってこない。,,
,,□,経営コンサルタント,取引先の様子,・製造業の顧客企業による製品開発、販路開拓に対する支出は堅調である。３か月前に比べると、景気への警戒感がやや後退した気がする。,,
,,□,コピーサービス業（店長）,受注量や販売量の動き,・受注はやや増加しているようであるが、季節的な動きと考えると、大きな変化はない。      ,,
,,□,その他サービス業［店舗開発］（従業員）,受注価格や販売価格の動き,・今夏は、特設プールなどの期間限定イベントによって周辺駅の店舗は大きくにぎわった。また、猛暑も手伝って飲料を中心に売上が伸びた。一方、免税店舗などは大きく売上を下げており、化粧品などの爆買いはほぼ皆無となっている。,,
,,▲,食料品製造業（従業員）,受注量や販売量の動き,・雨が多く、天候不順の日が多かったせいか、思ったほど売上が伸びなかった。気温が暑かったり、寒かったりしたことも原因と考えられる。,,
,,▲,繊維工業（総務担当）,競争相手の様子,・地元の取引先への販売数量が減っている。県外への販売に必要な経費負担が増加しているため、利益の減少がみられる。,,
,,▲,一般機械器具製造業（経営者）,受注量や販売量の動き,・現在、大型のプロジェクトを受注しているので、受注残は多いが、それ以外の引き合いや受注が減っている。,,
,,▲,不動産業（営業担当）,取引先の様子,・神戸からの企業の撤退が止まらない。それに伴って事務所や社宅のニーズが減少し、賃貸料が低下、空室率が上がるなど、景気は悪くなっている。,,
,,▲,その他サービス［自動車修理］（経営者）,受注量や販売量の動き,・休み明けも一時的に忙しくなったが、その後が続かない。,,
,,▲,その他非製造業［機械器具卸］（経営者）,取引先の様子,・得意先には輸出関連企業が多いため、円高の影響で注文量が減っており、新たな受注につながらない。,,
,,×,電気機械器具製造業（経理担当）,受注量や販売量の動き,・例年以上に商品の動きが悪く、計画的な設備更新を控えているといった話が多い。,,
,,×,新聞販売店［広告］（店主）,受注量や販売量の動き,・新規購読が伸び悩み、購読数が減少しつつあるほか、折込広告も減少しているなど、回復の兆しがみられない。,,
,,×,その他非製造業［商社］（営業担当）,受注量や販売量の動き,・取引先の仕事量が減っているのに伴い、当社の出荷量も減っている。,,
,,×,その他非製造業［電気業］（営業担当）,受注量や販売量の動き,・日本銀行による政策の効果もなく、円高株安で混迷が深まっている。,,
"雇用
関連

(近畿)",,◎,－,－,－,,
,,○,人材派遣会社（支店長）,求人数の動き,・派遣依頼の人数が前年比で10％以上の伸びをみせている。,,
,,○,人材派遣会社（営業担当）,求人数の動き,・求人数が増加傾向にあるほか、欠員補充ではなく、増員募集の案件が増えている。,,
,,○,職業安定所（職員）,求人数の動き,・３か月前に比べて、新規求職者は２％増加し、新規求人数も２％増加している。一方、就職件数は７％ほど減少し、新規・有効求人倍率は４％の低下となった。また、産業別の新規求人数では、建設業の増加幅が拡大した反面、持ち直しの気配があった製造業は約33％の減少となっている。宿泊業、飲食サービス業では、引き続き約47％の増加となっており、堅調な動きがみられる。,,
,,○,民間職業紹介機関（職員）,求人数の動き,・トラブルなどで工事が止まっていた新名神高速や橋りょうの工事などが再開されて以降、日雇い建設求人も前年比で増加に転換している。,,
,,□,人材派遣会社（経営者）,求人数の動き,・例年であれば、そろそろ年末の商談が出てくる時期であるが、今年はかなり遅れている。企業側が慎重になっており、人員配置などを試行錯誤している。,,
,,□,人材派遣会社（支店長）,求職者数の動き,・関西エリアにおいては、事業の縮小、スタート時期の先送りなど、あまり状況が良くない。,,
,,□,人材派遣会社（役員）,採用者数の動き,・企業の採用に関しては、良い人材がいれば採るが、そうでなければ急がない。今は、何が何でも人をそろえるという状況ではなく、企業は現状を維持し、情勢を見守っている感がある。,,
,,□,アウトソーシング企業（管理担当）,それ以外,・今月もほとんど仕事が入らない状況である。,,
,,□,新聞社［求人広告］（管理担当）,求人数の動き,・新聞の求人は、今月も景気の方向性を示すような上昇や落ち込みはみられない。ただし、最近の円高基調は、大手企業の下請中小企業が多い、関西の企業には徐々にダメージとなる。,,
,,□,新聞社［求人広告］（担当者）,それ以外,・新聞広告の出稿推移をみると、特にここ３か月は変化がない。リオデジャネイロオリンピックの影響もほぼない状況である。,,
,,□,職業安定所（職員）,求人数の動き,・人手不足により、新規求人は増加傾向が続いているが、正社員よりもパート求人の増加幅の方が大きい。,,
,,□,職業安定所（職員）,周辺企業の様子,・新規求人数は前年と比べて増加しているが、周辺企業の景況は引き続き現状維持となり、景気が上向いている様子はみられない。,,
,,□,職業安定所（職員）,求人数の動き,・直近の新規求人数は前年比で7.4％増加し、13か月連続の増加となった。業種別には、医療・福祉や情報通信業、教育・学習支援業、他に分類されないサービス業などで増加している。一方、金融・保険業や学術研究・専門・技術サービス業などでは減少となった。事業所に対する景況感のヒアリング結果では、普通という回答が多い。,,
,,□,民間職業紹介機関（マネージャー）,求人数の動き,・京都、滋賀エリアでは、2016年下期の採用予定数は上期の120％に増えている。一方、求職者数は微増にとどまるため、求職者による売手市場の状況が続く。,,
