Ⅰ．景気の現状に対する判断理由等,,,,,
,,□,一般レストラン（企画）,来客数の動き,・来客数の前年比は100％前後で推移している。一方、売上の前年比は客単価に支えられて100％を上回っており、堅調な営業が続いている。
,,□,その他飲食［自動販売機（飲料）］（管理担当）,お客様の様子,・経費削減に関する声が多い。新規の注文もあるが、取引先ごとの差が大きい。
,,□,観光型ホテル（経営者）,来客数の動き,・自然災害などの影響が出てきている。
,,□,観光型ホテル（経営者）,販売量の動き,・今月は台風21号の影響や、団体客のキャンセルが重なり、前年の販売量を下回った。また、直前の個人客の動きも今一つであり、キャンセルで発生した空室を埋められていない。
,,□,都市型ホテル（支配人）,販売量の動き,・景気に大きな変動はみられない。衆議院選挙の結果が与党の大勝となり、様子見の状況にある。
,,□,都市型ホテル（管理担当）,来客数の動き,・インバウンドの団体客は、引き続き好調に推移している。ただし、個人客については勢いがみられず、代理店経由の動きはオンラインを含めて低調に推移している。レストランについては、朝食付きの団体客が増えているので、微増となっている。
,,□,都市型ホテル（管理担当）,単価の動き,・アジアからのインバウンドの宿泊は、大きく減少することなく推移しているが、国内の代理店経由の動きに回復の兆しがみられない。
,,□,都市型ホテル（客室担当）,来客数の動き,・国慶節の期間も含め、訪日外国人は前年比で4.2％増となっている。そのお陰で、稼働率、売上共に前年を上回っている。
,,□,旅行代理店（営業担当）,販売量の動き,・個人消費がなかなか浮上しないほか、台風の影響もあり、依然として厳しい状況が続いている。
,,□,タクシー運転手,お客様の様子,・天候不順であったが、客の増減はみられない。
,,□,テーマパーク（職員）,来客数の動き,・修学旅行や遠足の時期であり、客の消費は増えているが、天候不順もあって集客が伸び悩んでいる。
,,□,その他レジャー施設［イベントホール］（職員）,お客様の様子,・来場者の数は、以前と比べて変化が少ない一方、物販の販売量は若干減っている。
,,□,その他レジャー施設［飲食・物販系滞在型施設］（企画担当）,単価の動き,・10月は天候が悪過ぎて、消費動向が分かりにくい。消費単価をみる限り、特に改善や悪化は感じられない。
,,□,美容室（店員）,販売量の動き,・ヘアケア商品の購入が、夏物から秋冬物へ変化した様子はあるが、増えたという印象は薄い。
,,□,美容室（店員）,単価の動き,・来客数自体の動きは変わらないが、パーマやカラーなどの高額なメニューを勧めると、積極的に受け入れてくれる。
,,□,その他サービス［学習塾］（スタッフ）,来客数の動き,・現在、生徒の増減が落ち着いている。
,,□,その他サービス［ビデオ・ＣＤレンタル］（エリア担当）,販売量の動き,・今月はゲーム販売や文具雑貨の品ぞろえが良く、売上はかなり好調で、レンタル売上の前年割れをカバーしている。
,,□,住宅販売会社（経営者）,来客数の動き,・７月頃から、顧客数の増加が継続している。
,,□,その他住宅投資の動向を把握できる者［不動産仲介］（経営者）,お客様の様子,・中小企業の売上が増えているとは、あまり聞かれない。
,,▲,商店街（代表者）,来客数の動き,・天候不順により、来店頻度が減少している。
,,▲,一般小売店［珈琲］（経営者）,販売量の動き,・商品を卸している飲食店からの注文数量が減少している。直営店の来客数も、雨などの天候不順で激減している。
,,▲,一般小売店［時計］（経営者）,来客数の動き,・月の初めは客足も悪くなく、まずまずの出足であった。少し期待したが、中旬からは雨が多く、２度の週末の台風で商店街のイベントも延期となり、客足も随分減った。雨が降ると、路面店には致命傷となる。
,,▲,スーパー（店長）,来客数の動き,・近くに競合店ができたこともあり、来客数が減少。農産品の相場安もあり、商品単価が低下している。また、割引セールに買物が集中するなど、消費者の生活防衛意識は依然として高い。
,,▲,スーパー（企画担当）,販売量の動き,・今年は残暑が厳しくないほか、台風などの天候要因もあり、飲料関連は大きく前年を下回っている。逆に、鍋物関連商品は動きが早くなっているが、マイナス分をカバーするほどではない。野菜価格は高騰しているものの、一定以上は価格を上げられず、苦戦している。
,,▲,スーパー（企画）,来客数の動き,・客単価は堅調なものの、来客数が厳しい状況にある。これまでは衣料品、生活関連品の不振を食料品がカバーしてきたが、９月以降は食料品の動きも鈍くなりつつある。９月からの台風や不漁で、青果や鮮魚関係の価格が上がるとともに、足元の消費環境は厳しくなっている。
,,▲,コンビニ（経営者）,来客数の動き,・近隣で工事をしていた２つのホテルが完成し、工事関係者の来店がなくなっている。今はオープンまでの空白期間であるため、客が減少している。
,,▲,コンビニ（店員）,来客数の動き,・雨の日が多く、来客数が少ない。
,,▲,家電量販店（店員）,販売量の動き,・前年と比べて来客数が減少し、販売量に関しても前年割れの状況にある。買い渋りが非常に目立つ。
,,▲,家電量販店（人事担当）,来客数の動き,・夏が終わって気温が下がり、過ごしやすい季節となったため、買換え需要以外の客の動きが少ない。また、秋の長雨により、来客数も前年に比べて減っている。
,,▲,乗用車販売店（経営者）,お客様の様子,・客の姿勢が消費に向けられているとは感じられない。衆議院選挙も与党の圧勝で何も変わらず、株価は上昇しているが、実際に豊かになったという客はいない。
,,▲,乗用車販売店（営業担当）,来客数の動き,・店舗に来店する客の数が減り、インターネットの中古車販売サイトへのアクセスも減少している。
,,▲,乗用車販売店（営業企画）,単価の動き,・例年どおり、年末に向けて価格が低下している。
,,▲,住関連専門店（店長）,単価の動き,・予算を前提とした商談が多い。例えば１万円しか予算がなく、どの商品なら買えるかと聞いてくる客が増えている。
,,▲,一般レストラン（経営者）,来客数の動き,・今月は週末の台風が２週間続いたため、来客数が減少した。近隣の商店街も人通りは少なく、周囲の店にも客は入っていない。
,,▲,一般レストラン（経営者）,来客数の動き,・外食業界では、特に９～10月は来客数の減少や伸び悩みをよく耳にした。また、近隣の会社での異動や引っ越しで新規顧客が安定せず、変動が大きい。
,,▲,観光型旅館（団体役員）,来客数の動き,・10月に入り、台風が２度にわたって週末に接近したため、予約のキャンセルによる損失が大きい。
,,▲,旅行代理店（店長）,お客様の様子,・客が台風や衆議院選挙前後から減っている。いろいろな要因が重なり、旅行は今でなくてもよいと考えている。
,,▲,旅行代理店（支店長）,お客様の様子,・北朝鮮によるグアムへの攻撃予告を受けて、教育旅行を中心に、キャンセル料がかかっても渡航をキャンセルする動きが増えている。客の需要が戻らない。
,,▲,競輪場（職員）,単価の動き,"・今月の客単価は9,015円で、３か月前の9,511円よりも下がっている。"
,,▲,美容室（店長）,来客数の動き,・来客数が伸びず、前年を下回っている。
,,▲,住宅販売会社（従業員）,競争相手の様子,・新築マンションの商談が遅れ始めており、デベロッパー各社が用地取得に対して慎重になっている。特に、郊外ではより顕著に表れている。
,,×,スーパー（経営者）,来客数の動き,・週末に接近した２度の台風や、前年比で２倍の降雨量により、来客数が大きな影響を受けた。また、前年は野菜の相場が急騰した反動で、１品単価も前年比で６割程度に落ち込んでいる。不漁や台風の影響で、鮮魚の入荷も不安定となるなど、散々な売上となっている。
,,×,衣料品専門店（経営者）,来客数の動き,・市長選挙、市議会議員補欠選挙、衆議院選挙の影響もあり、来客数が伸び悩んでいる。
,,×,衣料品専門店（経営者）,お客様の様子,・10月前半までは暑く、雨が降ってから急に寒くなったため、衣料品の売れ筋商品が変わり、売上が前年比で３割減少している。
,,×,乗用車販売店（営業担当）,販売量の動き,・自動車メーカーの不正検査問題の影響で、消費者の信頼がなくなっている。
"企業
動向
関連

(近畿)",,◎,－,－,－
,,○,建設業（経営者）,受注量や販売量の動き,・今月に入ってから、問い合わせが増えてきており、受注にもつながっている。
,,○,広告代理店（営業担当）,受注量や販売量の動き,・紙広告、Ｗｅｂ広告共に、問い合わせが増えてきている。
,,○,広告代理店（営業担当）,受注量や販売量の動き,・衆議院選挙関連の広告出稿があり、売上は結構良い。
,,○,広告代理店（企画担当）,取引先の様子,・服飾商材の売上が好調に推移しており、施設全体の売上が伸びている。個人消費が良くなってきていると感じる。
,,□,食料品製造業（従業員）,受注量や販売量の動き,・台風などの影響で週末のたびに天候が崩れ、人の出足も鈍っているが、気温が下がってきていることもあり、商品の出荷は少し回復している。
,,□,繊維工業（団体職員）,受注量や販売量の動き,・全体的には前年と変わらない。
,,□,化学工業（管理担当）,受注量や販売量の動き,・過去数か月は製品出荷が好調で、取引先からは、今後も生産は好調を維持できるとの連絡を受けている。ただし、化学品の原料価格上昇により、利益はあまり増加しない。
,,□,プラスチック製品製造業（経営者）,受注量や販売量の動き,・既存の商品の勢いは止まってきたが、新規商品の販売が立ち上がってきている。
,,□,金属製品製造業（経営者）,取引先の様子,・景気はやや良い状態で、大きな不安はない。
,,□,一般機械器具製造業（経営者）,受注量や販売量の動き,・取引先の景況は悪くない。ただし、当社の取扱商品と市場の需要が今一つ合っていない。
,,□,電気機械器具製造業（経営者）,取引先の様子,・製造設備への投資は前向きであるが、資金の使い方が非常にシビアである。
,,□,電気機械器具製造業（経営者）,それ以外,・当社の周辺では、中堅規模の中小企業による工場の新設が目につく。これまで市内では、商店が閉鎖されるとそのまま放置されることが多かった。素直に景気は上向いていると考えたいが、政治があまりに不安定なので、まだ安心はできない。
,,□,電気機械器具製造業（営業担当）,受注量や販売量の動き,・売上が伸びず、横ばい状態である。
,,□,電気機械器具製造業（営業担当）,受注量や販売量の動き,・ここ最近は仕事の予定が入っていない。
,,□,電気機械器具製造業（宣伝担当）,受注量や販売量の動き,・テレビ市場は、有機ＥＬテレビの販売増で単価アップの傾向にあるが、市場全体が伸びているわけではない。そのほかの商品では、あまり状況は変わっていない。
,,□,輸送用機械器具製造業（経理担当）,受注量や販売量の動き,・塗装関係の受注は安定しているものの、前年比での伸びはみられないほか、航空機関連もトーンダウンしている。また、中小企業の設備投資意欲は、相変わらず低調である。
,,□,その他製造業［事務用品］（営業担当）,受注量や販売量の動き,・受注、売上共に変化がなく、例年どおりの動きとなっている。
,,□,建設業（経営者）,受注価格や販売価格の動き,・衆議院選挙の影響もあり、しばらくは景気が停滞しているように感じる。
,,□,建設業（経営者）,取引先の様子,・価格競争は相変わらず厳しい状況が続いている。今回の台風被害の応急対応で、監理技術者や技能労務者の不足がより深刻になっている。
,,□,金融業（営業担当）,競争相手の様子,・得意先の取り合いが起きている。競合先が多く、当社の条件よりも安い金額を設定する動きが多い。頑張れば頑張るほど価格競争が進み、利益率は悪化傾向となる。
,,□,金融業［投資運用業］（代表）,それ以外,・景気を左右する要素がみられない。衆議院選挙での与党勝利の影響は、これから徐々に出てくる。
,,□,金融業（副支店長）,取引先の様子,・取引先との会話では、受注の増加や減少についての声はなく、横ばいであるとの回答が多い。
,,□,不動産業（営業担当）,取引先の様子,・神戸からの企業の撤退が続いている。それに伴って事務所のニーズが減り、家賃が下がっているほか、社宅のニーズも減り、賃料も低下している。
,,□,新聞販売店［広告］（店主）,受注量や販売量の動き,・購読収入、折込収入共に、横ばいである。10月は衆議院選挙と市長選挙が重なったので、広告の選挙特需を期待したが、それほどでもない。
,,□,経営コンサルタント,それ以外,・何かが良くなっているとか、悪くなっているといった実感がない。
,,□,経営コンサルタント,受注価格や販売価格の動き,・ここしばらく、各クライアントは企業の規模、業種を問わず、価格に厳しい。
,,□,コピーサービス業（店長）,受注量や販売量の動き,・前年と比べても、受注量に変化はみられない。
,,□,その他サービス業［店舗開発］（従業員）,受注量や販売量の動き,・今月は雨の日が非常に多く、特に週末の行楽には悪影響となったため、駅ナカ店舗は軒並み来客数が減り、売上ダウンとなった。一方、コンビニなどの売店では、傘やレインコートといった雨具の売上が、例年の約120％増となっている。
,,□,その他非製造業［機械器具卸］（経営者）,取引先の様子,・受注や予算の見積状況のほか、それ以外の動きもあまり変わらない。
,,▲,食料品製造業（営業担当）,受注量や販売量の動き,・今月に入って、急激な気温の低下や週末の天候の悪化もあり、景気が良くない。
,,▲,食料品製造業（経理担当）,それ以外,・衆議院選挙も物足りない感じで終わり、株の動きだけが目立っている。商品の動きは、９月に続いて良くない。
,,▲,繊維工業（総務担当）,取引先の様子,・消費者向けの催事では、集客の減少が目立つ。高額品の販売が減少し、中価格帯、低額品が現状維持のため、売上自体は伸びていない。
,,▲,出版・印刷・同関連産業（営業担当）,受注量や販売量の動き,・受注量、販売量共に、少しずつ右下がりになってきている。東京近郊の同業者からは良い声も聞かれるが、一部に限られる。会社全体でみても、受注量、販売量は前年比で約90％となっている。
,,▲,電気機械器具製造業（経理担当）,受注量や販売量の動き,・業界での規制問題に端を発した設備投資の抑制は、依然として続いている。今期一杯は回復の見通しが立たない状況である。
,,▲,輸送業（営業担当）,取引先の様子,・土日の有料化で、配達件数がかなり減っている。
,,▲,輸送業（営業所長）,受注量や販売量の動き,・第２四半期が終わり、10月に入ってから、じゅう器関係の荷動きが鈍化している。
,,▲,通信業（管理担当）,受注価格や販売価格の動き,・長雨による野菜価格の高騰で、影響を受けている。
,,▲,その他サービス［自動車修理］（経営者）,受注量や販売量の動き,・忙しくならない。
,,▲,その他非製造業［商社］（営業担当）,受注価格や販売価格の動き,・年々価格が下落しているが、それ以上に安い製品が中国などから入っている。価格が採算に全く合わない状況で、受注量は激減している。
,,×,その他非製造業［電気業］（営業担当）,受注量や販売量の動き,・株価は上がっているが、景気の実感が湧かない。
"雇用
関連

(近畿)",,◎,民間職業紹介機関（営業担当）,求人数の動き,・派遣料金がアップしているほか、求人数も増加傾向にある。
,,○,人材派遣会社（役員）,求職者数の動き,・今まで家庭にいた主婦や、高齢の男性の求職者が出てきたと同時に、企業側にも受け入れる素地が整いつつある。
,,○,人材派遣会社（支店長）,求人数の動き,・紹介案件が多く動いている。
,,○,職業安定所（職員）,求人数の動き,・新規求人数は前年比で増加傾向にある。建設関係や自動車、電機設備、家電などで、企業業績は好調となっている。
,,○,職業安定所（職員）,周辺企業の様子,・ハローワークで３か月に１回実施している企業ヒアリングによると、特に製造業で景況感が回復した。自動車や建機、産業用機械、インバウンド関連などで、特に好調との声が聞かれる。
,,○,民間職業紹介機関（営業担当）,求人数の動き,・例年は減少するこの時期になっても、まだ新卒の求人が減りそうにない。その点では、３か月前よりもやや良くなっている。また、この状況はリーマンショックの前にも似ている。
,,○,学校［大学］（就職担当）,求人数の動き,・中堅、中小企業を中心に、求人数が堅調に伸びている。
,,□,人材派遣会社（経営者）,求人数の動き,・人材派遣関係は、前月と同様に動きが鈍い。全業種から多くの注文が入ってくるが、人材不足のため、ほとんど成約できていない。ＩＴ関係では大型案件がいつ出てくるのか分からない状況で、特に関西は沈んだままである。ただし、衆議院選挙が与党の圧勝で終わったため、年末にかけて景気が良くなる期待感はある。
,,□,人材派遣会社（営業担当）,求人数の動き,・有効求人倍率は高く、販売系の求人については、常に枯渇状態である。
,,□,アウトソーシング企業（社員）,雇用形態の様子,・最低賃金は上がったものの、それ以外の雇用条件は変わらない。
,,□,アウトソーシング企業（管理担当）,それ以外,・通常の仕事は入ってきたが、忙しいわけでもなく、いつもどおりの動きである。
,,□,新聞社［求人広告］（管理担当）,求人数の動き,・前月と同様に、新聞求人では運輸、建設などの労働集約型企業の求人が増えているものの、全体的な増加や減少はみられない。求人倍率が1.5倍を超え、完全失業率が３％を割り込んでいるが、報道にみられるような人手不足感は感じられず、景気が上向いている兆候も感じられない。ただし、これは新聞広告に求人媒体としての力がないことを示している可能性もある。
,,□,新聞社［求人広告］（担当者）,求人数の動き,・関西景気の回復に手ごたえが感じられない。衆議院選挙後の株価上昇により、一般消費者に回復の実感が出てきてほしい。
,,□,新聞社［求人広告］（営業担当）,求人数の動き,・大阪では、飲食、サービス業の人手不足が顕著である。アルバイトの時給は上がっているが、人手が足りず、昼は主婦層、夜は留学生や高齢者層と、幅広い層の就業者が働いている。
,,□,職業安定所（職員）,求人数の動き,・管内の求人は前月よりも減少し、前年とも変わらなくなってきている。全体としては高止まりであり、状況は大きく変わらない。
,,□,民間職業紹介機関（職員）,求人数の動き,・建設日雇い求人では、人手不足で少しでも人材を確保したい事業所の意向により、求人申込件数が前年比で26.9％増となっているが、景気を左右するような動きはみられない。
,,□,学校［大学］（就職担当）,求人数の動き,・本学の卒業予定者を採用する企業は、各社とも小規模である。今年度はどの企業も採用意欲が高いようであるが、景気動向にはあまり変化が感じられない。
,,▲,－,－,－
,,×,－,－,－
,,,,,
　９．中国（地域別調査機関：公益社団法人中国地方総合研究センター）,,,,,
,,,,,（－：回答が存在しない、＊：主だった回答等が存在しない）
分野,,景気の現状判断,業種・職種,判断の理由,追加説明及び具体的状況の説明
"家計
動向
関連

(中国)",,◎,－,－,－
,,○,一般小売店［眼鏡］（経営者）,お客様の様子,・目的の物以外にも買っていく客が増えている。
,,○,百貨店（営業担当）,お客様の様子,・第３週末の台風の影響で売上を大きく落としているものの、気温の低下により婦人紳士衣料が数か月前と比較すると堅調に推移しており、前年からは明らかに客の購買意欲は向上している。
,,○,家電量販店（店長）,単価の動き,・客単価が上昇している。
,,○,乗用車販売店（統括）,販売量の動き,・10月の販売量は前年比110％と好調に推移している。
,,○,乗用車販売店（店長）,来客数の動き,・天候には恵まれていないが、週末の来客数は前年並みであり、全体的には前年の95％で推移している。高額な新車の動きが悪く売上に苦戦している。
,,○,自動車備品販売店（経営者）,販売量の動き,・最近の売上が前年を少々上回ってきており、先行きの希望が持てる状況になりつつある。
,,○,一般レストラン（経営者）,販売量の動き,・地元プロ野球チームの優勝の影響で地元景気は上向いていることに加え、衆議院選挙の結果からの影響も少なく、世の中が落ち着いている。
,,○,一般レストラン（経営者）,お客様の様子,・最近は家族層の利用も増え、例年に比べて来客数も増加している。天候不順が続いているが、稲刈りも順調なためこの先も来客数の増加が見込まれる。
,,○,観光型ホテル（営業担当）,来客数の動き,・秋の観光シーズン到来で来客数が増加している。
,,○,タクシー運転手,単価の動き,・衆議院選挙の影響で客の動きは良くない。
,,○,タクシー運転手,来客数の動き,・観光シーズンに入りイベントも開催され人の流れが良い。
,,○,通信会社（総務担当）,販売量の動き,・スマートフォンサービスの契約数が増加傾向にある。
,,○,設計事務所（経営者）,来客数の動き,・今年度の前半と比べて消費者からの耐震やリフォーム等の問い合わせが増えている。
