Ⅰ．景気の現状に対する判断理由等,,,,,
,東京都,○,乗用車販売店（販売担当）,お客様の様子,・車、建築、どの客を回っても人手不足のようである。需要が増えてきていることに加え、従事者が少ないこともあり、全体的に人手不足で忙しいということである。残業時間についてもいろいろと問題にされているが、仕事が増えてきていると聞いているので、景気は上向いている（東京都）。
,,○,乗用車販売店（店長）,販売量の動き,・決算月であり、販売量や客の動向にも顕著に表れている。
,,○,乗用車販売店（総務担当）,販売量の動き,・決算月で販売、サービスの需要が伸びている。
,東京都,○,高級レストラン（役員）,来客数の動き,・暑さが和らぎ、外出しやすくなったという客の声が多い（東京都）。
,,○,一般レストラン（経営者）,来客数の動き,・３か月前と比べると、９月は来客数も多少回復し、やや良くなっている。８月はかなり悪かったが、９月はケータリングの件数も増えて、いくらか順調に進んでいる。
,東京都,○,一般レストラン（経営者）,単価の動き,・値上げして４か月が経ったが、客単価はまだ伸びている。しかし、来客数は１年前と比べて100％程度であるため、来客数増まではいっていない（東京都）。
,東京都,○,その他飲食［居酒屋］（経営者）,お客様の様子,・当店の売上は伸びている。また、周囲の店の客入りや、飲食店街の人通りも多い（東京都）。
,東京都,○,都市型ホテル（スタッフ）,単価の動き,・インバウンドの増加により単価の向上につながっている（東京都）。
,東京都,○,旅行代理店（営業担当）,お客様の様子,・視察旅行等の案件が増加傾向にある。また、日程、日数も長くなる傾向にある（東京都）。
,東京都,○,タクシー運転手,それ以外,・９月に入っても猛暑が続き、台風の影響などで、前年同月に比べて営業収入が多いローカル駅などは、連日タクシー待ちの列ができている（東京都）。
,,○,タクシー運転手,お客様の様子,・最近、病院への送迎が多くなっている。聞けば、バス停まで歩くのが大変、また、電車に乗るのに、階段、エスカレーターの昇り降りが大変、タクシーだと家の玄関まで来てくれて、病院の前まで行ってくれるのが助かるとの声を多く耳にする。
,,○,ゴルフ場（経営者）,来客数の動き,・気温の安定とともに、来場者も増えてきている。
,,□,商店街（代表者）,販売量の動き,・８～９月にかけて一番感じるのは、来客数が少なくなったことである。販売量も契約までなかなか結び付かないところがあり、売上確保に苦心している。
,東京都,□,商店街（代表者）,それ以外,・クレジットカードの取扱高が、ここ１年ほどずっと前年同月を割っている。大幅にではないが、３％減などで微減が続いている。天候の影響もあるが、どうやら景況感は今一つ良くないというのが正直なところである（東京都）。
,,□,一般小売店［家電］（経理担当）,販売量の動き,・客は買物に慎重になっている。ＬＥＤ照明のキャンペーンを行っており、良い品物で、かなりお買い得になっているのだが、気持ちはあってもなかなか手が出ないという客が半数くらいである。
,,□,一般小売店［印章］（経営者）,来客数の動き,・来客数は非常に少ない。最近はインターネット通販に押され、全体的に低迷しているのではないか。
,東京都,□,一般小売店［家電］（経営者）,販売量の動き,・猛暑の夏が終わり、エアコン需要が一段落したが、テレビなどの他の商材の需要が余り伸びてこないので、悪くなりかけている（東京都）。
,東京都,□,一般小売店［文房具］（経営者）,販売量の動き,・新学期となり、学童用品を中心に販売は好調であるが、一般事務用品の販売量が伸びず、トータルでは横ばいとなっている（東京都）。
,東京都,□,一般小売店［茶］（営業担当）,販売量の動き,・相変わらず販売量が伸びず、新規客も増えていない。競争相手も多数あり、売り込みになかなか食い込めず苦戦している。かといって、販売価格を下げることまでは踏み切れない（東京都）。
,東京都,□,百貨店（売場主任）,販売量の動き,・全体的には台風の影響もあり、食料品は影響を受けている。今月下旬にリニューアルオープンし、今は非常に好調に推移しているので、来月は若干期待できるが、現状ではほぼ前年をやや割るくらいのペースで進んでいる（東京都）。
,,□,百貨店（総務担当）,お客様の様子,・月を通した天候不順、月末の台風の影響もあり、来客数が前年比で減少している。食料品等は堅調に推移しているものの、高額品の動きが鈍く、全体として苦戦している。
,東京都,□,百貨店（営業担当）,来客数の動き,・来客数が減っている。依然として客の価格への関心は高く、百貨店は厳しい状況にある（東京都）。
,東京都,□,百貨店（営業担当）,販売量の動き,・継続して消費をリードしているのは美術、宝飾品、時計など、富裕層による高額品とインバウンド需要である。けん引している訪日外国人は、最近の北海道胆振東部地震や台風の影響から、比較的影響の少ない首都圏でも減少しているなど、不安材料が多い（東京都）。
,東京都,□,百貨店（営業担当）,来客数の動き,・９月の都内基幹店の既存ベースでは、天候不順や台風、残暑等の影響があるなかでも、来客数が前年比103.2％と引き続き好調を維持している。また、インバウンドの免税売上実績も前年比103.4％と安定的に続伸している（東京都）。
,東京都,□,百貨店（販売促進担当）,来客数の動き,・訪日外国人客による売上の伸びは前月あたりから鈍化し、以前のように大幅に売上を伸ばし、全体をけん引するような勢いがなくなっている（東京都）。
,東京都,□,百貨店（販売促進担当）,単価の動き,・直近で、景況感に大きな変化は感じられない。インバウンド、富裕層の影響の大きい高単価商材の動きも変わらない（東京都）。
,,□,百貨店（副店長）,お客様の様子,・９月は台風や降雨日の多さ、気温の上下変動幅の大きさなどによる影響が大きく、婦人衣料を中心とした衣料関連商材への客の購買動向が非常に厳しく、好況感は感じられない。
,東京都,□,百貨店（営業企画担当）,販売量の動き,・９月については、月初に台風21号や北海道胆振東部地震の影響など特殊要素が多く、実態が見えない状況となっている。ただし、徐々に以前の状態に回復する傾向がみられることは安心材料かもしれない（東京都）。
,東京都,□,スーパー（販売担当）,単価の動き,・競合他社との価格競争もあり、平均単価が下がる傾向にある。客は、点数は前年以上に買ってくれているが、平均単価が下がっている分、客１人当たりの買上額が、なかなか前年まで達していない状況が見受けられる（東京都）。
,,□,スーパー（経営者）,来客数の動き,・９月に入り大分過ごしやすくなり、買物日和になってきたが、中旬以降天候が悪く、降雨も結構あり、売上がなかなか伸びない。売上が前年に追い付かないのは、来客数が減少していることが大きい。
,東京都,□,スーパー（店長）,単価の動き,・単価を下げないと販売量の増加がみられないので、現状の単価を維持するのが困難な状況になりつつある（東京都）。
,東京都,□,スーパー（営業担当）,単価の動き,・買上単価がようやく持ち直してきたものの、販売量がやや落ち込んでいるために、全体的に相殺されてしまっている（東京都）。
,,□,スーパー（仕入担当）,来客数の動き,・今月は北海道胆振東部地震の影響で、牛乳、ヨーグルト、チーズ等の乳製品が品不足となっている。青果物は相場高で単価が上昇したままである。
,,□,コンビニ（経営者）,単価の動き,・客は、必要以外の物は絶対に買わない。
,東京都,□,コンビニ（エリア担当）,来客数の動き,・３連休が２回あったことと、たばこ増税による駆け込み需要により、売上は前年より好調である。来客数は改善していないものの、単価上昇により売上は増加している。この傾向は半年ほど変わっていない（東京都）。
,,□,衣料品専門店（経営者）,販売量の動き,・今月も傾向に変化はなく、前年比の確保に苦戦している。特に、秋物ファッション衣料が悪い。
,東京都,□,衣料品専門店（店長）,単価の動き,・当社の扱う商品のうち比較的単価が手頃な物については、売上が堅調に推移している。しかし、呉服、毛皮等の高額品は、低調である（東京都）。
,東京都,□,家電量販店（店長）,販売量の動き,・猛暑による夏物商材の好調が前年比アップに寄与している店舗が多い一方、来客数が前年を割っている店舗も散見される。それらの店舗は、客単価アップに支えられている状況である。インバウンド需要については、災害の影響で低迷するが、中国の国慶節に伴って回復すると見込んでいる（東京都）。
,東京都,□,家電量販店（店員）,競争相手の様子,・競合他店を見ても市場が激しくなく、インターネット通信販売が景気への刺激になっている。実店舗は大きな動きが見えない（東京都）。
,東京都,□,家電量販店（経営企画担当）,販売量の動き,・９月の販売動向は、酷暑が終わり、客入りは増加傾向にある。しかし、北海道胆振東部地震、台風21号の影響で、該当地域のインバウンド需要はかなりマイナス影響を受けている。国内の消費需給は堅調で、前年の数字はクリアするものの、力強さは感じられない。首都圏の販売実績は、前年比108％、首都圏以外は100％のラップで推移している（東京都）。
,,□,乗用車販売店（経営者）,来客数の動き,・半期の決算月の割には、台風などの影響もあり、余り来客数が増えていない。
,,□,乗用車販売店（渉外担当）,販売量の動き,・販売量に顕著な変化がみられない。
,,□,その他専門店［ドラッグストア］（経営者）,販売量の動き,・気候変化が激しく、季節商材の取扱に苦慮している。
,,□,その他専門店［ドラッグストア］（経営者）,お客様の様子,・販売がやや不足している。
,東京都,□,その他専門店［貴金属］（統括）,来客数の動き,・季節の変わり目で、取扱商品も入れ替えているが、売上につながる来客数の増加は余りみられない（東京都）。
,東京都,□,その他小売［ショッピングセンター］（統括）,販売量の動き,・景気というより、酷暑の影響で必要に駆られて購入している感がある（東京都）。
,東京都,□,その他小売［ゲーム］（開発戦略担当）,販売量の動き,・「変わらない」と回答しているが、良い水準で変わらないという意味である。数年前と比べれば悪いが、ここ最近では好調が続いている（東京都）。
,東京都,□,高級レストラン（営業担当）,来客数の動き,・レストラン利用及び法人関連の宴席共に、来客数は前年同様に推移している（東京都）。
,東京都,□,高級レストラン（仕入担当）,単価の動き,・販売単価、来客数、売上、いずれも前年同期とほぼ変わらない（東京都）。
,東京都,□,一般レストラン（経営者）,来客数の動き,・近隣にタワーマンションが建設されたが、オーナーの半数は投資目的の外国人のため、人の回遊が増えない（東京都）。
,,□,一般レストラン（経営者）,お客様の様子,・３か月前と比べて、景気が上向いているとは決して思えない。客自体も飲む機会が減っているようである。また、注文数や宴会なども少なくなっているような気がする。加えて、高齢者が増えており、現役サラリーマン等の使う金額も減っている。
,東京都,□,一般レストラン（経営者）,来客数の動き,・８月の売上ダウンの要因が天候不順によるキャンセルだったのに比べて、今月はその客が少し戻っているような感じがする。通常３連休は売上が良くないのだが、今回は天候が良くなかったせいで、逆に来店する客が増え、前月の減少分をカバーしている（東京都）。
,東京都,□,観光型旅館（スタッフ）,お客様の様子,・前月と特に変わらない（東京都）。
,,□,都市型ホテル（スタッフ）,来客数の動き,・８月は過去最高の販売室数を記録したが、９月は連休もまばらになり、動きとしては物足りない。
,東京都,□,旅行代理店（従業員）,お客様の様子,・大きく変わるほどの動きはみられない（東京都）。
,東京都,□,タクシー運転手,お客様の様子,・連休が多いことに加え、夜の人の流れが全然ない（東京都）。
,,□,タクシー（団体役員）,来客数の動き,・平成30年度に前年比でプラスとなったのは５月のみである。６～８月は３か月連続で前年を割っている。特に企業の利用が減少しており、一般の経済指標に反して、末端まで景気回復しているとはまだいえない。
,東京都,□,通信会社（経営者）,お客様の様子,・客からのリアクションは相変わらず減少傾向にあるものの、こちらからのアプローチによる営業がやや持ち直してきているため、大きな変化はない（東京都）。
,,□,通信会社（営業担当）,単価の動き,・安価なサービスで契約する割合が増えており、付加価値よりも価格差での競争となっている。
,東京都,□,通信会社（局長）,販売量の動き,・ケーブルテレビ及びインターネット契約数が前年とほぼ変わらず、大きな変化はない（東京都）。
,東京都,□,通信会社（総務担当）,お客様の様子,・北海道胆振東部地震や異常気象等の影響で生鮮食料品等がいまだに高騰しており、その反動で他の消費が若干落ち込んでいる（東京都）。
,東京都,□,通信会社（経営企画担当）,お客様の様子,・商談内容に余り変化がみられない（東京都）。
,,□,通信会社（経理担当）,単価の動き,・客単価が10円未満で毎月下がり続けている。提供するサービスの種類を増やして売上が増加するよう努めている。
,東京都,□,観光名所（職員）,来客数の動き,・３か月前は梅雨の走りとなり、観光地としてはさほど人員が伸びない。しかしながら、９月も週末にかけての天候不良により、それほど変わらない（東京都）。
,,□,ゴルフ場（従業員）,それ以外,・前政権から現政権に変わり、公共工事が大量に発注され、景気は上向きになったとは思うが、それから約６年が経ち、それだけでは身の回りの景気回復までには至っていない。
,,□,ゴルフ場（従業員）,来客数の動き,・ゴルフ人口の逓減がみられるなか、安定的な来場者数で推移している。８月の来場者数は猛暑や台風の影響で減少したが、一時的な要因と考えている。
,東京都,□,パチンコ店（経営者）,来客数の動き,・客の入れ替わりがあったが、来客数は変わっていない。パチンコは新しい機械が出てきているが、人気は今一つである。スロットは、全く新しい機械が出てきていないので、厳しい状況になっている（東京都）。
,,□,その他サービス［保険代理店］（経営者）,来客数の動き,・ほとんどが既存客のため、来客数にさほど変化はないが、保証もない。
,,□,設計事務所（経営者）,お客様の様子,・３か月前と比べて、仕事内容や数が一切変わっていない。
,,□,設計事務所（経営者）,お客様の様子,・民間の受注量は低水準のまま推移している。民間が低調な分を官庁案件でしのいでいるのが現状である。
,東京都,□,設計事務所（所長）,お客様の様子,・計画物件の話が多少出てきてはいるが、ほとんど話のみで前へは進まない（東京都）。
,東京都,□,設計事務所（職員）,それ以外,・景気動向を左右する事象が見当たらない（東京都）。
,,□,住宅販売会社（経営者）,販売量の動き,"・当社は不動産デベロッパー業と総合建設業である。ここ２～３年住宅の売行きがかなり落ち込んでいる。それは国の政策にも原因があり、住宅取得のための生前贈与が、以前は3,500万円まであったが、現在では1,000万円である。住宅ローン減税も少なくなり、ローン金利が低くても住宅を取得するのが困難になっている。加えて、物価の上昇にもかかわらず、中小企業の給料が上がっていないため、ローンを組むのに将来不安が出ている。一方、請負工事では、公共工事はたくさんあるものの、発注価格が低く、赤字や不調になってしまうこともある。"
,,□,住宅販売会社（従業員）,販売量の動き,・契約数は３か月前と同じような流れになっている。
,,□,住宅販売会社（従業員）,販売量の動き,・特に状況の変化はみられない。
,東京都,□,その他住宅［住宅資材］（営業）,販売量の動き,・建築資材関連でスポット案件はあるものの、全体を押し上げるまでには至っていない（東京都）。
,,▲,一般小売店［傘］（店長）,来客数の動き,・目的のある人しか来店しない。酷暑、残暑で日中出歩く人が少ない。
,,▲,一般小売店［文具］（販売企画担当）,来客数の動き,・店頭売りは、降雨や暴風雨など天候不順が多かったために、来客数が極端に減っている。外商の大口案件も、北海道胆振東部地震や台風21号の影響で、関西国際空港や北海道などの案件受注が減っている。災害にまつわる理由で売上が極端に減るということが多々ある。
,,▲,一般小売店［茶］（営業担当）,販売量の動き,・今月は前年１日だった定休日を４日にし、イベントを組んだが、台風の影響もあり、休日分を取り戻すこともできず、来客数、売上共に減少している。
,,▲,百貨店（売場主任）,販売量の動き,・９月は、客単価は前年並みを維持しているものの、悪天候の日が多かったことが来客数に大きく影響し、販売数量が減少、結果としてどのカテゴリーも売上目標を達成できず、売上は前年未達となっている。リビングの高額品の動きが鈍く、特に厳しい状況である。
,東京都,▲,百貨店（営業担当）,来客数の動き,・隣接する施設が休業しているため、来客数が落ち込み、売上が厳しくなっている。衣料品及び家庭用品は前年と比べて２けた減少している。インバウンドについては、取引先の販売施策の影響もあり、化粧品のまとめ買いがないため、大きく落ち込んでいる。一方、食料品はほぼ横ばいと健闘している。商品単価は下がっており、来客数減、単価減という二重苦に陥っている。富裕層の購買動向に大きな変化はなく、高級時計やブランド品については前年をとらえている（東京都）。
,,▲,百貨店（店長）,販売量の動き,・天候不順による影響が大きい。米中の関税の問題など、国際関係も不安が募っている。株価の上昇や円安などプラスのポイントもあるものの、不透明感がより広がった１か月になったと考えている。
,東京都,▲,スーパー（経営者）,それ以外,・北海道胆振東部地震の影響により、商材が潤沢に供給されなくなっている（東京都）。
,,▲,スーパー（店長）,来客数の動き,・３か月前と比べて、売上達成数の推移が２～３％に下がっている。それに比例して来客数も減少している。来客数全体が減少傾向のなかで、比例して売上も落ちていっている。
,東京都,▲,コンビニ（経営者）,来客数の動き,・天候の影響もあるが、来客数が減っている（東京都）。
,,▲,コンビニ（経営者）,来客数の動き,・夏の猛暑から、台風その他の天候に左右されることも多かったが、客の購買意欲もやや低下している。
,,▲,コンビニ（経営者）,来客数の動き,・３か月前の気温が高い時期と比べると、今現在は若干来客数が減少してきている。特に、夜間の売上、来客数が落ちている。
,,▲,衣料品専門店（経営者）,お客様の様子,・台風、平成30年７月豪雨、北海道胆振東部地震等の影響により、野菜、ガソリンなど生活に直結する物の値上がりが目立ってきている。不安材料が増えているため、消費者心理が冷え込んでいる。
,,▲,乗用車販売店（店長）,お客様の様子,・景気が良さそうなのは一部の法人で、個人客の消費は伸びていない。また、高額商品が売れにくくなっている。
,,▲,住関連専門店（統括）,販売量の動き,・来客数、販売量共に今のところ伸び悩んでいる。
,,▲,高級レストラン（経営者）,販売量の動き,・来客数、売上共に前年を割っている。
,,▲,一般レストラン（経営者）,来客数の動き,・月の前半は30度以上の暑い日が続き、後半は台風を含め雨天が多かったので、今月は来客自体がかなり少ない。
,東京都,▲,一般レストラン（経営者）,来客数の動き,・今月は３連休が２週続いたので、家族連れや少人数の宴会が何件か同じ日に重なったりしたが、企業の大口の宴会予約は余り入らなかった（東京都）。
,,▲,都市型ホテル（スタッフ）,販売量の動き,・宿泊及びレストランは夏休みも終わり落ち着いているが、それなりに売上はキープできている。宴会については、月中の問合せがほとんどなく、３か月前と比べてかなり少ない。周辺のホテルも同様で、災害続きでの自粛や延期などが考えられ、厳しい状況となっている。
,,▲,旅行代理店（経営者）,単価の動き,・今月は異常気象による台風の接近や、北海道胆振東部地震などの発生で、客はそれぞれボランティアに出掛けたり、義援金を送ったりしているような状況なので、商売はやや悪くなっている。
,東京都,▲,旅行代理店（営業担当）,お客様の様子,・夏の暑さの影響で旅行の申込みが落ち込み、現在も下降気味である（東京都）。
,,▲,旅行代理店（営業担当）,販売量の動き,・販売量が減少している。
,東京都,▲,タクシー運転手,お客様の様子,・猛暑も落ち着き、本来の客の動きに戻っている。朝以外は、タクシーの景気を良くする動きが感じられない（東京都）。
,,▲,通信会社（営業担当）,販売量の動き,・売上の主力である複数のチャンネルサービスが競合する同種サービスの影響により、契約数が減少してきている。
