Ⅰ．景気の現状に対する判断理由等,,,,,
,,▲,スーパー（経営者）,競争相手の様子,・気温が上がらなかったり、悪天候が多かったりと、気象要因による影響が大きいが、既存店の実績は芳しくない。競合他社についても同様の傾向か、更に良くない状況となっているため、全体的に消費マインドも落ち込んでいると考えられる。
,,▲,スーパー（店員）,来客数の動き,・少し値上げが進んでいるほか、大型連休前で客の節約傾向が強まっているのか、安い物しか動かない。
,,▲,スーパー（企画）,販売量の動き,・前年の秋以降は、消費に減速感がある。衣料品や生活関連品の販売がなかなか上向かないなか、食料品でカバーしてきたが、その食料品もいよいよ厳しくなってきている。
,,▲,スーパー（社員）,競争相手の様子,・今春は食品メーカーから値上げが多く発表されている。当社も店頭価格の値上げを検討しているが、競合店の多くは余り値上げを行っていない。消費支出が伸び悩んでいるなか、厳しい価格競争が続いている。
,,▲,家電量販店（企画担当）,来客数の動き,・10連休明けの消費の冷え込みが予測される。消費税増税前の駆け込み需要も、キャッシュレス決済によるポイント還元策により、全体的に見込めない。
,,▲,乗用車販売店（経営者）,販売量の動き,・今月は大型連休の影響で、非常に販売効率の悪い月となっているため、売上は激減することが予想される。
,,▲,乗用車販売店（販売担当）,販売量の動き,・消費税増税の報道などで、購買意欲が高まると予想していたが、販売台数は伸び悩んでいる。輸入車はし好品であるため、価格よりも、どれだけ満足のいく商品を購入できるかが重視されている。
,,▲,住関連専門店（店長）,お客様の様子,・案件は増えているものの、前年の台風や豪雨による被害の補修といった、やむを得ない理由での案件がいまだに増えている。消費税増税の実施は不透明であるため、今購入するといった声もある。
,,▲,一般レストラン（経理担当）,単価の動き,・４月に入ってから、食料品を中心に値上げが進んでいる。外食業界でも10月の消費税増税を前に、緩やかな値上げを行っており、財布のひもが次第に固くなりつつある。
,,▲,観光型旅館（経営者）,来客数の動き,・ゴールデンウィークを控えているためか、全く動きがない。
,,▲,都市型ホテル（客室担当）,来客数の動き,・統一地方選挙の影響もあったのか、宿泊人数が増えず、客室稼働率も前年比で５ポイント下がっている。
,,▲,タクシー運転手,お客様の様子,・街の人出は多いが、手を挙げる人は日に日に少なくなっている。
,,▲,住宅販売会社（経営者）,販売量の動き,・不動産の売却が増えてきた一方、需要は減少している。
,,▲,その他住宅投資の動向を把握できる者［不動産仲介］（経営者）,それ以外,・消費動向は良くないと感じられる。
,,×,衣料品専門店（経営者）,お客様の様子,・４月は気温が上がらなかったこともあるが、来客数が少なく、トータルの売上は前年よりも減っている。もう少し気温の高い日があれば、売上も伸びていたはずである。
,,×,競輪場（職員）,単価の動き,"・改元やゴールデンウィークを目前にした買い控えの影響かどうかは分からないが、今月の客単価は8,944円で、３か月前の10,552円よりも下がっている。"
"企業
動向
関連

(近畿)",,◎,－,－,－
,,○,食料品製造業（従業員）,受注量や販売量の動き,・大型連休の影響で、得意先の在庫積み増し量が増え、受注量が増えている。その影響で売上も伸びている。
,,○,食料品製造業（営業担当）,受注量や販売量の動き,・ゴールデンウィークの影響で、月末にかけて飲料水の受注が少し増えている。
,,○,化学工業（経営者）,受注量や販売量の動き,・前年の実績はなかなか超えられなかったが、ここへきてようやく前年よりも良くなっている。
,,○,化学工業（管理担当）,受注量や販売量の動き,・４月の販売量は電気機械や電子部品、半導体、建設材料など、当社の全ての部門において、１月以降で最高の実績となっている。
,,○,金属製品製造業（経営者）,受注量や販売量の動き,・自動車関係では、電気自動車の特殊な部品などが増産傾向にある。
,,○,金属製品製造業（営業担当）,受注量や販売量の動き,・年始以降は減少傾向にあった出荷が、底打ちしたと感じる。
,,○,電気機械器具製造業（営業担当）,受注量や販売量の動き,・少しずつであるが、売上が増えてきている。
,,○,輸送用機械器具製造業（役員）,取引先の様子,・引き合いが具体化し、納期を含む仕様書の提示につながっている。さらに、広い領域にわたる引き合いがある。
,,○,建設業（経営者）,受注量や販売量の動き,・今月は受注も順調で、全体的に良くなってきている。特に、無電柱化の受注が堅調である。
,,○,金融業（営業担当）,取引先の様子,・製造業の中小企業に関しては、親会社の業況が上向き傾向にあり、協力会社の受注も増加傾向となっている。
,,○,広告代理店（企画担当）,それ以外,・改元に向けた期待感や、イベント等に伴う経費の支出、販促での臨時の投資が増えている。３か月前に比べて、客からの受注金額などの増加が感じられる。
,,○,その他サービス業［店舗開発］（従業員）,受注量や販売量の動き,・前年の度重なる災害の反動もあり、今年の花見客は、海外からの観光客も含めて非常に多かった。天候に恵まれたこともあり、ソフトドリンクやお茶、アルコールを中心に、飲料の売行きが好調である。
,,□,食料品製造業（経理担当）,受注量や販売量の動き,・10連休を控えているが、受注量は良くない。
,,□,パルプ・紙・紙加工品製造業（経営者）,受注量や販売量の動き,・連休前になって、少し受注量は増えているものの、大きな変化はない。
,,□,プラスチック製品製造業（経営者）,受注量や販売量の動き,・業界では、かなり努力をして現状を維持している。生産量が増えないなか、付随する仕事を取り込み、帳尻合わせを行っている。
,,□,一般機械器具製造業（経営者）,受注量や販売量の動き,・この数か月は、引き合いや販売量がやや減少傾向にある。この傾向は今後も変わらないと予想される。
,,□,電気機械器具製造業（宣伝担当）,受注価格や販売価格の動き,・エアコンや冷蔵庫、洗濯機、テレビなどの単価が高い商品では、前年よりも高額な商品が動いており、実売台数の前年比を販売額の前年比が上回っている。
,,□,建設業（経営者）,受注量や販売量の動き,・民間関係では予算は厳しいものの、好決算の企業による年度内での設備投資が活発であった。一方、公共工事関係では相変わらず価格競争が続いている。
,,□,建設業（経営者）,受注価格や販売価格の動き,・以前に比べて、住宅の新築を予定している客のうち、土地なしの比率が増えてきたと感じる。当然ながら、住宅に割くことができる予算は少なくなる。
,,□,輸送業（営業担当）,取引先の様子,・売上目標を達成できていない。
,,□,金融業（副支店長）,取引先の様子,・設備案件などの資金ニーズに変化はなく、景気も横ばいである。
,,□,金融業［投資運用業］（代表）,それ以外,・今のままでは消費税増税後の冷え込みが心配され、所得の二極化がますます顕著になりそうである。一方、消費税増税が中止になれば、消費は改善され、景気回復の起爆剤になるかもしれない。
,,□,不動産業（営業担当）,取引先の様子,・当市からの企業の撤退がいまだに続いている。事務所や社宅のニーズが減っているほか、賃料水準が下がり、空室率は上がっている。これらが景気回復の妨げとなっている。
,,□,広告代理店（営業担当）,取引先の様子,・期初であり、広告出稿の大きな動きはみられない。元号は改まるが、それほど大きなインパクトはない。
,,□,その他非製造業［機械器具卸］（経営者）,競争相手の様子,・変化がなく、前年と同じ状況が続いている。
,,□,その他非製造業［商社］（営業担当）,取引先の様子,・当社の代理店が、自身の主力事業に重点を置くために、販売活動を縮小している。
,,▲,繊維工業（団体職員）,受注量や販売量の動き,・受注の動きが良くない。
,,▲,電気機械器具製造業（経営者）,取引先の様子,・当社の取引先は、国内外の電機、自動車、電子部品業界の大手企業である。取引先の海外比率はまだ20％強で、基本的には国内の大手企業が多い。近年は電機、自動車の大手企業が海外企業に押されているため、その悪影響が出ている。電子部品の国内企業は健闘しており、その恩恵は受けているが、今後の推移は悪化が見込まれる。
,,▲,広告代理店（営業担当）,受注量や販売量の動き,・Ｗｅｂ媒体、紙媒体共に、広告は前年の売上を下回っている。
,,▲,その他サービス［自動車修理］（経営者）,受注量や販売量の動き,・大型連休前で注文が抑えられている。
,,×,繊維工業（総務担当）,取引先の様子,・最近は商品の仕入状況が変化している。当社は大きく変えていないが、他社は仕入れを大幅に減らしているようで、仕入先が納期や価格の面で便宜を図ってくれるようになっている。
"雇用
関連

(近畿)",,◎,＊,＊,＊
,,○,人材派遣会社（支店長）,求人数の動き,・現在のところ、改元への対応などで多忙を極めているが、受注のスピードが少し落ちているように感じる。
,,□,人材派遣会社（経営者）,求人数の動き,・新年度入り後は例年どおりの動きとなっているが、大型連休が控えているため、企業の雇用に関する動きは慎重となっている。関西での印刷関係の仕事は堅調であり、ゴールデンウィーク明けから本格化していくと予想されるため、それに対応している派遣会社は忙しくなりそうである。
,,□,人材派遣会社（役員）,求人数の動き,・企業の求人依頼は引き続き堅調に推移している一方、求職者の登録は減少傾向にあるため、人手不足が続いている。
,,□,人材派遣会社（営業担当）,採用者数の動き,・現状は、景気に良くも悪くも影響する材料が見当たらない。
,,□,新聞社［求人広告］（営業担当）,求人数の動き,・求人の減少が続いている。
,,□,新聞社［求人広告］（管理担当）,求人数の動き,・新年度を迎えたが、新聞広告の求人数に大きな動きはない。構造的に人手不足が続く、介護や建設、物流などの求人は多いが、全般的には縮小均衡の傾向が続いている。ちょうど新卒求人の時期で、こちらはインターネットが中心であるため、インターネット経由の求人は増加している。
,,□,職業安定所（職員）,求人数の動き,・求人数に変化はない。
,,□,職業安定所（職員）,求人数の動き,・新規求人数が微減傾向にある。
,,□,職業安定所（職員）,求人数の動き,・直近の近畿の新規求人数は３か月ぶりに減少した。製造拠点が集積している滋賀や京都で、製造業の求人が大きく減少したほか、サービス業でも減少している。一方、人手不足の声は引き続き多いため、このまま求人が減少傾向に転じるとは考えにくい。
,,□,学校［大学］（就職担当）,採用者数の動き,・学生からの内定取得報告がまだなのかもしれないが、若干スローダウンしている気がする。５月末で今年度の採用を終了すると宣言する企業も出始めている。
,,□,学校［大学］（就職担当）,雇用形態の様子,・新卒採用では、今までの一括採用の見直しが話題になっているが、医療系の採用はどちらかといえば通年型が多いため、大きな変化はないと予想される。
,,▲,人材派遣会社（営業担当）,周辺企業の様子,・取引の見直しが始まっている企業があり、派遣の活用が減少するといった動きもみられる。
,,▲,新聞社［求人広告］（担当者）,それ以外,・新年度になったが、改元や統一地方選挙の話題があっても、新聞広告や新聞求人に大きな変化はみられない。
,,▲,民間職業紹介機関（営業担当）,それ以外,・新卒学生の採用に関して、現状は人手不足が深刻であり採用は活発にみえるが、大手企業は全体的に採用数を減らしてきている。業種別には流通、サービス系の求人が多く、今までの全ての業種で多かった状況とは変わってきている。
,,▲,民間職業紹介機関（営業担当）,求職者数の動き,・派遣求人数は横ばいであるが、労働者派遣法の改正の影響で、直接雇用を希望する人が増えており、マッチングに苦戦している。
,,×,民間職業紹介機関（マネージャー）,求人数の動き,・大手企業による採用計画の見直しが増えており、特に海外経済の影響で、製造業による見直しが先行している。一方、中小企業では大手企業ほど見直しは進んでいない。そのほか、採用の基準の引上げで採用率も下がってきているなど、景気が悪くなったとはいえないが、様子見の段階ではあると感じる。
,,,,,
　９．中国（地域別調査機関：公益財団法人中国地域創造研究センター）,,,,,
,,,,,（－：回答が存在しない、＊：主だった回答等が存在しない）
分野,,景気の現状判断,業種・職種,判断の理由,追加説明及び具体的状況の説明
"家計
動向
関連

(中国)",,◎,競艇場（企画営業担当）,販売量の動き,・今月の中旬に開催した全国発売のレースで十分な売上を確保している。
,,○,一般小売店［印章］（経営者）,販売量の動き,・４月１日に新元号が発表され、元号訂正用のゴム印を中心に大量に売れている。
,,○,スーパー（店長）,販売量の動き,・３月後半～４月にかけては、花見等の行楽需要により販売点数が向上している。買物の中身もし好品などが増加し、短期的ではあるが上向いている。
,,○,スーパー（販売担当）,販売量の動き,・気温の上昇に伴い、中旬以降衣料品の売上が一気に上昇している。春夏商材が前年比110.3％と好調に推移する一方、家庭用品は前年比96.8％と、例年ほど新生活の買い足し需要がなく苦戦している。部門、商材により好不調の差は大きいが、総体的には前年比104.8％と良好である。
,,○,コンビニ（副地域ブロック長）,来客数の動き,・コンビニ業界全体でキャッシュレス化への取組が出遅れているチェーンがあるなか、当社が導入したバーコード決済方式が優位点になっている。
,,○,家電量販店（店長）,お客様の様子,・10月の消費税の引上げを見据えて、故障する前に購入を決断する客が増加してきている。特に、オール電化やリフォームのように高額で契約し、工事までに時間を要する商品はその傾向が顕著であり、施工業者のスケジュールはかなりひっ迫してきている。
,,○,自動車備品販売店（経営者）,販売量の動き,・少し景気が上向いており、今年に入って１～４月の売上が前年を上回り順調に推移している。
,,○,自動車備品販売店（経営者）,販売量の動き,・春の需要が前年同月比でも多く、良くなっている。今までより中級品以上の売行きが良く、客の節約傾向が緩和している。
,,○,その他小売［ショッピングセンター］（所長）,来客数の動き,・前年４月下旬に大幅改装を実施後、順調に来客数を伸ばしており、売上向上につながっている。
,,○,一般レストラン（経営者）,来客数の動き,・客単価は前年比95％前後で前年割れ傾向は変わらないが、来客数が新年度の時節柄であること、天候に恵まれて桜の開花期間が例年より長いこと、平成最後の月であることなどが追い風となり、来客数が前年までとは異なって、平日は115％、金曜日は135％と大きく伸びて全体を押し上げている。その要因として、予約が前年の140％以上あるとともに、その構成比が前年より６％上昇していることと、利用金額が明確で割り勘がしやすい食べ放題のコースが大きく伸びていることが大きい。
,,○,観光型ホテル（営業担当）,来客数の動き,・ゴールデンウィークに向けて先行予約が順調で来客数が伸びている。
,,○,都市型ホテル（企画担当）,来客数の動き,・桜シーズンに伴うインバウンドの客も増えており、ホテルの宿泊や物販店の売上も好調で域内経済に貢献している。一方で、法人企業関係の宴会利用などはやや低迷しており、接待利用などが減少傾向にある。
,,○,都市型ホテル（総支配人）,来客数の動き,・国内は前年並みで推移するものの、桜観賞を含んだインバウンドが堅調に推移しており全体をけん引している。
,,○,旅行代理店（経営者）,お客様の様子,・５月から元号も改まるため、景気に対する客の期待値も高くなってきていることから、やや良くなっている。
,,○,旅行代理店（支店長）,販売量の動き,・10連休があるため宿泊を始め４～５月分の旅行関連商品の売上が上昇し良い状況である。
,,○,タクシー運転手,それ以外,・前半は選挙があり夜の動きが悪くなったが、後半は歓送迎会が始まり天候も良かったので、外出する人も結構いる。来月から元号が改まることもあり、祝事景気に期待が持てる。
,,○,タクシー運転手,来客数の動き,・新年度に入って人の動きが活発になってきている。
,,○,通信会社（企画担当）,販売量の動き,・当月が年度替わりなので、モバイル系を中心に引き合い数と契約数が多い。
,,○,テーマパーク（営業担当）,来客数の動き,・暖かい日が続き、桜、チューリップと良い開花状態が続いていることに加え、週末の天候も良く客の動きが良い。
,,○,テーマパーク（業務担当）,来客数の動き,・春のイベントも始まり、多くの花々も咲きそろい、週末だけでなく平日の団体利用も含めて来園者数が多い。
,,○,観光名所（館長）,来客数の動き,・来館者数が増えている。
,,○,ゴルフ場（営業担当）,来客数の動き,・４月に入り、予約の動きが良くなっているが、単価は低下している。
,,○,設計事務所（経営者）,販売量の動き,・僅かだが消費税の増税前の駆け込みがある。６か月間ほどは受注消化のために景気が上向くことに期待が持てるが、その後の落ち込みが心配される。
,,○,設計事務所（経営者）,お客様の様子,・春先から建築材料のコスト高が目に付くようになっている一方、消費税の引上げ前の駆け込み注文は余り見受けられないが、リフォーム等客からの受注はきている。
,,○,住宅販売会社（営業担当）,販売量の動き,・引き合い案件等が増えている。
,,□,商店街（理事）,お客様の様子,・４月に食料品などの値上げがあり、家計にも多少の影響があるが、客も慣れがあるため、ある程度の価格変動は仕方ないと受け止めている。そのため、さほど大きな変化にはなっていない。
,,□,商店街（代表者）,販売量の動き,・今年はシーズンものが悪化しており、客単価も低下している。
,,□,商店街（代表者）,お客様の様子,・客はできるだけ安い物を買い求め、無駄な物は一切買わない状況である。
,,□,商店街（代表者）,お客様の様子,・10連休に備えての買い控えで一般的な消費が厳しい状況にあるため、景気は３か月前と同様に余り良くない。
,,□,一般小売店［洋裁附属品］（経営者）,お客様の様子,・大型店の出店もあって、来客数が次第に減少している。
,,□,一般小売店［靴］（経営者）,来客数の動き,・来客数、売上共に横ばいである。
,,□,百貨店（営業担当）,お客様の様子,・４月に入り、来客数は前年を10％程度下回っているが、若年層の来客数は前年を10％程度上回っている。半袖物など他の季節向け商材が若年層には売れているが、ミセス層では売上が前年実績を10％下回っており、今着るものを今求める動きが多い。その一方で、客単価は若年層もミセス層も上昇している。
,,□,百貨店（売場担当）,販売量の動き,・100万円を超える高級ブランド品の売上があるほか、会社の周年記念品を受注している。
,,□,百貨店（売場担当）,お客様の様子,・ラグジュアリーブランドや高額バッグの動きはよいが、シーズン雑貨や婦人靴の動きは悪い。
,,□,百貨店（売場担当）,お客様の様子,・近隣で関係店の閉店があり、集客施策の実施によって前年実績を達成できて当たり前の状況にあるにもかかわらず、目標までは程遠く景気の改善感はない。
,,□,スーパー（店長）,来客数の動き,・ここ半年以上にわたって来客数が前年の98％を少し下回る状況で推移している。
,,□,スーパー（店長）,来客数の動き,・来客数の前年割れが続いており、回復の傾向がみられない。
,,□,スーパー（店長）,来客数の動き,・来客数は前年比99.8％、売上は同102％で推移しており、ＱＲコード決済のポイントキャンペーンなどで購入金額は一時的に少し上昇している。
,,□,スーパー（総務担当）,販売量の動き,・客単価はさほど変わっていないが、購入点数が減少している。
,,□,スーパー（販売担当）,販売量の動き,・客単価、来客数に大きな変化はない。
,,□,スーパー（管理担当）,来客数の動き,・景気には余り変化がなく、客の節約志向は続いている。
,,□,スーパー（財務担当）,販売量の動き,・メーカーの値上げによる１品単価の上昇により、１人当たり購入金額は上昇しているが、買上点数の減少と来客数の前年割れにより、既存店売上が前年を下回る状況が続いている。
,,□,衣料品専門店（経営者）,お客様の様子,・特に中小企業勤務の客から良い話を聞かない。
,,□,家電量販店（店長）,来客数の動き,・例年に比べて10％ほど来客数が減少しており、増加する気配が全くない。
,,□,家電量販店（販売担当）,販売量の動き,・来客数は減少しているが、購入率や金額は前年並みである。
,,□,家電量販店（企画担当）,お客様の様子,・来客数は減少しているが、消費税の引上げ前の駆け込み需要が始まっているので、景気に変化はない。
,,□,乗用車販売店（店長）,お客様の様子,・購入を検討中の客であっても、購入見送り意識が強い。
