Ⅰ．景気の現状に対する判断理由等,,,,,
,,□,新聞社［求人広告］（管理担当）,求人数の動き,・求人数に大きな変化はみられず、期待はできないが、改めて大きな落ち込みも発生していない。求人数は今が底で、これからは少しずつ改善すると考えていたが、新型コロナウイルスが景気にもたらした傷は深く、しばらく上向くことはないと予想される。
,,□,職業安定所（職員）,求人数の動き,・新規求人数は８月に入ってやや持ち直したが、依然として前年比で20～30％程度の減少傾向で推移している。特に、飲食・宿泊業、卸売・小売業、医療・福祉業、製造業などの落ち込みが激しい。
,,□,職業安定所（職員）,求人数の動き,・新規求人数は、前年比で10か月連続の減少となっている。電機大手ですら仕事が減少し、自宅待機の社員がたくさんいる状況なので、下請業者まで仕事が回って来ないという事業主の声を聞く。
,,□,職業安定所（職員）,求職者数の動き,・７月は有効求人数が2.9％増と７か月ぶりに増加に転じたが、有効求職者数は8.0％増と３か月連続で増加したため、有効求人倍率は1.17倍と７か月連続で低下している。
,,□,職業安定所（職員）,求人数の動き,・小売業や飲食業はやや回復しているが、製造業のほか、特に建設業の落ち込みがひどい。
,,□,民間職業紹介機関（営業担当）,採用者数の動き,・３か月前の、緊急事態宣言中で全く動きのなかった５月時点と比べると、新卒採用市場でも選考試験や就職イベントへの出展申込みなどがあり、上向きに感じる。ただし、月全体や前年比でみると、これまでの売手市場とは異なり厳選採用の動きが強く、採用者数を絞る傾向にあるため、プラスマイナスゼロと考えられる。
,,▲,人材派遣会社（経営者）,求人数の動き,・お盆明けから、９月末までの派遣契約の方針などが、具体的になってきた。予想どおり約50％が終了し、10月からの新規案件も先細りとなっている。そのなかで、テレワークを中心とした案件が出てきているほか、在宅勤務が中心の企業に対しては、今までと違って人材も比較的集めやすくなっている。今後もこのような傾向が続きそうである。
,,▲,学校［大学］（就職担当）,それ以外,・政治情勢のほか、今後２～３か月の新型コロナウイルスの感染拡大状況が不透明である。
,,×,新聞社［求人広告］（担当者）,それ以外,・新聞広告の出稿状況をみると、関西企業からの出稿は、新型コロナウイルスの影響による業績の悪化で、全く動きがない。
,,×,学校［大学］（就職担当）,求職者数の動き,・就職情報サイトなどで、採用活動を継続していると広報している会社が、実際は採用活動が終了しているケースが多くなっている。
,,,,,
　９．中国（地域別調査機関：公益財団法人中国地域創造研究センター）,,,,,
,,,,,（－：回答が存在しない、＊：主だった回答等が存在しない）
分野,,景気の現状判断,業種・職種,判断の理由,追加説明及び具体的状況の説明
"家計
動向
関連

(中国)",,◎,家電量販店（店長）,販売量の動き,・例年であれば８月の売上はお盆までがピークでそれ以降は減少していくが、今年はお盆以降の連日の猛暑と新型コロナウイルスの第２波の影響等でエアコンを中心とした白物家電が大幅に伸長し、全体でも前年比110％となっている。
,,◎,乗用車販売店（営業担当）,来客数の動き,・新車購入やサービスメンテナンスの来客数が増加している。
,,◎,テーマパーク（営業担当）,来客数の動き,・休業で来客がなかった３か月前と比べると良くなっている。
,,○,商店街（理事）,お客様の様子,・景気が良くなっているというよりは、３か月前よりも人々が新型コロナウイルスに慣れてきていて、心理面で若干好転している。
,,○,一般小売店［靴］（経営者）,お客様の様子,・来客数は多くないが、インターネットからの問合せが微増している。
,,○,百貨店（経理担当）,販売量の動き,・回復傾向にあった売上も新型コロナウイルス感染症によるクラスターの発生により再び停滞している。部門別では、ほぼ前年並みの売上の部門もあるが、前年の70～80％台の売上の部門が多く、全体では売上は前年の70％弱くらいとなっている。特に観光部門はＧｏ　Ｔｏ　Ｔｒａｖｅｌキャンペーンなどが行われているが、売上は前年の30％程度までしか回復していない。
,,○,百貨店（営業担当）,販売量の動き,・３か月前よりはやや良くなっているが、来客数が前年と比べ30％減少し、前年の売上に全く届かない状況である。
,,○,百貨店（売場担当）,お客様の様子,・３か月前は新型コロナウイルス対策のための自粛の真っただ中であり、そのときの状況からすると、客足も売上も大幅に改善している。新型コロナウイルスの影響が続いていることで、逆に県外への移動が少なくなり、週末を中心に来客数が多くなっている。
,,○,百貨店（営業企画担当）,来客数の動き,・新型コロナウイルスの影響が少しずつ減少しているが、イベント等の中止もあり、全体的に景気はまだまだ回復していない。
,,○,百貨店（外商担当）,お客様の様子,・３か月前よりはやや良くなっているが、新型コロナウイルスの影響で、前月と比べると来客数が減少している。
,,○,スーパー（店長）,来客数の動き,・３か月前と比べ、来客数が増加している。
,,○,家電量販店（企画担当）,単価の動き,・来客数は前年を下回っているが、購入単価が高いため、売上は前年を上回っている。
,,○,乗用車販売店（営業担当）,来客数の動き,・新型コロナウイルスが落ち着き、新型コロナウイルス対策の徹底で客の受入体制が整ってきたことから、前年並みの来客数を確保できるようになってきている。
,,○,その他小売［ショッピングセンター］（管理担当）,お客様の様子,・３か月前と比べると良くなっているが、前年と比べると、必ずしも良くはなっていない。来客数は回復してきているが、アウトドア用品など最近流行している商品を除くと、消費意欲は向上していない。
,,○,一般レストラン（店長）,お客様の様子,・盆明けより新型コロナウイルスの影響が少しずつ薄れてきているが、来客数は前年の半分程度である。ただ、５月頃にはなかった団体客がちらほら入るようになり、徐々にではあるが回復傾向にある。
,,○,観光型ホテル（副支配人）,来客数の動き,・Ｇｏ　Ｔｏ　Ｔｒａｖｅｌキャンペーンの効果もあり、宿泊の予約が順調に入っている。
,,○,都市型ホテル（企画担当）,来客数の動き,・７月末からのＧｏ　Ｔｏ　Ｔｒａｖｅｌキャンペーンの開始により、客室の稼働率は10％台から40％近くまで上昇している。ただ、お盆期間の集客は、東京のＧｏ　Ｔｏ　Ｔｒａｖｅｌキャンペーン対象除外や新型コロナウイルスの影響などで期待したほど伸びていない。レストランもランチを利用する客がやや増加しているものの、夜のお酒を伴う食事やグループ客の利用が低迷しており、宴会需要は全く動いていない。
,,○,都市型ホテル（総支配人）,来客数の動き,・新型コロナウイルスの影響が続いているが、Ｇｏ　Ｔｏ　Ｔｒａｖｅｌキャンペーンの開始で僅かながら直近の予約が動き出している。ただ、前年と比べると依然として大幅な落ち込みとなっている。
,,○,タクシー運転手,お客様の様子,・乗車率が夜は40％、昼は70％ぐらいまで戻っている。
,,○,通信会社（総務担当）,販売量の動き,・新規通信加入数が好調である。
,,○,ゴルフ場（営業担当）,来客数の動き,・今月はコンペが減少しているが、１組単位の予約が増加している。入場者数は増加しているが、単価が下がり、売上は減少している。
,,○,競艇場（企画営業担当）,販売量の動き,・インターネット投票の売上が好調である。
,,○,住宅販売会社（営業担当）,来客数の動き,・来客数が増加してきている。
,,□,商店街（代表者）,来客数の動き,・暑さのためなのか、景気が悪化しているからなのか、人出が少なく、来客数も減少している。
,,□,商店街（代表者）,来客数の動き,・新型コロナウイルスの影響で、消費者マインドが良くならず、また、全ての行事が中止になっているので、消費が非常に落ち込んでいる。
,,□,一般小売店［食品］（経営者）,販売量の動き,・食品スーパーにおいては、新型コロナウイルスの影響で売上が堅調に推移している。ただ、８月のお盆期間においては、帰省の自主規制があり、商材の売行きが不振を極めている。
,,□,一般小売店［洋裁附属品］（経営者）,お客様の様子,・猛暑で人通りも少なく、昼間の暑い時間はほとんど客を見掛けない。
,,□,百貨店（営業担当）,お客様の様子,・新型コロナウイルスが一旦落ち着いていたが、地域内でも新型コロナウイルスの感染者数が増加したことにより、来客数の減少が続いている。また、地方の店舗ということもあり、例年ならばお盆期間中は客でにぎわうが、帰省客も少なく、全体的に来客数が減少している。
,,□,百貨店（売場担当）,販売量の動き,・ブランドの宝石や洋服等が売れており、売上は前年並みとなっている。
,,□,スーパー（店長）,来客数の動き,・最近２～３か月は来客数がほぼ前年を上回っている。買物の中身はほとんど変化がない。
,,□,スーパー（店長）,来客数の動き,・新型コロナウイルスの影響で、大型商業施設でなく、地元のスーパーで買物を済ませる傾向があるため、来客数は前年並みを維持している。
,,□,スーパー（店長）,来客数の動き,・来客数の減少傾向が続き、 回復の兆しがみられない。
,,□,スーパー（総務担当）,販売量の動き,・お盆の帰省客の不調、日中の暑さ、野菜や果物の値上がり等により、客単価は上昇しているが、来客数は減少している。
,,□,スーパー（販売担当）,お客様の様子,・従来であれば、市の中心地や大型ショッピングモールに集中していた客が人混みを避けるようになっている。郊外型路面店という立地が集客上優位に働き、例年になく売上が好調に推移しており、売上は前年比144％、来客数は前年比165％となっている。
,,□,スーパー（販売担当）,来客数の動き,・来客数、客単価、買上点数のいずれも大きな変化はない。
,,□,スーパー（管理担当）,販売量の動き,・飲食業や観光業等が厳しく、景気は全般的には良くないが、食品業界については、新型コロナウイルスの特需により売上、利益共に増加している。
,,□,スーパー（業務開発担当）,販売量の動き,・新型コロナウイルスの影響で内食化が続いているため、野菜等の価格高騰にもかかわらず、販売量は変わっていない。ただ、お盆期間は帰省客の減少で、総菜のオードブルや焼き肉セットなどの大型商品の販売量が大幅に減少している。
,,□,スーパー（財務担当）,販売量の動き,・新型コロナウイルスの影響で客の来店頻度は減少しているが、まとめ買いにより買上点数が増加し、既存店の売上は前年を上回っている。
,,□,コンビニ（エリア担当）,来客数の動き,・来客数が緊急事態宣言前の状態に戻りつつある。
,,□,衣料品専門店（代表）,来客数の動き,・新型コロナウイルスの第１波が過ぎ、特別定額給付金が給付された頃は客足もかなり戻っていたが、感染者数が再び増加するにつれて来客数は減少している。
,,□,乗用車販売店（店長）,来客数の動き,・来客数はお盆明けに比べやや増加しているものの、新型コロナウイルスや異常気象の影響もあり、前年の75％となっており、客の動きは依然として鈍くなっている。
,,□,乗用車販売店（営業担当）,来客数の動き,・４～６月より来客数は増加しているが、前年比では増加していない。
,,□,自動車備品販売店（経営者）,販売量の動き,・新型コロナウイルスが終息しない限り景気は元に戻らない。景気は６～７月に一旦元に戻りつつあったが、新型コロナウイルスの患者数の増加に伴い、失速状態にある。
,,□,その他専門店［和菓子］（経営者）,来客数の動き,・新型コロナウイルスの影響が継続している。
,,□,その他専門店［土産物］（経営者）,来客数の動き,・個人客はそこそこ動いているが、観光バスなどの団体客が全くいないので、全体の来客数は足りない。また、３密対策に人も経費も掛かり大変である。
,,□,その他小売［ショッピングセンター］（支配人）,販売量の動き,・緊急事態宣言解除後、６～７月と売上、来客数共に増加傾向にあったが、新型コロナウイルスの第２波の影響で７月下旬から外出自粛ムードが高まり、夏休み、お盆時期の旅行や帰省の自粛モードに拍車が掛かったため、現在は景気が回復する兆しがない状況である。
,,□,高級レストラン（事業戦略担当）,来客数の動き,・Ｇｏ　Ｔｏ　Ｔｒａｖｅｌキャンペーンの影響もほとんどない。
,,□,観光型ホテル（営業担当）,販売量の動き,・Ｇｏ　Ｔｏ　Ｔｒａｖｅｌキャンペーンの開始で売上の増加を見込んでいたが、大幅な増加はない。
,,□,都市型ホテル（企画担当）,来客数の動き,・新型コロナウイルスの感染防止対策を十分に行っているが、会食等への警戒が強いため、利用者数が伸びてこない。
,,□,旅行代理店（経営者）,お客様の様子,・Ｇｏ　Ｔｏ　Ｔｒａｖｅｌキャンペーンの効果が出てきていない。
,,□,旅行代理店（支店長）,販売量の動き,・Ｇｏ　Ｔｏ　Ｔｒａｖｅｌキャンペーンが開始したが、販売の柱となる団体需要がまだ回復しておらず、また個人需要も思った以上に伸びていない。
,,□,タクシー運転手,お客様の様子,・猛暑の影響で、病院や買物のための利用客が出てきている。ただ、新型コロナウイルスの影響で、夜の利用客数は変化がない。
,,□,タクシー運転手,お客様の様子,・新型コロナウイルスが終息せず、客の動きが良くなっていない。
,,□,通信会社（経理担当）,お客様の様子,・新型コロナウイルスの影響で外出を自粛している客が多いため、家でのテレビやネット環境が欠かせないものとなっており、景気は大幅に落ち込むことなく以前と変わらない状況が続いている。
,,□,通信会社（工事担当）,お客様の様子,・新型コロナウイルスの影響が続くため景気は変わらない。
,,□,テーマパーク（業務担当）,来客数の動き,・例年も夏季は閑散期であることから、来園者の減少はそれほど目立ったものになっていない。ただ、例年も比較的多くの来園があるお盆期間については、帰省の自粛、夏休み期間の縮小、イベント中止等の影響もあり、来園者の減少が顕著となっている。
,,□,テーマパーク（管理担当）,お客様の様子,・新型コロナウイルスの第２波の影響で景気は変わらない。
,,□,観光名所（館長）,来客数の動き,・新型コロナウイルスの影響でＧｏ　Ｔｏ　Ｔｒａｖｅｌキャンペーンの効果がほとんどない。
,,□,設計事務所（経営者）,来客数の動き,・購買に対して前向きな客と非常に慎重な客と二極化しているため、全体では景気が上昇するまでには至っていない。ただ、土地や建物の動きは徐々に上向いている。
,,□,設計事務所（経営者）,来客数の動き,・新型コロナウイルスの影響で引き合いが低迷している状況が続いている。
,,□,設計事務所（経営者）,お客様の様子,・例年に比べ、木造住宅耐震補強工事やリフォームなどの民間からの発注が少なく、低水準で推移している。
,,□,住宅販売会社（従業員）,お客様の様子,・新型コロナウイルスの終息のめどが立たず、先行きが不透明なことから、依然として客が慎重になっている。
,,▲,商店街（代表者）,単価の動き,・新型コロナウイルスの影響で売上がかなり落ち込んでおり、非常に厳しい状況である。
,,▲,商店街（代表者）,お客様の様子,・商店街の人通りも来客数も少ない。
,,▲,一般小売店［茶］（経営者）,販売量の動き,・今月に入り大型店からのお中元商戦の商品の返品が増加している。相変わらず個人消費が必要最低限に抑えられている。
,,▲,一般小売店［印章］（経営者）,来客数の動き,・新型コロナウイルスの影響や客が通販に流れていることもあり、来客数が減少している。
,,▲,百貨店（営業担当）,来客数の動き,・新型コロナウイルスの影響や気温が高いことなどにより、来客数が大幅に落ち込んでいる。
,,▲,スーパー（店長）,来客数の動き,・お盆の帰省客が前年に比べ大幅に減少したこともあり、８月の来客数は前年比87.5％、お盆期間中のオードブルや手土産などの売行きも鈍く、売上は前年比94.5％となっている。
,,▲,コンビニ（エリア担当）,来客数の動き,・新型コロナウイルスの影響で来客数が伸び悩んでいる。
,,▲,コンビニ（副地域ブロック長）,来客数の動き,・宅配での食事の増加など生活スタイルが変化し、夜から朝に掛けての来客数が大幅に減少している。
,,▲,コンビニ（支店長）,お客様の様子,・無駄な外出や外食を控える生活様式が定着しており、人の動きが少なくなっている。
,,▲,衣料品専門店（経営者）,それ以外,・新型コロナウイルスの影響で仕入れができない状況であるが、帯問屋などの仕入先も何軒かが廃業している。
,,▲,家電量販店（販売担当）,来客数の動き,・特別定額給付金などの効果もなくなり、景気はやや悪くなっている。
,,▲,自動車備品販売店（経営者）,販売量の動き,・新型コロナウイルスによる緊急事態宣言解除後も新型コロナウイルスの患者数が増加するなか、来客数や販売量が非常に少ない。店舗内をソーシャルディスタンス化しているが、来客数や販売量がなかなか元に戻らない。
,,▲,一般レストラン（経営者）,来客数の動き,・飲食店舗として、新型コロナウイルス感染予防を最大限実施しているが、客が警戒して来店自体を控えている状況である。一方で、持ち帰り比率が伸びており、唯一希望の持てる部分であるが、店舗として積極的な集客イベントを自粛しているので売上、利益共に厳しい状況である。
,,▲,タクシー運転手,来客数の動き,・まだまだ夜の乗車率が悪い。
,,▲,放送通信サービス（総務経理担当）,お客様の様子,・特別定額給付金などの一時的な家計補填の影響も考えられるので、新型コロナウイルスの影響を単月で判断するのは難しいが、利用料収入の観点からみると、延滞件数や延滞金額は低調に推移している。
,,▲,通信会社（営業担当）,お客様の様子,・廃業、休業、企業倒産により生活が急激に困窮状態に入った人とさほど変化がない人に分かれているが、消費が落ち込むことで、景気全体に影響が出始めている。
,,▲,通信会社（企画担当）,お客様の様子,・既存契約の解約といった動きはないが、新規契約やサービス更新による上位移行の動きが止まっている。
,,▲,観光名所（館長）,来客数の動き,・お盆以降は夏休みの短縮もあり、来館者数が減少している。
,,▲,美容室（経営者）,来客数の動き,・祭りや花火大会などのイベントが中止になり、売上が半減している。
,,×,商店街（代表者）,来客数の動き,・景気は若干上向き傾向にあったが、新型コロナウイルス感染症のクラスター発生以降、また悪くなってきている。
,,×,一般小売店［眼鏡］（経営者）,お客様の様子,・年配者が不要な外出や人の集まる場所での買物を控えているため、来客数が減少している。
,,×,コンビニ（エリア担当）,販売量の動き,・量販店やスーパーの取引額がかなり落ち込んでいる。
,,×,住関連専門店（営業担当）,来客数の動き,・今までも来客数は少なかったが、地元と隣の市でクラスターが発生し、来客数がますます減少している。
,,×,その他専門店［布地］（経営者）,来客数の動き,・新型コロナウイルスの影響や、梅雨が明けた途端、かんかん照りとなっていることで、人出が少なくなっている。
,,×,その他専門店［時計］（経営者）,来客数の動き,・新型コロナウイルスと猛暑の影響で来客数が減少している。
,,×,一般レストラン（経営者）,来客数の動き,・新型コロナウイルスの影響で人の動きが極端に悪くなっている。
,,×,一般レストラン（経営者）,単価の動き,・夏休みの短縮やお盆休み期間の帰省の自粛要請もあり、８月の２～３週目の売上が前年の65％を下回っている。予約は前年の60％を下回っており、１組当たりの客単価も前年と比べ2000円ほど低下している。時間帯別では21時以降の売上が前年の40％を下回っている。休日の前日の来客数は前年の80％を保っているが、その他の日の来客数は前年の55～70％まで落ち込んでいる。
,,×,スナック（経営者）,来客数の動き,・地方は余り関係ないと思うのだが、毎日毎日、都市部の新型コロナウイルスの感染者数が公表され、夜の街が感染源のような報道をされることで大打撃を受けている。ほとんど人出がない状況である。
,,×,その他飲食［サービスエリア内レストラン］（店長）,来客数の動き,・新型コロナウイルスの影響で景気は悪くなっている。
,,×,通信会社（広報担当）,お客様の様子,・客が新しいものを買うよりも処分、整理の方向に向かっている。
,,×,美容室（経営者）,来客数の動き,・客が外出を控える傾向が続いており、客の来店サイクルが長くなっている。
,,×,住宅販売会社（営業所長）,お客様の様子,・新型コロナウイルスの影響で、景気の先行きや今後の収入見通しに対する不安が高まり、景気は悪くなっている。
"企業
動向
関連

(中国)",,◎,輸送用機械器具製造業（経営者）,受注量や販売量の動き,・地元完成車メーカーの生産が回復基調にあることから、景気は良くなっている。
,,◎,輸送用機械器具製造業（経営企画担当）,受注量や販売量の動き,・３か月前に大幅に落ち込んでいた主要客からの受注量が大幅に回復している。
