Ⅰ．景気の現状に対する判断理由等,,,,,
,,▲,化学工業（経営者）,受注量や販売量の動き,・かなり回復した部門と予想外に落ち込みが大きかった部門があり、平均するとやや悪い状況である。
,,▲,金属製品製造業（経営者）,それ以外,・当社の受注は前年比７割である。先日、東京へ特急電車で行ったが、半分以下の乗車率であった。帰りは夕方であったが、１車両に５～６人しかいない。地元主要駅の居酒屋は金曜日でも客入りは２割とのことである。
,,▲,電気機械器具製造業（経営者）,受注量や販売量の動き,・新型コロナウイルスの影響で、現状、受注量は２割ほど減っている。当社は10～12月が繁忙期になるが、注文内容をみると、前年の半分くらいの受注量しかない。かなり厳しい状況である。
,,▲,不動産業（管理担当）,受注量や販売量の動き,・取引先の収益悪化で、受託している清掃の維持管理費を減額したため、売上が減少している。新型コロナウイルスの感染再拡大により、一部で清掃頻度、資材消費は増えているものの、受託金額は変わらないため、収益を押し下げる原因となっている。
,,▲,司法書士,受注量や販売量の動き,・少しずつ悪くなっている。
,,×,－,－,－
"雇用
関連

(北関東)",,◎,－,－,－
,,○,人材派遣会社（社員）,求人数の動き,・８月下旬から派遣の依頼数が前年並みに回復してきているため、やや良くなっている。
,,○,人材派遣会社（社員）,周辺企業の様子,・Ｇｏ Ｔｏ Ｔｒａｖｅｌキャンペーンの影響もあると思うが、付き合いのある宿泊施設等の稼働は、３か月前と比べるとやや戻っている。ただ、観光地の当地で新型コロナウイルスの感染者が出たため、キャンセルが相次いだということもあり、まだ伸び悩んでいる。
,,□,人材派遣会社（経営者）,求人数の動き,・小中学校等の夏休み期間も終わったが、休み期間にかなり外出したようで、スーパー、大型店等の購買はみられた。引き続き、建設関係の受注、着工等は厳しいが、予算の関係上、建て直すところは建て直し、道路補修工事も進められている。暑さの影響がかなり出ているようである。
,,□,人材派遣会社（経営者）,求人数の動き,・現状、仕事がなくて困っている。これから先が心配である。
,,□,人材派遣会社（管理担当）,求人数の動き,・新型コロナウイルスの影響で、求人数は低迷したままである。
,,□,職業安定所（職員）,周辺企業の様子,・製造業の休業が増加しているものの、飲食店は通常に戻りつつある。
,,▲,職業安定所（職員）,求人数の動き,・有効求人数は前年同月比28.6％減少し、13か月連続で減少している。新規求人数は前年比27.4％の減少となっている。
,,▲,学校［専門学校］（副校長）,求人数の動き,・新型コロナウイルスの影響で、各企業が求人をちゅうちょしている。今後はこうした状況の変化を見ていきたい。
,,×,＊,＊,＊
,,,,,
　４．南関東（地域別調査機関：株式会社日本経済研究所）,,,,,
,,,,,（－：回答が存在しない、＊：主だった回答等が存在しない）
分野,,景気の現状判断,業種・職種,判断の理由,追加説明及び具体的状況の説明
"家計
動向
関連

(南関東)",東京都,◎,百貨店（売場主任）,来客数の動き,・現在は全館で営業を再開しているので、食料品もそれに伴い若干戻ってきており、生鮮を中心に非常に良い。お中元ギフトも前年の売上を確保できており、良い兆しが見えてきている（東京都）。
,,◎,スーパー（販売促進担当）,販売量の動き,・新型コロナウイルスの影響による巣籠り需要で、自宅での食事が増え、肉類を中心に食品の売上が好調に推移している。猛暑による青果の価格高騰も追い風となっている。
,東京都,◎,乗用車販売店（営業担当）,販売量の動き,・５月と比較すると売行きは良い（東京都）。
,東京都,◎,その他専門店［貴金属］（統括）,販売量の動き,・３か月前は自粛期間のため、売上がほぼゼロであった。現在は営業再開しているため、売上を確保できている（東京都）。
,,◎,都市型ホテル（スタッフ）,来客数の動き,・３か月前は稼働率10％を下回っていたため、それと比べると少しは回復している。
,東京都,◎,旅行代理店（販売促進担当）,販売量の動き,・３か月前に比べると、８月は個人旅行が良くなっているが、新型コロナウイルスの影響のなか、全体的には非常に厳しく、特に団体旅行は９割減くらいである。海外個人旅行も９割強減少しているが、唯一良い国内個人旅行が７～８割強の盛り返しで、数字を支えている（東京都）。
,東京都,◎,通信会社（経営者）,お客様の様子,・３か月前は、新型コロナウイルスの影響により在宅勤務主体での営業活動であったが、８月は、一部制限はあるものの通常営業に戻しているため、営業的には大きく回復傾向にある（東京都）。
,東京都,◎,観光名所（職員）,来客数の動き,・３か月前は新型コロナウイルスの影響で営業ができない状態であった。今は営業しているため、３か月前よりは良くなっている（東京都）。
,,◎,住宅販売会社（従業員）,販売量の動き,・今月の販売量は目標数字の約116％となり、良い。３か月前と比べても3.5倍となり、明らかに良くなっている。新型コロナウイルスの感染拡大に伴う緊急事態宣言の解除後に来場者が増えたが、ようやく販売量に結び付いている。８月は長期休暇もあり、在宅率も高く、商談数が増えた結果である。
,,◎,住宅販売会社（従業員）,販売量の動き,・新型コロナウイルスの影響がなくなり、受注が伸びている。
,,○,商店街（代表者）,来客数の動き,・最近、商店街の通行量も少しずつ回復傾向にあり、それに伴い来客数もやや増えてきている。以前は本当にひどかったが、最近になって、やや回復とまでいかないものの、少しずつ客が増えている。
,東京都,○,商店街（代表者）,お客様の様子,・緊急事態宣言解除の頃と比べれば明らかに良くなっている。新型コロナウイルスの影響があるなかでの消費行動に客が慣れてきて、正しく恐れるようになってきたと感じる。ただし、３か月前と比べれば良いと感じるだけで、通常からするとかなりの厳しさが飲食を中心に続いている（東京都）。
,,○,一般小売店［家電］（経理担当）,来客数の動き,・新型コロナウイルスの影響と急な暑さにより、エアコンの売上が好調で、８月になっても注文が入っている。
,,○,一般小売店［家電］（経理担当）,販売量の動き,・暑さのせいもあり、エアコンが動いている。客に営業はかけられないが、電話の問合せやホームページなどから注文が入っている。ただし、新型コロナウイルスの影響による品不足があるので、商品の確保が大変である。
,東京都,○,一般小売店［家具］（経営者）,販売量の動き,・８月に入り、客が少し増え、販売量も多少増えている。特別定額給付金の10万円が幾らか還元されているのかもしれない（東京都）。
,東京都,○,一般小売店［文房具］（経営者）,販売量の動き,・７月末頃からほぼ前年どおりの売上にまで回復してきている。ただし、法人客による店頭での買物は、テレワーク等の影響を受けて減少傾向である（東京都）。
,,○,一般小売店［文具］（販売企画担当）,販売量の動き,・当地域は流出人口が多いのだが、その人たちがテレワーク等で東京方面になかなか行かないということもあってか、来客数が増えている。マスク等の感染防止商品を売っており、それがよく売れていることもあって、店頭部門は２けた成長である。一方、外商部門は、大手の法人がストップしていることもあり、若干下がっている。
,,○,一般小売店［茶］（営業担当）,販売量の動き,・来客数、売上共に前年比10％減で、思っていたほど減少してはいない。
,東京都,○,一般小売店［茶］（営業担当）,販売量の動き,・悪い状態だが、少しは注文が戻りつつある。ただし、全然元のような状況ではない。会場が取れず催事ができない。従業員も交代で休んでいる状況である（東京都）。
,東京都,○,百貨店（総務担当）,お客様の様子,・前月同様、緊急事態宣言下の５月との比較では、良くなっているという回答になる。実態の客の様子は、ここ数か月と変わらず、非常に慎重である。紳士、婦人共にファッション関連の今年の春夏商材の動きは、厳しいまま終わろうとしている。現在もバランスの良い客の購買行動にはなっていない（東京都）。
,東京都,○,百貨店（広報担当）,来客数の動き,・３か月前の５月は緊急事態宣言を受けて店舗の大半が臨時休業をしていた。現在は営業を再開しているため、その当時に比べれば来客数は回復している。しかし、前年比でみると引き続き厳しい状況である（東京都）。
,東京都,○,百貨店（営業担当）,来客数の動き,・現在の足元は悪いが、３か月前と比較すると改善してきている。来客数も15％ほど改善してきている（東京都）。
,,○,百貨店（販売促進担当）,それ以外,・３か月前は、緊急事態宣言が解除される月末までは食品のみの営業となり、売上に大きく影響のあった月であるため、比較すると景気は良くなっている。しかし、都内の感染者数が増えていることなどから、来客数の回復傾向も止まっており、景気が良いとはいえない。
,東京都,○,百貨店（販売促進担当）,来客数の動き,・４～５月頃の緊急事態宣言中と比較すれば業績は伸びているが、前月と比較すると厳しい。前年に比べて夏休みを利用した遠方からの来街者が減少している（東京都）。
,東京都,○,百貨店（店長）,来客数の動き,・営業再開直後の来客数は前年比６掛け程度であったが、今は安定して70％を超えている。特に、食品は売上についても前年を超える日がかなり出てきている（東京都）。
,,○,百貨店（企画宣伝担当）,販売量の動き,・新型コロナウイルス感染拡大防止のため営業品目の制限をしていた３か月前に比べ、営業再開後の品目拡大分は売上が増加している。前年同期比では下回っている。
,東京都,○,百貨店（副店長）,来客数の動き,・３か月前の５月は臨時休業の時期があり、販促活動もしていなかったので比較は難しいが、客の行動は活発になっている。食品売場において特に顕著である（東京都）。
,,○,スーパー（総務担当）,お客様の様子,・衣料品や住まいの品に関しては、頻度性の高い物は前年並みだが、お出掛けや帰省等に関連する物、おしゃれ関係は非常に数字が良くない。逆に、新型コロナウイルスの影響によるステイホームのため、食料品に関しては、ほぼ全品で売上が前年比で１～２割上回っており、店全体としても約１割前年より売上が伸びている。
,,○,スーパー（総務担当）,単価の動き,・自粛疲れが出ていると感じる。遠出できない分、買物で気を紛らわそうとしているように見える。
,,○,スーパー（ネット宅配担当）,お客様の様子,・今月は晴天に恵まれ、売上が安定して伸びている。お盆商戦も今年は長丁場で特に大きなピークはなかったが、ある程度高水準で売上が推移している。
,,○,コンビニ（経営者）,単価の動き,・新型コロナウイルスの影響で、来客数は減っているものの、客単価だけは上がっている。
,,○,コンビニ（経営者）,来客数の動き,・新型コロナウイルスの影響で、自宅にいることが多いことが一因と思われる。
,,○,コンビニ（経営者）,来客数の動き,・まだまだ景気が良くなっているとはいえないが、３～４月と比べれば少しずつ上向きになっており、人も少しずつ出始めている。当社はショッピングセンターにも入っており、まだ80～85％程度だが、少しずつ客が戻ってきているように感じる。
,,○,衣料品専門店（経営者）,販売量の動き,・マスク等の衛生商材の需要が多く、売上は取れている。来客数も多く、天候も夏物衣料には良い状態になっている。
,,○,衣料品専門店（統括）,販売量の動き,・３か月前と比べるとリモートワークが減り、働くビジネスマンも多くなり、必要な物を買いに来る客が増えてきている。
,,○,乗用車販売店（経営者）,来客数の動き,・最近は来客数が前年並みに戻ってきて、活気が出てきている。
,,○,乗用車販売店（店長）,販売量の動き,・販売量が増加傾向にあり、勢いは続くように感じる。客の購買検討も多く聞かれるようになっている。
,,○,その他専門店［ドラッグストア］（経営者）,来客数の動き,・ドラッグストアは来客数が増えているため、売上が前年比120％である。しかし、調剤薬局は患者数が減っているため、売上も前年比85％であり、全体では微増である。
,東京都,○,その他専門店［雑貨］（営業担当）,来客数の動き,・３か月前は緊急事態宣言の発出に伴い休業していたため、単純比較では増加している。しかし、宣言前の３月との比較では63％減少している（東京都）。
,東京都,○,その他専門店［ガソリンスタンド］（団体役員）,販売量の動き,・３か月前と比較すると販売量は増加しているが、前年比では減少している。天候が良いので、洗車が好調である（東京都）。
,,○,一般レストラン（経営者）,来客数の動き,・３か月前は一番のどん底で、新型コロナウイルスの影響で客が１人も来ないような状態が続いていたので、それと比べたら少し良くなっている。今は落ち着いているので、少しずつ回復して、景気が戻ってきている。
,東京都,○,一般レストラン（経営者）,販売量の動き,・３か月前の５月１～28日までの前年比は、売上30.0％、来客数27.0％である。今月８月１～27日までの前年比は、売上58.1％、来客数53.6％である（東京都）。
,東京都,○,その他飲食［居酒屋］（経営者）,来客数の動き,・３か月前は自粛要請が出ていたため、当然その頃よりは人が動いており、売上も上がっている。ただし、前年に比べると人の動きは半分以下で、決して良い状態とは言えない（東京都）。
,,○,都市型ホテル（スタッフ）,お客様の様子,・新型コロナウイルスの影響がまだ続いているが、少し回復している。
,,○,都市型ホテル（スタッフ）,販売量の動き,・３か月前と比べ、Ｇｏ　Ｔｏ　Ｔｒａｖｅｌキャンペーンの影響もあり、徐々にではあるが宿泊の稼働、売上共に伸びてきており、お盆期間中の稼働は80％を超えた。平日稼働は相変わらず低調ではあるが、緊急事態宣言発出直後の数字に比べれば伸びは大きい。
,,○,旅行代理店（営業担当）,来客数の動き,・４～５月の新型コロナウイルス感染第１波の頃は来店客が皆無だったが、Ｇｏ　Ｔｏ　Ｔｒａｖｅｌキャンペーンが始まった７月下旬から徐々に来客数が増加してきている。
,東京都,○,通信会社（社員）,お客様の様子,・集客の大きな催しが始まり、新型コロナウイルスへの意識や対処が変化してきているようである（東京都）。
,,○,通信会社（営業担当）,販売量の動き,・元どおりのセールス活動を行うことができており、ほぼ通常どおりの販売数も確保できている。
,,○,通信会社（営業担当）,販売量の動き,・緊急事態宣言下に比べ、契約数は伸びてきているが、在宅勤務者自体は３か月前よりも減ってきているため、多チャンネル、ＯＴＴ、高速インターネットの需要は若干減っているように感じる。
,東京都,○,通信会社（管理担当）,お客様の様子,・やや良くなっているといっても、３か月前が悪過ぎたので比較にならない（東京都）。
,東京都,○,通信会社（営業担当）,販売量の動き,・前月に比べて、加入希望の反響が少しではあるが増えてきている。数か月前は買い控え等が目立っていたが、当面は新型コロナウイルスの状況が変わらないと判断しているのか、徐々にではあるが、買い控え等がなくなってきているように見受けられる（東京都）。
,,○,ゴルフ場（経営者）,お客様の様子,・新型コロナウイルスの影響に慣れてきた感がある。
,,○,パチンコ店（経営者）,来客数の動き,・新型コロナウイルス感染者数が高止まりしている不安要素はあるものの、政府が打ち出すＧｏ　Ｔｏキャンペーンを始めとした景気対策が、僅かではあるが良いマインドを生み始めている。
,,○,設計事務所（経営者）,お客様の様子,・３か月前の５月と比べると多少良くなっているということであり、今後景気が浮揚し、受注が増加する気配は感じられない。
,東京都,□,一般小売店［家電］（経営者）,販売量の動き,・新型コロナウイルスの影響で、３か月くらい前までは品物が入ってこなかったりしたが、それが徐々に入ってくるようになり、売上が多少持ち直してきている。ただし、今までの負の部分がかなりあるので、経営状況は大変である（東京都）。
,,□,一般小売店［祭用品］（経営者）,来客数の動き,・毎年この時期は多くの客が祭り用品を購入するのだが、祭事の中止によりほとんど販売量がない。
,,□,一般小売店［傘］（店長）,来客数の動き,・緊急事態宣言解除後は、来客数が戻ってきたように見えたが、次第に静かになってしまっている。
,東京都,□,一般小売店［生花］（店員）,販売量の動き,・花屋は駄目である。自粛になってしまってから、お祝いごとの花が売れなくなってしまっている。仏花だけが多少売れているくらいで、本当に最悪の状態である（東京都）。
,東京都,□,百貨店（売場主任）,来客数の動き,・来客数は前年比70％で推移している。新型コロナウイルスの影響で高齢客の戻りが鈍い（東京都）。
,東京都,□,百貨店（広報担当）,来客数の動き,・メディアによる新型コロナウイルス感染者数の報道により来客数が左右されている。収束の見通しが立たないため、景気が上向きになることはない（東京都）。
,東京都,□,百貨店（営業担当）,販売量の動き,・来客数は回復傾向にあるものの、依然として前年を下回っている。売上は、衣料品は厳しい状況が続いている一方、外食を控える影響から、総菜や生鮮食品を中心に食料品が好調である。全体的には、通勤客の減少により、夕方以降の来客数と売上が減少している（東京都）。
,東京都,□,百貨店（販売促進担当）,来客数の動き,・３か月前は営業自粛期間中のため比較はできないが、従来の集客のための施策に対するヘッジ策が、まだ効果につながっていない（東京都）。
,東京都,□,スーパー（販売担当）,お客様の様子,・客の様子を見ていると、広告初日の安価な商品やポイント何倍の商品、タイムセールをやっている店など、お得な店や時間帯を利用して、少しでも安い物を買おうとしている状況がみられる（東京都）。
,,□,スーパー（経営者）,販売量の動き,・３か月前と同じように良い状態が続いている。３か月前は来客数が大分少ない代わりに客単価が高かったのだが、客単価は高い状態のまま、来客数も大分増えてきている印象である。以前はもっとまとめ買い需要が多かったが、それが徐々に薄れてきている。
,東京都,□,スーパー（店長）,お客様の様子,・１人当たりの買上点数や単価が前年比で110％くらいに伸びている。来客数は前年と大して変わらないが、買上点数と単価が上がっているため、売上は良い形で推移している（東京都）。
,東京都,□,スーパー（店長）,販売量の動き,・来客数は前年並みで、相場高による単価の上昇で売上が維持されている。販売量の増加は一向にみられない（東京都）。
,,□,スーパー（店員）,販売量の動き,・猛暑の影響により、飲料や乾麺類を始めとした夏物商材の動きが非常に良いことと、新型コロナウイルスの影響による内食需要の高まりにより、酒類の売行きが伸びている。
,東京都,□,スーパー（営業担当）,単価の動き,・このところの猛暑のお陰で夏物商材の稼働がみられるものの、買上単価の下落により、それが相殺されてしまっている（東京都）。
,,□,スーパー（仕入担当）,販売量の動き,・今年のお盆は帰省しなかった家庭が多く、帰省ギフトは不振であったが、家族で過ごした家庭が多かったようで、ごちそうメニューの少量目の商材の動向が良かった。
,,□,コンビニ（経営者）,お客様の様子,・夜間、深夜の来客数は減少しているが、昼間の客単価が上昇しているため、売上としては変化はない。
,,□,コンビニ（経営者）,お客様の様子,・緊急事態宣言が解除されてから、客は多少増えているが、子供に何か買ってと言われても親は駄目と返す感じで、本当に必要最小限の物だけを買い求めているようである。
,東京都,□,コンビニ（エリア担当）,販売量の動き,・気温が高い日が続いたにもかかわらず、飲料やアイスなどの販売が前年ほどは伸びず、販売量全体が低い傾向が継続している。盛夏期の売上が取れていない（東京都）。
,東京都,□,衣料品専門店（店長）,販売量の動き,・当社の主要事業である着物、ドレス事業の集客イベントがあったが、集客予約は80％で終わり、販売実績も同様の結果となっている（東京都）。
,,□,衣料品専門店（営業担当）,販売量の動き,・３か月前は休業要請で７日間しか営業していないので、比べようがない。年配客を中心としている当店は、新型コロナウイルス感染第２波や暑さの影響で、客が全く出てこない。ニーズに合わせて、ファッション性のあるマスクの売場を展開し、ターゲットを学生や男性、幅広い年齢層に広げたため、少しずつではあるが購入してくれる客が増え、売上も取れるようになってきている。洋服も出掛けないので買わない雰囲気だったが、セールで単価は取れないものの、動いてきており、前年比85％になっている。
