Ⅰ．景気の現状に対する判断理由等,,,,,
,,×,その他製造業［宝石・貴金属］（経営者）,受注量や販売量の動き,・８月に入ってから旧盆を挟んで、新型コロナウイルスの感染者が全国的に急増したため、６月末から７月にかけて多少売上が戻ってきていた店舗も、再び売上が減少している。卸売は展示会が開催されても、新型コロナウイルスへの感染を恐れて、出展者、来場者共に減少している。年初から各種展示会を見据えて作り込んだ商材の在庫負担も重くのしかかっている。
"雇用
関連

(甲信越)",,◎,－,－,－
,,○,－,－,－
,,□,求人情報誌製作会社（経営者）,周辺企業の様子,・８月中旬以降、特に当地周辺で新型コロナウイルスの感染者数が拡大しており、求人は多業種で一層減少傾向にある。
,,□,職業安定所（職員）,周辺企業の様子,・製造業や宿泊関連で休業が続いている。飲食関連でも収益が改善していない。
,,▲,人材派遣会社（営業担当）,雇用形態の様子,・求人はあるものの、採用決定に慎重で時間を掛けている様子である。求職者への合否が遅くなり、チャンスロスが発生している。
,,▲,職業安定所（職員）,求人数の動き,・新規求人が大きく減少している。緊急事態宣言解除後、求人が戻りかけた卸、小売業や宿泊、飲食業等からの求人が出なくなっている。製造業も一部を除いて、非常に少ない。
,,×,職業安定所（職員）,周辺企業の様子,・良い要素がない。
,,,,,
　６．東海（地域別調査機関：三菱ＵＦＪリサーチ＆コンサルティング株式会社）,,,,,
,,,,,（－：回答が存在しない、＊：主だった回答等が存在しない）
分野,,景気の現状判断,業種・職種,判断の理由,追加説明及び具体的状況の説明
"家計
動向
関連

(東海)",,◎,乗用車販売店（従業員）,販売量の動き,・３か月前の新型コロナウイルスのピーク時よりは良くなっており、現状は前年並みに戻っている。
,,○,百貨店（経理担当）,お客様の様子,・Ｇｏ　Ｔｏ　Ｔｒａｖｅｌキャンペーンの浸透によって、観光・レジャーを目的とした需要が増えつつある。
,,○,百貨店（業績管理担当）,販売量の動き,・新型コロナウイルスの影響は落ち着いてきている。売上は依然厳しい状況で来客数も回復せず、我慢が続く。
,,○,スーパー（店長）,お客様の様子,・今年のお盆は、新型コロナウイルスの影響で帰省や旅行ができず自宅で過ごしているため、お盆のごちそう以外に日用品も売れた。また、帰省できないので進物や果物のお供え物などの宅配が増えた。
,,○,スーパー（ブロック長）,お客様の様子,・来客数の減少は継続しているが、１人当たり単価の上昇、買上点数の増加で売上は伸びている。外食の減少と百貨店の減少分の恩恵を受けていると見込まれる。
,,○,スーパー（販売担当）,単価の動き,・購入点数が１割ほど増加しているが、必要な物の購入が多い。
,,○,コンビニ（企画担当）,販売量の動き,・３か月前に比べると改善はしているが、前年比70％程度で頭打ちの状態が続いている。これ以上の回復には、まだ時間が掛かりそうである。
,,○,コンビニ（エリア担当）,来客数の動き,・新型コロナウイルス感染拡大に伴い生活様式や働き方が変わり、店舗ごとに大きく変化した。エンターテインメントキャンペーンなどで来客数は２％改善したが、客単価が低く売上の改善までには至っていない。
,,○,コンビニ（店員）,販売量の動き,・新型コロナウイルスの影響でまだ帰省を控えた人が多く、お盆期間も店内ちゅう房弁当がよく売れた。
,,○,コンビニ（商品企画担当）,それ以外,・緊急事態宣言下のゴールデンウィーク期間中と比較して、Ｇｏ　Ｔｏ　Ｔｒａｖｅｌキャンペーンなどの効果もあり人の動きが戻りつつあるが、それでも８月の売上状況は、前年同月比で約３割と依然として厳しい。
,,○,衣料品専門店（売場担当）,お客様の様子,・３か月前は緊急事態宣言下であったため、客先への訪問もできず厳しい状況であったが、現在は訪問、商談も可能となり、多少ではあるが売上が回復している。
,,○,衣料品専門店（販売企画担当）,販売量の動き,・買い控えが続いていたが、定番品が売れ始めた。
,,○,家電量販店（フランチャイズ経営者）,販売量の動き,・家電業界は新型コロナウイルスの影響はそれほど受けていないが、前年は消費税増税前の駆け込みで売上が上がっており、前年と比較すると厳しい。しかし、10万円の給付やプレミアム付商品券等政府のばらまき施策のお陰と季節要因で、８月後半もエアコンが動いている。
,,○,乗用車販売店（経営者）,来客数の動き,・やはり新車販売が回復しない。現在は中古車にシフトしている。３か月前と比べると多少来客数は増えているが、新車販売の需要はほとんどない。
,,○,乗用車販売店（経営者）,販売量の動き,・売上は、前年比では８～８割５分程度である。
,,○,乗用車販売店（従業員）,販売量の動き,・新型車効果もあり、販売台数が徐々に増えてきており、前年並みで推移している。新型コロナウイルスの影響で悪かった４～６月の反動と思われる。
,,○,乗用車販売店（営業担当）,販売量の動き,・新型コロナウイルスの第２波といってもいい今の状況からすれば、４～５月に比べ来客数も販売量も回復してきている。大きな落ち込みがないものの、盛況には程遠い。
,,○,高級レストラン（経営企画）,来客数の動き,・新型コロナウイルスが長期化するなか、特に郊外店を中心にランチタイムの客が戻り、テイクアウト商品の販売で補完している。お盆の営業が比較的良好に推移した。
,,○,観光型ホテル（経営者）,来客数の動き,・８月は県のキャンペーンとＧｏ　Ｔｏ　Ｔｒａｖｅｌキャンペーンの相乗効果があり来客数が増えている。３か月前と比べると来客数が増加しているため、景気はやや良くなっている。
,,○,旅行代理店（営業担当）,販売量の動き,・３か月前と比べると、新型コロナウイルス禍に違いはないが、店舗自粛や客のステイホームがなくなったことと、Ｇｏ　Ｔｏ　Ｔｒａｖｅｌキャンペーンで経済活動を回すように政府が進めているお陰で、少しずつ旅行申込みは発生している。しかし、前年同月の売上や営業利益と比べると70％ダウンの状態である。
,,○,通信会社（企画担当）,販売量の動き,・イベント自粛や宴会自粛など街全体としては停滞感があるものの、特段の営業をしていないにもかかわらず、計画程度の新規契約を維持できている。また、企業の寮など、引っ越しによる入退去が増えており、メーカーが動き出しているように見受けられる。
,,○,ゴルフ場（支配人）,来客数の動き,・今月は雨や台風の影響も少なく、暑いにもかかわらず、順調に入場者数は伸びている。３か月前よりは新型コロナウイルス感染症の影響は薄れている。しかし、レストラン等の売上は新型コロナウイルス感染症の影響で伸び悩んでおり、入場者数の割には、まだまだといったところである。
,,○,その他レジャー施設［鉄道会社］（職員）,来客数の動き,・観光列車では、鮎料理列車企画等への申込みが上向いている。メディアでの取上げなどがプラスに動いている。
,,○,美顔美容室（経営者）,販売量の動き,・キャンペーンが始まり、セット購入があったため売上がアップした。
,,○,設計事務所（経営者）,来客数の動き,・小さな案件が少しずつ出てきている。
,,□,商店街（代表者）,販売量の動き,・７月中旬までは少しずつ回復していたが、下旬の４連休以後は春の状態に戻った。春の自粛期間中は閉店する店舗が多かったので、開いている店には客が来て悪いなりに効率が良かった。今回は、ほぼ全店が開店しているが購買量は春と同じなので、効率が悪い。
,,□,商店街（代表者）,来客数の動き,・前月と比較して来客数、売上共に下降傾向である。
,,□,商店街（代表者）,販売量の動き,・給付金の効果を期待していたが全く売上が伸びなかった。ただ、同業大手の店舗はよく人が入っているようであり、消費活動も全体としては動いてきたようにみえる。
,,□,商店街（代表者）,お客様の様子,・新型コロナウイルスの影響で、人の動きや消費が落ちている。
,,□,商店街（代表者）,お客様の様子,・新型コロナウイルスが終息しつつあると客は話している。
,,□,一般小売店［結納品］（経営者）,販売量の動き,・新型コロナウイルスの影響で売上が減少し、そのままの状態である。
,,□,一般小売店［土産］（経営者）,来客数の動き,・５月末の自粛解除で、一時的な開放感がかえって問題を長引かせ、Ｇｏ　Ｔｏ　Ｔｒａｖｅｌキャンペーンも中途半端である。２年程度は我慢が続く。
,,□,一般小売店［文房具］（店員）,来客数の動き,・来客数が極端に減っている。外出することが嫌な客もいるようである。
,,□,一般小売店［生活用品］（販売担当）,お客様の様子,・新型コロナウイルス禍の最悪の状況よりは良くなってはいるが、まだまだ客足が戻ったとはいい難い。
,,□,一般小売店［書店］（営業担当）,販売量の動き,・夏季の閑散期に加え、新型コロナウイルス禍での訪問営業の自粛を求められるため、販売量が減少している。
,,□,百貨店（総務担当）,お客様の様子,・県独自の緊急事態宣言が発出されたことで、外出自粛やお盆の帰省等の移動も少なく来客数が減少傾向にあり、売上も回復傾向とはなかなかいえない。ただし、駅前立地でもあることから日々の固定客は確保でき、売上のレベル感は低いが底堅い。
,,□,百貨店（営業担当）,来客数の動き,・７月末に起きたクラスターの影響で、戻りつつあった街中への人出が前年より半減となり、８月中旬になっても回復せず、来客数の減少も継続している。
,,□,百貨店（計画担当）,お客様の様子,・相変わらず新型コロナウイルス禍が続いているが、少しずつ客にもニューノーマルへの適応がみられるようになり、安定してきている。ただし、土日祝日の人出は低位のまま、上昇する様子はみられない。
,,□,百貨店（販売担当）,来客数の動き,・新型コロナウイルスの第２波により県独自の緊急事態宣言が出て以降、客足は予想以上に減少し、売上は前月比80％である。新作の投入により来客が少ないなかでも購入はみられたが、１か月を通して厳しい状況だった。
,,□,スーパー（店員）,販売量の動き,・販売量が少ない状況であり、売上に結び付かない。
,,□,スーパー（販売担当）,お客様の様子,・売上、粗利益共に予算達成している状況は続いている。加えて、第１波の自粛時より夜間の来客数が増えてきた。この暑さのせいもあると思う。
,,□,スーパー（商品開発担当）,販売量の動き,・売上は前年105％と好調に推移している。お盆に関しては、新型コロナウイルスの影響で帰省が減ったこともあり、全体的にお盆専用品の売上は例年より苦戦した。
,,□,スーパー（販売担当）,販売量の動き,・来客数は少なくなっているが、販売量は変わらない。
,,□,スーパー（営業企画）,お客様の様子,・客単価、買上点数は依然前年に比べ高い状態が続いている。来客数は、地区での感染者の増減によって上下する傾向はあるが、全体としては３か月前と比べて大きく変化していない。
,,□,コンビニ（店長）,販売量の動き,・主力のたばこ販売は、新型コロナウイルスの影響もあるが改正健康増進法の影響が大きく、販売量が前年より４割程度落ちている。
,,□,コンビニ（エリア担当）,来客数の動き,・相変わらず来客数がマイナスである。
,,□,コンビニ（エリア担当）,お客様の様子,・駅前、繁華街に立地する店舗付近は、人通りが少なく来客数が一向に伸長しない。また、入店客も少なく、買物は多くを求めず必要な商品しか購入しない状況である。
,,□,家電量販店（店員）,販売量の動き,・前年比で売上増加が続いている。生活に必要な家電が古くなったので買換えるという客が多い。
,,□,乗用車販売店（経営者）,お客様の様子,・少しずつ客に動きが出てきた気はするが、やはり業種や雇用形態によって差が見受けられる。
,,□,乗用車販売店（経営者）,来客数の動き,・義務的な車検や故障での臨時整備などの入庫があるものの、任意の点検での来店が減っている。
,,□,乗用車販売店（従業員）,お客様の様子,・そこまで悪くはないが、自動車業界や周りをみるとダメージが大きいと感じる。
,,□,その他専門店［書籍］（店員）,来客数の動き,・新型コロナウイルスの影響で夏休みが少なく、例年の夏休み課題、宿題や工作等の教材の売上は減少したものの、巣籠り需要はまだまだあるため、売上は例年より２割ほどアップしている状態である。
,,□,一般レストラン（経営者）,お客様の様子,・８月に県内でも新型コロナウイルスにり患する人が増え、来客数は減っている。
,,□,一般レストラン（経営者）,お客様の様子,・新型コロナウイルスの患者が近くで出たこともあり、客が外出しないようになっている。
,,□,その他飲食［仕出し］（経営者）,お客様の様子,・助成金、給付金や貸付け等の支援策も、このような状態では一時的でしかない。根本的な対策を講じていかないといけない。
,,□,観光型ホテル（支配人）,来客数の動き,・３か月前が最悪な営業結果であったため、それに比べればほんの少し回復しているものの、前年比でやっと30％を超えたところである。これで４か月連続、従前にはなかった営業損益となっている。今月は県独自の自粛宣言も解除されず、学校も夏休み短縮のため授業が始まり、ますます来客の見込みは薄れている。
,,□,都市型ホテル（営業担当）,お客様の様子,・新型コロナウイルス感染の拡大に伴い、宴会利用は前年比75％減で推移している。当面は、キャンセル増加、新規客低迷のまま変わらないと見込まれる。
,,□,旅行代理店（経営者）,販売量の動き,・Ｇｏ　Ｔｏ　Ｔｒａｖｅｌキャンペーンについては、やらないよりはやって正解だった。安心して旅をできる環境ではないので、新型コロナウイルス感染を恐れて少し様子を見ている客層もあるが、感染に気を付けて迷惑にならない程度にキャンペーンの有効活用を考えている客もいるので、全くゼロよりは助かっている。旅館は、安心して旅ができるように特に食事、入浴に気を付けてほしい。自分が観光ホテルに宿泊した際も、かなり感染防止に努めていて安心した。観光よりもホテル滞在時間が長くなるので、安心した滞在空間が求められる。
,,□,旅行代理店（経営者）,販売量の動き,・新型コロナウイルスの影響で旅行部門は前年比５％以下である。Ｇｏ　Ｔｏ　Ｔｒａｖｅｌキャンペーンが始まっても、客自体が勤め先から県外移動禁止や貸切りバス乗車禁止などの制約があり、販売が伸びていない。
,,□,旅行代理店（営業担当）,お客様の様子,・早期受注していた団体旅行に依然キャンセルが出てくる状態である。Ｇｏ　Ｔｏ　Ｔｒａｖｅｌキャンペーンも、興味ある客の方が少なく、お願いしてやっと検討してもらえる程度である。地域クーポンのスタート後に期待したい。
,,□,タクシー運転手,販売量の動き,・繁華街や飲食店街の人出が非常に少ない。飲食店経営者からも、人が少なく暇だという後ろ向きの声しか聞かない状況である。
,,□,タクシー運転手,来客数の動き,・新型コロナウイルスのせいで良くならない。
,,□,通信会社（営業担当）,お客様の様子,・自宅のインターネット環境用の光回線の需要が、多くはないがずっと続いている。
,,□,レジャーランド（職員）,来客数の動き,・新型コロナウイルスの感染再拡大により、外出自粛の影響を受けた。例年実施している花火大会が実施できず、集客に影響した。Ｇｏ　Ｔｏ　Ｔｒａｖｅｌキャンペーンが始まり新規予約もあったが、キャンセルも多く実施効果が確認しづらい。
,,□,美容室（経営者）,来客数の動き,・新型コロナウイルスの影響もあったが、お盆があったため今月は良かった。
,,□,美容室（経営者）,来客数の動き,・お盆に予定がない人が多く、イベント前に髪の手入れをする客が少なかった。
,,□,その他サービス［介護サービス］（職員）,販売量の動き,・介護リフォームの相談件数が、緊急事態宣言前の状況には、なかなか戻らない。
,,□,住宅販売会社（従業員）,来客数の動き,・来場者数は戻らず低調のままである。大手メーカーも極限の金額提示で必死のようで、元々低価格路線のメーカーは大変な状況と思われる。
,,□,その他住宅［室内装飾業］（従業員）,お客様の様子,・客からの工事依頼は、規模が大きい物件が多くなってきている。
,,□,その他住宅［不動産賃貸及び売買］（営業）,販売量の動き,・例年の８月に比べても来客数は減少しており、３か月前に比べても客足は少ない。
,,▲,一般小売店［高級精肉］（常勤監査役）,販売量の動き,・全て新型コロナウイルス対策の影響である。
,,▲,一般小売店［生花］（経営者）,来客数の動き,・新型コロナウイルスの影響で来客数は20％程度落ちた。お盆も市外から来る人は少なく、墓参りの花も例年よりやや少なかった。静かなお盆だったように思う。葬儀も家族葬がほとんどで、花も出ていかない。
,,▲,一般小売店［贈答品］（経営者）,お客様の様子,・新型コロナウイルスが収束して良くなっていくとみていたが、第２波が来て景気が悪くなり、客の財布のひもが固くなった。本格的に活動できず自粛する状況が続いているため、景気はやや悪い方向に向かっている。
,,▲,百貨店（販売担当）,来客数の動き,・学生の学校スケジュール変更によって、前年までのような動きが出てこない。
,,▲,スーパー（店長）,来客数の動き,・新型コロナウイルス禍において来客数が減っている。お盆を境に、客単価も下がってきている。
,,▲,スーパー（店員）,単価の動き,・３か月前は自粛期間真っただ中で、外食を控えて自宅での食事が大半で食料品の購入があった。今月は花火大会や地元の盆踊りが中止で、飲食店や自治会の飲物関連の注文がゼロだった。帰省によるお供えの果物にも自粛ムードがみられ、売上の減少につながった。
,,▲,コンビニ（本部管理担当）,来客数の動き,・新型コロナウイルスの影響が軽減し状況は回復傾向にはあるが、直近の売上は前年比92％と低調である。依然新型コロナウイルス発生以前まで状況が戻ったとはいえない。今後、世間が新しい生活様式となるのか、あるいは以前の生活に戻るのかの選択肢の中で、景気が不安定になると考える。
,,▲,家電量販店（店員）,それ以外,・３か月前は非常に厳しく、新型コロナウイルス禍の中で外出を控える傾向が強く、来客数が低下して売上にも影響が大きかった。給付金の10万円の使い道が家電購入に向いたため、３か月前に比べると良くなった。来客数、客単価は、共に前年を超えた。
,,▲,乗用車販売店（従業員）,販売量の動き,・新型コロナウイルスの感染者数が再び増え始め、来客数が前年の７割ほどに落ち込んでしまった。販売台数も比例して前年比８割ほどに落ち込んでいる。お盆休みは、フェア来場客で例年はにぎわうが、今年は閑古鳥が鳴くような状況だった。サービス工場への入庫は変わらないが、全体的には、更に危機的状況になっていると言わざるを得ない。
,,▲,乗用車販売店（従業員）,販売量の動き,・例年８月は、お盆休みのため営業活動が短く販売量も減少する。今年はさらに、新型コロナウイルスの影響と連日の猛暑により客の外に向かう気持ちが萎えてしまったのか、店頭への来店客は少なく、客の元気が感じられない。
,,▲,住関連専門店（営業担当）,販売量の動き,・新型コロナウイルスの影響により、商業施設を中心に新築工事、改装工事共に延期、中止となっている。一般の工事も同様にストップしている現場もあり、少なくとも今年一杯は良くならない。
,,▲,その他専門店［貴金属］（経営者）,来客数の動き,・８月に入り、新型コロナウイルス第２波の影響は当初よりも大きく感じる。来客数の減少が著しい。購買単価も低下しており、店前の通行者数もかなり少なく感じる。
,,▲,その他小売［ショッピングセンター］（経理担当）,販売量の動き,・緊急事態宣言が５月で解除され、６月以降消費が回復したものの、依然として前年割れの状況は継続している。
,,▲,一般レストラン（従業員）,来客数の動き,・７月に上向きになりかけたが、８月すぐに悪くなった。
,,▲,その他飲食［ワイン輸入］（経営企画担当）,販売量の動き,・飲食店向けの売上は、前年の６割に落ち込んでいる。今後、この業態が持ち直すとは考えられず、繁忙期である10～12月の落ち込みを懸念している。
,,▲,都市型ホテル（総支配人）,来客数の動き,・売上は緊急事態宣言時より悪い。Ｇｏ　Ｔｏ　Ｔｒａｖｅｌキャンペーンで、むしろ高級ホテルに少ない客を奪われている。
,,▲,旅行代理店（経営者）,お客様の様子,・新型コロナウイルス禍における新規感染者数増加の影響か、県内移動も自粛するという声を聞くことが多く、飲食店も昼夜共に以前とは比較にならないほど客が減っている。鉄道の乗客数も減って、以前ほどはいない。
,,▲,タクシー運転手,お客様の様子,・新型コロナウイルスの影響で、夜の街、繁華街は人出が少ない。店も開いておらず厳しい状況である。
,,▲,通信会社（営業担当）,販売量の動き,・新型コロナウイルス関連で需要増加となったが、現在は、通常の販売量に戻った。
,,▲,観光名所（案内係）,お客様の様子,・飲食店に常連客が来なくなり、ばん回できないのではないかと各店で考え始めている。
