Ⅰ．景気の現状に対する判断理由等,,,,,
,,×,経営コンサルタント,それ以外,・街なかや観光地、商業施設等への人出が止まった感があり、地域企業の動きも全体的に緩慢で地域経済に活力はなく、非常に落ち込んでいる。新型コロナウイルス禍で、個別企業の経営業績の格差が、更に極端に拡大している。
"雇用
関連

(北関東)",,◎,－,－,－
,,○,人材派遣会社（管理担当）,求人数の動き,・サービス業の派遣求人が増加しているため、やや良くなっている。
,,○,職業安定所（職員）,求人数の動き,・製造業への派遣求人が増加している。新型コロナウイルスの影響が大きかった飲食業や小売業も、前年より増加している。
,,□,人材派遣会社（経営者）,求人数の動き,・住宅関連では改装や外壁等の外装塗装については動きがみられたが、新築物件は止まっている。工場製造部門は食品の稼働がかなり活発である。小売関係では、スーパー等で、生鮮食料品、野菜等の動きが良く、客足が多くみられている。
,,□,人材派遣会社（社員）,求人数の動き,・製造業の求人は回復してきたが、事務系求人数は増えていない。
,,□,職業安定所（職員）,求人数の動き,・有効求人倍率は1.10倍と前月に比べ0.10ポイント下回ったが、14か月連続で下回っていた前年同月比は同率となっている。有効求人数は前年同月比8.1％増と22か月ぶりに増加に転じ、有効求職者も同7.9％増と10か月連続で増加している。
,,□,学校［専門学校］（副校長）,求職者数の動き,・求人の動きは業種によって異なり、例年以上の求人がきているところもあれば、新型コロナウイルスの影響を受けて採用数を減らしている企業もある。
,,▲,＊,＊,＊
,,×,＊,＊,＊
,,,,,
　４．南関東（地域別調査機関：株式会社日本経済研究所）,,,,,
,,,,,（－：回答が存在しない、＊：主だった回答等が存在しない）
分野,,景気の現状判断,業種・職種,判断の理由,追加説明及び具体的状況の説明
"家計
動向
関連

(南関東)",東京都,◎,旅行代理店（従業員）,販売量の動き,・緊急事態宣言が解除され、旅行者の動きが活発化している（東京都）。
,,◎,住宅販売会社（従業員）,販売量の動き,・今月の販売量は目標数字の約117％となり、景気は良い。３か月前と比べても販売量が約170％アップしている。販売量は注文建築の請負契約ベースでカウントしているが、契約金、契約工期、土地の有無など社内的な請負契約条件を緩めたという事情もある。
,,○,一般小売店［家電］（経理担当）,来客数の動き,・５月より少し来客数が増えてきている。ただし、前年と比べると少なく、売上も減っている。
,,○,一般小売店［傘］（店長）,単価の動き,・自分への投資なのか、高単価商材が動いている。
,,○,一般小売店［文具］（販売企画担当）,お客様の様子,・店頭における一般消費者の来客数は少なくなっており、単価も下がっている。公共、官庁関係の案件単価は確実に伸びている。競合店が少なくなっていることと、当社がいろいろ取扱商品を転換していることが功を奏しているようで、仕事が増えている。
,東京都,○,百貨店（売場主任）,来客数の動き,・緊急事態宣言中ではあったが、父の日需要が伸長し、家族連れの来店も増加している。自宅でごちそうを楽しむための高額商材の動きも活発化している（東京都）。
,東京都,○,百貨店（総務担当）,来客数の動き,・６月より休業要請が緩和されたことで、営業時間、取扱アイテムの拡大が図られ、来客数も戻りつつある（東京都）。
,東京都,○,百貨店（営業担当）,販売量の動き,・今月は緊急事態宣言からまん延防止等重点措置に移行し、来客数が回復傾向にあり、売上も宝飾品やアクセサリー、ラグジュアリーブランド商材が好調である。食料品は前年に比べて伸長しているものの、まとめ買いなどは減少している。アパレルや服飾雑貨、化粧品は依然として苦戦が続いている（東京都）。
,東京都,○,百貨店（営業担当）,来客数の動き,・緊急事態宣言からまん延防止等重点措置に移行したことで、商業施設や商業都市の人出は少し増えているようである（東京都）。
,,○,百貨店（販売促進担当）,それ以外,・隣接する東京都への緊急事態宣言が解除されたものの、まん延防止等重点措置適用は７月まで継続となっている。３か月前の緊急事態宣言中と比較すると、来客数の推移や客の様子からは景気が良くなったと感じる。
,東京都,○,百貨店（財務担当）,販売量の動き,・緊急事態宣言が解除されたことで、やや良くなっている（東京都）。
,,○,百貨店（企画宣伝担当）,来客数の動き,・当市がまん延防止等重点措置の対象地域から除外されたことにより、消費者の購買心理に明るさが出てきている。
,,○,コンビニ（経営者）,来客数の動き,・今月20日で緊急事態宣言が解除され、まん延防止等重点措置となり、都市部においてはかなり人出が多くなっていることから、コンビニ等の売上も伸びてきているのだと感じている。
,,○,衣料品専門店（役員）,来客数の動き,・新型コロナウイルスのワクチン接種が始まり、高齢者の外出が少し増えてきている。
,東京都,○,その他専門店［貴金属］（統括）,販売量の動き,・緊急事態宣言の解除以降、店舗の営業が可能となったことにより、売上が確保できるようになっている（東京都）。
,,○,高級レストラン（経営者）,来客数の動き,・前回までは今後の景気予想を良いか悪いかはっきり回答していたが、今回どちらとも言えないと答えたのは、新型コロナウイルス感染第５波次第だと考えているからである。東京都の緊急事態宣言が解除された21日の前週から予約が入り始め、来客数は24日から増え続けているが、リバウンドで制約が増えれば、来客数は減ってしまう。
,東京都,○,その他飲食［給食・レストラン］（役員）,販売量の動き,・売上が前年比で回復傾向にあり、４～５月累計でプラス５％超となった結果、経常利益も大幅に改善している。特に、経常利益は、前年度に不採算が継続すると判断した店を積極的に撤退したことが、改善を後押ししている（東京都）。
,,○,都市型ホテル（スタッフ）,来客数の動き,・団体利用があったことで、稼働率の向上につながっている。全体的に３か月前と比べて上がってきてはいるものの、まだ赤字は脱出できない。
,東京都,○,旅行代理店（販売促進担当）,それ以外,・旅行業自体は相変わらず厳しい状態だが、自治体を通じて新型コロナウイルスのワクチン接種会場運営等の仕事を新しく受注した結果、数字が改善している。今正に接種が進んでいるので、その需要にこたえている。来月の東京オリンピック開催も決定したので、仕事を進めている（東京都）。
,東京都,○,通信会社（経営者）,販売量の動き,・緊急事態宣言からまん延防止等重点措置に移行し、徐々にではあるが新型コロナウイルスの影響がない客からの受注が増えてきている（東京都）。
,東京都,○,通信会社（社員）,お客様の様子,・番組制作の引き合いが、注文につながっている。続けて２案件がまとまりつつある（東京都）。
,東京都,○,通信会社（社員）,販売量の動き,・新型コロナウイルスの影響が少なくなってきている（東京都）。
,東京都,○,その他レジャー施設［複合文化施設］（財務担当）,来客数の動き,・新型コロナウイルスのワクチン接種率が向上している（東京都）。
,,○,設計事務所（経営者）,お客様の様子,・前月の実感とほとんど変わらない。
,,○,住宅販売会社（従業員）,競争相手の様子,・３か月前に比べて土地の仕入れが若干良くなっている。まだまだ市場は在庫薄で厳しい状況だが、少しずつ情報が多くなり、土地を仕入れられるようになってきている。夏から秋にかけてもう少し良くなってくると予想している。
,,□,商店街（代表者）,来客数の動き,・例年なら、そろそろ来年の成人式の衣装レンタルを申し込む客がぽつぽつ来店するのだが、今年については余り動きがみられないことが一番心配である。
,,□,一般小売店［家電］（経理担当）,販売量の動き,・エアコンの動きが良く、パソコン関係もそこそこである。テレビは東京オリンピック開催が決定したので、４Ｋ、有機ＥＬテレビがぽつぽつ買い求められている。
,東京都,□,一般小売店［家具］（経営者）,販売量の動き,・３か月前の景気と比べて変わらないと回答したが、悪さがそのまま続いているという意味である（東京都）。
,,□,一般小売店［印章］（経営者）,来客数の動き,・路面店というハンディキャップはあるが、ほとんど客が歩いていない。非常に冷え切っているというのか、新型コロナウイルス禍のために余計に外出を控えているのかもしれないが、人通りが極端に少ない。
,,□,一般小売店［祭用品］（経営者）,来客数の動き,・今年も行事、イベントの中止が相次ぎ、まだまだ戻る気配がない。
,東京都,□,一般小売店［茶］（営業担当）,販売量の動き,・徐々にじり貧になっているので、上司からあれこれ言われて営業をしているものの、なかなか実績、成果が出ない。会社も暇で、半日休暇を取ったり、交代で休んだりしている。早く今のまん延防止等重点措置が解除されないとどうしようもない（東京都）。
,,□,百貨店（総務担当）,お客様の様子,・来客数は、前年同月を上回っているものの、婦人、紳士共に衣料品、服飾雑貨の落ち込みが激しく、大きく落ち込んでいる。オケージョンに対する購買は堅調である。
,東京都,□,百貨店（総務担当）,お客様の様子,・緊急事態宣言は解除されたものの、新型コロナウイルス感染への不安が完全に払拭されたわけではなく、客の消費行動は引き続き慎重であることに変わりはない。食料品等の生活必需商材の動きは堅調であるが、外出需要がないこともあり、ファッション関連商材の動きは鈍い（東京都）。
,東京都,□,百貨店（販売促進担当）,来客数の動き,・緊急事態宣言下で営業が制限されており、厳しい状況が続いている。月後半にまん延防止等重点措置に移行されたが、特に大きな変化はない（東京都）。
,東京都,□,百貨店（経営企画担当）,販売量の動き,・食料品は堅調に推移している一方、アパレル関連のセール品の動きは芳しくなく、全体としては大きな変化はみられない。お中元ギフトシーズンに入ったが、来客数は少なく、開店後の午前中は多少混雑するが、午後以降は客がまばらである。全体需要の縮小とインターネットへの移行が進んでいる（東京都）。
,東京都,□,スーパー（販売担当）,お客様の様子,・客の様子を見ていると、広告初日の価格を打ち出した目玉商品であるとか、ポイント何倍の日、あるいはタイムサービスの時間帯など、少しでも安く商品を買おうという動向が多くみられる（東京都）。
,,□,スーパー（経営者）,販売量の動き,・客は来店してくれているが、販売点数がなかなか伸びない。節約しており、余計な物は買わない傾向があるように感じている。
,東京都,□,スーパー（店長）,販売量の動き,・買上点数、単価が前年を割っていることが大きな要因である。唯一、来客数は新型コロナウイルス禍のなかでも前年を上回っているが、点数と単価が大きく割っているため、数字としては厳しくなっている（東京都）。
,,□,スーパー（店長）,お客様の様子,・以前に比べて客に危機感が感じられなくなり、ふだんどおりに買物をしている。ただし、高齢客の購入点数は若年客に比べて多い傾向にある。
,東京都,□,スーパー（店長）,単価の動き,・売上、来客数は前年並みを維持しているものの、単価の上昇がみられない（東京都）。
,,□,スーパー（総務担当）,お客様の様子,・新型コロナウイルスが今後どうなるか分からず、お金を使って良いのか、節約した方が良いのか、分からない。
,東京都,□,スーパー（営業担当）,来客数の動き,・来客数が徐々に増え始めてきているが、それに付随して、買上単価が落ち始めてきて、相殺される状況になっている（東京都）。
,,□,コンビニ（経営者）,来客数の動き,・深夜時間帯の来客数は限りなくゼロに近いが、それ以外は来客数、客単価共にほぼ変化はない。
,,□,コンビニ（経営者）,来客数の動き,・近隣の公共施設がオープンしていないことと、時短営業で人流がない。
,,□,コンビニ（経営者）,販売量の動き,・天候に左右されるところが強いような気がする。
,東京都,□,コンビニ（エリア担当）,販売量の動き,・緊急事態宣言は解除されたが、前年と比較しても客の戻りが少なく、販売量の改善が見込めていない（東京都）。
,東京都,□,コンビニ（商品開発担当）,販売量の動き,・空梅雨による消費増を期待したが、販売量は梅雨入り前とほとんど変わっていない（東京都）。
,,□,衣料品専門店（経営者）,来客数の動き,・路面店で地域密着型の衣料品店３店舗共、新型コロナウイルス発生以降、来客数は２けたアップが続いている。客は近くで買物をしている。
,東京都,□,衣料品専門店（店長）,販売量の動き,・新型コロナウイルス禍の影響のある都府県について、ほぼ緊急事態宣言からまん延防止等重点措置に移行したが、東京都を中心として感染者数のリバウンドの兆候がみられることから、業績については変わらない（東京都）。
,,□,乗用車販売店（経営者）,販売量の動き,・自動車の整備は順調に入っているが、販売が余り芳しくない。客の来店はあるが、なかなか契約に結び付いていない。
,,□,乗用車販売店（経営者）,販売量の動き,・新車の受注量は前年よりも増えているが、半導体不足の影響で納期が先延ばしになっており、納車できない状態が続いてる。
,東京都,□,乗用車販売店（販売担当）,お客様の様子,・新型コロナウイルスの影響で展示会などができないため、なかなか積極的な販売ができておらず、販売台数は低迷している。車検については、台数的には大きな影響はないものの、距離を走らなくなり、部品などの交換が少なくなっているために車検の単価が下がっており、総体的に粗利が低い（東京都）。
,東京都,□,乗用車販売店（営業担当）,販売量の動き,・ここ数か月変化はないし、これからも特にない（東京都）。
,東京都,□,その他専門店［ガソリンスタンド］（団体役員）,来客数の動き,・長期的需要減少のなかで、新型コロナウイルス禍もあり、景気が上向く気配はない（東京都）。
,東京都,□,その他小売［生鮮魚介卸売］（営業）,単価の動き,・緊急事態宣言で売れていないのに、仕入値が下がらない（東京都）。
,,□,その他小売［ショッピングセンター］（統括）,販売量の動き,・飲食と衣服は低調なものの、巣籠り需要を捉えた店舗は好調である。来客数からみると、全体的に新型コロナウイルス禍に対する緩みが散見される。
,東京都,□,高級レストラン（仕入担当）,来客数の動き,・緊急事態宣言からまん延防止等重点措置に変わったが、相変わらず来客数は少なく、厳しい状況が続いている（東京都）。
,東京都,□,一般レストラン（経営者）,競争相手の様子,・同業者間の足並みの乱れを感じる。特に、新規参入店や商店会未加入の店が、緊急事態宣言下でも同調せずに営業しているのがやや目立っている（東京都）。
,東京都,□,一般レストラン（経営者）,販売量の動き,・３か月前の３月１～30日までの前年比は、売上68.3％、来客数66.2％である。今月６月１～28日までの前年比は、売上63.4％、来客数52.5％である（東京都）。
,東京都,□,一般レストラン（経営者）,競争相手の様子,・酒の提供に時間制限があるため、最初頑張っていた同業者たちも、全て夜の営業は取りやめている。閉店も見据えての休業というような話もよく聞かれる（東京都）。
,東京都,□,一般レストラン（経営者）,来客数の動き,・緊急事態宣言中は酒類が出せなかったので、全く売上が上がらず、悪いままである。緊急事態宣言が解除され、少し酒が出始めたので、このまま酒の提供ができれば少しは良い方向にいく（東京都）。
,東京都,□,一般レストラン（経営者）,競争相手の様子,・外食業界では倒産、休業、閉店が続いており、今後も続くとみている。業界の動向は景気に左右されるところも多く、緊急事態宣言が解除されても、飲食店への規制はまだ多く残っているので、景況感は相変わらず下向きと思われる。東京オリンピック開催による新型コロナウイルスの感染拡大も懸念材料である（東京都）。
,,□,都市型ホテル（スタッフ）,販売量の動き,・延長が続いているまん延防止等重点措置に伴う酒類提供停止によりディナーの売上はほとんど見込めず、バーは営業を休止している。時間短縮営業も延長となり、ランチタイムはそれなりに客が入るものの、販売量は低空飛行のまま横ばい状態が続いている。
,,□,旅行代理店（従業員）,お客様の様子,・一般団体の問合せが１件あったのみである。見積りを提出して検討してもらうものの、結局今年度も実施しないことが決定した。労力をかけても受注、仕事共にゼロという状況は少しも変わらない。
,東京都,□,旅行代理店（従業員）,販売量の動き,・前年に比べると夏の国内旅行は動いているが、緊急事態宣言が解除され、東京オリンピック、パラリンピック開催で新型コロナウイルス感染第５波が来るとキャンセルになる可能性もあるので、楽観視はできない。ワクチン接種の進捗も影響する（東京都）。
,東京都,□,旅行代理店（営業担当）,販売量の動き,・緊急事態宣言、まん延防止等重点措置等により、旅行の募集ができない（東京都）。
,東京都,□,タクシー運転手,来客数の動き,・新型コロナウイルスの影響により、夜の人の動きがまるっきりなくなっている。昼間も、多少は良くなると思ったが、動きは止まったままである。このまま厳しい状況が続きそうである（東京都）。
,東京都,□,タクシー運転手,お客様の様子,・この現実に慣れただけで、以前のようにサラリーマン中心の営業はできていない（東京都）。
,東京都,□,通信会社（経営者）,お客様の様子,・６月の客からの問合せ件数は、前年同月と比較してほぼ同じ結果になっている。緊急事態宣言、まん延防止等重点措置の影響を受けて、高齢者宅への訪問拒否やキャンセルは相変わらず一定数発生している（東京都）。
,,□,通信会社（営業担当）,販売量の動き,・新型コロナウイルスの影響が長期化し、積極的な営業活動は依然制限されており、契約獲得数の鈍化傾向が続いている。
,,□,通信会社（営業担当）,競争相手の様子,・インターネット固定回線、携帯電話を軸に、他社との競争が激化しており、一進一退の状況である。
,東京都,□,通信会社（局長）,販売量の動き,・当社インターネットサービスに関して、テレワークの増加に比例して固定インターネットの需要も増加しているものの、他社切替えや当社エリア外への転居による解約も発生していることから、プラスマイナスゼロである（東京都）。
,,□,通信会社（営業担当）,お客様の様子,・新規契約、コース変更共に、無駄を省き、必要最小限の内容を選択する傾向は変わらない。
,東京都,□,通信会社（経営企画担当）,お客様の様子,・案件や商談の件数が伸びておらず、先行きが不透明である（東京都）。
,東京都,□,通信会社（営業担当）,お客様の様子,・緊急事態宣言中で在宅ワークが増えている影響か、インターネット回線の加入問合せが増えてきている（東京都）。
,,□,通信会社（経理担当）,単価の動き,・毎月客単価が10円未満で下がり続けている。契約の乗換えキャンペーン割引が携帯端末代０円から、解約違約金、解約工事費、月額利用料の割引に置き換わっている。端末代は制限されたが、他の制限されていない料金で今も昔も同じようなことが続いている。
,東京都,□,通信会社（総務担当）,お客様の様子,・新型コロナウイルス感染再拡大の影響が強く、当社の訪問を避ける世帯も多いなど、営業機会の減少から新規契約獲得件数が伸び悩んでいる（東京都）。
,,□,ゴルフ場（経理担当）,来客数の動き,・日本人女子プロゴルファーのメジャー大会優勝の報道もあり、今年に入り明るい話題も多く、ゴルフは新型コロナウイルス感染リスクが低いスポーツとして定着してきた感がある。夏至の前後で日が長い時期であり、日の出から日没までプレー枠にあてている同業他社においては、特に高稼働率で推移している。ゴルフ関連商材も活況であり、一部には品薄の商材もみられる。会員権相場も上昇基調がみられ、立地や運営などで優位性があるゴルフ場の入会希望者が多くなっている。一方、感染を警戒する高齢層のプレー自重の動きは大きく、足かせとなっている。
,,□,パチンコ店（経営者）,来客数の動き,・相変わらずまん延防止等重点措置による飲食店の時短営業が続いており、街中に活気が戻っていない。人の動きが戻らないため、来客数も以前のままで変わらない。
,,□,その他サービス［保険代理店］（経営者）,単価の動き,・販売単価の上昇にもかかわらず、全般的に購入してもらっている。販売単価が上がっても、客の様子にさほど変化はない。
,,□,設計事務所（経営者）,競争相手の様子,・民間設備投資は厳しいままだが、官庁案件はほぼ例年どおりの入札が行われている。応札業者数が多く、落札は運次第である。もうしばらくこのままの状況が続きそうである。
,東京都,□,設計事務所（所長）,お客様の様子,・コンサルタント的な計画はあるが、収入にはつながらない。また、相手に夢を与えるだけで、全てにおいて足踏み状態が続いている（東京都）。
