Ⅰ．景気の現状に対する判断理由等,,,,,
,,□,スーパー（販売担当）,販売量の動き,・食品、生活必需品の動きは余り変化がみられず安定している。化粧品の動向は回復しておらず、マスクや除菌関連商品等も在庫過剰になっている。
,,□,コンビニ（エリア担当）,来客数の動き,・前年のコロナ禍の影響度は図り切れないが、やはり緊急事態宣言の影響のためか、前年比の来客数が前月と比較してマイナス10％と悪化傾向である。回復傾向であった重点管理商品の米飯、ベーカリー及びファーストフードが、マイナス３～５％であった。
,,□,コンビニ（エリア担当）,来客数の動き,・まだ来客数が変わらず、前々年はもとより前年にも及ばない状態が続いている。
,,□,コンビニ（店長）,販売量の動き,・気温の上昇とともに飲料水やアイスクリームの売上が増えてきたが、その他の落ち込みを打ち消した程度で、全体の売上は２～３か月間変わらない状態である。
,,□,コンビニ（店長）,来客数の動き,・新型コロナウイルス感染防止対策の時短要請等によって、まだ周りの飲食店等が早く閉まるため、その影響がずっと出ている。
,,□,コンビニ（店員）,来客数の動き,・来客数の多い日と少ない日の差があるので、１か月の平均でみると厳しい。
,,□,コンビニ（本部管理担当）,来客数の動き,・売上は前年比102.5％であった。前年のコロナ禍を加味した場合、前年比105％と想定していたので、約マイナス３％という状況は、やはり先週まで緊急事態宣言であったことが要因である。前月の状況と直近では、変化がない印象を受ける。
,,□,衣料品専門店（経営者）,販売量の動き,・なじみ客への販売量は例年と変わっていないので、メーカーに協力してもらって在庫を少なくしてしのいでいる。
,,□,衣料品専門店（販売企画担当）,販売量の動き,・最低の月間売上高を記録更新した。物が動かない。
,,□,衣料品専門店（売場担当）,お客様の様子,・外商について、３～４月と同様に客の消費意欲が余り感じられない。
,,□,家電量販店（店員）,販売量の動き,・本来なら東京オリンピックでテレビの販売が伸びるはずが、特に反応がない。例年並みの売行きである。
,,□,家電量販店（フランチャイズ経営者）,単価の動き,・４～５月と比べると売上は少し回復傾向だが、来客数は前年割れであった。エアコンやテレビ等、単価の高い商品が売れ始めたため客単価は高くなっているが、それでも前年割れであった。
,,□,乗用車販売店（従業員）,販売量の動き,・販売台数は前年並みで推移しているが、納車に半年以上掛かる車も出てきており、販売しても登録に結び付かず、売上にならない。
,,□,乗用車販売店（従業員）,販売量の動き,・最近新型コロナウイルス対策に慣れが感じられ、マスクはしているものの外出は多くなってきていると感じる。しかし、自分たちの営業活動に端を発し感染が拡大しては困るので、なかなか積極的に動くことは難しい。最低限の活動では、客のニーズを捉えにくい。
,,□,乗用車販売店（従業員）,販売量の動き,・新型コロナウイルスの影響で景気の良くない部分もあるが、製造業での生産が追い付いていないのが現状である。
,,□,乗用車販売店（従業員）,単価の動き,・全体的にそれほど良い状況ではない。車は単価的に安くなってきている。仕入れでは良いが、値段が安くなるということは当社にある全在庫の価値が下がることになるので、良しあしである。景気としては、ガソリンや木材など高騰している物があるなか、中古車全体としては安いという感じである。
,,□,乗用車販売店（販売担当）,販売量の動き,・半導体不足による車の生産の遅延がここ最近かなり出ている。カーディーラーからの車をもらおうと思っても、皆もらえない状況のため、販売量もかなり厳しくなっている。
,,□,住関連専門店（営業担当）,販売量の動き,・新型コロナウイルスの影響も含め、新築物件、リフォーム物件など、まだ現場に動きが出てきていない。様子見という状態もあり、秋から来年に掛けてしか見込めない。
,,□,その他専門店［貴金属］（経営者）,来客数の動き,・時計宝石小売業としては、来客数が戻らず苦戦する毎日である。催事を実施すればそこそこの集客はあるが、単価が低く、毎月の売上確保が困難を極めている。
,,□,その他専門店［書籍］（店員）,来客数の動き,・新型コロナウイルスのワクチン接種も始まって、人出が増えてきた。今まで我慢していた分巣籠り需要がなくなりつつあるため、前年のような売上は見込めず、例年どおりの売上に戻ってきている。前年よりは２割ほど売上は落ちている。
,,□,一般レストラン（経営者）,お客様の様子,・いつものようにいつもの客が来てくれる。他の人の話を聞いても、それほど極端に落ち込んでいる様子はない。
,,□,一般レストラン（従業員）,来客数の動き,・もう本当に一部の常連客のみしか来ない状態で困っている。
,,□,バー（経営者）,来客数の動き,・コロナ禍のなか、会社から外食を止められていたり自粛ムードや外食しなくてもいいという慣れ等から、人の動きは少ない。しかし、要請を無視して営業している店には、若い人を中心に多く来店しているところもある。
,,□,その他飲食［仕出し］（経営者）,販売量の動き,・ワクチン接種が始まったが、もう少し分母が増えていかないと上向きな気分にはなっていかない。
,,□,旅行代理店（経営者）,お客様の様子,・新型コロナウイルスのワクチン接種が進まないことには、人は動かない。
,,□,旅行代理店（経営者）,販売量の動き,・新型コロナウイルスの感染拡大によるまん延防止等重点措置の適用などで、すっかり旅行需要は冷え込んだままである。
,,□,旅行代理店（経営者）,それ以外,・コロナ疲れで人出は回復してきているが、消費に結び付いているのはデパートでも高額商品が多い。ターミナル駅から５分も離れていない大型ビルの飲食店街でも、閉店したり店舗前で弁当を販売するなどで、単価も上がっていない。
,,□,旅行代理店（経営者）,お客様の様子,・緊急事態宣言がやっと解除されたが、まん延防止等重点措置が出ていて全く旅行に出掛けられる状態でもなく、問合せすらほぼない。高齢者のワクチン接種が進んでいるが、夫婦共に接種が終わらないと旅行は難しいといわれたり、まだ国民全体の接種率が低いので、秋くらいにはどこか出掛けたいといわれている。早く30～60代も接種して、夏休みの家族旅行に少しでも期待したい。
,,□,旅行代理店（営業担当）,販売量の動き,・ようやく緊急事態宣言、まん延防止等重点措置が解除されたが、引き続き新型コロナウイルス対策の制限があり、観光旅行需要はまだまだである。東京オリンピック需要も、新規の需要はない。
,,□,旅行代理店（営業担当）,お客様の様子,・旅行業界を気遣って申込みをしてくれる客もいるが、結局、度重なる自粛要請で出発に至らないのが現状である。
,,□,通信会社（サービス担当）,お客様の様子,・新型コロナウイルスの影響で在宅時間が増え、インターネットで動画やライブ配信を見たりするために、ネット環境の申込みをする家庭が増えている。
,,□,通信会社（営業担当）,お客様の様子,・設備都合で利用できなかった有線インターネットが提供できる環境になると即新規申込みがあるので、景気は変わりない。
,,□,その他レジャー施設［鉄道会社］（職員）,来客数の動き,・新型コロナウイルス対策が続くなか、客の利用は低調なまま推移している。
,,□,美容室（経営者）,来客数の動き,・客にイベント事がないことと職場がリモートになった客も多数いて、髪の毛などは手入れしなくてもいいという感じになっており、気分的に手入れがしづらくなった限界で来店する客が結構多くなった。
,,□,その他サービス［介護サービス］（職員）,販売量の動き,・新型コロナウイルス特需的な販売量の動きが見受けられるが、全般的に上向きとまではいかない。
,,□,設計事務所（経営者）,来客数の動き,・完了まで余り時間のない案件が舞い込んできた。ただ、忙しいだけで基本的には安定していない。
,,□,住宅販売会社（経営者）,お客様の様子,・新型コロナウイルスの影響が少し落ち着いてきたため、客の動きは良くなってきている。
,,□,その他住宅［室内装飾業］（従業員）,販売量の動き,・工務も毎日現場があり100％稼働はしているが、工事の規模が小さい物件が多くなっており、売上金額は思うようには伸びない状況である。
,,□,その他住宅［不動産賃貸及び売買］（営業）,単価の動き,・緊急事態宣言のため例年よりもかなり減少しているが、３か月前と同じ状況である。
,,▲,商店街（代表者）,販売量の動き,・来客数が少ないのはもう余り変わらないが、今月は注文が全くなかったため、販売量につながらなかった。
,,▲,一般小売店［書店］（営業担当）,販売量の動き,・制限があるなかで営業活動が再開されてはいるが、平常期に入り受注量が落ち着いてきている。
,,▲,スーパー（店員）,来客数の動き,・来客数が少なく、商品もとにかく安くないと売れない状況が続いている。
,,▲,スーパー（商品開発担当）,販売量の動き,・前年は新型コロナウイルスの影響を受け売上が伸長し続けたが、今期はその影響がなくなり、前年に比して売上は苦戦している。
,,▲,コンビニ（エリア担当）,単価の動き,・毎日必ず来店する客は、前年までは客単価が1000円程度の購入金額だったが、今は500～800円になった印象である。常連客の10～20名程度から同様の印象を受ける。
,,▲,コンビニ（店長）,単価の動き,・弁当や麺類の売上が下がり、おにぎりの売上も下がっている。
,,▲,乗用車販売店（経営者）,来客数の動き,・来客数が減っている。外出が減っているためか事故件数も減っている。サポカー補助金が終了したためか、新車売上も減少している。
,,▲,乗用車販売店（従業員）,販売量の動き,・ここに来て、半導体不足で車の納期遅れが本格化してきた。在庫車も少なくなってきており、新規生産の新車は半年待ちとなっており、売上が上がらず非常に苦慮している。中古車も取り扱っているが、高額車は売れず、50万円くらいの車の販売が中心である。車が必需品の地域ならではかもしれないが、購入費用を抑えようという傾向を感じる。
,,▲,その他専門店［雑貨］（店員）,来客数の動き,・６月に入ってから急激に来客数が減少した。緊急事態宣言の影響である。
,,▲,高級レストラン（経営企画）,来客数の動き,・６月中旬に緊急事態宣言の解除とはなったが、アルコール提供時間の制限、時短要請が残るまん延防止等重点措置のなかでは回復が難しい。また、規制に違反して繁盛する店があることに不公平感が残る。
,,▲,一般レストラン（経営者）,来客数の動き,・６月20日まで当地もまん延防止等重点措置で営業時間は20時までで、昼間も外出を控える客が多かった。前々年より売上が10％下がった。
,,▲,その他飲食［ワイン輸入］（経営企画担当）,来客数の動き,・飲食店の客では、緊急事態宣言が解除され酒類の提供が開始されても来店客の戻りは限定的で、前々年比で30％程度となっている。
,,▲,観光型ホテル（経営者）,来客数の動き,・３か月前は春休みということもあり、コロナ禍ではあるが家族客中心に来客があった。６月に入ってから、当地は対象地域ではないが、緊急事態宣言やまん延防止等重点措置などでマスコミのネガティブキャンペーンのもと、印象が悪いということで、不要不急の外出を控えるなどかなり影響を受け、大きく需要が減少傾向にある。したがって、悪い状況が続いている。
,,▲,都市型ホテル（経営者）,来客数の動き,・営業時間短縮で苦しい。
,,▲,タクシー運転手,お客様の様子,・緊急事態宣言が解除されたが引き続きまん延防止等重点措置が出ているため、売上は前月とほとんど変わらない。当社を含め市内のタクシー会社は夜の営業が相変わらず悪いため、稼働率をとても低くしており、当社も今月30日までは自宅待機の社員もいて、７月以降はまだ分からない状態である。
,,▲,タクシー運転手,来客数の動き,・客足が離れてしまった。
,,▲,通信会社（企画担当）,販売量の動き,・新規契約件数が落ち込んできており、人の動きが減ってきているように感じる。
,,▲,通信会社（営業担当）,販売量の動き,・１年前からの増設の影響により、最近は販売量の減少が続いている。
,,▲,テーマパーク職員（総務担当）,来客数の動き,・天候の影響もあるが、平日に来園する人数が減少している。
,,▲,ゴルフ場（支配人）,来客数の動き,・今月は、コロナ禍の影響を受けた前年より入場者数は増えているが、予算的には少し良くない。雨の予報が出るとキャンセルが多く発生する傾向にある。２月以降の入場者数が好調に推移しているため、今月は少し景気が悪いと判断する。
,,▲,理美容室（経営者）,来客数の動き,・暑くなってきて忙しくなってもいいはずだが、客が余り出歩いていないようである。
,,▲,美容室（経営者）,お客様の様子,・やはりまだまだ新型コロナウイルスの影響がある。
,,▲,設計事務所（職員）,お客様の様子,・客との打合せや会話のなかで景気についての話は全く出てこない。恐らく景気回復の基調はない。
,,▲,住宅販売会社（従業員）,販売量の動き,・新型コロナウイルス新規感染者数は減少しているが、今後の状況がどうなっていくのかの判断が難しいところである。
,,▲,その他住宅［住宅管理］（経営者）,お客様の様子,・最近では来客や商談があっても、先が見えない状況、情勢では大きな出費を控えているようである。受注額の低迷が続いている。
,,×,一般小売店［土産］（経営者）,来客数の動き,・当地への旅行客は、マイカー利用の客が平年の４分の１、鉄道利用が同じく５分の１、遠方の行き先を失った当地方の修学旅行生の観光バス利用が若干で、寂しい限りである。長年の経験でも初めてで、いまだに回復の兆しはゼロである。
,,×,一般小売店［酒類］（経営者）,販売量の動き,・前月に続き、飲食店での酒類販売自粛で、当社のような業務用酒販店は壊滅的な状況になっている。下旬になり夜７時までは解除されたが、ほとんど販売なしに等しい。飲食店でも、以前の夜７時まで販売可のときは営業していた店も今回は休業している店の方が多い。
,,×,百貨店（業績管理担当）,販売量の動き,・４月の近隣都府県での緊急事態宣言、また県内の新型コロナウイルス警戒レベルの上昇により、売上、来客数共に大幅に減少した。６月になってもその傾向が続いている。
,,×,コンビニ（エリア担当）,来客数の動き,・６月20日までの緊急事態宣言が影響し、来客数は大幅に下落しており、売上動向は悪い。特に、メイン商材となる米飯やパン類の販売が思わしくない。
,,×,衣料品専門店（店長）,来客数の動き,・建設関係全体の仕事量が減っていることと周辺の公共工事が一段落したため、来客数に影響が出ている。また、主要客層以外の一般客も、財布のひもは収入減少により固くなっている。
,,×,一般レストラン（経営者）,来客数の動き,・人が動いていない。
,,×,観光型ホテル（支配人）,来客数の動き,・６月20日をもって、隣県の緊急事態宣言の解除並びにまん延防止等重点措置の適用区域から除外はされたものの、今月もレストランの一部店舗を閉めたり、宿泊を延べ９日間も閉めた。それにより実績は、３か月前の56％、前年の80％ではあるが、前々年の25％にしか過ぎず、悪いとしかいいようがない。
,,×,レジャーランド（職員）,来客数の動き,・緊急事態宣言、まん延防止等重点措置等の自粛要請により、コロナ禍の影響があった前年と同様の低水準となった。
,,×,テーマパーク（職員）,お客様の様子,・変異株が出てきて、ワクチンが普及するまでは難しい。
,,×,パチンコ店（経営者）,販売量の動き,・来客数の動きから景気は悪くなっていると判断した。
,,×,その他レジャー［スポーツレジャー紙］（広告担当）,お客様の様子,・以前より先行きが見えないという声が多く聞かれる。給料も下がっている様子である。
,,×,美容室（経営者）,それ以外,・やはりこの１年半は、新型コロナウイルスの騒ぎで店もとても暇になった。
,,×,理容室（経営者）,お客様の様子,・新型コロナウイルスの感染拡大はいつまで続くのか、見当が付かない。
,,×,住宅販売会社（従業員）,競争相手の様子,・新聞の一面にウッドショックの記事が掲載されたのは致し方ないことかもしれないが、メーカーではない地元工務店では、折衝を控えていると聞く。    
"企業
動向
関連

(東海)",,◎,＊,＊,＊
,,○,化学工業（総務秘書）,それ以外,・緊急事態宣言が解除され、東京オリンピックの開催も確定的で、ワクチンの職域接種も始まり、コロナ禍にも動きが見られた。人出は急激に増え、感染対策はしているものの、多くの人が心の中では新型コロナウイルスの終息がみえてきていると感じているのではないか。
,,○,一般機械器具製造業（営業担当）,受注量や販売量の動き,・北米、アジアの自動車向け設備投資が好調で、引き合いが急激に増えている。
,,○,電気機械器具製造業（営業担当）,受注量や販売量の動き,・輸送機器の販売量が増えている。
,,○,電気機械器具製造業（総務担当）,受注量や販売量の動き,・通信関連機器の受注、販売は、前年と比較して若干減少傾向はみられるものの、依然として好調である。
,,○,輸送業（従業員）,受注量や販売量の動き,・少しずつだが荷主からの引き合いは増えている。６月になってから７月の依頼が続々入ってきているので、荷主側が、今までの遅れをこの夏にばん回するかのような動きになってきている。
,,○,輸送業（エリア担当）,それ以外,・取引先の不動産販売会社の話によると、新型コロナウイルスのワクチン接種が始まった頃から、都市部では特に中古マンションの投資用不動産などの売買に係る案件が徐々に件数を伸ばしていると聞き、活況感が出てきたと感じる。
,,○,通信業（総務担当）,それ以外,・７月の東京オリンピックを控え、国民の気分は少なからず高揚するはずである。景気向上は、期待感から自ら高めていくことになる。ワクチン接種も、64歳以下への展開のアナウンスが身近な自治体からあって、感染阻止の対策も目に見えてきた。
,,○,金融業（従業員）,取引先の様子,・緊急事態宣言の解除により、前月と比較すると再開した飲食店もあり、日常が戻りつつあるように感じる。それに伴い、消費活動も回復傾向にある。しかし、全業種での回復とはいえない部分もある。
,,○,不動産業（経営者）,それ以外,・例年同様に雨の日が多いが、新型コロナウイルスのワクチン接種が進み、徐々に外出する人が増加していると思われる。売上は前年を上回り、回復傾向になっている。
,,□,化学工業（営業担当）,受注価格や販売価格の動き,・引き続き半導体メーカー向け電材需要が好調である。
,,□,窯業・土石製品製造業（社員）,受注量や販売量の動き,・４～５月の受注量が少なめで心配したが、３月の水準に戻った。３月末までに予算消化の注文があり、４～５月はその反動で減少したものと思われる。
,,□,鉄鋼業（経営者）,受注価格や販売価格の動き,・メーカー主導の価格上昇が止まらない。マーケットの需要が回復していないのに値上げが先行し、在庫負担だけが増えている。
,,□,金属製品製造業（経営者）,受注量や販売量の動き,・受注量が減少している。
,,□,電気機械器具製造業（企画担当）,受注量や販売量の動き,・原材料が必要量は入ってこなかったり、新型コロナウイルスによるライン停止により、受注残が発生している。先進国が新型コロナウイルスから回復しても、生産地の新型コロナウイルスの感染が収束しないうちは、本格的な回復は期待できない。
,,□,輸送用機械器具製造業（管理担当）,それ以外,・周りの生活状況を見聞きして、景気は変わらないと判断した。
,,□,輸送用機械器具製造業（総務経理担当）,受注量や販売量の動き,・需要自体はもっと強いが、半導体不足のために自動車の生産が進まず減産せざるを得ない状況である。
,,□,建設業（役員）,受注量や販売量の動き,・５月と比べ６月は集客が減ったが、成約数は横ばいで実需での客の来場が多かった。マンションより戸建て住宅の販売が好調であった。新型コロナウイルスの影響は少なかった。
,,□,建設業（営業担当）,取引先の様子,・公の仕事は、補償の兼ね合いもあり金を掛けて新型コロナウイルス対策をしている。企業も静観していたところは実施が決まった感じで、仕事ができるようになったが、根本的な営業面では、企業も公共施設も収入がないので、来期以降は資金的に厳しいのではないかと、業者同士で話をしている。
,,□,輸送業（経営者）,受注量や販売量の動き,・消費財、生産財共に国内の物量が安定しているため、利益が出やすい。
,,□,輸送業（エリア担当）,受注量や販売量の動き,・航空貨物量は高いレベルを維持している。
,,□,通信業（法人営業担当）,それ以外,・統計上は改善しているようにみえるが、庶民感覚では景気回復とはとても言い難く、財布のひもはまだまだ固いというのが実感である。
