Ⅰ．景気の現状に対する判断理由等,,,,,
,,▲,通信会社（企画担当）,それ以外,・大阪の北浜に住んでいるが、飲食店だけでなく、歯医者や診療所、オフィスもなくなっており、景気の減退が実感される。
,,▲,観光名所（経理担当）,販売量の動き,・３月は例年の２割減程度であったが、６月は５割減にまで落ち込んでいる。
,,▲,その他レジャー施設［イベントホール］（職員）,来客数の動き,・長引く行動制限により、経済が回らなくなっていると感じる。
,,▲,美容室（店長）,来客数の動き,・今月は緊急事態宣言の延長により、来客数はかなり少ない状況が続いている。
,,▲,美容室（店員）,来客数の動き,・来店周期が延び、単価も下がってきている。
,,▲,住宅販売会社（経営者）,販売量の動き,・客との対面営業が減り、ビジネスチャンスが減少してきたように感じる。
,,▲,住宅販売会社（経営者）,それ以外,・新築戸建て住宅の受注は問題ないが、ウッドショックの影響で着工が不安定なため、請負契約の締結をちゅうちょしている。
,,▲,住宅販売会社（経営者）,販売量の動き,・やはり新型コロナウイルスの影響が長引いている。ワクチンの接種による感染の収束は海外でも失敗しており、先が見えない混とんとした状況が続いている。
,,▲,その他住宅［展示場］（従業員）,来客数の動き,・緊急事態宣言は解除されたが、住宅展示場への来場者数は低迷したままである。
,,▲,その他住宅［情報誌］（編集者）,お客様の様子,・新築マンション、戸建て住宅共に、販売は堅調に推移している。特に、手持ちの資産や年収の多い層は、購買意欲が引き続き高い。ただし、ウッドショックの影響で戸建て住宅のコスト上昇が顕著であるほか、着工の遅れが顕在化しているため、市場は不安定な状況となっている。
,,▲,その他住宅［住宅設備］（営業担当）,お客様の様子,・緊急事態宣言が解除されたが、新型コロナウイルスの影響は大きく、客の訪問キャンセルは続いている。　
,,×,百貨店（服飾品担当）,来客数の動き,・６月に入り、緊急事態宣言が20日で解除された。ようやく21日からは、平日だけなく土日も営業が再開できる状態になり、売上も前年を上回る形となった。ただし、緊急事態宣言の発出前の来客数には完全に戻っておらず、目的のはっきりした客の来店が中心である。好調な食品関係の売上は前年比で２けた伸び、ファッション関連も６～８％の伸びとなっている。一方、化粧品関係は前年割れとなり、コロナ禍での接客にも限りがあるため、完全な復調には至っていない。
,,×,衣料品専門店（経営者）,来客数の動き,・食料品の買物はみられるが、衣料品を買いに来る客はいない。緊急事態宣言が解除されても、来客数は増えていない。
,,×,家電量販店（企画担当）,来客数の動き,・コロナ禍でのボーナスの減少や、将来への不安からか、例年のようなボーナス商戦の集客がみられない。例年よりも、梅雨入りが早かったことも影響していると感じる。
,,×,住関連専門店（店長）,単価の動き,・春以降は、１万円以上の商品を購入する客が激減している。欲しくても数を減らすか、安い商品に変える人が増えている。
,,×,住関連専門店（店員）,来客数の動き,・新型コロナウイルスの影響で収入が減少している。特に必要でない物には、生活が厳しいときにはお金を掛けない。
,,×,観光型ホテル（経営者）,それ以外,・当地区では６月20日まで緊急事態宣言が発出され、その後もまん延防止等重点措置が適用されている。ゴールデンウィーク明けから休館が続き、ようやく６月25日から営業が再開したが、土曜日以外はほとんど客がみられない。
,,×,観光型ホテル（客室担当）,来客数の動き,・新型コロナウイルスの感染が収束していない。
"企業
動向
関連

(近畿)",,◎,＊,＊,＊
,,○,窯業・土石製品製造業（管理担当）,受注量や販売量の動き,・依然として新型コロナウイルスの影響が続いているが、ワクチンの接種が徐々に進んでいるほか、沖縄を除き、緊急事態宣言からまん延防止等重点措置に移行したこともあり、回復の期待も出てきている。
,,○,電気機械器具製造業（経営者）,受注量や販売量の動き,・前年はコロナ禍の影響が直撃し、間違いなく景気は良くなかったが、今年は半導体関連の市場が大変好調となっている。原因はいろいろと挙げられているが、本当のところはよく分からない。ただし、一過性の好況ではなさそうである。
,,○,経営コンサルタント,取引先の様子,・コロナ禍のなか、将来を見通して現状からの脱却を目指し、必死で努力をしている会社がみられるなど、少し光がみえてきた。販売戦略や人材育成に積極的に取り組む会社が増え、当社の仕事が増えつつある。
,,□,食料品製造業（従業員）,受注量や販売量の動き,・少し景気が良くなると予想したが、緊急事態宣言が延長され、相変わらず業務用商品の動きが停滞している。家庭用もこれまでの伸びがなくなり、例年並みに戻りつつある。
,,□,食料品製造業（営業担当）,受注量や販売量の動き,・緊急事態宣言が解除となり、まん延防止等重点措置に移行したが、飲食店への客の流れには変化がないため、飲料水の売上は変わらない。
,,□,出版・印刷・同関連産業（企画営業担当）,受注量や販売量の動き,・受注量は相変わらず減少傾向であり、今年度はこのまま微減の状態が続く。
,,□,化学工業（管理担当）,受注量や販売量の動き,・車載向けの製品や電子部品、電気機械のほか、半導体、建設資材向けの製品などで、出荷量は好調な状態が続いている。
,,□,プラスチック製品製造業（経営者）,受注量や販売量の動き,・販売量や受注量をみると、変わらないという評価になるが、雰囲気は悪く感じる。受注量は増えているものの、将来の先取り分が含まれるため、不安を感じる。
,,□,金属製品製造業（経営者）,受注量や販売量の動き,・半導体不足の影響で、自動車関連を中心に荷動きが減っている。
,,□,一般機械器具製造業（経営者）,受注量や販売量の動き,・今年の初めから受注が激減しており、今月も同じ状況である。
,,□,電気機械器具製造業（宣伝担当）,受注量や販売量の動き,・前年の６月は特別定額給付金によって販売が伸びたため、前年比では100％を大きく下回っている。ただし、前々年比ではややプラスとなっている。
,,□,電気機械器具製造業（経理担当）,受注量や販売量の動き,・全く回復の兆しがみられず、関係産業の設備投資も全て白紙に戻ったまま、具体的な時期の話が出てこない。また、半導体の調達にかなりのリスクがあり、受注が伸びても部品調達の予定が立たない。
,,□,建設業（経営者）,受注量や販売量の動き,・受注量や問合せの動きは変わらず、低調な状態が続いている。
,,□,建設業（経営者）,受注量や販売量の動き,・新型コロナウイルスの影響で、設備投資の延期や凍結の動きが出ており、価格競争も厳しい状況である。
,,□,輸送業（営業担当）,取引先の様子,・送料の値上げにより、売上が落ちている。
,,□,金融業［投資運用業］（代表）,それ以外,・緊急事態宣言の影響が全てであり、政府の優柔不断さも事業者を不安にさせている。秋頃にはコロナ禍も一段落するため、今のうちに今後の戦略を練っておくべきである。
,,□,新聞販売店［広告］（店主）,受注量や販売量の動き,・新型コロナウイルスのワクチン接種が始まったが、いまだに景気の回復は感じられない。
,,□,広告代理店（営業担当）,受注量や販売量の動き,・紙媒体、Ｗｅｂ媒体共に、広告売上は２年前と同じ水準となっている。
,,□,広告代理店（営業担当）,受注量や販売量の動き,・ようやく緊急事態宣言は解除されたが、まだ上向きな広告出稿の動きはみられない。
,,□,経営コンサルタント,取引先の様子,・取引先の飲食店は、緊急事態宣言やまん延防止等重点措置などに振り回されており、疲れがみられる。国から補助金などが支給されている間は、何とか割り切って休業していたが、ここまで長引いてくると、いよいよ閉店を考えるところまできている。
,,□,その他非製造業［機械器具卸］（経営者）,受注価格や販売価格の動き,・材料価格の高騰に伴い、商品の値上げを通達してくる会社が多く、その作業に追われて販売が伸びない。
,,□,その他非製造業［商社］（営業担当）,受注量や販売量の動き,・ある程度は動きが出てきたが、景気が上向くまでには至らない。
,,▲,パルプ・紙・紙加工品製造業（経営者）,受注量や販売量の動き,・緊急事態宣言の延長を経て、一段と動きが悪くなった。また、半導体不足による生産量の減少もみられる。
,,▲,電気機械器具製造業（営業担当）,受注量や販売量の動き,・新型コロナウイルスの影響かどうかは分からないが、仕事量が減っている。
,,▲,電気機械器具製造業（営業担当）,受注量や販売量の動き,・受注が増えない。
,,▲,建設業（経営者）,受注価格や販売価格の動き,・民間の大型案件は少なく、入札では考えられないような低価格で決まっている。
,,×,化学工業（経営者）,受注量や販売量の動き,・前月の売上は前年比で134％、前々年比では95％と、前年と比べるとさすがに大幅な改善となっているが、例年と比べるとまだ悪い。
,,×,不動産業（営業担当）,取引先の様子,・新型コロナウイルスの影響で、アパレル関連や飲食店の退店が続いている。それに伴って賃料が下がり、景気も悪化しつつある。
,,×,その他非製造業［電気業］（営業担当）,受注量や販売量の動き,・コロナ禍で先行きが見通せない。
"雇用
関連

(近畿)",,◎,＊,＊,＊
,,○,人材派遣会社（支店長）,求人数の動き,・関西の景気は戻りつつあると感じる。
,,○,人材派遣会社（営業担当）,求人数の動き,・求人数が、新型コロナウイルス発生前の実績を上回り始めている。
,,○,職業安定所（職員）,採用者数の動き,・６月に入ってからも、採用者数の増加傾向は衰えておらず、業種によっては採用意欲が相当高まっている。一方、求人数は製造業が３か月連続で増加するなど、回復の兆しがみられるものの、２年前の水準には戻っていない。
,,○,学校［大学］（就職担当）,それ以外,・緊急事態宣言が解除され、今まで外出を控えていた人が、フラストレーションを解消すべく外出し始めている。全体的に、買物客の動向が消費に向かっているように感じる。
,,□,人材派遣会社（経営者）,求人数の動き,・今年度の第１四半期も終わりに近づいているが、新型コロナウイルスの影響で余り芳しくない動きであった。ただし、区や市の社会福祉協議会などでの政府助成金の窓口業務や、下半期の入札関係の動きが活発化してきている。テレワークも様々な業種で進んでおり、派遣業界は忙しくなってきている。
,,□,新聞社［求人広告］（管理担当）,求人数の動き,・飲食や旅行、宿泊関係の求人数は、緊急事態宣言の発出によるダメージで更に減少している。東京オリンピックは開催される可能性が高いものの、景気への影響は限定的とみられる。
,,□,職業安定所（職員）,求人数の動き,・大阪の有効求人倍率は1.10倍と前月並みの水準であったが、就業地別にみると0.90倍と、厳しい状況が続いている。新規求人数も２か月連続で増えたものの、前年の大幅な減少の反動であり、２年前の水準は大きく下回っている。
,,□,職業安定所（職員）,周辺企業の様子,・景気は雰囲気的には上向きになると予想されるが、各種の数値をみると、新型コロナウイルスの感染第５波のおそれもあり、企業は慎重になっている。
,,□,職業安定所（職員）,求職者数の動き,・新型コロナウイルスによる不況が長引き、休業や時短による家庭内の収入の減少につながっている。求職活動を積極的に行う人が若干増え、特に男性の間では、65歳以上のパート希望者が少し増えている。
,,□,職業安定所（職員）,求人数の動き,・新規求人数は前年並みであるが、２年前と比べると大きく減少している。
,,□,民間職業紹介機関（営業担当）,求人数の動き,・新型コロナウイルスによる特需が続いているため、景気も同じような水準で推移している。
,,□,民間職業紹介機関（営業担当）,求人数の動き,・例年６月の採用解禁以降、新卒採用市場では内々定通知の動きがピークを迎える。その後の追加募集の動きに伴い、合同企業説明会の出展参加が増えるが、今年は余り大きな動きがなく、イベントの出展参加が増えている様子もない。
,,▲,人材派遣会社（役員）,求人数の動き,・６月も前年は上回っているものの、４～５月の回復度合いに比べると、かなり伸び率は鈍化している。
,,▲,人材派遣会社（営業担当）,周辺企業の様子,・緊急事態宣言は解除され、まん延防止等重点措置に移行したが、飲食や観光業界には依然として先が見えない。
,,▲,学校［大学］（就職担当）,求人数の動き,・採用担当者の来校も、求人目的ではなく、インターンシップの案内にシフトしてきている。学生の状況をみると、まだまだ就活は続きそうである。
,,×,新聞社［求人広告］（担当者）,それ以外,・新型コロナウイルスの影響がまだまだ続いている。特に、関西の地元企業からの新聞広告については、プロモーション費用が前年の70％台となっている。
,,,,,
　９．中国（地域別調査機関：公益財団法人中国地域創造研究センター）,,,,,
,,,,,（－：回答が存在しない、＊：主だった回答等が存在しない）
分野,,景気の現状判断,業種・職種,判断の理由,追加説明及び具体的状況の説明
"家計
動向
関連

(中国)",,◎,－,－,－
,,○,商店街（代表者）,競争相手の様子,・新型コロナウイルスのワクチン接種が進み、自粛疲れで外出者が増加しているため、人通りが多くなっている。
,,○,一般小売店［食品］（経営者）,来客数の動き,・新型コロナウイルス禍で、巣籠り需要が堅調な上に、緊急事態宣言が発出されて、より一層売上が好調に推移している。来客数、客単価がいずれも前年を２～３ポイント上回っている。
,,○,一般小売店［靴］（経営者）,お客様の様子,・３か月前は売上が前年に比べ50％減少している状況で、新規問合せも前年に比べ90％減少していたが、今月は新規問合せが回復しつつある。来月に向けて新規受注を見込める状況である。
,,○,一般小売店［茶］（経営者）,来客数の動き,・新型コロナウイルス禍で、人々に不安があるなかで、新型コロナウイルスのワクチン接種が進んでいることへの安心感や東京オリンピック開催の話題などで、何か人の心が良い方向に向かっている。それに伴い、売上も少しずつ回復している。
,,○,百貨店（営業担当）,販売量の動き,・プレクリアランスセールが始まり、売上が順調に回復していたが、クリアランスセールに入り、一般客の来店が盛り上がっていない。
,,○,百貨店（営業企画担当）,単価の動き,・衣料品の不振もあり、前々年と比べると、売上は減少しているが、前年と比べると回復傾向にある。
,,○,スーパー（店長）,来客数の動き,・３か月前と比べ、来客数が回復傾向にある。
,,○,スーパー（店長）,来客数の動き,・新型コロナウイルス禍ではあるが、来客数も販売点数も回復傾向にある。客が午前中に集中する動きは変わらないが、週末を中心に確実に回復している。まとめ買いの動きが大きくなっており、冷凍食品について特に顕著である。
,,○,スーパー（店長）,来客数の動き,・緊急事態宣言が解除されたが、来客数は前年並みで、販売もやや上向いている。
,,○,スーパー（店長）,来客数の動き,・３か月前と比べ、来客数は上昇傾向にある。父の日の売上も前年を上回っている。外食が減った分、催事に関しては家でプチぜいたくをする傾向にある。
,,○,スーパー（店長）,来客数の動き,・緊急事態宣言の影響もあり、今月に入り、来客数が前年を上回っている。
,,○,スーパー（総務担当）,来客数の動き,・来客数、客単価がいずれも上昇している。
,,○,コンビニ（エリア担当）,販売量の動き,・６月に入り、本部で販売促進活動を実施しているため、依然として、来客数は伸び悩んでいるものの、売上は回復している。
,,○,コンビニ（副地域ブロック長）,販売量の動き,・経済活動、レジャー、イベントが少しずつ再開し、主力商品の販売数量が回復傾向にある。
,,○,乗用車販売店（営業担当）,来客数の動き,・緊急事態宣言中は大型商業施設等が土日祝日休館だったこともあり、来客数が比較的多くなっている。
,,○,一般レストラン（経営者）,お客様の様子,・６月に入り、金曜日に職場関係の少人数の利用が出てきている。土曜日や日曜日の家族の利用も元に戻りつつある。新型コロナウイルスのワクチン接種が進み、客の安心感が出てきている。
,,○,都市型ホテル（企画担当）,来客数の動き,・緊急事態宣言の解除を受け、低迷していた宿泊の稼働率も徐々に回復傾向にあり、完全に止まっていたレストラン予約の問合せもやや増加してきている。全体的にはまだ前々年と比べ３割程度の回復であるが、新型コロナウイルスのワクチン接種の拡大で、駅中心の商業施設も人出が増加してきている。
,,○,タクシー運転手,販売量の動き,・緊急事態宣言が解除され、店も開き始め、20時くらいまでの売上はやや良くなっている。
,,○,競艇場（企画営業担当）,販売量の動き,・１日平均の売上が３か月前と比べ、少し増加している。
,,○,設計事務所（経営者）,来客数の動き,・新型コロナウイルス禍でも、客の来場意欲や購入意欲は高くなっている。
,,○,住宅販売会社（従業員）,来客数の動き,・前年の７割まで落ち込んでいたモデルハウスの来客数が９割近くまで回復してきており、完全予約制イベントを開催しても早い段階で予約が埋まっている。
,,□,商店街（代表者）,お客様の様子,・商店街の人通りは少しずつ元に戻りつつある。
,,□,百貨店（経理担当）,販売量の動き,・外出を自粛する人が多いようで来客数が前年を下回っている。売上も前年を下回る部門が多くなっているが、学生服、美術品、貴金属は前年を上回っている。
,,□,百貨店（営業担当）,来客数の動き,・緊急事態宣言が解除された前年と比べると、来客数が少ない。
,,□,百貨店（営業担当）,来客数の動き,・新型コロナウイルスの影響もあり、前月後半から来客数が減少している。感染者数が減少しているのに、平日の来客数も少ない。セールがスタートしたが、前年以上にゆっくりとした動きとなっている。
,,□,百貨店（売場担当）,販売量の動き,・数百万円の美術品や200万円くらいのブランドバッグが売れており、売上は好調である。
,,□,スーパー（店長）,来客数の動き,・来客数が増加しているのが特売日のみで、来客数の減少が続いているため、売上が伸びていない。
,,□,コンビニ（エリア担当）,来客数の動き,・来客数は前年を上回っているが、前々年を超えていない。
,,□,衣料品専門店（代表）,来客数の動き,・緊急事態宣言は解除されたが、来客数は元に戻らず、景気は悪い状況で推移している。
,,□,家電量販店（店長）,お客様の様子,・新型コロナウイルスが終息する気配がなく、客の消費意欲が低下している。
,,□,乗用車販売店（統括）,販売量の動き,・６月の販売台数は前年比88％で、大変厳しい状況である。半導体不足で生産制限が設けられていて、車両がない状態である。
,,□,自動車備品販売店（経営者）,販売量の動き,・良くも悪くも動きがなく、前年並みで推移している。
,,□,その他専門店［時計］（経営者）,来客数の動き,・梅雨時で、来客数が減少しており、購買にもつながっていない。
,,□,その他専門店［和菓子］（経営者）,来客数の動き,・新型コロナウイルスの影響が続いているため、景気は変わらない。
,,□,その他小売［ショッピングセンター］（支配人）,お客様の様子,・新型コロナウイルスが落ち着いた３か月前と同様の状況である。緊急事態宣言が解除されても、客の警戒感が強く、一気に回復とはいかない状況である。特に、夕方以降の来客数が依然として厳しく、業種別では、飲食が引き続き厳しい状況である。
,,□,高級レストラン（事業戦略担当）,来客数の動き,・新型コロナウイルス発生以降、景気は変わらない。
,,□,一般レストラン（経営者）,来客数の動き,・職場関係や家族での利用が減少している。
,,□,バー（経営者）,それ以外,・新型コロナウイルス禍の時短営業などもあり、景気は良くならない。
,,□,その他飲食［サービスエリア内レストラン］（店長）,来客数の動き,・新型コロナウイルスの影響が続き、景気は変わらない。
,,□,都市型ホテル（総支配人）,来客数の動き,・緊急事態宣言やまん延防止等重点措置が影響し、観光客、ビジネス客のいずれも動きが鈍い。特に大会や団体の利用がほとんどない状況である。一方で、地元県民対象のキャンペーン効果により、地元の利用客は増加している。
,,□,旅行代理店（経営者）,競争相手の様子,・若い人の新型コロナウイルスのワクチン接種が済んでいないため、景気に変化はない。
,,□,旅行代理店（支店長）,販売量の動き,・緊急事態宣言が解除されたが、まだまだ旅行という雰囲気ではなく、売上は停滞したままである。現状では東京オリンピック・パラリンピックが景気回復の契機となる可能性も低く、新型コロナウイルスのワクチン接種が進み、Ｇｏ　Ｔｏ　Ｔｒａｖｅｌキャンペーンが復活した段階である程度需要が回復してくる。
,,□,タクシー運転手,お客様の様子,・新型コロナウイルスの状況が良くならないため、客の自粛傾向が続いている。
